"boemong ba afrika borwa teng, ho kginwa ha metsamao le ditshebeletso tseo e seng tsa mantlha ho tlisa maima a eketsehileng le kgatello ya maikutlo, empa re etsa makgobonthithi ohle ao re ka a kgonang ho fokotsa thefuleho bathong ba habo rona.
","lapha eningizimu afrika, luvalelo lwasekhaya luhamba nebulukhuni kanye nesitresi, kantsi senta konkhe lokusemandleni kutsi siwudzambise lowo mtselela kubantfu bakitsi.
"
"empa seo re ithutileng sona ho maafrika borwa a tswang wuhan ke hore ho kginwa ha metsamao le ditshebeletso tseo e seng tsa mantlha, ho a sebe tsa.
","kodvwa sifundvo lesisitfola kubantfu baseningizimu afrika lababuya ewuhan sitsi lu valelo lwasekhaya luyasebenta.
"
"ke sesupo sa hore haeba re ka fela ra ikokobeletsa melawana e teng ya ho kgina ho ata ha kokwanahloko ena, re tla kgona ho fokotsa sekgahla sa ditshwaetso.
","kuyakhombisa kutsi nangabe siyilandzela ngemfanelo siyihloniphe imitsetfo lebekiwe yekuvimba leligciwane kutsi lingabhebhetseki, singakhona kutsi silehlise lizinga lekwesule leka ngalesifo.
"
"ho a bonahala hore haeba re ka sebedisana mmoho le ba apesitsweng matla ho tsa bophelo bo botle ho etsa seo re tshwanetseng ho se etsa, re tla be re sa boloke maphelo a rona feela, empa le a bao re phelang le bona.
","kuyakhombisa kutsi nasingabambisana netiphatsimandla tetemphilo ekwenteni loko lekumele kutsi sikwente, ngeke sisindzise kuphela timphilo tetfu kodvwa netalabo labasedvute natsi.
"
"pale ya maafrika borwa a kgutlang wuhan e tlameha ho re kgothatsa e be e re fe tshepo dibekeng tse boima tse tlang.
","indzaba yalabo baseningizimu afrika lababuya ewuhan kufanele kutsi isikhutsate futsi isinike litsemba kulamaviki lamatima letako.
"
"pale ya bona e re bolella hore ho na le kganya e teng kapele, hore haeba re tsitlallela sepheo sa rona, re dula re itshwere hantle re bile re hlompha ho kginwa ha metsamao le ditshebeletso tseo e seng tsa mantlha, hore haeba re sebetsa mmoho, re tla hlola.","lendzaba yabo isitjela kutsi likhona litsemba, nangabe nje singahlala siyibambe njalo, sitiphatse ngendlela lecinile futsi sihloniphe umtsetfo naloluvalelo lwasekhaya, nekutsi nasisebenta ngekuhlanganyela, sitawuncoba."
"cge e thusa batho ho fumana tshebeletso ya toka dale hes mahlatsipa a tlhekefetso ya dikgoka e amang basadi le bana (gbv) ba sokolang ho fumana thuso le tshe hetso eo ba e hlokang, ba kotjwa ho ikopanya le khomishene ya tekano ho ya ka bong (cge).
","icge yenta bulungiswa bufinyeleleke dale hes bahlukunyetwa bebudlova lobu condziswe kubu lili lobutsite (igbv) banebulukhuni kutfola lusito nekwesekelwa laba kudzingako bacelwa ku tsi batsintse ikhomishini yetekulingana ngebulili (icge).
"
"cge e ka o thusa ka ditshe beletso tsa toka dinyeweng tsa kgodiso ya ngwana, dinyeweng tsa tlhekefetso ka thobalano, dinyeweng tsa kgethollo ho ya ka bong le ho tsa gbv , mme e fana ka keletso ya molao le ditshebe letso ho mahlatsipa.
","icge ingelekelela ngesondlo sebantfwana, kugcagcalatwa ngetemaca nsi, lubandlululo lwetebulili kanye negbv , futsi inika bahlukunyetwa teluleko te temtsetfo netinsita mahhala.
"
"e mong wa khomishene e leng mofihli teleki o re o mong wa mesebetsi ya cge ke ho thusa mahlatsipa ho ritela dinyewe kgotla.
","mofihli teleki wekhomi shini utsi indzima ledlalwa yicge kusita bahluku nyetwa bavule emacala enkantolo.
"
"""lekala la rona la babuelli le felehetsa batletlebi ho ya makgotleng a dinyewe ho bula dinyewe tsa ka malapeng esita le ho ba thusa ho tlatsa diforomo tse tshwanelehang.
","""litiko letemtse fo liphekeletela bamangali baye etinkantolo tamantji bayovula emacala ebudlo va basekhaya liphindze futsi libasite ngekugcwalisa emafomu lafanele.
"
"cge e bile e na le seabo sa ho lekola dinyewe, ho kenyeletswa ditlolo tsa molao tsa peto le ditlhekefetso ka thobalano, tlhefetso ka motabo le kga tello le polao ya basadi.""
","icge iphindze futsi idlale indzima yekulandzelela emacala, kufaka ekhatsi emacala eku dlwengula newetemacansi, kugcagcalatwa ngetema cansi kanye nekubulawa kwalabasikati.
"
"cge e bile e ka thusa lehlatsipa ho fumana tshire letso ya molao mme hangata ba sebedisana hammoho le lekgotla la botjhutjhisi ba naha e le ho etsa bonnete ba hore lehlatsipa le fumana kahlolelo e kgotsofatsang e sa yeng ka leeme.
","""icge ingaphindze futsi isite umhlukunyetwa kutsi atfole umyalo wenkanto lo wetekuvikeleka futsi ivamisa kusebentisana nesi phatsimandla sekushushisa savelonkhe kucinisekisa kutsi umhlukunyetwa utfo la kutekwa kwelicala loku fanele.
"
"teleki o ile a hlalosa hore boemong bona cge e phethahatsa thomo ya bohlwedi mme e etsa mo sebetsi wa yona wa ho lekola bakeng sa dinyewe tsa gbv mme e hlahloba dintlha tsa motheo, jwaloka boitshwaro bo sa lokang ba babuelli, ho phetwa ha tlhekefetso ya mahlatsipa a pholositsweng esita le dipotso tsa babuelli tse sa nkeleng hlohong mai kutlo a mahlatsipa.
","""ecaleni lelinjena, icge ichuba sibutsetelo maciniso sekumelela iphi ndze futsi yente umsebenti wayo wekulandzelela ema cala egbv iphindze futsi ihlolisise tindzaba letibalu lekile, njengekutiphatsa ngalokungenaluvelomiva kwalabo labaphetse licala, kuhlumeteka kwelizinga lesibili kwebahlukunyetwa labasindzile nekuphindzili twa ngemibuto lokungena luvelomiva,"" kuchaza te leki.
"
"ha mahlatsipa a sokola ho fumana ditshebeletso tsa toka makgotleng a dinyewe tsa ditlhokofatso tsa dikgo ka tsa ka malapeng, cge e ka ba emela, ka ho fana ka boemedi ba molao.
","lapho bahlukunyetwa bahlangabetana nebulu khuni bekufinyelela bulungi swa etinkantolo temacala ebudlova basekhaya, icge ingatsatsa tinyatselo ega meni labo, ibamelele nge kwemtsetfo.
"
"e bile e na le hona ho fetisetsa mahlatsipa hore a fumane tshehetso ho tsa botsitso ba kelello.
","iyakwati futsi nekwendlulisela bahluku nyetwa ekutfoleni kweseke lwa ngekwengcondvo.
"
"tshebeletso ya bohlokwacge haesale e sebetsa ka nako tsohle le nakong ena ya thibelo ya metsamao ya batho hobane e le tshebe letso ya bohlokwa.
","insita lebalulekileicge beyiloku isebenta njengensita lebalulekile kuso sonkhe lesikhatsi sekuvalwa kwelive lokukhulu.
"
"teleki o re le hoja dinyewe tse ding di fetoletswe nako ka lebaka la thibelo ena ya metsamao, dinyewe tsa bohlokwa tse amanang le tshebediso ya dikgoka ka lapeng esita le tsa gbv di tswela pele ho hlokomelwa ke tshebeletso ya molao.
","""nanomanje lamanye emacala enkantolo ahle hlisiwe ngenca yaloku valwa lokukhulu kwelive, tindzaba letiphutfumako letiphatselene nebudlova basekhaya kanye negbv kutawuchubeka kunakwe ngenchubo yetebulungi swa,"" kusho teleki.
"
"cge e etsa bonnete ba hore ditokelo tsa setjhaba di a tshireletswa.
","icge yenta siciniseko sekutsi emalungelo esive ayavikeleka.
"
"""afrika borwa ke demokrasi e bule hileng, e tshepetsweng ho sireletsa ditokelo tsa batho tsa motheo, ho kenyeletswa le tokelo ya tekano le seriti se bopeletsweng sa motho sa tlhaho, ho ya ka dipehelo tsa molao wa motheo.""
","iningizimu afrika iyintsandvo yelinye nti levulekile, itinikele ku malungelo ebantfu labalule kile, kufaka ekhatsi lilungelo letekulingana kanye nesi tfunti semuntfu, ngekuya kwemigomo yemtsetfosi sekelo.
"
"hlahisa tletlebo ya haomahlatsipa a gbv le tlheke fetso a ka letsetsa nomoro ya cge e sa lefellweng ho 0800 007 709 e le ho hlahisa tletlebo.
","bhalisa sikhalobahlukunyetwa begbv nebebudlova bangasha yela lenombolo yamahha la yecge 0800 007 709 kute babike licala.
"
hape ba ka romela molaetsa ho leqephe la facebook: gender commission of south africa.,bangaphindze futsi batfu mele umlayeto ekhasini lefacebook: gender co mmission of south africa.
"boqolotsi ba ditaba afrika borwa ke tshiya e kgolo ya demokrasi ya rona vukuzenzele unnamed dinaheng tse ngata tsa lefatshe lohle, sewa sa kokwanahloko ya corona se thibetse bolokolohi ba ditjhaba tse ngata le ho sitisa dikamano tsa setjhaba ka bosona.
","tetindzaba taseningizimu afrika tiyinsika lebalulekile yentsandvo yelinyenti yetfu vukuzenzele unnamed emaveni lamanyenti emhlabeni jikelele, lubhubhane lwecorona lubite kutsi kuncishi swe tinkhululeko tebantfu letinyenti lwaphindze futsi lwavivinya telubumbano lwetenhlalo.
"
"empa dinaha tse nang le diinstitjushene tse matla, ditshebetso tse hlwahlwa tsa toka esita le boqolotsi bo tjhatsi ba ditaba di bile le hona ho sireletsa ditokelo tsa botho hore di se ke tsa halalwa le bolaodi ba naha hore bo se ke ba sebediswa hampe.
","kepha emave lanetikhungo letinemandla, tinchubo tete bulungiswa letihlala tica phele kanye nebetindzaba labanemandla akhonile ku vikela emalungelo ebantfu ekutsini anganyatselwa ku phindze futsi kusetjentiswe kabi ligunyamandla lembuso.
"
"e se e le dikgwedi tse tshe letseng esale maemo a naha a tlokotsi a phatlaladitswe.
","setinyanga letisitfupha solo kwamenyetelwa inhlekelele yavelonkhe.
"
"le ka ntle le hore boleng ba bolwetse bona ha bo a ka ba tloha bo tsebilwe pele esita le yona phephetso e matla ya ho etsa hore naha ya batho ba dimiliyone tse 58 ba dule ba le malapeng ba thibetswe metsamao, re sebeditse ha ntle.
","nanomanje lesimo salesifo kanye ne tinsayeya taso letijule kabi letente lelive lelinebantfu labatigidzi letinge58 kutsi babe ngaphansi kweku valelwa lokukhulu, sichube kahle kakhulu.
"
"re kgonne ho laola ho ata ha bolwetse bona ka lebaka la tshebedisano le bohlwahlwa ba baahi bohle.
","sikhonile kulawula kubhebhetseka kwalesifo ikakhulu ngenca yekubambisana nekucaphela kwato tonkhe takhamiti.
"
"hona ho bakilwe haholo ke mosebetsi o kgabane wa boqolotsi ba rona ba ditaba.
","loku kwentiwe kakhulu ngumsebenti lobabatakekako webetindzaba.
"
"re lokela ho leboha haholo baqolotsi ba ditaba ba afrika borwa ba sebetsang ka matla ba bileng ba nang le boitelo bo matla.
","siswele imilomo letinkhu lungwane yekubonga tintsa tseli talapha eningizimu afrika ngekusebenta nge kutikhandla kwato.
"
"ba ile ba etsa hore setjhaba se dule se na le tsebo ka ho fana ka melaetsa ya bohlokwa ya bophelo bo botle mabapi le ho sielana sebaka dipakeng esita le tlho komelo ya mmele.
","bagcine bantfu bakitsi batfola lwatiso ngekubendlulisela imila yeto yetemphilo lebalulekile mayelana nekukhweshelana kanye nekuhlanteka.
"
"ba entse tseo tsohle maemong a thata haholo, ebile hangata ba se na le mehlodi e lekaneng.
","bente loku ngaphansi kwetimo letimatima kakhulu, futsi imvamisa basebentisa imi tfombolusito lenemikhawulo.
"
"ba ile ba pheta dipale tsa batho tse buang ka hore se kgahla sa ho dula malapeng se amile jwang bophelo le dikgwebong tsa bona.
","balandzise tindzaba tekuvalelwa lokukhulu kwavelonkhe ngetimphilo tebantfu kanye nemabhi zinisi abo.
"
"ba ile ba etela metsana, ditoropo le metse e meholo mme ba tla ka dipale tsa batho ba sa tsebahaleng hakaalo mme ba bile ba hlokomedisa naha ka mathata ao setjhaba se nang le ona dipetlele le ditleliniking, mme hona ho bakile hore mmuso o etse ho hong.
","bebaphumile basemimangweni, emado lobheni nakumadolobhakati, bagcogca baletsa tindzaba tebantfu labetayelekile baphindze futsi benta kutsi livelonkhe linake tinkinga tibhedlela nemitfolamphilo lehlangabetana nato, letenta kutsi hulumende atsatse tinyatselo.
"
"boqolotsi bona ba rona ba ditaba bo ile ba hlahisa dintlha tse ding tse ngata tseo ka mohlomong di neng di ke ke tsa hlahiswa tsa tsebahala.
","betindzaba betfu baphi ndze futsi basikhanyisela basikhombisa tintfo lebeku ngenteka ngalokwetayele kile kutsi besingeke sitibone.
"
"ba ile ba phethahatsa seabo sa bona sa ho ba dihlwela ka ho sibolla diketso tsa bobodu le tsamaiso e fosahetseng, mme hona ha tsosa dinga ngisano tse matla ka hara setjhaba tse ileng tsa etsa hore qetellong ho be le dipatlisiso tsa boemo bo phahameng.
","bafezekise umsebenti wabo wekuba ngulabagadzile ngekutsi bavumbulule tento tenkhohlakalo nekusetje ntiswa kabi kwemali yahu lumende, lokuvutsele inkhu lumomphikiswano lenkhulu yavelonkhe lokubese kuhole la kuluphenyo loluphakeme kakhulu.
"
"ka lebaka la dipehelo tsena tsa bona, ba ile ba ikgapela tshepo ho tswa ho setjhaba.
","ngako lokubika batfole kwetsenjwa bantfu.
"
"boqolotsi ba ditaba bo loko llohileng ha bo bolele hore ke qetello ya bona.
","tetindzaba letikhululekile atigcini ngato kuphela.
"
"ke mokgwa oo ka ona demokrasi e fihle llwang le ho baballwa.
","yindlela yekutfola nekugci na intsandvo yelinyenti.
"
"nakong ena ya sewa sena, boqolotsi ba rona ba ditaba ha bo a phetha feela seabo sa bona se tlwaelehileng sa bohlwela, empa bo ile ba etsa mosebetsi wa bona wa setjhaba ka ho tshehetsa me kutu ya setjhaba ya ho laola kokwanahloko ena ya corona .
","ngesikhatsi salolubhubhane, betindzaba betfu abakadlalinje kuphela indzima yabo leyetayelekile yekucaphe la, kepha bente umsebenti wabo wekwesekela umtamo wavelonkhe kute kutsi kulawulwe leligciwane lecorona .
"
"ha re tadima bohlokwa ba boqolotsi ba ditaba bakeng sa bophelo bo botle ba demokra si ya rona, ke tletlebo e kgolo e bonahalang hore jwaloka dikarolo tse ding tsa moruo, tlokotsi ena ya kokwanahloko ya corona e thefutse matlo a boqolotsi ba ditaba haholo.
","uma kubukwa kubaluleka kwebetindzaba kutemphilo yentsandvo yetfu yelinye nti, kuyintfo lekhatsatana kakhulu kutsi yonkhe lemi nye imikhakha yetemnotfo, lenhlekelele yeligciwane lecorona lihlasele kamatima tindlu tikhungo tetfu tebeti ndzaba.
"
"diphatlalatso tse ding di lahlehetswe ke lekeno la tsona le ka etsang 60% matsatsing a ha re qala feela ka thibelo ya metsamao.
","letinye tishicilelwa tilahlekelwe ngemaphe senti lange60 emali yato lengenako emalangeni eku cala ekuvalwa lokukhulu kwavelonkhe.
"
"dikhamphani tse ngata di ile tsa lokela ho fokotsa meputso ya basebetsi, ho fokotsa palo ya basebetsi kapa hona ho fokotsa dihora tse sebeditsweng.
","letinye tinkampani letinyenti tadzi ngeka kutsi tinciphise imiho lo, tinciphise linani letisebenti nomake tinciphise tikhatsi tekusebenta.
"
"ka maswa bi, tse ding tsa diphatlalatso di ile tsa qobeleha ho kwalwa, hara tsona ho na le tse ding tsa mabitso a dikgatiso a tsebisa halang haholo a dimakasine tsa afrika borwa.
","ngalokudza bukisako, letinye tishici lelwa kute kwadzingeka kutsi tivale, emkhatsini wato ngemaphephabhuku aseni ngizimu afrika lekukudzala akhona futsi latiwa kakhulu.
"
"ditahlehelo tsa mesebetsi tse bakilweng ke thibelo ya metsamao di bakile tlokotsi ho dikhamphani tsa boqolotsi ba ditaba tse seng di ntse di na le mathata a jwaloka tahlehelo ya ditjhelete tsa dipapatso, kabo e ntseng e theoha e qepha esita le me baraka e ileng ya nkuwa ke dikhamphani tsa ditaba tse rekisang ditaba ka difono fono esita le mekgwa e meng ya theknoloji.
","kulahlekelwa yimise benti ngenca yekuvalwa kwavelonkhe sekubhebhe tsele inhlekelele kutinka mpani tetindzaba lebese tiveleke tibukene netinsa yeya njengekulahlekelwa yi mali lengenako yekukhangi sa, kwehla kwekujikeleta kanye nemasheya etima kethe lokwabese kutsatfwa tindzaba tabomakhalekhikhi kanye nalobunye bucwephe she.
"
"mathata ana a ditjhelete a ile a ba teng hohle dikhamphaning tsa ditaba, ho kenyeletsa tsa mabitso a di kgatiso tsa mo inthaneteng le tsa mangolo a ditaba ao a tlwaelehileng mmoho le tsa kgaso ya setjhaba.
","lobumatima betimali kuhlangabetwene nako kuyo yonkhe imikhakha, kusukela kutindzaba takuinthanethi letetayelekile kuye ku maphephandzaba latayele kile kuye emsakatweni wesive.
"
"ena e bile e nngwe ya di taba tse ileng tsa hlahiswa ka matla nakong eo ke buisa nang le south african national editors’ forum haufinyana.
","loludzaba lolu ngulolunye lwetindzaba letiphakanyi swe ngemandla ngesikhatsi ngikhulumisana nenkhu ndla yavelonkhe yebeti ndzaba kungasikudzalanje.
"
"ho na le ho dulela ho nna ba ingamangama, leha ho le jwalo, indasteri ya boqolotsi ba ditaba e sebetsa ka matla ho hlabolla mekgwa ya yona ya kgwebo, ho ntshetsa pele boitshimollelo le ho baballa basebetsi kamoo ba ka kgo nang ka teng.
","esikhundleni sekukhala ngalolusizi, nanoma kunjalo, imboni yebetindzaba isebe nta ngekutikhandla kute kutsi ihlele kabusha emabhizinisi, kuchuba kucamba lokusha kanye nekugcina tisebenti ngendlela lekungakhonwa ngayo.
"
"ka tsela e jwalo, boqolotsi ba ditaba ke setheo se ikgethi leng ka hara setjhaba sefe kapa sefe hobane baphethahatsi ba na le seabo sa bohlokwa ba keng sa taolo ya demokrasi ya rona.
","ngaso futsi leso sikhatsi, betindzaba bangumtimba lowehlukile kunoma ngu muphi ummango ngoba tisebenti tabo tifezekisa indzi ma lebalulekile eluhlelweni lwetfu lwentsandvo yelinye nti.
"
"ba hlaha setjhaba lese ding ka tse etsahalang esita le ho disa hore batho ba fuweng matla ha ba iketsetse kamoo ba ratang ka teng.
","basebentela kutsi sive sihlale sitfola lwati nelwatiso kanye nekugcina emandla endzaweni lefanele.
"
"re batla baqolotsi ba banga ta ba ditaba, eseng ba fokoditsweng.
","sidzinga tintsatseli letinye nti, hhayi letincane.
"
"ke ka hona tahlehelo ya moqolosi a le mong feela wa ditaba eseng feela ya indasteri empa e le tahlehelo ho naha kaofela.
","kungakoke kutsi ngisho kulahlekelwa yintsatseli yinye akukusikonje kulahlekelwa kwemboni kepha kwelive.
"
"re batla diqhoku tsa me kaubere ya baqolotsi ba di taba, ba tlisang boiphihlelo bo bongata le dikgopolo tsa kgale tsa institjushene, mme ba kgona ho fana ka dipehelo tsa mahlakore ohle le tshe katsheko e theilweng hodima dintlha.
","sidzinga tigayigayi tetfu tebetindzaba, labeta ne sipiliyoni lesikhulu kanye nenkhumbulo yesikhungo, futsi labakhona kubika ngetintfo letibalulekile ne luhlatiyo lolungulonalona.
"
"ka ona mokgwa o jwalo, re batla batjha ba eketsehileng ba baqolotsi ba ditaba ka hara mosebetsi ona mme e le batjha ba nang le boitsebelo ba theknoloji, ba na le tsebo ya mekgwa e metjha ya ho pheta dipale le tsebo ya ditletlebo tsa batjha.
","ngaso futsi leso sikhatsi lesifananako sidzinga tintsa tseli letinyenti letisesetincane kulomkhakha wetingcweti labanelikhono letebucwephe she, labahlala bati ngetintfo letentekako ekulandziseni indzaba baphindze futsi bati ngaloko lokukhatsata lusha.
"
"jwaloka setjhaba, re lokela ho fa boqolotsi ba ditaba tshe hetso ka botlalo.
","singummango sifanele kutsi sesekele betindzaba ngawo onkhe emandla etfu.
"
"e ka ba ka ho ikgethela ho lefela mananeo a ditaba, ho tshehetsa pokele tsong ya ditjhelete tsa ho thu sa ho boloka mesebetsi ya bo qolotsi, ho lefella ditefello tsa laesense ya sabc kapa hona ho reka koranta feela, bohle re ka ba le seabo ho tshehetsa indasteri ena e nang le mathata.
","kungaba kukhetsa kutsi sikhokhele lokusakatwako, sesekele buntsatseli lobusitwa ngetimali ngekubambisana, kukhokha timali temalayi sense etfu esabc nomake sitsenge emaphephandzaba, sonkhe singadlala incenye yetfu ekwesekeleni lemboni lesenhlekeleleni.
"
"jwaloka mmuso, le ka ntle ho maemo a kganyang a atle hileng a moruo, re tla tswe la pele ho eketsa dipapatso tse etsetswang diphatlalatso le kgaso, haholoholo boqolotsi ba ditaba tsa setjhaba.
","singuhu lumende, nanomanje simo semnotfo singasiso lesikahle sitawuchubeka nekunika letishicilelwa nebasakati, ikakhulu betindzaba temma ngo imali yekukhangisa.
"
"makala a poraefete le ona a lokela ho tswela pele ho tshehetsa indasteri ka ho etsa dipapatso le ho sebedi sana le matlo a boqolotsi ba ditaba bakeng sa tlhahiso ya mananeo a boitshimollelo a tsamaelanang le metjha ya tsamaiso ya boqolotsi ba ditaba lefatsheng.
","umkhakha lotimele nawo ufanele kutsi uchubeke ne kwesekela lemboni ngekutsi ukhangise futsi usebentisane netikhungo tebetindzaba ekukhicitweni kwaloku sakatwako lokuhambisana nemgomo wetinchubeko tebetindzaba.
"
"bafani ba ditjhelete ba ka naheng le banyehelani ba mekgatlo le bona ba lokela ho hlahella mme ba tshehetse mekutu ena ya boqolotsi ba ditaba e mo lemong wa setjhaba, jwaloka ha ho etswa jwalo mererong e mengata ya demokrasi.
","tinhlangano temmango letikhutsata inhla lakahle kanye naletinikelako nato tifanele kutsi tihlanga nyele tesekele imisebenti yebuntsatseli lefunwa sive, njengobe kunjalo kutintsa ndvo telinyenti.
"
"ho ata ha ditaba tseo eseng tsa nnete tsa boiqapelo nakong ya sewa sena, haholoholo ho ya ka tshebediso ya ma rangrang a dikgokahano tsa setjhaba, ho ekeditse tlhoke ho ya ditaba tse ngata tse nepahetseng, tse tshepa halang le tse sa yeng ka leeme.
","kwandza kwetindzaba letingasiwo emaciniso ngesikhatsi selubhubhane, ikakhulu etinkhundleni tetekuchumana, sekwente kutsi kube nesidzingo lesi phutfumako setindzaba letinyenti letinembako, letingito naletingakhetsi luhlangotsi.
"
"nakong ena batho ba rona ba itshepetse ho lesedinyana le tswang ma tlong a rona a tsebahalang a boqolotsi ba ditaba bakeng sa phumano ya dintlha tse tshepahalang, hape e le ntho e supang bohlokwa ba tsona demokrasi ya rona.
","ngalesikhatsi lesi bantfu bakitsi batsembe le kutikhungo tetindzaba letiyinkhandzangikhona kute batfole lwatiso, ngiyaphindza futsi ngigcizelela kubaluleka kwato njengetinsika tentsa ndvo yelinyenti yetfu.
"
"ha re qala mosebetsi wa ho aha botjha moruo wa rona kamora maputula ana a sewa sena, indasteri ya boqolotsi ba ditaba e tla batla tshehetso ya rona haholo le ho feta mehla yohle.
","lapho sicala umsebenti lomkhulu wekwakha ka busha umnotfo wetfu nge muva kwelubhubhane, imbo ni yetindzaba itawudzinga kwesekelwa ngitsi kakhulu kunakucala.
"
"boqolotsi ba ditaba bo lokolohileng bo kile ba hla loswa e le ‘mohlokomedi ya sa otseleng wa tokelo efe kapa efe eo e leng kgau e lokollang banna kapa basadi’.
","tindzaba le tikhululekile take tachazwa ngekutsi 'umnakekeli longa lali wawo onkhe emalunge lo labalulekile kubobabe nabomake labakhululekile'.
"
"jwalokaha re babatsa seabo sa bona bakeng sa sewa sena, ha re etseng seo re ka se kgo nang ho etsa bonnete ba hore boqolotsi bo lokolohileng le bo fapaneng ba ditaba ka hara naha ya rona bo na le hona ho lopoloha le ho tswela pele kapa hona ho atleha.","lapho siphakamisa sibonga indzima yabo labayidlalako kulolubhubhane, asenteni loko lesingakwenta kucinise kisa kutsi tindzaba letikhu lulekile naletehlukahlukene kulelive letfu tiyakhona kuphila nekuchubekelembili ngemandla."
"dikhampani tsa mmuso di tlameha ho ntshetsa pele kgolo ya moruo le diphetoho vukuzenzele unnamed e se e le dilengwana jwale dikgwebo tsa mmuso (disoe) tsa afrika borwa, mahlong a setjhaba, di amahanngwa le ho hulwa ha puso ka nko, tshebediso e mpe ya ditjhelete le ho se sebetse hantle.
","emasoe kufuneka achubekisele embili kukhula kwemnotfo futsi aletse tingucuko vukuzenzele unnamed sekuminyaka lemine ngi nyalo, emabhi zinisi ahulumende (emasoe) waseningizimu afrika ummango uwahlo banise kakhulu nekubanjwa kwahulumende ngabho ngwane, kungaphatfwa ka hle kwetimali nekungase benti kahle.
"
"hodima hore mmuso o nne o di ntshe dikolotong hangatangata, tse ding tsa dikhampani tsa mmuso, tse kgolo ka ho fetisisa, tse bileng di le molemo ka ho fetisisa, di nnile tsa hloleha ho phetha merero ya tsona.
","kwengeta kulokuhlala ku nesidzingo sekutfola lusito lwetimali kuhulumende, lamanye alamabhizinisi ahu lumende lamakhulu kakhulu kulelive futsi lamcoka kakhulu bewabukene nebumatima bekuhlangabetana nemagunya awo.
"
"dikgwebo tsena tsa mmuso di tshwanela ho ba tsona tse hulang ka pele phetolo ya moruo le ya setjhaba.
","lamasoe lawa kufuneka ahambe embili ekuletseni tigucuko tetemnotfo nete nhlalo.
"
"ke boikarabelo ba tsona ho fana ka dibopeho tsa motheo le ditshebeletso tseo moruo o itshetlehileng ho tsona, le ha e ka ba lekaleng la phehlo ya motlakase, la dipalangwang tsa setjhaba, la phepelo ya metsi, la ho thothwa ha thepa kapa la dibopeho tsa motheo tsa dikgokahanyo.
","anemsebenti weku phakela sakhiwonchanti ne tinsita umnotfo loncike kuto, noma kungaba kukhicita gezi, tigitjelwa temmango, kuphakelwa kwemanti, ku tfutswa kwemphahla noma tekuchumana ngetincingo.
"
"ditsela tseo re di sebedisang ha mmuso o rua thepa di shebane le tlhoko ya tsamaiso e ntle ya diindasteri tsa sehlooho, tse kang tsa motlakase le tsa madiboho, hape le tlhoko ya ho netefatsa hore ditlhoko tse mahlonoko tsa maafrika borwa wohle, haholoholo bafumanehi, di ka phethwa.
","indlela yetfu yekutsi abe ahulumende isuselwa kule sidzingo sekutsi kusebente kahle luchungechunge lwetimboni letimcoka, letifana netemandla kanye netema tibuko, futsi nangesidzingo sekucinisekisa kutsi tidzingo letisisekelo tabo bonkhe ba ntfu baseningizimu afrika, kakhulu labo labaphuyile, tingaphumeleliswa.
"
"re kgodisehile haholo hore thuo ya thepa ya mmuso e a hlokeha makaleng a hlokolosi a moruo le hore naha ya rona e hloka dikhampani tsa mmuso tse matla tse nang le bokgoni ba ho ntshetsa pele kgolo ya moruo le diphetoho.
","siyetsemba kakhulu kutsi lokutsi abe mabhizinisi ahu lumende kumcoka kumi khakha lebucayi yetemnotfo nesekutseni lelive lidzinga emasoe lanemandla lata wukhona kuchubekisela embili kukhula kwemnotfo nekuletsa tingucuko.
"
"ena ke ntlha e tobileng phano ya thepa ya setjhaba e kang motlakase le metsi, moo dikhampani tsa mmuso di kgonang ho phetha morero wa tsona wa ntshetsopele molemong wa setjhaba, e seng feela ho phetha morero wa ho fumana kuno.
","loku kwenteka kakhulu uma kuphakelwa tinsita temmango letifana nagezi nemanti, lapho khona emasoe anemandla ekuchubekisa ligunya lekutfutfukisa kute kuzuze ummango kunekutsi kwentiwe inzuzo yetetimali.
"
"ke ka lebaka lena re entseng hore morero o ka sehloohong wa mmuso ona e be ho hlophisa botjha dikhampani tsena le ho tsomula bobodu, ho ntlafatsa makgotla a tsona a taolo le ho di fa bokgoni ba ho phetha tema e di tshwanelang morerong wa kgodiso ya moruo le ho thewa ha mesebetsi.
","kungenca yaloko sikhetse kutsi kube yintfo lecaliswa embili ngulohulumende kutsi agucule letinkapani kute kuliwe nenkohlakalo, kutfutfukiswe kuphatfwa kwato futsi tentiwe kutsi tidlale indzima lekufuneka tiyidlale ekuchubekiseni kukhulisa umnotfo nekuvula ematfuba emsebenti.
"
"morerong wa ho fihlela tsena, re tshebetsong ya ho tlisa diphetoho tse ngata tse reretsweng ho matlafatsa dikgwebo tsena tsa mmuso, e le hore di hlahise diphetho tseo naha e di hlokang, le tseo e di lebeletseng.
","kute kube kunyalo, sicale kwenta tingucuko tekukhulisa lamasoe kute akhone kukhicita imiphumela ledzi ngekalako nalelindzelekile kulelive.
"
