eng,xho
"safe and legal abortion is free allison cooper there is no justification for women to use an illegal and unsafe abortion clinic if they want to end their pregnancy.
","ukukhupha isisu ngokukhuselekileyo nokusemthethweni kusimahla allison cooper asikho isizathu sokuba abase tyhini basebenzise iklinikhi yokukhupha isisu engekho mthethweni nengakhuselekanga ukuba bafuna ukukhupha izisu zabo.
"
"this is according to deputy minister of health dr sibongiseni dhlomo, who explains that, by law, all women have the right to terminate their pregnancy, for free, at a government hospital or clinic during the first 12 weeks.
","oku kungokutsho kukasekela mphathiswa wezempilo ugqr sibongiseni dhlomo, ocacisa athi, ngokomthetho, bonke abasetyhini banelungelo lokukhupha isisu, simahla kwisibhedlele okanye kwiklinikhi karhulumente kwiiveki ezili12 zokuqala.
"
"""it pains us as government leaders to see our people leaving safe and free health services, for whatever reason, to go and spend the last money they don’t have to pay someone to put their life at risk.
","""kuyasikhathaza thina njengeenkokheli zikarhulumente ukubona abantu bethu beshiya iinkonzo zempilo ezikhuselekileyo nezisimahla, nokuba kungasiphi na isizathu, besiya kuchitha imali yokugqibela ekunganyanzelekanga ukuba bayihlawule umntu obeka ubomi babo emngciphekweni.
"
"there is no justification for women to correct an unplanned pregnancy with illegal and unsafe aborting because we all make mistakes.
","asikho isizathu sokuba abasetyhini balungise ukukhulelwa okungacetywanga ngokuthi bakhuphe isisu ngokungekho mthethweni nangokungakhuselekanga kuba sonke siyazenza iimpazamo.
"
"illegal abortion is not an answer,"" says dr dhlomo.
","ukukhupha isisu ngokungekho mthethweni akusosisombululo,"" utshilo ugqr dhlomo.
"
"the department of health has 346 public health facilities that provide safe termination of pregnancy services, he adds.
","wongeze ngokuthi isebe lezempilo linamaziko ezempilo oluntu angama346 abonelela ngeenkonzo zokukhupha isisu ngokukhuselekileyo.
"
"these are located in the eastern cape (46), free state (16), gauteng (25), kwazulunatal (56), limpopo (54), mpumalanga (27), northern cape (six), north west (26) and western cape (90).
","amaziko afumaneka empuma koloni (46), efreystata (16), erhawutini (25), kwazulunatal (56), elimpopo (54), empumalanga (27), emntla koloni (6), emntla ntshona (26) kwaye entshona koloni (90).
"
"illegal abortion complications the acting director for maternal child and women’s health at the kwazulunatal department of health, phalanndwa muthuphei, says women can face many complications when having an abortion at an illegal abortion clinic.
","iingxaki zokukhupha isisu ngokungekho mthethweni ibambela lomlawuli wenkonzo yezempilo yabantwana neyabasetyhini kwisebe lezempilo kwazulunatal, uphalanndwa muthuphei, uthi abasetyhini bangajongana neengxaki ezininzi xa bekhupha izisu kwiklinikhi yokukhupha isisu engekho mthethweni.
"
"""the immediate complications include severe bleeding, tearing of the cervix, severe damage to the genitals and abdomen, internal infection of the abdomen and blood poisoning.
","""ezi ngxaki zikhawulezileyo ziquka ukopha kakhulu, ukukrazuka komlomo wesibeleko, umonakalo omkhulu kumalungu angasese nakwisisu, ukosuleleka ngaphakathi esiswini kunye nokutyhefeka kwegazi.
"
"""in the longterm, women could face a slightly increased risk of infertility, an ectopic pregnancy, a miscarriage or premature delivery or even death,"" says muthuphei.
","""kwixesha elide, abasetyhini banokujongana nokwanda kancinci komngcipheko wokungazali, ukukhulelwa kwindawo engaqhelekanga, ukuphuncukelwa sisisu okanye ukubeleka phambi kwexesha okanye nokufa,"" utshilo umuthuphei.
"
"""women could also suffer emotional effects from an unsafe, illegal abortion, which include posttraumatic stress disorder, depression and problems with interpersonal relationships.
","""abasetyhini basenokuchaphazeleka ngokweemvakalelo ngenxa yokukhupha isisu okungakhuselekanga, ngokungekho mthethweni, okuquka ukuphazamiseka koxinzelelo lwasemva kokwenzakala, ukudakumba kunye neengxaki zobudlelwane phakathi kwabantu.
"
"""unsafe abortions can also lead to negative socioeconomic impacts on women, children, families and communities,"" she adds.
","""ukukhupha isisu okungakhuselekanga nako kunokukhokelela kwiimpembelelo zoqoqosho lwentlalo olubi kwabasetyhini, ebantwaneni, kwiintsapho noluntu,"" wongeze watsho.
"
"legal abortion options muthuphei says women who want to end their pregnancy have safe and free options to do so at public clinics and hospitals.
","iindlela zokukhupha isisu ezisemthethweni umuthuphei uthi abasetyhini abafuna ukukhupha isisubaneendlela ezikhuselekileyo nezisimahla zokwenza oko kwiiklinikhi nakwizibhedlele zikarhulumente.
"
"""a choice of methods should be available, all of which must be performed by a trained and experienced doctor or professional nurse,"" she adds.
","""ukhetho lweendlela kufuneka lube khona, konke kufuneka kwenziwe ngugqirha oqeqeshiweyo nonamava okanye ngumongikazi oqeqeshiweyo,"" wongeze watsho.
"
"the options, either medical or surgical abortion, depend on how far along the woman’s pregnancy is.
","ezi ndlela, nokuba kukukhupha isisu ngonyango okanye ngotyando, zixhomekeke kubude bexesha lokukhulelwa kowasetyhini.
"
"medical abortion, which involves taking two sets of pills to end the pregnancy, can be done up until nine weeks of pregnancy.
","ukukhupha isisu ngonyango, okubandakanya ukusela iipilisi ezimbini ukuphelisa ukukhulelwa, kunokwenziwa de kube ziiveki ezilithoba zokukhulelwa.
"
"""the patient would then abort the foetus at home and not at a clinic or hospital,"" says muthuphei.
","""isigulane ngoko ke sinokukhupha isisu ekhaya hayi eklinikhi okanye esibhedlele,"" utshilo umuthuphei.
"
"surgical abortions are performed by a registered nurse (up to 12 weeks) or a doctor (from 12 to 20 weeks).
","ukukhupha isisu ngoqhaqho kwenziwa ngumongikazi obhalisiweyo (ukuya kwiiveki ezili12) okanye ngugqirha (ukusuka kwiiveki ezili12 ukuya kwezingama20).
"
"according to the choice on termination of pregnancy act no 92 of 1996 (the act), an abortion can also be performed from 13 to 20 weeks if a doctor, after consultation with a pregnant woman, believes that: the continued pregnancy poses an injury risk to the woman’s physical or mental health.
","ngokomthetho wokukhetha ukukhupha isisu (umthetho nombolo 92 wowe1996), ukukhupha isisu kunokwenziwa ukusuka kwiiveki ezili13 ukuya kwezingama20 ukuba ugqirha, emva kokubonisana nowasetyhini okhulelweyo, ukholelwa ukuba: ukukhulelwa okuqhubekayo kubangela umngcipheko wokwenzakala kwimpilo yomzimba okanye kweyengqondo yowasetyhini.
"
"there’s a substantial risk that the foetus would suffer from a severe physical or mental abnormality.
","kukho umngcipheko omkhulu wokuba umntwana ongekazalwa angaba nokukhubazeka okukhulu ngokwasemzimbeni okanye ngokwasengqondweni.
"
"the pregnancy resulted from rape or incest.
","ukukhulelwa kube sisiphumo sokudlwengulwa okanye umbulo.
"
"the continued pregnancy would significantly affect the woman’s social or economic circumstances.
","ukukhulelwa okuqhubekayo kunokuchaphazela kakhulu imeko yentlalo okanye eyezoqoqosho kwabasetyhini.
"
"an abortion can also take place after the 20th week if a doctor, after consultation with a registered midwife, believes that the continued pregnancy would endanger the woman’s life, result in a severe malformation of the foetus or pose a risk of injury to the foetus.
","ukukhupha isisu kusenokwenziwa emva kweveki yama20 ukuba ugqirha, emva kokubonisana nombelekisi obhalisiweyo, ukholelwa ukuba ukukhulelwa okuqhubekayo kunokububeka esichengeni ubomi bowasetyhini, kubangele ukukhubazeka okukhulu kusana olungekazalwa okanye kubangele umngcipheko wokwenzakala kusana olungekazalwa.
"
"according to the act, all women, even if they are a minor under the age of 18, have the right to terminate a pregnancy.
","ngokomthetho, bonke abasetyhini, nokuba bangaphantsi kweminyaka eli18 ubudala, banelungelo lokukhupha isisu.
"
"they do not need permission from their parents or guardian.
","akukho mfuneko yokufumana imvume kubazali okanye umgcini.
"
"according to the western cape department of health, if you are a minor, you will be advised to talk to an adult you can trust and to bring someone with you to your appointment.
","ngokwesebe lezempilo lasentshona koloni, ukuba ungumntwana, uya kucetyiswa ukuba uthethe nomntu omdala omthembileyo kwaye uze nomntu kwidinga lakho.
"
"however, you do not have to do so.","nangona kunjalo, awunyanzelekanga ukuba wenze njalo."
