"gape, go tshepagala ga go šogana le morwalo go kaonafetše go ya go 80% gomme go lebile go 95% go fihlelela maemo a boditšhabatšhaba.
","ngalo kunjalo, kusebenta kahle kweti setjentiswa letilayisha imitfwalo lemikhulu kutfutfuke kwaya ku80% futsi kuyachubeka kuya lokungenani ku95% kuze kutsi kuhlangabetane netimiso temave ngemave.
"
"dinako tša go leta ga dikepe di fokotšegile go magato a go makatša.
","tikhatsi teku lindza kwemikhumbi tinciphe ngalokunelisako.
"
"dipalopalo tše di ka bo nala e le tša botsebi le go se kwešišagale, eupša di na le khuetšo ya thwii mo kgolong ya ekonomi le go ditefo tšeo re di lefago bjalo ka bareki.
","letibalobalo tingabonakala kwangatsi tiyaphica futsi tisitse kile, kodvwa tinemtselelangco ekukhuleni kwemnotfo wetfu kanye nakulamanani lesiwakho khelako njengebatsengi.
"
"re dirile gore go kaonafatša go šoma gabotse ga maemake pe a rena e be selo se bohlokwa sa operation vulindlela go mme re nepišitše go ageng lefsa transnet, yeo e lego ye nngwe ya dikgwebo tša mmušo tše bohlokwa.
","sente kwentiwa ncono kwe kusebenta kahle kwetikhumulo tetfu kube seluhlwini lolusetulu lweoperation vulindlela futsi sigcile ekwakheni kabusha itransnet, lekungulenye yemabhizinisi embuso wetfu laligugu.
"
"ba taolo ye mpsha ya transnet le dikarolo tša yona tša go šoma ba nepiša ka maikemišetšo a go fetoša go šoma ga boemakepe.
","baphatsi labasha betrans net netigaba tayo tekusebenta bancume kugcila ekuguculeni kusebenta kwalesikhumulo.
"
"ba taolo ba na le maano a go hlohleletša gape a go kgahliša a go atološa mafelo ka moka a mahlano a boemakepe.
","baphatsi banenshisekelo ne tinhlelo letitsakasisako tekwa ndzisa emabala aletikhumulo letisihlanu.
"
"wona a akaretša go katološa tsela ya maydown wharf go dumelela dikepe tša sebjale bjale tše dikgolo go tsena ka boemakepeng, go tswalela pier 1 le pier 2 go hlola bokgoni bja tlaleletšo bja ditšhelo le kaonafatšo ya lefelo la setšhelo le lefsa ka point precinct.
","loku kufaka phakatsi ku julisa umgudvu imaydon wharf kuvumela imikhumbi yesimanje kutsi ingene esi khumulweni, kugcwaliswa kwepier 1 napier 2 lokuto kwakha umtsamo longetiwe wetintfo tekuphatsa neku tfutfukiswa kwetiteshi tetintfo tekuphatsa letinsha kupoint precinct.
"
"ka moka, katološo ya infrastraktšha mo boemake peng bjo e tla nyaka dipeeletšo tše dimpsha tša go dira r100 bilione mo mengwageng ye mesome le ya go feta ye e tlago.
","sekuhlangene, lokwengetwa kwesakhiwonchanti kulesikhu mulo kutawudzinga tigidzigi dzi letir100 kutjalomali lolu sha esikhatsini seminyaka leli shumi nangetulu.
"
"se se tla fetoša boemakepe go felelela, ya katološa bokgo ni bja bjona bja go šogana le setšhelo go tloga go diyuniti tše 2.9 milione go ya go diyuniti tše 11 milione.
","loku kutawuntjintja lesikhu mulo ngalokuphelele, kwe ngete nemtsamo wekubeka kwekuphatsa kusuka kumayu nithi latigidzi le2.9 kuye kula ngetulu kwalatigidzi le11 .
"
"maano a a go hlohleletša a tla nyaka gore lekala la praebete le kgathe tema ya go bonala le ya dipeeletšo.
","letinhlelo letinenshisekelo titawudzinga kuhlanganyela nelutjalomali lolukhulu lwemi khakha yangasese.
"
"transnet, go akaretša boema kepe bja durban, ke thoto ye bohlokwa ya setšhaba yeo e lego ya batho ba afrika borwa.
","itransnet, nesikhumulo sasethekwini lifa lesive lelibalulekile lebantfu ba seningizimu afrika.
"
"ditirišano le lekala la prae bete di bohlokwa go tliša peeletšo ye mpsha, theknolotši le bokgoni go tshepedišo ya boemakepe le go mpshafatša didirišwa le infrastraktšha.
","kuhlanganyela nemikha kha yangasese kubalule ke ngalokwendlulele eku letseni lutjalomali lolusha, bucwepheshe kanye ne bungcweti emisebentini yetikhumulo nokwe nta tisetjentiswa nesakhi wonchanti sesikhatsi sa nyalo.
"
"transnet e beakanya, mohla la, go kwalakwatša kgwebo moragonyana ngwaga wo go aga le go sepetša lefelo la boemakepe le lefsa.
","itransnet ihlela, sibonelo, kukhangisa imvume yekwakha iphindze isebentise lepoint ter minal lensha nasekutawuphela lomnyaka.
"
"se se tla tliša peeletšo ya praebete le go kaonafatša bokgoni bja go šogana le setšhelo.
","loku kutawuletsa lutjalomali lwangasese futsi ku tfutfukiswe kuphatsa kahle kwetintfo tekuphatsa.
"
"ka tshepetšo ya rena re kaonafatša ka go latelana bokgoni bja maemakepe a rena le diporo gomme ba utolla peeletšo ye kgolo ka infrastraktšha.
","ngetinchubo letiguculiwe tetfu siyatfutfukisa ngesineke kusebenta kahle kwetikhu mulo tetfu nemizila yetiti mela futsi sivula lutjalomali lolukhulu kusakhiwonchanti.
"
"se se ka se fokotše fela ditshenyagelo le go kaonafatša bokgoni bja maemakepe a rena, eupša se tla hlola mešomo ye mefsa mo tshepetšong.
","loku akunawehlisa kuphela tindleko nekutfutfukisa kuse benta ngelikhono kweku tfumela ngaphandle imikhicito, kodvwa kutowakha tinkhu lungwane temisebenti lemisha nasichubeka.
"
"ka bobedi dikaonafatšo tša tshepedišo le phetošo ya sebo pego, boemakepe bja durban bo tla boela maemong a bjona a go ba boemakepe bja go šoma gabotse go feta ka moka mo afrika.
","ngekwentiwa ncono kwako kokubili kusebente netingu cuko tesakhiwo, sikhumulo sasethekwini sitawubuyela endzaweni yaso yekuba sikhu mulo lesisebenta kahle kakhulu eafrika.
"
"bjalo ka ge e le karolo ya leano la rena la kagolefsa le mpshafatšo ya ekonomi, re tla tšwela pele go šoma ka maatla go oketša dipeeletšo mo infrastraktšheng le go fetoša intasteri ya rena ya manane.
","njengencenye yetfu yeluhlelo lwekwakha kabusha nekuvu setelwa kwemnotfo sitawuchu beka nekusebenta ngekutikha ndla kwandzisa lutjalomali lwesakhiwonchanti nekugucula timboni lesitfungene nato.
"
"ge leeto la ka durban le tlogetše selo se tee mona ganong wa ka, ke ka moo maafrika borwa ba kgonago go atlega diprotšekeng tše bohlokwa kudu le tše dikgolo.
","uma ngabe kuvakashela kwami ethekwini kushiye intfo yinye engcondvweni yami, ku tsi tsine bantfu baseningizimu afrika siyakhona kuphumelela emisebentini lebaluleke kakhu lu nalemikhulu kakhulu.
"
"maikemišetšo a rena a swanetše go sepelelana le bo golo bja ditlhohlo tše re nago le tšona.
","inshisekelo yetfu kufanele ilingane nebukhulu betinca bhayi tetfu.
"
"ka tšwelopele yeo re e di rago mo boemakepeng bja durban, ka mabokgoni ao a matlafaditšwego le mabokgoni ao re nago le wona ka go trans net, bjale re tseleng ya maleba.
","ngalenchubekelembili lesiye nta esikhumulweni sasethekwi ni, nemakhono nebungcweti lo buvuselelwe lesinabo etrans net, sesinemdlandla nyalo.
"
gomme re sepela ka lebelo go fihla moo re yago gona.,futsi sihamba ngelitubane lelisetulu siya lapho sicondze khona.
"disoe di swanetše go laola kgolo ya ekonomi le phetogo vukuzenzele unnamed bjale e šetše e le me ngwaga ye mma lwa ye dikgwebo tša mmušo (disoe) mo setšhabeng di amantšhwa le ditiragalo tša go goga mmušo ka nko le tšhomi šobošaedi ya ditšhelete le go hloka bokgoni.
","emasoe kufuneka achubekisele embili kukhula kwemnotfo futsi aletse tingucuko vukuzenzele unnamed sekuminyaka lemine ngi nyalo, emabhi zinisi ahulumende (emasoe) waseningizimu afrika ummango uwahlo banise kakhulu nekubanjwa kwahulumende ngabho ngwane, kungaphatfwa ka hle kwetimali nekungase benti kahle.
"
"godimo ga go kgopela thušo gantši go mmušo go di ntšha ka gare ga dikoloto, tše dingwe tša dikhamphani tše dikgolo tša mmušo tše gape di lego bohlokwa di dutše di palelwa ke go phethagatša ditaolelo tša tšona.
","kwengeta kulokuhlala ku nesidzingo sekutfola lusito lwetimali kuhulumende, lamanye alamabhizinisi ahu lumende lamakhulu kakhulu kulelive futsi lamcoka kakhulu bewabukene nebumatima bekuhlangabetana nemagunya awo.
"
"disoe tše di swanetše go ba tšona tšeo di etilego pele phetogo ya ekonomi le leago.
","lamasoe lawa kufuneka ahambe embili ekuletseni tigucuko tetemnotfo nete nhlalo.
"
"ke maikarabelo a tšona go aba infrastraktšha le ditirelo tšeo ekonomi e e thekgilego go tšona, e ka ba ka magorong a tšweletšo ya mohlagase, dinamelwa tša bašomi, kabo ya meetse, taolo ya dinamelwa tša merwalo goba dikgokagano tša megala.
","anemsebenti weku phakela sakhiwonchanti ne tinsita umnotfo loncike kuto, noma kungaba kukhicita gezi, tigitjelwa temmango, kuphakelwa kwemanti, ku tfutswa kwemphahla noma tekuchumana ngetincingo.
"
"mokgwa wa rena go dithoto tša mmušo o hlahlwa ke tlhokego ya go šoma ga dii ntasteri tša mananeo a mago lo a enetši le maemakepe, le ka tlhokego ya go kgonthiša gore dinyakwa tša motheo tša maafrika borwa ka moka, kudu bahloki, di a fihlelelwa.
","indlela yetfu yekutsi abe ahulumende isuselwa kule sidzingo sekutsi kusebente kahle luchungechunge lwetimboni letimcoka, letifana netemandla kanye netema tibuko, futsi nangesidzingo sekucinisekisa kutsi tidzingo letisisekelo tabo bonkhe ba ntfu baseningizimu afrika, kakhulu labo labaphuyile, tingaphumeleliswa.
"
"re tshepa kudu gore go ba beng ba thoto ya mmušo go a hlokega mo makaleng a bohlokwa a ekonomi le gore naga e hloka disoe tše maatla tšeo di kgonago go sepetša kgolo ya ekonomi le phetogo.
","siyetsemba kakhulu kutsi lokutsi abe mabhizinisi ahu lumende kumcoka kumi khakha lebucayi yetemnotfo nesekutseni lelive lidzinga emasoe lanemandla lata wukhona kuchubekisela embili kukhula kwemnotfo nekuletsa tingucuko.
"
"se gantši se ba bjalo mo go abeng dithoto tša mmušo tša go swana le mohlagase le meetse, moo disoe di kgonago go latela taolelo ya kaonafatšo mo kgahlagelong ya setšhaba kgahlanong le ye e lego fela ya kgwebo.
","loku kwenteka kakhulu uma kuphakelwa tinsita temmango letifana nagezi nemanti, lapho khona emasoe anemandla ekuchubekisa ligunya lekutfutfukisa kute kuzuze ummango kunekutsi kwentiwe inzuzo yetetimali.
"
"ke ka moo re dirilego gore go be bohlokwa go mmušo wo go fetoša dikhamphani tše go tumola bomenetša ka medu, go kaonafatša taolo ya tšona le go di kgontšha go kgatha tema yeo di swanetšego go e kgatha ka go sepetša kgolo ya ekonmi le go hlola mešomo.
","kungenca yaloko sikhetse kutsi kube yintfo lecaliswa embili ngulohulumende kutsi agucule letinkapani kute kuliwe nenkohlakalo, kutfutfukiswe kuphatfwa kwato futsi tentiwe kutsi tidlale indzima lekufuneka tiyidlale ekuchubekiseni kukhulisa umnotfo nekuvula ematfuba emsebenti.
"
"go fihla gonabjale, re thomile dikaonafatšo tše mmalwa go matlafatša disoe tše gore di tšweletše dipoelo tšeo naga e di nyakago gape e di letetšego.
","kute kube kunyalo, sicale kwenta tingucuko tekukhulisa lamasoe kute akhone kukhicita imiphumela ledzi ngekalako nalelindzelekile kulelive.
"
"ye nngwe ya diphetogo tše bohlokwa e ka lekaleng la enetši.
","lenye yaletingucuko leti mcoka kakhulu ikulomkha kha wetemandla.
"
"re thomile tshepetšo ya go beakanya lefsa eskom ka diseo tše tharo tša go fa pana, mo ye nngwe e tla bago le maikarabelo a tšweletšo ya mohlagase, ye nngwe yaba le maikarabelo a kgokagano gomme ya mafelelo yaba le maikarabelo a phatlalatšo, ka tatelano yeo.
","sicalile ngeluhlelo lwekuhlela kabusha ieskom kutsi ibe ngemasoe lahlukene lamatsatfu, latawubukana nekukhicita, kuhanjiswa nekusabalaliswa kwagezi ngekwehlukahlukana kwawo.
"
"se ke ka lebaka la gore sebopego sa go feta sa eskom se be se se maleba go fetoša maemo a enetši.
","loku kubangwa kutsi loluhlelo lwasekucaleni lweeskom belungakafaneleki kahle kute lukhone kugu cula lokwakheka kwalelive kutemandla.
"
"se be se palelwa ke go šoma gape se hloka tšhelete ye ntši kudu ebile se be se sa beye dilo pe peneng mo go lekanego.
","loluhlelo belungasebenti ngalokufanele, belubita kakhulu futsi belungakavuleleki kute lubo nwe nguwo wonkhe umu ntfu.
"
"go hlongwa ga lekala la kgokagano kudu go tla ra gore eskom e tla kgona go reka mohlagase go baabi ba bantši ba ditirelo, bobedi ba praebete le ba setšhaba.
","kusungulwa kwesikhungo sekuhanjiswa kwagezi kuta wusho kutsi ieskom itawu khona kutsenga gezi kuba phakeli tinsita labahluka hlukene, kubo bobabili ba phakeli bangasese nebahulu mende.
"
"se se tla kaonafatša go bea dilo pepeneng, sa oketša phadišano ya katlego le go hohleletša go reka mohlagase wa theko ya fase.
","loku kutawenta kutsi tintfo tenteke ngalokuvulekile, kutawukhulisa kuchu dzelana futsi kutawugcu gcutela kutsi kutsengwe gezi longabiti kakhulu.
"
"ka lenaneo la tšweletšo ya mohalagase la go ikema la enetši ya go tšošološwa, re bone legoro la praebete le dira dipeeletšo tše dintši tša go tšweletša mohlagase.
","ngekusebentisa luhlelo lwebakhiciti bagezi lo vusetelekako, kube nelutjalomali lolubalulekile kwanga sese ekukhiticweni kwagezi.
"
"ka tšhišinyo ya go oketša go se akaretšwe ga laesense ya tšweletšo ye e tsentšwego – moo dikhamphani di tšweletšago mohlagase wa tšona le badiriši ba bangwe ba kgwebo – go tšwa go 1mw go ya go 100mw, re ka letela peeletšo ya praebete ye nngwe ye ntši.
","ngalesiphakamiso sekutsi kukhuliswe lesidzingo seku ngadzingeki kwelayisensi kute ukhone kukhicita gezi, lapho khona tinkapani titikhicitela gezi wato futsi titsengisele labanye – kusuka ku1mw kuya ku100mw, silindzele kutsi lukhule lutjalomali kumabhizinisi angasese.
"
"se se bohlokwa ka nako yeo naga e lego bothateng bjo bo šoro bja go hlaelela mohlagase wa go swarelela le moo eskom goba mmušo ba ka se kgonego go beeletša go maatla a tšweletšo a mafsa.
","loku kumcoka kulesikha tsi lapho live libukene ne kuswelakala kanye neku ngasimami lokukhulu kwa gezi futsi lapho khona ieskom kanye nahulumende bangakhoni kutjala timali kulamandla lamasha ekukhi cita.
"
"se bohlokwa, dikaonafatšo tše di tla fa eskom sebaka sa go šogana le ditlhohlo tša ditšhelete le tirišo.
","lokubalulekile, letingucuko leti titawunika ieskom litfuba lekubukana netinsa yeya tayo tetetimali netekuse benta.
"
"kaonafatšo ye nngwe ye bohlokwa ke go hlongwa ga taolo ya maemakepe a setšhaba bjalo ka tlaleletšo ya go ikema ya transnet.
","lenye ingucuko lemcoka ngilokusungulwa kweluphiko lwavelonkhe lwema tibuko lelitawuba inkapani letimele leligatja letransnet.
"
"se se karolo ya bohlokwa ya peakanyo ye kgolo ya transet ya go mpshafatša infrastraktšha ya go rwala dithoto.
","lena yincenye lemcoka yendlelalisu lebanti yetransnet yekuvuselela sakhiwonchanti setekutfutswa kwemphahla.
"
"transnet e nyaka go beeletša r100 bilione mo mengwageng ye mehlano ka go kaonafatša infrastraktšha mo mafelong ka moka a maemakepe.
","itransnet ihlele kwenta tjalomali lolungemabhiliyoni lar100 kuleminyaka letako lesihlanu kute itfutfukise sakhiwo nchanti sayo kulo lonkhe luhlelo lwematibuko.
"
"se se tla dira gore maemakepe a rena a šome gabotse le dikišontle tša rena di be le mohola, gomme se se tla hola ekonomi ka moka.
","loku kutawenta ematibuko etfu asebente kahle futsi imphahla yetfu letfunyelwa emaveni angaphandle itawukhulisa kuchudzelana, bese kuzuza tonkhe tinhlelo temnotfo.
"
"se se tla hola bareki ka go ba fokoletša ditefišo ge ba reka dithoto mo nakong ye e tlago.
","kumtsengi lotayelekile, loku kutawusho kutsi kutawu ncipha emanani esikhatsini lesidze lesitako etintfweni letinengi.
"
"se se tla hola baišantle ba rena ka ge se tla ba thuša gore ba kgone go rekišetša mebaraka ye megolo lefaseng.
","kulabo labatsengi sela emave angaphandle, kutawusho kutsi kutawuba nekuchudzelana lokukhulu etimakethe temhlaba.
"
"ge kišontle ya rena e gola, ekonomi ya rena le yona e tla gola ya hlola mešomo ye mentši.
","njengoba kutfumela kwetfu tintfo emaveni angesheya kukhula, umnotfo wetfu utawukhula bese wakha lamanye ematfuba emsebe nti.
"
"maemakepe a bo kgoni a mantši a tla dira gore ekonomi ka moka e šome gabotse – gomme ge bontši bja maemakepe bo oketšega, go tla hlolega mešomo mo maemakepeng ka bowona.
","uma ematibuko lamane ngi asebenta kahle kutawenta kutsi tonkhe tinhlelo tetemnotfo tisebente kahle futsi uma linani lematibuko likhula, kutawuba nematfuba emisebenti kulawo matibuko ngekwawo.
"
"go hlola taolo ya maemakepe a setšhaba bjalo ka tlaleletšo ya transnet ka boto ya yona, gare ga tše dingwe, e ra gore matlotlo ao a dirilwego ke maemakepe a ka šomišwago go fetoša didirišwa tša kgale le go mpshafatša le go katološa maemakepe a rena, e lego mošomo wo o ditelegile ka sebaka sa go feta mengwaga ye lesome.
","kusungulwa kweluphiko lwavelonkhe lwematibuko lolutawuba ligatja letransnet lelinebhodi yalo, kulokunye, kutawuchaza kutsi imali letfolakele kulamatibuko ingasetjentiselwa kubuyisela imishini lemidzala nekutfutfukisa kanye nekukhulisa ematibuko etfu, lekumsebe nti lobambeleleke iminyaka lengetulu kwalelishumi.
"
"gare ga tše dingwe, di mpshafatšo tše di tla hlo hleletša legoro la praebete go dira dipeeletšo tše dintši go infrastraktšha ya ekonomi ya naga.
","kulokunye, letingucuko leti titawugcugcutela ema bhizinisi angasese kutsi atjale timali kakhulu kusakhiwo nchanti setemnotfo walelive.
"
"batho ba bangwe ba tšweleditše matshwenyego a gore se se tla tšeela mmušo maatla goba sa fokotša mohola wa disoe.
","labanye bantfu bavakalise kukhatseka kwabo kutsi loku kutawucedza noma kutawunciphisa kubaluleka kwemasoe.
"
"gabotse, se ga se nnete.
","ecinisweni, loku kutawukhulisa emasoe.
"
"dimphsafatšo tše di tla kgo nthiša gore ge infrastraktšha ye e beakantšwego e dula ka polokego ka diatleng tša mmušo, disoe tša rena di tla šoma ka bokgoni gomme diintasteri tšeo di di thekgago di tla kgona go phadišana ka katlego kudu.
","letingucuko leti titawucinisekisa kutsi nanoma indle lalisu yesakhiwonchanti itawuhlala isetandleni tahulumende, emasoe etfu atawusebenta kahle kakhulu futsi netimboni latisekelako titawuba nekuchudzelana lokukhulu.
"
"go no swana, dimpshafatšo tše di bohlo kwa go kgonthiša gore disoe di phethagatša ditaolelo tša tšona tša kaonafatšo ya go phatlalala go thekga badudi ka moka le ekonomi.
","ngalokulinganako, letingucuko timcoka ekucinisekiseni kutsi emasoe asebentisa ligunya lawo lelibanti lekutfutfukisa kute kusekelwe bonkhe bantfu nato tonkhe tinhlelo temno tfo.
"
"dipholisi tša rena le bjale di sa re disoe di swanetše go kgatha tema ye bohlokwa go thekga kgolo ya ekonomi ya rena.
","inchubomgomo yetfu isa mile ekutsini emasoe kufuneka adlale inzima le mcoka ekukhuliseni umnotfo wetfu.
"
"mošomo wa rena ke go di bea motheong wa go kwagala, gore di kgone go šomela bengdišere ba tšona ba bohlokwa – e lego batho ba afrika borwa.","umsebenti wetfu kutsi siwabeke ezingeni lelikahle lekusebenta, kute ekugcineni asebentele banikati bemasheya – lekubantfu baseningizimu afrika."
"sandf e lwantšhana le covid19 more matshediso lebotho la bosetšhaba la sešole sa afrika bo rwa (sandf) le gare le thuša go lwantšha leuba la coronavirus (covid19) mo gauteng, e lego profense ye gona bjale e nago le palo ya godimodimo ya lephoto la boraro la leuba le.
","isandf ilwa necovid19 more matshediso umbutfo weteku vikela wavelo nkhe waseningi zimu afrika (isandf) usita ekulweni nesifo selubhubhane lweligci wane lekhorona egau teng, kwanyalo lekusizi nda sesiwombe sesitsatfu.
"
"sandf e thuša go dira diteko tša batho ka bontši, go ba lekola le go lota mehlala ya bao ba fetetšwego, ebile e thuša gape le ka matsogo maokelong.
","isandf isita ekuhlo leni umphakatsi ngebunyenti, kucilonga, ilandzelele lotsi ntsene nabo, iphindze ifake sandla etibhedlela.
"
"bašomedi ba ditirelo tša maphelo tša sešole sa afrika borwa ba bileditšwe go tlo šoma ka mo profenseng gore ba thuše go imolla boima bjo bo rwelwego ke bašomedi ba tlhokomelo ya maphelo.
","umnyango wetemphilo wetetimphi waseningizimu afrika utfunyelwe kulesi fundza kutsi utonciphisa umtfhwalo kubasebenti betemphilo.
"
"sehlophatšhomo se sa dingaka se rometšwe sepetlele sa thuto sa chris hani baragwanath gola johannesburg.
","litsimba letekwelapha imedical task group ibekwe esibhedlela ichris hani baragwanath academic hospital ejozi.
"
"ka ge profense ya gau teng e nale le palo ya godimodimo ya diphetelo tša leuba la covid19 nakong ye ya le photo la boraro, sepetlele se se tsebagaditšwe bjalo ka bookelo bja maphelo ba profense ye ebile bo tlogeletšwe balwetši ba covid19.
","njengobe igauteng ibhalisa sibalo lesisetulu setigameko tecovid19 ngesikhatsi seli hlandla lesitsatfu, sibhedlela sakhetfwa njengesikhungo setemphilo kulesifundza futsi manje sesibekelwe tigulane letinecovid19.
"
"pele ba thomiša ka mošomo, maloko a sehlophatšhomo se sa dingaka ba ile ba swanela ke go entelwa gore ba bolokege ge ba le gare ba kalokana le palo ye hlatlogetšego godimo ya di tshwaetšo le bao ba amogelwago ka bontši ka maokelong.
","ngaphambi kwekucala imisebenti yabo, litsimba letekwelapha kwafuneka kutsi lijovwe kuze kutsi ligcinwe liphephile ngale sikhatsi ibukana nelinani lelinyukako letigameko tekwe tseleleka nekwemukelwa etibhedlela.
"
"molaodimogolo wa sehlophatšhomo se sa dingaka mokholonele fezeka mabona, yo e lego mooki wa profeše nale, o boletše gore o swarišana mošomo wa ka bookelong le maloko a sehlopha se.
","kolonela fezeka mabona longumlawuli welitsimba letekwelapha, utsi naye usebenta kanye nalamanye emalunga alelicembu.
"
"""sehlopha se se bopša ke ditsebi tša tlhokomelo ya maphelo, go akaretšwa baoki, dingaka, badirišanimmogo ba tša maokelo le ditsebi tša polokego le tša maphelo mešo mong,"" a realo.
","utsi ""lelitsimba linabo chwepheshe betemphilo, lokufaka ekhatsi emanesi, bodokodela labasebenta emitfolamphilo kanye nalabo la basebenta kutekuphepha netemphilo emisebentini yabo.
"
"bontši ba baoki sehlo pheng se ba nale mangwalo a thuto ya tša booki mae mong a tikrii, ka magoro a go fapafapana a mešomo ya tša booki, go akaretšwa le tlhokomelo ya maphelo ya motheo.
","""linyenti lemanesi lineticu tasemanyunivesi tekuba manesi, lokufaka ekhatsi kunakekela kwetemphilo lokusisekelo.
"
"""ba bangwe ba baoki ba filwe tlhahlo ya go dira diopareišene.
","""lamanye emanesi acece shelwe tekuhlinza.
"
"ka moka ga rena mo re thomile re šoma bjalo ka baoki ba pholo, baoki ba go belegiša, bahlahli le balaodi ba baoki ka sešoleng le ka dipetleleng tša mmušo,’’ a realo a tlaleletša seo a se boletšego.
","sonkhe sisebentile njengemanesi latayelekile, labelekisako, labafu ndisa emanesi nalabaphe tse etinhlelweni tetimphi netemphilo emphakatsini,"" kwe ngeta yena.
"
"sehlopha se se arogantšwe ka dihlophatšhomo ebile se šoma mmogo le bašomedi ba ka sepetlele ka go šiedišana go ya ka dinako tša bona tša go theogela mošomong, le go ya ka nyakego ya bašomi bookelong bjo.
","lelicembu lehlukaniswe ngematsimba emisebenti futsi lisebenta netisebenti talesi bhedlela ngekuntjintjana, kuye ngesidzingo lesikuleso sikhungo.
"
"ka motsotso wo, sehlopha se se gare ka go aba ditirelo tša tlhokomelo ya maphelo diwateng tše tshela tša bookelo.
","kwamanje lelitsimba liniketa lusito lwetemphilo emagunjini etiguli lasitfupha.
"
"""palo ya bašomedi ba sepetlele se e fase kudu go ka kgona go swaragana le palo ya diphetelo ka motsotso wo.
","""linani lebasebenti balesi bhedlela liphansi kakhulu kutsi lingakwati kubukana nesibalo setigameko njengamanje.
"
"go bohlokwa kudu go rena gore re leke ka mo re ka kgonago ka gona go ba thuša gore ka moka ga rena re tle re kgone go efoga kgatelelo ye tšwelago pele go imela peakanyo ya tlhokomelo ya maphelo,"" a realo mabona.
","kubalulekile kakhulu kutsi sitame ngalokusema ndleni kutsi sibasite kuze kutsi sonkhe sigweme kuchubeka kwebumatima eluhlelweni lwetemphilo,"" kusho mabona.
"
"polelong ya gagwe, o boletše gape le gore moya wa go šoma ka sehlopha magareng ga baoki ba go tšwa sandf le ba sepetlele se sa mmušo o bile o mobotse kudu go fihla nakong ye.
","wengeta ngekutsi umoya wekubambisana phakatsi kwemanesi labuya kusandf kanye neluhlelo lwetemphilo lwemphakatsi ube muhle kuze kube manje.
"
"ka baka la tlhatlogo ya diphetelo tša covid19, go letetšwe gore sepetlele se se amogele mepete ye mentši ya balwetši, nepo e le go oketša mepete ye lego gona gabjale ya go lekana balwetši ba 96 gore balwetši ba bangwe ba bantši le bona ba hwetše mepete.","ngenca yekwenyuka kwe tigameko tecovid19, sibhedlela silindzeleke kutsi sitfole leminye imibhede, kuze sikhuphule umtsamo waso wemibhede lenge96 kuze sihlalise tigulane letiningi."
"ditšhaba tše di kopanego di bohlokwa go katlego ya afrika borwa vukuzenzele unnamed le ge dikgaruru le tshe nyo tšeo di phulegi lego dikarolong tša kwazulunatal le gau teng kgauswanyana di hlotše tshenyo ye kgolo go thoto le mešomo, di bile gape le khuetšo ye kgolo go kopano ya ditšhaba tša rena.
","kubumbana kwemimango kumcoka kakhulu emphumelelweni yeningizimu afrika vukuzenzele unnamed nanome lobudlova nekonakalisa lobe kuhlasele tincenye takwazulunatal nasegau teng esikhatsini lesisandza kwendlula kubange umona kalo lomkhulu etimphahleni nasetindleleni tekutiphilisa, kuphindze futsi kwaba nemtselela lomkhulu ekubumbaneni kwemimango.
"
"se se hlatsetšwe ka diti ragalo tša masetlapelo tšeo di diragatšego phoenix le ethekwini.
","loku kubonakale ka khulu kuletehlakalo letilu sizi letenteke ephoenix nase tindzaweni letisedvute na khona kanye nasethekwini.
"
"nakong ya dikhuduego tše mpe le go feta ka temokra sing ya rena, le klaemete yeo e šetšego e tletše ka dikgo nono le matšhogo, batho bao ba bego ba phela mmogo ka khutšo ba hlanogelane.
","ngesikhatsi saletiphitsiphitsi letimbi kakhulu kuntsandvo yelinyenti yetfu, kanye nasesimeni lesivele sisolisa kakhulu futsi sekungetsembani, bantfu labebahletisene ngekuthula bajikelene bodvwa.
"
"go sa na le tše ntši tšeo re swanetšego go di utolla ka ditiragalo tšeo di diragetšego.
","kusasekunyenti lekumele kutsi sikuvumbulule loku macondzana naletehlakalo letentekile.
"
"koketšego ya ditaba tša maaka, phetošo ya diswantšho le tshedimošo ya maaka di dirile gore go be bothata go aroganya ditaba tša nnete le tša maaka.
","kusatjalaliswa kwetindzaba letingasilo liciniso, titfombe letibunjiwe kanye nelwatiso lolungasilo kube lukhuni kwehlukanisa emkhatsini kweliciniso nendzaba lecanjiwe.
"
