ven,tso
"zwa u thutha thumbu nga nḓila yo tsireledzeaho nahone i re mulayoni ndi mahala allison cooper a hu tou vha na tshiitisi tshi pfalaho tsha uri vhafumakadzi vha shumise kiḽiniki dza u thutha thumbu dzi siho mulayoni nahone dzi songo tsireledzeaho musi vha tshi ṱoḓa u thutha thumbu.
","nxixo lowu hlayisekeke na ku va enawini i mahala allison cooper ku hava xivangelo xo twala xa vavasati ku tirhisa tliliniki ya nxixo leyi nga riki enawini na ku va wu nga hlayisekangi loko va lava ku herisa vuyimana bya vona.
"
"hezwi ndi u ya nga muthusa minisṱa wa mutakalo dokotela vho sibingiseni dhlomo, vhe vha ṱalutshedza uri u ya nga mulayo, vhafumakadzi vhoṱhe vha na pfanelo dza u thutha thumbu nga mahala kha zwibadela zwa muvhuso kana kiḽiniki kha tshi fhinga tsha vhege dza 12 dza u thoma.
","leswi i ku ya hi xandla xa holobye wa rihanyo dkd sibongiseni dhlomo, loyi a hlamuselaka leswa ku, hi nawu vavasati hinkwavo va na mfanelo ya ku herisa vuyimana bya vona, mahala, exibedhlele xa mfumo kumbe tliliniki ya mfumo hi nkarhi wa 12 wa mavhiki lamo sungula.
"
"""zwi a ri vhaisa sa vharangaphanḓa vha muvhuso u vhona vhathu vhashu vha tshi ṱutshela tshumelo dza mutakalo dzo tsireledzeaho nahone dza mahala nga mulandu wa zwiitisi zwifhio na zwifhio zwine vha vha nazwo, vha ya vha shumisa masheleni avho a u fhedzisela ane na u vha nao vha si vhe nao, vha tshi badela muṅwe muthu ane a khou ḓo vhea matshilo avho khomboni.
","""swa hi vavisa tanihi varhangeri va mfumo ku vona vanhu va ka hina va tshika vukorhokeri byo hlayiseka na ku va bya mahala, hi xivangelo xihi kumbe xihi, va ya hakela mali ya vona yo hetelela leyi va nga riki na yona ku hakela munhu ku veka vutomi bya vona enxungetweni.
"
"a hu na zwiitisi zwi pfalaho zwauri vhafumakadzi vha lingedze u tandulula thaidzo ya u vhifha havho muvhilini hu songo dzu dzanyelwaho nga u thutha thumbu nga nḓila i songo tsireledzeaho nahone ine ya si vhe mulayoni ngauri roṱhe ri a ita vhukhakhi.
","ku hava xivangelo xo twala xa vavasati ku lulamisa vuyimana lebyi nga kunguhatiwangiki hi ku xixa loku nga hlayisekangiki na ku va ku nga ri enawini hikuva hinkwerhu ha endla swihoxo.
"
"zwa u thutha thumbu nga nḓila ine ya si vhe mula yoni a si yone phindulo,"" vha ralo dokotela vho dhlomo.
","nxixo lowu nga riki enawini a hi nhlamulo,"" ku vula dkd dhlomo.
"
"muhasho wa mutakalo u na zwiimiswa zwa mutakalo zwa muvhuso zwi linganaho 346 zwine zwa ṋetshedza tshumelo dzo tsireledzeaho dza u thutha thumbu, vha a ḓadzisa.
","ndzawulo ya rihanyo yi na 346 wa miako ya rihanyo ya mani na mani, leyi yi nyikaka vukorho keri bya heriso wa vuyimana wo hlayiseka, a engetela.
"
"zwiimiswa hezwi zwi wanala fhaḽa kapa vhubvaḓuvha (46), free state (16), gauteng (25), kwazulunatal (56), li mpopo (54), mpumalanga (27), devhula kapa (rathi), devhula vhukovhela (26) khathihi na kapa vhukovhela (90).
","tona ti kumeka ekapavuhumadyambu (46), free state (16), gauteng (25), kwazulunatal (56), li mpopo (54), mpumalanga (27), kapan'walungu (tsevu), n'walunguvupeladyambu (26) na kapavupeladyambu (90).
"
"thaidzo dza u thutha thumbu nga nḓila ine ya si vhe mula yoni mulangi o tou farelaho wa mutakalo wa vhana na vhafumakadzi kha muhasho wa mutakalo wa ngei kwazulunatal, vho phalanndwa muṱhuphei, vha ri vhafumakadzi vha nga ṱangana na thaidzo nnzhi dzo fhambanaho musi vha tshi khou thutha thumbu kiḽiniki ya u thutha thumbu ine ya si vhe mulayoni.
","mipfilungano ya nxixo lowu nga riki enawini mulawuri wo khomela wa rihanyo ra vana va va ntswedyana na vavasati eka ndzawulo ya rihanyo ya kwazulunatal, phalanndwa muthuphei, u vula leswaku vavasati va nga langutana na mipfi lungano yo tala loko va endla nxixo etliliniki ya nxixo leyi nga riki enawini.
"
"""thaidzo dzine dza nga vha hone nga khathihi zwenezwo musu hu tshi khou thuthwa thumbu ndi dzi fanaho na u bvesa malofha, u kheruwa ha mbumbelo, u huvhala nga maanḓa henefho kha vhu dzimu na kha muvhili, u kavhiwa nga zwitzhili nga ngomu muvhilini khathihi na u vha na mulimo kha malofha.
","""mipfilungano ya xihatla yi katsa ku huma ka ngati ko tikisa, ku handzuka nomu wa xivelekelo, ku vaviseka ko tikisa ka swirho swa rimbewu na byeke, ntluletavuvabyi wa le ndzeni wa byeke na nchefuhato wa ngati.
"
"""nga murahu ha tshifhinga tshilapfu, vhafumakadzi vha nga wana hu tshi vha na u engedzea zwiṱuku ha khombo ya u sa u beba, thumbu ine ṅwana a vha a songo dzula fhethu ho teaho, u huma nḓila kana u vhofholowa tshifhinga tshi sa athu swika kana lwone lufu,"" vha ralo vho muṱhuphei.
","""eka nkarhi wo leha, vavasati va nga langutana ni nxungeto lowu tlakukekenyana wa ku nga kumi vana, vuyimana bya le handle ka xivelekelo, ku onhakeriwa hi ndzhwalo kumbe ku veleka masiku ma nga si fika kumbe hambi rifu,"" ku vula muthuphei.
"
"""vhafumakadzi vha nga dovha hafhu vha vha na thaidzo ya muhumbulo nga mulandu wa u thutha thumbu hu songo tsirele dzeaho nahone hune ha si vhe mulayoni zwine hezwi zwa katela mutsiko wa muhumbulo wo kalulaho wo vhangwaho nga masiandaitwa a u thutha thumbu, mutsiko khathihi na thaidzo dza u sa kona u tshila na vhaṅwe vhathu.
","""vavasati va nga tlhela va karhatiwa hi switandzhaku swa le moyeni hikwalaho ka nxixo lowu nga riki enawini, lowu nga hlayisekangiki, lowu katsaka mpfilungano wa mabibi ya mbilu ya le ndzhaku ka ku vaviseka, ntshikelelamiehleketo na swiphiqo swo hanyisana na vanhu.
"
"""zwa u thutha thumbu zwi songo tsireledzeaho zwi nga dovha hafhu zwa ita uri hu vhe na masia ndaitwa ane a si vhe avhuḓi kha zwa matshilele na tshiimo tsha zwa masheleni kha vhafumakadzi, vhana, miṱa khathihi na tshitshavha,"" vha ḓadzisa ngauralo.
","""mixixo leyi nga hlayise kangiki yi nga tlhela yi katsa mikhumbo ya swa vanhu na ikhonomi yo homboloka ehenhla ka vavasati, vana, mindyangu na miganga,"" a engetela.
"
"nḓila dza u thutha thumbu dzi re mula yoni vho muṱhuphei vha ri vhafumakadzi vhane vha ṱoḓa u thutha thumbu vha na nḓila dzo tsireledzeaho nahone dza mahala dzine vha nga nanga khadzo musi vha tshi ṱoḓa u ita ngauralo dzikiḽiniki na zwibadela zwa muvhuso.
","ku hlawula tindlela ta nxixo lowu nga enawini muthuphei u vula leswaku vavasati lava va lavaka ku herisa vuyimana bya vona va ni tindlela to hlawula leti hlayisekeke na ku va ta mahala ku swi endla eka titliliniki na swibedhlele swa mani na mani.
"
"""zwa u tou ḓinangela nḓila ine wa funa u i dzhia musi u tshi ṱoḓa u thutha thumbu zwi tea u vha hone, nahone nḓila hedzi dzoṱhe ndi dzine dza tea u itwa nga dokotela o pfumbudzwaho nahone a re na tshenzhemo kana nese o zwi gudelaho,"" vha ḓadzisa ngauralo.
","""nhlawulo wa tindlela wu fanele ku kumeka, leti hinkwato ka yona ti bohekaka ku endliwa hi dokodela loyi a leteriweke na ku va na ntokoto kumbe muongori wa xiphurofexinali,"" a engetela.
"
"nḓila idzo dzine dza nga vha u thutha thumbu nga u shumisa mishonga kana muaro, dzi ya ngauri uyo mufumakadzi u na tshifhinga tshingafhani o vhifha muvhilini.
","tindlela leti, ku nga va ta nxixo wa vutshunguri kumbe wa vuhandzuri, ti leteriwa hi leswaku vuyimana bya wansati loyi byi lehe kufika kwihi.
"
"zwa u thutha thumbu nga u shumisa mishonga, zwine zwa katela u nwa tshaka mbili dza philisi dza u thutha thumbu, zwi nga itwa u vhuya u swika kha vhege ya vhuṱahe ya u vhifha muvhilini.
","nxixo wa vutshunguri, lowu wu khumbaka ku nwa swikatsa swimbirhi swa tiphilisi ku herisa vuyimana, swi nga end liwa kufika eka kaye wa mavhiki ya vuyimana.
"
"""mulwadze u ḓo konaha u thutha thumbu iyo e hayani, hu si kiḽiniki kana sibadela,"" vha ralo vho muṱhuphei.
","""endzhaku ka swona muvabyi u ta xixa n'wana wa le ndzeni a ri ekaya naswona ku nga ri etlilini ki kumbe exibedhlele,"" ku vula muthuphei.
"
"u thutha thumbu nga muaro zwone zwi itwa nga nese o redzhisiṱariwaho (u swika kha vhege dza 12) kana nga dokotela (u bva kha vhege dza 12 u ya kha dza 30).
","mixixo ya vuhandzuri yi endliwa hi muongori loyi a tsariseke (kufika eka 12 wa mavhiki) kumbe hi doko dela (kusuka eka 12 kufika eka 20 wa mavhiki).
"
"u ya nga mulayo wa tsheo ya u thutha thumbu wa vhu 92 wa ṅwaha wa 1996, u thutha thumbu zwi nga dovha hafhu zwa itwa kha vhege ya vhu 13 u ya kha ya 20 arali dokotela, nga murahu ha u kwamana na mufumakadzi uyo o vhifhaho muvhilini, a tshi tenda uri: u bvela phanḓa na thumbu iyo zwi nga vha na khombo kha mutakalo wa muhumbulo kana wa muvhili wa mufumakadzi uyo.
","hi ku ya hi nawu wa nhlawulo hi mayelana na heriso wa vuyimana wa no ya 92 wa 1996 (nawu lowu), nxixo wu nga tlhela wu endliwa kusuka eka 13 wa mavhiki kufika eka 20 wa mavhiki loko dokodela, endzhaku ka ku kaneri sana na wansati loyi a tikeke, a tshemba leswaku: vuyimana lebyi yisiwaka emahlweni byi tisa nxungeto wa ku vaviseka eka rihanyo ra le mirini kumbe ra le miehleketweni ra wansati loyi.
"
"hu na khombo khu lwane ya uri ṅwana a nga vhaisala kana a holefhala zwihulwane muvhilini kana muhu mbuloni.
","ku na nxungeto wo tivikana lowu n'wana wa le ndzeni a nga ta karhatiwa hi wona hikwalaho ka vulamari bya le mirini kumbe bya le miehleketweni byo tikisa.
"
"thumbu yo ḓa nga nṱhani ha u tambudzwa lwa vhudzekani kana nga shaka ḽa tsinisa.
","vuyimana lebyi tumbu lukeke kusuka eka mpfinyo kumbe masangu ya maxaka.
"
"u bvela phanḓa na thumbu yeneyo zwi nga kwama zwihulwane kutshilele na tshiimo tsha zwa masheleni tsha mufumakadzi onoyo.
","vuyimana lebyi yisiwaka emahlweni byi ta khumba hi ndlela yo tivikana swiyimo swa vanhu kumbe ikhonomi swa wansati loyi.
"
"u thutha thumbu zwi nga dovha hafhu zwa itwa nga murahu ha vhege ya vhu20 arali dokotela nga murahu ha u kwamana na nese a shumaho u bebisa o redzhisiṱariwaho, a tshi tenda uri u litsha thumbu iyo zwi nga vhea vhutshilo ha mufumakadzi uyo khomboni, zwi nga sia ṅwana uyo a tshi vha na tshivhumbeo tshi si tshavhuḓi kana zwi tshi nga sia hu na khombo ya u huvhala ha ṅwana onoyo.
","nxixo wu nga tlhela wu endleka endzhaku ka vhiki ra vu20 loko dokodela, endzhaku ko kanerisana na sungukati leyi tsariseke, a tshemba leswaku vuyimana lebyi yisiwaka emahlweni byi ta nghenisa vutomi bya wansati loyi ekhombyeni, byi vanga ku vumbeka ko homboloka ko tikisa ka n'wana wa le ndzeni kumbe byi tisa nxungeto wa ku vaviseka eka n'wana wa le ndzeni.
"
"u ya nga mulayo, vhafumakadzi vhoṱhe, naho arali vha na miṅwaha ya fhasi ha ya 18, vha na pfanelo ya u thutha thumbu.
","hi ku ya hi nawu lowu, vavasati hinkwawo, hambiloko va ri xihlangi xa le hansi ka malembe ya 18, va na mfanelo ya ku herisa vuyimana.
"
"a vha ṱoḓi thendelo u bva kha vhabebi kana vhaunḓi vhavho.
","a va lavi mpfumelelo kusuka eka vatswari kumbe muhlayi si wa vona.
"
"u ya nga vha muhasho wa mutakalo wa vunḓu ḽa kapa vhukovhela, arali muthu uyo a tshi kha ḓi vha ṅwana, u ḓo eletshe dzwa uri a ambe na muthu muhulwane ane a mu fulufhela na uri a ḓe na muṅwe muthu musi a tshi ya u thutha thumbu.
","hi ku ya hi ndzawulo ya rihanyo ya le kapavupeladyambu, loko u ri xihlangi, u ta tsundzuxiwa ku vulavula na munhu lonkulu loyi u nga n'wi tshembaka na ku ta na munhu un'wana eka nkarhi wa wena wa ku vonana.
"
"fhedziha, naho zwo ralo, a ni tei u sokou thutha thumbu.","hambiswiritano, a wu boheki ku endla tano."
