"sedert die uitbreek van die kovid19pandemie, het suidafrika $2 miljard in befondsing van die nuwe ontwikkelingsbank onder die kovid19noodfinansie ringsprogram ontvang om die pandemie te bestry en om ekonomiese herstel te steun.
","go tloga mola go bago le leuba la covid19 , afrika borwa e amogetše r28 pili one go tšwa go pankatlhabollo ye mpsha ka fase ga lenaneo la dikadimo la tšhoganetšo la covid19 ka nepo ya go lwantšha leuba le go thekga leano la rena la tsošološo ya ekonomi.
"
"daar was ook beduidende samewerking met ons bricsvennote om persoonlike beskermende toerusting te bekom, asook ten opsigte van die toegang tot en versprei ding van entstof.
","go bile gape le tirišano ye kgolo le badirišani ba rena ba brics gore re hwetše ditlabelo tša boitšhireletšo malwetšing le tirišano mabapi le phihlelelo ya meento le go e aba.
"
"ons het onlangs deel geneem aan die 13de bricsspitsberaad waar bricslande ooreengekom het om nog nouer saam te werk om kovid19 te bestry en om die politieke en finansi ële hulpbronne te mobiliseer wat nodig is vir toekomstige pandemiegereedheid.
","mo nakong ye e sa tšwago go feta re kgathile tema ka go seboka sa bo 13 sa brics, fao dinaga tša brics di dumelelanego go maatlafatša tirišano mabapi le go lwantšha covid19 le go hlohleletša thekgo ya tša sepolotiki le methopo ya ditšhelete yeo e hlokagalago go arabela go itokišetša mauba a ka moso.
"
"dit behels die ves tiging van n virtuele bricsentstofnavorsingen ontwikkelingsentrum asook n geïntegreerde vroeë waarskuwingstelsel om toekomstige uitbrekings van aansteeklike siektes in bricslande te voorspel.
","se se akaretšwa go hlongwa ga lekala la bitšhuale la brics la dinyakišišo le tlhabollo ka ga meento le lenaneo leo le kopantšwego la temošo ya ka pela la brics ka nepo ya go akanya go phulega ga malwetši a go fetela a ka moso.
"
"nog n belangrike gebied van ooreenkoms was die wedersydse erkenning van nasionale dokumente oor inenting en stelsels vir kovid19toetse — wat noodsaaklik sal wees vir oorgrensreise in die toekoms.
","lekala le lengwe le bohlokwa leo go dumelelanwego ka lona ebile mabapi le go amogela dingwalwa tša go hlatsela gore batho ba entetšwe tša dinaga tšeo le mananeo a diteko tša covid19 – e lego seo se tlago ba bohlokwa go maeto a go etela ka dinageng tše dingwe ka moso.
"
"die begrip van wedersyds voordelige same werking sal veral belangrik wees in die globale ekono miese herstelplanne waar ongelyke ontwikkeling beteken dat sommige lande vinnig sal herstel en ander agter sal raak.
","kgopolo ya tirišano yeo e holago bohle e tla ba bohlokwa kudu ka go tsošološo ya ekonomi ya lefase, fao e lego gore tlhabollo yeo e sa lekalekanego e rago gore dinaga tše dingwe di tla kgona go tsošološa diekonomi tša tšona ka pela, mola e le gore tše dingwe di tla šalela morago.
"
"ter ondersteuning van ekonomiese herstel, het die bricsvennote ooreengekom om hulle samewerking te ver stewig in katalitiese sektore soos energie, it, wetenskap, tegnologie en innovering, landbou en die groen eko nomie.
","go thekga tsošološo ya eko nomi ya dinaga tše, dinaga tša brics di dumelelane go maatlafatša tirišano ka maka leng ao a nago le tlhohleletšo ya tsošološo ya ekonomi a go swana le la mohlagase, theknolotši ya tshedimošo, mahlale, theknolotši le boitlha melo, temo le ekonomi ya tša tikologo.
"
"dit is almal belangrike sektore wat geïdentifiseer is in ons ekonomiese heropbouen herstelplan wat verlede jaar aangekondig is.
","makala a ka moka a hlathilwe bjalo ka a bohlokwa ka go leano la kagoleswa le tsošološo ya ekonomi leo le tsebagaditšwego ngwageng wo o fetilego.
"
"samewerking met ander bricslande, veral op die terrein van innovasienavors ing, sal help om ons land se industrialisasie te versnel en om ons doelwitte vir die vierde nywerheidsom wenteling te bereik.
","go dirišana le dinaga tše dingwe tša brics, kudukudu ka go lekala la dinyakišišo tša boitlhamelo, go tla thuša go akgofiša tlhomo ya diinta steri ka nageng ya rena le go re thuša gore re fihlelele ditlholo gelo tša rena tša lebakanako la tirišo ya theknolotši go dira mešomo.
"
"in dié verband is samesprekings oor die vorming van formele bricsplatforms gehou om beste praktyk, kennis en kun digheid te deel, insluitend die gebruik van oopbrontegnolo gieplatforms.
","mabapi le se, dipoledišano di ile tša swarwa mabapi le go hlama makala a semmušo a brics ka nepo ya go abe lana mekgwa ya ditiro tše kaone, tsebo le bokgoni, go akaretšwa go šomiša makala a theknolotši ya methopo wa phatlalatša.
"
"die bricsvennote het saamgestem dat ontwikke lende lande hulp nodig het om die vn se volhoubare ontwikkelingsdoelwitte te bereik, en dat skenkerlande hulle verantwoordelikhede in dié verband moet nakom.
","badirišani ba brics ba dumelelane gore dinaga tšeo di hlabollogago di hloka thušo ya gore di fihlelele dinepo tša tlhabollo ya go ya go ile tša mokgatlo wa dinagakopano (un), le gore dinaga tšeo di tshepišitšego go thekga dinaga tšeo di hlabollogago di swanetše go hlompha ditshepišo tša tšona tabeng ye.
"
"dit is veral belangrik in die konteks van klimaatsaksie.
","se se tloga se le bohlokwa ka seemong sa go tšea magato mabapi le tlelaemete.
"
"soos die meeste lande, wil suidafrika n laekoolstof ontwikkelingspad volg, wat inklusief en volhoubaar is en wat ons status as n ontwik kelende land in ag neem.
","go swana le dinaga tše ntši, afrika borwa e nyaka go fihlelela seemo sa tšweletšo ya khapone ye nnyane seo se akaretšago bohle, sa go tšwela pele go ya go ile le seo se hlokometšego maemo a rena bjalo ka naga yeo e hlabo llogago.
"
"die brics se samewerkingsplat form vir energienavorsing sal baie nuttig wees soos ons poog om ons energiehulp bronne te diversifiseer.
","lekala la tirišano ka ga dinyakišišo tša enetši la brics le tla ba le bohlokwa ge re tšea matsapa a go faro loganya methopo ya rena ya enetši.
"
"in die elf jaar sedert ons by brics aangesluit het, het ons lidmaatskap ons nasionale belang aansienlik bevorder.
","mo mengwageng ye lesome tee go tloga mola re tsenelago mokgatlo wa brics, boleloko bja rena bo tšweditše pele kudu dikgahlego tša rena tša bosetšhaba.
"
"deur n lid van brics te wees het ons posisie as n belangrike opkomende ekonomie bevor der.
","go ba leloko la brics go maatlafaditše maemo a rena bjalo ka eko nomi ye bohlokwa yeo e hlabollogago.
"
"dit het ons toegang gegee tot beleidsen tegniese kun digheid van groter en meer gevestigde ekonomieë, asook toegang tot die ondersteu ning van die nasionale ontwikkelingsbank.
","se se re file phihlelelo go bokgoni bja tša tlhamo ya melawana le go tša sethe kniki tša dinaga tša ekonomi tše kgolo le tšeo di šetšego di hlabollogilego, gammogo le phihlelelo go thekgo ya pa nkatlhabollo ya bosetšhaba.
"
"dit het ons aktivisme op die wêreld verhoog versterk, veral wat betref die hervorming van multilaterale instellings.
","se se maatlafaditše go kgatha tema ga rena ka mafolofolo seemong sa lefase ka bo phara, kudukudu mabapi le peakanyoleswa ya dihlongwa tša dinaga tše ntši.
"
"ons het ook voordeel getrek deur deel te wees van n kollek tiewe stem wat daarna streef om n wêreldorde te bevorder wat gebaseer is op weder sydse respek en die gelyke soewereiniteit van nasies.
","re holegile go ba karolo ya seboka seo se nyakago go tšwetša pele toka ya lefase go lebeletšwe tlhomphano le boipušo bjo bo lekalekanego bja dinaga.
"
"brics is, en sal nog vir n geruime tyd in die afsienbare toekoms, van onskatbare strategiese belang vir ons land wees.","brics e bohlokwa kudu go togamaano ka mo nageng ya rena, ebile e tla tšwela pele go ba bjalo le mo nakong ye e tlago."
"korrupsie in die staatsdiens moet stop vukuzenzele unnamed die onlangse onthul ling in die parle ment dat duisen de staatsamptenare elke maand onwettig maatskap like toelae ontvang, bewys dat ons nog n lang pad het om te stap om n kul tuur van werksetiek in die staatsdiens te vestig.
","go fediša bomenetša ka mmušong vukuzenzele unnamed kutollo ye e tšwe letšego ka pala menteng ya gore dikete tša bašomi ba mmušo ba dutše ba amo gela mphiwafela wa leago kgwedi ye nngwe le ye nngwe e bontšha gore re sa le kgole le go fihlelela setšo sa maitshwaro a mabotse ka mmušong.
"
"vroeër vanjaar is daar ook bevind dat meer as 16 000 werknemers in diens van die staat onreëlmatige uit betalings van die spesiale kovid19 maatskaplike noodverligtingstoelaag ont vang het.
","pejana ngwageng wo, go hweditšwe gape gore bašomi ba e ka bago 16 000 bao ba lego lenaneong la megolo la bašomi ba mmušo ba lefilwe mphiwafela wa masetlapelo wa kimollo ya leago wa covid19 ntle le maswa nedi.
"
"dit is algemeen bekend dat mense wat om hierdie toelaag aansoek doen terwyl hulle wel n ander bron van inkomste het, nie vir die toelaag kwalifiseer nie.
","ga go na yo a sa tsebego gore bakgopedi bao ba nago le mohuta ofe goba ofe wa letseno ga ba na maswanedi a go amogela mphiwafela wo.
"
"dit is ook vanselfsprekend dat mense wat n inkomste vanaf die staat ontvang, nie in aan merking kom om vir hierdie toelaag aansoek te doen nie.
","gape ga go na yo a sa tsebego gore bao ba amogelago le tseno go tšwa mmušong ga se ba swanela go dira dikgopelo tša mphiwafela wo.
"
"en tog het hulle.
","eupša le ge go le bjalo bašomi ba ba dirile dikgopelo.
"
"sowat 17 000 mense werksaam by die staat, op beide nasionale en provinsiale vlak, het aansoeke ingedien met die doel om hul salarisse aan te vul met geld wat vir die behoeftiges bestem is.
","batho ba bangwe ba 17 000 bao ba thwetšwego mmušong wa profense le wa bosetšhaba ba rometše dikgopelo tša mphiwafela, lebaka e le gore ba oketše mogolo wa bona ka tšhelete ya bahloki.
"
"gegewe die omvang van armoede in ons land, iets waarvan ons staatsamptenare maar ál te bewus is, is hierdie doelbewuste diefstal uit die staatskoffers onvergeeflik.
","ge re lebelela ka moo batho ba hlokago ka gona ka nageng ya rena, selo seo bašomi ba rena ba mmušo ba se tsebago gabotse, taba ye ya go tšwela pele go utswetša mmušo e ka se kgotlelelwe.
"
"die staat is nou besig om streng stappe te neem om hier die soort misbruik teen te kant en sal korte mette maak van enige staatsamptenare wat hul skuldig maak aan sulke misdade.
","mmušo gonabjale o ma tlafatša maitapišo a wona a go thibela mokgwa wo wa tlhorišo gomme o tšea magato go mang goba mang ka mmušong yo a dirago tšeo di se a lokago.
"
"die staat het onlangs n nuwe eenheid vir etiek, integriteit en dissiplinêre tegniese bystand in die openbare administrasie gestig.
","kguaswanyane, mmušo o thakgotše lekala la taolo ya setšhaba la maitshwaro, bo tshepegi le thušo ya semmušo ya kgalemo.
"
"die eenheid sal kapasi teit ontwikkel onder openbare instansies om dissiplinêre aksies van stapel te stuur in gevalle van wangedrag en sal met ander staatsinsellings saamwerk om diegene wat hulle aan ongerymdhede skul dig maak, tot verantwoording te bring.
","lekala le tla aga bokgoni mekgatlong ya setšhaba go thoma ka ditshepedišo tša kgalemo ge go na le ditiragalo tša go hloka maitshwaro a mabotse gomme la šomišana le makala a mangwe a mmušo go rweša bao ba nago le molato mai karabelo.
"
"die eenheid sal kor rupsiesake na die staat se teenkorrupsietaakmag verwys en opvolg met depar temente om seker te maak dat kriminele sake waarby staatsamptenare betrokke is, tot dissiplinêre aksie lei.
","lekala le tla iša melato ya bomenetša go sehlopha sa mošomo sa kgahlanong le bomenetša sa mmušo gomme la latišiša le dikgoro go kgonthiša gore melato ya bosenyi yeo e amago bašomi ba mmušo e fetolelwa go melato ya kgalemo.
"
"die eenheid sal saam met die multiagentskap fusion centre werk om werknemers betrokke in prioriteitsake wat deur die wetstoepassingso werhede ondersoek word, te identifiseer.
","go šoma le senthara ya kopano ya mekgatlo ye mentši, lekala le tla thuša go utolla bašomi bao ba nago le melato ye megolo gore ba nyakišišwe ke maphodisa.
"
"die eenheid sal die leefstyl oudits op staatsamptenare monitor.
","lekala le tla lekola go dirwa ga ditlhakišo tša ka moo bašomi ba mmušo ba phelago ka gona.
"
"waar departemente korrupsie en onverklaarbare welgesteldheid identifiseer, sal die sake na die suidafri kaanse polisiediens verwys word.
","moo dikgoro di uto llago bomenetša le mahumo ao a sa hlalošegego, melato e tla išwa go tirelo ya mapho disa a afrika borwa.
"
"die nuwe eenheid het reeds in alle erns skouer aan die wiel begin sit en help om staatsamptenare te identifiseer wat betrokke is in sake wat met kovid19verkrygingsbedrog, asook bedrog rakende die spesiale kovid19toelaag en die werkloosheidsversekerings fonds, verband hou.
","lekala le lefsa le šetše le thomile mošomo wa lona go tsenelela, le go thuša go utolla bašomi ba mmušo bao ba amegago melatong ya bomenetša bjo bo leba nego le dithendara tša go reka didirišwa tša tšhireletšo tša covid19 , kabo ya mphi wafela wa go ikgetha wa covid19 le sekhwama sa inšorense ya batho bao ba feletšwego ke mešomo.
"
"sake waar staatsamptenare deur die spesiale onder soekeenheid vir dissiplinêre aksie verwys is, sal deur die eenheid gemonitor word om hierdie sake se vordering te volg.
","melato ya bahlankedi ba mmušo yeo e laodišitšwego ke lekala la dinyakišišo la go ikgetha gore go tšewe magato a kgalemo e tla lekolwa ke lekala le go ela tšwelopele ya yona.
"
"nog n belangrike deel van die eenheid se werksaam hede sal wees om etiek en integriteit in die range van die staatsdiens te vestig.
","karolo ye nngwe ye bohlokwa ya mošomo wa lekala e tla ba go ikgafa go maitshwaro le botshepegi mo maemong a mmušo.
"
"n paar staatsamptenare het oor die jare heen die standpunt ingeneem dat dit toelaatbaar is om uitermate voordeel te trek uit die staat of om besigheid met die staat te doen, hetsy deur hulself of hul vriende en familie, mits daar niks onwet tig plaasgevind het nie.
","bašomi ba mmalwa ba mmušo mo mengwageng ba be ba tšea gore go lokile go dira kgwebo le mmušo goba go holega go tšwa go mmušo go dumeletšwe go bona, ba gwera ba bona le go malapa a bona, ge fela ba sa tshele molao.
"
"ons moet alles binne ons vermoë doen om hierdie houding tot niet te bring.
","re swanetše go dira se sengwe le se sengwe go fetola mokgwa wo.
"
"waar ons daaraan werk om korrupsie hok te slaan, moet ons eweneens fokus op die vestiging van etiese gedrag, want dinge wat nie nood wendig onwettig is nie, kan oneties of onbetaamlik van n staatsamptenaar nie.
","ge re šoma go fediša bomenetša, go swanetše go ba le nepo ya go lekana go ruteng maitshwaro a mabotse, ka gore seo e ka se bego go tshela molao e ka ba seo se hlokago maitshwaro a mabotse le go se be maleba go mošomi wa mmušo.
"
"die nuwe eenheid sal norme en standaarde met betrekking tot etiek, integriteit en gedrag instel.
","lekala le lefsa le tla bea ditlwaedi le mekgwa go maitshwaro a mabotse, bo tshepegi le taolo.
"
"dit sal ook die kapasiteit van departemente ontwik kel om amptenare wat aan wangedrag skuldig bevind word, te dissiplineer.
","le tla aga gape bokgoni bja dikgoro go kgalema bahlankedi bao ba hwetšwago molato wa mai tshwaro a mabe.
"
"laasjaar is meer as 200 werknemers opgelei as inligtingsbeamptes en inleiers.
","ngwaga wa go feta bašomi ba go feta 200 ba hlahlilwe bjalo ka bahla nkedi ba taolo le bahlami.
"
"die bou van n etiese, bekwame staatsdiens bly steeds n fokuspunt van dié administrasie.
","go aga mmušo wa maitshwa ro a mabotse, wa bokgoni e sa le nepo ya mmušo wo.
"
"soos ons kan sien uit n hele paar skandale die afgelope paar jaar waar staatsampte nare onwettig voordeel getrek het uit die regering, sal hier die proses moeilik wees en n hele ruk neem.
","bjalo ka ge go bontšhitše dikgobogo tše mmalwa tšeo di amago bašomi ba mmušo bao ba holegago moo go sego molaong go tšwa mmušong, tshepetšo e tla ba bothata gape e tla tšea nako.
"
"ons is egter vasbeslote om hierdie doelwit te bereik.
","le ge go le bjalo re ikgafetše go tšwela pele ka se.
"
"n bekwame staat dien as die fondasie om ons nasionale prioriteitsdoelwitte te bereik.
","mmušo wa bokgoni ke motheo wa go fihlelela tše bohlokwa tša rena ka moka tša bosetšhaba.
"
"sonder om verantwoordbaar heid te verskerp en etiese gedrag te bevorder, sal hierdie doelwitte buite bereik bly.
","ka ntle le go kaonafatša maikarabelo le go godiša mokgwa wa mai tshwaro a mabotse, ga go na seo se tla fihlelelwago.
"
"die oorgrote meerderheid staatsamptenare is pligsge trou, verbind tot etiese gedrag en wetsgehoorsaam.
","bontši bja bašomi ba rena ba mmušo ba ikgafile, gape ba latela molao ebile ba na le maitshwaro a mabotse.
"
"die taak wat ons voorlê is om saam te werk om daardie staatsamptenare wat nie hier die waardes volg nie, uit die staatsdiens te verwyder en die wanbegrip dat almal wat in diens van die staat korrup of selfsugtig is, reg te stel.
","mošomo wo re lebanego le wona ke go šoma mmogo go tloša bao ba se nago mohola le maitshwaro a mabotse, le go phošolla kgopolo ye e fošagetšego ya gore ka moka bao ba thwetšwego ka mmušong ba itebeletše ba le tee goba ba na le bomenetša.
"
"ek doen n beroep op die mans en vroue wat ons land elke dag dien om opnuut hulself te verbind tot die waar des van onbaatsugtigheid en diens, en om te onthou dat hul gedrag ten alle tye beide wettig en eties moet wees.
","re ipiletša go banna le basadi bao ba šomelago naga ya rena letšatši le lengwe le le lengwe go ikgafa lefsa go dikgopolo tša go se itebelele ba le tee le go ditirelo, le go gopola gore mekgwa ya bona e swanetšwe go ba molaong ka dinako ka moka gape e be ya maitshwaro a mabotse.
"
"die vestiging van hierdie eenheid is net nog een van die maniere waarop ons hard werk om korrupsie in die rege ring en, inderwaarheid, in alle sfere van ons land se daaglikse bestaan, wil uitroei.",go thongwa ga lekala le ke tsela ye nngwe ya mekgwa yeo re šoganago le yona go fediša bomenetša ka mmušong le dikarolong ka moka tša bo phelo bja maafrika borwa.
"kovid19 korrupsieplegers ry aan die pen vukuzenzele unnamed individue en maatskappye wat betrokke was in die pleeg van korrupsie te make met die regering se verkryging van koronavirus toerusting en dienste, gaan verantwoordbaar gehou word vir hul optrede.
","badirabosenyi ba bomenetša mabapi le covid19 ba golegilwe vukuzenzele unnamed batho le dikhamphani tšeo di bego di kgatha tema ka bomenetšeng bja go amana le dithentara tša mmušo tša mabapi le ditlabelo le ditirelo tša bolwetši bja coronavirus (covid19) ba rwešwa maikarabelo go ditiro tša bona.
"
"die spesiale ondersoekeenheid (soe) se finale verslag oor hul ondersoek na aantygings verwant aan die misbruik van kovid19fondse, regoor alle regeringsfere en die privaat sektor, se vrystelling aan die publiek is onlangs deur president cyril ramaphosa goedgekeur.
","pego ya mafelelo ya lekala la dinyakišišo tšeo di ikgethilego (siu) ka ga dinyakišišo tša lona mabapi le dipelaelo ka ga tšhomišobošaedi efe goba efe ya ditšhelete tša covid19, go ralala le makala a mmušo le a phraebete ka moka e sa tšwa go dumelelwa ke mopresidente cyril ramaphosa gore e lokollwe e fiwe setšhaba.
"
"die verslag is n belangrike stap in die stryd teen korrup sie en wanadministrasie in die staaten privaatsektors, het hy gesê.
","pego ye ke kgato ye bohlokwa ka ntweng kgahlanong le bomenetša le tšhomišobošaedi ya ditšhelete ka lekaleng la mmušo le la phraebete, a realo.
"
"president ramaphosa het die ondersoek deur die soe in julie 2020 gemagtig.
","ka mosegamanye 2020, mopresidente ramaphosa o ile a dumelela gore siu e dire dinyakišišo.
"
"destyds het hy hom daartoe verbind dat indien die soe bewyse sou vind dat kriminele oortreding plaasgevind het, die bewyse aan die nasionale vervolgingsgesag (nvg) oorhandig sou word.
","ka yona nako yeo, o ile a tshepiša gore ge siu e hweditše bohlatse bja gore molato wa bosenyi o dirilwe, e tla gapeletšega go romela bohlatse bjoo go tirelotaolo ya bosekiši ya bosetšhaba (npa).
"
"die soe is ook gemagtig om siviele regsaksies in te stel om enige skade of verliese wat deur die staat gely is, te herwin.
","siu e ile ya fiwa maatla a go phethagatša ditshepedišo tša melato ya bosenyi gore go hwetšwe ditšhelete go ditshenyo goba go ditahlegelo tšeo di hweditšwego ke mmušo.
"
"bevindinge van die verslag die soe het 5 467 kontrakte ter waarde van r14.3 miljard wat aan 3 066 diensverskaffers toegestaan is, ondersoek.
","tšeo pego e di utollotšego siu e nyakišišitše dikonteraka tše 5 467 tšeo di abetšwego baabi ba ditirelo ba 3 066, tše di bitšago palomoka ya r14.3 pilione.
"
"die ondersoek na 4 549 kontrakte is gefinaliseer en2 803 hiervan is as onreëlma tig bevind.
","dinyakišišo mabapi le dikonteraka tše 4 549 di phethilwe, gomme tše 2 803 tša tšona di hweditšwe di se molaong.
"
"dit behels 62% van die afgehandelde ondersoeke.
","se se fihla go 62% ya dinyakišišo tše di phethilwego.
"
"""dié ondersoek is gemik op individue en instellings wat geglo het dat hulle n oomblik van nasionale weerloosheid kon uitbuit om hulself te verryk asook diegene met wie hulle saamgesnoer het om die staatskas te misbruik,"" het die president gesê.
","""dinyakišišo tše di be di nepišitše batho le dihlongwa tšeo di bego di dumela gore di ka šomiša bošaedi seemo sa bosetšhaba sa go ba kotsing ka nepo ya go ikhumiša le go homiša bao ba dirišanago le bona go šomiša ditšhelete tša mmušo bošaedi,"" mopre sidente a realo.
"
"hy het bygevoeg dat dit onaanvaarbaar is dat soveel kontrakte wat gemik was op die red van lewens en die beskerming van mense se lewensbestaan onreëlmatig, onwettig en bedrieglik was.
","o tlaleleditše ka gore ga go amogelege gore diko nteraka tše ntši ka tsela ye tšeo di amanago le go phološa maphelo le go šireletša go iphediša ga batho di ka be di abilwe ka fao go sa amogelegego, di se molaong goba di le tša bomenetša.
"
"""dié ondersoek demonstreer ons vasberadenheid om korrupsie met wortel en tak uit te roei en met oortreders klaar te speel,"" het president ramaphosa gesê.
","""dinyakišišo tše di bontšha boikgafo bja rena bja go tumola bomenetša ka medu le go šomana le badirabosenyi,"" gwa bolela mopresidente ramaphosa.
"
"die finale verslag bevat besonderhede oor sake wat die soe na die nvg, departemente en entiteite in die staatsektor asook ander partye verwys het.
","pego ya mafelelo e bolela ka botlalo mabapi le melato yeo siu e e rometšego go npa, go dikgoro tša mmušo le go dihlongwa ka lekaleng la mmušo le go batšeakarolo ba bangwe.
"
"die nvg sal die proses om oortreders tot verantwoording te roep en swakpunte wat deur die soe geïdentifiseer is, te finaliseer, het die president verduidelik.
","npa e tla pheta tshepedišo ye ya go golega badirabosenyi le go rarolla mafokodi ao a bonwego ke dinyakišišo tša siu, mopre sidente a hlaloša bjalo.
"
"stappe wat gedoen is sedert die begin van die ondersoek het die soe, in samewerking met ander agentskappe, die volgende vordering gemaak: 45 sake, met n gesamentlike waarde van r2.1 miljard, is aangegee by die spesiale beslissingsraad oor korrupsie, bedrog en ongeoorloofde geldvloei.
","kgato ye e tšerwego go tloga mola go thomišwago ka dinyakišišo, siu, ka go šomišana le ditheo tše dingwe, e bile le kgatelopele ye e latelago: melato ye 45, ya boleng bjo bo kopantšwego bja r2.1 pilione, e ngwadišitšwe le kgorotsheko ye e kgethegilego ya melato ya tša bomenetša, tsogolekobong le ditshepedišo tša ditšhelete ka fao go sego molaong.
"
"die spesiale beslissingsraad het n wetlike mandaat om staatsfondse wat deur middel van korrupsie, bedrog en ongeoor loofde geldvloei gesteel is, te herwin en siviele aksie teen die oortreders te neem; 224 sake is verwys vir dissiplinêre aksie teen amptenare in staatsdepartemente of entiteite; 386 sake is na die nvg verwys en drie is verwys vir aksie op uitvoerende vlak; 330 sake is vir administratiewe aksie verwys, insluitend plasing op die swartlys (nie toegelaat om vir die staat te werk nie).
","kgoro tsheko ye e kgethegilego e filwe mošomo wa semolao wa go hwetša ditšhelete tša mmušo tšeo di utswitšwego ka tsela ya ditiro tša bomenetša, tsogolekobong le ditshepedišo tša ditšhelete ka fao go sego molaong, le go phethagatša magato a tshekišo kgahlanong le badirabosenyi; melato ye 224 e rometšwe gore go tšewe magato a kgalemo kgahlanong le bahlankedi ba mmušo goba ba dihlongwa tše; melato ye 386 e rometšwe go npa, gomme ye meraro e rometšwe gore e tšeelwe sepheto ke kabinete; melato ye 330 e rometšwe gore e tšeelwe sepheto ke bolaodi ba ka mešomong, go akaretšwa go magato a dikiletšo (gore badirabosenyi ba se kgone go šomela mmušo).
"
"volgens die verslag moet n somtotaal van r551.5 miljoen (waarde van kontant en bates) nog herwin word, met r34.2 miljoen wat tot op hede herwin is.
","go ya ka pego ye, palomoka ya r551.5 milione (ya boleng bja kheše le dithoto) e tlo hwetšwa, mola r34.2 milione yona e šetše e hweditšwe go fihla mo lebakeng le.
"
"die ondersoek het n verlies van r114.2 miljoen verhoed en kontrakte ter waarde van r170.4 miljoene tersyde gestel.
","dinyakišišo tše di thibetše tahlegelo ya r114.2 milione, gomme tša emiša dikonteraka tša boleng bja r170.4 milione.
"
"die soe verwag dat dié sake tussen maart en april 2022 afgehandel sal wees, voor die inhandiging van n aanvullende verslag aan die president aan die einde van junie.
","siu e emetše gore melato ye e phethwe magareng ga hla kola le moranang 2022, pele ga ge go ka romelwa pego ya tlaleletšo go mopresidente mafelelong a phupu.
"
