"vukorhokeri bya mfumo bya xiphurofexinali vukuzenzele unnamed loko ndzi hlawuriwa eka xiyimo xa ku va phuresidente wa afrikadzonga, ndzi vule leswaku ku aka mfumo lowu nga tlangisiki swi pfuno, wa vuswikoti na ku va wa matikhomelo nene lowu nga hava vu kungundzwana a ku ri xo rhanga emahlweni eka swirhangana swa mina.
","imisebenzi kahulumeni eqeqeshekile vukuzenzele unnamed ngesikhathi ngiqo kelwa esikhundle ni sokuba umonga meli waseningizimu afrika, ngathi ukwakha umbuso osebenza kahle, okhonayo nonomthetho ongenayo inkohlakalo kwakungenye yezinto eziseqhulwini.
"
"ko va ntsena mfumo wa vuswikoti, lowu nga tlangi siki swipfuno, wa matikho melonene na ku va wu lava nhluvukiso ntsena wu nga kotaka ku humelerisa eka ku tinyiketela ku antswi sa vutomi bya vanhu va tiko leri.
","umbuso okhonayo, ose benza kahle, onomthetho noqhakambisa intuthuko kuphela ongakwazi ukufeza izibophezelo zokuthuthukisa izimpilo zabantu baleli lizwe.
"
"leswi swi vula leswaku vukorhokeri bya mfumo byi boheka ku va na vatirhi va vavanuna na vavasati lava va nga tiphurofexinali, lava nga na swikili, lava nga tilaveriki swa vona vini na ku va lava nga tshembeka.
","lokhu kusho ukuthi imi sebenzi kahulumeni kumele iqashe amadoda nabesifazane abawufundele umsebenzi, abanamakhono, abangaca bangeli bona bodwa futhi abaneqiniso.
"
"va boheka ku va va tinyike tela ku tiyisisa mikhuvanene ya vumbiwa, naswona va bo heka, tanihiloko ndzi vurile eka mbulavulo wa ku vekiwa exitulwini, ""va korhokela hi ku tshembeka xivangelo xa vaaki ntsena handle ka swin'wana"".
","kumele bazinikele ukupha kamisa amagugu omthethosi sekelo, futhi kumele, njengo ba ngangishilo enkulumweni yami yokugcotshwa, ""base benzele umphakathi ngoku thembeka kuphela"".
"
"eka mavhiki mambirhi lama nga hundza, mikanerisano ya vaaki a yi ri ku endlekeni eka dokhumente ya pholisi ya nkoka leyi yi nga ta nyika mafulufulu lamakulu eka matshalatshala ya hina ya ku seketela, ku tiyisa na ku nyika vuswikoti eka vuko rhokeri bya mfumo.
","emavikini amabili edlule, izingxoxo nomphakathi bezi qhubeka mayelana nomthe tho obalulekile ozonikeza umfutho omkhulu emizamwe ni yethu yokuqinisa, ukunike za amandla kanye nokunike za amakhono ezomsebenzi kahulumeni.
"
"rimba ra nsimeko ra rixaka ra mpfapfarhuto eka ku endla vukorhokeri bya mfumo byi va bya xiphurofexinali ri na xikongomelo xa ku aka mfumo lowu korhokelaka vanhu va ka hina ku antswa, lowu wu sirheleriweke eka ku nghenelela ka tipolitiki loku nga fanelangiki na laha ku thoriwa swi endliwaka hi ku ya hi mipimo yo ringanela.
","umthetho osadingidwa wohlaka lokuqaliswa ko kusebenza lukazwelonke ekuqeqeshekeni emisebe nzini yomphakathi uhlose ukwakha umbuso osebenze la kangcono abantu bakithi, ongenakho ukungenelela kwezepolitiki futhi lapho imisebenzi inikezwa ngoku faneleka.
"
"rimba leri ri pasisiwile hi khabinete hi hukuri lembe leri nga hela naswona mika nerisano ya xivumbeko na ti sekitara to hambanahambana ta vaaki yi le ku endliweni sweswi.
","uhlaka lwagunyazwa yi khabhinethi ngolwezi ngo nyaka owedlule futhi izi ngxoxo ezihlelekile nemikha kha yomphakathi eyehluka hlukene ziyaqhubeka njenga manje.
"
"makumembirhinkombo wa malembe eka xidemo kirasi, swi nga vuriwa hi vukorhokeri bya mfumo leswaku loko swikhwama swo hlayanyana swa kahle swinene swi ri kona, hi na mitlhontlho yo tivikana eka tindzawulo ta mfumo to tala hi mayelana na swikili, vuswikoti, na moya wa xi phurofexinali.
","iminyaka engamashumi amabili nesikhombisa yenta ndo yeningi, singasho ukuthi uma sikhuluma ngemisebenzi kahulumeni noma kukhona okuningi okuhamba kahle kakhulu, sisasenazo izinselele eminyangweni eminingi kahulumeni uma kuziwa kumakhono, ukwenza kahle umsebenzi kanye nokuqeqe sheka emsebenzini.
"
"hinkwaswo hi ntolovelo kutlula mpimo, vanhu va thoriwile na ku tlakusiwa ku ya eka swiyimo leswi swi nga fanelangiki kumbe va nga swi thwaselangiki.
","isikhathi esiningi, abantu bebeqashwa futhi benyu selwa ezikhundleni eziphe zulu ezingabafanele noma abangaziqeqeshelwe.
"
"leswi swi khumba matirhelo ya mfumo, kambe swi tlhela swi hoxa xandla eka ku tholana hi vuxaka, ku nghenelela ka tipolitiki eka ntirho wa tindzawulo, ku pfumaleka ka vutihlamuleri, vufambisi byo ka byi nga lulamangi na vukungundzwana.
","lokhu kuthunaza ukusebenza kuka hulumeni, kodwa futhi kuvu na ukunikezana umsebenzi ngobuhlobo, ukugamanxa kwepolitiki kumsebenzi weminyango, ukungaphe nduli, ukungaphathi kahle kanye nenkohlakalo.
"
"ku tlhela ku va na xiphiqo xo fambelana xa ku nghe nelela ka tipolitiki na vurha ngerinkulu eka mafambiselo ya vukorhokeri bya mfumo.
","kunenye futhi inkinga ehambisana nalokhu yepo litiki kanye nokugamanxa kwabaphathi ekuphathweni kwemisebenzi kahulumeni.
"
"munhu u dinga ntsena ku languta eka ku pfumaleka ntshamiseko eka tindzawulo ta mfumo loko vafambisi nkulu va cincacinciwa kumbe ku siviwa nkarhi na nkarhi loko ku thoriwa holobye lontshwa.
","umuntu kumele abheke ku phela ukungazinzi kweminya ngo kahulumeni uma abapha thi abakhulu beshintshwa noma bekhishwa njalo nje uma kubekwa ungqongqo she omusha.
"
"valawurinkulu vo angarhe la na tinhloko ta tindzawulo ta swifundzakulu hi vona va khumbekaka ngopfungopfu.
","abaqondisijikelele naba phathi beminyango ezifu ndazweni bathinteka ka khulu.
"
"eka tindzawulo tin'wana, tidg, tihod na vafambisi va vurhangerinkulu va vile na ntshamiseko eka nkarhi wa vona wa ku khoma hofisi, leswi pfumelelaka tindzawu lo ku tirha hi nkavanyeto wuntsongo.
","kweminye iminyango, amadg, amahod kanye nabaphathi abakhulu babe nozinzo esikhathini, lokho okwenze iminyango yakwazi ukusebenza ngokuphazami seka okuncane.
"
"eka vunyingi bya tindzawulo leti laha ku nga na ntshamiseko wa vu rhangeri, mivuyelo ya oditi yi tala ku va leyinene naswona timali ta mfumo ti humese riwa vutihlamuleri.
","kweminingi yale minyango lapho kukhona uzinzo kubaholi, imiphumela yocwaningo lwamabhuku ivame ukuba mihle futhi nezimali zikahulumeni kuya phenduleka ngazo.
"
"laha ku nga na nhlayo ya le henhla ya ku fambetela na ku siviwa ka tinhloko ta tindzawulo, ku tala ku tshama ku ri na nkavanyeto wa mafambiselo.
","lapho kukhona uguquko olukhulu kubaphathi bomnyango, ku vamise ukuthi kube khona isiphithiphithi ekuphatheni.
"
"xin'we xa swibumabumelo swa nkoka leswi endliweke eka rimba ra mpfapfarhuto hi leswaku vukorhokeri bya mfumo, ngopfungopfu eka swiyimo swa le henhla byi boheka ku nga tirhiseriwi tipolitiki na leswaku tindza wulo ta mfumo ti boheka ku sirheleriwa eka tipolitiki.
","esinye sezincomo ezibalu lekile ezenziwe kumthetho osadingidwa wohlaka ukuthi imisebenzi kahulumeni kumele abezepolitiki banga gamanxi kuyona nokuthi iminyango kahulumeni ku mele ivaleleke kwezepolitiki.
"
"ku endliwa ka xiphu rofexinali swi fanerile ku endlela ntshamiseko eka vukorhokeri bya mfumo, ngopfungopfu eka swiyimo swa le henhla.
","ukuqeqesheka emsebenzi ni kuyadingeka ukuze ku zoba nozinzo emisebenzi ni kahulumeni, ikakhuluka zi ezikhundleni eziphezulu.
"
"vatirhela mfumo va boheka ku ya emahlweni va tirha mitirho ya vona ""handle ka micinco yihi kumbe yihi ya vaholo bye, swirho swa khansele ya vurhangerinkulu kumbe vakhanselara endzeni ka vandla leri fumaka leri ri nga na matimba ya mafambiselo, kumbe ku cinca ka mavandla ya tipolitiki endzhaku ka mihlawulo"".
","abasebenzi bakahulumeni kumele bakwazi ukuqhu beka benze umsebenzi wabo ""noma ngabe kunaluphi na ushintsho longqongqoshe, amalungu omkhandlu we ziphathimandla noma ama khansela aseqenjini elibusayo eliphethe ukuphathwa, noma izinguquko zamaqembu epo litiki emva kokhetho"".
"
"hi le ku ringanyeteni ka mi antswiso yo hlayanyana, tani hi ku engetelela nkarhi wa ku khoma hofisi wa tinhloko ta ndzawulo hi ku ya hi mpimo wo ringanela na matirhelo, ku endla mihlahluvo ya vu swikoti bya ntirho na ku katsa khomixini ya vuko rhokeri bya mfumo eka tii nthavhiyu ta valawurinkulu vo angarhela na swandla swa valawurinkulu vo angarhela.
","siphakamisa izinguquko ezifinyelela kude ezimbalwa, ezifana nokwelula isikhathi sabaphathi beminyango ngokubheka ukufaneleka kanye nokusebenza kahle, ngokwenza ukuhlolwa oku hambisana nomsebenzi no kubandakanya ikhomishana yemisebenzi kahulumeni kwinhlolokhono yabaqondi sijikelele kanye namaphini abaqondisijikelele.
"
"ku tivisa swikambelo swa vutengi eka vanhu lava hlawuriweke swi ta pfuna leswaku hi kota ku kuma vatirhelamfumo lava nga ta korhokela hi ku tshembe ka.
","ukwethulwa kokuhlolwa ubuqotho kubo bonke abakhe thiwe kuzosiza ukuthi siqa she abasebenzi bakahulumeni abazosebenza ngeqiniso.
"
"hi tlhela hi dinga ku ndlandlamuxa swikambelo swo nghena swo boha leswi hi nga swi tivisa hi dziva misoko 2020 ku hundza eka vufambisi bya le henhla.
","sidinga futhi ukwelula ukuvivinywa kokuqashwa esakwethula ngombasa kowezi2020 ezikhundleni ezingaphezu kwezabaphathi abakhulu.
"
"mifumo leyi hluvukaka leyi nga humelela yi na ma goza lama fanaka lama nga ta pfuna ku antswisa moya wa xiphurofexinali endzeni ka vukorhokeri bya mfumo.
","imibuso ephumele layo nethuthukayo inezinya thelo ezifanayo ezisiza ngo kuqeqesheka okusezingeni emsebenzini kahulumeni.
"
"loko ha ha tsala eka rimba ra mpfapfarhuto, ""xibyu rokirasi xi boheka ku ya emahlweni ku simeka hi ku tshembeka na hi vurhonwana xilerisoximfumo xa tipolitiki lexi nga vekiwa.
","njengoba saphawula ohla keni lomthetho osadingidwa, ""isakhiwo esizigabagaba ku mele siqhubeke nokusebenza ngokuthembeka nangoku khuthala ngalokhu oku gunyazwe ngabavoti kanye neqembu, kodwa bayeke ukuthi balingise osopolitiki ngokwabo.""
"
"hi ringanyeta endlelo ra vurhon'wana swinene eka ku laviwa na ku hlawuriwa ka vatirhelamfumo, vutivisi bya matirhelo na malawulelo ya matirhelo.
","siphakamisa indlela enzima kakhulu ekuqashweni nase kukhethweni kwabasebenzi bakahulumeni, ukufundiswa ngomsebenzi omusha kanye nokulawulwa ngokusebenza.
"
"leswi swi katsa ku dyondza loku yaka ema hlweni na ndlela ya nhluvu kiso wa xiphurofexinali yo vonaka ya mutirhelamfumo un'wana na un'wana.
","lokhu kubandakanya uku funda okuqhubekayo kanye nendlela ecacile yokuthuthu kiswa ngokomsebenzi kwabo bonke abasebenzi bakahulu meni.
"
"rimba ra mpfapfarhuto ri veka ntshikelelo eka xidingo xa ku endla vatirhelamfumo va va na vutihlamuleri eka matirhiselo ya mali lama hambanaka na milawu, ku tshika ntolovelo wa ku ka va nga katsiwi eka mixupulo eka malawulelo yo homboloka na ku yiveteriwa ka swipfuno swa mfumo.
","uhlaka lomthetho osadi ngidwa lugcizelela isidingo sabasebenzi bakahulumeni ukuthi baziphendulele uma ungenziwe kahle umsebenzi, nokuqeda nya ukungajeziswa kokungaphathi kahle kanye nokuxhashazwa kwezinsiza zombuso.
"
"ku endla vukorhokeri bya mfumo byi va bya xiphu rofexinali swi katsa vuleteri bya vaofisiri lava nga na vu tihlamuleri eka swiyenge hinkwaswo swa mfumo eka milulamiselo ya milawu leyi nyikiweke leyi faneleke.
","ukuqeqesheka emsebenzini kahulumeni kubandakanya ukuqeqeshwa kwabasebenzi kuzo zonke izinhlaka zika hulumeni ngokuhlinzeka imithetho efanele.
"
"xikolo xa mfumo xa rixaka xi na xiave xa nkoka ku xi tlanga eka mhaka leyi.
","isikole sikahulumeni ku zwelonke sinendima ebalu leke kakhulu kulokhu.
"
"moya wa xiphurofexinali a wu hi mayelana na ku va na mithwaso leyi faneleke na swikili swa xithekiniki ntsena, kambe wu tlhela wu va hi mayelana na ku va na mipimo leyi faneleke ya nhlonipho, ku titsongahata na vutengi eka ku tirhana na vaaki.
","ukuqeqesheka akusikho nje ukuba neziqu ezifanele namakhono omsebenzi ku phela, kodwa futhi kumaye lana nokuba nenhlonipho, ukuzehlisa kanye nobuqotho uma usebenza ngabantu bomphakathi.
"
"vukorhokeri bya mfumo byi hambananile, byi ri na vunavi lebyikulu bya swikili, mi thwaso na vuswikoti.
","umsebenzi kahulumeni uhlukahlukene, unohlu olukhulu lwamakhono, iziqu kanye namakhono omse benzi.
"
"vatirhelamfumo vo tala va na swikili swo kongomisa leswi swi faneleke eka ku phakela loku tirhaka kahle ka vukorhokeri.
","abasebenzi abaningi bakahulumeni banamakho no akhethekile adingeka ekuhlinzekweni kwezinsiza ngempumelelo.
"
"hikokwalaho, a hi mhaka ngopfu ya leswaku hi dinga vukorhokeri bya mfumo lebyitsongo: lexi hi xi dingaka ngopfu i vukorho keri bya mfumo lebyi ringa neleke xikongomelo lebyi nga na swikili leswi ringaneleke, matikhomelonene ma xiphu rofexinali na ku tinyiketela ku korhokela vanhu.
","ngakhoke akusikho ukuthi sidinga abasebenzi bakahulumeni abambalwa: esikudingayo ngempela abasebenzi baka hulumeni abafanelekile ngumsebenzi abanamakhono afanelekile, ukuziphatha ngo mthetho kanye nokuzinikela ekusebenzeleni abantu.
"
"vavanuna na vavasati va vukorhokeri bya mfumo va dinga ku nyikiwa vuswikoti ku kota ku tlanga xiphemu xa vona eka ku fambisa nhluvukiso na ku tiyisa xi demokirasi.
","amadoda nabesifazane abasebenzela uhulumeni ku mele bacijwe ukuze bezodlala indima yabo ekuthuthukiseni nasekuqiniseni intando ye ningi.
"
"lexi i xitiyisiso xa hina xo tlula hinkwaswo xa mfumo wo swi kota lowu korhokelaka ku tsakela ka vaakatiko.
","lokhu kuyisiqinisekiso sethu sombuso okhonayo osebenzela izidingo zezakha muzi.
"
"ndzi mi kombela ku va xiphemu xa phurosese ya mikanerisano ya vaaki hi mayelana na rimba ra mpfa pfarhuto, leri ri kumekaka eka webusayiti ya xikolo xa mfumo xa rixaka, na ku endla leswaku rito ra wena ri twiwa.
","ngiyanicela ukuba nibe yingxenye yezingxoxo zomphakathi mayelana nalolu hlaka lomthetho osadingidwa, olutholakala kwiwebhusayithi yesikole sikahulumeni kuzwelonke, futhi wenze izwi lakho li zwakale.
"
"vukorhokeri bya mfumo a hi bya vandla rin'we ro karhi, kumbe a byi fanelangi ku va ndhawu ya ntlawa wo karhi lowu nga na ku navela.
","imisebenzi kahulumeni akuyona eyeqembu elilodwa, futhi akumele kuqashwe iqembu elithile.
"
"a byi fanelangi byi va nawu eka byona n'wini.
","akumele ibe umthetho yona uqobo.
"
"vukorhokeri bya mfumo i bya vanhu va afrikadzonga.
","imisebenzi kahulumeni eyawo wonke umuntu wa seningizimu afrika.
"
byi fanele ku korhokela vona naswona vona ntsena.,kumele isebenzele bona futhi bona kuphela.
"miganga ya vukhongeri i ya nkoka swonghasi eka ku lwisana na covid19 vukuzenzele unnamed sweswinyana maafrikadzo nga vo tala va vupfumeri va tikatsile na van’wana misava hi nkwayo eka mitlangelo ya nkoka ya vukhongeri.
","umphakathi wezenkolo ubaluleke kakhulu ekulweni necovid19 vukuzenzele unnamed kamuva nje abantu baseningizimu afrika abakholwayo bahlanganyele na banye emhlabeni jikelele ukubungaza ezenko lo ezibalulekile.
"
"swirho swa vupfume ri bya vayuda swi tlangele paseka, vakriste va tlangele paseka, kasi ma muzilamu ku nga ri khale va ta tlangela n’hweti yo kwetsima ya ramadan.
","amalu ngu enkolo yamajuda abungaze i pesach , abenkolo yamakhrestu babungaze iphasika futhi amasulumane maduze nje azobungaza i nyanga engcwele yeramadan .
"
"eka lembe ra vumbirhi, mikhuvu leyi yi funghiwile exikarhi ka ntungukulu wa misava hinkwayo wo onhe tela lowu wu koxeke vu tomi bya vanhu vo tlula 2.5 wa timiliyoni emisaveni hinkwayo.
","unyaka wesibili manje, le micimbi yenzeke phakathi kobhubhane lomhlaba oseluthathe izimpilo zabantu abangaphezu kwezigidi ezi2.5 emhlabeni jikelele.
"
"mihlangano ya rimitsu ra vupfumeri yi vile na nkoka eka mahlamulelo ya hina ya rixaka eka vuvabyi lebyi, ku nga ri ntsena ku hi nyika vuchaveleri bya ximoya na ndzetelo, kambe hi ku tlhela yi hlayisa lava nga sirhelele kangiki eka switandzhaku swa ntungukulu lowu, ku katsa ni hi ku nyikiwa ka swakudya, vutumbelo na byin’wana vukorhokeri bya vanhu.
","izinhlangano zenkolo zilokhu zibalulekile ekubhekaneni kukazwelonke nesifo, hhayi nje ngokusiza ngokududuza ngokomoya neziyalo kuphela, kodwa futhi ngokunakekela labo abakhahlanyezwe kakhulu imiphumela yobhubhane, okubandakanya ukuhlinzeka ngokudla, indawo yo kulala kanye nezinye izinsiza zenhlalo.
"
"vukhongeri byi na xiave xa nkoka evuton’wini bya timi liyoni ta maafrikadzonga, naswona vugandzeri bya nhlengeletano byi vumba xiphemu xa nkoka eka endle lo ra vona ra vukhongeri.
","inkolo idlala indima ebalu lekile ezimpilweni zezigidi zabantu baseningizimu afri ka, ukukhonza kwebandla kuyingxenye ebalulekile yenkolo yabo.
"
"ku va ku kotiwa ku hle ngeletana hikwalaho ka vukorhokeri bya vukhongeri swi tlhela swi va wisiso lowu amukeriwaka wa nkarhi lowo leha wa maxangu lamakulu ya vanhu hi un’weun’we, mindyangu na miganga.
","ukuhlanganyela ukuzokhonza kungukuphumula okwamukelekile esikhathini esinzima kangaka kubantu ngabanye, imindeni kanye nemiphakathi.
"
"swa twisiseka leswaku endzhaku ko kayakaya kutlula lembe ehansi ka swi pimelo eka tinhlengeletano ta swa vukhongeri leswaku muganga wa vupfumeri wu hisekela ku tlhelela eka miehleketo ya ntolovelo.
","kuyaqondakala ukuthi emva kwesikhathi esingaphezu konyaka sokusebenza ngaphansi kwemikhawulo yemibuthano yezenkolo umphakathi wezenkolo ulangazelela ukubuyela esi meni esijwayelekile.
"
"hi ku xixima nkoka wa vu gandzeri bya nhlengeletano evuton’wini bya vanhu va ka hina, mfumo a wu ri karhi wu burisana na muganga wa vupfumeri.
","ekuboneni ukubaluleka kokukhonza kwebandla ezimpilweni zabantu, uhu lumeni ubelokhu exoxisana nomphakathi wenkolo.
"
"varhangeri va muganga wa vupfumeri va twisisa na ku amukela khombo ra ntiyiso ra gandlati lerints hwa ra mitluletavuvabyi ya covid19 .
","abaholi bezenkolo bayaqonda futhi bayayibona ingozi yangempela yehlandla elisha lokusuleleka ngecovid19 .
"
"himpfhuka ku humelela ntungukulu lowu, mihlangano ya vukhongeri yi tekile magoza ya xirindza mhangu na ku va lamanene ku hunguta ku hangalaka ka vuvabyi lebyi exikarhi ka vagandzeri.
","selokhu kwaqubuka ubhubhane, izinhlangano zokholo zithathe izinyathelo ezinhle kakhulu zokunciphi sa ukubhebhetheka kwesifo phakathi kwabakhonzayo.
"
"mhaka yin’wana ya nkoka hileswaku hi nkarhi wa tilevhele ta vulemukisi to ha mbanahambana, mihlanga no ya vukhongeri yi byarhile milahlekelo ya swa timali yo tivikana leyi yi xungetaka vuyisekamahlweni bya yona.
","okunye okubalulekile ukuthi ngesikhathi sezigaba zokuqaphela ezehlukene, izinhlangano zenkolo zibhekane nokulahlekelwa ngokwezimali okubeke engcupheni ukusimama kwabo.
"
"tanihi mfumo, hi ya emahlweni hi tinyiketela ku tirhisana na miganga ya vupfumeri ni ku kuma swi tshunxo swo tirheka.
","sizinikele ekusebe nzeni nomphakathi wokholo ukuthola izisombululo ezise benzayo.
"
"hi nkarhi walowo, rihanyu na vuhlayiseki bya vaaki byi boheka ku va leswi tekeri waka enhlokweni hi ndlela ya nkoka kutlula hinkwaswo.
","ngaso leso sikhathi, impilo yomphakathi kanye noku phepha kumele sikucabangele phambili.
"
"miganga ya vukhongeri yi kombisile maendlelo la mantshwa na vutumbuluxi eka ku endla vugandzeri hi nkarhi lowu a ku ri na vuka nakani lebyikulu ehenhla ka ndlela ya ntungukulu lowu.
","umphakathi wokholo usubonise ukuqhamuka namasu amasha nezindlela ezintsha zokukhonza esikhathini lapho kwakukhona ukunga baza ngalolu sizi lobhubhane.
"
"vukorhokeri bya tinhlenge letano a byi khomiwa eka inthanete naswona vaga ndzeri a va hlohloteriwa ku khongela emakaya ya vona ematshan’wini yo ya nghena ekerekeni.
","izinkonzo bezibanjwa ngobuchwepheshe beinthanethi futhi amakholwa agqugquzelwa ukuthanda zela emakhaya abo kuno kuya ezinkonzweni.
"
"leswi swi pfunile swinene matshalatshala ya rixaka ku kamanyeta ku hangalaka ka vuvabyi lebyi.
","lokhu kusize kakhulu emzamweni kazwelonke wokunqanda ukubhebhetheka kwesifo.
"
"varhangeri va vukhongeri va tlangile xiphemu xa nkoka swonghasi hi ku hlohlotela vanhu hinkwavo ku landze lela ka vaaki ka magoza ya swa rihanyu hi mayelana na mitolovelo ya nkoka ku katsa na magandzelelo ya mfuwo kufana na malahlelo.
","abaholi benkolo badlale indima ebaluleke kakhulu ekugqugquzeleni umpha kathi ukuthi uthobele izinya thelo zezempilo emicimbini yesintu namasiko efana ne mingcwabo.
"
"hi mpimo lowu ringane laka, vanhu va ka hina va kombisile ku tinyiketela ka vona ku landzelela milawu ya swa rihanyu ya vaaki na ku siya mpfhuka exika rhi ka vanhu.
","ngokulinganayo, abantu bakithi babonise ukuzi nikela kwabo ekuthobe leni imithetho yezempilo no kuqhelelana.
"
"kutani va twisisa hi ndlela leyi nga lulama leswaku va boheka ku ya emahlweni va papalata tinhlengeletano letikulu.
","futhi bayabona ukuthi kumele baqhubeke nokugwema imibuthano emikhulu.
"
"sweswi hi le ka nkarhi lowu ku sivela nkarhi wu nga si fika swi dingiwaka ehenhla ka hinkwaswo.
","sisesikhathini lapho ukuqaphelisisa kudingeka kakhulu kunakho konke.
"
"ntungukulu wa khoronavhayirasi a wu se herisiwa, ku nga va eka tiko ra ka hina kumbe emisaveni hinkwayo.
","ubhubhane lwegciwane lecorona alukapheli, kungaba ezweni lethu noma emhlabeni jikelele.
"
"nxungeto wa ga ndlati ra vunharhu i wa nti yiso naswona wu kona hi laha ku nga heriki.
","ubungozi behlandla lesithathu obangempela futhi bulokhu bukhona.
"
"ntokoto wa matiko ya misava wu hi dyondzisile leswaku a hi fanelangi ku ringa vuhelo.
","esikubone emhlabeni kusi fundise ukuthi akumele sili nge ikusasa.
"
"matiko yo tala ya olovisile swipimelo, ku va ntsena ku va na ku tumbulu ka hi vuntshwa, leswi endle ke swi fanela ku rhwexa hambi swipimelo swo tika swinene.
","amazwe amaningi asexegise imikhawulo, kanti kuzoba nokunye ukuqubuka kwegciwane, okwadinga okunye ukubekwa kwe mikhawulo eqinile.
"
"tinhlengeletano letikulu, hambi ta vukhongeri kumbe swin’wana, ti na vuswikoti byo hangalasa xitsongwa tsongwana lexi, swi nga ri na mhaka ku tirhisiwa ka magoza hi mayelana na ku siyiwa ka mpfhuka exika rhi ka vanhu na ku hlamba swandla.
","imibuthano emikhulu, inga ba eyenkolo noma eminye, inakho ukubhebhethekisa igciwane, yize kukhona izinyathelo zokuqhelelana nokusebenzisa isibulalimagciwane.
"
"timiliyoni ta maafrikadzonga a ti ri karhi ti landze lela xikhorwiwa xa nkoka xa vupfumeri bya tona.
","izigidi zabantu baseningi zimu afrika bezilokhu zihlo nipha ukholo lwazo.
"
"eka tiko leri ri sirhelelaka mfanelo ya ntshunxeko wa vukhongeri, matshalatshala hinkwawo ma boheka ku endliwa ku se ketela vanhu va ka hina eka ku tirhisiwa ka mfanelo leyi.
","ezweni eliqhakambisa ilungelo lenkululeko yenkolo, wonke umzamo kumele wenziwe ukweseka abantu bakithi ukusebenzisa leli lungelo.
"
"naswona ku tirhisa mfanelo leyi, hi dinga ku tiyisisa le swaku a hi veki timfanelo leti kumbe vutomi bya van’wana enxungetweni.
","futhi uma sekusetshenziswa leli lungelo, kudingeka siqi niseke ukuthi asibeki amalungelo noma izimpilo zabanye engcupheni.
"
"lowu i nawu lowu va rhangeri va vukhongeri lava ndzi hlanganeke na vona va wu seketelaka hi ku hetiseka na ku wu amukela.
","lesi yisimiso abaholi be zenkolo engihlangene nabo abaseseka ngokugcwele futhi abasibongayo.
"
"va twi sisa vutihlamuleri bya vanhu hinkwavo va vupfumeri – ha kunene bya maafrikadzo nga hinkwavo – ku landze lela magoza lama kotekaka lama nga vekiwa ku sirhelela rihanyu ra vanhu ni ku po nisa vutomi.
","bayasiqonda isibopho sabo bonke abantu abakholwayo – impela sabo bonke abantu baseningizimu afrika – ukulandela izinya thelo ezibekiwe zokuvikela impilo yabantu nokusindisa izimpilo.
"
"eka kutlula lembe, hi tirhisanile tanihi rixaka ku kamanyeta ntungukulu lowu.
","ngaphezu konyaka, sesi sebenze ngokubambisana njengomphakathi ukunqa nda lolu bhubhane.
"
"sweswi tanihiloko hi tirhisana ku wu hlula, hi dinga ku tshikelela hi vu ntshwa vutiyimiseri bya hina lebyi avelaniwaka ku endla hi ndlela ya vutihlamuleri na hi vukheta.
","manje njengoba sisebenzela uku linqoba, sidinga ukuphinde siqinise ukuzimisela kwethu sonke ukuthi siziphathe ngendlela eqotho neno kuqaphela.
"
"hi ku endla tano, hi ta va hi humelerisa hi ndlela yo tivi kana mahungu ya ntshembo, ku ponisiwa, ntshunxeko na nseketelano leswi ku nga ta vulavuriwa haswona eti kerekeni, emasinagogweni, tikerekeni ta masurumani na le makaya ya tiko ra ka hina eka masiku na mavhiki lama ha taka.","uma senza njalo, siyobe si fezekisa imiyalezo yomhlaba yethemba, insindiso, inkulu leko kanye nobunye ezobe ikhulunywa emasontweni, kumasinagoge, emamosque kanye nasemakhaya asendaweni yakithi ezinsukwini nasemavikini azayo."
"hlaluko wa le durban wu tumbuluxa swivandlanene swa afrikadzonga vukuzenzele unnamed sweswinyana, ndzi endzerile hlaluko wa le durban ku ya tivone la hi ndzexe ntirho lowu wu nga eku endliweni ku endla hlaluko wu tirha hi ku hatlisa na ku va lowu phikizanaka.
","ichweba lasethekwini lisungulela iningizimu afrika inqwaba yamathuba vukuzenzele unnamed kamuva nje, bengi vakashele ichweba lasethekwini ukuze ngizozibonela mina mathupha ukuthi umsebenzi u qhutshwe kanjani ngendlela eqeqeshe kile futhi nencintisayo.
"
"endzhaku ka mbhurisano wa xinkadyana na vafambisinkulu va transnet, ndzi rhendzelekile na ndhawu ya swikepe hi xikepe xa nkombiso, lexi hi mikarhi yo tala xi tirhisiwaka ku rhangela swikepe leswikulu hi le muge rhweni wo huma no nghena eka pulatifomo.
","emva kokuxoxisana naba phathi abakhulu benkampani yakwatransnet , ngivakashele izibuko ogwini lolwandle ngesikebhe, esivame ukuse tshenziswa ukuhola imikhu mbi kusuka la ingena khona kuya lapho yethulela khona umthwalo.
"
"ku vona leswi tirhiwaka eka hlaluko ndzi ri ematini, swi ndzi tsundzuxe hi vukulu na ku pfilu ngana ka swona.
","uma ngibheka umsebe nzi wechweba ngisemanzini, ngikhumbule ubukhulu kanye nobunzima balo msebenzi.
"
"loko hlaluko lowu wu nga tirhi hi ku hatlisa, ikhonomi hinkwayo ya tikeriwa, kusuka eka lava xa vaka tinhundzu kusuka eka ma tiko mambe na lava rhumelaka tinhundzu ematikweni mambe eka vatirhisi.
","uma ichweba lingasetshe nziswa ngendlela efanele, wonke umnotho wezwe uya khahlamezeka, ukusuka kwabathumela impahla lapha ekhaya kanye nabathumela impahla kwamanye amazwe kuya kubathengi bempahla.
"
"hi tlhelo lerin’wana, loko hla luko lowu wu tirha kahle wu endla leswaku ikhonomi yi kula na ku veka tiko ra ka hina tanihi nyangwa wo nghena eka xifu ndza na le ka tikokulu.
","ngakolunye uhlangothi, uma ichweba lisebenza kahle liholela ekukhuleni komnotho futhi libeke izwe lakithi eku theni libe yintuba yokungene la esifundeni kanye nasezwe kazini.
"
