"vhuimana ho vhumbeaho nnḓa ha mbumbelo vhu ṱoḓa dzilafho ḽa tshihaḓu allison cooper vhafumakadzi vho tshenzhemaho vhuima na ho vhumbeaho nnḓa ha mbumbelo vha ya ḓivha vhuṱungu vhune ha vhanga, zwo vhangwa nga mvelelo dza phosethivi dza vhuimana kha ndingo dza murundo na dza malofha.
","ukukhulelwa okwenzeka ngaphandle kwesibeleko yingozi edinga inkathalelo yezempilo kaxakeka allison cooper abantu basetyhi ni abaye bafuma na ukukhulelwa okwenzeka ngaphandle kwesibeleko babazi kakuhle ubuhlungu bentliziyo obubangelwa koku, ngenxa yeziphumo ezithembisayo ezingqina ukuba bakhulelwe kuvavanyo lomchamo nolwegazi.
"
"hezwi ndi u ya nga vho dokotela bushy mhlari, dokotela muhulwane are kha vhupfumbudzi ha u vha makone kha ectopic obstet rics na gynaecology kha sibadela tsha akhademiki tsha dr george mukhari, vhe vha ṱalutshedza uri vhuimana ho vhumbeaho nnḓa ha mbumbelo a vhu dzuli nga ngomu ha bako ḽa mbumbelo, hune kanzhi vhuimana ha dzula hone.
","ngokutsho kukagqr bushy mhlari, oyisenior registrar kwicandelo leectopic ob stetrics and gynaecology edr george mukhari academic hospital , ochaze ukuba ukukhulelwa ngaphandle kwesibeleko kukukhulelwa okwenzeke ngaphandle komngxuma wesibeleko.
"
"vha ri kanzhi, nga murahu ha u ṱangana ha kumba ḽa musadzi na vhunna/tshipeme – zwine zwa bvelela kha tshubu ya u bva kha kumba u ya kha mbumbelo, kumba ḽo ṱanganaho na vhunna/tshipeme ḽi tshimbila nga kha tshubu u ya kha bako ḽa mbumbelo ḽo pfumaho hune ḽa ṱumana na mudzedze wa endometrial ha kona u vha na u bveledzwa ha ṅwana.
","uye wathi ngokuqhelekileyo, emva kokuchunyiswa kweqanda yimbewu yobudoda – okuthi kwenzeke ngaphakathi kwemibhobho yesibeleko, iqanda elichunyisiweyo lihamba ngombobho liyokutsho ngaphakathi kumngxuma wesibeleko apho lincamathela khona kwinwebu engaphakathi esibelekweni, aze emva koko umntwana akhule.
"
"""kha vhuimana ho vhumbeaho nnḓa ha mbumbelo, kumba ḽo ṱanganaho na vhunna/tshipeme a ḽi dzuli nga ngomu ha mbumbelo ḽi dzula kha zwiṅwe zwipiḓa zwa muvhili.
","""ekukhulelweni okwenzeka ngaphandle kwesibeleko, iqanda elichunyisiweyo lihlala kwezinye iindawo zomzimba.
"
"kha nyimele dzi linganaho phesenthe dza 98, vhuimana ho vhumbeaho nnḓa ha mbumbelo vhu dzula kha tshubu dza u bva kha kumba u ya kha mbumbelo.
","kwiziganeko ezingama98%, olu hlobo lokukhulelwa lwenzeka kwimibhobho yesibeleko.
"
"fhethu hu songo ḓoweleaho hu katela ovari, nga ngomu thumbuni, mulomoni wa mbumbelo na mukala wa nga nnḓa ha mbumbelo ,"" vho ralo vho dokotela mhlari.
","iindawo ezingaqhelekanga ziquka indawo esisiyilelomaqanda emzimbeni, emazantsi esisu, emlonyeni wesibeleko nakwisiqwanga esingaphandle kwesibeleko,"" utshilo ugqr mhlari.
"
"musi izwi zwi tshi bvelela, tshitumbuki tshi nga si sudzuluswe tsha iswa nga ngomu ha mbumbelo na uri tsho salaho fhedzi kha mufumakadzi hu vha u fhelisa vhuimana.
","xa oku kusenzeka, isihluma sembewu asinakumiliselwa kwenye indawo, into enokwenziwa inye kuphela kukuba sikhutshwe isisu eso.
"
"vho dokotela mhlari vho ri mufumakadzi u vha khomboni khulwane ya vhuimana ho vhumbeaho nnḓa ha mbumbelo arali; tshubu dza u bva kha kumba u ya kha mbumbe lo dzo tshinyala kana dzi siho kha tshiimo tshone, u fana na vhulwadze ha dzitshubu ha kale ho ḓaho nga kha vhulwadze ha vhudzekani kana sedzhari ya kha tshubu; o vhuya a vha na vhuimana ho vhumbeaho nnḓa ha mbumbelo; a sa bebi; a tshi dzekana na vhathu vho fhambanaho; a tshi daha fola.
","ugqr mhlari uthe umntu wasetyhini unamathuba amaninzi okufumana ingxa ki yokukhulelwa okwenzeka ngaphandle kwesibeleko ukuba; unemibhobho yesibeleko eyonakeleyo okanye engaqhelekanga, enokususela kukuba wakhe wanesifo okanye usuleleko lwesifo kule mibhobho alufumene ngokwabelana ngesondo okanye ngotyando kwimibhobho; wakhe wanayo ingxa ki yokukhulelwa okwe nzeke ngaphandle kwesibeleko ngaphambili; akanayo inzala; unamaqabane okwabelana ngesondo amaninzi; utshaya imidiza.
"
"""vhuimana ho vhumbeaho nnḓa ha mbumbelo ho baleaho ndi nyimelo i isaho lufuni na uri ndi tshivhangi tshihulwane tsha mpfu dzi elanaho na vhuimana ha miṅwedzi miraru ya u thoma.
","""ukugqabhuka kwale nwebu yambethise isihluma sembewu xa umntu enengxaki yokukhulelwa ngaphandle kwesibeleko kungambulala kwaye kungunobangela ophambili wokusweleka koomama abakhulelweyo kwiinyanga ezintathu zokuqala bekhulelwe.
"
"khombo ya vhuimana ho vhumbeaho nnḓa ha mbumbelo i ṱoḓa u lingana na phesenthe mbili ya vhathu nga u angaredza,"" vho ralo vho dokotela mhlari.
","izehlo zokukhulelwa okwenzeka ngaphandle kwesibeleko zimalunga ne2%,"" utshilo ugqr mhlari.
"
"zwiga/tsumbo zwiga/tsumbo dza vhuimana ho dza vhuimana ho vhumbeaho nnḓa ha vhumbeaho nnḓa ha mbumbelombumbelou ya nga vho dokotela mhlari, tsumbadzwadze dzi vhonala mathomoni a vhuimana.
","iimpawu zokukhulelwa okwenzeka ngaphandle kwesibelekongokukagqr mhlari, iimpawu zibonakala kwangoko xa ukhulelwe.
"
"tshiṅwe tshifhinga, dzi vhonala phanḓa ha musi mufumakadzi a tshi limuwa uri o ḓihwala.
","ngamanye amaxesha, nangaphambi kokuba umntu wasetyhini aziqonde ukuba ukhulelwe.
"
"tsumbadzwadze dzo ḓoweleaho dzi katela; vhuṱungu ha nga fhasi ha thumbu, u pfuka u ya maḓuvhani u bva malofha nga fhasi.
","iimpawu eziqhelekileyo ziquka; iintlungu zamazantsi esisu, ukuphosakala kwexesha lokuya exesheni; ukopha kwilungu lobufazi.
"
"""fhedziha, kha vhaṅwe vhafumakadzi a hu vhonali tsumbadwadze u swika tshubu dza u bva kha kumba u ya kha mbumbelo dzi tshi balea.
","""nangona kunjalo, abanye abantu basetyhini ababinazo iimpawu kude kugqabhuke imibhobho yesibeleko.
"
"musi izwi zwi tshi bvelela, mufumakadzi a nga pfa vhuṱungu vhuhulu na uri vhaṅwe vha ya swikelela hune vha bva malofha nga fhasi.
","xa oku kusenzeka, umntu wasetyhini unokuva iintlungu eziqatseleyo kwaye abanye basenokopha kwilungu lobufazi.
"
"hezwi zwi tevhelwa nga dzungu, u tsela fhasi ha mutsiko wa malofha, u dzidzivhala, mutshuwo na u lovha arali dzilafho ḽa lengelelwa,"" vho ralo.
","oku kulandelwa sisiyezi, ukuhla koxinzelelo lwegazi, ukufa isiqaqa, ukothuka kunye nokufa ukuba unyango lulibazisekile,"" utshilo.
"
"u tumbula vhuimana ho vhumbeaho nnḓa ha mbumbelo, hu itwa ndingo ya murundo kana ya malofha u itela u khwaṱhisedza uri mufumakadzi o ḓihwala.
","ukuze uxilongo luyiveze le ngxaki yokukhulelwa okwenzeka ngaphandle kwesibeleko kufuneka kwenziwe uvavanyo lokukhulelwa lwegazi okanye olomchamo ukungqina ukuba umntu wasetyhini ukhulelwe kusini na.
"
"""ha itwa ultrasound u khwaṱhisedza arali mbumbelo i si na tshithu na u vhona hune tshitumbuki tsha vha hone kha muvhili wa mufumakadzi,"" vho ralo vho dokotela mhlari.
","""kwenziwa uvavanyo lwamaza esandi olubizwa iultrasound emva koko ukuqinisekisa ukuba isibe leko asinanto na kwanokubona ukuba isihluma sembewu sifumaneka phi na kumzimba womntu wasetyhini,"" utshilo ugqr mhlari.
"
"u alafha vhuimana u alafha vhuimana ho vhumbeaho nnḓa ho vhumbeaho nnḓa ha mbumbeloha mbumbelo""vhuimana ho vhumbeaho nnḓa ha mbumbelo ha vhuya ha tumbulwa vhu tea u alafhiwa u thivhela nyaluwo yaho, ngauri vhutshilo ha mufumakadzi vhu ya vha khomboni arali dzilafho ḽa lengelelwa,"" vho ralo vho dokotela mhlari.
","ukunyanga ukukhulelwa okwenzeka ngaphandle kwesibeleko ""xa ukukhulelwa okwenzeka ngaphandle kwesibeleko kufunyanisiwe kufuneka kunyangwe ukuze kungabi sahambela ndawo, kuba ubomi bomntu wasetyhini busemngciphekweni ukuba unyango lulibazisekile,"" utshilo ugqr mhlari.
"
"vho engedza nga uri ""sedzhari i kha ḓi vha dzilafho ḽa u thoma ḽa vhuimana ho vhumbeaho nnḓa ha mbumbelo, fhedziha u ṱavhanya u tumbula vhulwadze uvhu zwi tendela u shumiswa ha dzilafho ḽa mushonga phanḓa ha musi vhuimana ho vhumbeaho nnḓa ha mbumbelo vhu tshi balea"".
","""utyando yeyona ndlela ingcono yokunyanga le ngxaki nangona kunjalo, ukuyifumanisa kwangethuba kubangela kube neendlela zonyango eziliqela ekunokukhethwa kuzo phambi kokuba ukukhulelwa okwenzeka ngaphandle kwesibeleko kugqabhuke,"" wongeze watsho.
"
"vho dokotela mhlari vha ri mufumakadzi u ya kona u dovha a vha muimana nga murahu ha vhuimana ho vhumbeaho nnḓa ha mbumbelo.
","ugqr mhlari uthe umntu wasetyhini uyakwazi ukuphinda akhulelwe emva kokufumana le gxaki.
"
"vhafumakadzi vhane vha humbulela uri vha na vhuimana ho vhumbeaho nnḓa ha mbumbelo vha tea u dalela dokotela wavho, sibadela kana kiḽiniki nga u ṱavhanya nga hune zwa konadzea ngaho.","abantu basetyhini abakrokrela ukuba banengxaki yokukhulelwa okwenzeka ngaphandle kwesibeleko kufuneka badibane nogqirha wabo, baye esibhedlele okanye kwikliniki ekufutshane ngokukhawuleza."
"vhaswa ndi vhone vhumatshelo ha shango ḽashu vukuzenzele unnamed u ambedzana na vha swa zwi anzela u ntsia ndi na mafulufulu.
","abantu abatsha balikamva lelizwe lethu vukuzenzele unnamed ukufakana imilomo nabantu abatsha kusoloko kundishiya ndinodlamko.
"
"zwi a takadza u wana luvhonela nga ha thambulo na madakalo avho na bono ḽavho ḽa uri hu nga itwa mini u khwi nisa shango iḽi.
","kuyavuyisa ukuqonda iingxaki neempumelelo zalo kunye nemibono yalo ngento enokwenziwa ukuphucula eli lizwe.
"
"a zwi hanedzwi uri vhaswa ndi vhuhone ha ndeme kha muya na muhanga wa lushaka.
","liyinene elokuba abantu aba tsha basisininzi, bangundaba mlonyeni kwaye izingqi zabo ziyavakala kwisizwe siphelo.
"
"kule na kuhumbulele kwa uri vha ṱoḓa u ḓitakadza fhedzi, u sa ḓidzhenisa kha zwa poḽotiki kana u humbulela vhone vhaṋe, ngudo dzapo na dza dzitshaka dzi anzela u khwaṱhisedza uri vhaswa u mona na ḽifhasi vha anzela u vha na fulufhelo nga ha ndavhelelo dzavho.
","umbono wokuba batyhafile, abanamdla kwezopolitiko okanye bayazingca, uyaphiki swa ziziphumo zamaphulo ophando aqhutywe apha ekhaya nakumazwe aphesheya angqina ukuba abantu abatsha kwihlabathi liphela bahlala benethemba lamathuba amahle okuphumelela ebomini.
"
"u ya nga mawanwa a ipsos pulse a khetho dza vhathu o bviswaho nga phando, 61% ya maafrika tshipembe vha miṅwaha u bva kha 15 u ya kha 17 vha pfa vha na fulufhelo nga ha 2020. a thi timatimi uri hovhu ndi vhuḓipfi ha vhaswa nga u anga redza nga maanḓa avho vho bebiwaho nga tshifhinga tshi fanaho tsha musi miḽeniamu i tshi khou shanduka vhane zwa zwino vha khou thoma vhutshilo ha vhaaluwa, vhane vhaswa vha vha vhidza ama2000.
","ngokwakufunyaniswe kwi ipsos pulse of the people eyakhu tshwa kwinyanga yomqungu, iipesenti ezingama61 zabemi bomzantsi afrika abaneminyaka eli15 ukuya kweli17 baziva benethemba malunga nowama2020.
"
"ndi vharwa na vhananyana vho bebwaho nga murahu ha dimokirasi.
","andithandabuzi ukuba olu luluvo lwabantu abatsha ngokubanzi ingakumbi eli qela lazalwa ekuqaleni kwale nkulungwane, ekungoku nje bafika kwinqanaba lobudala, olubizwa ngokuba ngama2000.
"
"musi vha songo ṱangana na tshenzhemo thwii ya tshiṱuhu tsha muvhuso wa tshiṱalula, vha bvela phanḓa na u tshila na vhufa hawo ha tshayandingano ya muvhala, u sa dzula hu fanaho na vhushai.
","ngumlisela nomthinjana owazalwa emva kokuba eli lizwe lifumene inkululekoi.
"
"vhaswa avha vha na fulufhelo, vhuḓifulufheli na u fhufhuma lutamo lwa u bvelela.
","nangona bengenazivubeko bona buqu zenkohlakalo yombuso wocalucalulo, bayaqhubeka nokuphila nentlungu eyashiywa ngulaa rhulumente yokungalingani ngokobuhlanga, ukubandeze lwa umhlaba kunye nentluphe ko.
"
"vha a ḓivha pfanelo dzavho nahone a vha shavhi u dzi ṱoḓa.
","olu lutsha luzithembile, lu yazithemba kwaye luyaphuphu ma ngamabhongo.
"
"vhaswa vha shango vha imela mafulufulu, fulufhelo, vhuḓi mvumvusi, vhukoni, vhuma tshelo na mbofholowo.
","bayawazi amalungelo abo kwaye aboyiki ukuwabanga.
"
"vho bebwa nga tshifhinga tsha thekhinoḽodzhi ya didzhithala na u kona zwavhuḓi kushumisele kwa thekhinoḽodzhi dza tshizwinozwino na u ṱoḓa u dzhena kha mabuḓo e a vha a siho na luthi hi nga tshifhinga tsha vhabebi vhavho.
","ulutsha lwelizwe lethu lubonakalisa amandla, ithemba, ulonwabo, ukubanakho, ikamva nenkululeko.
"
"nga madekwana a ḓuvha ḽa phanḓa ha vhuṱambo ha mulaedza wa lushaka ndo vha na mashudu a u ambedzana na tshigwada tsha vhaswa vha mafulufulu kha nyambedzano dza mirafho yo vhalaho yo rambi waho nga zhendedzi ḽa mvele dziso ya vhaswa ḽa lushaka.
","basisizukulwana esiphila ngobuchwepheshe beli xesha esisebenzisa ubugcisa bale mihla ngokuchanekileyo kwaye bajonge ukungena kumakhondo emisebenzi angazange abekho ngexesha labazali babo.
"
"ro amba nga ha zwithu zwine zwa vha zwa vhuṱhogwa vhukuma kha vhaswa na u ṱola nḓila dzine ri nga livhanya kuhu mbulele na nyito dzashu.
","ngaphambi kwentetho kamongameli engobume besizwe ndiye ndaba nethuba lokunxibelelana neqela lolutsha elinamandla kwindibano yokufakana imilomo ibiququzelelwe yiarhente yesizwe yophuhliso lolutsha.
"
"sa nḓowelo, mafhungo nga ha u wana mishumo na zwikhala zwa mishumo zwo vha zwo a ndesa kha adzhenda.
","sixoxe ngemicimbi ebaluleke kakhulu kulutsha kwaye savavanya iindlela esinokuthi singqamanisa izimvo kunye neentshukumo zethu.
"
"kha vhaswa vha 1.2 miḽioni vhane vha khou dzhena kha makete wa vhashumi ṅwaha muṅwe na muṅwe, vhane vha ṱoḓa u lingana mbili tsha tshararu vha vha vha vha sa khou shuma kana u guda tshikoloni.
","ngokuqinisekileyo, umba wokufumaneka kwemisebenzi namathuba ubuphambili kwiingxoxo zethu.
"
"vhadzheneli kha nyambedzano vho ṱanganedza zwa uri fhungo ḽa mushumo wa vhaswa ḽi khou sedzeswa khaḽo kha ḽevele dza nṱhesa dza muvhuso.
","kwisigidi esi1,2 solutsha esifikelela kwinqanaba lukhangela imisebenzi kunyaka ngamnye, phantse isibini kwisithathu sihlala singasebenzi okanye singafundi.
"
"fhedzi mbuelelo ndi i ḓivheaho: vho ḓiimisela na u ḓo u shela mule nzhe kha ikonomi nga nḓila dzo fhambanaho, hu tshi katelwa na vhoramabindu, fhedzi sisiṱeme ya ndaulo i konḓesaho na u sa vha hone ha ndambedzo ya masheleni zwi vha thivhela u ita nga u ralo.
","abathathinxaxheba kwezi ngxoxo bayayichulumancela into yokuba umba wokuqeshwa kolutsha ufumana ingqalelo kwelona nqanaba liphezulu likarhulumente.
"
"sa zwe bright hlongwane u bva kha vhaswa vha re kha mabindu afrika tshipembe a mmbudza zwone, hu fanela u vha na ndambedzo ya masheleni ma nzhi a ṋetshedzwaho vhorama bindu vha vhaswa.
","noko kunjalo babonakalisa okwa kuzimisela baziwa ngako: babekulungele kwaye bezimisele ukufaka isandla kuqoqosho ngeendlela ezahlukeneyo, kuquka ukuba ngoosomashi shini, kodwa ubucukubhede obugqithisileyo babasemagunyeni kunye nokusilela kwenkxasomali kuyabathintela ekwenzeni oko.
"
"vha tama u vhona tshaka dzo fhambanaho dza zwiimiswa zwa masheleni, zwiimiswa zwa masheleni a mveledziso, vhabindudzi vha phuraivethe, dzifeme dza miko vhe dza phuraivethe khathihi na dzibannga dza zwa mabindu vha tshi ṋetshedza tshikolodo na u betsha kha vhoramabindu vha vhaswa.
","njengoko ubright hlongwane ovela kwiyouth in business south africa endixelele, kufuneka kubekho inkxasomali eya ndisiweyo eya koosomashishi ni abasebatsha.
"
"uri shango ḽashu ḽi bvelele ri fanela u lingedza nga nḓila dzoṱhe u khwaṱhisedza uri vhaswa vha khou kona u dzhenela kha ikonomi yashu nga nḓila i pfadzaho, hu nga vha nga nḓila ya mushumo wa fomaḽa kana nga u tou ḓishuma.
","bangathanda ukubona amaziko ahlukeneyo ezemali, amaziko abolekisa ngemali yophuhliso, abatyalizimali ababolekisa ngemali engena nzala, iinkampani ezishishina ngezabelo kunye neebhanki zorhwebo eziboleka imali ngetyala zize zixhase oosomashi shini abasebatsha.
"
"zwenezwo zwo vha zwo tea uri ndi nga shumisa luvhanḓe ulu u rwela ṱari vhudzheneleli kha zwa mishumo ya vhaswa ya ofisi ya muphuresidennde, ine ya vha bono ḽa maano a vhuṱali ḽa lushaka ḽine ḽa vhekanya nyito ya ndemesa ya u lwa na vhushayamushumo kha vhaswa.
","ukuze ilizwe lethu liphumelele kwaye likhule kufuneka senze konke okusemandleni ethu ukuqinisekisa ukuba ulutsha luyakwazi ukuthatha inxaxheba kuqoqosho lwethu ngendlela enenjongo, nokuba kukuqeshwa okanye ukuzisebenzela.
"
"hezwi zwi katela netiweke ya ndangulo ya gondo ḽa lushaka ine ya tshimbilelana na vhaṱoḓi vha mushumo na zwikhala zwa mushumo.
","kufanelekile ke ukuba ndisebenzise eli qonga ukumisela ungenelelo lukamongameli kwingqesho yolutsha (ipre sidential youth employment intervention), nto leyo ingu mbono wesizwe kunye nesicwangciso esibonisa amanyathelo okusebenza angxamisekileyo ukujongana nentswelangqesho kulutsha.
"
"hezwi zwi ḓo konisa vhaswa u swikela zwikhala sa i zwi vhaṅwe vhavho vha si na netiweke dzine dza nga leludza uri zwi konadzee u swikela zwikhala.
","oku kuquka inkqubo yesizwe yokufunela abantu imisebenzi ethi idibanise abantu abafuna imisebenzi kunye namathuba omsebenzi.
"
"khoso pfufhi dzo khetheaho dzo tou sedzesaho kha mushumo dza zwikili zwine vhatholi vha zwi ṱoḓa zwino dzi ḓo dzudzanywa.
","oku kuyakwenza ukuba ulutsha lukwazi ukufumana amathuba njengoko abanye kubo bengenazo iindlela ezenza ukuba kube lula ukufumana amathuba afanelekileyo.
"
"hezwi zwi khou itela u tandulula thaidzo ya u sa tshimbilelana vhukati ha mbekanyamushumo dza mveledziso na vhupfumbudzi na pfunzo dzine dza vha hone zwino zwi tshi vhambe dzwa na ṱhoḓea dza ikonomi.
","kuza kuqaliswa izifundo zoqeqesho ezikhethekileyo zexeshana ezijolise kwizakhono ezifunwa ngabaqeshi.
"
"ri ṱanganedza mushumo wo no itwaho kha sia iḽi, u fana na mbekanyamushumo ine ya vha kati zwino nga kha mihasho ya zwa vhulimi, vhuvhusi ha tshumisano na zwa sialala, mveledziso ya mahayani na mvusuludzo ya mavu ya u pfumbudza matshudeni a vha swa a 1,000 ngei free state kha zwa vhulimi na zwiṅwe zwikili.
","oku kujolise ekushukuxeni ingxaki yokungahambelani phakathi kwemfundo esele ikho, iinkqubo zoqeqesho nezophuhliso kunye nezakhono ezifunekayo kuqoqosho lweli lizwe.
"
"vhunzhi ha vhaswa vha ṱoḓa u thoma mabindu a vhone vhaṋe.
","siyawamkela umsebenzi osele wenziwe kule ndima, njengenkqubo eqhutywa ngoku lisebe lezolimo, uhlengahlengiso lomhlaba nophuhliso lwamaphandle kunye nelezentsebenziswano kulawulo nemicimbi yeze mveli yokuqeqesha i1000 la bantu abatsha efreyistata kwe zolimo nakwezinye izakhono.
"
"vha shaya zwikili zwa thekhi nikhala zwine zwa nga vha thu sa u thoma mabindu a vhone vhaṋe.
","uninzi lolutsha lufuna ukuqala amashishini alo.
"
"thusedzo i ḓo tikedza nyaluwo ya vhoramabindu vha vhaswa.
","kunqo ngophele izakhono zobugcisa ezinokulunceda ukuba luziqalisele amashishini.
"
"ngoho ndi ya uri u ita zwa mabindu a si thandululo ya thaidzo dzoṱhe, fhedzi ndi a tenda tshoṱhe uri ndi iṅwe ya nḓila dzo lingwaho dzi shumaho u ambedzana nga vhuṋe na ndivho, ndeme ya u vha tshipi ḓa, na fulufhelo ḽa vhumatshelo ha vhaswa.
","eli nyathelo lokungenelela luya kuxhasa ukukhula koosomashishini abasebatsha.
"
"mbekanyamushumo ya tshumelo ya vhaswa ya ofisi ya muphuresidennde i ṋetshedza zwikhala vhaswa uri vha shumele zwitshavha zwa havho.
","ushishino ngokuqinisekileyo ayisosisombululo, kodwa ndiqinisekile ukuba le yenye yeendlela ezisebenzayo neziqinisekisiweyo zokubonisa ubungqina kunye nenjongo, umbono wokuba lilungu, nethemba lekamva lolutsha.
"
"vhurangeli uhu ho dzudzanywa u ḓisa tshanduko na u vha na mvelelo dzi vhonalaho vhukuma, musi zwi tshi vhambedzwa na mbekanyamushumo dzi songo ṱumanaho dze dza vha na mvelelo ṱhukhu.
","inkqubo kamongameli yee nkonzo zolutsha (ithe presidential youth service programme) inika abantu abatsha ithuba lokuba bafake isandla kumaphulo okuphu hlisa iindawo abahlala kuzo.
"
"ndo dovha nda ḓivhadza kha mulaedza wa lushaka uri ri ḓo vhetshela thungo 1% ya mugaganyagwama wa lushaka ine ya ḓo shuma kha vhurangeli ha mishumo ya vhaswa.
","eli nyathelo lenzelwe ukwenza utshintsho luze lwenze impe mbelelo, ngokuchasene nee nkqubo ezingaphelelanga ezithe zaba nempembelelo encinci.
"
"tshivhalo tsha mbekanyamushumo na thandela zwi khou dzudza nywa u ḓo sedzana na khaedu dza lushaka.
","ndazisile kwakhona kwi ntetho kamongameli engobume besizwe ukuba siza kubekela bucala i1% yohlahlolwabiwo mali lwesizwe kwiphulo lokuqeshwa kolutsha.
"
"vhaswa vha shango ḽashu zwi tou vha khagala uri vha vhona izwi sa shango ḽine ḽa vha na tshikhala na u ṋea fulufhelo , naho hu na zwikhakhisi zwine vha ṱangana nazwo.
","inani leenkqubo neeprojekthi ziyilelwe ukushukuxa lo mngeni wesizwe.
"
"kha vhege nthihi yo fhiraho ndo ṱangana na vhaswa vho vhalaho vha afrika tshipembe vhane ra ḓihudza ngavho ri tshi sedza hune ra bva hone na zwe ra zwi swikela.
","ulutsha lwesizwe sethu lukubona ngokucacileyo oku njengesizwe esinamathuba nezithembiso, nangona kukho imiqobo neengxaki oluhla ngabezana nazo.
"
"hu na vhathu vha mitambo vha tshe vhaṱuku u fana mukoni vhukuma wa golofo sim ""tiga tshabalala ane a vha kha vhuimo ha nṱha kha u wina pfufho dza zwa golofo dza dzitshaka a kha ḓi tou vha na miṅwaha ya malo fhedzi.
","kule veki iphelileyo ndiye ndadibana nolutsha lwasemzantsi afrika olwandenza ndazingca ukuba sisuka phi nempumelelo yethu.
"
"u kha vhuimo ha vhusumbe kha ḽifhasi kha tshi gwada tsha vha miṅwaha yawe nahone o wina thonamennde ya golofo ya us kids luvhili lwoṱhe.
","kukho ulutsha oluzibandakanye kwezemidlalo olufana nosim 'tiger' tshabalala oneminyaka esi8 onesiphiwo esimangalisayo ophumelele iimbasa ezininzi zegalufa kwihlabathi.
"
"muya wanga wo ḓo takala vhukuma musi mugudi wa gireidi ya 11 sinoyolo qu mba u bva orange farm a tshi nṅwalela nga ha zwine zwa tea u vha kha sona ya ṅwaha uno.
","ubekwe kwindawo yesi7 kwihlabathi kwiqela lakhe lobudala kwaye uphumelele ukhuphiswano lwega lufa lwasemelika kabini.
"
"zwavhuḓivhuḓi o ṱanganela na thimu yashu ya u ṅwala tshipitshi kha phurosese ya mvetamve to.
","umoya wam waphakama xa umfundi webanga le11 usino yolo qumba ovela eorange farm wandibhalela malunga noko kufanele ukuba kubekhona kwisona yalo nyaka.
"
"hu na vhalwelatshanduko vho ḓikumedzelaho u fana na ayakha melithafa u bva ngei eerste rivier kapa vhukovhela, we a dzhenela kha foramu ya zwa ikonomi ya ḽifhasi ngei davos u ita khuwelelo kha vharangaphanḓa vha ḽifhasi uri vha ime vho khwaṱha kha vhulamukanyi ha zwa kilima.
","uye wajoyina iqela lethu lokubhala intetho kwinkqubo yoyilo.
"
"ndo vha ndo mangala vhukuma musi ndi tshi ṱangana na michelle nkamankeng ane, kha miṅwaha ya 11, ndi ene muṅwali muṱukusa nahone u vhaliwa kha vhaṅwali vhaṱukusa vha maimo a nṱha vha fumi ḽifhasini.
","kukho amatshantliziyo afana noayakha melithafa osuka eeerste rivier entshona kapa, obezimase iworld economic forum edavos ukucela iinkokheli zehlabathi ukuba zime ngokuqinileyo kubulungisa bemozulu.
"
"muṅwali wa bugu dza sumbe o ṅwala bugu yawe ya mathomo a na miṅwaha ya rathi.
","ndamangala xa ndandidibana nomichelle nkamankeng, oneminyaka eli11 ubudala, ongoyena mbhali umnci nane eafrika kwaye ubalwa phakathi kwababhali abaphezulu abalishumi abancinci kwi hlabathi.
"
"sa zwe phurofesa vho jonathan jansen vha amba: u na vhuḓifulufheli, u kona u amba, u na nḓivho na vhudugambilu.
","umbhali weencwadi ezisixhenxe owathi wabhala incwadi yakhe yokuqala eneminyaka emi6 ubudala.
"
"""ndi vhaswa avha vhane vha vha dzhuwele dza vhukuma dza vhumatshelo ha shango ḽashu vha ri humbudzaho uri mbofholowo yo winiwa nga kha zwiṱhavhelo zwa vhanna na vhafumakadzi vhaswa vhe vha vha vho ḓiimisela uri hu si vhone fhedzi, fhedzi na avho vhe vha ḓa nga murahu vha fanela u tshila kha tshedza tsha mbofholowo.
","nje ngoko unjingalwazi jonathan jansen wathi ukumchaza: ""uno kuzithemba, uyacacisa, uno kuqonda kwaye unothando.""
"
"ri fanela u bvela phanḓa na u shumisana sa muvhuso, mabindu, vhashumi na vhadzulapo u khwaṱhisedza uri muhwalo wa vhushayamushumo a u khou bvela phanḓa na u lemela vha swa vhashu, u pwasha mimuya yavho, zwa vhanga uri vha fhelelwe nga fulufhelo.
","ngabantu abatsha abafana naba abalingomso nekamva eliqaqambileyo lesizwe sakuthi, abasikhumbuzayo ukuba le nkululeko siyixhamlayo yalwela ngegazi neenyembezi likhaba lakuthi elalizimisele ukuba ayilulo kuphela, kodwa ngabo beza emva kwabo, ekufuneka bahlale ekukhanyeni kwenkululekokufuneka siqhubeke sisebenzisana njengorhulumente, amashishini, ezabasebenzi noluntu ukuqinisekisa ukuba umthwalo wokungapha ngeli awuqhubeki ukutyhafisa ulutsha lwethu, ukutyumza imimoya yalo nokulwenza ukuba luphelelwe lithemba.
"
"ndi na fulufhelo ḽa uri mishumo ye ra i sumbedzisa kha sona i ḓo imela mukano muswa wa mveledziso ya vhaswa.
","ndiqinisekile ukuba iintshukumo esizichaze kwisona ziya kubonisa umda omtsha wophuhliso lolutsha.
"
"sa zwe frantz fanon a amba, ndi u funza murafho muṅwe na muṅwe u tumbula mishini wawo.
","njengoko ufrantz fanon esitsho, kukwisizukulwana ngasinye ukufumanisa injongo yaso.
"
"murafho uyu wo tumbula wao.
","esi sizukulwana sifumene ezaso.
"
"zwi kha riṋe zwino uri ri vha tikedze kha u u bveledza.
","kukuthi ngoku ukuba siluxhase ukuze luzifezekise.
"
ndi ngoho ya kale na kale ya uri u kundelwa ha lushaka u bvelela zwavhuḓi kha u ṱhogomela na u khwaṱhisa vhukoni ha vhaswa vhalwo zwi tsilufhadza vhuma tshelo ha shango ḽeneḽo.,kuyinyani eyimbali ukuba ukungaphumeleli kwesizwe ukukhulisa ngempumelelo nokuphucula amandla obuchule bolutsha bayo kupela ukutshabalala kwekamva lelo lizwe.
"kha vha pulanele masheleni avho nga vhuṱali dr rufaro mucheka ṅwaha muswa ndi tshikhala tsha u thoma nga vhuswa, u ḓivhetshela zwipikwa zwine zwa tshila, u sika madzema maswa na u dzudzanyulula madzema a mashumisele a mashelelni a kale u itela vhumatshelo ho khwaṱhaho.
","cwangcisa iimali zakho ngobulumko ugq rufaro mucheka unyaka omtsha lithuba lesiqalo esitsha, uzibekele iinjongo ezivakalayo, uzibekele iinjongo ezilulutho, ukudala ukuziqhelanisa nezinto ezintsha kwaye ulungelelanise indlela za kho zangaphambili zokuse benzisa imali ukuqinisekisa ikamva elizizileyo.
"
