zul,afr
"ukuguqula umkhakha wezolimo vukuzenzele unnamed kamuva nje, umnyango wezolimo, ukuguqulwa komhlaba kanye nokuthuthukiswa kwezindawo zasemakhaya (idlrd) wamemezela ukuthi amalungu omphakathi azokwazi ukufaka izicelo zokuqasha umhlaba wombuso ongamahe ktha ayizi700 000 ongasetshenziswa noma ohleli nje ezifundazweni eziyisikhombisa.
","transformasie van die landbousektor vukuzenzele unnamed die departement van landbou, grondhervorming en landelike ontwikkeling (dlglo) het onlangs aangekondig dat lede van die publiek aansoek sal kan doen om 700 000 hektaar onderbenutte of leë staatsgrond in sewe van die provinsies te huur.
"
"ezolimo ziyinsika yesisekelo sokumbiwa phansi kwe mvelo.
","landbougrond is die hoof steun van ons natuurlike hulpbronbasis.
"
"ukuba khona nokuse tshenziswa okusimeme kwendawo yokulima izitshalo nokufuya izilwane sizonqoba ngakho.
","die beskikbaarheid en volhoubare gebruik van landbougrond waarop gewasse aangeplant kan word en vir veeteelt is van kardinale belang vir ons oorlewing.
"
"iningizimu afrika inomhlaba omningi kakhulu olungele umkhiqizo wezolimo, ama37.9% omhlaba wethu wonke njengamanje usetshenziselwa ezolimo ukuze kuthengiswe.
","suidafrika het wyd uitgestrekte grondoppervlakke wat geskik is vir landbouproduksie, met net 37,9% van ons totale landoppervlakte wat tans vir kommersiële landbou gebruik word.
"
"njengamanye amazwe, umhlaba wethu ovundile usengcupheni yokuncipha kokuvunda, ukungabi namanzi ngokwanele kanye nokusetshenziswa komhlaba ukwakha kuwona.
","ons bewerkbare grond word, soos in baie ander lande, bedreig deur grondverswakking, waterskaarste en stedelike indringing.
"
"siphinde silahlekelwe umhlaba wokulima omkhulu kakhulu ngenxa yezinguquko ekusetshe nzisweni komhlaba.
","ons verloor ook puik landbou grond deur veranderings in grondgebruik.
"
"uma sibheka umlando wethu, ukunweba ukufinyelela emhlabeni wokulima imikhiqizo ezothengiswa nokulimela ukuziphilisa kuyinto eseqhulwini kuzwelonke.
","gegewe ons geskiedenis, is die verbreding van toegang tot landbougrond vir kommersiële produksie en bestaansboerdery, n nasionale prioriteit.
"
"yize uhlelo lokuguqulwa komhlaba lwangasemva kowe1994 luholele ekubu yisweni komhlaba omningi wabuyiselwa kubantu aba nsundu baseningizimu afrika, umphumela oyingozi womthetho wangowe1913 womhlaba wabomdabu uyaqhubeka nokubonakala ebunikazini bomhlaba wokulima.
","hoewel die grondhervormingsproses na 1994 daartoe gelei het dat meer grond aan swart suidafrikaners teruggegee en herstel is, leef die skadelike uitwerking van die wet op naturelle grond van 1913 steeds voort in patrone van landbougrondeienaarskap.
"
"lo mthetho waqhubeka na ngaphezu kokuphuca izigidi zabantu umhlaba wokhokho babo.
","die wet het baie verder gestrek as die onteiening van miljoene mense se voorvadersgrond.
"
"njengoba ubunikazi bomhlaba busesezandleni zabayidlanzana, nokukhiqizwa kwezolimo okukhulu nemisebenzi ehambisana nokukhiqizwa iphethwe ngabalimi abamhlo phe, imiphumela ye sikhathi sethu esedlule isalokhu inathi namuhla.
","die uitwerking van ons verlede duur steeds voort deur grondeienaarskap wat steeds meestal in besit van die minderheid is, en landbou primêre produksie en waardekettings wat hoofsaaklik deur wit kommersiële boere besit word.
"
"ukuqhubeka nokubusa wedwa emikhiqizweni eba lulekile njengomhlaba akusiso nje isithikamezo ekwenzeni ngcono umphakathi oli nganayo; kuzodala inxu shunxushu emphakathini.
","die voortgesette monopolisasie van n belangrike produksiemetode soos grondverwerking, is nie net n hindernis tot die bevordering van n meer gelykmakende samelewing nie; dit is ook n resep vir maatskaplike onrus.
"
"ukulambela umhlaba wokulima kuyakhula, ikakhulukazi kulabo abadla imbuya ngothi emakhaya.
","die hunkering na grond om te bewerk neem toe, veral onder arm landelike mense.
"
"ngezizathu eziningi, ukuguqulwa ko mhlaba kulo mkhakha ku hamba ngonyawo lonwabu futhi akugculisi.
","en die tempo van grondhervorming in dié spesifieke sektor is, om verskeie redes, stadig en onbevredigend.
"
"ukuguqula ukuphathwa kobunikazi bomhlaba wokulima kubaluleke kakhulu hhayi nje ukuze kubhekanwe no mlando ongenabulungiswa, kodwa ukuze sivikele ukuphepha kokudla kwesizwe sethu.
","transformerende patrone van landbougrondeienaar skap is noodsaaklik om nie net die geskiedkundige ongeregtighede van die verlede die hoof te bied nie, maar ook om ons nasie se voedselsekerheid, te beveilig.
"
"njengoba kubekiwe embi kweni wangowezi2019 wesi gungu eseluleka umongameli ngokuguqulwa komhlaba kanye nezolimo, ""ngesikhathi thina sithumela ukudla kwamanye amazwe, emuva ekhaya abantu abangama41% ezindaweni zasemakhaya kanye nabangama59.4% emadolobheni abafinyeleli ngokwanele ekudleni.""
","volgens die 2019 verslag van die presidensiële raadgewende paneel oor grondhervor ming en landbou, ""het 41% van mense in ons landelike gebiede en 59,4% in stedelike gebiede in ons land ernstige onvoldoende toegang tot voedsel, hoewel ons voedsel uitvoer"".
"
"ukuguqulwa kwezolimo bekulokhu kuseqhulwini kubaphathi abalandelanayo kusukela kwintando yeningi labantu.
","landbouhervorming was sedert demokrasie n prioriteit van opeenvolgende regerings.
"
"phakathi kowe1994 nondasa kowezi2018 uhulu meni unikeze amahektha omhlaba ayizigidi eziyisi8.4 kubantu abebencishwe amathuba ngaphansi kohlelo lokuguqulwa komhlaba.
","tussen 1994 en maart 2018, het die staat deur die grondhervormingsprogram 8,4 mil joen hektaar grond aan voor heen benadeelde individue gelewer.
"
"kodwa le nqubekelapha mbili ilingana nokungaphansi kwe10% komhlaba ophelele wokulima.
","vordering beloop egter minder as 10% van alle kommersiële landbougrond.
"
"enkulumweni yami yesimo sezwe ekuqaleni kwalo nyaka ngazibophezela ukuthi umhlaba wokulima ongapha nsi kukahulumeni uzodede lwa maduze ukuze kulinywe.
","in my staatsrede vroeër vanjaar, het ek my daartoe verbind om landbougrond wat deur die staat besit word binnekort vir boerdery beskikbaar te stel.
"
"lokhu kuyingqophamla ndo ohlelweni lokuguqulwa kwezolimo, futhi lugcina isithembiso esikusomqulu wenkululeko esithi umhlaba kuzokwabelwana ngawo kulabo abasebenza kuwona.
","dit is n belangrike mylpaal in die landbouhervormingsproses en gee uitvoering aan die vryheidsmanifes se belofte dat die grond onder diegene wat dit bewerk, verdeel sal word.
"
"umbono wethu wokuphi nde kwabiwe umhlaba uhlose ukulinganisa phakathi kobulungiswa kwezenhlalo noku lungisa, nokukhulisa imi khiqizo yezolimo ngokuletha abalimi abansundu abaningi emnothweni omkhulu.
","ons herverspreidingsvisie poog om die regte balans tussen maatskaplike ongeregtigheid en regstelling te vind en om landbouuitsette te bevorder deur meer swart boere tot die hoofstroomekonomie te laat toetree.
"
"umhlaba uyifa eliletha inzuzo futhi ungasetshenzi swa njengesibambiso ukuzu za elinye ifa.
","grond is n produktiewe bate wat wins genereer en vir kollateraal gebruik kan word om ander bates te verkry.
"
"kumele siqinisekise ukuthi umhlaba odingekayo ukuze kulinywe usetshenziswa ngendlela enenzuzo.
","ons moet ook verseker dat grond wat vir boerderydoeleindes verkry word, produktief gebruik word.
"
"ukuze siqaphe umhlaba onikeziwe kahulumeni ukuze kuli nywe kuwona, isivumelwano sokuwuqasha asidluliseleki komunye umuntu.
","om die toegekende stuk grond vir boerderydoeleindes te beskerm, is die huurreg nie oordraagbaar nie.
"
"abazu zile bazosayina isivumelwano sokuqasha nohulumeni bese bekhokha imali yokuqasha elingana nenani lomhlaba.
","begunstigdes sal n huurkontrak met die staat teken en n huurfooi wat in ooreenstemming met die grondwaarde is, betaal.
"
"kumele futhi siqinisekise ukuthi abalimi bayasekelwa baze basimame futhi benze inzuzo.
","ons moet ook verseker dat boere op die pad na volhoubaarheid en winsgewend heid ondersteun word.
"
"njengengxenye yalolu hlelo, abazuzile bazoqeqeshwa ngokulawula izimali kanye nokuthuthukiswa kwamabhizinisi.
","as deel van die program, sal begunstigdes opleiding in finansiële bestuur en ondernemingsontwikkeling ontvang.
"
"isikhathi esidlule sibonise ukuthi abalimi abasafufusa nabasebancane ba jwayele ukuswela amakhono kwezezimali ukubhekana namathuba ezimakethe kanye nokuzihlanganisa nokwenziwa kwemikhiqizo.
","ervaring het getoon dat opkomende en klein skaalse boere dikwels nie die finansiële vaardighede het om markgeleenthede te benut en met waardekettings te integreer nie.
"
"sibeke eqhulwini abesifazane, intsha kanye nabantu abaphila nokukhubazeka njengabantu abazozuza.
","ons prioritiseer vroue, die jeug en mense met gestremdhede as begunstigdes.
"
"sekube nempumelelo ebonakalayo ngokuhlomisa abalimi besifazane ngaphansi kwesu lokutholwa komhlaba ipro active land acquisition strategy (iplas).
","daar is bewysbare sukses met die bemagtiging van vroulike boere onder die bestaande proaktiewe grondverkrygingstrategie (pgvs).
"
"ezifundazweni eziningi, abesifazane asebenikwe amapulazi yidlrd bakwazile ukuwaqhuba ngempumelelo futhi sebedlulele ekukhiqizeni imikhiqizo ethengiswayo.
","vroue aan wie plase in verskeie provinsies deur die dlglo toegeken is, kon dit suksesvol bestuur en kon selfs na kommersiële produksie oorskakel.
"
"ukwengeza ekutholweni komhlaba ngokwawo, u mnyango uyaqhubeka no kutshala izimali kwingqala sizinda, izinsizakusebenza nemishini ukuze labo somabhizinisi abancane bezokwazi ukuqhuba amabhizinisi aphumelelayo.
","die departement belê ook, buiten grondverkryging self, in infrastruktuur, toerusting en masjinerie om dié entrepreneurs in staat te stel om suksesvolle besighede te bedryf.
"
"ukusabalalisa ukufinyelela emhlabeni nasemathubeni okulima kuzosekela ukusu ngulwa kwemisebenzi kanye nokuthuthukiswa kwama bhizinisi, futhi kuthuthukisa imakethe yokudla, izimpahla zolimo kanye nezinsiza.
","verhoging van toegang tot grond en boerderygeleenthede sal werkskepping en ondernemingsontwikkeling ondersteun en die mark vir voedsel, landbougoedere en dienste, verbeter.
"
"inhloso enkulu yokudedela lezi ziqephu zomhlaba ngukuguqula isimo sezolimo ngokukhulisa isizukulwane esisha sabalimi.
","die uiteindelike doelwit van die beskikbaarstelling van dié grond, is om die landboulandskap te transformeer deur n nuwe generasie boere te ontwikkel.
"
"ukuqasha umhlaba ngaphansi kwezimo ezivunayo kumele kubenze bacabange okukhulu; hhayi nje ukukhulisa amabhizinisi abo kodwa ukwenza ngcono ingcebo okwabelwana ngayo kanye nokuchuma emiphakathini abalima kuyona.
","die verhuring van grond onder sulke gunstige toestande moet hulle aanspoor om groot planne te hê; om nie net hul eie ondernemings te ontwikkel nie, maar om gedeelde rykdom en voorspoed in die gemeenskappe waar hulle boer, te bevorder.
"
"kumele bapholise ama nxeba obandlululo lwesikhathi sethu esedlule.
","hulle moet die ernstige verdeling van ons verlede genees.
"
"kumele bayichithe inkolelo ethi abalimi abamhlophe kuphela abaphumelelayo ekuthengiseni eningizimu afrika, nokuthi abalimi aba nsundu bahlale 'befufusa.
","hulle moet die stereotipe siening dat net wit boere in suidafrika kommersieel suksesvol is en dat swart boere aanhoudend ‘opkomend’ is, uit die weg ruim.
"
"'ekusebenzeni lo mhlaba; ukuwusebenzisela ukukhiqiza, nakanjani bazophendula izinkemba zibe ngamageja.
","deur die grond te bewerk en dit produktief te maak, sal hulle inderdaad swaarde in ploegskare verander.
"
bazoba yizibonelo zokubu yisana kwezwe.,hulle sal die simbool van nasionale versoening word.
