"ons het dieselfde hier gedoen, maar ons inperking het 'n baie betreurenswaardige foutlyn in ons samelewing onthul, wat aandui hoe uiterste armoede, ongelykheid en werkloosheid die struktuur van ons gemeenskappe uitmekaar skeur.
","re dirile seo le ka nageng ya rena, eupša go tswalela ga naga ga rena go utollotše maswabi a magolo kudu ka setšhabeng sa rena ao a laetšago ka fao bohloki bjo bogolo, tlhokego ya tekatekano le tlhokego ya mešomo di senyago seemo sa ditšhaba tša rena.
"
"daar kan geen groter foltering wees as dié van ouers wie se kinders by hulle huil omdat hulle nie kos het nie, maar hulle het niks om te gee nie.
","ga gona tlalelo ya go feta ya motswadi yo bana ba gagwe ba mo llelago ba nyaka dijo, eupša a hloka dijo tšeo a ka ba fago tšona.
"
"daar kan geen groter onreg bestaan as 'n samelewing waar sommiges in gemak en oorvloed leef, terwyl ander sukkel om met min of niks te oorleef nie.
","ga gona tlhokego ye kgolo ya toka ya go feta ge setšhaba seo batho ba bangwe ba phelago ka boiketlo le katlego go sona, mola ba bangwe ba hlophega go fetišiša gore ba phele ka se sennyane seo ba nago le sona goba ba hloka seo ba ka iphedišago ka sona.
"
"ja, dit is die hartseer nagevolge van 'n gebroke en ongelyke verlede.
","ee, tše ke diabe tša mašaledi a nako ye e fetilego yeo e bego e na le mathata le tlhokego ya tekatekano.
"
"maar dit is ook 'n simptoom van 'n fundamentele mislukking in ons samelewing ná apartheid.
","eupša gape ke maswao ao a laetšago go palelwa kudu ga setšhaba sa ka morago ga kgethologanyo.
"
"die landwye inperking in reaksie op die koronavirus het 'n jarelange probleem aansienlik vererger.
","go tswalela ga naga ka bophara bjale ka ge e le phetolo ya coronavirus go mpefaditše kudu bothata bjo e bego e le kgale bo le gona.
"
"die afgelope paar weke is ons gekonfronteer met ontstellende beelde van desperate mense wat mekaar vir kospakkies by verspreidingsentrums vertrap en gemeenskappe wat protesoptogte hou teen voedseltekorte.
","mo dibekeng tše mmalwa tšeo di fetilego, re itemogetše diswantšho tšeo di bego di kweša bohloko tša batho bao ba lego kgakanegong ba baka diphuthelwana tša dijo mafelong ao di bego di abja gona le ditšhupetšo tšeo di bego di dirwa ke setšhaba kgahlanong le tlhaelelo ya dijo.
"
"ons het ook bewerings gehoor wat ontstellend en walglik is.
","gape re ile ra swanela ke go go šogana le ditatofatšo tše ka bobedi tše di kwešago bohloko ebile di re tsentšha mahlo a batho.
"
"verskeie provinsies het berigte ontvang van gewetenlose individue, sommige van hulle na bewering regeringsamptenare, wat kospakkies wat vir die behoeftiges en kwesbares bestem is opgaar of verkoop, of vir hul vriende en familie gee.
","diprofense tše mmalwa di amogetše dipego tša gore go na le batho bao ba sa kgathalelego ba bangwe, bao go bona go nago le bahlankedi ba mmušo, ba fihlago goba ba rekišago diphuthelwana tša dijo tšeo di swanetšego go ﬁ wa bahloki le badikobjanamagetleng, goba ba di lebiša go bagwera ba bona le ba lapa.
"
"as daar bevind word dat daar enige waarheid in hierdie bewerings steek, sal ons baie streng teen die betrokke individue optree.
","ge e le gore dipolelo tše ke nnete, re tla otla batho bao ba dirago tše gabohloko.
"
"met die verklaring van 'n nasionale ramptoestand en die instelling van 'n landwye inperkingstoestand het ons ’n onbekende terrein betree.
","ka go tsebišwa ga seemo sa masetlapelo sa bosetšhaba le go tswalela naga ka bophara re tsene seemong seo re sego ra ka ra ba ka go sona mo nakong ye e fetilego.
"
"dit was nog nooit voorheen vir suidafrika nodig om 'n openbare gesondheidsnoodsituasie van hierdie omvang te hanteer nie.
","afrika borwa ga se ya ka ya swanela ke go lebana le seemo sa maphelo a setšhaba se segolo ka tsela ye.
"
"ons moes vinnig optree om lewens te red.
","re ile ra swanela ke go tšea kgato ka pela gore re phološe maphelo.
"
"en ons moet erken dat die voorsiening van ondersteuning aan die land se kwesbaarste burgers in die dae en weke wat hierop gevolg het, stadiger was as wat dit moes wees, en dat sekere probleme oor die hoof gesien is.
","gomme re swanetše go dumela gore ka matšatši le dibeke tšeo di latetšego, kabo ya thekgo go badudi ba naga ya rena bao ba lego kotsing kudu e ile ya nanya go feta ka fao go nyakegago ka gona, gomme le go palelwa go ile gwa hlaga.
"
"die uitbetaling van maatskaplike toelaes het egter betreklik glad verloop, en ná 'n aantal tegniese uitdagings word die voedselverspreidingstelsel nou gestroomlyn.
","le ge go le bjale, tefelo ya tšhelete ya thušo ya leago e ile ya tšwela pele ntle le mathata, gomme ka morago ga mathata a sethekniki, lenaneo la kabo ya dijo le a phethagatšwa.
"
"die instelling van 'n landwye inperkingstoestand op baie kort kennisgewing het tot verskeie uitdagings gelei.
","go tsenya tirišong go tswalela naga ka bophara ka tsebišo ye e dirilwego ka pejana kudu go tlišitše mathata a mmalwa.
"
"ons moes die relatiewe uitwerking van die nasionale reaksie opweeg teenoor die omvang van die beperkings wat ons sou moes instel.
","re ile ra swanela ke go lekodišiša tekanelo ya phetolo ya bosetšhaba le bogolo bja dikiletšo tšeo re ilego ra swanela ke go di phethagatša.
"
"ons het oplaas die roete van omsigtigheid gekies.
","mafelelong re ile ra kgetha go obamela keletšo yeo re ilego ra ﬁ wa yona.
"
"en soos die ministerie van gesondheid se voorlegging onlangs aangedui het, het die inperking wat ons die afgelope tyd afgedwing het die infeksiekoers vertraag en, selfs belangriker, vir ons tyd gekoop om voor te berei op 'n moontlike toename in infeksies in die komende weke en maande.
","gomme ka ge tlhagišo yeo e dirilwego ke tona ya maphelo e laeditše mo nakong ye e sa tšwago go feta, go tsenya tirišong go tswalela ga naga ka nako ye re e dirilego ka yona go dirile gore dipalopalo tša batho bao ba fetelwago ke baerase di nanye, gomme se bohlokwa kudu ke gore se se ile sa re fa nako ya go itokišetša kgonagalo ya koketšego ye kgolo ya batho bao ba fetelwago ke baerase mo dibekeng le dikgweding tše di tlago.
"
"ons moes die impak op 'n reeds sukkelende ekonomie op die lang en kort termyn oorweeg, en ons moes die uitwerking van hierdie wesenlike ontwrigting op die lewensbestaan van miljoene mense in oënskou neem.
","re ile ra swanela ke go gopodišiša ka ga seabe sa seemo se go ekonomi ye e šetšego e fokola ka go bobedi lebaka le letelele le le lekopana, le seabe sa tšhitišo ye kgolo ye go maphelo a dimilione tša batho.
"
"ons moes nadink oor wat weke se inperking by die huis sou beteken vir werkers wat nie gereelde salarisse kry nie, vir werkloses en mense wat werk soek, vir mense wat informele of seisoenale werk doen, vir diegene in die informele sektor, vir die behoeftiges en vir die kwesbares.
","re ile ra swanela ke go gopodišiša mabapi le gore dibeke tša go dula ka magae ga batho go tla ra eng go bašomi gomme ba sa tle go hwetša meputso ya bona ya tlwaelo ka lebaka la se, go bao ba hlokago mešomo le go bao ba nyakago mešomo, go bao ba šomago mešomo ya lebakanyana goba bao ba šomago dinako tše itšego, go bao ba šomago ka lekaleng leo e sego la mmušo, go bahloki le go bao ba lego kotsing.
"
"die kabinet gaan 'n stel maatreëls ﬁ naliseer om te reageer op die uitwerking van die inperking op die lewensbestaan van ons mense.
","kabinete e tla feleletša magato a mmalwa a go arabela seabe sa go tswalela naga go maphelo a batho ba rena.
"
"dit is voorafgegaan deur 'n reeks samesprekings met verskeie belanghebbendes, waaronder die sakesektor, georganiseerde arbeid, godsdienstige organisasies, die burgerlike samelewing en die presidensiële ekonomiese adviesraad.
","se se direga ka morago ga ge re bile le ditherišano tša mehutahuta le bakgathatema ba mmalwa go akaretšwa ba kgwebo, bašomi, mekgatlo ya sedumedi, setšhaba sa badudi le lekgotlakeletšo la mopresidente ka ga ekonomi.
"
"die maatskaplike vennote het verskeie voorstelle ingedien oor ingrypings wat die onmiddellike kwesbaarheid van die armstes van die armes, waarvan die meeste staatmaak op maatskaplike hulp om te oorleef, kan verlig.
","badirišani ba setšhabeng ba tlišitše ditšhišinyo tše mmalwa ka ga magato ao a ka rarollago go ba kotsing ga ka pela ga bao ba hlokago kudu, bao bontši bja bona ba botilego tšhelete ya thušo ya leago gore ba phele.
"
"ons sal die voorsiening van welsynsdienste in hierdie tydperk opskerp om huishoudings wat onder die armoedegrens leef, te help.
","re tla oketša kabo ya thušo ya leago mo nakong ye go thuša ba malapa ao a phelago ka tšhelete ya ka fase go ya go iphediša.
"
"selfs as die landswye inperkingstoestand opgehef word, sal die gevolge daarvan nog 'n geruime tyd gevoel word.
","le ka nako yeo go tswalela ga naga go fedišwago, batho ba tlo tšwela pele go itemogela seabe sa yona mo nako ye e tlago.
"
"diegene wat bevoorreg is om 'n bestendige inkomste te verdien, sal na hul werk kan terugkeer; maar vir miljoene ander sal dit 'n verlore maand wees waar hulle andersins tydelike werk kon gehad het, in die informele sektor sake sou gedoen het of geld kon gespaar het om hul gesinsverantwoordelikhede na te kom.
","bao ba nago le mahlatse a go ba le letseno la go se tekateke ba tlo kgona go boela mešomong ya bona; eupša go ba bangwe ba dimilione se e tlo ba kgwedi ye e ba lahlegetšego fao ba ka bego ba ile ba hwetša mošomo wa lebakanyana, ka ge ba ka be ba ile ba dira kgwebo ka lekaleng leo e sego la semmušo goba ba bolokile tšhelete yeo ba e hweditšego go hlokomela ba malapa a bona.
"
"voedselondersteuning is 'n noodmaatreël op die kort termyn.
","thekgo ya dijo ke kgato ya tšhoganyetšo ya lebakanyana.
"
"dit moet gepaard gaan met volhoubare oplossings wat ons kwesbaarste burgers help om in die moeilike tye wat nog voorlê, te oorleef.
","e tla swanela ke go nyalantšhwa le ditharollo tša go ya go ile tšeo di thušago batho ba rena bao ba lego kotsing kudu le ka dinakong tše boima tšeo di sa tlago.
"
"ek wil die talle nro's, godsdienstige groepe en gewone burgers bedank wat geld skenk en as vrywilligers help om honger en behoeftige mense te voed.
","ke rata go leboga mekgatlo ye e sego ya mmušo ye mentši (dingo), dihlopha tša sedumedi le badudi ba rena bao ba neelago tšhelete le go ithaopa go thuša go fepa bao ba hlokago dijo le badikobjanamagetleng.
"
"om honger te verlig, is nie 'n daad van barmhartigheid nie.
","go fediša bohloki ga se tiro ya kwelobohloko.
"
"dit is 'n noodsaaklikheid vir enige samelewing wat gegrond is op respek vir menseregte.
","ke selo se bohlokwa go setšhaba sefe goba sefe seo se theilwego go ditokelo tša botho.
"
"ons is op 'n punt in ons stryd teen die pandemie waar oorgerustheid rampspoedig kan wees.
","re mo nakong ya ntwa ya rena kgahlanong le leuba le fao go goga maoto go ka re tlišetšago masetlapelo.
"
"ek doen 'n beroep op elkeen om waaksaam te bly, om steeds die regulasies na te kom, om veilig te bly en om ander veilig te hou.
","ke ipiletša go yo mongwe le yo mongwe gore a dule a ntšhitše mahlo dinameng, go tšwela pele go obamela melawana, le go dula a bolokegile ebile a bolokile ba bangwe.
"
"as regering sal ons inligting voorsien oor die direkte ingrypings wat ons onderneem om ons kwesbaarste burgers teen die skrikwekkende vooruitsig van honger te beskerm.
","bjalo ka mmušo re tlo fana ka tshedimošo ka magato ao re a tšeago go phemela badudi ba rena bao ba lego kotsing kudu go kgonagalo ye kgolo ya gore ba ka bolawa ke tlala.
"
"die talle probleme wat ons mense tans in die gesig staar, moet nie nog verder vererger word deur onsekerheid oor waar hulle volgende maaltyd vandaan sal kom nie.","gareng ga mathata a mantši ao batho ba rena ba itemogelago ona mo lebakeng le, gore ba tla hwetša kae dijo tša bona tše di latelago ga se gwa swanela go ba ye nngwe ya ona."
"sajeug is n bron van inspirasie en hoop vukuzenzele unnamed elke keer wat ek die geleentheid het om met jong suidafrikaners te praat, kom frantz fanon se woorde, naamlik dat 'elke generasie sy missie moet ontdek', by my op.
","bafsa ba afrika borwa ke mothopo wa tlhohleletšo le kholofelo vukuzenzele unnamed mantšu a frantz fanon a gore ‘moloko o mongwele o mongwe o swanetše go utolla nepo ya ona’ a tla ka monaganong wa ka nako ye nngwe le ye nngwe ge ke hwetša sebaka sa go boledišana le bafsa ba maafrika borwa.
"
"elkeen het n brandende begeerte om die wêreld te verander, ongeag waar hulle woon en wat hulle doen.
","go sa kgathale gore ba dula kae ebile go sa kgathale gore ba dira eng, yo mongwe le yo mongwe o na le phišegelo ye kgolo ya go fetoša lefase.
"
"hulle wil ook, terwyl hulle beslis hulle eie lewens wil verbeter, n beter samelewing en wêreld tot stand bring.
","le ge e le gore ka nnete ba nyaka go kaonafatša maphelo a bona, gape ba nyaka go ﬁ hlelela setšhaba se sekaone le lefase le lekaone.
"
"hulle sien hulself as agente vir fundamentele transformasie.
","ba ipona bjalo ka bahlankedi ba phetogo ya motheo.
"
"jong mense was nog altyd regdeur die geskiedenis n dryfkrag vir verandering.
","ka historing ka moka bafsa ba bile ketapele go phetogo.
"
"jong mense het die afgelope paar dekades verskeie veldtogte teen ongeregtigheid gevoer, van die 1968studenteopstand in parys, tot die teenoorlogbeweging in die verenigde state in die 1960's, tot die teenkoloniale stryd in baie afrikaen asiatiese lande, tot die stryd teen apartheid, tot die arabiese lente.
","mo mengwagasomeng ye mmalwa ye e fetilego, bafsa ba hlomile twantšho kgahlanong le tlhokego ya toka, go thoma ka dikgarurung tša baithuti tša 1968 ka paris, go ﬁ hla go lesolo la twantšho ya dintwa ka united states ka mengwageng ya bo 1960, go ﬁ hla go twantšho ya bokoloniale ka dinageng tše ntši tša afrika le tša ešia, go ﬁ hla go ntwa kgahlanong le kgethologanyo, go fihla go megwanto kgahlanong le mebušo ya maarapomo nakong ye e sa tšwago go feta, bafsa ba bile ketapele ya lesolo la #blacklivesmatter leo le hweditšego thekgo ya lefase ka bophara ka morago ga polao ya george floyd ka united states.
"
"jong mense was mees onlangs aan die spits van die #blacklivesmatterbeweging, wat wêreldwyd steun verwerf het nadat george floyd in die verenigde state vermoor is.
","mo dibekeng tše mmalwa tše di fetilego, balweladitokelo tša bathobaso lefaseng ka bophara ba be ba nyaka go tlošwa ga maswao ao a retago bošoro le dikgaruru tša bao ba bego ba gweba ka makgoba le bokoloniale.
"
"aktiviste van regoor die wêreld het ook die afgelope paar weke die verwydering van simbole wat die barbaarsheid en geweld van die slawehandel en kolonialisme verheerlik, geëis.
","ka ditšhupetšong tšeo di bego di dirwa ka yunibesithing ya oxford mo nakong ye e sa tšwago go feta modiraditšhupetšo o be a swere polakata yeo e bego e ngwadilwe mantšu a ‘rhodes must fall’, e lego seo se bego se thekga seo se bego se dirwa ke baithuti ka nageng ya rena mo mengwageng ye mehlano ye e fetilego.
"
"n betoger het onlangs by n betoging by oxford universiteit n plakkaat gedra met die woorde 'rhodes moet val', 'n strydkreet van studente in ons eie land vyf jaar gelede.
","bafsa go ralala le lefase ba hweditše seo ba ka se lwelago mmogo.
"
"jong mense regoor die wêreld het n gemeenskaplike doelstelling gevind.
","ba thuba dihlwadieme le maswao a semorafe, ba nyaka gore go tlošwe bokoloniale ka gare ga mananeothuto, ebile ba ipiletša go dihlongwa gore di fediše semorafe le go fediša go se akaretše ba bangwe setšhabeng.
"
"hulle breek standbeelde en simbole van rassisme af, eis die dekolonisasie van opvoedkundige kurrikula en vereis van instansies om rassisme en maatskaplike uitsluiting aan te pak.
","gomme ka fao, re ketekile segopotšo sa moloko wa 1976 ka la 16 phupu 2020, re reta gape bafsa ba afrika borwa ya ka morago ga kgethologanyo, e lego ba phethagatši ba bohlokwa ba bohwa bjo bohlokwa bjo.
"
"ons het op 16 junie 2020 hulde aan die generasie van 1976 gebring en bring ook hulde aan die jeug van postapartheid suidafrika, die waardige erfgename van dié edele nalatenskap.
","nepo ya moloko wa 1976 e be e le go fediša seo se bego se bitšwa thuto ya bathobaso; ya bafsa ba lehono ke go iša pele protšeke ya poelanyo le phetošo ya bosetšhaba.
"
"die 1976generasie se missie was om bantoeonderwys af te breek; die missie van vandag se jeug is om die projek van nasionale versoening en transformasie voort te sit.
","mo nakong ye e tlago go tla be go bolelwa ka ngwaga wo, gore ngwaga wa 2020 o bile mathomo a lebakanako le leswa la histori ya batho.
"
"daar sal mettertyd gesê word dat dié jaar, 2020, die begin van n nuwe epog in menslike geskiedenis was.
","coronavirus ga se ya ba fela le seabe se segolo go maphelo le go iphedišeng ga batho, e fetošitše gape le toka ya setšhaba lefaseng ka bophara.
"
"die koronavirus het nie net n enorme impak op mense se lewens en bestaan gehad nie, maar ook die globale maatskaplike orde verander.
","ka fao leuba le le hlasetšego batho ka gona e bile segopotšo sa kamagano ya batho le ya go se lekalekane kudu ga batho fao go lego gona gareng ga dinaga le ka gare ga dinaga.
"
"die wyse waarop die pandemie toegeslaan het, is n herinnering aan die onderlinge verbintenisse van die mensdom en die diep ongelykhede wat tussen lande en in lande bestaan.
","leuba le le emetše sebaka sa go ‘beakanya leswa’ lefase leo le nago le bojato, go ikhola le go itirela e sego fela ga batho eupša ga ditšhaba ka moka.
"
"die pandemie bied n geleentheid om n wêreld wat deur erge materialisme, selfsugtigheid en selfbeheptheid van individue en hele samelewings gekenmerk is, te 'herstel' .
","bafsa ba re botša gore maitshwaro a bohlokwa a seriti, a go naganela ba bangwe le a kwelobohloko a swanetše go ba metheo ya setšhaba se seswa seo se tlago tšwelela, le gore ba ikemišeditše go ba dinkgwete tša lefase le le leswa le lekaone.
"
"jongmense sê vir ons dat die noodsaaklike waardes van integriteit, deernis en eensgesindheid die kenmerke van die nuwe samelewing moet wees wat na vore sal kom en dat hulle vasbeslote is om die kampvegters vir dié nuwe, beter wêreld te wees.
","ka dipoledišanong tšeo ke bilego le tšona le bafsa ke boletše gore re se tsoge re nyaditše maatla a kgopolo ye itšego, ka gobane dikgopolo di kgona go fetoša lefase ebile di le fetošitše.
"
"ek het in my gesprekke met jongmense gesê dat ons nooit die mag van n idee moet onderskat nie, want idees kan en het die wêreld verander.
","dikgopolo di hlohleleditše kgatelopele ya batho gomme ke tšona di re kgontšhago go hloma tsela ye mpsha ka nakong ya ka morago ga coronavirus.
"
"idees het menslike vooruitgang aangewakker en dit is wat ons in staat stel om n nuwe pad in die postkoronavirusera uit te stippel.
","bafsa ba ba fetošitše dikgopolo tša bona go ba kgato ye ba e tšeago.
"
"dié jongmense het hulle idees in optrede omgeskakel.
","ga se ba dumelela tlhokego ya methopo go ba šitiša.
"
"hulle het nie toegelaat dat n tekort aan hulpbronne hulle kniehalter nie.
","ba itlhometše sebaka ka makaleng a mmalwa go thoma ka go la tirišo ya theknolotši ya maemo a godimo go ﬁ hla ka go tšwetše peleng go ya go ile ga tikologo.
"
"hulle het in n hele aantal sektore, van hipertegnologie tot omgewingsvolhoubaarheid, vir hulself n nis uitgekerf.
","bjale go feta le peleng re tla lebelela moya wa boitlhamelo le wa tšwetšopele ka mafolofolo wa bafsa ba rena gore ba tle ka ditharollo tšeo di ba holago, di holago ditšhaba le setšhaba go mathata a tlhokego ya mešomo.
"
"ons sal nou, meer as ooit, ons op die innoverende en baanbrekersgees van ons jeug beroep om oplossings vir die werkloosheidskrisis te vind wat vir hulle, hulle gemeenskappe en die samelewing voordelig sal wees.
","re sa le gona fao, ke hlohla bafsa ba rena go hloma le go hlama mananeo ao a tlago re kgontšha go fihlelela dinepo tša rena tša tšwetšopele.
"
"ek daag terselfdertyd ons land se jeug uit om programme te prakseer en ontwerp wat ons in staat sal stel om ons ontwikkelingsdoelwitte te bereik.
","ka 1961, naga ya cuba ye e lwelago ditokelo tša batho e rometše baithuti ba baithaopi ba bafsa dithabeng le metseng go ya go aga dikolo, go ruta go kgona go bala le go ngwala le go hlahla barutiši ba bafsa.
"
"revolusionêre kuba het in 1961 talryke jong studentevrywilligers na die berge en dorpies toe gestuur om skole te bou, geletterdheid te onderrig en nuwe opvoeders op te lei.
","lesolo le le sa bonwa bjalo ka lesolo la go ruta batho go bala le go ngwala leo le ilego la atlega kudu ka historing ya lehono.
"
"dit word steeds as een van die suksesvolste geletterdheidsveldtogte in die moderne geskiedenis beskou.
","bafsa ba rena ba swanetše go ba le masolo a go hlabolla setšhaba gomme ba swanetše go a eta pele.
"
"ons jongmense moet maatskaplike opheﬃ ngsinisiatiewe ontwikkel en aan die stuur daarvan staan.
","go swana le ge ba lwetše tekatekano ka go thuto ya godingwana, mafolofolo a magolo a bafsa ba rena a swanetše go šomišwa go lwantšha phihlelelo ye e lekalekanago ya tlhokomelo ya maphelo, go phetošo ya go ba beng ba naga le, se bohlokwa kudu, go lwela toka go tša bong.
"
"die aansienlike energie van ons jeug moet, net soos wat hulle die stryd vir geslagsgelykheid in hoër onderwys aangedurf het, ook vir die stryd vir gelyke toegang tot gesondheidsorg, die transformasie van grondeienaarskap en, die belangrikste, vir geslagsgeregtigheid, aangewend word.
","go swana le maafrika borwa ka moka, ke tshwentšwe kudu ke tlhatlogo ya dipolao tša makgarebe ka diatleng tša banna.
"
"ek, soos alle suidafrikaners, is diep ontsteld oor n opwelling in die aantal moorde op jong vrouens deur mans.
","tše ke ditiro tša bophoofolo tše di tšhošago tšeo go se nago le fao re di beilego gona ka setšhabeng sa rena.
"
"dit is skokkende, onmenslike dade wat nie in ons samelewing tuishoort nie.
","lesolo la baagi leo le etilwego pele ke bafsa, go tliša temošo le keletšo ya sethaka ke ditlabelo tše bohlokwa ka masolong a rena a go fediša dikgaruru tša bong setšhabeng (gbv).
"
"burgerlike aktivisme, bewusmaking en portuurberading wat deur die jeug gelei word, is kernbelangrike hulpbronne in ons poging om geslagsgebaseerde geweld in ons samelewing uit te roei.
","go sa le bjale, re swanetše go maatlafatša tshepedišo ya rena ya toka, re netefatše gore badirabosenyi ba a golegwa, le gore maemo a peila le a parola ya bona a a maatlafatšwa le gore bao ba rometšwego kgolegong bophelo ka moka ba tšea bophelo bja bona ka moka ba le ka kgolegong.
"
"ons moet terselfdertyd ons regstelsel versterk en verseker dat oortreders aan die pen sal ry, dat borgtogen paroolvoorwaardes opgeskerp word en dat diegene wat tot lewenslange tronkstraf gevonnis is, die res van hulle lewens agter tralies sal spandeer.
","le ge e le gore se se hloka kgato ye e tšewago ke setšhaba ka bophara, ke ipiletša kudukudu go masogana go lwantšha gbv .
"
"alhoewel dit optrede van regoor die samelewing vereis, vra ek vir jong mans in besonder om die stryd teen geslagsgebaseerde geweld aan te pak.
","ka ntle le ge re ka fediša ntwa ye e lebišitšwego go basadi ba afrika borwa, toro ya go ba le setšhaba se seswa e tla dula e le boima go ﬁ hlelelwa.
"
"die droom van n nuwe samelewing sal ons bly ontwyk, tensy ons die oorlog wat teen suidafrikaanse vrouens woed, beëindig.
","bao ba rena re bego re le karolo ya masolo a baithuti ka nakong ya kgethologanyo re fela re botšišwa gore re nagana eng ka ga bafsa ba lehono.
"
"diegene van ons wat tydens die apartheidsera deel van die studentebewegings was, word gereeld gevra wat ons van vandag se jongmense dink.
","go na le kgoketšo ya go boela morago kgale ‘nakong ya matšatšing a mafolofolo’ a dipolotiki tša baithuti le go lwela tokologo ga bafsa, yeo e ka se tsogego e bušeleditšwe.
"
"daar is n versoeking om in nostalgie oor die 'glorieryke dae' van studentepolitiek en jeugstryd wat nooit herhaal kan word nie, te verval.
","eupša go swana le bafsa ba mengwaga ye e fetilego ba be ba hlaloša nepo ya bona, bafsa ba lehono le bona ba hlalošitše nepo ya bona.
"
"net soos wat die jeug van die verlede hulle missie bepaal het, bepaal vandag se jeug egter ook hulle sn.
","bafsa ba afrika borwa ba ngwaga wa 2020 ba fihlelela kudu maemo a godimo ao a beilwego ke bafsa ba mengwaga ye e fetilego.
"
"die suidafrikaanse jeug van 2020 voldoen beslis aan die hoë standaard van hulle voorgangers.
","ba na le kholofelo, ga ba tekateke ebile ba na le kgotlelelo, gantši le ge go na le maemo a boima kudu.
"
"hulle is optimisties, lewenskragtig en dapper, dikwels in die moeilikste omstandighede denkbaar.
","ke mothopo wa tlhohleletšo le kholofelo.
"
"hulle is n bron van inspirasie en hoop.
","ka ditiro tša bona, ba aga lefase leo le nago le toka kudu, leo le lekalekanyago batho, leo le tšwelago pele go ya go ile la go ba le khutšo.
"
"hulle bou, deur hulle dade, n wêreld wat meer regverdig, gelykwaardig, volhoubaar en vreedsaam is.",bafsa go ralala le lefase ba ipiletša go dihlongwa go emiša semorafe le go hlokiša dihlopha tše dingwe setšhabeng menyetla.
"laat ons mekaar veilig hou vukuzenzele unnamed in ons reaksie op die koronaviruspande mie, het ons land na waarskuwingsvlak 2 be weeg.
","a re bolokegeng ka moka ga rena vukuzenzele unnamed naga ya gaborena e theošeditšwe go maemotemošo a bobedi mo magatong a rena a leuba la corona virus .
"
"dit is 'n verligting vir alle suidafrikaners wat die afgelope vyf maan de onder streng beperkings moes leef.
","se se tlile bjalo ka kimollo go maafrika bo rwa ka moka bao ba ilego ba swanela ke go phela ka fase ga dikiletšo tše tiišeleditšwego letsogo dikgweding tše tlhano tša go feta.
"
