"bou n nasie wat omgee vir kinders vukuzenzele unnamed geagte me desuidafrika ners, daar is n gesegde in baie afrikakulture wat stel dat dit n ge meenskap vat om n kind groot te maak.
","re aga setšhaba seo se hlokomelago bana vukuzenzele unnamed go na le seema seo se tlwaelegilego ditšong tša se afrika seo se rego ngwa na o godišwa ke setšha ba.
"
"dié idee — dat die breër gemeen skap vir die ontwikkeling, welstand en veiligheid van elke kind verantwoordelik is — gaan deur my gedagtes wanneer ek aan die onlangse tragiese en hoogs ontstellende dood, op n skoolkamp, van 13jarige enock mpianzi, dink.
","kgopolo ye – ya gore setšhaba ka bophara se na le maikarabelo a magolo go kgodišo, go boitekanelo le polokego ya ngwana yo mongwe le yo mongwe – e ntlela mogopolong ge ke nagana ka lehu la masetlapelo la go nyamiša kudu la mošemane wa mengwaga ye 13, enock mpianzi, ge a be a le kampeng ya sekolo matšatši a se makae ao a fetilego.
"
"enock is nie die enigste kind wat sy lewe verloor het in omstandighede wat voorkom kon word as volwassenes die nodige voorsorgmaatreëls getref en verantwoordelikheid geneem het.
","ka manyami, enock ga se ngwana a le tee yoo a lobilego bophelo bja gagwe ka mabaka ao a ka bego a thibetšwe ge feela nkabe batho ba bagolo ba bile le tlhokomelo le ma ikarabelo.
"
"dit laat n mens dink aan n ander 13jarige kind, keamohetswe shaun seboko, wat onlangs in n magaliesburgse laerskool se swembad verdrink het, en die twee kinders wat by laerskool lekgolo in limpopo oorlede is toe n trok in n muur vasgery het wat op hulle geval het.
","ke gopola le ngwa na yo mongwe wa mengwaga ye 13, keamohetswe shaun seboko, yoo matšatši a se makae a fetilego a kgamilwego ke meetse ka letangwaneng la go ruthela la sekolo sa phoraemari sa magaliesberg, le bana ba babedi bao ba hlokofetšego sekolong sa phoraemari sa lekgolo ka limpopo morago ga ge theraka e se no thula leboto leo le ilego la ba wela.
"
"n mens dink ook aan die talle kinders, soos sesjarige nathlia pienaar, wat in die kruisvuur van ’n bendeoorlog op die kaapse vlakte gesterf het.
","ke gopola gape le bana ba bangwe ba bantši, bjalo ka nathlia pienaar wa mengwaga ye 6 yoo a ilego a bolawa nakong ya dintwa tša digo ngwane tša dinokwane go la cape flats.
"
"ons onthou ook die tragiese dood van michael komape en lumka mkethwa wat dood is toe hulle in puttoilette geval het.
","re gopola gape le mahu a masetlapelo a michael komape le lumka mkethwa bao bobedi bja bona ba hlo kofetšego morago ga go wela ka dintlwaneng tša boithomelo tša melete.
"
"dit was heeltemal onnodig dat al hierdie jongmense, en baie ander, hul lewens verloor het.
","maphelo ao a go kgaotšwa e sa le a mannyane, mmogo le a ba bangwe ba bantši, nkabe a se a ba a lobja.
"
"al dié tragedies kon voorkom word as die nodige maatreëls om die kinders se veiligheid te verseker, getref was.
","ditiragalo tše ka moka tša masetlapelo nkabe di ile tša thibelwa ge nkabe go bile le magato ao a tšerwego go efoša bana ba dikotsing.
"
"dit lyk vir my asof ons, as n samelewing, ons kinders in die steek laat.
","go a bonagala go nna gore, bjalo ka setšhaba, re a palelwa ge go etla baneng.
"
"te veel kinders bevind hulself in gevaarlike situasies, hetsy op n tydelike vlot op n rivier of alleen in n gehuggie met n paraffienlamp.
","bana ba bantši kudu ba ikhwetša ba le maemong a kotsi, e kaba e le ge ba nametše seketswana sa maitirelo ka nokeng goba ba tlogetšwe ba le tee ka mokhukhung moo go tukago lebone la parafene.
"
"ons kinders se lewens word in gevaar gestel wanneer kontrakteurs opgrawings onbeskerm laat, skoolinfrastruktuur nie onderhou word nie, of skoolvervoer oorlaai word.
","ge borakonteraka ba tlogela moo ba epilego go se gwa šireletšega, goba mananeokgoparara a sekolo a sa hlokomelwe goba senamelwa sa bana ba sekolo se nameditše bana ba bantši go feta tekano, gona maphelo a bana a bewa kotsing.
"
"daar kom egter nog meer nalatigheid en verwaarlosing voor.
","eupša go na le go hloka šedi go gontši le go hloka tlhokomelo mešomong.
"
"baie kinders word deur seksuele prooisoekers, kriminele bendes en dwelmverkopers geteiken, juis omdat hulle kwesbaar is.
","bana ba bantši ba hlaselwa ke basenyi ba go phaya theto ka kgang, digongwana tša basenyi le batho ba go gweba ka diokobatši ka gobane bana ba ba kotsing.
"
"as n samelewing, moet ons meer toegewyd wees en aktief betrokke wees by die beskerming van ons kinders teen dié en ander gevare.
","bjalo ka setšhaba, re swanetše go ntšha mahlo dinameng kudu le go kgatha tema kudu go šireletša bana ba rena go basenyi ba le go dikotsi tše dingwe.
"
"ons moet gesamentlik n verantwoordelikheidskultuur opbou.
","bjalo ka setšhaba, re swanetše go aga setlwaedi sa maikarabelo.
"
"ons moet vir onsself, ons kinders en ander verantwoordelikheid aanvaar.
","re hloka gore re be le maika rabelo go rena, go bana ba rena le go batho ba bangwe.
"
"ons moet verseker dat ons kinders in n veilige, versorgende en stimulerende omgewing kan grootword; ons moet ook besef dat dit ons plig is om almal wat ons ken en die mense met wie ons omgaan, te beskerm en versorg.
","bjalo ka ge re hloka go netefatša gore bana ba golela tikolo gong yeo e bolokegilego,ye e ba hlokometšego le go ba hlohleletša, gona ka fao le gona se swanetše go ikwa re rwele maikarabelo a go šireletša le go hlokomela bohle bao re ba tsebago ebile re phedišanago le bona.
"
"ons moet ook hierdie verpligting op ons land se paaie voel.
","re swanetše re ikwe re na le maikarabelo a ge re le ditseleng.
"
"ons verwelkom die afname in padsterftes oor die feesseisoen, maar die aaklige werklikheid is dat meer as 1 600 mense in net n maand en n half op ons paaie gesterf het.
","le ge re amogela go fokotšega ga dipalopalo tša mahu ditseleng mo sehleng se sa maikhutšo, sa go nyamiša kudu ke gore batho ba go feta 1,600 ba hlokofetše ditseleng tša gaborena mo nakong ya kgwedi le seripa feela.
"
"dit is kommerwekkend dat meer as 9 000 motoriste vir oortredings, insluitend dronkbestuur, oorskryding van die spoedgrens en roekelose en nalatige bestuur in hegtenis geneem is.
","go a hlobaetša gore baotledi ba go feta ba 9,000 ba ile ba sware lwa melato yeo e akaretšago go otlela ba nwele bjala, go otlela ka lebelo la godimo, go otlela bošaedi le ka go hloka šedi.
"
"n verantwoordelikheidskultuur beteken dat ons almal die verkeersreëls moet nakom en voetgangers en ander padgebruikers se regte moet respekteer.
","setlwaedi sa maikarabelo se ra gore ka moka ga rena re swanetše re otlele ka polokego re be re hlomphe le ditokelo tša basepelakadinao le badiriši ba bangwe ba tsela.
"
"n verantwoordelikheidskultuur beteken dat pa’s by hulle kinders se lewe ns betrokke moet wees.
","setlwaedi sa maikarabelo se ra gore botate ba swanetše go ba gona maphelong a bana ba bona.
"
"te veel vroue moet hulle kinders alleen grootmaak, wat dikwels hulle en hul kinders se moontlikhede beperk.
","basadi ba bantši kudu ba godiša bana ba le tee, gomme se gantši se se fokotša tšwelopele ya bona mmogo le ya bana ba bona.
"
"n verantwoordelikheidskultuur beteken ook dat ons veilige seks moet hê en nie onsself of ander aan miv moet blootstel nie.
","setlwaedi sa maikarabelo se ra gape gore re swanetše re be le thobalano yeo e bolokegilego gomme re se ipeye goba ra beya ba bangwe kotsing ya go fetelwa ke hiv .
"
"ons moenie alkohol en dwelms misbruik nie.
","re se ke ra nwa bjala go feta tekano goba ra šomiša diokobatši.
"
"ons moet gesonde lewens leef sodat ons siektes wat grootliks voorkombaar is kan vermy en langer kan leef.
","re swanetše re nyake go phela maphelo ao a itekanetšego re efoge malwetši ao a thibelegago gore re phele nako e telele.
"
"sodanige kultuur behoort veral deur diegene in posisies van gesag en invloed, hetsy godsdienstige leiers of politici, tradisionele leiers of beroemdes, omarm te word.
","setlwaedi sa mohuta woo se swanetše se amogelwe kudu ke bao ba lego maemong a boetapele le khuetšo setšhabeng, e kaba baetapele ba ditumelo goba boradipolotiki, baetapele ba setšo goba batsebalegi.
"
"hulle behoort, deur hulle woorde en dade, daarna te streef om n beter samelewing te skep waarin almal waardeer en versorg word.
","ka mantšu le ditiro tša bona, ba swanetše ba nyake go aga setšhaba se sekaone seo ka go sona bohle ba amogelwago ebile ba hlokomelwago.
"
"dit is verkose amptenare en staatsamptenare se verantwoordelikheid om die veiligheid en welstand van burgers te verseker.
","bahlankedi bao ba kgethi lwego le bašomedi ba mmušo ba filwe maikarabelo a go netefatša polokego le go phela gabotse ga badudi.
"
"hulle moet seker maak dat daar voldoende en veilige skoolinfrastruktuur is.
","ba swanetše ba netefatše gore go na le mananeokgoparara ao a lekanego le ao a bolokegilego ka dikolong.
"
"hulle moet vinnig optree wanneer daar n onderbreking in watertoevoer in gemeenskappe is of wanneer foutiewe straatligte aangemeld word.
","ba swanetše ba eme ka maoto ge go na le kgaotšo ya kabo ya meetse ka ditšhabeng goba ge go begilwe gore mabone a mmileng ga a šome gabotse.
"
"hulle moet seker maak dat gesondheidsen veiligheidsregulasies toegepas word en dat die oppergesag van die reg gehandhaaf word.
","ba swanetše ba netefatše gore melawana ya tša maphelo le polokego e a phethagatšwa gape le gore molao o a obamelwa.
"
"ons moes soms uitermatige stappe neem, bykomend tot die werk wat steeds regoor die regering — op alle vlakke — gedoen word, om uiting te gee aan dié verantwoordelikheid.
","godimo ga mošomo wo o dirwago ka magatong a mmušo ka moka, go phetha gatša maikarabelo a, ka nako e nngwe re ile ra gapeletšega go tšea magato a boima.
"
"ons het, as antwoord op die kinders wat gesterf het of seergekry het toe hulle in puttoilette geval het, die safeinisiatief geloods om die voorsiening van behoorlike toilette aan alle skole in die land, te bespoedig.
","go arabela mahu le dikgobalo tšeo di hlotšwego ke ge bana ba wela ka dintlwaneng tša boithomelo, re tsebagaditše lesolo la safe go akgofiša kabo ya dintlwana tša bo ithomelo tša maleba dikolong ka moka ka nageng.
"
"ons het die suidafrikaanse nasionale weermag na dele van kaapstad ontplooi om die polisie in hul pogings om bendegeweld te verminder, te ondersteun.
","re rometše maole a bosetšhaba a afrika borwa dikarolong tše dingwe tša cape town go yo thuša maphodisa maitekelong a bona a go fokotša dintwa tša digongwana.
"
"ons het, meer onlangs en saam met die burgerlike gemeenskap, n noodreaksieplan geloods om geweld teen vroue en kinders te beëindig.
","mo nakong yeo e sa tšwago go feta, mmogo le setšhaba, re ile ra tla ka leano la tšhoganetšo go fediša dikgaruru kgahlanong le ba sadi le bana.
"
"dit is egter duidelik dat daar baie meer is wat ons, as regering en samelewing, moet doen.
","le ge go le bjalo, go sa na le tše ntši tšeo re hlokago go di dira bjalo ka mmušo le setšhaba.
"
"ons prys die individue en organisasies wat die verantwoordelikheid vir ander se welstand op hulself neem.
","re bethela matsogo batho le mekgatlo yeo e tšerego ma ikarabelo ge go etla boiteka nelong bja ba bangwe.
"
"daar is mense soos ralph bouwers en mark nicholson, wat ontspanningsaktiwiteite vir jongmense in lavender hill in kaapstad reël om te verhoed dat hulle na die bendewêreld terugkeer.
","go na le batho ba bjalo ka ralph bouwers le mark nicholson bao ba rulaganyago dipapadi tša boitapološo tša baswa go la lavender hill ka cape town gore ba se tlo tsena digongwaneng tša bosenyi.
"
"daar is moeders, susters en dogters wat as vrywilligers diens doen by operation bobbi bear, n organisasie in amanzimtoti, kwazulunatal wat toevlug aan mishandelde kinders bied.
","go na le bomma, bosesi le barwedi bao ba šomago bjalo ka baithuti bao ba ithao pilego gomme ba šoma le ba operation bobbi bear, e lego mokgatlo wa ka amanzimtoti ka kwazulunatal woo o fanago ka madulo go bana bao ba tlaišitšwego.
"
"daar is talle geloofsgebaseerde groepe, soos die konferensie van suiderafrikaanse katolieke biskoppe, met wie ek vergader het, wat my vertel het van die werk wat hulle doen in antwoord op die armes se behoeftes, om gesinne te ondersteun om meer om te gee en versorgend te wees en ook om jong mense te help om die talle uitdagings wat hulle in die gesig staar, te hanteer.
","go na le dihlopha tše ntši tša ditumelo tša go fapafapana bjalo ka southern african catholic bishops’ conference, bao ke kopanego le bona mo nakong yeo e sa tšwago go feta, bao ba mpoditšego ka ga mošomo woo ba o dirago go arabela dihlokwa tša bao ba itlhokelago, go thekga ma lapa gore a be ao nago le šedi le tlhokomelo kudu, gape le go thuša baswa go lebagana le ditlhotlo tšeo ba kopanago natšo.
"
"dié suidafrikaners wys vir ons die weg.
","maafrika borwa a a re bontšha tsela.
"
"hulle herinner ons, deur hul voorbeeld, wat dit beteken om verantwoordelikheid vir onsself en ander te neem.
","ka mehlala ya bona, ba re gopotša gore go ra go reng go rwala maikarabelo bakeng sa rena le ba bangwe.
"
"ons land het heeltemal te veel tragedies ervaar.
","naga ye e itemogetše mase tlapelo a mantši kudu.
"
"te veel jongmense is oorlede, te veel kinders het seergekry en is getraumatiseer.
","maphelo a mantši a baswa a lobilwe, bana ba bantši kudu ba kwešitšwe bohloko le go lebana le kgatelelo ye kgolo ya menagano.
"
"ons kan hierdie tragedies beëindig as ons almal, ieder en elk van ons, die verantwoordelikheid neem om die kinders in ons wonderlike suidafrikaanse gemeenskap, te help grootmaak.",re ka fediša masetlapelo a ge ka moka ga rena re ka rwala maikarabelo a go godiša bana ka motseng wo mokaone kudu wa afrika borwa.
"die jeug is die toekoms van ons land vukuzenzele unnamed om met jong mense gesprek te voer, laat my altyd energiek voel.
","bafsa ke bokamoso bja naga ya rena vukuzenzele unnamed go boledišana le bafsa ka mehla go ntlogela ke na le mafolofolo.
"
"dit is opwindend om insig te kry in hul strewes en oorwinnings en hul visie oor wat gedoen kan word om hierdie land te verbeter.
","go a thabiša go hwetša tsebo mabapi le mathata a bona le diphenyo tša bona le ka ga dinepo tša bona ka ga seo se ka dirwago go kaonafatša naga ye.
"
"ons kan nie ontken dat die jeug 'n belangrike teenwoordigheid in die psige en weefsel van ons land is nie.
","ga go na yo a ganetšago gore bafsa ke batho ba bohlokwa ka sebopegong le motheong wa naga ya rena.
"
"in teenstelling met die persepsie dat hulle selfvoldaan, polities apaties of selfbehep is, bevestig plaaslike en internasionale studies dat jongmense regdeur die wêreld altyd meer positief is oor hul vooruitsigte.
","go fapana kudu le kgopolo ya gore ba itebetše, ga ba na le kgahlego go dipolotiki goba ba itirela ba nnoši, dinyakišišo tša ka nageng le tša boditšhabatšhaba di tiišetša kgafetšakgafetša gore bafsa lefaseng ka bophara ka mehla ba na le maikutlo a makaone ka ga bokamoso bja bona.
"
"volgens die bevindinge van 'n peiling deur ipsos pulse of the people, wat in januarie vrygestel is, voel 61% van suidafrikaners tussen 15 en 17 jaar optimisties oor 2020. ek twyfel nie dat dit 'n sentiment is wat gedeel word deur die jeug in die algemeen nie, en veral die groep wat aan die begin van die millennium gebore is en nou hul volwasse lewe begin; diegene wat die jeug ama2000 noem.
","go ya ka dikutollo tša di kgetho tša ipsos pulse of the people tšeo di lokollotšwego ka pherekgong, 61% ya maafrika borwa ba mengwaga ye 15 go fihla go ye 17 ba ikwa ba na le kholofelo ka ga ngwaga wa 2020. ga ke na pelaelo ya gore a ke maikutlo ao a lego a bafsa ka kakaretšo le kudukudu maikutlo ao a tšweleditšwego ge ngwagakete o fihla bao mo lebakeng le ba thomago bophelo bja bona bja batho ba bagolo, bao bafsa ba ba bitšago ma2000.
"
"dit is die seuns en dogters wat ná demokrasie gebore is.
","ke barwa le barwedi bao ba belegwego ka morago ga temokra si.
"
"hoewel hulle nie persoonlike ervaring van die gruweldade van apartheid het nie, leef hulle saam met die nalatenskap van rasseongelykheid, ruimtelike onreg en armoede.
","le ge e le gore ga ba na ma itemogelo a thwii a ditšhohlo tša kgethologanyo, ba tšwela pele go phela ka mašaledi a yona a tlhokego ya tekatekano ya me rafe, tlhokego ya toka go kabo ya naga le bohloki.
"
"hierdie jongmense is vol vertroue, selfversekerd en vol ambisie.
","bafsa ba ba na le boitshepo, boikemo ebile ba phadima ka maikemišetšo.
"
"hulle ken hul regte en is nie bang om daarop aan te dring nie.
","ba tseba ditokelo tša bona ebile ga ba tšhabe go di nyaka.
"
"die jeug van ons land verteenwoordig energie, hoop, pret, potensiaal, toekoms en vryheid.
","bafsa ba naga ya rena ba emetše mafolofolo, kholofelo, boipshino, bokgoni, bokamoso le tokologo.
"
"hulle is digitale boorlinge wat vlot is in die gebruik van moderne tegnologieë en loopbane wil betree wat nie eens bestaan het toe hul ouers jonk was nie.
","ke badudi ba go šomiša titšithale bao ba šomišago theknolotši ya sebjalebjale ebile ba lebeletše go tsena ka mešomong yeo e bego e se gona ka nakong ya ge ba le batswadi.
"
"aan die vooraand van die staatsrede het ek die voorreg gehad om met 'n groep sulke dinamiese jongmense te gesels tydens 'n intergenerasiedialoog wat deur die nasionale agentskap vir jeugontwikkeling belê is.
","nakonyana pele ga polelo ya maemo a setšhaba (sona) ke bile le monyetla wa go boledišana le sehlopha sa bafsa ba mafolofolo ka poledišanong ya mabapi le meloko ya mehutahuta yeo e bego e biditšwe ke setheo sa bosetšhaba sa tlhabollo ya bafsa (nyda).
"
"ons het kwessies wat vir die jeug baie belangrik is bespreek, en maniere ondersoek om ons perspektiewe en optrede te belyn.
","re boledišane ka ga merero yeo e lego ye bohlokwa kudu go bafsa le go lekodišiša mekgwa yeo ka yona re ka tsepanyago seemo le ditiro tša rena.
"
"uiteraard het toegang tot werk en geleenthede die agenda oorheers.
","bjalo ka ge e le setlwaedi, phihlelelo go mešomo le go dibaka ebile seo re boledišanego ka sona.
"
"van die 1,2 miljoen jongmense wat elke jaar tot die arbeidsmark toetree, is daar byna twee derdes wat nie werk of studeer nie.
","go bafsa ba 1.2 milione bao ba tsenago mešomong ngwaga o mo ngwe le o mongwe, ke palo ye e nyakilego go ba peditharong ye e šetšego e sa šome goba e sa ithute.
"
"die deelnemers aan die dialoog het die feit verwelkom dat die kwessie van jeugindiensneming op die hoogste regerings vlakke aandag geniet.
","bafsa bao ba bego ba le ka mo dipoledišanong tše ba amogetše taba ya gore tlhokego ya mešomo e hwetša šedi maemong a godimodimo a mmušo.
"
"maar die refrein was welbekend: hulle was op verskillende maniere gereed en kon bydra tot die ekonomie, onder meer as entrepreneurs, maar burokratiese rompslomp en 'n gebrek aan finansiering verhoed hulle om dit te doen.
","eupša maikutlo a bona a be a swana: ba be ba ikemišetše ebile ba kgona go tsenya letsogo go ekonomi ka mekgwa ye e fapafapanego, go akaretšwa bjalo ka bahlomi ba dikgwebo, eupša mollwane wa tatelano le tlhokego ya thušo ya ditšhelete e ba thibela go dira seo.
"
"in dié verband het bright hlongwane van youth in business south africa vir my gesê daar moet meer geld vir jong entrepreneurs beskikbaar gestel word.
","ka ge bright hlongwane go tšwa go mokgatlo wa youth in business south africa a mpoditše, go swanetše go ba le thušo ye nngwe ya ditšhelete yeo e fiwago bafsa bao ba hlomago dikgwebo.
"
"hulle wil graag sien dat 'n verskeidenheid finansiele instellings, soos instellings wat ontwikkelingsfinansiering voorsien, private beleggers en privateekwiteitsfirmas, sowel as kommersiële banke, krediet aan ons jong entrepreneurs verleen en vertroue in hulle stel.
","ba nyaka go bona mehutahuta ya dihlongwa tša ditšhelete, dihlongwa tša ditšhelete tšeo di hlabollago, babeeletši bao ba thekgago dikgwebopotlana, difeme tša diekhwiti tša phraebete gammogo le dipanka tša kgwebo tšeo di fanago ka sekoloto ebile di iteka lesego ka go thekga bafsa bao ba lego bahlomi ba dikgwebo.
"
"om ons land te laat vooruitgaan en floreer, moet ons alles in ons vermoë doen om te verseker dat jongmense op 'n betekenisvolle manier aan ons ekonomie kan deelneem, hetsy in formele indiensneming of in eie diens.
","gore naga ya rena e atlege le go tšwelela re swanetše go dira ka fao re ka kgonago ka gona go netefatša gore bafsa ba kgona go kgatha tema ka ekonoming ya rena ka mokgwa wo o nago le mohola, e ka ba ka mošomong wo e sego wa semmušo goba ka go itlhomela mešomo.
"
"dit was dus gepas dat ek hierdie platform kon gebruik om die presidensiële intervensie vir jeugindiensneming te loods, wat 'n strategiese nasionale visie en plan is waarin prioriteitsoptredes uiteengesit word om jeugwerkloosheid die hoof te bied.
","ka fao ke bone go le maswanedi gore nka šomiša sebaka se go tsebagatša semmušo tsenogare ya mopresidente ya tlhomo ya mešomo ya bafsa, e lego nepo le leano la bosetšhaba la togamaano leo le beago ditiro tšeo di tlago pele ka nepo ya go rarolla tlhokego ya mešomo go bafsa.
"
"dit sluit 'n nasionale loopbaannetwerk in wat kandidate met werksgeleenthede verbind wat by hulle vermoëns pas.
","se se akaretša netweke ya taolo ya tiro ya ka moso yeo e nyalantšhago bao ba nyakago mešomo le dibaka tša mešomo.
"
"dit stel jongmense in staat om toegang tot geleenthede te kry, aangesien sommige van hulle nie toegang tot netwerke het wat geleenthede vir hulle ontsluit nie.
","se se tla kgontšha bafsa go kgona go fihlelela dibaka tša mešomo ka ge ba bangwe ba bona ba hloka dinetweke tšeo di dirago gore go be bonolo go fihlelela dibaka ka fao go kgonagalago.
"
"gespesialiseerde kort gefokusde kursusse in vaardighede waaraan werkgewers tans ’n behoefte het, word gereël.
","dithutwana tše kopana tša tsebo ye e kgethegilego ka ga mabokgoni ao bašomi ba a nyakago bjale di tla rulaganywa.
"
"dit is daarop gerig om aandag te gee aan die probleem van 'n wanverhouding tussen die bestaande opvoedkundige, opleidingsen ontwikkelingsprogramme en die vereistes van die ekonomie.
","se se akaretša go rarolla bothata bja tlhokego ya nyalelano gareng ga mananeo a bjale a thuto, a tlhahlo le a tlhabollo le dinyakwa tša ekonomi.
"
"ons verwelkom die werk wat reeds op hierdie gebied gedoen word, soos die program wat tans deur die departemente van landbou, grondhervorming en landelike ontwik keling asook samewerkende regering en tradisionele sake onderneem word om 1 000 jong studente in die vrystaat op te lei in landbouen ander vaardighede.
","re amogela mošomo wo o šetšego o dirwa ka mo lefapheng le,wa go swana le lenaneo leo le šetšego le phethagatšwa mo lebakeng le ka dikgoro tša temo, peakanyoleswa ya naga le tlhabollo ya dinagamagae le la pušo ya tirišano le merero ya setšo go hlahla bafsa bao e lego ba 1 000 ka foreisetata ka mabokgoni a temo le a mangwe.
"
"talle jongmense wil hul eie ondernemings begin.
","bafsa ba bantši ba nyaka go thoma dikgwebo tša bona.
"
"hulle het egter nie die tegniese vaardighede wat hulle kan help om dit te doen nie.
","ba hloka mabokgoni a tša sethekniki ao a ka ba thušago go ithomela dikgwebo tša bona.
"
"hierdie ingryping sal die groei van jong entrepreneurs ondersteun.
","tsenogare ye e tla thekga kgolo ya bafsa bao ba hlomago dikgwebo.
"
"entrepreneurskap is beslis nie 'n wondermiddel nie, maar ek is oortuig daarvan dat dit een doeltreffende en bewese manier is om identiteit en doel, 'n gevoel dat hulle êrens behoort en hoop vir die toekoms aan die jeug te verleen.
","bohlomi bja dikgwebo ke seo re nago le bonnnete ka ga bjona ebile ga se tharollo, eupša ke a tshepa gore ke mokgwa wo o šomago gabotse wo re nago le bohlatse ka ga ona bja go laetša boitšhupo, maikutlo a go wela go gongwe, le kholofelo go bokamoso bja bafsa.
"
"die presidensiële jeugdiensprogram bied aan jongmense geleenthede om iets terug te gee aan hul gemeenskappe.
","lenaneo la tirelo ya bafsa la mopresidente le fa bafsa dibaka tša go thuša ditšhaba tša bona.
"
"hierdie inisiatief is daarop gerig om veranderinge te bewerkstellig en ’n grootskaalse uitwerking te hê, in teenstelling met gefragmenteerde programme wat ’n beperkte uitwerking het.
","lesolo le le hlametšwe go phethagatša phetogo le go dira seabe sekaleng, go fapana le mananeo ao a arogantšwego ao a bilego le seabe se senyane.
"
"ek het ook in die staatsrede aangekondig dat ons 1% van die nasionale begroting opsy sal sit vir 'n jeugindiensnemings inisiatief.
","ke tsebišitše ka go sona gore re tla beela thoko 1% ya ditekanyetšo tša bosetšhaba gore e tle e šome ka go lesolo la go thwala bafsa mešomong.
"
"'n aantal programme en projekte word ontwerp om hierdie nasionale uitdaging aan te pak.
","mananeo le diprotšeke tše mmalwa di hlametšwe go rarolla tlhohlo ye ya bosetšhaba.
"
"die jeug van ons land sien dit duidelik as 'n land van geleenthede en belofte, ondanks die struikelblokke wat hulle teëkom.
","bafsa ba naga ya rena ba bona naga ye bjalo ka yeo e nago le dibaka le tshepišo, go dutše go na le mapheko ao ba kopanago le ona.
"
"die afgelope week alleen het ek verskeie jong suidafrikaners ontmoet wat my trots maak op hoe ver ons gekom het en wat ons bereik het.
","bekeng ye e fetilego fela ke kopane le bafsa ba mmalwa ba afrika borwa bao ba ntirago gore ke ikgantšhe ka ga ka fao re tšwago kgole ka gona le seo re se fihleletšego.
"
"daar is jong sportmense soos gholfwonderkind sim ‘tiger’ tshabalala, wat net net agt jaar oud is en reeds internasionale gholftoekennings inpalm.
","go na le bafsa bao ba ralo kago dipapadi ba go swana le mofsa yo a nago le talente sim ‘tiger’ tshabalala yo a hwetšago difoka tša boditšhabatšhaba tša kolofo a na le mengwaga ye seswai.
"
