"ho na le takatso ya hore eke ho ka kgutlelwa morao ‘matsatsing a tlotla’ ya dipolotiki tsa baithuti le ntwa ya batjha, empa tseo di ke ke tsa hlola di phetwa hape.
","kunaleso silingo sekubuyela emuva sikhumbule ‘emalanga ekubusa’ etepolitiki yetitjudeni kanye nemzabalazo welusha, longeke uphindzeke.
"
"empa he, jwaloka ha batjha ba maoba ba ile ba talola sepheo sa bona, le batjha ba kajeno ba talotse sa bona.
","kodvwa njengaloko lusha lweminyaka leyengca layikhombisa inchubombono yalo, nelusha lwalomuhla luyikhombisile yalo.
"
"maemo a batjha ba afrika borwa ba 2020 a ka nqane ho maemo a hodimo a siilweng ke batjha ba tlileng pele ho bona.
","lusha lwaseningizimu afrika lwanga2020 lungetulu kwekuhlangabetana nelizinga lelisetulu lelabekwa ngulabo labebakhona ngaphambili.
"
"ba na le tshepo, ba matla ebile ba sebete, hangata ba tobana le maemo a boima ka ho fetisisa.
","banesifiso lesihle, batimisele ngekwengcondvo futsi banesibindzi, ikakhulu nababukene netimo letimatima kakhulu.
"
"ke bona mohlodi wa kgothatso le tshepo.
","bangumtfombo welusikisiki nelitsemba.
"
"ka diketso tsa bona, ba aha lefatshe le nang le toka e tomanyana, tekano, boitjaro ba nako e telele le bile le na le kgotso.
","ngetento tabo, bakha umhlaba lonebulungiswa, lolingene, losimeme futsi lonekuthula.
"
batjha lefatsheng ka bophara ba etsa kgoeletso ditheong tsa thuto hore di tlohele semorabe le ho kotela ditjhabana tse ding.,bantfu labasha emhlabeni wonkhe bacela tikhungo kutsi tilungise indzaba yebuhlanga kanye nekungambandzakanywa ngekwetenhlalo.
"ho fedisa bobodu tshebeletsong ya setjhaba vukuzenzele unnamed tshenolo ya pala menteng ya hore basebetsi ba mmu so ba diketekete ba ntse ba fumana matlole a dithuso tsa setjhaba ka bokunyata kgwedi le kgwedi e bo ntsha hore re ntse re sa na le leeto le le telele leo re lokelang ho le nka ho ke nya tlwaelo ya maitshwa ro a matle tshebeletsong ya setjhaba.
","kucedza inkhohlakalo emisebentini yahulumende vukuzenzele unnamed kuvetwa ebaleni ephalamende kutsi tinkhulu ngwane tebasebenti ba hulumende bebatfola si bonelelo sahulumende nja lo ngenyanga kukhombisa kutsi luseludze luhambo lokutsi sifake lisiko leku tiphatsa emisebentini ya hulumende.
"
"pejana selemong sena, ho ile ha boela ho fumanwa hore basebetsi ba kabang 16 000 ba fumanang mokgolo mmusong ba ile ba fuma ntshwa letlole la dithuso la kimollo ya matshwenyeho la covid19 ka bokunyata.
","ekucaleni kwalomnyaka, kwaphindze kwatfolakala kutsi basebenti lababalelwa ku16 000 labahola imali embusweni bebabhadalwa sibonelelo secovid19 lesikhetsekile sekucedza inhlupheko ngalokungakafa neli.
"
"mang le mang o a tseba hore bakopi ba nang le mehlodi e meng ya lekeno ha ba tshwa nelehe ho fumantshwa letlole lena.
","yintfo leyatiwako kutsi labafaka ticelo kube banale minye mitfombo lengenisa imali abakavumeleki kutfola lesibonelelo.
"
"ho boetse ho a tsebahala hape le hore ba fumanang lekeno ho tswa mmusong ha ba tshwanelehe ho kenya dikopo.
","kuyacaca futsi kutsi labo labatfola imiholo embusweni abakafaneli kufaka ticelo.
"
"le ha hole jwalo ba ile ba di kenya.
","kodvwa bentile.
"
"batho ba kabang 17 000 ba hirilweng mmusong wa naha le wa profense ba kentse dikopo molemong wa ho eketsa meputso ya bona ka tjhelete e reretsweng mafutsana.
","bantfu labangaba ti17 000 laba cashwe nguhulumende wavelonkhe newetifundza bafake ticelo ngenhloso yekukhuphula emaholo abo, ngemali lebekelwe laba phuyile.
"
"ha re nahana ka sekgahla sa tlhoko naheng ena, seo basebetsi ba rona ba mmuso ba se tsebang hantle, maikemisetso ana a ka boomo a ho utswetsa setjhaba ha a tshwarelehe ho hang.
","nakubukwa bu khulu besidzingo eveni, lobu lobatiwa basebenti bahu lumende kahle kakhulu, lenhloso yangemabomu yekuntjontja imali yempha katsi ayicoleleki.
"
"mmuso jwale o tiisa letsoho boitekong ba ona ba ho thibela tlhekefetso ya mofuta ona le ho nka kgato kgahlano le mang kapa mang ya tshebeletsong ya setjhaba ya amehang tlo long ena ya molao.
","hulumende nyalo ucinisa mitamo yakhe kuvimbela loluhlobo lokuhlukumeteka aphindze atsatsele tinyatselo noma ngubani emisebentini yahulumende lotsintsekako etentweni letingakalungi.
"
"ha morao tjena, mmuso o phatlaladitse yuniti e ntjha ya ho thusa ka merero ya mai tshwaro, botshepehi le di kgato tsa kgalemelo ya ba sebetsi tshebeletsong ya setjhaba.
","lokusandza kwenteka, hulu mende wetfule luphiko lolu sha lolusita ngekutiphatsa, bucotfo nekucondziswa kwetigwegwe kuhulume nde.
"
"yuniti e tla thusa mafapha a mmuso ho theha tsamaiso ya dinyewe tsa kga lemelo mabapi le maitshwaro a mabe le ho sebedisana le makala a mang a mmuso ho ahlola ba ikarabellang bobo dung.
","loluphiko lutokwakha emandla emitimbeni yempha katsi kuze kucalwe tinyatselo tekucondziswa kwetigwegwe lapho kunekungatiphatsi kahle luphindze lubambisane naletinye tikhungo tembuso kwenta labo labanesibopho sokutsintseka kutsi bati phendvulele.
"
"yuniti e tla lebisa dinyewe tsa bobodu ho sehlopha sa tshebetso se lwantsha ng bobodu mme e latele mafapha ho etsa bonnete ba hore dinyewe tsa tlolo ya molao tse kenyeletsang basebetsi ba mmuso di kenye letswa le dinyeweng tsa kga lemelo.
","loluphiko lutondlulisela emacala enkhohlakalo kuli tsimba lelilwa nenkhohla kalo yahulumende iphindze ilandzelele neminyango kucinisekisa kutsi emacala ebugebengu latsintsa base benti bahulumende ayajika abe macala ekucondziswa kwetigwegwe.
"
"ka ho sebedisana mmoho le kemedi ya setsi se kopanetsweng ke ditheo tsa diphuputso tsa melato e meholo, yuniti e tla thusa ho hlwaya basebetsi ba nkgang lefotha dinyeweng tsa melato e meholo tse fuputswang ke maponesa.
","ngekusebe ntisana nesikhungo ifusion centre , loluphiko lutosita kubuka basebenti labase macaleni lasemcoka laphe nywa tiphatsimandla te mtsetfo.
"
"yuniti e tla shebana le boitshwaro ba ditlhahlobo tsa bophelo ba basebetsi ba setjhaba.
","loluphiko litawubukisisa kwentiwa kwelucwaningo lwendlela yekuphila kwe basebenti bahulumende.
"
"moo mafapha a tshwayang bobodu le leruo le sa hlaloseheng, dinyewe di tla fetisetswa ho tshebeletso ya sepolesa sa afrika borwa.
","lapho minyango itobona khona kukhohlakala neku njinga lokungachazeki, ema cala atondluliselwa kumbutfo wemaphoyisa eningizimu afrika.
"
"yuniti ena e ntjha e se e qadile ka mosebetsi wa yona ka mafolofolo, e thusa ho futulla basebetsi ba mmuso ba amehang dinyeweng tse amanang le dithendara tsa covid19 , le bobodu ba letlole le ikgethileng la covid19 le letlole la inshorense ya ho fellwa ke mosebetsi.
","luphiko lolusha selivele liwucalile umsebenti nge kutimisela, lusita kubuka basebenti bahulumende labatibandzakanya emacaleni laphatselene nekutizuzela kucovid19 , sibonelelo lesikhetsekile secovid19 nekukhwabanisa kusi khwana semshwalense wala baphelelwe ngumsebenti.
"
"dinyewe tsa basebetsi ba mmuso tse fetisitsweng ke yuniti e ikgethileng ya di phuputso bakeng sa dikgato tsa kgalemo di tla lekolwa ke yuniti ho lekola hore na di a phethahatswa kapa tjhe.
","emacala etikhulu tahulu mende landluliselwe luphiko lwemacala lakhetsekile kuze kutocondziswa tigwegwe atobukisiswa nguloluphiko kuze ahlole inchubekelembili yawo.
"
"karolo e nngwe ya bohlokwa ya mosebetsi wa yuniti e tla ba ho tiisa melao ya mai tshwaro a matle le botshepehi maemong a tshebeletso ya setjhaba.
","lolunye luhlangotsi lolu balulekile lwemsebenti waloluphiko kutoba kufaka kutiphatsa lokwemukelekile nekwetsembeka etigabeni temisebenti yahulumende.
"
"dilemong tse feti leng basebetsi ba mmalwa ba mmuso ba bile le mohopolo wa hore ho etsa le kgwebo le mmuso kapa ho una molemo o sa hlokahaleng ho tswa mmusong ho dumeletse hile molemong wa bona, wa metswalle le wa ba malapa a bona, ha feela ho se tlolo ya molao.
","basebenti bahulumende labambalwa ngekuhamba kweminyaka batsatse umbono wekutsi kwenta libhizinisi kumbe basitakale ngalokungakafaneli embu sweni kuvumelekile kubo, kubangani babo nasemi ndenini yabo, kuphela nje nangabe akukho lokungekho emtsetfweni lokwentiwe.
"
"re tlameha ho etsa tsohle tse matleng a rona ho fetola mohopolo ona.
","simele kwenta konkhe lesingakwenta kuntjintja lesimo lesi sengcondvo.
"
"ha re ntse re sebetsa ho fedisa bobodu, ho tlameha hore ho shejwe ka ho lekana ho ruta maitshwaro a matle, hobane se ka nnang sa se ke sa ba tlolo ya molao e kanna ya ba se fosahetseng ebile se sa tshwanele mosebetsi wa setjhaba.
","njengobe sisebentela kucedza inkhohlakalo, kufanele sinakisise ngaloku linganako ekufakeni similo lesihle sekutiphatsa, ngoba loku lokungahle kungabi ngulokungekho emtsetfwe ni kungaba kungatiphatsi ngalokwemukelekile futsi kungafaneli sisebenti sahu lumende.
"
"yuniti e ntjha e tla beha mekgwa le maemo hodima maitshwaro a matle, botshe pehi e boitshwaro.
","luphiko lolusha lutobeka tindlela tekwenta tintfo nemazinga ngekutiphatsa lokwemukelekile, kwetse mbeka nendlela yekuti phatsa.
"
"e tla boela e thusa mafapha mererong ya ho kgalema basebetsi ba mmuso ba fumanwang ba bile le boitshwaro bo bobe.
","futsi lutokwakhela ematiko emandla ekucondzi sa tigwegwe etikhulwini letitfolakele titiphetse kabi.
"
"selemong se fetileng base betsi ba fetang 200 ba ile ba kwetlisetswa ho ba baofisiri ba okametseng le bathakgodi.
","kulomnyaka lophelile base benti labangetulu kwema200 baceceshwa njengebaphatsi nebaholi.
"
"ho aha naha e nang le mai tshwaro a matle, le bokgoni e ntse e le sepheo sa puso ena.
","kwakha umbuso lohambi sana nenchubo leyamu kelekako, lonelikhono kuyachubeka kubukisiswa kulokuphatsa.
"
"jwalo ka mahlabisadihlong a mangata a kenyeletsang basebetsi ba mmuso ba unang molemo o seng molaong ho tswa mmusong a bontshitse, motjha ona o tla ba boima mme o tla nka nako.
","njengobe emahlazo lamaningi labandzakanya basebenti bahulumende labazuza ngalokungekho emtsetfweni embusweni akhombisile, lenchubo itoba matima futsi itotsatsa sikhatsi.
"
"le ha ho le jwalo, re ikemiseditse ho dula temeng ya rona.
","noma kunjalo siti bophelele kuhlala kulendlela.
"
"naha e nang le bokgoni ke motheo wa phihlello ya dintho tsohle tse tlang pele setjhabeng.
","umbuso lokhonako usi sekelo sekutfola konkhe lokubekwe embili eveni letfu.
"
"ntle le ho ntlafatsa boikarabello le ho kgothaletsa boitshwaro bo botle, ha ho letho le tla fihlellwang.
","ngaphandle kweku tfutfukisa kutiphendvulela nekukhutsata kutiphatsa lokwamukelekile, kute kuzuza.
"
"boholo ba basebetsi ba rona ba mmuso ba sebatsa ka boi nehelo, ba hlompha molao ebile ba na le maitshwaro a matle.
","liningi lebasebenti bahulu mende litibophelele, ligcina umtsetfo futsi litiphatsa nga lokwamukelekako.
"
"mosebetsi o ka pele ho rona ke ho sebetsa mmoho ho fothola ba sa ikamantshe ng, le ho lokisa mohopolo o fosahetseng wa hore bohle ba hirilweng mmusong ba itjhe bile bo bona kapa ba tletse bobodu.
","umsebenti lophambi kwetfu kusebenta ngekubambisana kuze kutsi sizuphune labo labangenti njalo, siphindze silungise umbono longa siwo wekutsi bonkhe labo labacashwe kuhulumende batisebentela bona kumbe bakhohlakele.
"
"re ipiletsa ho banna le basadi bohle ba sebeletsang naha ya rona letsatsi le leng le le leng hore ba itlame botjha boleng ba ho beha batho pele le tshebeletsong ya setjhaba, le ho hopola hore boitshwaro ba bona bo tlameha ho dula bo le molaong le boitshwarong bo botle ka dinako tsohle.
","ngenta lubito kubo bonkhe labadvuna nalabasikati labasebentela live letfu onkhe emalanga kutsi baphindze batibophelele emagugwini ekutidzela nasekusebenteni, futsi bakhumbule kutsi kuti phatsa kwabo kufanele ngaso sonkhe sikhatsi kube se mtsetfweni futsi kwemu keleke.
"
ho thehwa ha yuniti ena ke e nngwe ya ditsela tseo re di sebedisang ho fedisa bobodu mmusong le makaleng ohle a naha ya afrika borwa.,kusungulwa kwaloluphiko kungulenye yetindlela lesi sebenta ngato kucedza inkhohlakalo kuhulumende nakuyo yonkhe mikhakha yemphilo yaseningizimu afrika.
"badudi ba ditumelo tse fapaneng ba bohlokwa ntweng e kgahlanong le covid19 vukuzenzele unnamed moraorao tjena maafrika bo rwa a mangata a ipapisitse le ba bang ho phatlalla le lefatshe dike tsahalong tsa bohlokwa tsa bodumedi.
","ummango wetenkholo ubaluleke kakhulu ekulweni necovid19 vukuzenzele unnamed bantfu labanyenti baseningizimu afrika betenkholo bahlanganyele nalabanye emhlabeni wonkhe jike lele ekugubheni umkho si wetenkholo.
"
"ditho tsa bodu medi ba sejuda haufinyane tjena di sa tswa keteka pa seka, bakreste ba ketekile labohlano le halalelang ha mamoselemo haufinyane a tla keteka kgwedi e halale lang ya ramadan.
","emalunga etenkholo yemajuta agu bhe umkhosi wepesach , emakholwa etenkho lo yebukhristu agubhe umkhosi weliphasika futsi emasulumane wona masi nyanenje atawube agubha inyanga lengcwele yeramadan .
"
"jwale re se re le selemong sa bobedi bobedi, diketsahalo tsena di ketekwa hara sewa sena se thefutseng lefatshe se qositseng maphelo a batho ba fetang dimilione tse pedi le halofo ho phatlalla le lefatshe.
","ngumnyaka we sibili manje, lemikhosi lena igujwa ngesikhatsi selubhubhane lwemave emhlaba lolwephulana umoya lolutsetse timphilo tebantfu la bangetulu kwetigidzi leti2.5 emhlabeni wonkhe jikelele.
"
"mekgatlo ya ditumelo tse fapaneng esale e le bohlokwa ho karabelo ya rona lefung lena, e ne e sa fane feela ka matshediso a semoya le ta taiso, empa e ne e boetse e hlokomela ba neng ba ame hile haholo ke ditlamorao tsa sewa, ho kenyeletswa phano ya dijo, bodulo le ditshebe letso tse ding tsa kahisano.
","tinhlangano tetenkholo tibe nguletibalulekile eku bukaneni kwetfu nalesifo, betinganiketinje kuphela kudvudvuteka kwemphe fumulo, kepha betiphindze futsi tinakekele labo la bahlaseleke kalula ludvosi lwalolubhubhane, kufaka ekhatsi kubanika kudla, indzawo yekukhosela kanye naletinye tinsita tetenhlalo.
"
"bodumedi bo bapala karolo ya bohlokwa maphelong a di milione tsa maafrika borwa, le ho kenela tshebeletso e le phutheho ke ka karolo ya bohlokwa ya ditlwaelo tsa bona tsa bodumedi.
","tenkholo tidlala indzi ma lebaluleke kakhulu etimphilweni tetigidzi tebantfu baseningizimu afrika, futsi kudvumisa bandzawonye kwabo kuyincenye lebaluleke kakhulu ekukhonteni kwabo.
"
"ho kgona ho bokana ba keng sa ditshebeletso tsa bodumedi kamora ho tswa nakong ya mathata a maholo, e boetse e ba kgefu bakeng sa batho ka bo mong, malapa le badudi.
","kukhona kuhlangana ndza wonye ngekwetinsita te tenkholo kukuhhamuleka lokwemukelekile ngemuva kwesikhatsi lesimatima kakhulu kubantfu labehlukene, kumindeni kanye nemimango.
"
"ho a utlwahala hore ka mora nako e fetang selemo ya ho sotleha tlasa dithibelo tsa dipokano tsa bodumedi, badumedi ba tjhesehela ho kgutlela maemong a setlwa eding.
","kuyavisiseka kutsi ngemu va kwesikhatsi lesingetulu kwemnyaka sekusebenta ngaphasi kwetimo letibeka imikhawulo kumibutsano ye tenkholo kutsi ummango we tenkholo unenshisekelo yeku buyela esimeni lesetayelekile.
"
"ka kananelo ya bohlokwa ba ho kena tshebeletsong e le phutheho maphelong a batho ba bo rona, mmuso esale o buisana le badumedi.
","ekucabangeleni kubalu leka kwekukhontela ndza wonye etimphilweni te bantfu bakitsi, hulumende abeloku akhulumisana nemmango wetenkholo.
"
"baetapele ba badumedi ba utlwisisa le ho ananela kotsi ya sebele ya ditshwaetso tsa leqhubu le le letjha la covid19 .
","baholi bemmango wetenkholo bayavisisa futsi bayayibona ingoti yekucubuka lokusha kwecovid19 .
"
"esale sewa sena se ropoha, mekgatlo ya bo dumedi e nkile mehato ya phadimeho le e hlwahlwa ya ho fokotsa ho nama ha lefu lena hara barapedi.
","kusukela kwabhedvuka lo lubhubhane, tinhlangano tetenkholo titsetse tinyatselo tekuvimbela naletikahle te kunciphisa kubhebhetseka kwalesifo emakholweni.
"
"ntlha e nngwe ya bohlokwa ke hore nakong ya mehato ya tlhokomediso e fapafapa neng, mekgatlo ya bodumedi e bile le ditahlehelo tse kgolo tsa ditjhelete tse tshosetsang boemo ba yona ba ho ite kanela.
","lokunye lokubalulekile kutsi ngalesikhatsi setigaba teku caphelisa, tinhlangano tetenkholo tihlangabetane neku lahlekelwa timali lokukhulu lokube yinkinga ekusimame ni kwato.
"
"jwaloka mmuso re dula re itlamme ho sebetsa le badumedi bakeng sa ho thola ditharollo tse tla ba tswelang molemo.
","singuhulumende siyachubeka nekutinikela ekusebentisaneni nemmango wetenkholo kute kutsi sitfole sisombululo lesikahle.
"
"re sa le hona moo, boiteka nelo le polokeho ya setjhaba di lokela ho ba ka sehlohlo long.
","ngaso sona leso sikhatsi, temphilo nekuphepha kwesive kufanele kutsi kube yintfo lesicaba nga ngayo kakhulu.
"
"badumedi ba bontshitse ntjhafatso le boikitlaetso mabapi le ho tshwara di tshebeletso ha ho ne ho na le qeaqeo e kgolo mabapi le boemo ba sewa sena.
","ummango wetenkholo ukhombise kukhona kwenta imitamo nekwenta tintfo ngendlela lensha mayelana nekuchuba tinkonzo ngesikhatsi lapho khona bekunekungaciniseki lokukhulu mayelana nekutsi lo lubhubhane lucondze kuphi.
"
"ditshebeletso tsa diphu theho di ne di tshwarwa ka marangrang a inthanete mme barapedi ba ne ba kgothale tswa ho rapella malapeng ho e na le ho ya ditshebeletsong.
","tinkonzo tekuhlangana ndzawonye betentiwa ngeinthanethi futsi emakholwa bekakhutsatwa kutsi athantaze etindlini tawo esikhundleni sekutsi aye enkonzweni etakhiweni.
"
"sena se thusitse haholo me kutung ya naha ya ho ngotla ho nama ha lefu lena.
","loku kuyisite kakhulu imi tamo yavelonkhe yekulawu la kubhebhetseka kwalesifo.
"
"baetapele ba bodumedi ba bapetse karolo ya bohlokwa mabapi le ho kgothaletsa setjhaba ho ikobela mehato ya bophelo bo botle mabapi le ditlwaelo tsa meetlo le tsa botjhaba tse akgang mapato.
","baholi betenkholo badlale indzima lebaluleke ka khulu ekukhutsateni sive kutsi silandzele tinyatselo tetemphilo mayelana ne tinchubo temihambo ne masiko njengemingcwabo.
"
"ka tsela e tshwanang, batho ba bo rona ba bontshitse boi tlamo ba ho ikobela melawa na ya boitekanelo ba setjhaba le ho sielana sebaka.
","ngalokulinganako, bantfu bakitsi bakhombise kuti nikela kwabo ekugcineni tindlelanchubo tetemphilo kanye nekukhweshelana.
"
"mme ruri ba ananela hore ba lokela ho tswella ho phema dipokano tse kgolo.
","futsi bayakutfokotela kutsi bafanele kutsi bachubeke nekugwema imi butsano lemikhulu.
"
"hajwale re nakong moo re hlokang ho itlhokomela.
","manje sisesikhatsini lapho khona kucilika kudzingeka ngetulu kwako konkhe.
"
"kokwanahloko ya sewa sa corona ha e so fediswe, naheng ya bo rona kapa le fatsheng ho pota.
","lolubhubhane lweligci wane lekhorona alikapheli, lapha eveni letfu noma emhlabeni wonkhe jikelele.
"
"ketsahalo ya hore re be le leqhubu la boraro e teng mme e tla dula e le teng.
","kwesatjiswa kwekucubuka kwesitsatfu kukhona sibili futsi kutawuhlala kukhona.
"
"boiphihlelo ba matjhabeng bo re rutile hore re seke ra leka modimo tumelo.
","lesikubonile emaveni emhlaba kusifundzise kutsi singatenti tintfo letingema gangangoti.
"
"dinaha tse ngata di nyehlisitse dithibelo, kanthe ke feela moo ho bileng le ho ropoha botjha, ho ileng ha baka dithibelo tse matla le ho feta.
","emave lamanyenti acekise imikhawulo, kodvwa kwatfolakala kutsi siyacubuka futsi lesifo, lokoke kwabese kudzinga kutsi kuhlisibetwe le minye imikhawulo leseyitse kuba matima kakhulu.
"
"dipokano tse nang le batho ba bangata, e ka ba e le tsa bodumedi kapa tse ding, di na le bokgoni ba ho atisa kokwanahloko ena, ho sa natswe tshebediso ya ditsela tse amanang le ho sielana se baka le ho hlapa matsoho ka sebolayadikokwanahloko.
","imibutsano lemikhulu, kungaba yetenkholo noma yalokunye, inemandla ekubhebhetsekisa leligci wane, ngisho noma ngabe kulandzelwa tinchubo tekuphepha tekukhweshelana nekugeza tandla ngesibulalamagciwane.
"
"dimilione tsa maafrika borwa esale di kenela di ketsahalo tsa bohlokwa tsa tumelo ya bona.
","bantfu labanyenti baseningizimu afrika bebaloku bagcina inkholo yabo lebalu lekile.
"
"naheng ena e amohelang tokelo ya bolokolohi ba bodumedi, ho lokelwa ho etswa mekutu yohle ya ho tshehetsa batho ba bo rona ha ba sebedisa to kelo ena.
","eveni leligcina lilunge lo lenkhululeko yetenkholo, kufanele kutsi kwentiwe yonkhe imitamo lengentiwa kwesekelwe bantfu bakitsi ekusebentiseni lelilungelo.
"
"mme ha re sebedisa tokelo ena, re lokela ho etsa bonnete ba hore ha re behe ditokelo le maphelo a ba bang kotsing.
","futsike ekusebentiseni leli lungelo, sifanele kutsi sente siciniseko sekutsi asifaki le lilungelo nomake timphilo talabanye bantfu engotini.
"
"ena ke pehelo eo baetapele ba bodumedi bao ke kopa neng le bona ba e tshehetsang le ho e ananela.
","lona ngumtsetfomgomo ebaholi betenkholo lengihlangene nabo labawe sekela futsi bawujabulele ngalokuphelele.
"
"ba utlwisisa boikarabelo ba batho bohle ba ditumelo – hantlentle ba maafrika borwa kaofela – ho ikobela ditsela tse kgonehang tse behilweng bakeng sa ho sireletsa boitekanelo ba batho le ho boloka maphelo.
","bayasivisisa sibopho sabo bonkhe bantfu betenkholo – ngempela sabo bonkhe bantfu baseningi zimu afrika – kutsi bagcine tinyatselo letimisiwe teku vikela tetemphilo yebantfu nekusindzisa timphilo.
"
"bakeng sa nako e fetang selemo, re sebeditse mmoho re le setjhaba ho ngotla sewa sena.
","sesikhatsi lesingetulu kwemnyaka, sisebentisa na singummango silawu la lolubhubhane.
"
"jwaloka ha re sebeletsa ho se hlola, re lokela ho tii setsa boikemisetso ba rona ba ho sebetsa ka boikarabelo le ka hloko.
","manje njengaloku sisebentela kuluncoba, sifuna kucinise kisa kutinikela kwetfu kutiphatsa ngalokunesibopho nekwenta tintfo ngekucilika.
"
"ka ho etsa jwalo, re tla be re fana ka kgahlamelo e tshwarehang ho melaetsa ya lefatshe ya tshepo, topollo, tokoloho le bonngwe e tla bueha dikerekeng, masina kgokgeng, dimoskeng tsa naha ya bo rona matsatsing le dibekeng tse tlang.","ekwenteni njalo, sitawube senta umlayeto lofananako welitsemba, wensindziso, wenkhululeko newekubambisana lotawube kukhulu nywa ngawo emasontfweni, emasinagogweni, kumamosque nasemakhaya emhlaba wetfu kulamalanga nemaviki letako kutsi ube nemandla."
"demokerasi ya rona e tla re thusa ho hlola covid 19 vukuzenzele unnamed hangata re nka demokerasi ya rona e hlwahlwa le e matla hanyane.
","intsandvo yelinyenti yetfu itawusisita sincobe icovid 19 vukuzenzele unnamed sivamise kuyitsatsela phasi lentsandvo yelinyenti yetfu lenemphilo nalenemandla lamakhulu.
"
"feela e batla e le sesebediswa sa rona se seholo ka ho fetisisa mabapi le ntwa ya rona ya ho hlola sewa sa kokwanahloko ya corona.
","kantsi ilifa letfu lelikhulukati emzabalazweni wetfu lomkhulu wekuncoba lolubhubhane lwecorona.
"
"re na le baahi ba tsebang haholo ka dipolotiki lefatsheng.
","lesinayo emkhatsini wetakhamuti letihlanganyela kutepolitiki ngemandla emhlabeni.
"
"diphuputso tse entsweng ke setsi sa diphuputso sa pew ka 2018 se bontsha hore maafrika borwa a kgona ho nka kgato ya sepolotiki ka matla mabapi le dintlha tse ba ngongorehisang haholo, tse kang tlhokomelo ya kalafo, thuto, bolokolohi ba puo le bobodu.
","lucwaningo lwanga2018 lolwentiwa ipew research center lukhombisa kutsi bantfu baseningizimu afrika bayavama kakhulu kutsatsa sinyatselo setepolitiki mayelana netintfo labeva banemiva kakhulu ngato, njengekunakekelwa ngetemphilo, temfundvo, kukhuluma ngekukhululeka nenkhohlakalo.
"
"diphuputso di thathiselletsa haholo ka seo re seng re se tseba ka rona.
","lolucwaningo lucinisekisa kakhulu kutsi siyatati kutsi sibobani.
"
"re thabela ho buisana ka matla le mmuso wa rona le ka bo rona mabapi le ditaba tse tjhesang tsa letsatsi.
","kute lesikujabulela kakhulu kwendlula kukhulumisana nahulumende wetfu nekukhulumisana sodvwana ngalokunemandla mayelana netindzaba letibalulekile telusuku naletiphutfumako.
"
"re na le setjhaba se itahlelang ka setotswana ditabeng tsa letsatsi ka leng, se dulang se ikemiseditse ho sireletsa ditokoloho le ditokelo tsa rona tsa mantlha.
","sinenhlangano yemmango lenemandla lehlala njalo ilungele kugadza tinkhululeko nemalungelo etfu labalulekile.
"
"e nngwe ya ditlholo tsa rona tsa demokerasi ke hore moafrika borwa e mong le e mong o dumela hore molaotheo o a mo sireletsa le hore makgotla a dinyewe a hloka leeme le ho ba moahlodi ya sa nkeng lehlakore mabapi le dikgahlehelo tsa bona.
","lokunye kuncoba kwentsandvo yelinyenti yetfu kutsi bonkhe bantfu baseningizimu afrika bakholelwa ekutseni umtsetfosisekelo uyabavikela nekutsi tinkatolo tinebulungiswa futsi tingumlamuli longakhetsi cala etintfweni labatifunako.
"
"ke ile ka nahana ka ditaba tsena moraorao tjena ha ke ne ke etetse kapa botjhabela ho ya lekola boemo ba boitokisetso ba provense eo mabapi le kokwanahloko ya corona.
","ngicabange ngato letintfo ngiseluhambeni lwami lengisandza kulutsatsa lwekuya emphumalanga kapa kuyohlola simo salesifundza sekulungela kubukana neligciwane icorona.
"
"moqolotsi wa ditaba o ile a mpotsa haeba ke tshwenyehile ka qoso e motjheng ya ho phephetsa dipehelo tse ding tsa molao wa taolo ya dikoduwa.
","ngibutwe yintsatseli kutsi ngiyakhatsateka yini mayelana nalelicala lembango lelisengakaphetfwa leliphikisana naleminye yemitsetfomgomo yemtsetfo wekulawula tinhlekelele.
"
"molao ona ke motheo wa melawana yohle e phatlaladitsweng tlasa maemo a koduwa ya naha ao re a tsebahaditseng ho lwantsha kokwanahloko ya corona.
","lomtsetfo usisekelo sayo yonkhe imitsetfomgomo leshaywe ngaphansi kwesimo lesiyinhlekelele savelonkhe lesasimemetelela kulwa neligciwane icorona.
"
"esale koduwa ena e qala, batho ba bangata ba sebedisitse tokelo ya bona ya ho leba makgotleng a dinyewe.
","kusukela kwacala lenhlekelele, banyenti bantfu labasebentise lilungelo labo lekuya etinkantolo.
"
"melawana ya ho kginwa ha ditshebeletso le metsamao ya batho e ile ya phephetswa bekeng ya pele feela ya ho kginwa ha ditshebeletso ke moahi wa mpumalanga ya neng a batla ho kotelwa thibelong ya ho ya lepatong.
","lemitsetfomgomo yekumiswansi kwemisebenti neminyakato nekuhlala ekhaya kwavelonkhe kwaphikiswana nayo kusukela ngeliviki lekucala lekumiswansi kwemisebenti neminyakato nekuhlala ekhaya kwavelonkhe sakhamuti sangasese lesivela empumalanga lebesifuna kukhululwa ekungavunyelweni kuhambela umngcwabo.
"
