"o bolela gore ge go ka hwetša gore go bile le tiragalo ya go tshela molao – e ka ba ya go reka dithoto le ditirtelo le ya go thwala bašomi ka tsela ya bomenetša, pipamolomo, bomenetša bja go amana le kabo ya dintlo tša rdp, tso golekobong yeo e amanago le tšhelete ya thušo ya leago, bofaladi bjo bo sego molaong, tlaišo, bohodu goba tsogole kobong – psc e tla šišinya gore go be le kgato ya kimollo go kgoro ye e amegago goba ya romela molato woo go the hawks, tirelo ya maphodi sa ya afrika borwa (saps) goba go sehlophatšhomo sa twantšho ya bomenetša go nyakišišwa go tšwela pele.
","utsi nangabe kutfolakala kutsi kukhona lokungake ntiwa ngemfanelo – kungaba kungahanjiswa ngemfanelo nakutsengwa nome nakuca shwa, kudiza, yinkhohlakalo lephatselene netindlu terdp, kukhwabanisa kwetibonelelo tahulumende, kuhamba ungene nome uphume eveni ngalokungekho emtsetfwe ni, kuhlasela, kweba nome kukhwabanisa – ikhomishina yetemisebenti yahulumende ingenta sincomo sekutsi lelo tiko lelifanele lente tinya tselo tekulungisa nome ingandlulisela kuluphiko lwaboklebe, lwesaps nome ecenjini lemsebenti wekulwa nenkhohlaka lo kutsi kwentiwe lu phenyo loluchubekako.
"
"melato yeo psc e e romelago go dikgoro go yo nyakišišwa e akaretša: ge bašomi ba mmušo ba dira mešomo ya tlaleletšo go hwetša tšhelete ka ntle le tumelo ya dikgoro tšeo ba di šomelago; dithulano tša dikga hlego tšeo di sego tša tsebagatšwa dikgorong tšeo ba di šomelago le; maitshwaro ao a sa amogelegego.
","tehlakalo ipsc leti ndlulisela ematikweni kutsi tiphenywe, tifaka ekhatsi: basebenti bahulumende labenta umsebenti lowengetiwe batfole imali ngaphandle kwemvume yematiko kushayisana kwetimfu no lokungakadzalulwa, kanye nekutiphatsa ngaloku ngasiyo inchubo lemu ke lekile.
"
"seloane o bolela gore psc e fa dikgoro tša mmušo matšatši a 60 go nyakišiša le go tswalela molato woo.
","seloane utsi ipsc inika litiko lahulumende emalanga lange60 kutsi iphenye futsi iluvale ludzaba.
"
"o bolela gore go tloga fao kgoro e tsebiša psc ka ga dikutollo tša yona.
","utsi litiko beseke latisa ipsc ngaloko lelikutfolile.
"
"""ge e le gore re thabišwa ke dikgato tšeo di tšerwego ke kgoro, re tla tswalela molato woo, eupša ge re se ra kgotsofala, re boela go bona.
","""nangabe siya jabula ngaleto tinyatselo leti tsatfwe litiko, sitalu vala ludzaba, kodvwa nangabe asikanetiseki, silu buyisela emuva futsi kubo.""
"
"""re tiišitše gore maina a gago a ka se tsebagatšwe ge mmegi wa ditiro tša bomenetša a sa nyake gore leina la gagwe le tsebagatšwe, mohlankedi wa psc wa mogala wa go se lefelwe o ngwala fela dintlha tša gagwe tša boikgokaganyo.
","kungatiwa kucini sekisiwe 00000000 nangabe inhlabamkhosi ingafuni kutsi kuvetwe buyena, sisebenti seno mbolo yelucingo lwama hhala lwepsc sibhala phasi kuphela iminini ngwane yabo yekubatsintsa.
"
"se se bohlokwa gore ge e le gore tshedimošo ya tlaleletšo e a hlokega, psc e kgone go ikgokaganya le yena.
","loku kubalulekile ngobe na ngabe lwatiso lolwengetiwe ludzingeka, ipsc kufanele kutsi ikhone kubatsintsa.
"
"babegi ba ditiro tša bomenetša bao ba begago melato mogaleng wa go se lefelwe wa psc ba netefaletšwa gore ba tla šireletšwa ge e le gore ba nyaka go dula maina a bona a sa tsebagatšwe, gwa bolela seloane.
","tinhlabamkhosi letibika tehlakalo ngenombolo yelucingo lwamahhala lwepsc tiyacinisekiswa kutsi titawuvikeleka na ngabe tifuna kutsi tingatiwa, kusho seloane.
"
"o hlaloša gore bahlankedi ba tha rollo ya molato ka pela ba hlahlilwe go netefatša gore boitšhupo bja mmegi wa ditiro tša bomenetša bo dula bo šireleditšwe.
","uchaza kutsi baphenyi bekucala bacece shiwe kutsi bacinisekise kutsi buyena benhlabamkho si buhlala buvikelekile.
"
"seloane o bolela gore ma afrika borwa ba swanetše go bega ditiro tša bomenetša ka gobane di utswetša bahloki le go thibela tlhabollo, gomme se se thibela gore naga ye e tšwele pele.","seloane utsi bantfu baseni ngizimu afrika kufanele kutsi bayibike inkhohlakalo ngobe yebela labaphuyile futsi ivimba intfutfuko, lokuyintfo levimbela lelive kutsi lichubekele embili."
"ga go na lebaka leo o ka le fago go dira gbv vukuzenzele unnamed ge maitshwaro a naga a ka lebele lwa ka mo e swarago basadi le bana, gona ga re šome gabotse.
","asikho sizatfu segbv vukuzenzele unnamed uma ngabe similo sesive sikalwa ngendlela lesiphatsa ngayo bantfu lababomake nebantfwana, loko kungasho kutsi siyahluleka kakhulu.
"
"dipalopalo tša bosenyi tša kgauswanyane tšeo di lokolotšwego ke tirelo ya maphodisa a afrika borwa (saps) di bontšha koketšego ya bosenyi bja go phaya theto ka kgang, dikgaruru tša ka malapeng, le, se sengwe seo se hlobaetšago kudu, go bolawa ga bana.
","letibalobalo takamuva tebugebengu letikhishwe luphiko lwetemaphoyisa aseningizimu afrika (isaps) tikhomba kutsi enyukile emacala ekudlengula, ebudlova basekhaya, futsi, mhlawumbe lokusikhatsatako kakhulu, kwenyuka kwemacala ekubulawa kwebantfwana.
"
"gare ga mosegamanye le lewedi 2021, batho ba 9 556, bao bontši bja bona e lego basadi, ba phailwe theto ka kgang.
","emkhatsini kwakholwane nemphala 2021, bantfu laba9 556, linyenti labo lelibomake, badlengulwa.
"
"se ke koketšego ya 7% go feta nakong ya pego ya go feta.
","loku kumaphesenti langetiwe lasikhombisa langetulu kwalowo esikhatsi lesengcile sekukhishwa kwalombiko.
"
"go melato ya go betha ye e ka bago 73 000 yeo e begilwego nakong ye, ya go feta 13 000 e amana le dikgaruru tša ka malapeng.
","kulamacala ebudlova labikiwe lacishe abe73 000 kulesikhatsi sanyalo salombiko, langetulu kwe 13 000 bewamayelana nebudlova basekhaya.
"
"palo ya dipolao tša bana e oketšegile gararo ge go bapetšwa le ya nakong ya pego ya go feta.
","lizinga lemacala ekubulawa kwebantfwana likhule ngalokucishe kube ngilokuphindvwe katsatfu uma kucatsaniswa nesikhatsi lesengcile sekukhishwa kwalombiko.
"
"re šetše re boletše gore dikgaruru tšeo di hlolago ke banna kgahlanong le basadi ke leuba la bobedi eupša naga ya rena e swanetše go le lwantšha, gomme go no swana le leuba la covid19 re ka le fenya ge ka moka re ka šoma mmogo.
","sike sasho ngaphambilini kutsi lobudlova lobucondziswe kubomake lobentiwa madvodza bungubhubhane wesibili lekufuneka lelive letfu libukane naye, futsi njengalobhubhane wecovid19 naye lona singawuncoba uma singasebentisana.
"
"bjalo ka mmušo, re na le mošomo le maikarabelo a go aba didirišwa tše di hlokegago go lwantšha bosenyi bja dikgaruru tšeo di hlolwago ke bong.
","njengahulumende, sinemsebenti nesibopho sekuphophelela tonkhe tinsitaletimcoka ekulweni nebugebengu begbv.
"
"go tloga mola go thakgolwago leano la peakanyo ya setšhaba (nsp) la go lwantšha dikgaruru tšeo di hlolwago ke bong le dipolao tša basadi le basetsana (gvbf) ka 2020, go bile le ditsenogare tše mmalwa go arabela gbv.
","kusukela kwacalwa luhlelo lwavelonkhe lwendlelalisu yekulwa nebudlova betebulili nekubulawa kwebesifazane (insp) ngemnyaka we2020, kube kukhona kungenelela lokwehlukahlukene lokucondziswe kwigbv.
"
"se se akaretša go fetošwa ga melao go bohlokwa, thekgo go bao ba phologilego dikgarurung ka go ba thuša ka didirišwa tša go kgoboketša bohlatse mo ditišing tša maphodisa le ditirelo tša go bothamatswalo, go thongwa ga sekhwama sa gbvf le go thekga netweke ya disenthara tša tlhokomelo tša thuthuzela le tša khuseleka.
","loku kufaka ekhatsi tingucuko temtsetfo letinyenti, kusekelwa kwalabo labasindzile ngekuniketa emakhithi ebufakazi etiteshini temaphoyisa kanye netinsita tetengcondvo netekuhlalisana, kwakhiwa kwesikhwama segbvf kanye nekwesekelwa kwekusebenta kwetikhungo tekunakekela tethuthuzela netekhuseleka.
"
"saps e boletše gore go na le tšwelopele mo go fokotšeng ditšhalelomorago tše dikgolo tša tshekatsheko ya dna, seo se lego bohlokwa go phethagatša toka go bao ba phologilego go bosenyi bja thobalano.
","isaps ivete kutsi kunenchubekela embili ekunciphiseni kusalela emuva lokukhulu emsebentini wekuhlatiya idna, lekuyintfo lemcoka yekuletsa bulungiswa kulabo labasindze emacaleni etemacansi.
"
"saps e na le mafelo a 134 a gbv mo ditišing tša maphodisa go phatlala le naga gomme e gare ka tshepetšo ya go hloma a mangwe.
","isaps futsi isebentisa emadeski le134 egbv etiteshini temapho yisa letikulo lonkhe lelive futsi isafuna kwengeta ngekusungula lemanye.
"
"dikgaruru tšeo di hlolago ke bong ke bothata bja dikgaruru tša banna.
","igbv lebangwa madvodza.
"
"bontši ke banna bao ba phayago theto ka kgang.
","kuvamisile kakhulu kutsi kube madvodza ladlengulako.
"
"bontši ke banna bao e lego basenyi ba dikgaruru tša ka malapeng.
","kuvamile kutsi kube madvodza lenta lokubi lokumayelana nebudlova basekhaya.
"
"ka gore ke banna bao e lego basenyi ba bagolo, e swanetše go ba banna bao ba etago pele ka go bolela le go bega dikgaruru tšeo di hlolago ke bong, go godiša temošo, go ruta ba mphato wa bona le go maitapišo a go thibela bosenyi.
","ngenca yekutsi madvodza lenta tintfo letimbi, kufuneka kube ngiwo lahamba embili ekukhulumeni nasekubikeni emacala lamayelana negbv, ekuchwashiseni, ekufundziseni bontsanga nakumitamo yekubuvikela.
"
"e swanetše go ba banna mo maemong a taolo mo lenaneong la rena la thuto, e ka ba dihlogo tša dikolo, barutiši goba bafahloši, bao ba swanetšego go dira gore dikolo le mafelo a thuto ya godimo di bolokege go barutwana le baithuti ba basadi, gomme ba se šomiše maemo a bona a taolo bošaedi go nyaka thobalano.
","kufuneka kube madvodza lasetikhundleni letisetulu laseluhlelweni lwetfu lwetemfundvo, kungaba bothishelanhloko betikolo, bothishela nebafundzisi labasezingeni lemfundvo lephakeme, lekufuneka bente tikolo netindzawo tetemfundvo lephakeme tibe tindzawo letiphephile kubafundzi nakutitjudeni tesifazane, futsi bangasaphindzi, basebentise kabi tikhundla tabo letisetulu kute baphumelelise tifiso tabo tetemacansi.
"
"banna ba swanetše gape go kgatha tema ya go aga le go ba gona go malapa a bona, kudu mo go godišeng barwa ba bona go bontšha bonna bja bona bjo bobotse bjo bo hlomphago basadi le bana.
","emadvodza kufuneka futsi adlale indzima yawo lenkhulu leyakhako neyekutsi ahlale akhona emindenini yawo, kakhulu ekukhuliseni emadvodzana awo kute akhombise kuphila kahle, nebudvodza lobukahle lobuhlonipha bomake ne bantfwana.
"
"ditšhaba le mekgatlo ya setšhaba ba swanetše go šoma mmogo le mmušo go phethagatša ditsenogare le go hlaloša ka lefsa bonna gore re godiše banna ba kwelobohloko, kgotlelelo le tlhompho.
","imimango netinhlangano temmango kufuneka tisebentisane nahulumende kute kube nekungenelela lokutawuchaza kabusha budvodza kute sikhulise emadvodza laneluvelo, labeketelako nalanenhlonipho.
"
"bjale ka ge go fediša gbv e ka se be maikarabelo a mmušo fela, e ka se be maikarabelo a basadi le bana go fediša magato a go tšhoša a dikgaruru le tlhorišo tšeo di ba aparetšego.
","njengoba nako kucedza igbv kungasiwo umsebenti wahulumende kuphela, angeke kubesemahlombe abomake nebantfwana kucedza lamazinga latfusako eludlame nekuhlukunyetwa lokwenteka kubo.
"
"banna ba afrika borwa ba swanela ke go kgatha tema ye kgolo go thibela gbv.
","emadvodza aseningizimu afrika kufuneka adlale indzima lenkhulu kuvikela igbv.
"
"ba swanetše go kwešiša gore ke eng seo se hlolago gbv, kudu dikgaruru tša thobalano.
","kufuneka avisise kutsi yini lengena ngaphansi kwegbv, kakhulu budlova betemacansi.
"
"dipalopalo tša moragorago tša bosenyi di bontšha gore batho bao e ka bago 4 000 ba phailwe theto ka kgang ka magaeng a bona goba ka magaeng a basenyi, gomme melato ye 400 yeo e begilwego motšwasehlabelo le mosenyi ba be ba na le kamano.
","letibalobalo takamuva tebugebengu tikhomba kutsi bantfu labacishe babe4 000 badlengulwa emakhaya abo noma emakhaya alabo lababadlengulako, futsi emacaleni la400 labikiwe umdlenguli nemhlukunyetwa bebavana.
"
"se se bolela gore banna ba bangwe ga ba kwešiše gore go robalana le motho ntle le tumelelo ya gagwe ke bosenyi.
","loku kusho kutsi lamanye emadvodza awavisisi kutsi kuya ecansini ngaphandle kwekuvumelana ngaloku gcwele kulicala.
"
"banna ba swanetše go hlompha basadi le balekane ba bona gomme ba kwešiše gore go ba ka kamanong ya marato ga se lebaka la go dira dikgaruru tša ka malapeng.
","emadvodza kufuneka ahloniphe emakhosikati awo netintfombi tawo futsi avisise kutsi kuba nemlingani lotsandzana naye akusiso sizatfu sekutsi wente licala lebudlova basekhaya.
"
"ge monna o tee a ka kgoboketša banna ba babedi gomme boraro bja bona ba ikana go se tsoge ba phaile mosadi theto ka kgang, ba ka se tsoge ba bethile mosadi gomme ba rwešana maikarabelo a boikano bjo, re ka thoma go lwantšha ka nnete dikgaruru tša go hlolwa ke bong mo nageng ya rena.
","uma leyo naleyo ndvodza ingahlanganisa emadvodza lamabili bese bobatsatfu benta sifungo sekungasaphindzi badlengule bomake, bangasiphindzi babashaye futsi bagadzane kutsi bayasilandzela lesifungo, singacala kukhomba kutimisela kulwa igbv kulelive letfu.
"
"ga se gwa lekana go tsena ka bogare ge fela basenyi ba šetše ba swerwe.
","akukaneli kungenelela kuphela uma badlenguli sebangene eluhlelweni lwetebulungiswa.
"
"re swanetše go thibela dikgaruru tša go hlolwa ke bong pele di direga.
","kufuneka siyigweme ingenteki igbv ngembi kwekutsi yenteke.
"
"ke ipeletša go banna ba afrika borwa, ba bannyane le ba bagolo, bao ba dulago ditoropong le magaeng,ba sebjalebjale le ba sekgale, bao ba nyetšego le bao base a nyalago, go ba karolo ya maitapišo a go thibela ao a hlokegago ka magaeng le ditšhabeng tša rena.
","ngenta lubito kuwo onkhe emadvodza aseningizimu afrika, lamancane nalamadzala, lahlala emadolobheni nalahlala etindzaweni tasemakhaya, laphila simanje nalaphila sidzala, lashadile nalangakashadi, kutsi abe yincenye yemitamo yetfu yekuvikela lokudzingekako lokubuhlungu emakhaya nasemimangweni yetfu.
"
"ka go gana go dumelela dikgaruru kgahlanong le basadi le bana, ka go se be karolo ya tšona le go bega ditiro tšeo, o bontšha mohlala wo mobotse go banna ba geno, kudu go banna ba bafsa le bašemane.
","ngekwala kuvumela budlova lobucondziswe kubomake nakubantfwana, ngekungabi yincenye yako wena ngekwakho nangekubika tehlakalo letinjena, ubeka sibonelo kulamanye emadvodza angakini, kakhulu emadvodzeni lasesema ncane nesebafaneni.
"
"o tla ba o romela mola etša wa gore, kamano, segwera goba tshepano e kase be lebaka la go se emele ditokelo tša basadi le bana.","utawube utfumela luphawu lolucacile lolutsi kute buhlobo, bungani noma kwetsembeka lokungaba sizatfu sekungasukumeli emalungelo abomake newebantfwana."
"go šoma mmogo go matlafatša temokrasi vukuzenzele unnamed bjalo ka ge afrika borwa e tsene ngwa geng wo moswa, re be re lebane le ditiragalo tše pedi tše kgolo tšeo di re gopoditšego, ka ditsela tša go fapana, seo se re ko panyago bjalo ka batho.
","asisebentisaneni kute sinike intsandvo yelinyenti emandla vukuzenzele unnamed njengoba iningizimu afrika ingene emnyakeni lomusha, sihlangabetane netigameko letinkhulu letimbili letisikhumbute, ngetindlela letehlukahlukene, loko lokusihlanganisako lokusenta sibe bantfu.
"
"ka letšatši la mathomo la 2022, setšhaba se kopane moyeng go laelana le mopišopomogolo desmond tutu kerekeng ya st george’s cathedral go la cape town.
","ngelilanga lekucala lemnyaka we2022, sive sahlanganyela ndzawonye ngekwemoya savalelisa umbhishobhi lomkhulu desmond tutu est george’s cathedral ekapa.
"
"e be e le nakwana ya ma nyami a magolo ge re be re gopola bophelo le seabe sa modudi yo a rategago yoo e bego e le, ka ditsela tše ntši, motho wa maitshwaro a mabotse wa setšhaba sa rena.
","bekusikhatsi selusizi lolukhulu njengoba besikhumbula imphilo neligalelo lalomunye wakitsi lebesimtsandza, longetindlela letehlukene, bekakhombisa indlela lekahle yekutiphatsa esiveni sakitsi.
"
"go sa le bjalo, poloko ya gagwe e be e le keteko ya di kgopolo tše a bego a di emela.
","ngaso leso sikhatsi, umgcwabo wakhe bewuwekubungata timiso bekakholelwa kuto.
"
"e be e le keteko ya botee bjo bogolo le phapano ya setšhaba sa rena, le segopotšo sa ditahlegelo tše di dirilwe go ke batho ba bantšintši go fihlelela temokrasi ya rena.
","bekumbungato wekubumbana lokukhulu newekwehlukahlukana kwebantfu bakitsi, futsi bekusikhumbuto sekutidzela lokwentiwa bantfu labanengi kute kutfolakale intsandvo yelinyenti.
"
"ka letšatši la bobedi la 2022, naga e bogetše ka manyami ge mollo wo mogolo o fiša palamente ya rena, dimetara tše lekgolo fela go tloga moo re bego re kgobokane gona letšatši pele ga moo go fa tlhompho ya rena ya mafelelo go mopišopomogolo tutu.
","elusukwini lwesibili lwemnyaka we2022, live lathuka kakhulu kubona umlilo lomkhulu uhlasela iphalamende, indzawo lelibanga lelimamitha lalikhulu kunalapho besihlanganyele khona ngayitolo kuvalelisa umbhishobhi lomkhulu tutu.
"
"re imologile gobane ga go na tahlegelo ya bophelo le gore ga go na yo a gobetšego mollong woo.
","siyadvudvuteka ngekutsi akukabi nekuphuma kwemphefumulo nangekutsi kute lowalimala ngalomlilo.
"
"re leboga kudu borasetimamollo bao ba katanego le go tima mollo gomme mafelelong ba kgona go o tima.
","siyabonga kakhulu kubacishimlilo labalwa nalelilangabi bagcina bakhonile kulicima.
"
"dinyakišišo tša seo se hlotšego mollo bjale di tšwela pele.
","kusentiwa luphenyo mayelana naloko lokubange lomlilo.
"
"re swanela go kgonthiša gore dinyakišišo tše ke tše di tseneletšego ebile di phethwa ka pelapela.
","kufuneka sicinisekise kutsi loluphenyo luyentisiswa kahle nekutsi luyaphotfulwa masinyane.
"
"naga e nyaka go tseba seo se diregilego.
","sive sifuna kwati kutsi kwentekeni.
"
"dipeakanyo di a dirwa go kgonthiša gore mošomo wa palamente o ka tšwelapele le ge e le gore meago e ka se šomišwe.
","emalungiselelo ayentiwa kucinisekisa kutsi umsebenti wephalamende utawuchubeka nanoma kungeke kusetjentiswe takhiwo tayo.
"
"go bohlokwa gore palamente e tšwelapele go akanya le go phasiša melao yeo e tlago fetola setšhaba le go tšwelapele go lekola le go kgonthiša boikarabelo ka ge mmušo o phethagatša taelo yeo e e amogetšego go tšwa bathong.
","kumcoka kutsi iphalamende ichubeke kubuka nekushaya imitsetfo letawuletsa tingucuko emmangweni nekutsi iyachubeka kwenta umsebenti wekugadza newekucinisekisa kuphendvula njengoba hulumende asebenta kuphumelelisa ligunya lalinikwe bantfu.
"
"ka ntle ga go ba kgau swikgauswi le kereke ya st george’s cathedral le pala mente, seo se kopanyago ditiragalo tše tše pedi ke gore ye nngwe le ye nngwe e re gopotša seo se re kopanyago bjalo ka maafrika borwa: temokrasi ya rena.
","ngaphandle kwekwakhelana edvute kwephalamende nest george’s cathedral, lokuhlanganisa letigameko letimbili ngikutsi leso naleso sigameko sisikhumbuta loko lokusihlanganisako njengebantfu baseningizimu afrika: intsandvo yelinyenti yetfu.
"
"re llela desmond tutu gobane e be e le moetapele wa semoya wa temokrasi ya rena.
","siyakhala ngekulahlekelwa ngudesmond tutu ngoba bekangubabe ngekwemoya wentsandvo yelinyenti yetfu.
"
"re nyamišitšwe ke go senywa ga meago ya palamente ya rena gobane ke mošate wa temokrasi ya rena.
","siphelelwa litsemba ngalomonakalo lowenteke kutakhiwo tephalamende yetfu ngoba tiyindzawo lapho kuhlala khona intsandvo yelinyenti yetfu.
"
"ke lefelo la moo molaotheo wa rena wo moswa wa temokrasi o amogetšwego gona me ngwaga ya ka godingwana ga ye 25 ya go feta, le moo ma kgolokgolo a melao ya phetogo e phasišitšwego gona.
","tiyindzawo lapho kwavunyelwana khona ngentsandvo yelinyenti yetfu lensha eminyakeni lengetulu kancane kule25 leyengca, nalapho emakhulu emitsetfo leyaletsa tingucuko yashaywa khona.
"
"re ka no ba re sa bone selo se, eupša mollo palamenteng o laeditše ka moo maafrika borwa a boulelwago ka gona ka temokrasi ya bona.
","angeke sihlala sikubona loku, kodvwa lomlilo wasephalamende ukhombise kakhulu kutsi bantfu baseningizimu afrika bayitsandza kanganani intsandvo yelinyenti yabo.
"
"gape ke segopotšo sa ka moo go lego bohlokwa gore re šogane le go matlafatša le go šireletša temokrasi yeo.
","kuyasikhumbuta futsi kutsi kumcoka kanganani kutsi sisebentele kunika emandla nekuvikela lentsandvo yelinyenti.
"
"mola meago ya palamente e senyegile moo e lego gore e ka se šomišwe, sehlongwa sa palamente se tšwetšapele mošomo wa sona wa go šomela batho.
","nanoma takhiwo tephalamende timoshakele ngendlela yekutsi angeke tisasebentiseka, iphalamende njengesikhungo iyachubeka kwenta umsebenti wayo wekusebentela bantfu.
"
"se ke segopotšo se bohlokwa sa gore di hlongwa tša rena tša temokrasi ga di hlalošwe go ya ka meago yeo di lego ka gare ga yona, eupša ka mošomo wo di o dirago le ka boitshepho bjo batho ba nago nabjo go yona.
","loku kusikhumbuto lesimcoka sekutsi tikhungo tetfu tentsandvo yelinyenti atatiwa ngetakhiwo letikuto, kodvwa tatiwa ngemsebenti letiwentako nangelitse mba bantfu labanalo kuto.
"
"se ke nnete go dihlongwa ka moka tša temokrasi ya rena.
","loku kuliciniso kuto tonkhe tikhungo tentsandvo yelinyenti yetfu.
"
"mafelelong ge mollo palamenteng o sa tšwa go tingwa, moahlodimogolo wa motšwaoswere raymond zondo ke ge a lokolla karolo ya mathomo ya pego ya khomišene ya dinyakišišo ka go gogwa ga mmušo ka nko.
","ngalesikhatsi ucedza kucinywa umlilo ephalamende, libamba lelijaji lelikhulu raymond zondo watfula incenye yekucala yembiko wekhomishini yeluphenyo lwekubamba umbusongabhongwane.
"
"karolo ye ya pego e hla losa ka moo dihlongwa tša setšhaba tše mmalwa di bego di tseneletšwe, di thopetšwe dithoto le go senywa wo šoro.
","lencenye yalombiko ichaza ngekutsi kwangenwa njani kutikhungo letehlukahlukene tahulumende, taphangwa njani nekutsi tacekelwa njani phasi ngalendlela.
"
"tše di akaretša kgwebo ya go laolwa ke mmušo go swana le ditirelophofo tša afrika borwa, lekala la dikgokagano tša mmušo le mekgwa ya tshedimošo le lekala la tirelo ya metšhelo ya afrika borwa.
","loku kufaka tinkampani temabhizinisi tahulumende letifana netitfutsi tetindiza taseningizimu afrika, tetekuchumana tahulu mende netekwatisa kanye netemisebenti yetensela yaseningizimu afrika.
"
"karolo ye ya pego e fa seswantšho sa go tshwenya kudu sa ka moo dihlongwa tše bohlokwa tša temokrasi di šaeditšwego le go nyatšwa ka maikemišetšo a bosenyi.
","lencenye lena yalombiko inika sitfombe lesingasikahle kakhulu sekutsi tikhungo letimcoka tentsandvo yelinyenti yetfu tabekwa engotini lenga kanani nekutsi beticekelwa kanjani phasi ngenhloso yekwenta bugebengu.
"
"ga se fela palo ye kgolo ya tšhelete ye e utswitšwego, eupša di hlongwa tše di be di sa kgone go dira ka tshwanelo mešomo ya tšona yeo di hlomilwego ka lebaka la yona.
","akusiko kuphela kutsi kwebiwa imali lenyenti, kodvwa letikhungo betingakhoni kwenta ngalokufanele umsebenti wato letasungulelwa wona.
"
"dikutullo le ditšhišinyo tša khomišene ya zondo di tla thuša naga go agaleswa dihlongwa tše le go rweša boikarabelo bao ba nago le maikarabelo.
","loko lokutfolakele netincomo talekhomishini yazondo kutawusita lelive kutsi lakhe kabusha letikhungo nekutsi labo labasebenta kuto baphendvule.
"
"re swanetše go khonthiša gore re di šomiša go šireletša dihlongwa gore le ka moso di se ke tša tsoga di thopilwe gape.
","kufuneka sicinisekise kutsi sisebentisa letincomo kuvikela letikhungo kute tingaphindzi tibanjwe ngabhongwane esikhatsini lesitako.
"
"re swanetše go lwa le twantšho efe goba efe le maiteko ka moka a go tekatekiša temokrasi ya rena ya go hwetšwa boima – ge eba maiteko a a tšea sebopego sa bomenemene ka dikgwebong tša go laolwa ke mmušo, go phuhlamiša dietšentshi tša rena tša phethagatšo ya molao, go senya ka boomo mananeokgoparara a rena a ikonomi, goba go hlasela bolokologi le tlhompho ya boahlodi bja rena.
","kufuneka siyivikele kunoma ngabe yini nakuyo yonkhe imitamo yekululata intsandvo yelinyenti yetfu lesiyitfole matima – kungaba kutsi lemitamo itsatsa simo sekwenta inkhohlakalo kumabhizinisi ahulumende, kuvukela emaejensi etfu etemtsetfo, kucekela phasi sakhiwonchanti setfu setemnotfo, noma kuhlasela inkhululeko yetfu kanye nekubacotfo kwetebulungiswa betfu.
"
"re nyaka go šireletša mola otheo wa rena, pušo ya rena ya temokrasi le tshepedišo ya dikgetho go tšwa go mang le mang yoo a nyakago go tekatekiša temokrasi ya rena le go tima batho ba afrika borwa tokologo ya bona ye e hweditšwego ka boima.
","kufuneka sivikele umtsetfosisekelo wetfu, sive setfu sentsandvo yelinyenti kanye nenchubo yetfu yelukhetfo kuwo wonkhe umuntfu lofuna kwenta intsandvo yelinyenti yetfu ibe butsakatsaka nakulovimbela bantfu baseningizimu afrika kutsi batfole inkhululeko yabo lebayilelwa matima.
"
"go na le mathata a mantši ao re swanetšego go a lebantšha ge re ntše re šogana le go agaleswa le go tsogagape go tšwa dikhuetšong tša leuba la covid19.
","kunetinseyeya letinyenti lekufuneka sibukane nato njengoba sisebentela kwakha kabusha nekululama kulemitselela yalobhubhane wecovid19.
"
"bjalo ka ge re dira bjalo, a re tšee maatla le tlhohleletšo go tšwa go boineelo bja go tsenelela go temokrasi ya rena le tumo ya rena ya go swana ya go aga naga yeo e nago le botee, tokologo le tekatekano.
","njengoba senta loku, asitfoleni emandla nekugcugcuteleka kulokutibophelela kwetfu ngemandla kuntsandvo yelinyenti nakusifiso setfu lesifanako sekwakha sive lesibumbene, lesikhululekile nalesinekulingana.
"
ke le lakaletša tše botse ka moka mo ngwageng wo ge o ntše o tšwelapele.,nginifisela tilokotfo letinhle nonkhe kulomnyaka lesibukene nawo.
