"die presidensiële indiensnemingstimulus verskaf verligting aan gesinne wat n lang, moeilike winter verduur het, met inkomste wat baie verminder het en vir individue wat reeds baie jare sonder werk moes oorleef.
","lesolo la tsošološo ya mešomo ka presidente e tliša kimollo go malapa ao a itemogetšego marega a matelele a go tonya, ka letseno leo le fokotšegilego kudu, gape le bakeng sa batho bao ba feditšego mengwaga e mentšhi ba sa šome.
"
"regte, behoorlike werk is elke mens se reg.
","mošomo wa nnete wa go tšea gabotse ke tokelo ya motho yo mongwe le yo mongwe.
"
"dit is n voorwaarde vir ekonomiese groei en maatskaplike stabiliteit.
","ke senyakwa sa kgolo ya ikonomi le boitekanelo bja leago.
"
"die presidensiële indiensnemingstimulus lewer n deurslaggewende bydrae tot die ontwikkeling van n samelewing wat werk, deur uiting aan dié fundamentele reg te gee.","ka go fa tokelo ye maatla, lesolo la tsošološo ya mešomo ka presidente e tsenya letsogo go kwagala mo tabeng ya go aga setšhaba seo se šomago."
"'n professionele staatsdiens vukuzenzele unnamed met my verkiesing as staatspresi dent het ek des tyds gesê dat die skepping van ’n doeltreffende, be kwame en etiese regering, vry van enige korrupsie, een van my grootste prio riteite is.
","ditirelo tša mmušo tše di nago le bokgoni vukuzenzele unnamed ge ke be ke kge thwa goba mopre sidente wa afrika borwa, ke boletše gore go hloma mmušo wa tokologo le potego, wo kgonago le wa bokgoni ebile o hloka bomenetša ke seo se bego se le sa tše dingwe tša dilo tšeo di tlago pele ga tšohle.
"
"slegs ’n bekwame, doeltref fende, etiese en ontwikke lingsgeoriënteerde regering kan die verbintenis tot die verbetering van die lewens van die mense van hierdie land nakom.
","ke fela mmušo wa bokgoni, wa tsheketšo, wa potego le wo o lebantšego šedi ya ona tlhabollong wo o ka kgonago go fihlelela boikgafo bja go kaonafatša maphelo a badudi ba naga ye.
"
"dit beteken dat die staats diens beman moet word deur mense wat professioneel, vaardig, onbaatsugtig en eerlik is.
","se se ra gore ditirelo tša mmušo di swanetše go šongwa ke banna le basadi ba bokgoni, tsebo ya mošomo, ba go se inaganele ba le noši le ba potego.
"
"hulle moet daartoe verbind wees om die waardes van die grondwet te handhaaf en moet, soos ek in my in huldigingstoespraak gesê het, ""hulself getrou vir geen ander saak as dié van die publiek beywer nie"".
","ba swanetše go ikgafa go šireletša metheo ya molao theo, le gore, bjalo ka ge ke boletše polelong yaka ya ma thomo ya go tsena setulong, ""ba swanetše go šoma ka po tego le go hlankela setšhaba fela"".
"
"tydens die afgelope twee weke het openbare kon sultasies plaasgevind met betrekking tot ’n belangrike beleidsdokument wat groter dryfkrag gaan gee aan ons werk om die staatsdiens te steun, versterk en bevoeg te maak.
","mo dibekeng tše pedi tša go feta, ditherišano tša setšhaba di tšweletše ka sengwalwa se bohlokwa sa pholisi seo se tla tlišago hlohleletšo ye kgolo mo matsapeng a rena a go hlatloša, go maatlafatša le go aba ditirelo tša setšhaba ka go thwala batho ba maleba.
"
"die konsep vir die nasionale implementeringsraamwerk vir die professionalisering van die staatsdiens is daarop gemik om ’n regering tot stand te bring wat ons volk beter dien, wat geïsoleer is van onbehoorlike politieke inmenging, en waar aanstel lings op meriete plaasvind.
","seakanywa sa tlhako ya phethagatšo ya bosetšhaba se se lebeletšego go aba diti relo tša mmušo ka bokgoni se nepile go hloma mmušo wo o hlankelago batho ba gaborena bokaone, mmušo wa go ba kgakala le khuetšo ye sego maleba ya go šunyašunya nko ga boradipolotiki le fao dithwalo di dirwago go ya ka maleba.
"
"die raamwerk is in novem ber laasjaar deur die kabinet goedgekeur en gestruktureer de konsultasie met verskeie sektore van die samelewing word tans onderneem.
","tlhako ye e dumeletšwe ke kabinete ka dibatsela ngwaga wa go feta ebile ditherišano tšeo di beakantšwego ka tshwanelo le mafapha a go fapafapana a setšhaba di gare di tšwetšwapele.
"
"na seweentwintig jaar van demokrasie kan ons die vol gende van die staatsdiens sê: ondanks uitnemendheid op talle terreine, is daar in baie staatsdepartemente steeds ernstige uitdagings met betrekking tot vaardighede, bekwaamheid en professio naliteit.
","mengwaga ye 27 ka gare ga mmušo wa temokrasi, go nale dipolelo tše lego gona ka ditirelo tša mmušo eupša le ge e le gore mošomo o dirwa ka bothakga le botswerere, re santše re nale ditlhotlo tše kgolo dikgorong tše ntši tša mmušo tša go amana le ma bokgoni, bokgoni ba mošomo le tsebo.
"
"te dikwels is mense aange stel in en bevorder tot sleutel posisies waarvoor hulle nie geskik of bekwaam was nie.
","sa go nyamiša kudu, batho ba thwetšwe le go hlatlošwa maemong a godimo ao ba se nago bokgoni bja ona goba mangwalo a thuto a maleba.
"
"dit het die werksprestasie van die regering beïnvloed en ook bygedra tot nepo tisme, politieke inmenging in die werksverrigting van departmente, ’n gebrek aan verantwoordbaarheid, wan bestuur en korrupsie.
","se ga se ame fela tiragatšo ya mmušo eupša se nale le seabe sa go thwala ka sepitša, go šunyašunya nko ga boradi polotiki mešomong ya di kgoro, tlhokego ya boikara belo, taolo ye mpe le letsogo le kobong.
"
"daar is ook die verwante probleem van politieke en uitvoerende inmenging in die administrasie van die staatsdiens.
","go nale bothata bjo bongwe ba go swana le bjo bja go šunyašunya nko ga bora dipolotiki le khuduthamaga tshepedišong ya ditirelo tša mmušo.
"
"'n mens hoef net te kyk na die onstabiliteit in staatsdepartemente wan neer seniorbestuur verskuif of vervang word elke keer as ’n nuwe minister aangestel word.
","motho a ka bona fela ka go tekateka ga dikgoro tša mmušo ge balaodibagolwane ba šutišwa goba ge go tse nywa ba bangwe maemong a bona nako le nako ge go thwalwa tona.
"
"direkteursgeneraal en pro vinsiale departementshoofde word veral hierdeur geraak.
","balaodipharephare (didg) le baetapele ba dikgoro (dihod) diprofenseng ba amega kudu ka maatla.
"
"in sommige departemente het dgs, departementshoofde en uitvoerende bestuur die voor deel van 'n stabiele amps termyn geniet, wat sulke departemente in staat gestel het om met min ontwrigting aan te hou funksioneer.
","mo dikgorong tše dingwe didg, dihod le balaodiphethiši ba dutše lebaka le letelele maemong a bona, gomme seo sa kgontšha dikgoro go šoma ntle le tšhitišo.
"
"in die meeste sulke departemente waar daar stabiele leierskap is, is ouditverslae geneig om positief en openbare be fondsing verantwoordbaar te wees.
","go tše ntši tša dikgoro tše fao boeta pele bo tieletšego, dipoelo tša bohlakiši di atiša go ba tše botse le gore go nale boikara belo ba ditšhelete.
"
"daarenteen is daar dikwels administratiewe onstuimigheid in departe mente met ’n hoë omset van leierskap.
","fao e lego gore baetapele ba dikgoro ba tsena ba e tšwa, go fela go eba le tlhakatlhakano ya tsamaišo ya kgoro.
"
"een van die belangrikste voorstelle in die konsepraamwerk is dat die staats diens gedepolitiseer moet word en dat staatsdeparte mente van politiek geïsoleer moet word.
","ye nngwe ya ditšhišinyo tše bohlokwa tše dirilwego ka gare ga tlhako ya seakanywa se ke gore ditirelo tša mmušo di swanetše go hloka seabe sa boradipolotiki le gore dikgoro tša mmušo di swanetše go ba kgakala le dipolotiki.
"
"professionalisering is nood saaklik vir stabiliteit in die staatsdiens, veral in die se nior range.
","go aba ditirelo ka bokgoni go maleba go hlola tielelo ditirelong tša mmušo, kudu kudu maemong a godingwa na.
"
"staatsamptenare moet hul pligte kan uitvoer ""ondanks enige veranderinge onder die ministers, lede van die uitvoerende raad of raadslede in die regerende party met betrekking tot die administrasie, of verskui wings van politieke partye na afloop van verkiesings"".
","bahlankedi ba mmušo ba swanetše go kgona go tšwelapele go dira mešomo ya bona ""go sa kgathale diphetogo dife goba dife tša ditona, maloko a khudutha maga goba makhanselara ka gare ga mokgatlo wo bušago e le bona ba laolago tshepedišo, goba diphetogo tša mekgatlo ya dipolotiki morago ga di kgetho"".
"
"ons stel ’n aantal verrei kende hervormings voor, byvoorbeeld die verlen ging van die ampstermyn van departementshoofde op grond van meriete en prestasie, die instelling van beroepsgebaseerde bekwaamheidsassesserings asook die betrokkenheid van die staatsdienskomis sie wanneer onderhoude met kandidate vir die poste van direkteursgeneraal en adjunkdirekteursgeneraal gevoer word.
","re gare re šišinya di peakanyolefsa tše dintši tše di kwagalago, go swana le go oketša paka ya mošomo ya dihlogo tša dikgoro go lebeletšwe mošomo wo botse wo ba o dirago le ka fao ba phethagatšago mošomo, go dira diphetleko tša go amana le bokgoni ba mošomo le go laletša khomišene ya ditirelo tša mmušo dipoledišanong tša go thwala didg le matsogo a balaodipharephare (diddg).
"
"die instelling van integri teitstoetsing vir alle kandi date wat op die kortlys is, sal daartoe bydra dat ons staatsamptenare kan werf wat met eerbaarheid kan dien.
","go tsebagatša diteko tša potego go badiradikgopelo ka moka bao ba hlokotšwego go tla thuša gore re tle re kgone go goka bahlankedi ba mmušo ba go kgona go hla nkela setšhaba ka potego.
"
"ons moet voorts ook die verpligte intreeeksamens wat ons in april 2020 inge stel het, uitbrei na meer as slegs die senior bestuurders.
","go nyakega gape gore re oketše ditlhahlobo tša kgapeletšo tša go šoma ka gare ga kgoro tšeo re di tsebagaditšego ka moranang 2020 tšeo gabjale di ngwalwago ke balaodi bagolwane gore di ngwalwe gape le ke bašomedi ba bangwe ba mmušo.
"
"suksesvolle ontwikkelende regerings het soortgelyke maatreëls wat professiona lisme onder die staatsdiens bevorder.
","mebušo ye atlegilego ya go hlabologa e nale magato a go swana le a go thuša go tšwetšapele bo kgoni ba mošomo ditirelong tša mmušo.
"
"soos ons in die konsepraamwerk noem, ""moet die burokrasie voortdurend lo jaal en nougeset die politieke mandaat wat deur die kiesers en die party daargestel is, implementeer, maar hulle daarvan weerhou om self politieke rolspelers te wees.
","ka ge go ngwadilwe ka gare ga tlhako ya seaka nywa, ""mmušo wa mehleng o swanetše gore ka potego le ka mafolofolo o tšwelepele go phethagatša thomelo ya sepolotiki yeo e hlamilwego ke bakgethi le mekgatlo ya dipolotiki, le gore ba emiše ka go ba bomponeng ba di polotiki ka seng sa bona.
"
"""ons voorstel is ’n stren ger benadering jeens die werwing en keuring, in duksie en prestasiebestuur van staatsamptenare.
","""re gare re šišinya lemanoga la go tiišetšwa letsogo ge go goketšwa le ge go hlokolwa bahlankedi ba mmušo, taolo ya tlwaetšo ya bašomi le tiragatšo mešomong.
"
"dit sluit in volgehoue leer en ’n duidelike professionele ontwikkelingspad vir elke staatsamptenaar.
","se se akaretša thuto ye tšwelago pele le tlhahlo ye hlakilego ya bokgoni ba mošomo go mohlankedi wo mongwe le wo mongwe wa mmušo.
"
"die konsepraamwerk benadruk die behoefte om staatsamptenare verant woordbaar te hou vir on reëlmatighede en sodoende ’n kultuur van straffeloos heid in die wanbestuur en misbruik van regeringshulp bronne te verhoed.
","tlhako ya seakanywa e gate lela kudu nyakego ya go dira gore bahlankedi ba mmušo ba ikarabele mabošaeding a bona, go fediša setlwaedi sa go se ikarabele godimo ga taolompe le tšhomišobošaedi ya didirišwa tša mmušo.
"
"professionalisering van die staatsdiens behels die opleiding van rekening kundige beamptes oor al die regeringsfere heen met betrekking tot die toepaslike wetlike bepalings.
","go aba ditirelo tša mmušo ka bokgoni go hloka gore bahlankedi ba go sepetša dikgoro ka moka tša mmušo ba hlahlwe mešomong ka dipeakanyetšo tše maleba tša theosemolao.
"
"die nasionale regerings kool speel ’n sleutelrol in hierdie verband.
","sekolotlhahlo sa bosetšhaba sa mmušo (nsg) se nale tema ye bohlokwa yeo se ka e kga thago tabeng ye.
"
"professionalisme behels nie net die regte kwalifikasies en tegniese kennis nie, maar ook die toepaslike standaarde van respek, hoflikheid en integriteit in skakeling met lede van die publiek.
","bokgoni ga bo amane fela le mangwalo a maleba a thuto le mabokgoni a sethekniki, eupša bo amana le go ba le maitshwaro a maleba a tlhompho, tlhomphego le po tego ge o šomišana le maloko a setšhaba.
"
"die staatsdiens is uiteen lopend, met ’n wye verskei denheid vaardighede, kwa lifikasies en bekwaamhede.
","ditirelo tša mmušo di aro gane ka go fapafapana ga tšona, ka mabokgoni a go fapafapana, mangwalo a dithu to le maikarabelo.
"
"baie staatsamptenare het gespesialiseerde vaardig hede wat noodsaaklik is vir doeltreffende dienslewering.
","bahlankedi ba bantši ba mmušo ba nale mabokgoni a go ikgetha ao a lego maleba kabong ye atlegi lego ya ditirelo.
"
"dit is dus nie noodwendig die geval dat ons ’n kleiner staatsdiens benodig nie; wat ons wel nodig het is ’n ef fektiewe staatsdiens met die nodige vaardighede, profes sionele etiek en ’n verbintenis om die gemeenskap te dien.
","ka gona, ga se gore go nyakega palo ye nnya ne ya badiredi ba mmušo: seo re se hlokago ke ditirelo tša mmušo tšeo di swanelago morero wo di o diretšwego tša mabokgoni a maleba, potego ya bokgoni le boikgafo ba go hlankela batho ba gaborena.
"
"die mense in die staatsdiens moet in staat gestel word om hul rol te vervul in die strewe na ontwikkeling en die kon solidering van demokrasie.
","banna le basadi ba ditirelo tša mmušo ba swanetše go fiwa mabokgoni a go kgatha tema ya bona go tliša kgate lopele le go dira gore go rene moya wa temokrasi.
"
"dit is ons beste waarborg vir ’n bekwame staat wat die belange van sy landsburgers dien.
","ye ke kgonthišišo ya rena ye kaone kaone ya mmušo wa bokgoni wa go hlankela dikgahlegelo tša badudi.
"
"ek doen ’n beroep op julle almal om deel te neem aan die openbare konsultasie proses vir hierdie konsepraamwerk, wat op die nasionale regeringskool se webwerf beskikbaar is, en om jul stemme te laat hoor.
","ke ipiletša go lena ka moka go ba karolo ya ditshepedišo tša ditherišano ka ga tlhako ye ya seakanywa, yeo e ka hwetšagalago wepsaeteng ya nsg, le go dira gore mantšu a lena a kwagale ka go kgatha tema seakanyweng se.
"
"die staatsdiens behoort nie aan een spesifieke party nie; en dit behoort ook nie die domein van enige bepaalde belangegroep te wees nie.
","ditirelo tša mmušo ga se tša mokgatlo wo itšego wa dipo lotiki, ebile ga se tša swanela go ba tšeo di laolwago fela ke sehlopha se itšego seo se nago le kgahlego.
"
"dit behoort nie bo die wet te staan nie.
","ga se tša swanela go ikgapa di ikgoroša ka botšona.
"
"die staatsdiens behoort aan die mense van suidafrika.
","ditirelo tša mmušo ke tša batho ka moka ba afrika borwa.
"
dit moet hulle en slegs hulle dien.,"di swanetše go hola bona, bona fela."
"durbanhawe skep 'n see vir sa van geleenthede vukuzenzele unnamed ek het onlangs die durbanhawe be soek om te gaan kyk na die werk wat verrig word om die hawe meer doeltreffend en mededin gend te maak.
","boemakepe bja durban bo hlola dibaka tše dintšhi tša go thiba letšatši ka afrika borwa vukuzenzele unnamed kgauswanyane, ke etetše boemakepe bja durban go iponela ka bonna mošomo wo o dirilwego go dira gore boemakepe bo kgone go šoma gabotse gape bo be le mohola.
"
"ek het, na n inligtingsessie met transnet se senior be stuur, per sleepboot deur die hawe getoer.
","ka morago ga go bolela le bolaodibogolo bja transnet, ke sepetše le boemakepe ka seketswana sa teko, seo gantši se šomišwago go hlahla dikepe tše dikgolo mo tseleng ya ma tseno go ya go boemong.
"
"sleepbote word gewoonlik gebruik om groot skepe deur die ingangskanaal na die dokke te begelei.
","go bona mošomo wa boema kepe o le ka meetseng, motho o gopotšwa bogolo bja mošomo wo le ka fao o raraganego ka gona.
"
"met dié dat ek die bedrywig hede in en om die hawe vanaf die water kon aanskou, het ek weereens die reuse omvang en ingewikkeldheid daarvan besef.
","ge boemakepe bo sa šome gabotse, ekonomi ka moka e a amega, go tloga go barekantle le baišantle go ya go bareki.
"
"as die hawe nie doeltreffend funksioneer nie, lei die hele ekonomie daaronder — van invoerders en uitvoerders tot verbruikers.
","ka go le lengwe, ge boemake pe bo šoma gabotse bo ka dira gore ekonomi e gole gomme bja dira gore naga ya rena e be sebaka sa selete le kontinente.
"
"aan die ander kant, as die hawe doeltreffend funksioneer kan dit ekonomiese groei dryf en ons ekonomie posisioneer as n poort tot die streek en ook die kontinent.
","ge ke etetše durban ka diphalane 2019, borakgwebo ba bantši ba gae le bašomiši ba boemakepe ba tšweleditše matshwenyego go nna ka ga go šoma ga boemakepe bja durban.
"
"toe ek in oktober 2019 durban besoek het, het baie plaaslike besighede en gebruikers van die hawe hul besorgdheid oor die werksver rigting van die durbanhawe met my gedeel.
","dikhamphani tša dikepe, kudu, di tšweleditše matshwe nyego ka ga pitlagano ya dilori le dinako tša go leta, go ditelega ga go fihla ga dikepe le dinako tša boemakepe, tlhokomelo ya go fokola ya didirišwa le ka kakaretšo tšweletšo ya fase ka boemakepeng.
"
"skeepsmaatskappye, in besonder, het hul kommer uitgespreek oor verkeersop eenhopings met betrekking tot vervoertrokke en wagtye, vertragings in ankerlegging en verankering, swak in standhouding van toerusting en algemene lae produktiwiteit in die hawe.
","ge ke be ke etetše boemakepe bjo kgauswanyane ke be ke eya go lekola ge e le gore maikgafo ao a dirilwego go matshwe nyego a a phethagaditšwe.
"
"my onlangse besoek aan die hawe was om te gaan kyk of die verbintenisse wat na aanleiding van dié kwessies aangegaan is, wel geïmple menteer is.
","ka nnete go bile le tšwelopele ye kgolo mo ngwageng wa go feta ka go fetoša go šoma ga boemakepe, le ge go na le khuetšo ya covid19 .
"
"daar is werklik oor die afge lope jaar groot vordering ge maak om die werksverrigting van die hawe om te swaai, ten spyte van kovid19 se impak.
","maitapišo a a šetše a bontšha dipoelo go tlhokomelo ye e kaonafetšego ya didirišwa, pitlagano yeo e fokotšegilego, dinako tša go dira dilo tša lebe lo le tšhomišo ye e oketšegilego ya diporo go na le dinamela tša tseleng.
"
"dié harde werk toon reeds resultate in die verbeterde in standhouding van toerusting, verminderde verkeersopeen hopings, korter omkeertye en meer gebruik van spoorver voer eerder as padvervoer.
","le ge se e le tšwelopele ye bohlokwa, go sa na le mošomo wo montši woo o swanetšwego go dirwa go bea durban mae mong a go ba boemakepe bja maemo a godimo le bjalo ka boemakepe bja hapo ya he misfere ya borwa.
"
"dié vordering is belangrik, maar daar is nog baie werk wat gedoen sal moet word om durban as n wêreldklashawe en middelpunt in die suidelike halfrond te posisioneer.
","mo mengwageng ya kgau swanyane, boemakepe bo tlogile maemong a bjona a go ba bja mathomo ka afrika go ba bja boraro, ka morago ga tangier ka morocco le boema kepe bja said ka egepeta.
"
"die hawe het oor die afge lope paar jaar van sy posisie as die nommer een hawe in afrika tot nommer drie gedaal; na tangier in morokko en port said in egipte.
","dinako tša go fihla ga dilori e kaonafetše kudu.
"
"omkeertye in trokvervoer het reuse vordering getoon.
","gape, go tshepagala ga go šogana le morwalo go kaonafetše go ya go 80% gomme go lebile go 95% go fihlelela maemo a boditšhabatšhaba.
"
"so ook het die betroubaarheid van skeepsladingtoerusting tot 80% verbeter en is dit vinnig oppad na minstens 95% om internasionale standaarde te haal.
","dinako tša go leta ga dikepe di fokotšegile go magato a go makatša.
"
"skeepswagtye het tot in drukwekkende vlakke gedaal.
","dipalopalo tše di ka bo nala e le tša botsebi le go se kwešišagale, eupša di na le khuetšo ya thwii mo kgolong ya ekonomi le go ditefo tšeo re di lefago bjalo ka bareki.
"
"dié statistieke mag dalk teg nies en duister voorkom, maar dit het n direkte invloed op ons ekonomiese groei en op die pryse wat ons as verbruikers betaal.
","re dirile gore go kaonafatša go šoma gabotse ga maemake pe a rena e be selo se bohlokwa sa operation vulindlela go mme re nepišitše go ageng lefsa transnet, yeo e lego ye nngwe ya dikgwebo tša mmušo tše bohlokwa.
"
"ons het die verbetering van die doeltreffendheid van ons hawens as deel van operasie vulindlela n prioriteit gemaak en fokus daarop om trans net, een van ons waardevolle staatsbeheerde onderne mings, te herbou.
","ba taolo ye mpsha ya transnet le dikarolo tša yona tša go šoma ba nepiša ka maikemišetšo a go fetoša go šoma ga boemakepe.
"
"transnet se nuwe bestuur en hul bedryfsafdelings is spits gefokus op die omkeer van die hawe se werksverrigting.
","ba taolo ba na le maano a go hlohleletša gape a go kgahliša a go atološa mafelo ka moka a mahlano a boemakepe.
"
"die bestuur het ambisieuse en opwindende planne vir die uitbreiding vir al vyf van die hawe se pole.
","wona a akaretša go katološa tsela ya maydown wharf go dumelela dikepe tša sebjale bjale tše dikgolo go tsena ka boemakepeng, go tswalela pier 1 le pier 2 go hlola bokgoni bja tlaleletšo bja ditšhelo le kaonafatšo ya lefelo la setšhelo le lefsa ka point precinct.
"
"dit sluit in die verdieping van die maydonkaai om groter, meer moderne skepe in staat te stel om die hawe binne te vaar, die invulling van pier 1 en pier 2 om ekstra kapasiteit te skep vir houers, en die ontwikkeling van n nuwe hou erterminaal in die pointpool.
","ka moka, katološo ya infrastraktšha mo boemake peng bjo e tla nyaka dipeeletšo tše dimpsha tša go dira r100 bilione mo mengwageng ye mesome le ya go feta ye e tlago.
"
"die uitbreiding van die hawe sal altesaam r100 miljard in nuwe beleggings oor die volgende dekade en langer benodig.
","se se tla fetoša boemakepe go felelela, ya katološa bokgo ni bja bjona bja go šogana le setšhelo go tloga go diyuniti tše 2.9 milione go ya go diyuniti tše 11 milione.
"
"dit gaan die hawe heeltemal van gedaante laat verwissel en sy kapasiteit vir die hantering van skeepshou ers verhoog van 2.9 miljoen eenhede tot meer as 11 mil joen eenhede.
","maano a a go hlohleletša a tla nyaka gore lekala la praebete le kgathe tema ya go bonala le ya dipeeletšo.
"
"dié ambisieuse planne gaan groter deelname en belegging van die privaatsektor vereis.
","transnet, go akaretša boema kepe bja durban, ke thoto ye bohlokwa ya setšhaba yeo e lego ya batho ba afrika borwa.
"
"transnet, waaronder die durbanhawe, is n belangrike nasionale bate wat aan die mense van suidafrika be hoort.
","ditirišano le lekala la prae bete di bohlokwa go tliša peeletšo ye mpsha, theknolotši le bokgoni go tshepedišo ya boemakepe le go mpshafatša didirišwa le infrastraktšha.
"
"vennootskappe met die pri vaatsektor is noodsaaklik om nuwe beleggings, tegnologie en kundigheid tot hawebedry wighede by te dra en om die toerusting en infrastruktuur te moderniseer.
","transnet e beakanya, mohla la, go kwalakwatša kgwebo moragonyana ngwaga wo go aga le go sepetša lefelo la boemakepe le lefsa.
"
"transnet beplan byvoorbeeld om later vanjaar n konsessie te adverteer om die nuwe pointterminaal te bou en te bestuur.
","se se tla tliša peeletšo ya praebete le go kaonafatša bokgoni bja go šogana le setšhelo.
"
"dit sal privaatbeleg gings lok en die doeltreffend heid van die hantering van skeepshouers verbeter.
","ka tshepetšo ya rena re kaonafatša ka go latelana bokgoni bja maemakepe a rena le diporo gomme ba utolla peeletšo ye kgolo ka infrastraktšha.
"
"ons is, deur middel van ons herbouproses, besig om stel selmatig die doeltreffendheid van ons hawens en spoorweë te verbeter en reuse belegging in infrastruktuur te ontsluit.
","se se ka se fokotše fela ditshenyagelo le go kaonafatša bokgoni bja maemakepe a rena, eupša se tla hlola mešomo ye mefsa mo tshepetšong.
"
"dit sal nie net kostes verlaag en die mededingendheid van ons uitvoere verbeter nie, maar ook in die proses duisende werksgeleenthede skep.
","ka bobedi dikaonafatšo tša tshepedišo le phetošo ya sebo pego, boemakepe bja durban bo tla boela maemong a bjona a go ba boemakepe bja go šoma gabotse go feta ka moka mo afrika.
"
"durbanhawe sal, danksy bedryfsverbeteringe en struk tuurhervorming, weer sy plek as die toppresterende hawe in afrika kan inneem.
","bjalo ka ge e le karolo ya leano la rena la kagolefsa le mpshafatšo ya ekonomi, re tla tšwela pele go šoma ka maatla go oketša dipeeletšo mo infrastraktšheng le go fetoša intasteri ya rena ya manane.
"
"ons sal, as deel van ons herbouen herstelplan, voort gaan om onvermoeid te werk om ons infrastruktuur uit te brei en ons netwerkbedryfsektore te hervorm.
","ge leeto la ka durban le tlogetše selo se tee mona ganong wa ka, ke ka moo maafrika borwa ba kgonago go atlega diprotšekeng tše bohlokwa kudu le tše dikgolo.
"
"as my besoek aan durban my een ding laat besef het, is dit dat ons as suidafrikaners in staat is om projekte van reu se belang en skaal suksesvol uit te voer.
","maikemišetšo a rena a swanetše go sepelelana le bo golo bja ditlhohlo tše re nago le tšona.
"
"ons ambisies behoort die hoogtes van ons uitdagings te ewenaar.
","ka tšwelopele yeo re e di rago mo boemakepeng bja durban, ka mabokgoni ao a matlafaditšwego le mabokgoni ao re nago le wona ka go trans net, bjale re tseleng ya maleba.
"
"met die vordering wat ons by durbanhawe maak, met die heropgewekte vaardighede en vermoëns wat ons in transnet sien, het ons nou die wind van agter en ons vaar met gebolde seile na ons bestemming .",gomme re sepela ka lebelo go fihla moo re yago gona.
