nbl,sep
"kungavikelwa bunjani ukuba sidisi kwelutjha vukuzenzele unnamed kuneendlela ezi hlukileko zoku vikela ukuba sidisi kwamatlawana, ezifaka hlangana ukukhetha ukungayi emse meni ukufikela lapho wenda khona namkha nasele ukulungele ukuba nabentwana.
","ka fao o ka thibelago go ima ga batšwamahlalading vukuzenzele unnamed go nale mekgwa ya go fapafapana ya go thibela go ima ga batšwamahlalagad ing, mekgwa yeo e akaretša go ikgethela go se tsenele thobalano go fihlela o nyetšwe goba ge o itokišeditše go ba le bana.
"
"abanye abantu badlumbana bona ukuzithiba (ukukhetha ukungayi emsemeni ukufikela lapho benda khona) kusikade, kantike abanye bayakwenyula njengendlela engcono etjengisa ukuziphatha kuhle.
","batho ba bangwe ba na gana gore go ikilela (go ikgethela go se tsenele thobalano go fihlela ge o nyetšwe) ke dilo tša kgale, mola ba bangwe ba bona e le botho go dira bjalo.
"
"nanyana kunjalo, kufuze amatlawana azithathele isiquntweso ngokwawo.
","go le bjalo, batšwamahlalading ba swanetše go itšeela diphetho.
"
"abantu abanengi abafuni ukulinda ukungena emtjhadweni ngaphambi kokuya emsemeni.
","batho ba bantši ga ba nyake go leta go fihlela ge ba nyalwa pele ba ka tsenela thobalano.
"
"abafuni godu ukurhabela izinto ngalokhoke bagcine sebenze iimphoso ezikulu.
","ebile ga ba nyake go phakiša go dira dilo le go dira diphošo tše kgolo.
"
"kanengi vane baqunte ngokuriyadisa ukuya emsemeni bebabe bakhulu, bakghone ukuziphendulela, babe nobudlelwano bezethando obunzinzileko nomlingani munye begodu nasele basebenza, kuyinto engcono khulu.
","gantši ba tšea sephetho sa gore go diegiša go tsenela tša thobalano go fihlela ge e le ba bagolo, ba nale maikarabelo, ba le ka gare ga dikamano tša go se tekateke mo ba ratanago le motho wo tee ebile ba šoma ke kgetho ye kaonekaone ye ba ka e letelago.
"
"nawukhetha ukuzithiba namkha ukuriyadisa ukuya emsemeni, kunezinye izinto ongazenza ukuzivikela: khetha ngokuyelela aba ntu ofuna babe bangani bakho.
","ge o ikgethela go ikilela goba go diega go tsenela thobalano, go nale dilo tšeo o ka di dirago go itšhireletša: kgetha bagwera ba gago ka šedi ye kgolo.
"
"kufuze abangani bakufisele okuhle ngaso soke isikhathi begodu kufuze bahloniphe isiqunto sakho sokungayi emsemeni.
","ba gwera ba mmakgonthe ba swanetše go go ratela dilo tše botse ebile ba swanetše go hlompha sephetho sa gago sa go se tsenele thobalano.
"
"yelela ubujamo obungaba ngobungakaphephi, nje ngabangani abaselako namkha abasebenzisa iindakamizwa, oku ngadosela ekutheni uye emsemeni ngendlela engakaphephi.
","hlokomela maemo ao a ka dirago gore o ikwe o sa bolokega, go swana le bagwera ba go nwa goba ba go diriša diokobatši, tšeo di ka dirago gore o feletše o tsenetše thobalano ya go se bolokege.
"
"khambela kude nomli ngani okukatelela bona ukuya naye emsemeni ku sitjengiso sethando lakho.
","hlokomela balekani bao ba o botšago gore o swanetše go robala le bona ge o ba rata.
"
"lalela bewufunde kilabo ababasidisi basese matlawana.
","theeletša le go ithuta go bao ba ilego ba ima e le batšwamahlagading gore ba fetile bjang.
"
"bayazazi iimphoso zabo neenkhisi abarhohlomela kizo.
","ba tseba diphošo tša gona le ditlamo rago tše mpe.
"
"lalela ababelethi bakho begodu ufunde emlandweni wamaphilo wabo nabasakhulako.
","theleetša le go ithuta go tšwa batswading ba gago ka maitemogelo a bona a bophelo.
"
"nawuqunta bonyana ukuzithiba nokuriyadisa ukuya emsemeni akusizo iinqunto ezikufaneleko nezingcono begodu awufuni ukulinda, zinikele isikhathi ufunde ngokuzivikela, okufaka hlangana iinkhandelambeleko, okukusebenzisa indlelathize (isikhandelambeleko esifakwa hlangana neqanda nembewu, ipilisi nofana ikhondomu) ukuvikela ukuba sidisi.
","ge o tšea sephetho sa gore go ikilela le go diega go tsenela thobalano ga se diphetho tše kaone tšeo di go loketšego wa ikgethela gore o ka se kgone go ema, tšea nako go ithuta ka fao o ka itšhireletšago ka gona, go akaretšwa le dithibelapelegi, e lego go šomiša mokgwa (wa setlwaedi goba wa dikhemikhale) go thibela go ima.
"
"kuneenkhandelambeleko ezisebenza ngeendlela ezihlukileko, kodwana zoke zenzelwe ukuvikela imbeleko.
","go nale dithibelapelegi tša go šoma ka ditsela tša go fapafapana, eupša ka moka di diretšwe go thibela go ima.
"
"zifaka hlangana isivikelambeleko esiselwako, esaziwa ngokuthi ‘lipilisi’, isikhandelambeleko esimjovo namakhondomu wabantu bembaji newebengubo.
","tšona di akaretša dithibelapelegi tše ka tšewago go swana le dipilisi; dithibelapelegi tša go hlabelwa; le dikhontomo tša banna le tša basadi.
"
"khuyini engingakwenza nasele ngisidisi?
","nka dira eng ge ke imile?
"
"nawusola bonyana usidisi, khamba nomuntu omthembako emtholapilo oseduze uyokuhlolelwa ukuba sidisi.
","ge o gonona gore o kaba o imile, sepela le motho yo o mo tshephago go ya kiliniking ya kgauswi gore o dirwe diteko tša go ima.
"
"itjhejo lomuntu osidisi (ukutlhogonyelwa komntwana ongakabukubelethwa) kuqakathekile begodu kuthoma ngeveke yobunane.
","tlhokomelo ya baimana (go hlokomela masea ao a sa lego ka dipopelong tša bommagobona) e bohlokwa ebile ka setlwaedi e thoma ka dibeke tše seswai.
"
"umtholapilo wangekhenu ungakusiza ngetjhejo lomuntu osidisi begodu umsebenzi wezamaphilo uzokusiza ukutlama ihlelo elivumelana nawe nomntanakho.
","kliniki ya kgauswi le wena e ka go thuša ka tlhokomelo ya baimana ebile mošomedi wa tlhokomelo ya maphelo o tla go thuša go hlama thulaganyo yeo e loketšego wena le lesea la gago.
"
"nawusidisi, kuqakathekile ukugoma imivango enezakhamzimba, ukuthabulula umzimba, ukulala ngokwaneleko nokuzila iindakamizwa notjwala.
","ge o imile, go bohlokwa gore o je dijo tše loketšego mmele tša phepo, o itšhidulle, o robale nako ye lekanego le go efoga diokobatši le madila.
"
"*ilwazeli ulilethelwa mnyango wezamaphilo wakwazulu natala.
","*tshedimošo ye le e tlišetšwa ke kgoro ya maphelo ya kwazulunatal.
"
"ukuba sidisi lokha nawusese litlawana kuzokuba nomthelela omumbi epilweni yakho yoke, nokho zikhona iindlela zokobana uvikele ukuba sidisi okungakahlelwa.","go ima ge o le motšwamahlagading go tla ama bophelo ba gago ka moka, eupša go nale mekgwa yeo o ka e latelago gore o seke wa ima o sa ipeakanyetša."
