"u ya nga vha tshigwada tsha zwa mutsiko na mbila helo tsha afrika tshipembe (sadag), hu na zwiwo zwa u ḓivhulaha zwa 23 na mivhingo ya 230 ya vhane vha lingedza u ḓivhulaha afrika tshipembe kha ḓuvha nga ḓuvha.
","lo mbutho ujolise ekuthinteleni ukuzibulala kunye neendlela zokuzibulala, kwaye ukwajolisa nasekunciphiseni iziphumo zokuzibulala, kananjalo ubonelela ngeqonga kwizi fundiswa, kwiingcali zempilo yengqondo, kubasebenzi bakaxakeka, kumavolontiya kunye nakwabo basinde ekuzibulaleni.
"
"""u ḓivhulaha zwi kha ḓi vha maṱudzi a ofhisaho kha tshitshavha tshashu – a hu na muthu na muthihi ane a ṱoḓa u amba nga hazwo; a hu na ane a ḓivha uri a nga zwi amba hani nahone vhabebi a vha ṱoḓi u amba nga ha zwo na vhana vhavho nga uri ḽiṅwe ḓuvha vha nga vha vha tshi khou ‘sima mihumbulo’.
","ngokweqela labantu abano xinzelelo ngokomphefumlo lomzantsi afrika (isadag), umzantsi afrika ubhala abantu abangama23 yabo bazibuleleyo kunye nama230 yabantu abazama ukuzibulala mihla le.
"
"fhedziha, ndi zwithu zwine zwa khou itea, zwine zwa vhonala nga tshivhalo tshine tsha khou engedzea tsha ṱhingo dzine ra dzi ṱanganedza nga ḓuvha,"" vho ralo vho cassey chambers, mulanguli wa mashumele a sadag.
","""ukuzibulala kusengumba ongafuni kuphathwa luluntu akukho mntu ufuna ukuthetha ngako; akukho mntu waziyo indlela yokuthetha ngako kwaye abazali abafuni kuthetha nabantwana babo ngako hleze kanti 'ityale iimbono'.
"
"""arali vhathu vhanzhi vha ḓivha nga ha u ḓivhulaha na u ḓivha uri vha nga wana hani thuso ya u thusa muthu nga u ṱavhanya, ri nga thusa u fhungudza tshivhalo tsha zwiito zwa u ḓivhulaha,"" vho ralo.
","nangona kunjalo, ukuzibulala kukhona kwaye kuyenzeka, oku kuno kubonwa ngenani leefowuni esizifumanayo elonyuka mihla le, utshilo ucassey chambers, ongumlawuli wezokusebenza wesadag.
"
"zwiga zwine ra nga vhona ngazwo muhumbulo wa u ṱoḓa u ḓivhulaha zwi katela zwi tevhelaho:l u amba nga ha u fhelisa vhutshilo hau, u lovha kana u ḓivhulaha.
","uthi, ""ukuba abantu abaninzi bayaqonda ngokuzibulala kwaye bayayazi indlela yokufumanela umntu uncedo kusengethuba, oku kunonceda ukunciphisa izinga lokuzibulala,""iimpawu ezisisilumkiso ezinokubakho xa umntu ezakuzibulala:l ukuthetha ngokutshabala lisa ubomi bakhe, ngokufa okanye ngokuzibulala.
"
"l u vha na lutamo luhulwane lwa u lovha kana u humbula nga lufu kana nga u fa.
","l umnqweno obalaseleyo wokufa okanye ukuzixa kekisa kakhulu ngokufa nokufa.
"
"l u kovhela vhathu thundu dza u ḓura.
","l ukuphisa ngezinto ezixabisekileyo.
"
"l zwiga zwa mutsiko, u fana na mamudi, u laṱa fulufhelo, u ḓikokodzela murahu, u sa vha na dzangalelo ḽa zwiḽiwa na u sa eḓela, khathihi na u sa vha na dzangalelo ḽa u shuma mishumo ya nga misi.
","l iimpawu zoxinzelelo, ezinje ngokungatyhileki, ukungabi nathemba, ukurhoxa, ukungabinamdla wokutya kunye nokulala nzima, nokuphelelwa ngumdla kwimisebenzi yesiqhelo.
"
"l u engedzea ha tshumiso ya zwikambi kana zwidzidzivhadzi.
","lukwanda kokusela utywala okanye ukusebenzisa iziyobisi.
"
"l u swaswara fhungo ḽa u sa vha hone kha ḽa matshelo kana u amba luambo lwa u onesa.
","l ukuthetha ngokungabikho kwixesha elizayo okanye avalelise.
"
"l tshanduko khulwane kha vhuḓifari.
","lutshintsho olukhulu kwindlela yokuziphatha.
"
"l u ita ndugiselo dza u khu nyeledza zwithu zwi songo fhelaho.
","l ukwenza amalungi selelo okugqibezela izinto azishiye esithubeni.
"
"arali vhone kana muṅwe ane vha mu ḓivha a tshi khou ṱoḓa thuso, kha vha founele nomboro ya thuso ya zwiwo zwa u ḓivhulaha ine ya shuma tshifhinga tshoṱhe ya sadag ya 0800 567 567.","ukuba wena okanye umntu omaziyo ufuna uncedo, tsalela umnxeba isadag kule nombolo0800 567 567 esebenza imini nobusuku."
" vha thanyele vhatshinyi vha zwa vhudzekani phanḓa ha u thola vhashumi vha u ṱhogomela vhana na avho vha re na vhuholefhali ha ngelekanyo.
","lumkelani abophulimthetho ngezesondo sphelele ngubane qala ujonge irejista yesizwe yabaphulimthetho ngokwesondo phambi kokuba uqeshe umntu ozakonasa abantwana okanye abo bakhubazeke ngokwasengqondweni.
"
"sphelele ngubane kha vha ṱole ridzhisiṱara ya lushaka ya vhatshinyi vha zwa vhudzekani phanḓa ha u thola vhashumi vha u ṱhogomela vhana na avho vha re na vhuholefhali ha ngelekanyo.
","ukuba ungumntu oqhuba iziko lophuhliso lwabantwana abaselula, ungomnye wabantu abanyanzelwa ngumthetho ukuba bajonge abaqeshwa babo abakho na kwirejista yesizwe yabaphulimthetho ngokwesondo (inrso).
"
"arali vha mutholi ane a tshimbidza senthara ya mveledziso ya nyaluwo ya ṅwa na vhuhanani, vha muṅwe wa vhathu vhane nga mulayo vha tea u sedzulusa arali vhashumi vhavho vha kha ridzhisiṱara ya lushaka ya vhatshinyi vha zwa vhudzekani (nrso).
","inrso iphantsi kwesebe lezobulungisa nophuhliso lomgaqosiseko kwaye abaqeshi kufuneka baqhagamshelane neli sebe ukuze bajonge abo bazakubaqesha ukuba aba bhaliswanga na kolu luhlu.
"
"nrso i wela nga fhasi ha muhasho wa zwa vhulamukanyi na mveledziso ya ndayotewa nahone vhatholi vha tea u sedza arali vhathu vhane vha khou ṱoḓa u vha thola vha kha mutevhe.
","umqeshi ukwabandakanya umzali ofuna ukuqesha umntu oncedisa endlini, umntu ozakuba lilungu lebhodi elawula isikolo okanye esibhedlele.
"
"mutholi u dovha a katela mubebi ane a khou ṱoḓa u thola muthusi wa nḓuni, kha khorombusi ya tshikolo kana vhuongeloni.
","inrso yasekwa ngokomthetho wepalamente ngonyaka ka2007.
"
"nrso yo thomiwa nga mulayo wa phalamennde nga 2007. ndi rekhodo ya madzina a avho vho wanalaho vhe na milandu ya vhutshinyi ha zwa vhudzekani kha vhana na vhathu vha re na vhuhole fhali ha ngelekanyo.
","ngamagama wabo bafunyenwe benetyala lolwaphulomthetho ngo kwesondo kubantwana nakubantu abakhubazeke ngokwasengqondweni abadweliswe kolu luhlu.
"
"vho ntombizodwa matjila, muṅwalisi wa nrso, vha ri ridzhisiṱara i na madzina a vhatshinyi vha vhanna na vha vhafumakadzi.
","untombizodwa matjila, umbhalisi wenrso, uthi le rejista inamagama abophulimthetho angama doda nababhinqileyo.
"
"vhathu avha ndi vho itaho vhutshinyi kha vhana na vhathu vha re na vhuholefhali ha ngelekanyo vhu fanaho na; u ita zwa vhudzekani kana u binya ṅwana; u kombetshedza kana u ita uri vhana vha lavhelese zwi ito zwa vhutshinyi ha zwa vhudzekani, nyito dza zwa vhudzekani; u fhura ṅwana u itela u ita zwa vhudzekani nae; u ḓiḓowedza na ṅwana u itela u ita zwa vhudzekani nae; u ṱana kana u vhonisa phonogirafi ya vhana (zwifanyiso na vidio zwa vhana vha songo ambaraho kana vha tshi khou binyiwa) kha vhana kana vhathu vha re na vhuholefhali ha ngelekanyo na u shumisa vhana kana vhathu vha re na vhuholefhali ha ngelekanyo u itela bveledza phonogirafi.
","aba ngabantu abenze ubugwenxa kubantwana kunye nabo bakhubazeke ngokwasengqondweni, ubugwenxa obufana noku; ukwabelana ngesondo nomntwana omncinci; ukunyanzelisa okanye ukwenza abantwana bangqine ulwaphulomthetho ngokwesondo; ukwenzisa isondo; ukuxhaphaza ngokwesondo; ukunyoba umntwana ngenjongo yokumhluku meza ngokwesondo; ukuvezwa okanye ukuboniswa kwemifanekiso yamanyala yabantwana kubantwana okanye kubantu abakhubazeke ngo kwasengqondweni; kunye nokusebenzisa abantwana okanye abantu abakhubazeke ngokwasengqondweni ngeenjongo zokuthatha imifanekiso yamanyala.
"
"""arali mutholi a wana uri dzina ḽa mutholiwa ḽi hone kha ridzhisiṱara, mutholi u tea u pfulusa mutholiwa onoyo a ya kha muṅwe mushumo une wa sa ḓo ita uri a vhe na vhukwamani na ṅwana kana mualuwa a re na vhuholefhali ha ngelekanyo"" vha no ralo ndi vho matjila.
","""ukuba umqeshi ufumanise ukuba igama lomsebenzi wakhe liyavela kwirejista, umqeshi kufuneka amsuse loo msebenzi amse kwe sinye isikhundla esingazi kumdibanisa nomntwana okanye nomntu omdala okhubazekileyo ngokwa sengqondweni,"" utsho umatjila.
"
"arali mutholi a sa koni u pfulusa mutholiwa u ya kha muṅwe mushumo, vha tea u fhelisa khonṱhiraka yawe ya mushumo.
","ukuba umqeshi akakwazi kumsusa umqeshwa amse kwesinye isikhundla, kufu neka asiphelise isivumelwano sakhe sengqesho.
"
"mafhungo a re kha nrso a katela; madzina nga vhuḓalo na zwifani na madzina a miswaswo, phurofesheni kana mushumo zwa vhatshinyi; ḓiresi ya vhudzulo i ḓivheaho, zwidodombedzwa zwa vhukwamani, hu tshi katelwa ḓiresi ya poswo ya mutshinyi; nomboro dza bugundaula (id) kana phasipoto dza vhatshinyi; lushaka lwa vhutshinyi ha zwa vhudzekani.
","ulwazi oluqulethwe kwinrso lubandakanya; amagama apheleleyo kunye nefani yomaphulimthetho, isiteke tiso kunye nomsebenzi wakhe; idilesi yendawo eya ziwayo yomaphulimthetho, kunye nazo naziphi na iinkcukacha zoqhagamshelwano, kuquka nedilesi yeposi; inombolo yesazisi yomaphulimthetho okanye yencwadana yokundwendwela; uhlobo lolwaphulomthetho ngokwesondo.
"
"ridzhisiṱara a i vhoniwi nga nnyi na nnyi.
","irejista ayivulelwa uwonkewonke.
"
"i nga ṱolwa fhedzi nga vhatholi u itela u wana ṱhanziela dza khwaṱhisedzo dza avho vhane madzina avho a khou sedzuluswa.
","inokuboniswa kuphela abaqeshi ukuze bafumane isatifikethi esi bonakalisa ukuba loo magama ajongiweyo awa chaphazeleki kulwaphulomthetho.
"
ndi mulandu u bvisela kha gala vhathuni mafhungo a re kha ridzhisiṱara.,kululwaphulomthetho ukuchazela nabani na ongomnye iinkcukacha eziqulethwe kwirejista.
"zwiito zwa khakhathi dzo ḓisendekaho nga mbeu (gbv) a zwi ṱanganedzwi na luthihi vukuzenzele unnamed arali vhuvha ha lushaka hu tshi nga haṱulwa nga nḓila ine lwa fara vhafumakadzi na vhana ngayo, zwi amba uri ri khou kundelwa tshoṱhe.
","asikho isizathu segbv vukuzenzele unnamed ukuba iinkolelo okanye iimbono ekwabelwana ngazo zesizwe zinokugwe tywa ngendlela esibaphatha ngayo abasetyini kunye nabantwana, ngoko ke siyasilela ukufikelela koko kujoliswe kuko.
"
"mbalombalo dza zwa vhugevhenga dza zwinozwino dzo bvisiwaho nga tshumelo ya tshipholisa tsha afrika tshipembe (saps) i sumbedza u engedzea ha u tshipiwa, khakhathi dza miṱani, na, khamusi zwine zwa khou tou vhilaedzisa vhukuma ndi mabulayo a vhana.
","iinkcukachamanani zamva nje zolwaphulomthetho ezikhutshwe yinkonzo yamapolisa yasemzantsi afrika (isaps) zibonisa ukwanda kodlwengulo, ubundlobongela basekhaya, kwaye, mhlawumbi ezixha labisa kakhulu, ekubulaweni kwabantwana.
"
"vhukati ha fulwana na khubvumedzi 2021 vhathu vha 9 556 vhane vhunzhi havho vho vha vhe vhafumakadzi, vho tzhipiwaho.
","phakathi kweyekhala kunye neyomsintsi wama2021, abantu abangama9 556, uninzi lwabo ababengabasetyhini, badlwengulwa.
"
"hezwi zwo gonya nga 7% u fhira muvhigo wa tshifhinga tsho fhiraho.
","oku kungaphezulu nge7% kunexesha lokunikezelwa kwengxelo yangaphambili.
"
"kha milandu ya u vhaisa ya 73 000 yo vhigiwaho nga tshifhinga hetshi, i fhiraho 13 000 yo vha i elanaho na khakhathi dza miṱani.
","kumatyala okubetha aphantse abe ngama73 000 axeliweyo ngeli xesha, ngaphezulu kwama13 000 ayenxulumene nobundlobongela basekhaya.
"
"tshivhalo tsha mabulayo a vhana tsho gonya lu ṱoḓaho u swika kha tshararu musi hu tshi vhambedzwa na muvhigo wa tshifhinga tsho fhiraho.
","izinga lokubulawa kwabantwana linyuke phantse ngesinye kwisithathu xa kuthelekiswa nexesha lokunikezelwa kwengxelo yangaphambili.
"
"ro zwi amba u thomani uri khakhathi dzi vhangwaho nga vhanna kha vhafumakadzi ndi dwadze ḽa vhuvhili ḽine shango ḽashu ḽa khou tea u lwa naḽo na uri u fana na dwadze covid19 ri nga ḽi kunda arali ri khou shumisana roṱhe.
","besitshilo ngaphambili ukuba ubundlobongela obenziwa ngamadoda kubafazi ngubhubhane wesibini ekufuneka ilizwe lethu lijongane naye, kwaye njengobhubhane wecovid19 sinokuboyiswa ukuba sonke sisebenza kunye.
"
"sa muvhuso ri na mushumo na vhuḓifhinduleli kha u ḓiṋekedzela kha u ṋea zwiko zwo teaho zwa u lwa na khakhathi dzo ḓisendekaho nga mbeu.
","njengorhulumente, sinomsebenzi kunye noxanduva lokunikezela ngezixhobo eziyimfuneko ukulwa ulwaphulomthetho lwegbv.
"
"u bva tshe ha rwelwa ṱari pulane ya maano a vhuṱali ya lushaka ya u lwa na khakhathi dzo ḓisendekaho nga mbeu na mabulayo a vhatshi sadzini (nsp) nga 2020, ho no vha na thusedzo dzo vhalaho dza u lwa na gbv.
","ukusukela oko kwasungulwa isicwangcisoqhinga sesizwe sokulwa ubundlobongela obusekelwe kwisini kunye nokubulawa kwabasetyhini (insp) ngowama2020, kuye kwakho amangenelelo amaninzi okuphendula kwigbv.
"
"hezwi zwi katela mvusuludzo ya vhusimamilayo yo ṱanḓavhuwaho, thikhedzo kha zwipondwa ya ṋetshedzo ya khithi ya u kuvhanganya vhuṱanzi zwiṱitshini zwa mapholisa na tshumelo dzi thusaho muhumbulo na matshilisano, u thomiwa ha tshikwama tsha gbvf na u tikedza netiweke ya senthara dza ndondolo dza thuthuzela na khuseleka.
","oku kuquka uhlaziyo lwemithetho oluneziphumo ezibalulekileyo, inkxaso kumaxhoba ngokubonelela ngezixhobo zobungqina kwizikhululo zamapolisa kunye neenkonzo zentlalontle yengqondo, ukusekwa kwengxowamali yegbvf kunye nokuxhasa uthungelwano lwamaziko ethuthuzela kunye ne khuseleka.
"
"saps yo sumbedza uri ri khou vha na mvelaphanḓa kha u fhungudza mushumo munzhi wo salelaho murahu wa tsedzuluso dza dna, une wa vha wa ndeme kha u wana vhulamukanyi ha zwipondwa zwa vhugevhenga ha zwa vhudzekani.
","isaps ibonise ukuba senza inkqubela ekunciphiseni imisebenzi engekenziwa ebonakalayo kuhlalutyo lwedna, nto leyo ebalu lekileyo ekuqinisekiseni ubulungisa kumaxhoba olwaphulomthetho ngo kwesondo.
"
"saps i dovha ya shuma kha ofisi dza 134 dza gbv kha zwiṱitshi zwa mapholisa u mona na shango nga vhuphara nahone vha kati na u thoma dziṅwe nnzhi.
","isaps ikwasebenzisa iidesika zegbv ezili134 kwizikhululo zamapolisa kwilizwe jikelele kwaye ikwinkqubo yokuseka ezinye.
"
"khakhathi dzo ḓisendekaho nga mbeu ndi thaidzo ya khakhathi dzi itwaho nga vhanna.
","igbv yingxaki yobundlobongela bamadoda.
"
"ndi vhanna vhane vha vha vhatzhipi.
","ubukhulu becala ngamadoda abangabadlwenguli.
"
"hu anzela u vha vhanna vha itaho khakhathi dza miṱani.
","ikakhulu ngamadoda angabenzi bobubi bobundlobongela basekhaya.
"
"ngauri vhanna ndi vhone vhane vha vha vhatshinyi vhahulwane, ndi vhone vhane vha tea u ranga phanḓa kha u amba na u vhiga khakhathi dzo ḓisendekaho nga mbeu, u tshimbidza fulo ḽa tsivhudzo, u funza vhanna ngavho na kha ndingedzo dza thivhelo.
","kuba ingamadoda angabenzi bobubi abaphambili, kufuneka ukuba ibe ngamadoda akhokelayo ekuthetheni phandle nasekuxeleni igbv, ekwaziseni abantu, ekufundiseni koontanga nakwinzame zokuthintela.
"
"hu tea u vha vhanna vha re kha vhuimo ha ndangulo kha sisiṱeme dza zwa pfunzo, hu nga vha ṱhoho dza tshikolo, vhadededzi kana maḽekitshara vhane vha tea u ita uri zwikolo na fhethu ha ngudo dza nṱha hu vhe fhethu ho tsireledzeaho kha vhagudiswa na matshudeni vha tshisadzini, na kha uri vha songo vhuya vha shumisa vhuimo havho nga nḓila i yone u itela uri vha badelwe nga vhudzekani.
","kufuneka ibe ngamadoda akwizikhundla zamagunya akwinkqubo yethu yezemfundo, nokuba ziinqununu zezikolo, abafundisintsapho okanye abahlohli, abafanele ukuba benze izikolo kunye neendawo zemfundo ephakamileyo zibe ziindawo ezikhuselekileyo zabantwana besikolo ababhinqileyo kunye nabafundi, kwaye bangaze kwakhona basebenzise kakubi isikhundla sabo segunya ukufuna ukwabelana ngokwesondo.
"
"vhanna vha khou tea u dovha vha dzhia vhuimo ha u ṱuṱuwedza na u vha tsini na miṱa yavho, nga maanḓa nga u alusa vhatuka vhavho nga nḓila i sumbedzaho vhunna havhuḓi vhu ṱhonifhaho vhafu makadzi na vhana.
","amadoda nawo kufuneka adlale indima eyakhayo nekhoyo nangakumbi kwiintsapho zawo, ingakumbi ekukhuliseni oonyana babo ukuze babonise ubudoda obusempilweni, obuqinisekileyo nobunentlonipho kwabasetyhini nasebantwaneni.
"
"zwitshavha na madzangano a tshitshavha vha khou tea u shuma na muvhuso kha mathomo a mushumo wa thu sedzo u ṱalusaho nga huswa vhunna u itela uri ri kone u alusa vhanna vha pfelaho vhuṱungu, vha konḓelelaho na u ṱhonifha.
","uluntu kunye nemibutho yasekuhlaleni kufuneka basebenzisane norhulumente ukuphumeza amangenelelo achaza ngokutsha ubudoda ukuze sikhulise amadoda ngovelwano, unyamezelo kunye nentlonipho.
"
"sa musi u fhelisa khakhathi dzo ḓisendekaho nga mbeu hu nga si vhe vhuḓifhinduleli ha muvhuso fhedzi, hu nga si vhe vhafumakadzi na vhana vha fhelisaho tshivhalo tshi shushaho tsha khakhathi na u tambudzwa zwine zwa itwa khavho.
","njengokuba ukuphelisa igbv kungenakuba luxanduva lukarhulumente kuphela, uxanduva alunakuba kowasetyhini kunye nabantwana ukuphelisa amanqanaba awothusayo obundlobongela kunye nokuxhatshazwa okubafike layo.
"
"vhanna vha afrika tshipembe vha tea u tamba vhuimo hu vhonalaho kha u thivhela gbv.
","amadoda asemzantsi afrika kufuneka adlale indima enkulu ekuthinte leni igbv.
"
"vha tea u pfesesa uri ndi mini zwi vhangaho khakhathi dzo ḓisendekaho nga mbeu, nga maanḓa khakhathi dza zwa vhudzekani.
","kufuneka aqonde ukuba yintoni na eyenza igbv, ingakumbi ubundlo bongela obuphathelele kwezesondo.
"
"mbalombalo dza vhugevhenga dza zwinozwino dzi sumbedza uri vhathu vha 4,000 vho tzhipiwa mahayani avho kana hayani ha mutzhipi, na uri kha milandu ya u tzhipa ya 400 yo vhigwaho, mutzhipi na mutzhipiwa vho vha vha na vhushaka.
","iinkcukachamanani zamva nje zolwaphulomthetho zibonisa ukuba baphantse babe ngama4 000 abantu abadlwenguliweyo emakhayeni abo okanye kulowo womenzi wobubi, kwaye kumatyala odlwengulo axeliweyo angama400 ixhoba nomenzi wobubi babenobudlelwane.
"
"hezwi zwi sumbedza uri vhaṅwe vhanna a vha pfesesi uri u ita zwa vhudzekani hu si na thendelano ndi mulandu.
","oku kuphakamisa ukuba amanye amadoda akaqondi ukuba ukwabelana ngesondo ngaphandle kwemvume ecacileyo lulwaphulomthetho.
"
"vhanna vha tea u ṱhonifha vhafumakadzi na vhafarisi vhavho na u pfesesa uri u vha na vhushaka ha tsini tsini na mufarisi wavho a zwi vha ṋei thendelo ya u ita khakhathi miṱani.
","amadoda kufuneka ahloniphe abafazi bawo kunye namantombazana athandana nawo kwaye aqonde okokuba ukuba kubudlelwane bokuthandana ayisosizathu sokuba kwenzeke ubundlobongela basekhaya.
"
"arali munna muṅwe na muṅwe a ṱangana na vhanna vhavhili, vhuraru havho vha ana u sa tzhipa mufumakadzi, na u sa rwa mufumakadzi, vha hwesana vhuḓifhinduleli ha muano uyu, ri nga thoma u lwa na khakhathi dzo ḓisendekaho nga mbeu shango ḽashu.
","ukuba indoda nganye iqokelela amadoda amabini kwaye bobathathu benze isibhambathiso sokuba abasoze badlwengule owasetyhini, abasoze babeke isandla kowasetyhini kwaye babambane kwaye indoda nganye ibenoxanduva lokuphendula ngesi sibhambathiso, singaqalisa ngokuzimiseleyo ukulwa negbv kwilizwe lethu.
"
"a zwo ngo lingana u dzhenelela nga murahu ha musi vhatshinyi vho no fariwa na u gwevhiwa.
","akwanelanga ukungenelela kuphela xa abenzi bobubi bengenile kwinkqubo yobulungisa yolwaphulomthetho.
"
"ri khou tea u thivhela khakhathi dzo ḓisendekaho nga mbeu dzi sa athu u itea.
","kufuneka sithintele igbv phambi kokuba yenzeke.
"
"ndi khou humbela vhanna vhoṱhe vha afrika tshipembe, vhaṱuku na vhahulwane, vhadzulapo vha ḓoroboni na vhadzulapo vha mahayani, vha musalauno na vha tevhedzaho mvelele, vho malaho na vha songo malaho, uri vha vhe tshipiḓa tsha ndingedzo dza thivhelo i no khou ṱoḓea vhukuma mahayani na zwitshavhani zwashu.
","ndimemelela onke amadoda omzantsi afrika, ulutsha kunye namadoda amadala, abahlali basezidolophini kunye nabahlali basezilalini, kubantu abakholelwa kwiinkqubo zala maxesha kunye nabo basagcine izithethe, abatshatileyo nabangatshatanga, ukuba babe yinxalenye yeenzame zothintelo ezifuneka ngamandla emakhayeni nakwiindawo esihlala kuzo.
"
"nga u hana u ṱanganedza zwiito zwa khakhathi dzi itelwaho vhafumakadzi na vhana, u sa ḓidzhenisa khazwo na u vhiga zwiito zwenezwo, vha vha tshivhonelo tshavhuḓi kha vhaṅwe vhanna ngavho, nga maanḓa vhaswa na vhatukana.
","ngokwala ukuvumela ubundlobongela obujo liswe kwabasetyhini kunye nabantwana, ngokungabandakanyeki kubo wena buqu kwaye ngokuxela izenzo ezinjalo, umisela umzekelo kwamanye amadoda ngokubanzi, ingakumbi kubafana namakhwenkwe.
"
"vha ḓo vha vha khou zwi sumbedza khagala uri a hu na vhushaka, vhukonani kana u fulufhedzea zwine zwa nga vha thivhela na luthihi u lwela pfanelo dza vhafumakadzi na vhana.","uza kuthumela umqondiso ocacileyo wokuba akukho budlelwane, ubuhlobo okanye ukunyaniseka okunokuba sisizathu sokuba ungameli amalu ngelo abasetyhini kunye nabantwana."
"tshumelo na vhugudisi zwa mahala zwa mabindu vukuzenzele unnamed zwiimiswa zwiraru zwa muvhuso zwo sedzesa kha u ita uri zwi leluwe u ita zwa mabindu afrika tshipembe u itela u alusa ikonomi.
","uqeqesho lwasimahla kunye neenkonzo ezenzelwe amashishini kgatiso tlhakole amaqumrhu amathathu karhulumente agxile ekuncediseni ukuba kube lula ukwenza ushishino emzantsi afrika ukuze kukhule uqoqosho.
"
"webinara ya zwinozwino ya vuk talks yo farwa u itela u tsivhudza vhathu nga ha mushumo, mbekanyamaitele na tshumelo dzi ṋekedzwaho nga vha khomishini ya ndaka ya ngelekanyo na dzikha mphani (companies and intellectual property commission (cipc), khoro ya dzikha mphani (companies tribunal (ct) na khomishini ya zwa u maanḓafhadza vharema nga u angaredza kha zwa ikonomi (broadbased black economic empowerment) (bbbee) .
","iintetho ngeintanethi zakutshanje zevuk talks , ebezibanjwe yinkqubo yonxibelelwano lolwazi lukarhulumente, zabanjelwa ukwazisa ngesigunyaziso, imigaqonkqubo kunye neenkonzo ezinikezwa yikomishini yokubhalisa iinkampani nobugcisa bengqondo (icipc), inkundla yeenkampani (ict) kunye nekhomishini yokuxhotyiswa kwabamnyama ngokubanzi kwezoqoqosho (ibbbee).
"
"zwiimiswa izwi zwoṱhe ndi zwa muhasho wa zwa mbambadzo, nḓowe tshumo na muṱaṱisano.
","onke la ngamaqumrhu esebe lezorhwebo, ushishino nokhuphiswano.
"
"u ya nga ha vho ofentse shakung, mulanguli wa cipc wa zwa vhutumbuli na vhushumisani na mula ngi wa elearning, cipc i na mishumo yo fhambanaho, hu tshi katelwa u ṅwaliswa ha dzikhamphani, mabindu mahulwane na pfanelo dza ndaka ya ngelekanyo (tswayo dza mbambadzo, nzivhanyedziso, na nyolo/dizaini).
","ngokutshiwo nguofentse shakung, umphathi wecipc wokusungulwa kwezinto ezintsha kunye nentsebenziswano kunye nomlawuli weelearning, icipc inemisebenzi eyahlukeneyo, equka ukubhaliswa kweenkampani, umanyano lwamashishini kunye namalungelo obunini bempahla (iimpawu zorhwebo, amalungelo awodwa omenzi wempahla, uyilo kunye nelungelo lokushicilela).
"
"cipc yo bveledza pulatifomo yavho ya bizportal i ṋe tshedzaho redzhisiṱiresheni kana u ṅwaliswa ha kha mphani kha inthanethe na tshumelo dzi elanaho nazwo u itela u leludza maitele a u ṅwalisa bindu na u tevhedza ṱhoḓea.
","icipc iphuhlise iqonga layo lebizportal ukuze kubhaliswe iinkampa ni kunye neenkonzo zayo kwiintanethi, oku kukwenza lula inkqubo yokubhalisa ishishini kunye nokuthobelaizinto ezifunwayo.
"
"bizportal i ṋekedza avho vha ṱoḓaho u thoma mabindu pulatifomo ire na zwoṱhe ya u ṅwalisa khaphani, u ṅwa lisa muthelo, u ṅwalisa domain name, u ita khumbelo ya ṱhanziela ya bbbee, u ṅwalisa kha tshikwama tsha ndiliso na tshikwama tsha ndindakhombo ya vhusha yamushumo, khathihi na u vula akhaunthu ya bannga ya bindu.
","ibizportal inika abo bafuna ukuqalisa ishishini iqonga elipheleleyo lokubhalisa inkampani, ukubhali sela irhafu, ukubhalisa igama, ukufaka isicelo sesatifikethi sebbbee, ukubhalisa kwingxowamali yembuyekezo kunye nengxowamali yeinshurensi yokungasebenzi, kunye nokuvula iakhawunti yebhanki yeshishini.
"
"""ndi maitele a sa ṱoḓi uri vha shumise mabammbiri nahone khampha ni i ḓo ṅwaliswa hu sa athu fhela awara dza 24 musi yo rumelwa.
","""yinkqubo engasebenzisi maphepha kwaye inkampani iya kubhaliswa kwiiyure ezingama24 ingenisiwe.
"
"ro dovha ra engedza tshumelo dza bindu dza kha google, dzine dza konisa khamphani u vhea phurofaiḽi ya bindu na webusaithi ya khamphani i sa shandukiho kha google nga mahala,"" vho ralo vho shakung.
","sikwangeze iinkonzo zeshishini likagoogle, ezenza ukuba iinkampani zifumane iprofayile yeshishini kunye newebhusayithi yenkampani kugoogle simahla,"" utshilo ushakung.
"
"u shumisa tshumelo idzi, kha vha dalele www.
","ukusebenzisa ezi nkonzo, yiya kuwww.
"
"bizpo rtal.
","bizportal.
"
"gov.
","gov.
"
"za vha puṱedze ‘regi ster’ ‘nṱha ha siaṱari.
","za ucofe ku'register' ophezulu kwephepha elo.
"
"phothaḽa i a leluwa u i shumisa nahone i ṋekedza ndaela nga ḽiga nga ḽiga nga ha uri bindu ḽi ṅwa liswa hani.
","iportal ilula ukuyiphendlaphendla kwaye ichaza ngendlela yokubhalisa ishishini.
"
"vhugudisi ha mahala cipc zwa zwino yo dovha ya rwela ṱari pulatifomo ya vhugudisi ha mahala kha inthanethe ya learnibiz u itela u thusa vhalangi vha mabindu maṱuku, ane a khou bvelela na vhoramabindu kha u fhaṱa vhukoni havho ha u tshimbidza mabindu a bvelelaho, hu na u khwaṱhisedza uri a tevhedza ṱhoḓea dza mulayo.
","uqeqesho lwasimahla icipc isandu kuphehlelela iqonga loqeqesho lasimahla kwiintanethi ilearnibiz ukunceda abalawuli bamashishini amancinci, aphakathi kunye nasakhasayo kunye noosomashishini ukuze bakhulise izakhono zabo zokuqhuba amashishini anempumelelo, ngelixa beqinisekisa ukuba bathobela iimfuno zomthetho.
"
"""pulatifomo ndi nyende dzi ya u vhala ya didzhithala nahone i katela thuthoriaḽa dza vidio na u ḓilinga kha mimodulu ya sumbe miṅwe na miṅwe,"" vho ralo vho shakung.
","eli qonga sisikhokelo sokufunda esidijithali kwaye sibandakanya izifundo zevidiyo kunye nokuzivavanya kwimodyuli nganye kwezi zisixhenxe,"" utshilo ushakung.
"
