"""mathomoni a fulwi, mimbete ya zwibadela zwa muvhuso i fhiraho 27 000 yo vhetshelwa thungo u itela vhalwadze vha covid19 .
","ekuqaleni kweyesilimela, iibhedi zezibhedlele zikarhulumente ezingaphezulu kwama27 000 ziye zabekelwa bucala kulungiselelwa izigulane zecovid19 .
"
"musi zwi tshi fhela, zwibadela zwa tshifhinga nyana zwi ḓo vha na mimbete ya 13 000. vhupo ha vhukhethela thungo na zwibadela zwa tshifhinganyanaminisṱa wa mishumo ya muvhuso na themamveledziso vho patricia de lille vho amba uri: zwiimiswa zwa 1 751 zwo khethwa sa vhupo ha u vhetshela thungo vhalwadze, zwi imelaho mimbete ya 129 600 u mona na shango, kha zwiṱiriki zwoṱhe zwa 44 na ḓorobo khulwane dza malo.
","xa sele zigqityiwe, izibhedlele zethutyana ziza kuba neebhedi ezingama13 000. amaziko okuvalela abanecovid19 bodwa kunye nezibhedlele zethutyanaumphathiswa wezemisebenzi karhulumente neziseko zoncedo upatricia de lille uthe: iindawo ezili1 751 zibekelwe bucala njengeendawo eku cetywa ukuba zibe zindawo zokugcinwa bucala kwabanecovid19 , into leyo ethetha ukuba kukho iibhe di ezingama129 600 kuzwelonke, kuzo zonke izithili ezingama44 kunye nezixeko ezimbaxa ezisibhozo.
"
"zwiimiswa zwa 358 zwo topo lwa ngei kapa vhukovhela, zwi imelaho mimbete i fhiraho 27 500. zwiimiswa zwa 395 zwo ṱolwa nga muhasho wa mutakalo, zwi imelaho mimbete ya 35 759. zwibadela zwa 32 ngei kapa vhubvaḓuvha, zwa 19 ngei kwazulunatal na zwa 10 ngei mpumalanga zwo topolwa uri zwi vusuludzwe na u lugiswa sa zwibadela zwa tshifhinga nyana.
","iindawo ezingama358 sele zibekelwe bucala entshona koloni, futhi zineebhedi ezingaphezulu kwama27 500.
"
"cape town international convention centre, tshone sibadela tsha tshifhinga nyana tshihulwanesa kha shango, tshi na mimbete ya 862. tsho ṱanganedza vhalwadze vha u thoma vha fumi nga ḽa 8 fulwi.
","ezingama395 sele zihloliwe lisebe lezempilo, ezimele iibhedi ezingama35 759.
"
"ngei devhula vhukovhela, zwigwada zwi khou hudza zwibadela nga u fhaṱa zwiṅwe zwifhaṱo.
","izibhedlele ezingama32 empuma kapa, ezili19 kwazulu natala kunye nezili10 empumalanga zichongelwe ukuvuselelwa zize zilungiswe zitshintshwe zibe zizibhedlele zethutyana.
"
"tshiimo tsha gauteng tsha u lugelamulangavundu wa gauteng vho david makhura vho amba uri vundu: li na mimbete ya sibadela ya 8 301, ḽo kunakisa zwiṅwe zwibadela zwi re hone ḽa zwi ita zwiimiswa zwa covid19 , zwa ita uri hu vhe na mimbete yo ḓoweleaho ya 555 na mimbete ya icu ya 308 ire hone, ḽo ita dziwadi ntswa dza tshoṱhe ngei zwibadela zwa kopanong, jubilee, chris hani baragwanath na george mukhari, ha engedza mimbete ya 800, na u vhona uri tshiimi swa tsha nasrec tshi na mimbete miswa ya 500. nga shundunthule, mulangavundu vho makhura vho ṱanganedza ṋetshedzo u bva kha bmw na nissan ya u thusa u fhaṱa sibadela tsha tshifhinga nyana ngei rosslyn, kha ḽa tshwane.
","icape town international convention centre, sesona sibhedlele sethutya na sikhulukazi apha elizweni lethu, ineebhedi ezingama862.
"
"zwibadela zwa tshifhinganyana zwa kapa vhubvaḓuvhangei kapa vhubvaḓuvha, sibadela tsha tshifhinganyana tshi re na mimbete ya 1 000 tsho fhaṱwa site diamu tsha nelson mandela bay.
","yamkela izigulane zayo zokuqala ezili10 ngomhla we8 kweyesilimela.
"
"zwiṅwe zwitediamu na zwone zwi khou shumiswa sa zwiimiswa zwa vhukhethela thungo na zwibadela zwa tshifhinga nyana, hu tshi katelwa na sitediamu tsha ḓorobo ya kapa na tshitediamu tsha fnb.
","emntla ntshona, amaqela enza futhi andisa izibhedle le ngokuthi akhe izakhiwo ezongezelelweyo.
"
"muvhuso wa germany na volkswagen vho ita muano wa u ṋetshedza r107 miḽioni ya u fhaṱa sibadela tsha port elizabeth.
","imeko yasegauteng yokulungela icovid19inkulumbuso yasegauteng udavid makhura uthi iphondo: lineebhedi zesibhedlele ezingama8 301, lilungise izibhedlele ezikhoyo laza lazijika zaba zizibhedlele zecovid19 , into leyo eyenze kwakho iibhedi ezingama555 zabantu abangaguli kakhulu kunye neebhedi ezingama308 zabagula kakhulu (iicu), lenza iiwadi ezisisigxina ezintsha kwizibhedlele ikopanong, ijubilee, ichris hani baragwanath kunye negeorge mukhari, ngolo hlobo longeza iibhedi ezingama800, laze laqinisekisa ukuba iziko lasenasrec lineebhedi ezintsha ezingama500.
"
"musi sibadela tsho no lugela u ṱanganedza vhalwadze, tshi nga kona u dzhia mimbete ya 4 000. tshishumiswa tsha u thusedza u fema afrika tshipembe nga kha thuso ya mivhuso yo fhambanaho, dzikhamphani na madzangano zwo kona u kuvhanganya tshivhalo tshihulwane tsha zwishumiswa zwa u ḓitsireledza iwe muṋe, dziṅwe ṋetshedzo dza dzilafho na zwishumiswa zwa u thusedza u fema.
","kucanzibe, inkulumbuso umakhura wamkela iminikelo evela kwabmw nakwanissan ukunceda ukwakha isibhedlele erossyln, etshwane.
"
"""tshishumiswa tsha u thusedza u fema tsha dzilafho ndi mutshini une wa thusa mafhafhu u shuma.
","izibhedlele zethutyana zasempuma kapaempuma kapa, isibhedlele sethutyana esineebhedi ezili1 000 senziwa kwibala lemidlalo inelson mandela bay stadium .
"
"tshi shumiswa kha vhalwadze vhane vha konḓelwa u fema.
","amanye amabala emidlalo asetyenziswa njengeendawo zokuvalela abo banecovid19 bodwa nanjengezibhedlele zethutyana, kuquka ibala lezemidlalo icape town stadium kunye nefnb stadium.
"
"vhalwadze vhane vha vha na tshitzhili tsha corona (covid19) vha vha na thaidzo ya u fema.
","urhulumente wasejamani kunye novolkswagen bathembise ngezigidi ezili107 zeerandi ukuba kwakhiwe isibhedlele sethutyana ebhayi.
"
"muvhuso wo rwela ṱari thandela ya lushaka ya tshishumiswa tsha u thusedza u fema nga lambamai, u itela u fhaṱa mitshini fhano hayani minzhi nga ṅwambo wa ṱhahelelo yayo ḽifhasini.
","xa isibhedlele sesilungile ukwamkela izigulane, siza kuba neebhedi ezingama4 000. izixhobo zokuphefumlisa ngoncedo loorhulumente, iinkampani kunye nemibutho eyahlu keneyo, umzantsi afrika ukwazile ukuqokelela izixa ezibonakalayo zeppe, ezinye izixhobo zonyango kunye nezixhobo zokuphefumlisa.
"
"minisṱa wa mbambadzo, nḓowetshumo na muṱaṱisano vho ebrahim patel vho amba uri tsumbo dza tshishumiswa tsha u thusedza u fema dzo lingwa.
","isixhobo sonyango sokuphefumlisa ngumatshini onceda imiphunga ukuba ikwazi ukusebenza.
"
"hu khou fulufhelwa uri mveledzo i ḓo thoma nga fulwi nahone muvhuso u na fulufhelo ḽa uri zwishumiswa zwa u thusedza u fema zwa 20 000 zwi ḓo bveledzwa kha miṅwedzi i ḓaho.
","sisetyenziselwa izigulane ezinephika.
"
"tshikwama tsha vhuthihi tsho kumedza masheleni a u wana zwishumiswa zwa u thusedza u fema zwa 200, zwine zwa ḓo ṋewa zwibadela zwi tshi ya nga ṱhoḓea.
","izigulane ezinesifo sentsholongwane icorona (icovid19) ziba nephika.
"
"united states ḽo ṋetshedza afri ka tshipembe zwishumiswa zwa u thusedza u fema zwa 1 000, he zwa 20 zwa ṱanganedzwa nga minisṱa wa mutakalo vho zweli mkhize nga fulwi.
","urhulumente wamisela inational ventilator project kwekatshazimpuzi, ukwenza oomatshini abaninzi apha ekhaya ngenxa yokunqongophala kwihlabathi jikelele.
"
"zwo iswa chris hani baragwanath academic hospital ngei soweto.
","kuyathenjwa ukuba umsebenzi wokuzenza uza kuqala ngeyesilimela kwaye urhulumente uyathemba ukuba izixhobo zokuphefumlisa ezingama 20 000 ziza kuveliswa kwezi nyanga zizayo.
"
"ṋetshedzo i tevhelaho i ḓo shumiswa kha zwiimiswa zwa ngei kapa vhukovhela.
","isolidarity fund izibophele ngemali yokufumana izixhobo zokuphefumlisa ezi ngama200, eziza kuthunyelwa kwizibhedlele ezizidinga kakhulu.
"
"zwishumiswa zwa u ḓitsireledza zwa vhashumi vha ndondolamutakalozwiṅwe zwa ndemesa zwa tshikwama tsha vhuthihi ndi u ṋetshedza ppe kha vhashumeli vha mutakalo u fana na madokotela na vhaongi.
","imelika inike umzantsi afrika izixhobo zokuphefumlisa ezili1 000, ezingama20 kwezo zamkelwa ngumphathiswa wezempilo uzweli mkhize kweyesilimela.
"
"tshikwama, tshe tsha kuvhanganya r2.61 biḽioni u swika zwino, tsho thusa kha u wana ppe dzine dza ḓo thusa kha sisiṱeme dza mutakalo wa tshitshavha na vhashumeli vha mutakalo wa tshitshavha lwa miṅwedzi mivhili.
","zafakelwa kwisibhedlele ichris hani baragwanath academic esoweto.
"
"fhedziha, hu dzulela u vha na ṱhahelelo ya ppe u mona na ḽifhasi, hu tshi katelwa na afrika tshipembe.
","umnikelo olandelayo uza kusetyenziswa kwizibhedlele ezisentshona koloni.
"
"minisṱa vho mkhize vho swikisa ndivhuwo kha khamphani dzo fhambanaho dze dza ṋetshedza ppe, hu tshi katelwa na mabindu a afrika tshipembe, naspers, first national bank, united pharmaceutical distributors, people’s republic of china, dzangano ḽa mutakalo ḽa ḽifhasi, khamphani ya moḓoro ya ford na tshikwama tsha vhuthihi.
","izixhobo zokuzikhusela zabasebenzi bezonyango eyona nto ibalulekileyo kwisolidarity fund kukunika abasebenzi bezonyango abafana noogqirha kunye nabongikazi iippe.
"
"khuwelelo kha vhashumeli vhoṱhe vha ndondolamutakalovhunzhi ha vhashumeli vha ndondolamutakalo vha ḓo ṱoḓea musi tshivhalo tsha vha kavhiwaho nga covid19 tshi tshi engedzea nahone muvhuso u khou vhidza vhashumeli vha ndondolamutakalo na madokotela vha sa khou shumaho uri vha kwame mavundu a havho.
","isolidarity fund , esele inemali ezibhiliyoni ezi2.61 zeerandi ukuza kuthi ga ngoku, sele incede ukufumana iippe ukuxhasa inkqubo yezempilo karhulumente kunye nabasebenzi bezempilo boluntu kwiinyanga ezimbini.
"
"minisṱa vho mkhize vho ri ""ri khou swikisa khuwelelo kha vhashumeli vha zwa dzilafho, na avho vho nothaho, uri vha ḓe vha tholiwe – naho hu tshi tou vha lwa tshifhinga tshiṱuku.
","nangona kunjalo, kusekho ukunqongophala kweeppe kwihlabathi liphela, kuquka nakumzantsi afrika.
"
"""muvhuso wo dovha wa thola madokotela a 217 u bva ngei cuba u mona na shango.
","iinkampani ezinikezele ngeeppe, ziquka ibusiness for south africa, inaspers, ifirst national bank , iunited pharmaceutical distributors, ipeople’s republic of china , umbutho wezempilo wehlabathi (iwho), iford motor company kunye nesolidarity fund .
"
"kumedza masheleni a u wana zwishumiswa zwa u thusedza u fema zwa 200, zwine zwa ḓo ṋewa zwibadela zwi tshi ya nga ṱhoḓea.
","sicela bonke oonompilo kudingeka oonompilo abaninzi njengoko inani labantu abanecovid19 linyuka kwaye urhulumente ucele oonompilo kunye noogqirha abangasebenziyo ukuba baqhagamshelane namaphondo abo.
"
"states ḽo ṋetshedza afri ka tshipembe zwishumiswa zwa u thusedza u fema wa mutakalo vho zweli mkhize nga fulwi.
","""siyabacela bonke abasebenzi bezempilo, nkqu nabo bathathaumhlalaphantsi, ukuba beze ngaphambili bazokusebenza nokuba lithuba elifutshane,"" utshilo umphathiswa mkhize.
"
"zwo iswa chris hani baragwanath academic ngei soweto.
","urhulumente uthumele oogqirha basecuba abangama217 kwizwelonke.
"
"ṋetshedzo i tevhelaho i ḓo shumiswa kha zwiimiswa zwa ngei kapa vhukovhela.
","""besixakekile siphucula iziseko zoncedo ezibhedlele, silungisa izibhedlele zethutyana kwaye sifumanela izigulane zecovid19 iibhedi ezongezelelweyo.""
"
"zwishumiswa zwa u zwishumiswa zwa u ḓitsireledza zwa vhashumi ḓitsireledza zwa vhashumi vha ndondolamutakalovha ndondolamutakalozwiṅwe zwa ndemesa zwa tshikwama tsha vhuthihi ndi u ṋetshedza ppe kha vhashumeli vha mutakalo u fana na madokotela na vhaongi.
","kwihlabathi jikelele.
"
"tshikwama, tshe tsha kuvhanganya r2.61 biḽioni u swika zwino, tsho thusa kha u wana ppe dzine dza ḓo thusa kha sisiṱeme dza mutakalo wa tshitshavha na vhashumeli vha mutakalo wa tshitshavha lwa miṅwedzi fhedziha, hu dzulela u vha na ṱhahelelo ya ppe u mona na ḽifhasi, hu tshi katelwa na afrika tshipembe.
","kuyathenjwa ukuba umsebenzi wokuzenza uza kuqala ngeyesilimela kwaye urhulumente uyathemba ukuba izixhobo zokuphefumlisa nyanga solidarity fund izibophele ngemali yokufumana izixhobo fumlisa ezi ngama200, eziza kuthunyelwa kwizibhedlele ezizidinga kakhulu.
"
"minisṱa vho mkhize vho swikisa ndivhuwo kha khamphani vho swikisa ndivhuwo kha khamphani dzo fhambanaho dze dza ṋetshedza ppe, hu tshi katelwa na mabindu a afrika tshipembe, naspers, national bank, united pharmaceutical distributors, people’s republic of china , dzangano ḽa mutakalo ḽa ḽifhasi, khamphani ya moḓoro ya ford na tshikwama tsha vhuthihi.
","imelika inike umzantsi afrika izixhobo zokuphefumlisa ezili1 000, ezingama20 kwezo zamkelwa ngumphathiswa wezempilo uzweli mkhize kweyesilimela.
"
"khuwelelo kha khuwelelo kha vhashumeli vhashumeli vhoṱhe vha vhoṱhe vha ndondolamutakalondondolamutakalovhunzhi ha vhashumeli vha ndondolamutakalo vha ḓo ṱoḓea musi tshivhalo tsha vha kavhiwaho nga tshi tshi engedzea nahone muvhuso u khou vhidza vhashumeli vha ndondolamutakalo na madokotela vha sa khou shumaho uri vha kwame mavundu a havho.
","zafakelwa kwisibhedlele ichris hani baraacademic esoweto.
"
"minisṱa vho mkhize vho ri ""ri khou swikisa khuwelelo kha vhashumeli vha zwa dzilafho, na avho vho nothaho, uri vha ḓe vha tholiwe – naho hu tshi tou vha lwa tshifhinga tshiṱuku.
","umnikelo olandelayo uza kusetyenziswa kwizibhedlele ezisentshona koloni.
"
"""muvhuso wo dovha wa thola madokotela a 217 u bva ngei cuba u mona na shango.
","nzi bezonyango abafana noogqirha kunye nabongikazi iippe.
"
"""ro no thoma u khwinisa themamveledziso ya zwibadela, u lugisela zwibadela zwa tshifhinganyana na u wana mimbete minzhi u itela vhalwadze vha covid19 .""","isolidarity fund , esele inemali solidarity fund , esele inemali solidarity fundbezempilo, nkqu nabo bathathaba elifutshane,"" utshilo umphathibasecuba abangama217 kwi"
"ndivhuwo dzo khetheaho kha vhashumi vha ndondolamutakalo vhashu vukuzenzele unnamed tshivhalo tsha dzimpfu dza tshitzhili tsha corona zwa zwino tsho paḓa 2000. kha vho lovhaho hu na vhashumi vha ndondolamutakalo, vho ramaṱalimakone vhe vha ṱhogomela vha lwalaho, nahone vhe vha vha thikhedzo na mukhuthadzi kha avho vha re sibadela vho khethelwaho thungo kha miṱa yavho.
","imbeko ekhethekileyo kubasebenzi bethu benkathalelo yezempilo vukuzenzele unnamed inani lokusweleka okubangelwa yintsho longwane icorona kutsha nje lide ledlula kuphawu lwama2 000. phakathi kwabo bathe baphulukana nobomi babo ngabasebenzi bezempilo, abasebenzi abafezekileyo abebekhathalela abagulayo, kwaye bebeyinkxaso nentuthuzelo kwabo bebesesibhedlele besenziwa amakheswa kwiintsapho zabo.
"
"zwauri vhanna na vhafumakadzi vho hwalaho mushumo wo khetheaho na u ṱhonifheaho na vhone vha khou kavhiwa nga vhulwadze vha lovha ndi zwithu zwi vhaisaho vhukuma.
","le yokuba amadoda naba setyhini benza le misebenzi iphakamileyo nendilisekile kangaka babe bona kuqala begula bade basweleke sisithonga esibuhlungu eso.
"
"vha tou vha tshivhindini tsha u lwa na dwadze iḽi.
","ngabo abangabona baphambili edabini lokulwa nalo bhubhane.
"
"vha shuma vhe fhasi ha mutsiko muhulu nahone vha tea u hwala mutsiko kha muhumbulo u ḓivha zwauri vha tou vha kha khonadzeo ya khombo ya u nga kavhiwa nga vairasi.
","basebenza phantsi koxinizelelo olukhulu kuze kufuneke ukuba bathwale ubunzi ma bengqondo bokwazi ukuba basemngciphekweni wokosulelwa yile ntsholongwane.
"
"vha tou vha vhahali vhukuma kha nndwa yashu ya u lwisana na tshitzhili tsha corona .
","bangamaqhawe namaqhawekazi okwenene wedabi lethu lokulwa intsholongwane icorona .
"
"ri nea ṱhompho vhahali avha vha afrika tshipembe vhe vha ṱutshela mahaya avho, miṱa na vhafunwa vhavho vha ya mushumoni dzikiḽiniki vha sa fhidzi ḓuvha ḽiṅwe na ḽiṅwe.
","siwothulela umnqwazi la makhalipha abemi bomzantsi afrika ashiya amakhaya wabo, iintsapho kunye nabo babathandayo ukuya empangelweni engaphosi nomzuzu yonke imihla kwiikliniki, izibhedlele kunye namanye amaziko ezempilo.
"
"vha afho vha ṋetshedza ndondolo ya zwa dzilafho, thikhedzo ya zwa ndaulo na dziṅwe tshumelo dzi ngaho u kunakisa na u fha zwiḽiwa.
","apho bathi babonelele khona ngenkathalelo yezempilo, inkxaso yobumabhalana nezinye iinkonzo ezifana nokucoca nokulungiselela ukutya.
"
"musi vha tshi khou ita mushu mo wavho we vha gudela, na riṋevho ri na vhuḓifhinduleli khavho na miṱa yavho.
","njengokuba besenza oko kungumsebenzi wobizo lwabo, nathi sinoxanduva kubo neentsapho zabo.
"
"mutakalo wavho na tsireledzo yavho zwi tea u vha zwone zwa ndeme.
","impilo yabo nokhuseleko lwabo kufuneka siyixabise kakhulu.
"
"ri a vha ṱhonifha na u vha tikedza sa vhanna na vhafumakadzi vhe vha sumbedza uri vho ḓiimisela u vhea vhutshilo havho kha khonadzeo ya khombo vha tshi itela uri ri tshile.
","sibanika imbeko siba bekela phezulu njengamadoda nabasetyhini ababonakalise ukuba bazimisele ukubeka ubomi babo emngciphekweni ukuze kuphile thina.
"
"khavho u ita mushumo wavho u ṱoḓaho vhuḓifhinduleli vhuhulwane vha ṱoḓa thikhedzo yashu khathihi na tsireledzo nga u ṋetshedza zwishumiswa zwa u tsireledza muthu ene muṋe (ppe).
","ukuze bakwazi ukwenza lo msebenzi mkhulu kangaka ufuna amandla badinga inkxaso yethu kwakunye nokhuseleko ngokubonelelwa ngezixhobo zokusebenza ezikhuselekileyo (iippe).
"
"nga kha thikhedzo ya tshikwama tsha mulanga na ndambedzo dzi bvaho kha vhunzhi ha vhathu vha afrika tshipembe, mabindu, dzifoundesheni na miṅwe mivhuso, ro kona u wana zwishumiswa zwa u tsireledza muthu ene muṋe hu tshi itelwa mihaga iyi ya vhashumi vha re tshivhindini.
","ngenkxaso yesolidarity fund nezipho ezivela kubantu ngabantu basemzantsi afrika, kumashishini, kwiingxowamali nakoorhulumente bamanye amazwe, sikwazile ukufumanela aba basebenzi bangabona baphambili edabini bakhaliphileyo izixhobo zokusebenza ezikhuselekileyo.
"
"he ha vha hu na ṱhahalelo ya zwishumiswa zwa u tsireledza muthu ene muṋe (ppe) zwibadela zwashu zwi khou sedzana nazwo nga u ṱavhanya u vhona uri zwi vhe hone.
","apho bekukho khona ukudingeka kweppe izibhedlele zethu zikulungisa ngokukhawuleza oko ukuqinisekisa ukuba zikhona.
"
"ri a ḓivha zwauri u swikela zwishumiswa zwa u tsireledza muthu ene muṋe (ppe) a si yone khaedu i yoṱhe ine vhashumi vha ndondolamutakalo vhashu vha ṱangana nayo.
","siyayazi ukuba ukufikelela kwippe asikokuphela komce limngeni abasebenzi bethu benkathalelo yezempilo abajongene nawo.
"
"u mona na shango dzikiḽiniki na zwibadela zwi khou ṱangana na khaedu dza ṱhahalelo ya vhashumi.
","kweli lizwe jikelele iikliniki nezibhedlele zijongene nokudingeka kwabasebenzi.
"
"thaidzo iyi i khou sedziwa.
","le ngxaki iyalungiswa.
"
"u tikedza mushumo une vhashumi vhashu vha re tshivhidzini vha khou ita u mona na shango ri khou rumela dziminisṱa na vhafarisa dziminisṱa kha tshiṱiriki tshiṅwe na tshiṅwe kha shango u ya u wanulusa khaedu nkene kha zwiṱiriki izwi na u shuma na vha maanḓalanga vha zwa mutakalo kha vundu.
","ukuxhasa umsebenzi owenzi wa nga basebenzi bethu abanga bona baphambili edabini kweli lizwe jikelele sithumela abaphathiswa noosekela baphathiswa kwisithili ngasinye kweli lizwe ukuze babe nokuzibonela ngokwabo imicelimngeni ngobunjalo bayo kwezi zithili ukuze base benzisane nabasemagunyeni kwezempilo kula maphondo.
"
"ri tea u shumisana u tsireledza mutakalo hu si wa vhashumi vha re tshivhindini fhedzi, fhedzi na u itela na vhashumi vhoṱhe.
","kufanele sisebenze kunye ukukhusela hayi nje kuphela impilo yabasebenzi abangabona baphambili edabini kodwa bonke nje abasebenzi.
"
"zwa zwino hu na mushumo wavhuḓi uno khou itwa nga madzangano wa u funza miraḓo nga zwa ndango ya phirela, u thivhela na tsiravhulwadze.
","imibutho yabasebenzi sele yenze umsebenzi omhle wokufundisa amalungu malunga nokulawula nokuthintela usuleleko nococeko.
"
"vha khou tikedza mushumo wa muhasho wa zwa mushumo na vhashumi kha u tshimbidza zwa vhuṱoli ha mushumoni u vhona uri matshimbidzele a zwa tsireledzo na mutakalo a kha ngona u itela vhashumi vha no khou humela mushumoni.
","ikwaxhasa nomsebenzi wesebe lezengqesho nezemisebenzi ekwenzeni uhlolo lwasemsebenzini ukuqinisekisa ukuba imimiselo yezempilo nokhuseleko iyalandelwa kubasebenzi ababuyela emsebenzini.
"
"vhunzhi ha madzangano ashu a vhashumi a khou ṋetshedza mafhungo nga ha tshitzhili tsha corona kha miraḓo yao nahone vhatholi vha khou tshimbidza mafulo a u tsivhudza.
","uninzi lwemibutho yethu yabasebenzi ikwabonelela ngolwazi lwentsholongwane icorona kumalungu wayo kwaye abaqeshi benza amaphulo okuqondisa.
"
"iṅwe ya khaedu yo ṱahaho kha shango ḽashu ndi u shata samba vhathu vhe vha itwa ndingo vha wanala uri vha na tshitzhili tsha corona .
","omnye wemicelimngeni othe wavela kweli lizwe lethu kukubekwa ibala kwabo bantu bathe bafunyaniswa benayo intsholongwane icorona.
"
"sa tshitshavha, ri na vhuḓifhinduleli roṱhe ha u fhelisa zwa u shata samba vhathu vho kavhiwaho nga tshitzhili tsha corona.
","siluluntu, sinoxanduva oludibeneyo lokukuncothula nengcambu ukubeka ibala abantu abosulelwe yintsholongwane icorona .
"
"ho vha na mivhigo i vhaisaho ya vhathu vhe vha thudzelwa thungo nga tshitshavha tsha havho, ha vha na tshitshavha tshe tsha gwalabela vhalwadze vha re na tshitzhili tsha corona musi vha tshi khou ṱanganedzwa kha zwibadela na kiḽiniki dzapo.
","kubekho iingxelo ezihluphayo zabantu abasikiweyo kuluntu abahlala nalo kunye noluntu oluqhankqalazayo kuba izigulana ezinentsholongwane icorona zilaliswa kwizibhedlele zasekuhlaleni nasezikliniki.
"
"hezwi zwi tea u ima.
","lo nto leyo mayiphele.
"
"sa zwe ra ṱangana roṱhe u ṱuṱuwedza zwa u ṱanganedza vhathu vha tshilaho vhe na hiv ra imedzana ra lwisana na zwa u ponda, ri tea u sumbedza u pfesesa, u konḓelela, vhuhwavho na u pfela vhuṱungu miṱa ya vho kavhiwaho khathihi na avho vho kavhiwaho nga vairasi iyi.
","njengoko sasidibene ukukhuthaza ukwamkelwa kwabantu abaphila nentsholongwane kagawulayo (ihiv) saze sema saluqilima ukulwa ukungcungcuthekiswa kwabo, kufuneka sibonakalise ukuqonda, unya mezelwano, inceba, uvelwano nemfesane kwabo bosulelweyo yile ntsholongwane neentsapho zabo.
"
"zwo ambiwa uri zwa u shata samba zwi itiswa nga nyofho dza u shavha u kavhiwa nga vhulwadze na u sa pfesesa.
","kuthiwa oku kubekwa kwebala kuqhutywa luloyiko lokosulelwa sesi sifo nokuswela ukuqonda.
"
"nḓila ya khwiṋe ya u kunda nyofho dza vhulwadze na dza u kavhiwa ndi u tevhedza maitele a tsiravhulwadze ane a vha hone.
","eyona ndlelaingcono yokoyisa uloyiko lokugula olubangelwa lithuku lemvelo nesifo esosulelayo kukuthobela imimiselo yezempilo ekhoyo.
"
"u ofha u kavhiwa zwi tou dzula zwi kha muthu nahone ndi zwa vhukuma.
","uloyiko losuleleko luyavakala kwaye lukhona.
"
"ri tshi kha zwenezwo, ri a ḓivha zwine ra tea u ita u ḓitsireledza na u tsireledza vhaṅwe.
","kwangaxesha nye, siyayazi ukuba yinto emasiyenze ukuzikhusela nokukhusela abanye.
"
"ri a ḓivha zwine zwa vhanga vairasi na zwine ra nga ita u itela u ḓitsireledza kha u kavhiwa.
","siyayazi ukuba ibangelwa yintoni le ntsholongwane nokuthi yintoni esinokuyenza uku zikhusela ukuba singosuleleki.
"
"ri a zwi ḓivha uri ri tea u dzula ro sia tshikhala vhukati ha iwe muṋe na muṅwe muthu, u ḓikhethela thungo arali ro ṱangana na avho vho kavhiwaho na u ya sibadela arali ri na tsumbadwadze.
","siyayazi ukuba kufanele sigcine umgama wokuqelelana, ukuzigcina singamakheswa ukuba besidibene nabo bosulelekileyo nokuthi sizise esibhedlele ukuba sineempawu.
"
"ri tea u dzula ri tshi khou langwa nga mafhungo a vhukuma hu si mavharivhari.
","kufuneka siqhubeke sikhokelwa yinyaniso hayi amarhe.
"
"tshifhinga tshe muthu a vha a tshi nga ri ha ḓivhi muthu o kavhiwaho kana a kwameaho nga tshitzhili tsha corona tsho fhira kale.
","ixesha lokuba umntu athi aka zi mntu owosulelweyo okanye ochatshazelweyo yintsholongwane icorona ledlula kudala.
"
"zwa zwino, nṱha ha izwo, khonani dzashu, miṱa, vhashumisani na vhahura vha ṱoḓa khuthadzo na thikhedzo yashu.
","ngoku, ngaphezulu kunakuqala, abahlobo bethu, iintsapho, oogxa nabamelwane bethu badinga uvelwano nenkxaso.
"
"kha maḓuvha, dzivhege na miṅwedzi i ḓaho, tshiṅwe tshifhinga ri ḓo ḓiwana ri tshi shaya fhulufhelo na u ḓala nyofho musi ri tshi vhona tshivhalo tsha vhathu vho kavhiwaho na vha lovhaho tshi tshi khou engedzea tshi tshi ya nṱha.
","kwiintsuku, iiveki nezi nyanga ziphambi kwethu, ngamanye amaxesha siza kuzifumana siphelelwa lithemba kwaye sibe noloyiko xa sibona inani labantu abosulelekayo nababhubhayo liqhubeka ukonyuka.
"
"zwi ḓo vha hu uri zwithu zwo vhifha vhukuma, fhedzi ri a fhulufhela uri zwi ḓo vha khwiṋe.
","kusenokuba izinto zibe mbi ngakumbi, kodwa siqinisekile ukuba ziza kuba ngcono.
"
"vhaeletshedzi vha zwa dzilafho na vhorasaintsi vhashu vho ri vhudza uri phimo ya u kavhiwa i ḓo ya nṱha musi ri tshi ya tsini na maṱhakhe azwo.
","oosonzululwazi bethu nabacebisi bezonyango basixelele ukuba izinga losule leko liza kunyuka njengoko sifikelela encotsheni yethu.
"
"fhedzi zwi ḓo tsela fhasi.
","kodwa ngokuqinisekileyo liza kuhla.
"
"ri ṱhonifha na u khoḓa vhashu mi vha ndondolamutakalo vhe vha lovha musi vha tshi khou ṱhogomela vhalwadze.
","sinika imbeko abasebenzi benkathalelo yezempilo abathe baphulukana nobomi babo benikezela ngenkathalelo kwabagulayo.
"
"ri tshi khou vha elelwa, kha ri dzule ri tshi ḓitsireledza na u tsireledza vhadzulapo vhashu nga u ita tshipiḓa tshashu.
","ukubakhumbula, masizigcine sikhuselekile kunye nabanye abemi bakuthi ngokudlala eyethu indima.
"
"ri ḓo kunda vairasi hei ra fhaṱulula tshitshavha tshashu.
","siza kuyoyisa le ntsholongwane size silakhe ngokutsha uluntu lwethu.
"
"ro vhona zwifhinga zwi konḓaho nahone ro kunda.
","siwabonile amaxesha awayengawonaanzima kodwa soyisa.
"
kha ri shumise maanḓa oṱhe na nungo dzoṱhe musi ri tshi khou shumisana u itela u phulusa matshilo.,masingagcini mandla okanye sibindi njengokuba sisebenza kunye ukukhusela ubomi.
