src_text,tgt_text,cosine_score
"u fhaṱa lushaka lu ṱhogomelaho vhana u fhaṱa lushaka lu ṱhogomelaho vhana vukuzenzele unnamed hu na murero wo ḓoweleaho kha mvelele nnzhi dza vhathu vha afrika une wa ri zwi dzhia muvhu ndu woṱhe u alusa ṅwana.
","ukwakha isizwe esikha thalele abantwana vukuzenzele unnamed kukho isaci esiqhe lekileyo kwizizwe zamaafrika ezininzi esithi umntwa na ukhuliswa aqeqeshwe sisizwe.
",0.62636894
"muhumbulo uyu – wa uri vhadzulapo vhoṱhe vha na vhuḓifhinduleli ha u bveledzisa, vhuvha na tsire ledzo ya ṅwana muṅwe na muṅwe – murero uyu u a ḓa musi ndi tshi humbula nga ha ḽikhaulambilu na lufu lu vhaisaho zwihulu lwa enock mpianzi wa vhukale ha miṅwaha ya 13 lwo iteaho zwezwino khempheni ya tshikolo.
","olu luvo – lokuba isizwe ngokubanzi sinoxanduva lokukhulisa, intlalontle kunye nokhuseleko lomntwana ngamnye – luza engqondweni yam xa ndicinga ngokusweleka kabuhlungu nakalusizi kukaenock mpianzi oneminyaka eli13 kutshanje ngethuba bekukhenketho lwesikolo.
",0.6569902
"zwi vhaisaho ndi zwauri, enock a si ene ṅwana e eṱhe we a xelelwa nga vhutshilo nga zwiitisi zwine zwa vhukuma zwa nga thivhelea, arali vhathu vhahulwane vho vha vho ṋe tshedza ndondolo na vhuḓifhi nduleli.
","okubuhlungu kukuba uenock akukuphela komntwana ophulukene nobomi bakhe ngenxa yezinto ebezinokuthi ntelwa, ukuba nje abantu abada la bebeziqhelanise nokukhatha la nokuthatha uxanduva.
",0.617863
"muthu u a dovha hafhu a humbula nga ha muṅwe wa vhukale ha miṅwaha ya 13, keamohetswe shaun seboko, we a nwela khothe zwenezwino damuni ḽa u bambela ḽa tshikolo tsha phuraimari tsha magalie sburg, na vhana vhavhili vhe vha lovha tshikoloni tsha phuraimari tsha lekgolo ngei limpopo musi ṱiraka ḽi tshi zhaka luvhondo lwa vha wela.
","le nto inditsho ndacinga ngomnye umntwana naye oneminyaka eli13, ukeamohetswe shaun seboko, osandula ukutshona kwidama lokuquba kwisikolo samabanga aphantsi emaga liesburg, nabanye abantwana ababini abasweleke kwisikolo ilekgolo primary elimpopo xa iloli ithe yatshayisa udonga lwabawela.
",0.4509846
"muthu u a dovha a humbula hafhu nga ha vhana vhanzhi, sa nathlia pienaar wa vhukale ha miṅwaha ya 6, vhane vha khou vhulawa kha nndwa dza magevhenga ngei fuletheni dza kapa.
","le ntlungu inditsho ndacinga ngabanye abantwana abaninzi, abafana nonathlia pienaar oneminyaka emi6 ubudala, owabulawa kwimfazwe yemigulukudu eyayidubulana kummandla wecape flats.
",0.6713049
"ri humbula hafhu mpfu dzi khaulaho mbilu dza michael komape na lumka mkethwa, vhuvhili havho vho lovha musi vho wela kha mabunga a dindi.
","sikhumbula kwakhona uku sweleka kabuhlungu kukami chael komape kunye nolumka mkethwa, bobabini basweleka emva kokuba betshone kwi mingxuma yezindlu zangasese ezingagungxulwayo.
",0.6786306
"matshilo oṱhe ayo a vhathu vhaṱuku, na matshilo a vhaṅwe vhanzhi, o vha a tshi ḓo vha a songo ṱuwa.
","bonke abo bantwana, kunye nabanye abaninzi, bekungafunekanga ukuba baphulukene nobomi babo.
",0.46425813
"makhaula mbilu haya oṱhe o vha a tshi ḓo vha o thivhelea arali ho vha na maga o dzhiwaho a u tsireledza vhana kha fhethu hu huvhadzaho.
","zonke ezi ntlekele bezinako ukuthintelwa ukuba bekuthatyathwe amanyathelo okubagcina aba bantwana bekhuselekile.
",0.34229738
"zwi ntsumbedza uri, sa lushaka, ri khou laṱedza vhana vhashu.
","apha kum kuyacaca ukuba, njengesizwe, siyasilela ekudlaleni indima yethu kuba ntwana bethu.
",0.42845547
"vhana vhanzhi vha ḓiwana vhe kha nyimele dzi ofhisaho, kana tshikhwekhwethe tsha tshifhinganyana mulamboni kana u vha sia vha vhoṱhe mukhukhuni hu na lammba ḽa pharafeni.
","uninzi lwabantwana lu zifumana lukwiimeko ezi nobungozi.
",0.44440535
"musi vhorakhonhṱiraka vha tshi sia mitshini i songo tsireledzea kana themamvele dziso dza tshikolo dzi sa khou londotwa kana tshiendedzi tsha u ya tshikoloni tsho ḓala lu kalulaho, matshilo a vhana a vha o vhewa kha khombo.
","ezinye zezo meko zifana nokubulawa nguzenzele wephenyane emlanjeni okanye basutywe kukufa kuba beshiyeke bodwa kwityotyombe elinesibane separafini.
",0.5992925
"fhedzi hu na zwinzhi u fhirisa u sa vha na ndavha na u sokou litshedzela mushumo.
","xa iinkampani ezakhayo zishiya imisele eziyigrumbileyo ingagqunywanga okanye izakhiwo zesikolo zinga gcinwanga kakuhle okanye izithuthi zabantwana zigcwele kakhulu, ubomi babantwana bubekwa ebungozini.
",0.59451413
"vhana vhanzhi ndi zwipondwa zwa vhabtzipi, magevhenga na vharengisi vha zwidzidzivhadzi nga maanḓa ngauri a vha koni u ḓitsireledza.
","kodwa ayikokungakha thali nokungahoyi kuphela okubangela le ngxaki.
",0.5173915
"sa lushaka, ri tea u vha na vhuronwane na u ṱalifha vhukuma kha zwa u tsireledza vhana vhashu kha khombo idzi na dziṅwe.
","uninzi lwabantwana lusemngciphe kweni wabantu ababaxhaphaza ngezesondo, amaqela emigulukudu kunye nabathengisi beziyobisi kanye kuba besaziwa ukuba ngabantwana abanokwenziwa izisulu lula.
",0.61438614
"sa lushaka, ri tea u fhaṱa mvelele ya vhuḓifhinduleli.
","njengesizwe, kufuneka sihlale sibaze amehlo kwaye siwumele ngeenyawo umba wokukhusela abantwana bethu kwiingozi ezifana nezi.
",0.50144064
"ri tea u vha na vhuḓifhinduleli kha riṋe vhaṋe, kha vhana vhashu na kha vhaṅwe.
","njengesizwe, kufuneka sizifundise ukuthatha uxanduva.
",0.34191352
"musi ri tshi ṱoḓa u vhona uri vhana vha khou kona u aluwa kha vhupo vhu na ṱhuṱhuwedzo, ndondolo na tsireledzo, zwo ralo ri tea u pfa zwi mushumo washu u tsireledza na u londota vhoṱhe vhane ra vha ḓivha na vhane ra tshilisana navho.
","kufuneka sizikhathalele thina, abantwana bethu kunye nabanye abantu.
",0.40083835
"ri tea u pfa mushumo hoyu wa u londota na musi ri dzibadani.
","njengoko kufuneka siqinisekise ukuba abantwana bethu bakhulela kwindawo ekhuselekileyo, efudumeleyo nehlaziyayo, ngokunjalo ke kufuneka sizive sinoxanduba lokukhusela nokukhathalela bonke abo sibaziyo nesinxibelelana nabo.
",0.5458581
"musi ri tshi khou ṱanganedza phungudzeo kha khombo dza badani kha tshifhinga tsha madakalo, ngoho i shushaho ndi ya uri vhathu vha fhiraho 1,600 vho lovha dzibadani dzashu kha tshifhinga tsha ṅwedzi na hafu.
","kufuneka siwuve lo msebenzi wokukhathalela endle leni.
",0.4130978
"zwi a kula nungo zwauri vhareili vha fhiraho 9,000 vho farelwa vhutshinyi vhu katelaho u reila vho kambiwa, luvhilo, u reila nga u sa londa.
","nangona zichulumancisa iindaba zokwehla kwenani labantu abasweleke kwiingozi zendlela kwezi holide zehlobo, intlungu embi yeyokuba bangaphezu kwe1,600 abantu abasweleke ezindleleni kwisithuba nje esiyinyanga enesiqingatha.
",0.5764494
"mvelele ya vhuḓifhinduleli zwi amba uri roṱhe ri tea u reila nga vhuronwane na u ṱhonifha pfanelo dza vhaendangaṋayo na vhaṅwe vhashumisi vha bada.
","iyadanisa into yokuba abaqhubi zimoto abangama9,000 babanjelwe amatyala aquka ukuqhuba phantsi kweempembelelo zotywala, ukuqhuba ngesa ntya esiphezulu, nokuqhuba kakubi nangokungakhathali.
",0.54262215
"mvelele ya vhuḓifhinduleli zwi amba uri vhokhotsi vha tea u vha hone kha matshilo a vhana vhavho.
","ukuthatha uxanduva kuthetha ukuba kufuneka sonke siqhube ngenkathalo futhi sihloniphe amalungelo abahambi ngee nyawo nabanye abasebenzisi bendlela.
",0.48374093
"vhafumakadzi vhanzhi vha alusa vhana vhe vhoṱhe, zwine zwa anzela u fhungudza khonadzeo dzavho dza u bvelela na dza vhana vhavho.
","ukuthatha uxanduva kuthetha ukuba ootata kufuneka babekhona ebomini baba ntwana babo.
",0.49042076
"mvelele ya vhuḓifhinduleli zwi dovha hafhu zwa amba uri ri tea u ḓigudisa vhudzekani ho tsireledzeaho na u sa ḓiwedza kana u wedza vhaṅwe kha hiv .
","maninzi amanina ekufuneka ezikhulisele aba ntwana babo bodwa, into leyo inciphisa amathuba abo kunye nawabantwana babo okuphumelela ebomini.
",0.6303586
"a ri tei u shumisa zwikambi kana zwidzidzivhadzi.
","ukuthatha uxanduva kuthetha nokuba kufuneka sizikhusele kwezesondo futhi singabezibeki thina okanye abanye esiche ngeni sokosulelwa yihiv .
",0.47956342
"ri tea u lusa u tshila ri na mutakalo u itela uri ri thivhele malwadze ane a tsireledzea na u tshila matshilo malapfu.
","kufu neka singaseli utywala kakhulu okanye sisebenzise iziyobisi.
",0.5658849
"mvelele iyi i tea u kutelwa nga maanḓa nga havho vhane kha lushaka vha fara maimo a maanḓalanga na vhuṱuṱuwedzi, kana vharangaphanḓa vha zwa vhurereli kana vhorapoḽotiki, vharangaphanḓa vha zwa mvelele kana vhaḓivhalea.
","kufuneka sifune ukuphila ubomi obusempilweni ukwenzela ukuba siziphephe izifo ezinoku thintelwa kwaye siphile ubomi obude.
",0.5555544
"nga kha maipfi kana nyito dzavho, vha tea u lusa u fhaṱa lushaka lwa khwine lune vhoṱhe vha dzhielwa nṱha na u londotwa.
","le ndlela yokuziphatha kufuneka ilandelwe ngokukodwa ngabo bonke abantu abaphe theyo kwizikhundla zegunya nabahlonitshwayo luluntu, nokuba zinkokeli zezenkolo okanye oosopolitiki, iinkokeli zemveli okanye oosaziwayo.
",0.5141463
"vhaofisiri vho khethwaho na vhashumeli vha muvhuso vho fhulufhelwa nga vhuḓifhinduleli ha u vhona tsireledzo na vhuvha ha vhadzulapo.
","ngokusebenzisa nje amazwi nezenzo zabo, kufuneka bancedise kumalinge okwakha isizwe esingcono apho wonke umntu exatyisiwe kwaye ekhathalelwe.
",0.5173079
"vha tea u vhona uri hu na themamveledziso dzo teaho zwikoloni.
","amagosa onyuliweyo kunye nabasebenzi bakarhulumente baphathiswe uxandauva lokuqinisekia ukhuseleko nentlalontle yabemi.
",0.4810312
"vha tea u dzhia maga nga u ṱavhanya musi hu na khakhathi ya nḓisedzo ya maḓi kha vhadzulapo kana musi mavhone a zwiṱaraṱani o tshi nyalaho o vhigiwa.
","kufuneka aqinisekise ukuba kukho izakhiwo ezaneleyo nezikhuselekileyo ezikolweni.
",0.57866
"vha tea u vhona uri milayo ya vhutsirele dzi na mutakalo i khou tevhed zwa na uri mulayo u khou tevhedzwa.
","kufuneka ashukume ngokukhawuleza xa kukho uphazamiseko lwamanzi ekuhlaleni okanye xa kuchazwe izibane zesitalato ezonakeleyo.
",0.60758734
"ho sedzwa mushumo u no khou itwa kha muvhuso, kha masia oṱhe, u ita uri vhuḓifhi nduleli uhu vhu vhonale, tshiṅwe tshifhinga ri tea u dzhia maga mahulwane.
","kufuneka baqinisekise ukuba kunya nzeliswa imigaqo yezempilo nezokhuseleko futhi nokuba umthetho awophulwa.
",0.47401676
"u fhindula kha dzimpfu na mafuvhalo o vhangwaho musi vhana vha tshi wela kha mabunga a di ndi, ro rwela ṱari vhurangeli ha safe u tshimbidza ṋetshedzo ya mabunga o teaho kha zwikolo zwoṱhe kha shango.
","ukongeza kumsebenzi oqhubekayo owenzeka kurhulumente wonke, kuwo onke amanqanaba, ukuzalisekisa olu xanduva, ngamanye amaxesha kuye kufuneke sithathe ama yathelo angaqhelekanga.
",0.51329917
"ro rumela mmbi ya vhupileli ya lushaka ya afrika tshipembe kha zwipiḓa zwa ḓorobo ya kapa u tikedza mapholisa kha ndingedzo dzavho dza u fhu ngudza khakhathi dzi itwaho nga magevhenga.
","ukuphendula ekufeni nasekonzakaleni okubangelwa kukutshona kwabantwana emingxunyeni yezindlu za ngasese ezingagungxulwayo, sisungule iphulo lesafe lokukhawulezisa ukwakhiwa kwezindlu zangasese ezifane lekileyo kuzo zonke izikolo elizweni.
",0.5590844
"zwenezwino, ro ṱangana na vhashumeli vha muvhuso, ro ḓidzhenisa kha pulane ya u fhindula zwa shishi u itela u fhelisa khakhathi dzi ite lwaho vhafumakadzi na vhana.
","sathumela umkhosi wokhuselo wesizwe wasemzantsi afrika kwiindawo ezithile ekapa ukuxhasa amapolisa kwiinzame zawo zokunciphisa ubundlobongela.
",0.5887322
"naho zwo ralo, hu vhonala hu na zwinzhi zwine ra tea u ita, sa muvhuso nahone sa lushaka.
","kutshanje, thina, kunye nemibutho yoluntu, siqalise isicwangciso sokulwa ubu ndlobongela obenziwa ku manina nabantwana.
",0.600006
"ri fhululedza madzangano na vhathu avho vhe vha vhea mahaḓani avho vhuḓifhinduleli ha vhuvha ha vhaṅwe vhathu.
","nangona kunjalo, kuninzi ekufuneka sikwenzile, nje gorhulumente nanjengesizwe.
",0.49391055
"hu na vhathu vha ngaho sa vho ralph bouwers na vho mark nicholson, vhe vha dzudzanya mishumo ya vhuḓimvumvusi ha vhaswa ngei lavender hill kha ḽa ḓorobo ya kapa u vha tsireledza kha u shandukela kha zwa vhugevhenga.
","sibaqhwabela izandla abo bantu kunye nemibutho ethe yaluthathela kulo uxanduva lokukhathalela impilo yabanye.
",0.55041504
"hu na vhomme, dzikhaladzi na vhasidzanyana vhane vha shuma sa matshudeni vha sa shumeli malamba kha operation bobbi bear, dzangano ḽi re amanzimtoti ngei kwazulunatal ḽine ḽa ṋetshedza haya kha vhana vhaṱuku vhe vha tambudzwa.
","kukho aba ntu abafana noralph bou wers kunye nomark nicho lson, abaququzelela imidlalo yokuzonwabisa yabantu abasebatsha elavender hills ekapa ukuze bangaguquki babe yimigulukudu.
",0.7063712
"hu na zwigwada zwo ḓisen dekaho nga zwa lutendo zwi ngaho sa khonferentsi ya mabishopho a khathyoḽiki tshipembe ha afrika, vhe nda ṱangana navho zwenezwino vhe vha mmbudza nga ha mushumo une vha khou ita u fhindula ṱhoḓea dza vhashayi, u tikedza miṱa uri i vhe i londaho na u ṱhogomela nga maanḓa na u thusa vhaswa musi vha tshi livhana na khaedu nnzhi dzi re phanḓa havho.
","kukho oomama, oodade kunye neentombi abasebenza njengamavolontiya angabafundi kwioperation bobbi bear, umbutho oseamanzimtoti kwazulunatal ofunela aba ntwana abancinci abangama xhoba okuxhatshazwa iindawo zokuhlala.
",0.6306809
"vhathu avha vha afrika tshipembe vha khou ri sumbedza nḓila.
","kukho amaqela amaninzi ezenkolo afana nesouthern african catholic bishop’s conference, endisandula ukudibana nawo andixelele malunga nomsebenzi awe nzayo ukujongana neemfuno zabantu abahluphekileyo, ukuxhasa iintsapho ukuba zikhathale kwaye zikhulise kwaye zincede abantu abasebatsha ukuba bahlangabezane nemingeni emininzi abajo ngene nayo.
",0.5630689
"nga kha tsumbo dzavho, vha khou ri humbudza zwauri zwi amba mini u dzhia vhuḓifhinduleli hashu riṋe vhaṋe na ha vhaṅwe.
","aba bemi basemzantsi afrika basibonisa indlela.
",0.42143324
"shango iḽi ḽo no ṱanzilela makhaulambilu manzhi vhukuma.
","ngemizekelo yabo, baya sikhumbuza ukuba kuthetha ukuthini ukuzithathela uxa nduva thina buqu nokuluboni sa nakwabanye.
",0.44334492
"matshilo manzhi a vhathu vhaṱuku o lozwea, vhana vha nzhi vho vhaisala na u thithisea muhumbulo.
","eli lizwe lithwaxwe ziintlekele ezininzi kakhulu.
",0.41942
"ri nga fhelisa makhaulambilu haya arali roṱhe, muṅwe na muṅwe washu, a tshi dzhia vhuḓifhinduleli ha u alusa vhana kha mivhundu yashu yavhuḓi ya afrika tshipembe.","ukwakha isizwe esikha thalele abantwana vukuzenzele unnamed kukho isaci esiqhe lekileyo kwizizwe zamaafrika ezininzi esithi umntwa na ukhuliswa aqeqeshwe sisizwe.
",0.41942
"mafhungo nga vhuḓalo nga ha adhd na add silusapho nyanda hu na thuso ine ya vha hone kha vhana vhane vha konḓelwa u thetshelesa zwavhuḓi, u vha na mafufulu o kalulaho na u sa dzulisea arali ṅwana ane a vha na thaidzo ya u konḓelwa u thetshelesa zwavhuḓi, u sa dzulisea na u vha na mafulufulu o kalulaho (adhd) kana u a konḓelwa u thetshelesa zwavhuḓi na u sa dzulisea (add) a sa ilafhiwa, nyimele idzo dzi nga vha na masiandaitwa a tshifhinga tshilapfu kha mutakalo wawe.
","ulwazi olubanzi nge adhd neadd silusapho nyanda lukhona uncedo lwabantwana abanesifo seattention deficit hyperactivity disorder.
",0.5697165
"hezwi ndi u ya nga dokotela vho khatija jhazbhay, vhane vha rangaphanḓa yuniti ya zwa muhumbulo ya vhaswa na vhana ngei sibadela tsha townhill pietermaritzburg, ngei kwazulunatal.
","ukuba umntwa na onesifo seadhd) okanye iattention deficit disor der (iadd) akanya ngwa, ezi zifo zingenza umonakalo onzulu empilweni yakhe.
",0.6124289
"vho ṱalutshedza uri vho no aluwa, vhana avha vha nga vha kha khombo khulwane ya dziṅwe nyimele dza muhu mbulo, dzi nga ho sa mbilaelo na mutsiko, nahone vha nga shumisa zwikambi lu si lwavhudi.
","ezi zimbono zikagq khatija jhazbhay, owongamele icandelo lengqondo labantwana nabafikisayo kwisibhedlele itownhill epietermaritzburg, kwazulunatal.
",0.6493509
"adhd na add vhu kwama mvelaphanḓa dza pfunzo dza vhana nahone maitele avho a nga kwatisa vhaṅwe.
","uyacacisa ukuba njengabantu abadala, aba bantwana basenokuba semngciphekweni omkhulu wokuhlaselwa zezinye izifo zengqondo, ezinjengexhala kunye nokudakumba komphefumlo, futhi basenokusebenzisa iziyobisi.
",0.5510337
"vhana na vhone vha nga nyaliwa, vha dzhena khakhathini na u welwa nga dzikhombo.
","iadhd kunye neadd zichaphazela indlela abaqhuba ngayo abantwana kwizifundo zabo kwaye le ngxaki banayo inokubacaphukisa abanye abantu.
",0.58714104
"dokotela vho jhazbhay vho amba uri: ""nyimele dza ṅwana muṅwe na muṅwe dzi a aluwa nahone a dzi fani, zwo ralo ndi zwa ndeme u ita ṱhaṱhuvho ya kiḽinikhaḽa yo ṱanḓavhuwaho u vhona zwiṅwe zwithu zwine zwa nga vha zwi tshi kwama mveledziso dzavho, khathihi na zwa ndeme zwine zwa nga itwa u vha thusa u swikela hune vha tea u swikela vhukoni havho ho fhelelaho.
","abantwana abanezi ngxaki basenokungathandwa, bangene engxakini futhi bathande ukwenza izinto eziyingozi.
",0.48443085
"""vho ṱalutshedza uri adhd na add ndi thithiso ya nyaluwo ya maluvhi ine ya sumbedziswa nga vhuḓifari vhu si havhuḓi, zwi ngaho sa u sa kona u dzu lisea na u thetshelesa zwavhuḓi.
","""iimeko zomntwana ngamnye zahlukile kwaye ziyakhula, ngoko ke kubalulekile ukwenza uvavanyo oluthe vetshe lwengqondo ukuze ubone ezinye izinto ezinokuba nefuthe kwindlela abakhula ngayo, kunye nezo ziluncedo kunokwakhelwa kuzo ukubanceda ukufikelela kubuchule babo obugcweleyo,"" utsho ugq jhazbhay.
",0.6265203
"izwi zwi vhonala nga: u ita vhukhakhi vhu sa tei u itwa u sa fhedza mishumo u xedza zwithu u khakhisea na u hangwa nga u ṱavhanyatsumbo dza u sa dzulisea na u vha na mafulufulu o kalulaho kana u sa langea zwi katela: mazhuluzhulu u tambisa zwanḓa kana milenzhe u swenda swenda kha tshidulo u sokou fhindula u songo thoma wa humbula na u sokou takuwa wa ima u tshi khou lavhelelwa u dzula.
","uyachaza ukuba iadhd kunye neadd sisifo sokuphazamiseka kwemithamboluvo esithi sibangele ukuba umntwana aziphathe ngendlela engafanelekanga, efana nokungahoyi.
",0.5836431
"""tsumbadwadze dzi vhonala fhethu huvhili kana u fhira – hayani, tshikoloni, u na khonani kana mashaka kana musi hu na miṅwe mishumo – zwa thithisa mashumele a tshikolo, zwa mushumo kana zwa matshilisano.
","oku kubonakala ngendlela: yokwenza iimpazamo ezingenamsebenzi yokungagqibi imisebenzi yokulahlekelwa zizinto yokuphazamiseka lula nokulibalaimizekelo yokuphazamiseka okanye yokuba sisingxami iquka: ukungqunga ukubetha izandla okanye iinyawo ukujubalaza esihlalweni sabo ukukhwaza iimpendulo nokuphakama xa kulinde leke ukuba uhlale phantsi.
",0.68607587
"tsumbadwadze dzo kalula ho dzi vhonala ṅwana a sa athu swika miṅwaha ya 12 nahone zwi tea u vhonala lwa miṅwedzi ya henefha kha ya rathi.
","""iimpawu zibonakala kwiindawo ezahlukahlukeneyo – ekhaya, esikolweni, xa enabahlobo okanye ngexesha esenza eminye imisebenzi – kwaye ziphazamisa indlela anxibelelana ngayo ekuhlaleni, emsebenzini okanye esikolweni.
",0.5144006
"vhadededzi vha a kona u topola vhuḓifari vhu siho kha ngona nahone vha nga isa ṅwana kha ṱhaṱhuvho ya zwa kiḽinikhaḽa.
","iimpawu ezinkulu ezikhoyo ngaphambi kweminyaka eli12 kwaye kufuneka zibekhona okungenani kwiinyanga ezintandathu.
",0.42096925
izwi ndi maitele a dzilafho o fhambanaho ane a nga shumiswa.,"ulwazi olubanzi nge adhd neadd silusapho nyanda lukhona uncedo lwabantwana abanesifo seattention deficit hyperactivity disorder.
",0.42096925
"vhaswa ndi vhone vhumatshelo ha shango ḽashu vukuzenzele unnamed u ambedzana na vha swa zwi anzela u ntsia ndi na mafulufulu.
","abantu abatsha balikamva lelizwe lethu vukuzenzele unnamed ukufakana imilomo nabantu abatsha kusoloko kundishiya ndinodlamko.
",0.65084064
"zwi a takadza u wana luvhonela nga ha thambulo na madakalo avho na bono ḽavho ḽa uri hu nga itwa mini u khwi nisa shango iḽi.
","kuyavuyisa ukuqonda iingxaki neempumelelo zalo kunye nemibono yalo ngento enokwenziwa ukuphucula eli lizwe.
",0.18230009
"a zwi hanedzwi uri vhaswa ndi vhuhone ha ndeme kha muya na muhanga wa lushaka.
","liyinene elokuba abantu aba tsha basisininzi, bangundaba mlonyeni kwaye izingqi zabo ziyavakala kwisizwe siphelo.
",0.6363621
"kule na kuhumbulele kwa uri vha ṱoḓa u ḓitakadza fhedzi, u sa ḓidzhenisa kha zwa poḽotiki kana u humbulela vhone vhaṋe, ngudo dzapo na dza dzitshaka dzi anzela u khwaṱhisedza uri vhaswa u mona na ḽifhasi vha anzela u vha na fulufhelo nga ha ndavhelelo dzavho.
","umbono wokuba batyhafile, abanamdla kwezopolitiko okanye bayazingca, uyaphiki swa ziziphumo zamaphulo ophando aqhutywe apha ekhaya nakumazwe aphesheya angqina ukuba abantu abatsha kwihlabathi liphela bahlala benethemba lamathuba amahle okuphumelela ebomini.
",0.61212754
"u ya nga mawanwa a ipsos pulse a khetho dza vhathu o bviswaho nga phando, 61% ya maafrika tshipembe vha miṅwaha u bva kha 15 u ya kha 17 vha pfa vha na fulufhelo nga ha 2020. a thi timatimi uri hovhu ndi vhuḓipfi ha vhaswa nga u anga redza nga maanḓa avho vho bebiwaho nga tshifhinga tshi fanaho tsha musi miḽeniamu i tshi khou shanduka vhane zwa zwino vha khou thoma vhutshilo ha vhaaluwa, vhane vhaswa vha vha vhidza ama2000.
","ngokwakufunyaniswe kwi ipsos pulse of the people eyakhu tshwa kwinyanga yomqungu, iipesenti ezingama61 zabemi bomzantsi afrika abaneminyaka eli15 ukuya kweli17 baziva benethemba malunga nowama2020.
",0.58659804
"ndi vharwa na vhananyana vho bebwaho nga murahu ha dimokirasi.
","andithandabuzi ukuba olu luluvo lwabantu abatsha ngokubanzi ingakumbi eli qela lazalwa ekuqaleni kwale nkulungwane, ekungoku nje bafika kwinqanaba lobudala, olubizwa ngokuba ngama2000.
",0.53569216
"musi vha songo ṱangana na tshenzhemo thwii ya tshiṱuhu tsha muvhuso wa tshiṱalula, vha bvela phanḓa na u tshila na vhufa hawo ha tshayandingano ya muvhala, u sa dzula hu fanaho na vhushai.
","ngumlisela nomthinjana owazalwa emva kokuba eli lizwe lifumene inkululekoi.
",0.52045083
"vhaswa avha vha na fulufhelo, vhuḓifulufheli na u fhufhuma lutamo lwa u bvelela.
","nangona bengenazivubeko bona buqu zenkohlakalo yombuso wocalucalulo, bayaqhubeka nokuphila nentlungu eyashiywa ngulaa rhulumente yokungalingani ngokobuhlanga, ukubandeze lwa umhlaba kunye nentluphe ko.
",0.5938395
"vha a ḓivha pfanelo dzavho nahone a vha shavhi u dzi ṱoḓa.
","olu lutsha luzithembile, lu yazithemba kwaye luyaphuphu ma ngamabhongo.
",0.6028402
"vhaswa vha shango vha imela mafulufulu, fulufhelo, vhuḓi mvumvusi, vhukoni, vhuma tshelo na mbofholowo.
","bayawazi amalungelo abo kwaye aboyiki ukuwabanga.
",0.42936772
"vho bebwa nga tshifhinga tsha thekhinoḽodzhi ya didzhithala na u kona zwavhuḓi kushumisele kwa thekhinoḽodzhi dza tshizwinozwino na u ṱoḓa u dzhena kha mabuḓo e a vha a siho na luthi hi nga tshifhinga tsha vhabebi vhavho.
","ulutsha lwelizwe lethu lubonakalisa amandla, ithemba, ulonwabo, ukubanakho, ikamva nenkululeko.
",0.53938895
"nga madekwana a ḓuvha ḽa phanḓa ha vhuṱambo ha mulaedza wa lushaka ndo vha na mashudu a u ambedzana na tshigwada tsha vhaswa vha mafulufulu kha nyambedzano dza mirafho yo vhalaho yo rambi waho nga zhendedzi ḽa mvele dziso ya vhaswa ḽa lushaka.
","basisizukulwana esiphila ngobuchwepheshe beli xesha esisebenzisa ubugcisa bale mihla ngokuchanekileyo kwaye bajonge ukungena kumakhondo emisebenzi angazange abekho ngexesha labazali babo.
",0.54005444
"ro amba nga ha zwithu zwine zwa vha zwa vhuṱhogwa vhukuma kha vhaswa na u ṱola nḓila dzine ri nga livhanya kuhu mbulele na nyito dzashu.
","ngaphambi kwentetho kamongameli engobume besizwe ndiye ndaba nethuba lokunxibelelana neqela lolutsha elinamandla kwindibano yokufakana imilomo ibiququzelelwe yiarhente yesizwe yophuhliso lolutsha.
",0.56112456
"sa nḓowelo, mafhungo nga ha u wana mishumo na zwikhala zwa mishumo zwo vha zwo a ndesa kha adzhenda.
","sixoxe ngemicimbi ebaluleke kakhulu kulutsha kwaye savavanya iindlela esinokuthi singqamanisa izimvo kunye neentshukumo zethu.
",0.21097001
"kha vhaswa vha 1.2 miḽioni vhane vha khou dzhena kha makete wa vhashumi ṅwaha muṅwe na muṅwe, vhane vha ṱoḓa u lingana mbili tsha tshararu vha vha vha vha sa khou shuma kana u guda tshikoloni.
","ngokuqinisekileyo, umba wokufumaneka kwemisebenzi namathuba ubuphambili kwiingxoxo zethu.
",0.2766112
"vhadzheneli kha nyambedzano vho ṱanganedza zwa uri fhungo ḽa mushumo wa vhaswa ḽi khou sedzeswa khaḽo kha ḽevele dza nṱhesa dza muvhuso.
","kwisigidi esi1,2 solutsha esifikelela kwinqanaba lukhangela imisebenzi kunyaka ngamnye, phantse isibini kwisithathu sihlala singasebenzi okanye singafundi.
",0.50568265
"fhedzi mbuelelo ndi i ḓivheaho: vho ḓiimisela na u ḓo u shela mule nzhe kha ikonomi nga nḓila dzo fhambanaho, hu tshi katelwa na vhoramabindu, fhedzi sisiṱeme ya ndaulo i konḓesaho na u sa vha hone ha ndambedzo ya masheleni zwi vha thivhela u ita nga u ralo.
","abathathinxaxheba kwezi ngxoxo bayayichulumancela into yokuba umba wokuqeshwa kolutsha ufumana ingqalelo kwelona nqanaba liphezulu likarhulumente.
",0.5428766
"sa zwe bright hlongwane u bva kha vhaswa vha re kha mabindu afrika tshipembe a mmbudza zwone, hu fanela u vha na ndambedzo ya masheleni ma nzhi a ṋetshedzwaho vhorama bindu vha vhaswa.
","noko kunjalo babonakalisa okwa kuzimisela baziwa ngako: babekulungele kwaye bezimisele ukufaka isandla kuqoqosho ngeendlela ezahlukeneyo, kuquka ukuba ngoosomashi shini, kodwa ubucukubhede obugqithisileyo babasemagunyeni kunye nokusilela kwenkxasomali kuyabathintela ekwenzeni oko.
",0.64115316
"vha tama u vhona tshaka dzo fhambanaho dza zwiimiswa zwa masheleni, zwiimiswa zwa masheleni a mveledziso, vhabindudzi vha phuraivethe, dzifeme dza miko vhe dza phuraivethe khathihi na dzibannga dza zwa mabindu vha tshi ṋetshedza tshikolodo na u betsha kha vhoramabindu vha vhaswa.
","njengoko ubright hlongwane ovela kwiyouth in business south africa endixelele, kufuneka kubekho inkxasomali eya ndisiweyo eya koosomashishi ni abasebatsha.
",0.5590446
