src_text,tgt_text,cosine_score
"siyazi ukuthi ingogwana le ibangwa yini, siyazi nokuthi kufanele senzeni ukuzivikela kobana singazokutheleleka.
","re a tseba hore re tshwanela ho dula re qaqolohane re le batho, le hore re itsheke thajana haeba re ile ra atamelana le bao ba tshwaetsehileng esita le hore re itlalehe dipetlele haeba re na le matshwao.
",0.56447095
"siyazi bona kufuze siqalangane, sizikhethele ngeqadi nayibe sikhe sahlangana nabantu abanesifo secoronavirus , siyazi nokuthi kufuze siye esibhedlela nayibe sinamatshayo wecovid19 .
","re tlameha hore re nne re tswele pele ho tataiswa ke nnete, e seng ke hlokwana la tsela.
",0.48619428
"kumele ngeenkhathi zoke silandele ilwazi eliliqiniso ngezinto ezenzeka mbala, hayi izwangobatjho, kikho kokeesikwenzako.
","e fetile nako eo ka yona mang kapa mang a neng a ka re ha ho motho eo a mo tsebang ya tshwaetsehileng kapa ya anngweng ke kokwanahloko ya corona .
",0.5880064
"kade sadlula isikhathi soku thi abantu bathi abazi muntu onecoronavirus namkha ocaphazelekileko ngayo.
","mothating wa jwale, ho feta neng kapa neng pejana, metswalle ya rona, ba leloko, basebetsimmoho le baahisane, ba hloka kutlwelobohloko le tshehetso ya rona.
",0.53636956
"nje, khulu khulu ukudlula phambilini, abangani bethu, umndenethu, abalingani bethu bomsebenzi kunye nabomakhelwana badinge izwelo nesekelo lethu.
","matsatsing a tlang, dibekeng tse tlang le dikgweding tse tlang, ka dinako tse ding re tla iphumana re nyahame re bile re tshohile ha re ntse re bona manane a batho ba tshwaetsehang le ba shwang a ntse a tswelapele ho eketseha.
",0.52677125
"emalangeni, eemvekeni neenyangeni ezizako, kesinye isikhathi sisezazithola sisevalweni elikhulu, sidane singasazi ukuthi sithatheni sihlanganise nani nasibona basanda abantu abangenwe yingogwana, basanda nabantu ababulawa sisifesi.
","ho ka nna ha etsahala hore jwale dintho di mpefetse le ho feta, empa re na le bonnete ba hore di tla boela di ntlafala.
",0.46141016
"kuzabe kukumbi khulu ngesikhatheso, kodwana kuzakubuye kube ngcono.
","baeletsi ba rona ba tsa saense le tsa bongaka ba re bolelletse hore sekgahla sa ditshwaetso se tla nyoloha ha re ntse re atamela qhoweng ya rona.
",0.55625653
"abososayensi nabodorhodere bekhethu basitjele ukuthiinani labantu abazokungenwa yingogwana le basazokwanda ngokukhamba kwesikhathi nasiya esiqongolweni sesifesi.
","empa qetellong se tla boela se theoha.
",0.2343399
"kodwana nakanjani sizakugcina sirhobhile.
","re tlotla basebetsi ba tsa bophelo bo botle ba lahlehetsweng ke maphelo a bona ka lebaka la ho hlokomela bakudi.
",0.4930102
"siyabathokoza, sibethulela ingwani abasebenzi bezamaphilo ababhubhe basendimeni yokuhlenga abagulako.
","e le ho ba hopola, ha re ipolokeng re be re boloke le baahi ba habo rona ka ho nka boikarabelo.
",0.4974773
"njeke njengesikhumbuzo sabo, asizilonde sihlale siphephile siphephise nezinye izakhamuzi zekhethu ngokwenza okulungi leko ekufuze sikwenze.
","re tla e fenya kokwanahloko ena re be re se ahe botjha setjhaba sa habo rona.
",0.5535948
"sizayehlula ingogwana le sibe siwuvuselele umphakathi welizwe lekhethu.
","re ile ra feta dinakong tsa lefifi la bonkantjana empa re ile ra di hlola.
",0.49761015
"sakhe sabona iinkhathi zobumnyama ezidlula lezi, sadlula kizo besaphundlukela nganeno.
","tlotlo e kgethehileng ho basebetsi ba habo rona ba tlhokomelo ya bophelo bo botle vukuzenzele unnamed lenane la batho ba bolailweng ke kokwanahloko ya corona le sa tswa feta ho 2 000. ho bao ba hlokahetseng, ho teng basebetsi ba tlhokomelo ya bophelo bo botle, le baporofeshenale ba tswileng matsoho ba neng ba hlokomela bakudi, bao e neng e le batshehetsi le batshedisi ho bao ba dipetlele ba tshekilweng ho ba malapa a bona.
",0.49761015
"umlimi/umfuyi omumuntu omutjha ufumana isekelo lesikhwama secovid19 silusapho nyanda umlimi/umfuyi wepumalanga kapa osakhasako ungomunye walabo abasizwa ngeemali zombuso zokubakhokhisa ummoya ebujameni becoronavirus .
","motjha wa sehwai o fumana tshehetso ya covid19 silusapho nyanda sehwai se thuthuang sa kapa botjhabela ke e mong wa ba fotseng molemo letloleng la mmuso la kimollo ya kokwanahloko ya corona.
",0.7088809
"unomagcinandile suduka (oneminyaka ema27) ukhulisa ilifa lakwabo ngokusisisa kezokulima nokufuya.
","nomagcinandile suduka (27) o hodisa lefa le maruo a habo ka ho itahlela ka setotswana temothuong.
",0.72244537
"umnikazi we4 u and 4 me primary cooperative endaweni yemooiplaas usekelwa sikhwama sokukhokhisa ummoya ebujameni becoronavirus (icovid19) somnyango wezokulima, ukubuyiselwa kwenarha nokuthuthukiswa kweendawo zemakhaya ngamaqanda, nefuyo kunye neplasi yokutjala imirorho.
","monga 4 u and 4 me primary cooperative motsaneng wa mooiplaas o fumane tshehetso letloleng la kimollo ya kokwanahloko ya corona (covid19) la lefapha la temothuo, tlha bollo ya mobu le ntshetsopele ya mahae bakeng sa temothuo ya hae ya mahe, diphoofolo le meroho.
",0.7637832
"umnyango ukhuphe amavawutjha wemali eyir1.2 yamabhiliyoni enikelwa abosoplasi abasemtlhagweni.
","lefapha le nanabeditse divaotjhara tsa boleng ba r1.2 bilione ho dihwai tse hlokang ka sebele.
",0.5832425
"unomagcinandile uthi amavawutjha wakhe azamsiza ekukhuliseni ihlangothi lebhizinisi yakhe elisebenza ngamaqanda.
","suduka o re divaotjhara tsa hae di tla mo thusa ho hodisa karolo ya tlhahiso ya mahe kgwebong ya hae.
",0.5629418
"""ngithole amavawutjha amathathu ahlanganisa imali eyir19 000. ivawutjha yer12 000 yokuthenga iinkukhu zamaqanda ezilikhulu, ivawutjha yer6 500 yokuthenga ukudla kween kukhu kunye nevawutjha yer500 yokuthenga iinhlahla.""
","""ke fuwe divaotjhara tse tharo tse etsang r19 000 ha di kopane.
",0.59122235
"uthome iplasakhe yokubhura ngamaqanda ngokupha iinkukhu zekhabo ukudla kokuthengwa okukhulisa iinkukhu, okuzenza zibekele ngaphandle kokuhlangana nemikukurumba.
","ke vaotjhara ya r12 000 ya ho reka dikgoho tsa mahe tse 100, ebe vaotjhara ya r6 500 ya ho reka dijo tsa dikgoho le vaotjhara ya r500 ya ho reka meriana"".
",0.5445794
"iinkukhu zakhe ezima50 njenganje sezibekela ama50 wamaqanda ngelanga, awathengisa qobe veke.
","o qadile kgwebo ya hae ya tlhahiso ya mahe ka ho fepa dikgoho tsa habo tsa setho ka phepokgodiso e ntlafatsang ho behela, e di thusang hore di behele mahe le ha di sa kopana le mekoko.
",0.5938716
"unomagcinandile, obuye abe mfuyi weembuzi ezima73, nezimvu ezima25, neenkomo ezima25 uthome ukusebenza ngeplasi ngomnyaka wee2015 ngemva kokuthola kwakhe isitifikethi sepublic management n6 ekhala training and voca tional education and training college.
","dikgoho tsa hae tse 50 jwale di behela mahe a 50 ka letsatsi mme o a rekisa ka beke le beke.
",0.48900726
"ngemva kokulimuka ukuthi amathuba womsebenzi ayindlala, waqunta ukuthatha iplasi yekhabo abebaziphilisa ngayo wayenza ibhizinisi eyenza imali.
","suduka, ya ruileng le dipodi tse 73, dinku tse 25 le dikgomo tse 25, o qadile thuo ena ya hae ka 2015 kamora ho phethela dithuto tsa public management n6 certificate kholejeng ya thupelo le thuto ya mesebetsi ya matsoho (tvet) ya ikhala.
",0.6355811
"ubeke wathi:""sikhule silima besifuya, ngalokhoke ngemva kokuthola kwami iziqu zefundo ngabona kungcono ngirage umsebenzi wokulima nokufuya kunobanyana ngifune umsebenzi.""
","kamora ho elellwa hore ho na le leqeme la menyetla ya mesebetsi, o ile a qeta ka hore a nke temothuo ya habo ya ho jela hanong mme a e fetole hore e be kgwebo e nang le phaello.
",0.61303854
"lokhuke kubonakele ukuthi kube siqunto esihle esikhuthazako, ngoba zandile iimbuzi neenkomo azifuyileko namhlanjesi.
","suduka o re: ""re hotse re sebetsa mesebetsi ya temo thuo, kahoo, kamora ho qeta dithuto ke ile ka qeta ka hore ke kene temothuong ho e na le ho tsoma mosebetsi.""
",0.5902454
"iplasi kanomagcinandile emahagere amathandathu utjala kiyo umumbu/isiphila, amazambana, iphizi kunye neembhontjisi.
","ena e ile ya bonahala e le qeto e kgothatsang hobane jwale o se a ekeditse lenane la dipodi le la dikgomo.
",0.53517735
"umumbu/isiphila sitjalwa emahagereni amane, amazambana atjalwe ehagereni linye bese kuthi iphizi neembhontjisi zihlanganyele ihagere lokugcina.
","polasi ya suduka ya dihekthara tse tsheletseng e hlahisa poone, ditapole, dierekisi le dinawa.
",0.6741696
"usuduka ufunde okunengi ngecovid19 , khulukhulu ukuthi ilifa lakhe elikhulu kinawo woke zizandla zakhe nokukhuthala.
","poone e lengwa dihekthareng tse nne, ebe ditapole hekthareng e lenngwe mme dinawa le dierekisi di kopantswe hekthareng ya ho qetela.
",0.6277715
unomagcinandile suduka uphendule iplasekhabo yokulimela nokufuyela ukuziphilisa wayenza ibhinizinisi encani.,"motjha wa sehwai o fumana tshehetso ya covid19 silusapho nyanda sehwai se thuthuang sa kapa botjhabela ke e mong wa ba fotseng molemo letloleng la mmuso la kimollo ya kokwanahloko ya corona.
",0.6277715
"isewula afrika isikimela ukulungisa umraro wokutlhayela kweemphefumulisi silusapho nyanda isiphefumulisi esikhandwe khona lapha ekhethu sizakusiza iingulani ezinamatshwayo alula wecovid19 ukuthi ziphefumule lula.
"," afrika borwa e nka dikgato tsa ho rarolla qaka ya kgaello ya dithusaphefumoloho silusapho nyanda sethusaphefumoloho se entsweng kwano lapeng se tla thusa bakudi ba nang le matshwao a fokolang a covid19 ho phefumoloha habobebe.
",0.66861635
"ipi yokulwa nesifo secovid19 esewula afrika iqiniswe amandla siphefumulisi sokuthoma esikhandwe lapha elizweni lekhethu.
","twantsho ya lefu la kokwanahloko ya corona (covid19) afrika borwa e matlafaditswe ke sethusaphefumoloho sa pele se entsweng kahara naha.
",0.6899307
"lesisiphefumulisi, esibizwa ngokuthi yicpap , sisiza iingulani ezinamatshwayo alula wecovid19 ukuphefumula lula ngokupompela isigulani ummoya oneoksijini elingeneko kobanyana iindlela ezikhambisa ummoya emzimbeni zizokuhlala zivulekile.
","sethusaphefumoloho sa continuous positive airway pressure (cpap) se thusa bakudi ba nang le matshwao a fokolang a covid19 ho phefumoloha habobebe, ka ho fana ka kgatello e tlase ya moya o nang le oksijene e le ho boloka dipeipi tsa bona tsa moya di bulehile.
",0.6571932
"lesisiphefumulisi sitlanywe mkhandlu wezokurhubhulula ngesayensi nezamabubulo (icsir), ngokusebenzisana nababelani abambadlwana bakhona lapha ekhethu begodu sizokutholakala kilo loke ilizweli eengulaneni ezitjengisa umgadangiso 1amatshwayo wokwehliwa yicovid19.
","sethusaphefumoloho sena se radilwe ke lekgotla la diphuputso tsa saense le indasteri (csir) ka kopanelo le balekane ba bangatanyana ba kwano lapeng, mme se nanabetswa naha ka bophara ho bakudi ba bonahalang ba na le mathata a phefumoloho qalehong ya tshwaetso ya covid19.
",0.545932
"""ummoya ophefumulwa mumuntu uvamise ukuba nama23% weoksijini.
","""moya oo ka tlwaelo motho a o phefumolohang o na le sekepele sa dipheresente tse 23 tsa oksijene.
",0.71212983
"isiphefumulisi icpap ingapompa umthamo ophezulu weoksijini, isize umuntu ukuphefumula.
","sethusaphefumoloho sa cpap se ka pompa sekepele se phahameng sa oksijene e le ho thusa motho hore a phefumolohe.
",0.62149465
"ungawukhuphula namkha uwehlise umthamo weoksijini ophefumulwa mumuntu,"" kutjho umphathi olawulako kwacsir future production: manufacturing, umartin sanne.
","cpap e pompa motswako wa oksijene motjhaotjhele.
",0.54054505
"iingulani ezisebenzisa isiphefumulisi zifakelwa sona ngemaski.
","o ka eketsa kapa wa fokotsa sekgahla sa oksijene eo motho a e phefumolohang,"" ho rialo molaodi wa phethahatso wa tlhahiso ya kamoso ya csir: manufacturing martin sanne.
",0.4845429
"ioksjini idoswa etankeni yayo bese ihlanganiswa nommoya wemvelo ngesiphefumulisini, ukusuka lapho idluliselwa emaskini bese iphefumulwa sigulani.
","bakudi ba sebedisang sethusaphefumoloho ba hokahantswe ke sekwahelasefahleho.
",0.5301325
"usanne uthi ngaphandle kokupompa ummoya oneoksijini, icpap ibuye godu isize iingulani ukuphefumulela ngaphandle.
","oksijene e hulwa tankeng ya gase ya oksijene mme e tswakwa le moya wa tlhaho o kahara sethusaphefumoloho ebe ho tloha moo e fetisetswa ho sekwahelasefahleho mme mokudi o e phefumolohelwa kahare.
",0.5037931
"isiphefumulisi icpap singasetjenziswa necwephetjhe lezinga eliphezulu kunye neendaweni zesikhatjhana, njengeembhedlela zesikhatjhana zesizo elirhabako kunye neendaweni zokukhethelwa ngeqadi kwabantu nofana zokuvalelwa wedwa.
","sanne o re kahodimo ho ho pompa moya o nang le oksijene, cpap e boela e thusa bakudi ho phefumolohela ka ntle.
",0.60745645
"usanne uthi kuzakuthi kuphela urhoboyi icsir ibe seyikhande iinkulungwana ezilitjhumi zeemphefumulisi.
","""sesebediswa sa cpap se ka sebediswa ditikolohong tsa bongaka ba botekgeniki bo phahameng esita le dibakeng tsa nakwana, tse kang dipetlele tse thokwana le metse esita le ditsheng tsa tshekeho.
",0.5559207
"ngokusebenzisana nesiemens, nesimera, neakacia, negabler, umoya kunye neyunivesithi yekapa, icsir ikhande isiphefumulisi icpap ngokwekambiso namazinga wehlangano yezamaphilo yephasiloke (iwho).
","sanne o re csir e tla be e se e hlahisitse dithusaphefumoloho tse 10 000 mafelong a phato.
",0.6003592
"iimphefumulisi zokuthoma zizokunikelwa iimbhedlela zombuso ezinesidingo khulu ngenca yefuneko yeensetjenziswa zokwelapha icovid19.
","ka ho sebedisana hammoho le siemens, simera, akacia, gabler, umoya le yunivesithi ya cape town, csir e hlahisitse cpap ho ya ka maemo a beilweng ke mokgatlo wa lefatshe wa bophelo bo botle.
",0.6211625
"icsir ithome ukusebenza ngecpap ngemva kobana iphasi loke lithome ukutlhayelelwa ziimphefumulisi khulu.
","lefupe la pele la dithusaphefumoloho le tla abelwa dipetlele tsa mmuso tse nang le kgatello ka lebaka la kgaello ya disebediswa tsa ho lwantsha covid19.
",0.4386106
"""ngeenkhathi zikantaka nosihlabantangana, kuthome ukutlhayela kweemphefumulisi kubasabalalisi bethu bamazwe ngamazwe.
","csir e qadile ho sebetsana le cpap kamora hore lefatshe lohle le qale ho ba le kgaello e kgolo ya dithusaphefumoloho.
",0.56616914
"lapho bezisatholakala khona besele zibiza imali enengi khulu, ngalokhoke urhulumende wakhupha ithenda yokuthi kukhandwe iimphefumulisi,"" kutjho usanne.
","""e ne e ka ba nakong ya tlhakubele le mmesa moo ka tshohanyetso ho bileng le phepelo e fokolang ya dithusaphefumoloho ho tswa ho bafepedi ba rona ba matjhaba.
",0.56450105
"ithenda ekhutjhiweko le beyiyingcenye yehlelo likarhulumende inational ventilator project yelizweloke ngaphasi komnyango wezerhwebo, zamabubulo nezokuphalisana ngokuthengisa.
","moo o neng o ka di fumana teng, di ne di le theko e phahameng haholo mme ka hona mmuso wa ntsha thendara ya tlhahiso ya dithusaphefumoloho,"" ho rialo sanne.
",0.5624872
"icsir isebenza nangesiphefumulisi secpap esimahlangothimabili esinqophe ukusiza iingulani ezinazamatshwayo abukhali wecovid19.
","thendara e ne e le karolo ya projeke ya naha ya dithusaphefumoloho kahare ho lefapha la kgwebisano, indasteri le tlhodisano.
",0.35544148
"lesisiphefumulisi sizakusiza ukuphefumula ngokukhokha ummoya nangokuphefumulela ngaphandle, ngokubeka isiphefumulisi ezingeni lesigandelelo somfutho esijame ndawonye namkha ngokulinganisa umthamo weoksijini efuneka esigulini bese kubekwa umfutho wayo ezingeni elikhambisana nesilinganiswesi."," afrika borwa e nka dikgato tsa ho rarolla qaka ya kgaello ya dithusaphefumoloho silusapho nyanda sethusaphefumoloho se entsweng kwano lapeng se tla thusa bakudi ba nang le matshwao a fokolang a covid19 ho phefumoloha habobebe.
",0.35544148
"sizanihle sikhandele ukurhatjheka kwecovid19 vukuzenzele unnamed isitjhaba sekhethu sisahlelwe mrarokazi omkhulu emlandweni wehlelo lokubusa ngentando yenengi.
","thusa ho thibela ho ata ha covid19 vukuzenzele unnamed setjhaba sa habo rona se hlahetswe ke koduwa e kgolo ka ho fetisisa nalaneng ya demokrasi ya rona.
",0.4552486
"isikhathi esingaphezulu kwamalanga ali120 siphumelele ukuriyadisa ukurhatjheka kwengogwana yecorona engumatjhiyakulilwa ephasini zombelele.
","ka matsatsi a kahodimo ho 120, re ile ra atleha ho diehisa ho ata ha kokwanahloko ena e bakang qomatsi lefatsheng lohle.
",0.6048615
"kodwanake nje, ukukhuphuka kwezinga lokutheleleka kwabantu ngengogwana le esasikuyeleliswe zizazi zokwelapha ukuthi kuzakufika, mbala sekufikile.
","empa jwale nako ya ho eketseha ha ditshwaetso tseo re ileng ra eletswa ka tsona ke ditsebi tsa rona tsa bongaka hore e tla fihla, jwale e fihlile.
",0.583027
"angaphezulu kwekota yesigidi amasewula afrika angenwe yingogwana yecorona begodu siyazi nokuthi banengi abanye ebangenileko esingakabukwazi ngabo.
","maafrika borwa a kahodimo ho kotara ya milione a se a tshwaeditswe ke kokwanahloko ya corona, mme re a tseba le hore ditshwaetso tse ding tse ngata ha di a utollwa.
",0.5925853
"njenganje, qobe lilanga sesibala abantu abangaphezulu kweenkulungwana ezili12 abangenwe yingogwana le.
","ha jwale re ba le ditshwaetso tse ntjha tse kahodimo ho 12 000 letsatsi le letsatsi.
",0.33445558
"solo isifo secovid19 sehla ngenyanga kantaka, ubuncani babo bazii4 079 abantu esele sibabulele.
","haesale lefu lena le ne le qale ho ropoha ka tlhakubele, ke bonnyane ba batho ba 4 079 ba shweleng ka lebaka la covid19.
",0.70358324
"njengamakhaza amakhulu embatha ilizwe lekhethu avela elwandlekazi isouth atlantic ngalesisikhathi somnyaka, kuneengcenye ezimbadlwana zelizweli ezizakuhlala zingakacaphazeleki.
","jwaloka maqhubu a mangata a mohatsela a parolang naha ya rona a hlaha ka borwa ho atlantic nakong ena ya selemo, ho na le dikgutlwana tse mmalwa naheng ya rona tseo kokwanahloko ya corona e sa tlo fihla ho hang ho tsona.
",0.6518129
"isiwuruwuru sengogwana icorona size ngobukhali obukhulu begodu sinamandla wokubhubhisa ukudlula koke esakhe sakubona phambilini.
","sefefo sa kokwanahloko ya corona se kotsi ebile se ruthutha le ho feta kokwanahloko efe kapa efe eo re kileng ra e tseba.
",0.4608981
"sikukuruja imithombo yethu yamandla nekghono lethu ukufika ekugcineni.
","e monyolla mehlodi le ditjhelete tsa rona ho isa moo di fellang teng.
",0.51876616
"kufikile kwanje ukukhuphuka kwesibalo sabantu abatheleleka ngengogwana abososayensi bekhethu ababekuphengule eenyangeni ezintathu ezidlulileko.
","keketseho ya ditshwaetso tseo ditsebi le boramahlale ba rona ba ileng ba e lepa dikgweding tse kahodimo ho tse tharo tse fetileng, jwale e fihlile.
",0.4629091
"kuthome etjingalanga kapa kantike njenganje sekusahlele epumalanga kapa negauteng.
","e qadile kapa bophirimela mme jwale e ntse e ata kapa botjhabela le gauteng.
",0.6353722
"kodwanake nanyana isibalo sabantu abatheleleka ngengogwana sikhuphuka ngamandla kangaka nje, kuqakathekile ukuthi sitjheje ukuthi isibalo sabantu ababulawa yingogwana le lapha ekhethu sihlangana neembalo eziphasi khulu ephasini loke, njengoba siyi1.5% nje.
","empa leha ditshwaetso di eketseha ka potlako hakaalo, ho bohlokwa ho tseba hore sekgahla sa ho shwa ha batho ba habo rona sa 1.5% ke se seng sa tse tlase ka ho fetisisa lefatsheng.
",0.50382435
"lesisibaloke silinganiswa nesilinganiso sabantu ababulawa yingogwana yecorona abayi4.4%.
","sena ke papisong le sekgahla se tlwaelehileng lefatsheng lohle sa 4.4% ya batho ba shwang.
",0.66670644
"ukuthi sibe nesibalo esiphasi sabantu ababulawa yingogwana elizweni lekhethweli kungenca yelimuko nokuzinikela kwabosokghonofundwa bezamaphilo bekhethu kunye namagadango arhabako esiwathetheko ukwakha amandla wehlelo lethu lezamaphilo.
","re na le palo ena e tlase ya mafu naheng ya rona ka lebaka la boiphihlelo le boikitlaetso ba diporofeshenale tsa rona tsa bophelo bo botle, esita le mehato ya tshohanyetso eo re e nkileng ho aha bokgoni ba tsamaiso ya rona ya bophelo bo botle.
",0.56728643
"ngitjho nanyana ubunengi babantu bekhethu bathethe igadango lokukhandela ukurhatjheka kwengogwana le nje, abanye akhange bakwenze lokho.
","leha boholo ba batho ba habo rona ba nkile dikgato tsa ho thibela ho ata ha kokwanahloko ena, ho na le ba bang ba sa itshwenyang ka ho etsa jwalo.
",0.18204978
"kunabanye bethu abayeqisa amehlo imilayelo nemibandela ephasiselwe ukukhandela isifesi.
","ho na le ba bang kahara rona mona ba sa natseng melawana e beilweng ya ho kgina lefu lena.
",0.5722097
"kilesisifo esirhageleko, ukungena ngeteksini ngaphandle kwemaski, ukubuthana nihlangane nabangani, ukuya emaphathini namkha ngitjho nokuvakatjhela umndeni imbala, nakho kungayirhatjha ingogwana le bekubulale nabantu.
","setsiketsing sa sewa sena, ho kena ka tekesing ho sa kenngwa sekwahelanko le molomo, mmoka wa ho teana le metswalle, ho ya meketjaneng kapa hona ho etela ba leloko, ho ka akofisa ho ata ha kokwanahloko ena habobebe ho be ho fete le maphelo a batho.
",0.6245653
"lesi kungaba sisifo esibangwa yingogwana, kodwana sirhatjhwa yindlela abantu abazipatha ngayo.
","lena e ka nna ya eba lefu leo sesosa sa lona e leng kokwanahloko, empa lona le ata ka lebaka la boitshwaro ba batho.
",0.50688016
"ngezenzo zethu – umuntu ngamunye, simndeni, simphakathi – singakghona begodu kufanele sitjhugulule ubujamo bezinto ngalesisifo esisirhagaleleko ekhethwapha.
","ka diketso tsa rona, re le batho ka bomong, re le malapa, re le setjhaba, re ka kgona ebile re tlameha ho fetola ho ata ha sewa sena naheng ya rona.
",0.64485395
"kufuze sifake imaski evala umlomo nepumulo qobe nasiphuma ekhaya.
","re lokela ho rwala sekwahelanko le molomo sa lesela se kwahelang nko le molomo kgafetsa ha re tloha malapeng.
",0.6183939
"kufuze siragele phambili ngokuhlala sihlamba izandla ngamanzi nesibha namkha ngesihlanzekisi.
","re lokela ho tswela pele ho hatlela matsoho a rona ka metsi le sesepa kapa ka sebolayadikokwanahloko kgafetsa .
",0.5484502
"kufuze siragele phambili ngokuhlanzekisa ilingaphezulu lezinto ezinjengamakhawunthara nobubeko kizo zoke iindawo ezisetjenziswa linengi labantu.
","re tlameha ho tswela pele ho hlwekisa le ho nyanyatsa bokahodimo ba dibaka tsohle, dibakeng tsohle tseo ho phetheselang setjhaba ho tsona.
",0.5661458
"ngaphezu kwakho koke, kufuze siqalangane nabanye abantu – ubuncani bakhona ngamamitha amabili.
","taba ya bohlokwa ka ho fetisisa ke ya hore re tlameha ho siya sebaka se bolokehileng sa bonyane ba dimithara tse pedi dipakeng tsa rona le batho ba bang.
",0.566412
"kunobufakazi obutjha obuvelako obuthi kungenzeka ukuthi ingogwana yecorona le ikhamba nangommoya eendaweni lapho abantu baminyezelene khona, eendaweni ezivalekileko namkha eendaweni lapho ummoya ungangeni khona kuhle.
","jwale ho na le bopaki bo botjha ba hore kokwanahloko ena e ka nna ya fetiswa ka dikarolwana tse nyenyane haholo tse moyeng dibakeng tseo ho tsona ho subuhlellaneng batho, tse kwalehileng kapa tse nang le lephallo le fokolang la moya.
",0.58612365
"ngenca yalokhu, kufuze silenze libe ngcono ingaphakathi leendawo zomphakathi lapho ingozi yokuthelelana iphezulu khona khulu.
","ka lebaka lena, re tlameha ho ntlafatsa bokahare ba tikoloho ya dibaka tse phetheselang batho, moo kotsi ya tshwaetso e leng kgolo ka ho fetisisa.
",0.27155668
"isiqunto sethu sokumemezela imilayelo yokuqinteliswa kwamakhambo sakhandela ukutheleleka kwabantu ngobunengi ngengogwana le ukube kanti amaziko wethu wezamaphilo ayengakakulungeli ukuqalana nobujamo obunjalo ngesikhatheso, njengoba lokho kwakuzakwenza ukuthi kubhubhe abantu abanengi khulu.
","qeto ya rona ya ho phatlalatsa ho kginwa ha metsamao ya batho le ditshebeletso tseo e seng tsa mantlha naha ka bophara, e ile ya thibela sekgahla se hodimo sa keketseho ya ditshwaetso di sa tloha ha ditshebeletso tsa rona tsa bophelo bo botle di ne di so loke hantle, e leng ntho e neng e ka baka ho shwa ha batho ba bangata le ho feta.
",0.34225202
"ngesikhathi esibe naso, sithethe amagadango aqakathekileko wokuqinisa amandla wehlelo lethu lezamaphilo wokulwa nesifesi.
","ka nako eo re bileng le yona, re nkile mehato ya bohlokwa ya ho matlafatsa karabelo ya rona mabapi le bophelo bo botle.
",0.47967932
"bangaphezulu kweengidi ezimbili abantu esele sibahlolele ukuthi abakangenwa yingogwana yecorona na, kantike bangaphezulu kwama20 weengidi abantu esele bakhanyiswe basebenzi bomphakathi abaqala ukuthi abantu abanamatshayo wengogwana yecorona na.
","re se re entse diteko tsa kokwanahloko ya corona tse kahodimo ho dimilione tse pedi mme basebeletsi ba setjhaba ba tsa bophelo bo botle ba se ba entse ditlhahlobo tse kahodimo ho dimilione tse 20. re fumane dibethe tse ka bang 28 000 tsa dipetlele bakeng sa bakudi ba covid19 ra ba ra aha dipetlele tse sebetsang tse thokwana le metse ho pharalla le naha.
",0.68722326
"sithenge imibhede elinganiselwa ema28 000 eembhedlela lapho kuzakulaliswa khona iingulani zecovid19 sabe sakha iimbhedlela zesikhatjhana zesizo elirhabako kilo loke ilizweli.
","jwale re na le dibethe tsa tshekeho tse kahodimo ho 37 000 ditsing tsa kokelo tsa poraefete esita le tsa setjhaba ho pharalla le naha, mme di malalaalaotswe ho tsheka bao ba sa kgoneng ho itsheka malapeng a bona.
",0.6012789
"njeke sesinemibhede engaphezulu kwama37 000 yeengulani ezivalelwe zodwa eembhedlela zangeqadi nezombuso elizweni lokeli, elindele ukukhethela ngeqadi labo abangeze bakghone ukuzikhethela ngeqadi emakhaya.
","re ile ra fumana ra ba ra fana ka dimilione tsa thepa ya boitshireletso dipetleleng, ditleliniking le dikolong ho pharalla le naha ho basebetsi ba habo rona ba tshwereng teu.
",0.5998517
"sikhande sabe sadiliva iingidigidi zepahla yokuzivikela (amappe) eembhedlela, ematlinigi neenkolweni kilo loke ilizweli ngehloso yokuvikela abasebenzi bekoro yezamaphilo abamaforosi kilepi.
","re thaothile ebile re ntse re tswela pele ho thaotha baoki ba tlatsetso, dingaka le basebetsi ba ditshebeletso tsa tshohanyetso tsa bophelo bo botle.
",0.5482248
"siqatjhile, sisaqatjha ukuya phambili, siqatjha abanye abahlengikazi, abanye abodorhodere kunye nabanye abasebenzi besizo lezamaphilo elirhabako.
","re tswela pele ho etsa kgatelopele mekutung ya rona ya ho lwantsha covid 19, empa phephetso ya rona e kgolo e sa ntse e tla.
",0.5434154
