src_text,tgt_text,cosine_score
"die cpapventilator kan meer suurstof pomp en sodoende 'n pasiënt help om asem te haal.
","isiphefumulisi icpap ingapompa umthamo ophezulu weoksijini, isize umuntu ukuphefumula.
",0.643511
"die cpap kan deurlopend gekonsentreerde suurstof pomp.
","ungawukhuphula namkha uwehlise umthamo weoksijini ophefumulwa mumuntu,"" kutjho umphathi olawulako kwacsir future production: manufacturing, umartin sanne.
",0.516625
"’n mens kan die hoeveelheid suurstof wat ’n pasiënt inasem, verhoog of verlaag,"" sê die uitvoerende bestuurder van die wnnr se future production manufacturing, martin sanne.
","iingulani ezisebenzisa isiphefumulisi zifakelwa sona ngemaski.
",0.49581897
"pasiënte wat met die ventilator behandel word, word deur 'n gesigmasker aan die ventilator gekoppel.
","ioksjini idoswa etankeni yayo bese ihlanganiswa nommoya wemvelo ngesiphefumulisini, ukusuka lapho idluliselwa emaskini bese iphefumulwa sigulani.
",0.6071602
"suurstof word uit 'n suurstoftenk gepomp en met natuurlike lug in die ventilator gemeng, waarvandaan dit na die masker oorgedra word en deur die pasiënt ingeasem word.
","usanne uthi ngaphandle kokupompa ummoya oneoksijini, icpap ibuye godu isize iingulani ukuphefumulela ngaphandle.
",0.5112885
"sanne sê benewens die inpomp van suurstofhoudende lug, help die cpap pasiënte ook om uit te asem.
","isiphefumulisi icpap singasetjenziswa necwephetjhe lezinga eliphezulu kunye neendaweni zesikhatjhana, njengeembhedlela zesikhatjhana zesizo elirhabako kunye neendaweni zokukhethelwa ngeqadi kwabantu nofana zokuvalelwa wedwa.
",0.6306795
"die cpapventilator kan in hoëtegnologie kliniese omgewings, sowel as tydelike instellings soos veldhospitale en kwarantyngeriewe gebruik word.
","usanne uthi kuzakuthi kuphela urhoboyi icsir ibe seyikhande iinkulungwana ezilitjhumi zeemphefumulisi.
",0.6290557
"sanne sê die wnnr sal teen einde augustus 10 000 ventilators kan vervaardig.
","ngokusebenzisana nesiemens, nesimera, neakacia, negabler, umoya kunye neyunivesithi yekapa, icsir ikhande isiphefumulisi icpap ngokwekambiso namazinga wehlangano yezamaphilo yephasiloke (iwho).
",0.5427308
"in samewerking met siemens, simera, akacia, gabler, umoya en die universiteit van kaapstad, het die wnnr die cpap volgens die standaarde van die wêreldgesondheidsorganisasie vervaardig.
","iimphefumulisi zokuthoma zizokunikelwa iimbhedlela zombuso ezinesidingo khulu ngenca yefuneko yeensetjenziswa zokwelapha icovid19.
",0.6338238
"die eerste stel ventilators sal aan staatshospitale voorsien word wat onder druk is weens die tekort aan toerusting om covid19 te hanteer.
","icsir ithome ukusebenza ngecpap ngemva kobana iphasi loke lithome ukutlhayelelwa ziimphefumulisi khulu.
",0.49005753
"die wnnr het aan die cpap begin werk nadat daar wêreldwyd 'n ernstige tekort aan ventilators ontstaan het.
","""ngeenkhathi zikantaka nosihlabantangana, kuthome ukutlhayela kweemphefumulisi kubasabalalisi bethu bamazwe ngamazwe.
",0.60458106
"""teen ongeveer maart en april was daar skielik ’n tekort aan ventilators van ons internasionale verskaffers.
","lapho bezisatholakala khona besele zibiza imali enengi khulu, ngalokhoke urhulumende wakhupha ithenda yokuthi kukhandwe iimphefumulisi,"" kutjho usanne.
",0.5181173
"as ’n mens dit in die hande kon kry, was dit baie duur; die regering het daarom ’n tender vir die vervaardiging van ventilators uitgereik,"" sê sanne.
","ithenda ekhutjhiweko le beyiyingcenye yehlelo likarhulumende inational ventilator project yelizweloke ngaphasi komnyango wezerhwebo, zamabubulo nezokuphalisana ngokuthengisa.
",0.5348327
"die tender was deel van die regering se nasionale ventilatorprojek in die departement van handel, nywerheid en mededinging.
","icsir isebenza nangesiphefumulisi secpap esimahlangothimabili esinqophe ukusiza iingulani ezinazamatshwayo abukhali wecovid19.
",0.35603952
"die wnnr werk ook aan 'n tweevlakpositiewe lugwegdrukventilator wat daarop gerig is om pasiënte met meer ernstige covid19simptome te behandel.
","isewula afrika isikimela ukulungisa umraro wokutlhayela kweemphefumulisi silusapho nyanda isiphefumulisi esikhandwe khona lapha ekhethu sizakusiza iingulani ezinamatshwayo alula wecovid19 ukuthi ziphefumule lula.
",0.35603952
"help om die verspreiding van covid19 te stuit vukuzenzele unnamed ons nasie staar die ernstigste krisis in die geskiedenis van die land se demokrasie in die gesig.
","sizanihle sikhandele ukurhatjheka kwecovid19 vukuzenzele unnamed isitjhaba sekhethu sisahlelwe mrarokazi omkhulu emlandweni wehlelo lokubusa ngentando yenengi.
",0.44116127
"ons het meer as 120 dae lank daarin geslaag om die verspreiding van 'n virus wat verwoesting oor die hele wêreld saai, te verlangsaam.
","isikhathi esingaphezulu kwamalanga ali120 siphumelele ukuriyadisa ukurhatjheka kwengogwana yecorona engumatjhiyakulilwa ephasini zombelele.
",0.6551404
"maar die styging in infeksies wat deur ons mediese spesialiste voorspel is, het nou begin.
","kodwanake nje, ukukhuphuka kwezinga lokutheleleka kwabantu ngengogwana le esasikuyeleliswe zizazi zokwelapha ukuthi kuzakufika, mbala sekufikile.
",0.62170696
"meer as 'n kwartmiljoen suidafrikaners het die koronavirus opgedoen, en ons weet dat baie meer infeksies nie aangemeld word nie.
","angaphezulu kwekota yesigidi amasewula afrika angenwe yingogwana yecorona begodu siyazi nokuthi banengi abanye ebangenileko esingakabukwazi ngabo.
",0.6534988
"meer as 12 000 nuwe gevalle word nou daagliks aangeteken.
","njenganje, qobe lilanga sesibala abantu abangaphezulu kweenkulungwana ezili12 abangenwe yingogwana le.
",0.3870072
"sedert die begin van die uitbreking in maart, het minstens 4 079 mense weens covid19 gesterf.
","solo isifo secovid19 sehla ngenyanga kantaka, ubuncani babo bazii4 079 abantu esele sibabulele.
",0.6909138
"soos die massiewe koue fronte wat hierdie tyd van die jaar ons land vanuit die suidatlantiese oseaan binnestroom, is daar min dele van die land wat nie deur die koronavirus geraak word nie.
","njengamakhaza amakhulu embatha ilizwe lekhethu avela elwandlekazi isouth atlantic ngalesisikhathi somnyaka, kuneengcenye ezimbadlwana zelizweli ezizakuhlala zingakacaphazeleki.
",0.69866747
"die koronavirusstorm is baie feller en meer vernietigend as enigiets wat ons voorheen beleef het.
","isiwuruwuru sengogwana icorona size ngobukhali obukhulu begodu sinamandla wokubhubhisa ukudlula koke esakhe sakubona phambilini.
",0.4268905
"dit plaas ongekende druk op ons hulpbronne en ons vasberadenheid.
","sikukuruja imithombo yethu yamandla nekghono lethu ukufika ekugcineni.
",0.57608
"die styging van infeksies wat ons deskundiges en wetenskaplikes meer as drie maande gelede voorspel het, is nou met ons.
","kufikile kwanje ukukhuphuka kwesibalo sabantu abatheleleka ngengogwana abososayensi bekhethu ababekuphengule eenyangeni ezintathu ezidlulileko.
",0.5005731
"dit het in die weskaap begin en na die ooskaap en gauteng uitgebrei.
","kuthome etjingalanga kapa kantike njenganje sekusahlele epumalanga kapa negauteng.
",0.64639854
"hoewel infeksies eksponensieel styg, is dit belangrik om daarop te let dat ons sterftesyfer van 1,5 persent onder die laagste ter wêreld is.
","kodwanake nanyana isibalo sabantu abatheleleka ngengogwana sikhuphuka ngamandla kangaka nje, kuqakathekile ukuthi sitjheje ukuthi isibalo sabantu ababulawa yingogwana le lapha ekhethu sihlangana neembalo eziphasi khulu ephasini loke, njengoba siyi1.5% nje.
",0.5444703
"dit word vergelyk met 'n wêreldwye gemiddelde sterftesyfer van 4,4 persent.
","lesisibaloke silinganiswa nesilinganiso sabantu ababulawa yingogwana yecorona abayi4.4%.
",0.6734094
"ons kan die betreklik lae aantal sterftes in ons land toeskryf aan die ervaring en toewyding van ons gesondheidswerkers en die dringende maatreëls wat ons getref het om die kapasiteit van ons gesondheidstelsel op te bou.
","ukuthi sibe nesibalo esiphasi sabantu ababulawa yingogwana elizweni lekhethweli kungenca yelimuko nokuzinikela kwabosokghonofundwa bezamaphilo bekhethu kunye namagadango arhabako esiwathetheko ukwakha amandla wehlelo lethu lezamaphilo.
",0.57584333
"hoewel die meeste van ons mense voorkomingsmaatreëls om die verspreiding van die virus te beperk, nakom, is daar ander wat dit nie doen nie.
","ngitjho nanyana ubunengi babantu bekhethu bathethe igadango lokukhandela ukurhatjheka kwengogwana le nje, abanye akhange bakwenze lokho.
",0.21973026
"daar is mense in ons geledere wat die regulasies wat ingestel is om die siekte te bestry, ignoreer.
","kunabanye bethu abayeqisa amehlo imilayelo nemibandela ephasiselwe ukukhandela isifesi.
",0.56423116
"te midde van so 'n pandemie, kan mense se optrede soos om in 'n taxi te klim sonder 'n gesigmasker; saam met vriende te kuier; partytjies by te woon of selfs familie te besoek, die virus maklik laat versprei en lewens in gevaar stel.
","kilesisifo esirhageleko, ukungena ngeteksini ngaphandle kwemaski, ukubuthana nihlangane nabangani, ukuya emaphathini namkha ngitjho nokuvakatjhela umndeni imbala, nakho kungayirhatjha ingogwana le bekubulale nabantu.
",0.60657334
"hoewel dit 'n siekte is wat deur 'n virus veroorsaak word, word dit deur menslike optrede en gedrag versprei.
","lesi kungaba sisifo esibangwa yingogwana, kodwana sirhatjhwa yindlela abantu abazipatha ngayo.
",0.5291735
"deur ons eie optrede – as individue, as gesinne, as gemeenskappe – kan en moet ons die verloop van hierdie pandemie in ons land verander.
","ngezenzo zethu – umuntu ngamunye, simndeni, simphakathi – singakghona begodu kufanele sitjhugulule ubujamo bezinto ngalesisifo esisirhagaleleko ekhethwapha.
",0.65082717
"elke keer as ons uit ons huise gaan, moet ons 'n materiaalmasker dra wat ons neus en mond bedek.
","kufuze sifake imaski evala umlomo nepumulo qobe nasiphuma ekhaya.
",0.559057
"ons moet steeds gereeld ons hande met seep en water of ontsmetmiddel was.
","kufuze siragele phambili ngokuhlala sihlamba izandla ngamanzi nesibha namkha ngesihlanzekisi.
",0.5643177
"ons moet aanhou om alle oppervlakke in alle openbare ruimtes te reinig en te ontsmet.
","kufuze siragele phambili ngokuhlanzekisa ilingaphezulu lezinto ezinjengamakhawunthara nobubeko kizo zoke iindawo ezisetjenziswa linengi labantu.
",0.5504422
"die belangrikste is dat ons 'n veilige afstand – minstens 2 meter – van ander mense af moet hou.
","ngaphezu kwakho koke, kufuze siqalangane nabanye abantu – ubuncani bakhona ngamamitha amabili.
",0.52343917
"daar kom tans bewyse aan die lig dat die virus ook in klein deeltjies deur die lug oorgedra kan word in plekke wat oorvol of toe is, of waar die lugsirkulasie swak is.
","kunobufakazi obutjha obuvelako obuthi kungenzeka ukuthi ingogwana yecorona le ikhamba nangommoya eendaweni lapho abantu baminyezelene khona, eendaweni ezivalekileko namkha eendaweni lapho ummoya ungangeni khona kuhle.
",0.64419335
"om dié rede moet ons die binnenshuise omgewing onmiddellik verbeter op openbare plekke waar die risiko vir besmetting die grootste is.
","ngenca yalokhu, kufuze silenze libe ngcono ingaphakathi leendawo zomphakathi lapho ingozi yokuthelelana iphezulu khona khulu.
",0.3073179
"ons besluit om 'n landwye inperking te verklaar toe ons gesondheidsdienste nog nie voldoende voorberei was nie, het ’n massiewe aanvanklike styging in infeksies sowel as meer lewensverliese voorkom.
","isiqunto sethu sokumemezela imilayelo yokuqinteliswa kwamakhambo sakhandela ukutheleleka kwabantu ngobunengi ngengogwana le ukube kanti amaziko wethu wezamaphilo ayengakakulungeli ukuqalana nobujamo obunjalo ngesikhatheso, njengoba lokho kwakuzakwenza ukuthi kubhubhe abantu abanengi khulu.
",0.41760963
"ons het in die tyd wat ons tot ons beskikking gehad het, belangrike maatreëls getref om ons gesondheidsrespons te versterk.
","ngesikhathi esibe naso, sithethe amagadango aqakathekileko wokuqinisa amandla wehlelo lethu lezamaphilo wokulwa nesifesi.
",0.55880344
"ons het meer as twee miljoen koronavirustoetse gedoen en gemeenskapsgesondheidswerkers het meer as 20 miljoen siftings voltooi.
","bangaphezulu kweengidi ezimbili abantu esele sibahlolele ukuthi abakangenwa yingogwana yecorona na, kantike bangaphezulu kwama20 weengidi abantu esele bakhanyiswe basebenzi bomphakathi abaqala ukuthi abantu abanamatshayo wengogwana yecorona na.
",0.63454735
"ons het bykans 28 000 hospitaalbeddens beskikbaar gestel vir covid19 pasiënte en het funksionele veldhospitale regoor die land opgerig.
","sithenge imibhede elinganiselwa ema28 000 eembhedlela lapho kuzakulaliswa khona iingulani zecovid19 sabe sakha iimbhedlela zesikhatjhana zesizo elirhabako kilo loke ilizweli.
",0.7244041
"ons het nou meer as 37 000 kwarantynbeddens in private en openbare fasiliteite regdeur die land, wat gereed is om mense te isoleer wat dit nie tuis kan doen nie.
","njeke sesinemibhede engaphezulu kwama37 000 yeengulani ezivalelwe zodwa eembhedlela zangeqadi nezombuso elizweni lokeli, elindele ukukhethela ngeqadi labo abangeze bakghone ukuzikhethela ngeqadi emakhaya.
",0.6967759
"om ons frontliniewerkers te beskerm, het ons miljoene artikels persoonlike beskermende toerusting by hospitale, klinieke en skole regdeur die land aangekoop en afgelewer.
","sikhande sabe sadiliva iingidigidi zepahla yokuzivikela (amappe) eembhedlela, ematlinigi neenkolweni kilo loke ilizweli ngehloso yokuvikela abasebenzi bekoro yezamaphilo abamaforosi kilepi.
",0.6306477
"ons het ook bykomende verpleegkundiges, dokters en noodgesondheidspersoneel gewerf en werf steeds meer.
","siqatjhile, sisaqatjha ukuya phambili, siqatjha abanye abahlengikazi, abanye abodorhodere kunye nabanye abasebenzi besizo lezamaphilo elirhabako.
",0.58306074
"ons maak vordering met ons pogings om covid19 te hanteer, maar ons grootste uitdaging lê nog voor.
","solo siya phambili ngemizamo yethu yokulwa necovid19, kodwana umsebenzi omkhulu useza.
",0.63822865
"ons werk in al die provinsies daaraan om meer beddens in die algemene sale, sowel as vir kritieke covid19pasiënte beskikbaar te stel.
","kizo zoke iimfunda, sisebenzela ukwandisa amawodi ajayelekileko nemibhede eqakathekileko ezakulalisa iingulani zecovid19.
",0.65144736
"kapasiteit in algemene sale word in verskeie hospitale geskep deur gevalle wat minder dringend is tot later uit te stel, sommige hospitaalruimtes in bykomende sale te omskep en veldhospitale op te rig of uit te brei.
","umthamo wamawodi uyandiswa eembhedlela ezinengi, ngokuriyadisa itjhejo lokwelapha elingakarhabeki, ukutjhugululwa kweendawo ezithileko zeembhedlela kobanyana zisebenze njengamawodi kunye nokwakhiwa namkha ukukhuliswa kweembhedlela zesikhatjhana zesizo elirhabako.
",0.6434644
"ons werk daaraan om groter hoeveelhede suurstof, ventilators en ander toerusting vir diegene wat kritieke sorg verg beskikbaar te stel, deur onder meer die toevoer van suurstof vanaf ander bronne te herlei.
","sisebenzela ukwandiswa ukuphakiswa kweoksijini, iimphefumulisi nezinye iinsetjenziswa kilabo abadinge itjhejo khulu, ekubalwa hlangana nakho nokuphambukiswa kweoksijini keminye imisebenzi ebekufuze iyenze, ibuyiselwe ekusizeni ukuphefumulisa abantu abaphathekileko.
",0.6315618
"ons gebruik digitale tegnologieë om die identifisering, opsporing en isolasie van kontakte uit te brei en om ondersteuning te bied aan diegene wat positief toets.
","saba ithekhnoloji yokuqinisa umsebenzi wokuthola, ukulandelela kunye nokukhethela ngeqadi abantu abakhe baba seduze nabantu abangenwe yicovid19, kunye nokusekela labo abangenwe yingogwana yecorona.
",0.4615683
"namate ons die hoogtepunt van infeksies nader, moet ons meer voorsorg tref en bestaande maatreëls verskerp om die oordragtempo te vertraag.
","njengoba nje silalamela isiqongolo sokutheleleka kwabantu nje, kufuze sitjheje siyelele khulu, siqinise amagadango nemibandela ekhona njenganje ukuphungula ukurhatjheka kwengogwana le.
",0.61466426
"die regulasies oor die dra van maskers word verskerp.
","imithetholawulo ngokufakwa kwamamaski izokuqiniswa.
",0.5607107
"werkgewers, winkeleienaars en bestuurders, openbare vervoeroperateurs en bestuurders, sowel as eienaars van enige ander openbare gebou is nou wetlik verplig om te sorg dat elkeen wat hul perseel of voertuig betree, 'n masker moet dra.
","abaqatjhi, abosositolo kunye nabaphathi bemisebenzi, bezokuthutha umphakathi, abaphathi nabanikazi bemakho yomphakathi kwanje sebakatelelwa mthetho ukuqinisekisa ukuthi nanyana ngubani ongena endawenabo kumele afake imaski, ngokunjalo nanyana ngubani ongena endaweni ngomodoro ungena afake imaski.
",0.6694601
"taxi’s wat plaaslike reise onderneem, sal nou toegelaat word om hul kapasiteit tot 100 persent te verhoog, terwyl langafstandtaxi's nie toegelaat sal word om 70 persent besetting te oorskry nie, op voorwaarde dat nuwe protokolle vir risikovermindering wat met maskers, ontsmetting van voertuie en oop vensters verband hou, gevolg word.
","amateksi athuthela abakhweli ngemzini esesifundeni sinye kwanje selavunyelwa ukukhuphula umthamo wawo, akhweze azalise, ukube amateksi akhamba ibanga elide hlangana neemfunda akazukuvunyelwa ukudlula ama70% womthamo wokukhweza abantu, ibe koke lokhu kwenziwa kulandelwa imibandela yokuhlonitjhwa kwemilayelo emitjha ephathelene nokufakwa kwamamaski enqophe ukuphungula ubungozi bokutheleleka, neyokuhlanzekisa amateksi kunye neyokuvulwa kwamafesidiri.
",0.6962557
"duidelike bewyse het nou aan die lig gekom dat die hervatting van alkoholverkope daartoe gelei het dat hospitale, insluitend traumaen intensiewesorgeenhede, onder aansienlike druk geplaas is weens motorongelukke, geweld en ander alkoholverwante trauma.
","sekunobufakazi obukhanya kuhle bokuthi ukuvulwa kokuthengiswa kotjwala kuthwese iimbhedlela umthwalo obudisi, kwadisibezeka namaphiko weembhedlela aqalene neenhlekelele nokukhubala kumbi emzimbeni, neendawo zokwelaphela abaphatheke khulu, ngenca yeengozi zeemodere, inturhu nokukhubala kumbi okukhambisana nalokho.
",0.6983252
"ons het derhalwe besluit om die verbod op die verkoop en verspreiding van alkohol weer in te stel om die druk op hospitaalkapasiteit te verlig.
","ngenca yalokhuke, siqunte ukuthi sikujamise tsi ukuthengiswa, ukukhutjhwa, ukudilivwa nokusatjalaliswa kotjwala ukusukela khona nje.
",0.54473627
"as 'n bykomende maatreël om die druk op hospitale te verminder, sal 'n aandklokreël tussen 21:00 en 04:00 van krag wees.
","njengegadango elisingezelelo sokuphungulela iimbhedlela umthwalo, kuzokusebenza umthetho wewatjhi okhandela abantu ukuba ngaphandle kwamakhaya wabo ukusukela ngeiri le9 ebusuku ukuyokufika ngeiri lesi4 ekuseni.
",0.63812876
"ons is ten volle bewus daarvan dat die instelling van hierdie maatreëls onwelkome beperkings op mense se alledaagse lewens plaas.
","sithatha amagadango lawa nje silimuka kuhle ukuthi abantu angeze bakuthokozele nakancani ukuqinteliswa kwezinto ezibathokozisako.
",0.58065474
"dit is egter noodsaaklik om ons deur die hoogtepunt van die siekte te dra.
","nokhoke kuyafuneka ukuthi kwenziwe lokhu, nasizakuphumelela ukudlula kilesisigaba sesiqongolo sesifo secovid19.
",0.51681125
"daar is geen manier hoe ons die aanslag van die koronavirus kan vryspring nie.
","akunandlela esingasikhandela ngaso isiwuruwurwesi sengogwana yecorona.
",0.5256149
"maar ons kan die skade wat dit in ons lewens kan aanrig, beperk.
","kodwana nokho singawuphungula umonakalo esingawenza epilwenethu.
",0.44147927
"ons het as 'n nasie saamgestaan om mekaar te ondersteun, om troos te bied aan siekes en om aanvaarding vir dié wat nog die virus het, te bevorder.
","njengesitjhaba sibuthanele ukusekelana, ukududuza abagulako nokukhuthaza ukwamukelwa kwabantu abangenwe yingogwana yecorona.
",0.6014394
"nou, meer as ooit tevore, is ons verantwoordelik vir die lewens van diegene rondom ons.
","nje, khulu kunaphambilini, siyithwele emahlombe wethu ipilo yabantu esihlala nabo.
",0.43714616
"ons sal hierdie storm oorleef.
","sizakudlula kilesisiwuruwuru.
",0.33794093
"ons sal toesien dat ons land weer gesond en voorspoedig word.
","sizalibuyisela epilweni ehle nepumelelweni yomnotho ilizwe lekhethu.
",0.49525476
ons sal oorwin.,"sizanihle sikhandele ukurhatjheka kwecovid19 vukuzenzele unnamed isitjhaba sekhethu sisahlelwe mrarokazi omkhulu emlandweni wehlelo lokubusa ngentando yenengi.
",0.49525476
"vereer vroue deurvereer vroue deurekonomiese insluitingekonomiese insluiting vukuzenzele unnamed suidafrika vier in augustus vrouemaand.
"," sigidinga abomma ngokubaqalelela kezomnotho ngokubaqalelela kezomnotho vukuzenzele unnamed ngorhoboyi isewulaafrika igidinga inyanga yabomma.
",0.7324805
"dié geleentheid is die herdenking van die dag in 1956 toe 20 000 vroue na die uniegebou opgemars het — n see van vroue van alle rasse, wat verskillende tale gepraat het en uit verskillende oorde gekom het.
","ukugidingokhu kusikhumbuzo saqobe mnyaka selanga langomnyaka we1956 mhlana iinkulungwana ezima20 zabomma bamatjhela eunion buildings – baba sifofo sabomma bemihlobo yoke, ababekhuluma amalimi ahlukahlukeneko, bavela eendaweni ngeendawo.
",0.7186079
"hulle was verenig in hulle aandrang op die einde van die aaklige paswette en vir hulle reg om in vryheid te lewe.
","bebabumbene ngento yinye ebebayifuna, ukuthi kuqedwe imithetho yokuphathwa kweempasa babuyelwe nanga lilungelo labo lokuphila ngokukhululeka.
",0.46326044
"die huidige status en posisie van vroue in suidafrika is heeltemal anders as wat ons ma's en ouma's in 1956 in die gesig moes staar.
","ubujamo nesikhundla sabomma/sabantu abasikazi besewula afrika namhlanje kuhluke khulu kilobo abomma nabogogo bethu ababeqalene nabo ngomnyaka we1956.
",0.5880947
"ons het ver gekom om n suidafrika te verwesenlik wat nierassig, nieseksisties, demokraties, vooruitstrewend en vry is.
","sikhambe indlela ede khulu sibe siphumelelise isewula afrika engabandlululiumhlobo nobulili, ebusa ngentando yenengi, ephumelelako nekhululekileko.
",0.6569245
"daadwerklike vordering is gemaak om suidafrikaanse vroue se lewens ekonomies, politieties en in die openbare lewe te verbeter.
","ibe yihle kwamambala indima yokwenza ipilo yabomma besewula afrika ibe ngcono emnothweni, kezepolitiki kunye nepilweni yangamalanga emphakathini.
",0.64943504
"maar ons is bewus daarvan dat daar nog heelwat vordering gemaak moet word.
","ngakelinye ihlangothi, siyazi ukuthi kusese kunengi khulu okusamele kwenziwe.
",0.4768586
"vroue staar steeds diskriminasie, teistering en geweld in die gesig en dra die grootste las van armoede.
","abantu abasikazi/abomma basabandlululwa, basakhahlunyezwa, baphiliswa ngenturhu, basathwele nomthwalo wobuchaka omkhulu kinayo yoke.
",0.5534014
"as ons die belofte wat in ons grondwet vervat is wil verwesenlik, moet ons die ekonomiese en finansiële uitsluiting wat vroue meer kwesbaar vir mishandeling en geweld maak, die hoof bied.
","nasizakuphumelela ukuzuza iinthembiso zomthethosisekelo wethu, kumele silwe nokukhatjhelwa ngaphandle kwabantu abasikazi/kwabomma kezomnotho nakezeemali okwenza abantu abasikazi bacaphazeke khulu ngokukhahlunyezwa nangenturhu.
",0.6234518
"ons het by ’n baanbrekerveldtog aangesluit wat ons met globale pogings om teen 2030 geslagsgelykheid te bereik, verbind.
","sijoyine ijima elenza umehluko elisihlanganisa nemizamo yephasi ukuphumelelisa imizamo yokulinganiswa kobulili kungakapheli umnyaka we2030.
",0.6478185
"generation equality is n vooruitstrewende en transformatiewe agenda om diskriminasie en geweld teen vroue te beëindig en te verseker dat hulle gelyke deelname in die politieke, maatskaplike en ekonomiese sfere het.
","ukulinganiswa kweengaba zeenzukulu mnqopho oncame khulu onqophe ukuletha amatjhuguluko wokuqeda ukubandlululwa kwabantu abasikazi/lwabomma nenturhu abakhahlunyezwa ngayo, babe bakghone ukuba nethuba elilinganako lokuba nelizwi nesandla eendabeni zepolitiki, zomnotho nezokuhlalisana komphakathi.
",0.61482906
"ons het, as deel van die veldtog, by twee 'aksiekoalisies' aangesluit; een vir ekonomiese geregtigheid en n ander een teen geslagsgebaseerde geweld.
","njengengcenye yejimeli, sijoyine ‘iinhlangano zabakhambisani bamagadango’ ezimbili, yinye yomthethobulungiswa kezomnotho nemalungelweni, yinye yokulwa nenturhu yobulili.
",0.66130143
"albei is kernbelangrik vir ons eie nasionale agenda.
","yomibili lemimmongondaba iqakathekile ehlelweni leminqopho yethu yelizwe.
",0.46182615
"elf maande sedert die toepassing van die noodreaksieaksieplan om geslagsgebaseerde geweld en vrouemoord te bekamp, het ons vordering gemaak met die uitbreiding van ondersteuning en sorg vir oorlewendes.
","ngemva kweenyanga ezili11 solo kwavulwa ihlelo lamagadango arhabako lokulwa nenturhu yobulili neyokubulawa kwabantu abasikazi/kwabomma, sesilime indima ebonakalako yokunabisa isekelo lokutjheja abongazimbi, kanti kwenziwa nendima ebonakalako ekwenziweni kwamatjhuguluko kezomthetho kobanyana bavikeleke khudlwana abongazimbaba.
",0.6648813
"daar is ook vordering gemaak met regshervormings wat aan hulle meer beskerming sal bied.
","ngorhoboyi wanonyaka sithoma ukuphumelelisa ihlelo lamaqhinga welizweloke lokulwa nenturhu yobulili nokubulawa kwabantu abasikazi/kwabomma.
",0.45272672
"ons het in augustus begin om die nasionale strategiese plan vir die bekamping van geslagsgebaseerde geweld en vrouemoord, uit te voer.
","okuqakatheke khulu ehlelweneli kuqinisekisa ukuthi abantu abasikazi/abomma baqalelelwa khudlwana kezeemali.
",0.57361645
"n kernaspek van die plan is om die finansiële insluiting van vroue te verseker.
","lokhu kungenca yokuthi ukutjhiyana ngendima yomnotho nokutjhiyana ngendima kezokuphilisana komphakathi kuthungelelene.
",0.49534222
"dit is omdat ekonomiese en maatskaplike ongelykheid onderling verbind is.
","ubujamo bezomnotho babantu abasikazi/babomma esewula afrika kubenza bacaphazeke khudlwana.
",0.5003806
"die ekonomiese status van vroue in suidafrika maak hulle meer kwesbaar vir mishandeling.
","ngalokhoke kufuze bona siqinise besiphakamise isekelo labantu abasikazi/labomma kobanyana bazokukghona ukuzijamela kezeemali.
",0.5479584
