src_text,tgt_text,cosine_score
"kubambisana nalamanye emave ebrics, ikakhulu emkhakheni welucwaningo lwetekucamba lokusha, sitawusita kuphutfumisa kutfutfuka kwelive letfu kuphindze futsi kusisite sihlangabetane netifiso tetfu tebucwepheshe lobu sheshako ifourth industrial revolution .
","ntirhisano na matiko ma n’wana ya brics, ngopfu ngopfu eka ndzima ya ndza visiso ya vutumbuluxi, wu ta pfuna ku hatlisisa ku endliwa ka tiindasitiri eka tiko ra ka hina na ku hi pfuna ku fikelela ku navela ka hina ka ncinco wa tiindasitiri wa vumune.
",0.9082084
"mayelana nalokuke, kwa banjwa tingcoco mayelana nekwakhiwa kwetinkhundla tebrics letihlelekile kute kucotjelelwane ngetindle lakwenta letisezingeni leli setulu, lwati nemakhono, kufaka ekhatsi kusetjentiswa kwetinkhundla tebucwephe she temtfombo lovuleleke kuwona wonkhe umuntfu.
","hi mayelana na mhaka leyi, mijekajekisano yi vile kona hi mayelana na ku tumbuluxiwa ka tipulatifomo ta brics ta ximfumo leswaku hi avelana maendlelonene, vutivi na vu swikoti, ku katsa ku tirhisiwa ka tipulatifomo ta thekinoloji ya swihlovo swo pfuleka.
",0.9286363
"balingani bebrics bavu melana kutsi emave lasatfu tfuka adzinga kusitwa kute azuze imigomo yentfuntfuko lesimeme yeun, kanye nekutsi emave lanikelako afa nele kutsi atigcine tetsembiso tekutinikela kwawo mayelana naloku.
","vatirhisani va brics va twa nane leswaku matiko lama ha hluvukaka ya dinga mpfuno ku fikelela swikongomelokulu swa nhluvukiso lowu yise kaka emahlweni swa un, na leswaku matiko lama nyike laka ya fanele ku humelerisa ku tiyimisela ka wona hi ma yelana na mhaka leyi.
",0.91412425
"loku kubaluleke ka khulu mayelana nesinyatselo sesimo selitulu.
","leswi swi na nkoka ngopfungopfu loko ku tekeriwa enhlokweni hinkwaswo eka goza ra tlila yimete.
",0.794353
"njengemave lamanyenti, iningizimu afrika ifuna kulandzela indlela yentfu tfuko lenekungcoliseka kwe moya lokusezingeni leli phasi lefaka konkhe ekhatsi, lesimeme futsi lokubuka simo setfu njengelive lelisatfutfuka.
","ku fana na matiko yo tala, afrikadzonga yi lava ku khoma ndlela ya nhluvu kiso wa khaboni ya le hansi leyi yi katsaka hinkwavo, yi yisekaka emahlweni na ku tekela enhlokweni xiyimo xa hina tanihi tiko lera ra ha hluvukaka.
",0.91972494
"inkhundla yelubanjiswano yekucwaninga ngetemandla agezi yebrics itawuba khona uma sesicale kwenta imitfombo yemandla etfu agezi kutsi ibe ngulehluka hlukene.
","pulatifomo ya ntirhisano wa ndzavisiso wa eneji ya brics yi ta va ya nkoka loko hi ya eka ku hambanisa swihlovo swa hina swa eneji.
",0.9221542
"kuleminyaka le11 kusukela sajoyina ibrics, bulunga betfu sebukhulise kakhulu tintfo letifunwa nguvelonkhe.
","eka khumen’we wa malembe kusukelaloko hi tikatse eka brics , vuxirho bya hina byi tlakusile hi ndlela yo tivikana ku navela ka rixaka ra ka hina.
",0.89392316
"kuba lilunga lebrics sekwente kancono simo setfu njengemnotfo lovelako loba lulekile.
","ku va xirho xa brics swi tlakusile xiyimo xa hina tanihi ikhonomi leyi tumbulukaka ya nkoka.
",0.93801
"sekusente sakwati kufi nyelela inchubomgomo ne makhono etebucwepheshe eminotfo lemikhulu lesime me, kanye nekufinyelela kwe sekelwa libhange inational development bank .
","swi hi nyikile mfikelelo wa pholisi na vuswikoti bya xithekiniki bya tiikhonomi letikulu na ku va leti tiyeke, xikan’we na ku nyika nseketelo wa bangi ya nhluvukiso wa rixaka.
",0.88709545
"sekucinise bushoshovu betfu enkhundleni yemave emhlaba, ikakhulu ekuhle lweni kabusha kwetikhungo letimikhakhaminyenti.
","swi tiyisile vugingirikeli bya hina eka xiteji xa misava hinkwayo, ngopfungopfu eka ku antswisa mihlangano ya matikonyingi.
",0.9097455
"sizuze ekubeni yincenye yelivi linye lelihlangene leli lwela kuchubekisela embili kuhleleka kwemhlaba lokusu selwa ekuhloniphaneni kanye nasekutiphatseni lokulinga nako kwetive.
","hi vuyeriwile eka ku va xiphemu xa rito ra nhlanga nelo leri lwelaka ku antswisa mfumo wa misava hi ku ya hi nxiximano na vutifumi byo ringana bya tinxaka.
",0.88085246
"ibrics yilisubuciko leliba luleke kakhulu eveni lakitsi, futsi kutawuchubeka kube njalo sikhatsi lesidze.","brics i xiphemu xa nkoka eka ku kula ka afrikadzonga vukuzenzele unnamed lembe ku nga si va na nhlawulo wo sungu la wa xidemokirasi, phuresidente nelson ma ndela u tsale atikili eka ma gazini wa foreign policy hi mayelana na pholisi ya ma tiko mambe ya vumundzu ku ya afrikadzonga leyi ntshwa.
",0.88085246
"kucedza inkhohlakalo emisebentini yahulumende vukuzenzele unnamed kuvetwa ebaleni ephalamende kutsi tinkhulu ngwane tebasebenti ba hulumende bebatfola si bonelelo sahulumende nja lo ngenyanga kukhombisa kutsi luseludze luhambo lokutsi sifake lisiko leku tiphatsa emisebentini ya hulumende.
","ku herisa vukungundwani eka vukorhokeri bya mfumo vukuzenzele unnamed ku humeseriwa ehandle epala mente ka leswaku magidigidi ya vatirhela mfumo a va ri eku amukele ni ka mali ya mpfuneto wa vanhu n’hweti yin’wana ni yin’wana swi nga ri ena wini swi kombisa leswaku ha ha ri ni gondzo ro leha leri hi faneleke ku ri famba mayelana ni ku dyondzisa ntolovelo wa mahanyelo ya vumunhu eka vuko rhokeri bya mfumo.
",0.9057956
"ekucaleni kwalomnyaka, kwaphindze kwatfolakala kutsi basebenti lababalelwa ku16 000 labahola imali embusweni bebabhadalwa sibonelelo secovid19 lesikhetsekile sekucedza inhlupheko ngalokungakafa neli.
","ekusunguleni ka lembe leri, ku tlhele ku kumeka leswaku kwalomu ka 16,000 wa vatho riwa lava nga eka nxaxamelo wa mfumo wa miholo va hakeriwile mali ya mpfuneto wa xiyimo xa khombo wa vaaki ya covid19 swi nga ri enawini.
",0.93417275
"yintfo leyatiwako kutsi labafaka ticelo kube banale minye mitfombo lengenisa imali abakavumeleki kutfola lesibonelelo.
","swa tiveka leswaku vaendli va xikombelo lava kumaka miholo kun’wana a va ringanelanga hi ku kuma mpfuneto lowu.
",0.8810967
"kuyacaca futsi kutsi labo labatfola imiholo embusweni abakafaneli kufaka ticelo.
","swi tlhela swi va erivaleni leswaku lava kumaka miholo ku suka eka mfumo a va fanelanga ku endla swikombelo.
",0.94428164
"kodvwa bentile.
","kambe va swi endlile.
",0.99032074
"bantfu labangaba ti17 000 laba cashwe nguhulumende wavelonkhe newetifundza bafake ticelo ngenhloso yekukhuphula emaholo abo, ngemali lebekelwe laba phuyile.
","kwa lomu ka 17,000 wa vanhu lava thoriweke eka mfumo wa tiko hinkwaro ni le ka mifumo ya swifundzankulu va yisile swikombelo hi ku ringeta ku tlakusa miholo ya vona hi mali leyi endleriweke vapfumari.
",0.9370867
"nakubukwa bu khulu besidzingo eveni, lobu lobatiwa basebenti bahu lumende kahle kakhulu, lenhloso yangemabomu yekuntjontja imali yempha katsi ayicoleleki.
","hikokwalaho ka swilaveko leswi nga kona laha etikweni, leswi vatirhela mfumo va hina va swi tivaka swinene, ku tinyiketela loku ko endla hi vomu ko yivela xikhwama xa vaaki a ku riva leleki.
",0.8978035
"hulumende nyalo ucinisa mitamo yakhe kuvimbela loluhlobo lokuhlukumeteka aphindze atsatsele tinyatselo noma ngubani emisebentini yahulumende lotsintsekako etentweni letingakalungi.
","sweswi mfumo wu tiyisisa matshalatshala ya wona yo sivela muxaka lowu wa matirhiselo yo biha ni ku teka magoza ku lwisana ni munhu wihi ni wihi loyi a tingheni saka eka swendlo swo biha eka vukorhokeri bya mfumo.
",0.9442649
"lokusandza kwenteka, hulu mende wetfule luphiko lolu sha lolusita ngekutiphatsa, bucotfo nekucondziswa kwetigwegwe kuhulume nde.
","ku nga ri khale, mfumo wu simeke yuniti yo pfuneta ya xithekiniki ya matikhomelo lamanene eka vulawuri bya mfumo, ku tshembeka na vutshinyi.
",0.87471986
"loluphiko lutokwakha emandla emitimbeni yempha katsi kuze kucalwe tinyatselo tekucondziswa kwetigwegwe lapho kunekungatiphatsi kahle luphindze lubambisane naletinye tikhungo tembuso kwenta labo labanesibopho sokutsintseka kutsi bati phendvulele.
","yuniti yi ta antswisa vuswikoti exikarhi ka mihlangano ya mfumo ku simeka mafambiselo yo tshinya eka milandzu ya matikhomelo yo biha ni ku ti rhisana ni swiyenge swi n’wana swa mfumo ku endla leswaku vanhu lava nga ni milandzu va va ni vuthla muleri.
",0.9028686
"loluphiko lutondlulisela emacala enkhohlakalo kuli tsimba lelilwa nenkhohla kalo yahulumende iphindze ilandzelele neminyango kucinisekisa kutsi emacala ebugebengu latsintsa base benti bahulumende ayajika abe macala ekucondziswa kwetigwegwe.
","yuniti yi ta hundzisela mi landzu ya vukungundwani eka xipanu xo lwisana ni vukungundwani no landze lerisa ni tindzawulo ku ti yisisa leswaku milandzu ya vugevenga leyi khumbaka vatirhelamfumo yi tlhlela yi endliwa milandzu yo tshinya.
",0.90413356
"ngekusebe ntisana nesikhungo ifusion centre , loluphiko lutosita kubuka basebenti labase macaleni lasemcoka laphe nywa tiphatsimandla te mtsetfo.
","hi ku tirhisana na fusion centre ya vuyimeri nyingi, yuniti yi ta pfuna ku komba vathoriwa lava nga eka milandzu ya xirhangana leyi lavisisiwaka hi vahlayisi va nawu.
",0.8895118
"loluphiko litawubukisisa kwentiwa kwelucwaningo lwendlela yekuphila kwe basebenti bahulumende.
","yuniti yi ta xiyisisa ku endliwa ka nkambisiso wa matirhiselo ya timali ya vatho riwa va vatirhelamfumo.
",0.8372724
"lapho minyango itobona khona kukhohlakala neku njinga lokungachazeki, ema cala atondluliselwa kumbutfo wemaphoyisa eningizimu afrika.
","laha tindzawulo ti kumaka vukungundwani ni rifuwo leri nga hlamuseriwangiki, milandzu yi ta hundziseriwa eka vukorhokeri bya mapho risa ya afrikadzonga.
",0.90166116
"luphiko lolusha selivele liwucalile umsebenti nge kutimisela, lusita kubuka basebenti bahulumende labatibandzakanya emacaleni laphatselene nekutizuzela kucovid19 , sibonelelo lesikhetsekile secovid19 nekukhwabanisa kusi khwana semshwalense wala baphelelwe ngumsebenti.
","yuniti leyitshwa se yi sungule ntirho wa yona hi nkhikhi, ku pfuna ku kuma vatirhelamfumo lava ti ngheniseke eka milandzu leyi yelanaka ni makumele ya swa covid19 , mpfuneto wo hlawuleka wa covid19 ni vuxisi bya nkwama wa ndzindzakhombo wa lava pfumalaka ntirho.
",0.9540907
"emacala etikhulu tahulu mende landluliselwe luphiko lwemacala lakhetsekile kuze kutocondziswa tigwegwe atobukisiswa nguloluphiko kuze ahlole inchubekelembili yawo.
","milandzu ya vaofisiri va mfumo leyi hundzisiweke hi yuniti yo hlawuleka ya ndzavisiso leswaku va teke riwa magoza yo tshinya yi ta xiyisisiwa hi yuniti ku kambela ku yisiwa ka yona emahlweni.
",0.7909018
"lolunye luhlangotsi lolu balulekile lwemsebenti waloluphiko kutoba kufaka kutiphatsa lokwemukelekile nekwetsembeka etigabeni temisebenti yahulumende.
","xiphemu xin’wana xa nkoka xa ntirho wa yuniti ku ta va ku simeka matikhomelo lamanene ni ku tshembeka eka swiyimo swa vukorhokeri bya mfumo.
",0.9177343
"basebenti bahulumende labambalwa ngekuhamba kweminyaka batsatse umbono wekutsi kwenta libhizinisi kumbe basitakale ngalokungakafaneli embu sweni kuvumelekile kubo, kubangani babo nasemi ndenini yabo, kuphela nje nangabe akukho lokungekho emtsetfweni lokwentiwe.
","vatirhelamfumo vangarivangani eka malembe lama hundzeke va teke mavo nelo ya leswaku ku endla bindzu na mfumo kumbe ku vuyeriwa hi ndlela yo ka yi nga fanelanaga ku suka eka mfumo swa pfumeleriwa eka vona, vanghana va vona na mindyangu ya vona, ntsena loko ku nga ri ni leswi nga riki enawini.
",0.92657816
"simele kwenta konkhe lesingakwenta kuntjintja lesimo lesi sengcondvo.
","hi fanele ku endla hinkwaswo leswi hi swi kotaka ku cinca vonelo leri.
",0.977931
"njengobe sisebentela kucedza inkhohlakalo, kufanele sinakisise ngaloku linganako ekufakeni similo lesihle sekutiphatsa, ngoba loku lokungahle kungabi ngulokungekho emtsetfwe ni kungaba kungatiphatsi ngalokwemukelekile futsi kungafaneli sisebenti sahu lumende.
","loko hi ri karhi hi tirha ku herisa vukungundwani, ku fanele ku va ni ku xiyisisa ko ringana hi ku dyondzisa matikhomelo lamanene ya vumunhu, hikuva leswi nga vaka swi ri enawini swi nga va matikhomelo yo ka ya nga amukeleki naswona swi va swi hoxekile eka mutirhela mfumo.
",0.9173963
"luphiko lolusha lutobeka tindlela tekwenta tintfo nemazinga ngekutiphatsa lokwemukelekile, kwetse mbeka nendlela yekuti phatsa.
","yuniti leyintswa yi ta simeka milawu ya matikhomelo na swipimelo leswibohaka swa matikhomelo lamanene, ku tshembeka na mahanyelo ya vumunhu.
",0.8379916
"futsi lutokwakhela ematiko emandla ekucondzi sa tigwegwe etikhulwini letitfolakele titiphetse kabi.
","nakambe yi ta tlhela yi antswisa vuswikoti bya tindzawulo mayelana ni ku tshinya vatirhi lava kume keke va ri ni milandzu ya matikhomelo yo biha.
",0.8272245
"kulomnyaka lophelile base benti labangetulu kwema200 baceceshwa njengebaphatsi nebaholi.
","lembe leri hundzeke ku tlula 200 wa vathoriwa va leteriwile tanihi varhangeri ni vatumbuluxi.
",0.9650941
"kwakha umbuso lohambi sana nenchubo leyamu kelekako, lonelikhono kuyachubeka kubukisiswa kulokuphatsa.
","ku aka mfumo lowu nga na matikhomelo lamanene ni vuswikoti swi ya ema hlweni swi va xikongomelo xa vulawuri lebyi.
",0.8781816
"njengobe emahlazo lamaningi labandzakanya basebenti bahulumende labazuza ngalokungekho emtsetfweni embusweni akhombisile, lenchubo itoba matima futsi itotsatsa sikhatsi.
","tanihileswi nhlayo ya manyala lama khumbaka vatirhelamfumo lava vuye riweke swi nga ri enawini ku suka eka mfumo yi kombeke hakona, maendlelo ma ta tika naswona swi ta teka nkarhi wo leha.
",0.9201425
"noma kunjalo siti bophelele kuhlala kulendlela.
","hambiswiritano hi tinyiketele ku ya emahlweni ni ku tiyisela.
",0.8564769
"umbuso lokhonako usi sekelo sekutfola konkhe lokubekwe embili eveni letfu.
","mfumo lowu nga ni vu swikoti i masungulo yo fikelela swirhangana swa hina hi nkwaswo swa rixaka.
",0.89369094
"ngaphandle kweku tfutfukisa kutiphendvulela nekukhutsata kutiphatsa lokwamukelekile, kute kuzuza.
","handle ko antswisa vutihlamuleri ni ku tlakusa matikhomelo lama nene ya vumunhu, a xi kona lexi nga fikeleriwaka.
",0.8246042
"liningi lebasebenti bahulu mende litibophelele, ligcina umtsetfo futsi litiphatsa nga lokwamukelekako.
","vatirhelamfumo va hina vo hlaya va tinyiketerile, va la ndzelela milawu ni matikho melo lamanene ya vumunhu.
",0.8090606
"umsebenti lophambi kwetfu kusebenta ngekubambisana kuze kutsi sizuphune labo labangenti njalo, siphindze silungise umbono longa siwo wekutsi bonkhe labo labacashwe kuhulumende batisebentela bona kumbe bakhohlakele.
","ntirho lowu hi nga langu tana na wona i ku tirhisana kususa lava nga fanelangiki, ni ku lulamisa matwisiselo lama nga riki wona ya leswaku hinkwavo lava thoriweke hi mfumo va tirhela ku tivuye risa kumbe i timbabva.
",0.94003767
"ngenta lubito kubo bonkhe labadvuna nalabasikati labasebentela live letfu onkhe emalanga kutsi baphindze batibophelele emagugwini ekutidzela nasekusebenteni, futsi bakhumbule kutsi kuti phatsa kwabo kufanele ngaso sonkhe sikhatsi kube se mtsetfweni futsi kwemu keleke.
","ndzi rhamba vanuna ni vavasati hinkwavo lava tirhe laka tiko ra hina siku na siku ku tlhela va tiboha eka mikoka ya ku va va nga tilaveli swa vona ntsena kambe va tirhela, naswona va tlhela va tsu ndzuka leswaku matikhomelo ya vona ma fanele ku va ena wini ni ku va ni mahanyelo lamanene ya vumunhu mi karhi hinkwayo.
",0.9058165
kusungulwa kwaloluphiko kungulenye yetindlela lesi sebenta ngato kucedza inkhohlakalo kuhulumende nakuyo yonkhe mikhakha yemphilo yaseningizimu afrika.,"ku herisa vukungundwani eka vukorhokeri bya mfumo vukuzenzele unnamed ku humeseriwa ehandle epala mente ka leswaku magidigidi ya vatirhela mfumo a va ri eku amukele ni ka mali ya mpfuneto wa vanhu n’hweti yin’wana ni yin’wana swi nga ri ena wini swi kombisa leswaku ha ha ri ni gondzo ro leha leri hi faneleke ku ri famba mayelana ni ku dyondzisa ntolovelo wa mahanyelo ya vumunhu eka vuko rhokeri bya mfumo.
",0.9058165
"luhlelo lolungumvusa lwetemisebenti likamengameli ligcugcutela kwakhiwa kwematfuba emsebenti vukuzenzele unnamed lesigaba sesibili lesisandza kusu ngulwa selu hlelo lolungumvusa lwetemisebenti lika mengameli simelele imphumelelo lenkhulu emitameni yetfu yekuvula ematfuba emsebe nti ebantfwini labaningi baseningizimu afrika lebangasebenti.
","swihanano swa mitirho hi presidente swi susumeta ku tumbuluxiwa ka mitirho vukuzenzele unnamed ku simekiwa ka xiyenge xa vumbirhi xa ku simekiwa ka swihanano swa mitirho hi pre sidente sweswinyana swi kombisa ku humelela lokukulu eka swiko ngomelo swa hina swo tumbuluxa swivandla swa mitirho eka ma afrikadzonga lava nga tirhiki.
",0.9255251
"sisungule lendlela yesikhutsati kulomnyaka lowengcile kute sakhe ematfuba emisebenti lamanyenti lesingawakhona esikhatsini lesincane kakhulu.
","hi tumbuluxile swiha nano swa mitirho lembe leri hundzeke ku vanga mikateko yo tala hilaha hi nga kotaka hakona hi xinkadyana lexitsongo hilaha swi kotekaka hakona.
",0.882359
"loku kwente kutsi kudzingeke tindlela letinsha tekusebenta kute kusetjentiswe tinhlelo ngesivinini nangelinani lelingakaze libonwe.
","leswi swi ta lava tindlela letintshwa ta maehleke telo to tirha ku simeka tiphurogireme leti nga tolovelekangiki hi xihatla ni mpimo.
",0.90863174
"loluhlelo lwekucasha bantfu labanengi lebebanga sebenti lusebentise tinkhundla letidijithali kute lufinyelele ebantfwini labanengi labafanelekile.
","ndlela yo gangisa vanhu votala lava nga tirhiki va tirhisile tindlela ta xidijitali ku fikelela vathoriwa vo hlaya lava ringaneleke hilaha swi nga kotekaka hakona.
",0.89341486
"sibonelo, balimi labasafufusa bakhona kufaka ticelo tekwesekelwa ngekuse bentisa iussd bese batfola emavawusha latawufakwa kubomakhalekhikhini babo.
","xikombiso, van’wamapurasi lavatsongo va swi kotile ku endla swikombelo ku seketeriwa hi ussd ni ku amukela tivhochara eka tiqingho ta vona.
",0.9311801
"kusukela litiko letemfundvo lesisekelo lavula kutsi kufakwe ticelo telicembu lelilandzelako lekuba basiti babothishela muva nje, bantfu labasha labangetulu kwe940 000 bafaka ticelo ngekusebentisa inkhundla yekucashwa yeinthanethi yamahhala lebitwa ngekutsi yisayouth.
","ku sukela loko ndzawulo ya dyondzo ya le hansi yi pfulele swikombelo swa ntlawa wa vumbirhi wa vapfuneti va le swikolweni ku nga ri khale, ku tlula 940 000 wa vantshwa va endlile swikombelo hi ku tirhisa ndlela ya magangiselo ya mahala lama vuriwaka sayouth.
",0.9493334
"mobi, leyincenye yavelonkhe yepathway management network.
","mobi, lama endla ka xiphemu xosungula xa rixaka xa pathway management network.
",0.95409596
"kusetjentiswa kwebucwepheshe lobusha ekuniketeni ematfuba emisebenti kwenta kutsi kucashwa kube malula kakhulu, kusheshise futsi kuvuleleke kuwo wonkhe umuntfu.
","ku tirhisiwa ka thekinoloji yintshwa eku nyikeni ka swivandla swa mitirho swi endle leswaku vugangisi byi olova, byi hatlisa ni ku va erivaleni.
",0.9318488
"luhlelo lolungumvusa lwetemisebenti likamengameli lwenta kutsi kube nekubambisana kumkhakha wahulumende.
","swihanano swa mitirho hi presidente swi endle ni ku hatlisisa ntirhisano eka mabindzu ya mfumo.
",0.84103966
"tinhlelo letisesigabeni sekucala tasetjentiswa matiko avelonkhe lali11.
","tiphurogireme eka xiyenge xo sungula ti simekiwile hi tindzawulo ta mfumo ta 11. migingiriko ya tona a yi fambelana ni ku papalata mbuyelelo no tlangisa ni ku antswisa ku dyondza ku suka eka lava nga ni ntokoto.
",0.68722737
"imisebenti yawo yacondzaniswa kute kugwenywe kutsi kube nekuphindvwaphindvwa nekumoshwa kwemise benti futsi kutfutfukiswe kufundza ngekusebentisa sipiliyoni salabanye.
","engetelo wa mitirho wu tlhele wu kombisa nkoka wa ntirhisano kun’we.
",0.5857983
"lendlela yekukhutsata kucashwa futsi ikhombise kubaluleka kwekusebenti sana kutenhlalo.
","mfumo, mabindzu, vathori na vaakatiko va tirhisanile swin’we ku tisa lava va nga tirhiki eka ikhonomi.
",0.66025656
"hulume nde, bosomabhizinisi, base benti kanye nemmango babambisene kute baletse labo labangasebenti kutemnotfo.
","ku tlula hafu ya gidi ya miliyoni ya maafrikadzonga va se va vuyeriwile ku suka eka xiyenge xo sungula, laha tiphurogireme tin’wana ta ha yaka emahlweni.
",0.63678217
"bantfu baseningizimu afrika labangetulu kwesigamu sesigidzi sevele bazuzile kulesigaba sekucala, lapho khona tinhlelo letehlukahlukene tisetawulandzela.
","vathoriwa va se va nyikiwile nkateko wo vuyeriwa hi swa rihanyu, ku dyondza vutshila byintshwa no hluvukisa lebyi va nga na byona, ni ku tirhisa ntokoto tanihi masungulo ku kuma ntirho lowu landzelaka kumbe vutitirhi.
",0.6489842
"labo lebayincenye yaloku banikwa litfuba lekutsi bakhone kutiphilisa, lekufundza emakhono lamasha nelekutsi batfutfukise lamatfuba lavele akhona, nelekutsi basebentise sipiliyoni sabo njengendlela yekutfola lomunye umsebenti noma yekutsi batisebente bona ngekwabo.
","xikombiso, nhlayo ya vathoriwa lava thoriweke hi ndzawulo ya mitirho ya mfumo na miako eka tiphurogireme ta yona ta xiyenge xo sungula yi swi kotile ku kuma mitirho eka mabindzu lama nga riki ma mfumo hi ku hela ka nyenyankulu 2021. vunyingi byo tala bya ntlawa wo sungula wa vapfuneti eswikolweni, hi ndlela leyi fanaka, va kumile ndlela yo thoriwa, lava haverisiweke hi ntokoto, vuleteri na vuti toloveti.
",0.7371397
"sibonelo, labaningi kulabo bebayincenye yaloluhlelo lebebacashwe litiko letemisebenti yahulumende nelesakhiwonchanti kuletinhlelo talo tesigaba sekucala bakhona kutsi batfole umsebenti kumkhakha lotimele ngasekupheleni kwendlovulenkhulu ngemnyaka we2021.
","tiphurogireme leti endliweke hi swihanano swa mitirho hi presidente ti tlhele ti vuyerisa miganga hi ku anama.
",0.6366497
"labaningi kulelicembu lebasiti babothishela, ngalokufanako, nabo bayitfolile imisebenti, batfola sipiliyoni, kucecesheka nangekutfola emareferensi.
","xikongomelo ku vile ku tumbuluxa mitirho eka tisekitara hi xikongomelo xa ximunhu xo khumba eka swo fana ni dyondzo, nhlayiseko wa swakudya, ku lunghisiwa ka switirhisiwa swa mani na mani na nsirhelelo wa mbangu.
",0.7657627
"letinhlelo lebetisetje ntiswa ngekulandzela luhlelo lolungumvusa lwetemi sebenti likamengameli tiphindze tasita imimmango ngalokubanti kakhulu.
","hi ku tirhisa swihanano swa mitirho hi presidente vantshwa va thoriwile ku seketela no pfuna vadyondzisi eswikolweni swa hina.
",0.80215627
"betigcile kakhulu ekuvuleni ematfuba emisebenti kumikhakha lenemtselela locondzene netenhlalo lefana netemfundvo, kutfolakala kwekudla, kunakekela sakhiwonchanti sahulumende kanye nekuvikela simondzawo.
","van’wana va thori wile ku aka mabuloho eka miganga ya le makaya.
",0.67491126
"ngekulandzela luhlelo lolungumvusa lwetemise benti likamengameli bantfu labasha bacashelwa kusekela nekuba basiti babothishela etikolweni tetfu.
","tisenthara to tala ta nhluvukiso wa tindzumulo ti pfuniwile ku sisimuka ni ku pfula.
",0.7336146
"labanye bacashelwa kutsi bakhe emabhuloho emimangweni yasemakhaya.
","van’wamapurasi lavatsongo va pfuniwile ku engetela vuhumelerisi, na switirhisiwa swa mbangu swo fana na milambo na swimbyarumbyaru swi pfuxetiwile ni ku hlayisiwa.
",0.7004282
"tikhungo letinengi tekutfutfukisa bantfwana labasesebancane tasitakala kute tikhone kumelane neku phindza tivulwe.
","tanihi xiphemu xa xiyenge xa vumbirhi, hi le ku tumbuluxeni ka nkwama wa rixaka wa vuthori lowu nga ta seketela ntirho wa mbuyelo lowunene lowu rhangeriweke hi mihlangano ya miganga eka tindhawu to hamba nahambana tanihi hi le ka vurimi bya le madorobeni, vutshila bya mani na mani, nhluvukiso wa tindhawu to ka ti nga ri enawini ni nhlayiseko wa vaaki.
",0.6988063
"balimi labasafufusa basekelwa kute bakhulise kukhicita, kantsi imphahla yemvelo lefana nemifula netitete kwasima miswa futsi kwanakekelwa.
","exikarhi ka ikhonomi leyi tikeriwaka leswi vangiweke hi ntungu wa vuvabyi bya khoronavhayirasi, mitirho ya mani na mani yi nyikile vuhanano bya nkoka eka ntumbuluxo wa mitirho.
",0.7648694
"njengencenye yesi gaba sesibili, sisasungula sikhwama sekucashwa kwemmango lesitawusekela umsebenti lotawuzuzisa wonkhe umuntfu lotawube uholwa tinhlangano temmango etindzaweni letehlukahlukene letifana netekulima emadolobheni, tebuciko emmangweni, kutfutfukisa tindzawo tekuhlaliswa kwebantfu letingakahleleki kanye nete kuphepha kwemmango.
","leswi i nsimeko wa ku tinyiketela ka hina leswaku tiko ri va ni xiave xo seketela mitirho loko timakete ti ri karhi ti pfuxeleleka.
",0.73851025
"emkhatsini walesehlakalo lesimbi setemnotfo lesibangwe ngulobhubhane wesifo seli gciwane lekhorona, kucashwa kuhulumende nakutenhlalo kunikete sikhutsati lesimcoka sekuvula ematfuba emsebenti.
","hi swihanano swa mitirho hi presidente hi tisile va ntshwa eka xiyimo xa mitirho hi ndlela ya le henhla yo ka yi nga tolovelekanga hi nkarhi wutsongo.
",0.7433738
"loku kukucala kwekusebenta kwekutibophelela kwetfu kwekutsi hulumende kufu neka asekele ngemandla kucashwa ngalesikhatsi imakethe yetisebenti isavu selelwa.
","kwalomu ka 84% wa vathoriwa eka xiyenge xo sungula a ku ri vantshwa lava nga ehansi ka 35 wa malembe, naswona mbirhi xa nharhu a va ri vaxisati.
",0.581057
"ngekulandzela loluhlelo lolungumvusa lwetemise benti likamengameli sikhone kufaka bantfu labasha kumkhakha wetebasebenti lokwaba linani lelikhulu ngendlela lengakaze ibonwe ngesikhatsi lesincane.
","eka xiyenge xa vumbirhi hi langutela nhlayo leyi ku va ehenhla swinene, tanihiloko swihanano swi ta nyika kwalomu ka r1 biliyoni ku hakelela eka ku tinghenelerisa ka presidente eka mitirho ya vantshwa.
",0.7516607
"labo lebaba yincenye yesigaba sekucala laba84% bekubantfu labasha labaneminyaka lengaphasi kwe35, kwatsi linani lelingukubili kulokutsatfu kwaba bomake.
","tanihi xiphemu xo nghenelela, vantshwa votala va ta gangisiwa eka mpfuxeto wa vukorhokeri bya vantshwa bya rixaka.
",0.64303535
"esigabeni sesibili silindzele kutsi lelinani libe setulu, njengoba lesikhutsati sitasinika imali lecishe ibe ibhiliyoni yinye yemarandi letawuba yindlela yamengameli yekungenelela ekucashweni kwelusha.
","vantshwava ta kuma ndze telo wa vutshila bya dijitali naswona mabindzu lama fambisiwaka hi vantshwa ma ta kuma nseketelo wa ndlandlamuxo ni vuthori.
",0.7270194
