src_text,tgt_text,cosine_score
"""mo kgweding ya mopitlwe le moranang, go ne ga nna le tlhaelo ya metšhini ya go thusa go hema mo batlameding ba rona ba boditšhabatšhaba.
","csir yo thoma u shuma zwa cpap nga murahu ha musi ḽifhasi ḽi tshi khou tshenzhema ṱhahelelo khulwane vhukuma ya dziventhiḽeitha.
",0.5337027
"fao e neng e le teng gone e ne e rekisiwa ka madi a a boitshegang mme puso e ne ya rebola thendara ya gore go tlhagisiwe metšhini ya go thusa go hema,"" ga rialo sanne.
","""henefha nga ṱhafamuhwe na lambamai, ho ḓo thoma u vha na ṱhahelelo ya ṋetshedzo ya dziventhiḽeitha u bva kha vhaṋetshedzi vhashu vha dzitshaka.
",0.65638804
"thendara eno e ne e le karolo ya porojeke ya puso ya naga ya metšhini ya go thusa go hema e e neng e laolwa ke lefapha la kgwebisano, intaseteri le dikgaisano tsa dikgwebo.
","he dza vha dzi tshi khou wanala hone, dzo vha dzi khou ḓura vhukuma, ngauralo, muvhuso wa bvisa thenda ya mveledzo ya dziventhiḽeitha,"" vha ralo vho sanne.
",0.5851412
"csir e samagane gape le go dira motšhini wa go thusa go hema wa bilevel positive airway pressure (bpap) o maitlhomo a ona e leng go thusa balwetse ba ba leng mo maemong a a tlhobaetsang a covid19.
","thenda yo vha tshipiḓa tsha thandela ya venthiḽeitha ya lushaka ya muvhuso u bva kha muhasho wa mbambadzo, nḓowetshumo na muṱaṱisano.
",0.61889464
"motšhini ono wa go thusa go hema o tla thusa balwetse go goga mowa le go hemela kwa ntle mowa o o leng mo matshwafong a bona, e ka tswa e le ka mokgwa wa go o beela nako go dira tiro eno kgotsa ka go o dira gore o dupelele fa molwetse a tlhoka go goga kgotsa go hemela kwa ntle mowa o o leng mo matshwafong mme e le ona o o itirisang ka bo ona go ya ka seo molwetse a se tlhokang."," afrika tshipembe ḽi khou shuma u tandulula thaidzo ya ṱhahelelo ya venthiḽeitha silusapho nyanda venthiḽeitha dzi bveledzwaho fhano hayani dzi ḓo thusa vhalwadze vha re na tsumbadwadze dza covid19 dzine dzi sa vhe khombo nga maanḓa uri vha kone u fema zwo leluwa.
",0.61889464
"thusa go emisa go anama ga covid19 vukuzenzele unnamed setšhaba sa rona se tobane le matlhotlhapelo a se kana ka sepe fa e sale re nna le temokerasi ya rona.
","kha vha thuse u fhelisa u phaḓalala ha covid19 vukuzenzele unnamed lushaka lwashu lwo livhana na tshiwo tshihulu vhukuma kha ḓivhazwakale ya dimokirasi yashu.
",0.6616652
"sebaka sa matsatsi a feta a le 120, re atlegile mo go diegiseng go anama ga mogare ono o o dubang matlhotlhapelo lefatshe ka bophara.
","kha maḓuvha a fhiraho 120, ro kona u lengisa u phaḓalala ha tshitzhili tshine tsha khou vhanga mutshinyalo u mona na ḽifhasi.
",0.56285703
"fela ga jaanong, tlhatlogo ya ditshwaetso e re sa bolong go lemosiwa ka yona ke baitseanape ba rona ba tsa boitekanelo gore e mo tseleng, e re aparetse.
","fhedzi zwazwino, u engedzea nga u ṱavhanya ha tshivhalo tsha vha kavhiwaho he ra eletshedzwa nga vhomakone vhashu vha zwa dzilafho uri hu ḓo itea, ho swika.
",0.49530244
"palo ya maaforika borwa a feta kotara ya milione jaanong e tshwaeditswe ke mogare wa corona, e bile re a itse gore batho ba bangwe gape ba le bantsi go santse go sa itsiwe fa ba tshwaetsegile kgotsa jang.
","vhathu vha fhiraho kotara ya miḽioni afrika tshipembe vho kavhiwa nga tshitzhili tsha corona, nahone ri a zwi ḓivha uri hu na tshivhalo tshinzhi tsha vho kavhiwaho tshi songo vhonalaho.
",0.49040636
"jaanong re iphitlhela re bega dikgetse tse dintšhwa di feta di le 12 000 letsatsi le lengwe le le lengwe.
","zwazwino ri khou rekhoda tshivhalo tshiswa tsha vha kavhiwaho tshi fhiraho 12 000 ḓuvha ḽiṅwe na ḽiṅwe.
",0.4147883
"fa e sale mogare ono o supotsa tlhogo ka kgwedi ya mopitlwe monongwaga, batho ba feta ba le 4 079 ba setse ba tlhokafetse ka ntlha ya covid19.
","u bva tshe dwadze ḽa ṱaha nga ṱhafamuhwe, vhathu vha swikaho 4.079 vho lovha nga nṱhani ha covid19.
",0.7130231
"fela jaaka ditsuatsue tse di maatla tse di tsubutlang naga ya rona go tswa kwa karolong ya borwa jwa lewatle la atlelanta mo pakeng eno ya ngwaga, le ka mogare ono wa corona go tla nna le dikarolo tsa naga eno tse di ka se tsubutlweng ke mogare wa corona.
","u fana na lutsinga luhulu lwa muya u rotholaho vhukuma lu swielaho shangoni ḽashu u bva kha south antlantic nga tshifhinga hetshi tsha ṅwaha, hu na zwipiḓa zwi si gathi zwa shango ḽashu zwine zwa ḓo sala zwi songo kwamiwa nga tshitzhili tsha corona.
",0.6103698
"setsuatsue sa mogare wa corona se bogale thata e bile se senya tota go gaisa ditsuatsue tse dingwe tse re kileng ra sutlha mo go tsona.
","ḓumbu ḽa tshitzhili tsha corona ḽo kalula vhukuma na u vha ḽi tshinyadzesaho u fhira zwe ra vhuya ra ṱangana nazwo murahu.
",0.52779627
"se tlhotlhora metswedi le maitlhomo a rona tota.
","ḽi khou swiela fhu zwiko zwashu na thandululo dzashu u swika magumoni.
",0.42325538
"tlhatlogo ya ditshwaetso e re sa bolong go lemosiwa ka yona dikgwedi di le tharo tse di fetileng ke baitseanape ba rona ba tsa boitekanelo le ba tsa saense gore e mo tseleng, e re aparetse.
","u gonya nga u ṱavhanya ha tshivhalo tsha vha kavhiwaho he vhomakone vhashu na vhorasaintsi vha hu bula uri hu ḓo itea miṅwedzi miraru yo fhiraho, ho swika.
",0.5065038
"e simolotse kwa kapa bophirima mme jaanong e tsweletse go tsubotla kapa botlhaba le gauteng.
","ho thoma kapa vhukovhela nahone hu khou itea ngei kapa vhubvaḓuvha na gauteng.
",0.5364628
"le fa tota ditshwaetso di tsweletse go tlhatloga ka bontsi, go botlhokwa thata go nopola gore palo ya tlhatlogo ya dikgetse tsa dintsho ya phesente e le nngwe le halofo ke e nngwe ya dipalo tse di kwa tlase thata mo lefatsheng ka bophara.
","naho zwo ralo, musi tshivhalo tsha vha kavhiwaho tshi tshi khou gonya nga luvhilo, ndi zwa vhuṱhogwa u ḓivha uri reithi yashu ya vha lovhaho ya phesenthe ya 1.5 ndi iṅwe ya dza fhasisa ḽifhasini.
",0.5332068
"eno ke fa re e bapisa le palo ya tlhatlogo ya dikgetse tsa dintsho e e tletseng mo lefatsheng ya diphesente di le 4.4. re tshwanetse go leboga batlhankedi ba rona ba boitekanelo ka maitemogelo le boineelo jwa bona mmogo le dikgato tse re di tsereng go ithulaganya sentle mo tsamaisong ya boitekanelo go bo re na le palo eno e e kwa tlase ya dintsho mo nageng ya rona.
","hezwi zwi khou vhambedzwa na tshivhalokati tsha reithi ya vha khou lovhaho tsha ḽifhasi tsha phesenthe dza 4.4. ri tea u livhisa ndivhuwo dzashu dza u vha na tshivhalo tsha mpfu tsha fhasi kha shango ḽashu kha tshenzhemo na vhuḓikumedzeli ha vhashumeli vha mutakalo vhashu na maga e ra a dzhia nga u ṱavhanyedza u bveledzisa na u lugisela sisiṱeme ya mutakalo washu.
",0.5976896
"le fa tota go na le batho ba le bantsi ka fa nageng ba ba tsereng dikgato go thibela go anama ga mogare ono, go santse go na le ba bangwe ba le bantsi ba ba sa direng jalo.
","naho vhunzhi ha vhathu vhashu vho dzhia vhukando ha u thivhela u phaḓalala ha tshitzhili, vha hone vhane vha sa khou ita nga u ralo.
",0.46962315
"go na le ba bangwe mo go rona ba ba itlhokomolosang melaokiletso eno e e neseditsweng pula gore e ka dirisiwa go lwantshana le bolwetse jono.
","hu na vhaṅwe vhukati hashu vhane vha khou pfuka milayo ye ya phasiswa ya u lwa na vhulwadze.
",0.52308315
"mo nakong eo re aparetsweng ke leroborobo leno, go namela thekesi o sa apara maseke wa go hema, go kokoana go etela ditsala, go ya meketeng kgotsa go etela balelapa, go dira gore go nne bonolo gore mogare o aname mme seno se ka tlhola dintsho.
","vhukati ha tshiwo tsha dwadze iḽi, u ṋamela thekhisi u songo ambara masiki, u kuvhangana na dzikhonani, u ya mbulungoni kana u dalela vha muṱa, na zwone zwi nga phaḓaladza tshitzhili na u lozwa matshilo.
",0.6743482
"jono e ka tswa e le bolwetse jo bo tlhodiwang ke mogare, fela bo anama ka ntlha ya maitsholo a batho.
","hovhu vhu nga kha ḓi vha vhu vhulwadze vhu vhangwaho nga tshitzhili, fhedzi vhu phaḓaladzwa nga vhuḓifari na mikhwa ya vhathu.
",0.49297607
"ka maitsholo a rona – re le batho ka borona, re le masika, re le baagi – re ka fetola ka fao leroborobo leno le itirelang ka teng boithatelo e bile re tshwanetse go dira jalo.
","nga kha nyito dzashu riṋe vhaṋe – sa vhathu vhone vhaṋe, sa miṱa, sa zwitshavha – ri nga kona nahone ri fanela u shandukisa nḓila ine tshiwo tsha dwadze iḽi ya khou isa shango ḽashu hone.
",0.5266588
"re tshwanetse go apara maseke wa lesela o o thibang nko le molomo fa re tswa ka malapa a rona.
","ri tea u ambara masiki wa labi une wa vala mulomo na ningo tshifhinga tshoṱhe musi ri tshi bva hayani.
",0.61672103
"re tshwanetse go tswelela go tlhapa diatla tsa rona ka gale ka metsi a sesepa kgotsa ka go a tlotsa ka sebolayamegare.
","ri fanela u bvela phanḓa na u ṱamba zwanḓa zwashu tshifhinga tshoṱhe nga maḓi na tshisibe kana nga sanithaiza (tshivhulahatshitzhili).
",0.5428117
"re tshwanetse go tswelela go phepafatsa mafelo otlhe a a dirisiwang ka gale ke batho.
","ri fanela u bvela phanḓa na u kunakisa na u sanithaiza fhethu hoṱhe ha u shumela hone ha nnyi na nnyi.
",0.55337405
"se se botlhokwa go fetisisa, re tshwanetse go katogana – go katoga motho yo mongwe sekgala sa dimitara di le pedi.
","tsha vhuṱhogwa vhukuma, ri fanela u vha kule na muṅwe muthu – lwa vhukule ha mithara dzi swikaho mbili – u bva kha vhaṅwe vhathu.
",0.46260414
"jaanong go na le bopaki jo bo supologang jo bo reng mogare ono o ka tsamaya ka dikarolo tse dinnye thata tse di leng mo moweng mo mafelong a go nyeumang batho mo go ona, a a tswalegileng kgotsa ao a sa tsenelweng ke phefo.
","zwazwino hu na vhuṱanzi ho bvelelaho ha uri tshitzhili tshi nga hwalwa nga zwipiḓa zwiṱukuṱuku muyani fhethu ho ḓalesaho vhathu, ho valeaho kana hune hu sa tou vha na u mona ha muya zwavhuḓi.
",0.62004626
"ka ntlha ya seno re tshwanetse gore ka gangwe fela re tokafatse mafelo a batho ba tsenang ka fa gare ga ona ao mo go ona kgonagalo ya go anama ga mogare ono e leng teng.
","nga nṱhani ha hezwi, ri fanela u khwinisa nga u ṱavhanya vhupo ha nga ngomu ha fhethu ha nnyi na nnyi hune khonadzeo ya khombo ya u kavhiwa ya vha khulwanesa.
",0.52055645
"tshwetso ya rona ya go tsena mo kgatong ya go sekega nakwana ditiro tsa ka fa nageng e re thusitse gore re se gosomelwe ke ditshwaetsego tse dintsi re santse re le mo tshimologong fao ka nako eo maokelo a rona a neng a santse a ise a ithulaganye, e leng seo se ka bong se bakile dintsho tse di seng kana ka sepe.
","tsheo yashu ya u ḓivhadza nyiledza u bva mahayani ya lushaka nga vhuphara yo thivhela u gonya huhulu ha vhulwadze nga u ṱavhanya musi tshumelo dza mutakalo dzashu dzo vha dzi sa athu lugiselwa zwavhuḓi, zwe zwa vha zwi tshi ḓo vhanga ndozwo khulwanesa ya matshilo a vhathu.
",0.5869108
"mo nakong eo re nnileng le yona, re tsere dikgato tse di botlhokwa thata go matlafatsa maokelo a rona gore a kgone go samagana le mogare ono.
","kha tshifhinga tshe ra vha ri natsho, ro dzhia maga a vhuṱhogwa u khwaṱhisa phindulo ya mutakalo washu.
",0.5005324
"re setse re dirile diteko tsa mogare wa corona di feta di le dimilione di le pedi mme ka fa letlhakoreng le lengwe batlhankedi ba boitekanelo ba ba tsenang ntlwana ka ntlwana bona ba setse ba dirile ditlhatlhobo tsa boitekanelo di feta di le dimilione di le 20re beetse thoko malao a ka nna 28 000 kwa dipetlele go thusa balwetse ba covid19 mmogo le go tlhoma dipetlele tsa nakwana tse di leng kgakala le baagi tse di dirang go ralala le naga.
","ro ita dzindingo dza tshitzhili tsha corona dzi fhiraho miḽioni mbili nahone vhashumeli vha mutakalo vha tshitshavha vho ṱola vhathu vha fhiraho 20 miḽioni.
",0.34557727
"ga jaana re na le malao a feta a le 37 000 kwa maokelong a puso le a poraefete go ralala le naga a a beetsweng balwetse ba ba nang le mogare ono mme ba tlhoka go katosiwa, a a letetseng fela go amogela balwetse bao ba batlang go ka katosiwa mo bathong ba bangwe mme ba se na ditlogo tsa go ka ikatosa ka bobona fa ba le kwa malapeng a bona.
","ro kona u ri hu vhe na mimbete ya sibadela i ṱoḓaho u swika 28,000 ya vhalwadze vha covid19 na u fhaṱa zwibadela zwa tshifhinga nyana zwi shumaho u mona na shango.
",0.624444
"re rekile ra bo ra romela dimilionemilione tsa didirisiwa tsa ipabalesego kwa dipetlele, ditleliniki le kwa dikolong go ralala le naga e le go ka babalela batlhankedi ba rona ba ba kopanang le badirelwa.
","zwazwino ri na mimbete ya khwarathini ya 37,000 kha zwiimiswa zwa muvhuso na zwa phuraivethe u mona na shango, zwo lugela u ṱanganedza avho vha sa koni u ḓikhethela thungo mahayani avho.
",0.58379066
"re thapile e bile re tsweletse go thapa baoki, dingaka le batlhankedi ba tirelo ya tshoganyetso ya boitekanelo.
","ro renga na u ḓisa tshomedzo dza u ḓitsireledza dza miḽioni zwibadela, dzikiḽiniki na zwikoloni u mona na shango u tsireledza vhashumi vha ṋetshedzaho tshumelo dza vhuṱhogwa.
",0.28399473
"re tsweletse go nna le kgatelopele mo matsapeng a rona a go samagana le covid19, le fa go le jalo, kgwetlho ya rona e e namagadi e santse e tla.
","ro thola nahone ri khou bvela phanḓa na u thola vhaongi vha u engedzedza, madokotela na vhashumi vha zwa mutakalo kha tshiimo tsha shishi.
",0.43915707
"go ralala le diporofense tsotlhe, re samagane le go oketsa palo ya diphaposibookelo tse di amogelang balwetse ba malwetse a a farologaneng mmogo le malao a a tlhokegang go amogela balwetse ba covid19.
","ri ya phanḓa na u ita mvelaphanḓa kha ndingedzo dzashu dza u lwa na covid 19, fhedzi khaedu yashu khulwanesa i kha ḓi ḓa.
",0.6321798
"mo dipetleleng di le dintsinyana balwetse ba ba sa tlhokeng kalafo ya tshoganyetso ba fokodiwa mo diphaposing tsa bookelo go romelwa kwa malapeng a bona, dikarolo dingwe tsa dipetlele di fetolwa go nna diphaposi tsa balwetse e bile go tlhomiwa kgotsa go okediwa gape le dipetlele tsa nakwana tse di leng kgakala le baagi.
","u mona na mavundu oṱhe, ri khou shuma u engedza tshivhalo tsha mimbete wadini dza vha lwalesaho na kha wadi zwadzo uri i vhe hone u itela vhalwadze vha covid19.
",0.57189536
"re samagane le go oketsa tlamelo ya oksijene, metšhini ya go thusa go hema mmogo le didirisiwa tse dingwe gape tse di botlhokwa tse di tla tlhokagalang go thusa bao ba leng mo maemong a a tlhobaetsang, go tsenyeletsa go tlamela ka oksijene mabapi le ditirelo tse di rileng.
","tshikhala wadini tshi khou vulea kha zwibadela zwo vhalaho nga u lengisa ndondolo ya dzilafho ine a si ya shishi, u shandukiswa ha huṅwe fhethu zwibadela ha itwa wadi dza u engedzedza na u fhaṱwa kana u engedzedzwa ha zwibadela zwa tshifhinga nyana.
",0.6483148
"re dirisa thekenoloji ya dijithale go gagamatsa matsholo a go nopola, go gata motlhala le go beela kwa thoko batho bao ba kopaneng le bao ba tshwaetsegileng, mmogo le go tshegetsa bao diteko di fi tlhetseng ba na le mogare ono.
","ri khou shuma u engedza nḓisedzo ya okisidzheni, dziventhiḽeitha na dziṅwe tshomedzo u itela avho vha ṱoḓaho ndondolo ya vhuṱhogwa, hu tshi katela na u nga pambusa ṋetshedzo ya okisidzheni dze dza vha dzi tshi khou ya u shumiselwa zwiṅwe.
",0.63817126
"jaanong jaaka re tsena mo maemong ao ditshwaetso di tla bong di le kwa godimo, re tlhoka go tsaya dikgato tse di gagametseng tsa polokesego mmogo le go gagamatsa dikgato tse ga jaana di leng teng go ka fokotsa lebelo la ditshwaetsego.
","ri khou shumisa thekhinoḽodzhi dza didzhithaḽa u khwaṱhisa u topola, u sala murahu vho kwamanaho na muthu o kavhiwa na u vha vhea fhethu ha thungo, na u tikedza avho vho wanwaho uri vha na tshitzhili tsha corona.
",0.5385203
"melawanataolo ya gore batho ba apare dimaseke e tla gagamadiwa.
","sa izwi zwino ri tshi khou sendela tsini na maṱhakheni a vhulwadze, ri tea u khwaṱhisedza uri ri tevhedza tsiradwadze na u khwaṱhisa maga ane a vha hone a u ongolosa reithi ya phiriselo.
",0.45809942
"bathapi, beng ba mabentlele le balaodi, beng ba dipalangwa tse di dirisiwang ke baagi, mmogo le balaodi le beng ba meago yotlhe e e dirisiwang ke baagi jaanong ke molao gore motho mang le mang yo a tsenang mo mafelong a bona kgotsa yo a namelang dipalangwa tsa bona o tshwanetse go bo a apere maseke.
","milayo ya u ambarwa ha mimasiki i ḓo khwaṱhiswa.
",0.34561297
"dithekesi tse di tsayang maeto a fa gautshwana di tla letlelelwa gore di ka tlatsa banamedi, mme tseo di tsayang maeto a maleele tsona di tla tshwanelwa ke go pega fela 70% ya banamedi, mme seno se tla letlelelwa fa fela ba ikamanya le dikgato tsa tsamaisokgwebo tse di ikamanyang le tiriso ya dimaseke, go tshela sejanaga seo ka sebolayamegare mmogo le go bula a mangwe a matlhabaphefo a sejanaga seno.
","vhatholi, vhaṋe vha mavhengele na vhalanguli, vhareili vha zwiendedzi zwa nnyi na nnyi, na vhalanguli na vhaṋe vha zwifhaṱo zwiṅwe zwa nnyi na nnyi zwazwino vha kombetshedzwa nga mulayo u khwaṱhisedza uri muthu muṅwe na muṅwe a dzhenaho kha zwifhaṱo zwavho kana moḓoro u fanela u vha vho ambara masiki.
",0.5969994
"jaanong go bopaki jo bo totobetseng gore go letlelelwa gore notagi e ka simolola go rekisiwa go nnile le ditlamorago tse di seng kana ka sepe mo dipetleleng, go tsenyeletsa le mo ditirelong tsa dikgobalo tse di masisi le mo ditirelong tsa diyuniti tsa balwetse ba ba lwelang botshelo le badimo, mme seno ke ka ntlha ya dikotsi tsa dijanaga, tirisodikgoka mmogo le ditiragalo tsa mothale ono tse di tlholang dikgobalo tse di masisi.
","thekhisi dzi tshimbilaho nyendo pfufhi dzapo zwazwino dzi ḓo tendelwa u engedza tshivhalo u ya kha phesenthe ya 100 ya vhanameli, ngeno thekhisi dza nyendo ndapfu dzi sa ḓo tendelwa u ṋamedza tshivhalo tshi fhiraho phesenthe dza 70 dza vhanameli, zwi tshi bva nga uri phurotokhoḽo ntswa dza u fhungudza khonadzeo dza khombo dzi elanaho na u ambarwa ha masiki, u sanithaiza moḓoro na u vula mafasiṱere dzi khou tevhedzwa.
",0.631269
"ka ntlha ya seno, re tsere tshwetso ya gore, gore re kgone go somarela bokgoni jwa dipetlele go ka samagana le matsapa a re tobaneng le ona, thekiso, kabelano le phasalatso ya notagi e tla tshwanelwa ke go kgaotswa go tloga mo motsing one o. go tsaya kgato e nngwe gape go ka fokotsa boima jo dipetlele di bo rweleng, re tla tsenya gape le dikiletso tsa go tsamaya masigo magareng ga ura ya bo robongwe mo maitsiboeng le ura ya bone mo matsheng.
","zwazwino hu na vhuṱanzi vhu re khagala ha uri u vulwa ha thengiso ya mahalwa zwo vhanga mutsiko u vhonalaho kha zwibadela, hu tshi katelwa yunithi dza zwi tatisaho na icu, nga vhanga ḽa khombo dza mimoḓoro , zwi tatisaho zwi elanaho na dzikhakhathi.
",0.5381036
"re tsaya dikgatokiletso tseno re itse sentle gore ke tseo batho ba sa itumeleleng tsone mo matshelong a bona.
","nga u ralo, ro dzhia tsheo ya uri u itela u vhulunga tshivhalo tsha mimbete sibadela, thengiso, u hwala na u iswa ha mahalwa zwi khou imiswa u bva zwino.
",0.4393398
"fela di botlhokwa thata mo pakeng eno gore re kgone go kgabaganya paka eno eo bolwetse jono bo tlhatlogelang kwa godimo mo go yona.
","sa maga a u engedzedza u itela u fhungudza mutsiko zwibadela, hu ḓo vhewa nyiledzo ya tshifhinga tsha u tshimbila vhukati ha awara ya 9 nga madekwana na awara ya 4 nga matsheloni.
",0.4531814
"ga go tsela e nngwe e re ka efogang setsuatsue seno sa mogare wa corona.
","ri khou dzhia maga aya ri tshi tou zwi ḓivha zwavhuḓi uri a kombetshedza nyiledzo dzi sa takalelwi kha matshilo a vhathu.
",0.5516696
"fela re ka fokotsa bogale jwa tshenyo eo e ka bo dirang mo matshelong a rona.
","honeha, o tea u ri thusa uri ri kone u bva maṱhakheni a vhulwadze.
",0.5044128
"re le naga kgetse eno ya tsie re e kgona ka go e tshwaraganela, ka go thoba matswalo a bao ba gateletsweng mmogo le go rotloetsana gore re amogele bao ba tshelang ka mogare ono.
","a hu na nḓila ine ri nga tinya ḓumbu ḽa tshitzhili tsha corona.
",0.46088743
"mo motsing ono, go feta mo malobeng, re na le maikarabelo a go sireletsa matshelo a bao re tshelang le bona.
","fhedzi ri nga fhungudza tshinyalelo ine tshi nga i bveledza kha matshilo ashu.
",0.40419048
"re tla se sutlha setsuatsue seno.
","sa lushaka, ro ṱangana u tikedzana, u khuthadza avho vhane vha khou lwala khathihi na u ṱuṱuwedza u ṱanganedzwa ha vhathu vhane vha vha na tshitzhili.
",0.34180275
"re tla busetsa naga ya rona mo maemong a itekanelo le a khumo.
","zwazwino, u fhira na mathomoni, ri na vhuḓifhinduleli ha matshilo a vhathu vha re vhukati hashu.
",0.21052253
re tla sutlha mo dinaleng tsa phage.,"kha vha thuse u fhelisa u phaḓalala ha covid19 vukuzenzele unnamed lushaka lwashu lwo livhana na tshiwo tshihulu vhukuma kha ḓivhazwakale ya dimokirasi yashu.
",0.21052253
"ku tlangela vavasati hi nkatso ku tlangela vavasati hi nkatso eka swa ikhonomieka swa ikhonomi vukuzenzele unnamed hi mhawuri afrikadzonga ri tlangela nhweti ya vavasati.
","u pembelela vhafumakadzi nga u vha dzhenisa kha zwa ikonomivha dzhenisa kha zwa ikonomi vukuzenzele unnamed nga ṱhangule afrika tshipembe ḽi pembelela ṅwedzi wa vhafumakadzi.
",0.64213127
"ntirho lowu wu komba siku leri fanaka ra 1956 loko 20,000 wa vavasati va macha ku ya eunion buildings – lwandle ra kahle ra vaxisati lava vulavulaka tindzimi to tala, ku suka eka tindhawu to hambana hambana na tinxaka hinkwato.
","mushumo uyu u sumba tshiga tsha anivesari ya ḓuvha ḽe nga 1956 vhafumakadzi vha 20,000 vha gwalaba vha ya union buildings – gogo ḽa vha tshifumakadzini vha ambaho nyambo dzo fhambanaho, vha bvaho fhethu ho fhambanaho na vha mirafho yoṱhe.
",0.6776806
"a va khomanile eka swikoxo swa vona swa ku herisa milawu ya pasi na timfanelo ta vona to hanya va ntshuxekile.
","vho vhumbana kha migwalabo yavho ya u lwela uri hu fheliswe milayo i thivhelaho mbofholowo ya u tshimbila kha vharema na pfanelo dzavho dza u tshila vho vhofholowa.
",0.30977726
"xiyimo xa vavas atieafrikadzonga namuntlha xi hambanile swinene na lexi a xi langutane na vamanana na vakokwana wa hina hi 1956. hi suka ekule eka ku kumisisa afrikadzonga leri nga yiki hi rixaka, rimbewu, ra xidimokirasi, ro hluvuka no ntshuxeka.
","maimo na vhuimo ha vhafuma kadzi afrika tshipembe ṋamusi zwo fhambana vhukuma na zwe zwa ṱangana na vhomme na vhomakhulu washu nga 1956. ri bva kule u swikela afrika tshipembe ḽi si na khethano nga lukanda, mbeu, ḽa dimokirasi, ḽi bvelelaho nahone ḽo vhofholowaho.
",0.72099483
"ku vile na ku antswa eka ku antswisa vutomi bya vavasati va afrikadzonga eka ikhonomi, eka xiphemu xa tipolotiki na le ka vutomi bya mani na mani.
","ho vha na mvelaphanḓa yavhuḓi kha u khwinisa matshilo a vhafumakadzi vha afrika tshipembe kha sia ḽa ikonomi, poḽotiki na kha matshilo a vhathu.
",0.60181296
"hi nkarhi wun'we, ha swi tiva leswaku kahari na ndlela yo leha leyi hi faneleke ku yi famba.
","kha tshifhinga tshenetshi tshithihi, ri a zwi ḓivha zwauri hu na zwinzhi hafhu zwine ra khou tea u zwi ita.
",0.45581824
"vavasati vaha langutane na xihlawuhlawu, nxaniso na madzolonga, na ku rhwala ndzhwalo lowukulu wa vusiwana.
","vhafumakadzi vha kha ḓi ṱangana na zwa khethululo, u vhaiswa na dzikhakhathi, vha hwala mutsiko muhulu wa vhushai.
",0.5958977
"loko ho lava ku lemuka xitshembiso xa vumbiwa ra hina hi fanele ku languta nkatso wa xiikhonomi na wa ximali leswi swi endlaka leswaku vavasati vava va nga hlayisekanga eka nxaniso na madzolonga.
","arali ri tshi khou ṱoḓa u wedza nga ngoho pfulufhedziso dza ndayotewa yashu ri tea u lingedza nga maanḓa u sedzana na zwa u sa dzheniswa kha zwa masheleni na kha zwa ikonomi zwine zwa ita uri vhafumakadzi vha ḓiwane vha songo tsireledzea kha dzikhakhathi na u tambudzwa.
",0.54463196
"hi nghenerile khampheni leyi nga se tshamaku yi endliwa leyi yi hi hlanganisaka na kutinyiketela ka misava hinkwayo ku fikelela ku ringana ka rimbewu hi 2030. ndzingano warixaka i ajenda leyi naveriwaka no cinca ku herisa xihlawuhlawu na madzolonga eka vavasati na ku nghenelela loku ringanaka eka vutomi bya swa tipolotiki, xinakulobye naxiikhonomi.
","ro dzhena kha fulo ḽihulwane ḽa vhutumbuli ḽine ḽa ri ṱumanya na ndingedzo dza ḽifhasi dza u swikela ndinganyiso ya mbeu nga 2030. ndinganyiso ya murafho ndi mafhungo a sumbaho tshanduko na ṱhuṱhuwedzo u itela u fhelisa khethululo na dzikhakhathi zwi itelwaho vhafumakadzi na u itela u shela mulenzhe nga nḓila i linganaho kha zwa poḽotiki, matshilisano na zwa ikonomi.
",0.7161007
"tanihi xiphemu xa khampheni leyi, hi nghenele ‘mihlanganelo ya swendlo’ yimbirhi, wun'we wa vululami bya ikhonomi na timfanelo na yin'wana ku lwisana na madzolonga ku ya hi rimbewu.
","sa tshipiḓa tsha fulo iḽi, ro dzhenela kha ‘ṱhanganelano dza ndivho nthihi’ mbili, iṅwe ndi ya pfanelo na vhulamukanyi ha zwa ikonomi ngeno iṅwe i tshi lwisana na khakhathi dzo ḓisendekaho nga mbeu.
",0.62162393
"tithimi leti havumbirhi ti na nkoka eka ajenda ya hina ya tiko.
","vhuvhili ha thero idzi ndi dza ndeme kha mafhungo a lushaka lwashu riṋe vhaṋe.
",0.38934758
"khumen'we wa tinhweti loko kungu ra ku hlamula ra xilamulelamhangu ku lwisana na madzolonga kuya hi rimbewu na kudlawa ka vavasati ri simekiwile hi endlile ku antswa eka ku andzisa nseketelo na nhlayiso wa lava poneke, naswona ku antswa swi endliwa hi ku aka hi vuntshwa nawu ku va nyika nsirhelelo wa kahle swinene.
","kha miṅwedzi ya fumithihi u bva tshe pulane ya nyito i sedzaho zwa shishi ya u fhelisa khakhathi dzo ḓisendekaho nga mbeu na u vhulawa ha vhathu vha tshifumakadzi ya thoma u shuma ro vha na mvelaphanḓa ya u engedza thikhedzo na ndondolo kha vhaponyi, nahone mvelaphanḓa i khou itwa kha mbuyedzedzo ya zwa mulayo u itela uri vha wane tsireledzo khulwane.
",0.6203005
"hi n'hweti ya mhawuri, hi sungula ku simeka kungu ra tiko ro lwisana na madzolonga yoya hi rimbewu na ku dlawa ka vavasati.
","kha ṅwedzi wa ṱhangule, ri thoma u shumisa pulane ya tshiṱirathedzhi ya lushaka u fhelisa khakhathi dzo ḓisendekaho nga mbeu na zwa u vhulawa ha vhathu vha tshifumakadzini.
",0.5268923
