src_text,tgt_text,cosine_score
"ek doen n beroep op die mans en vroue wat ons land elke dag dien om opnuut hulself te verbind tot die waar des van onbaatsugtigheid en diens, en om te onthou dat hul gedrag ten alle tye beide wettig en eties moet wees.
","ngikhombela boke abobaba nabomma abasebenzela ilizwe lesewula afrika mihla nama langa bona bazibophelele ngobutjha kilomsebenzi begodu bawenze ngefanelo ngokukhumbula bona uku ziphatha kwabo kufanele kube semthethweni begodu kube ngokuhle.
",0.56767505
"die vestiging van hierdie eenheid is net nog een van die maniere waarop ons hard werk om korrupsie in die rege ring en, inderwaarheid, in alle sfere van ons land se daaglikse bestaan, wil uitroei.","ukuqeda ikohlakalo ekorweni yemisebenzi yombuso vukuzenzele unnamed umbiko ovele epa lamende othi iinkulungwana zabasebenzi bembusweni bekade barhola ngoku ngasisemthethweni iimbo nelelo zombuso qobe yi nyanga uhlathulula bo nyana iseseyide indlela esi sazoyikhamba ukufinyele la esigabeni sokufundisa abantu ngesiko lomthe thokambiso wokuzipha tha kwabasebenzi bembu sweni.
",0.56767505
"presidensiële werkskeppingstimulus gee stukrag aan werkskepping vukuzenzele unnamed die onlangse bekend stelling van die tweede fase van die presidensiële werkskeppingstimulus spreek van groot vordering in ons poging om werk te skep vir werklose suidafrikaners.
","ihlelo likamengameli lokuvula imisebenzi lisunduzela ukuvulwa kwemisebenzi vukuzenzele unnamed ukusikinyiswa kwamhlapha kwesigaba sesi bili sehlelo likamenga meli lokuvula imise benzi kuliliqha elikhulu emzameni wethu wokuvulela amasewula afri ka angasebenziko imise benzi.
",0.7108388
"ons het die werkskeppingstimulus verlede jaar op die been gebring om soveel moontlik geleenthede in die kortste moontlike tyd te skep.
","sivule ihlelo lokukhuthaza ukwakhiwa nokuvulwa kwemisebenzi nyakenye ngomnqopho wokuvula amathuba wemisebenzi amanengi ngendlela ekunga kghonakala ngayo nge sikhatjhana esifitjhazana khulu.
",0.33053607
"dit het nuwe en innoverende maniere van doen geverg om programme teen n ongekende pas en skaal te implementeer.
","lokhuke kwenza ukuthi kufuneke ukuthi kutholakale iindlela ezitja zokuphumelelisa amahlelo amalungana nalokhu ngebelo elikhulu ekungakhange khekusetjenzwe ngalo pham bilini nangomthamo omkhulu kinayo yoke eyakhe yaba khona.
",0.32319805
"die werwingsproses van die talle werklose mense maak gebruik van digitale platforms om soveel moontlik geskikte deelnemers te bereik.
","ihlelo lokutholela abantu abanengi ebebangasebenzi umsebenzi lisebenzise iinkundla zeendlela zokuthintana ezibudijithali ukufika ebantwini abalungele umsebenzi abanengi ngokukghonakalako.
",0.57441306
"byvoor beeld, kleinskaalboere kon deur middel van ussd (funk siekodes) vir ondersteuning aansoek doen en insetbewyse op hulle selfone ontvang.
","isibonelo, abosomaplasi abancani bakghone ukwenza iimbawo zokusekelwa ngeussd bathola amavawutjha woku basiza emaselifowunini wabo.
",0.4888886
"sedert die departement van basiese onderwys onlangs aansoeke oopgestel het vir die volgende inname van skoolassistente, het meer as 940 000 jongmense via die nultariefindiensnemingsplat form naamlik sayouth.
","solo umnyango weze fundo esisekelo uvulele iimbawo zesiqhema esi landelako sabasizi beenkolo mhlapha, bangaphezulu kwee940 000 abantu abatjha abafake iimbawo zabo ngekundla engabhadalelwako ebizwa ngokuthi yisayouth.
",0.78960943
"mobi aansoek gedoen, wat deel uitmaak van die nasionale roetebestuursnetwerk.
","mobi, eyingcenye yepathway management net work yelizwe loke.
",0.61244214
"die gebruik van nuwe tegnologieë in die aanbieding van werksgeleenthede, het werwing baie makliker, vinniger en meer deursigtig gemaak.
","ukusetjenziswa kwa mahlelo wethekhnoloji amatjha ekuvuleni amathuba wemisebenzi kwenze umsebenzi wokuqatjha ube lula khulu, ube msinyana begodu wenzelwe emkhanyweni ngcono kunaphambilini.
",0.61436474
"die presidensiële indiensnemingstimulus het samewerking in die openbare sektor moontlik gemaak en vergemaklik.
","ihlelo likamengameli lokuvula imisebenzi likghonakalise ukusebenzisana ekorweni yembusweni.
",0.5741876
"programme in fase een is deur 11 nasionale departemente geïmplemen teer.
","amahlelo wesigaba sokuthoma aphunyeleliswa minyango yombuso eli11.
",0.5345894
"hulle aktiwiteite is in ooreenstemming in gebring om duplisering en vermorsing te voorkom en leer uit ander se ervaring te bevorder.
","okwakwenziwa ngamahlelo lawa kwakukhambisana ngoku vumelana kobanyana kuzokubalekelwa ukubuyeleleka kwento yinye nokusetjenziswa kwemi thombo yamandla ngokungakafaneli nokukhuthazwa kokufunda ngelimuko labanye.
",0.6217264
"die indiensnemingstimulus het ook die belangrikheid van maatskaplike vennootskappe getoon.
","ukukhuthazwa kokuvulwa kwemisebenzi kubuye godu kwatjengisa ukuqakatheka kokusebenzisana nomp hakathi.
",0.6174329
"die regering, sake wêreld, arbeid en burgerlike samelewing het saamgekom om diegene wat werkloos is, in die ekonomie in te bring.
","urhulumende, amabhizinisi, zabasebenzi kunye neenhlangano zomphakathi, boke bahlanganele ukubabuthela emnothweni labo abangasebenziko.
",0.6145116
"meer as n halfmiljoen suidafrikaners het reeds baatgevind by die eerste fase, met talle programme wat nog geloods gaan word.
","angaphezulu kwesi quntu sesigidi amasewula afrika esele azuzile esiga beni sokuthoma, esisese namahlelo ambadlwana asaragako.
",0.6614897
"deelnemers is die kans gegun om n bestaan te maak, nuwe vaardighede aan te leer en bestaande vaardighede te ver beter en om hulle ervaring te gebruik as n wegspringplek vir n ander werk of om vir hulself te werk.
","abangene esigabenesi banikelwe ithuba lokuthola umthombo wokuziphilisa, bafunde amakghonofundwa amatjha bakhuphule nalawo esele banawo, basebenzise nelimuko labo njengesi sekelo sokuthola omunye umsebenzi namkha sokuzivulela umsebenzi abangazi sebenza ngawo.
",0.65121627
"byvoorbeeld, n aantal deelnemers wat deur die departement van openbare werke en infrastruktuur in sy programme in fase een aan gewys is, kon teen die einde maart 2021 werk in die privaatsektor bekom.
","isibonelo, bambadlwana abantu abaqatjhwe mnya ngo wezemisebenzi ka rhulumende nezemithangalasisekelo esigabeni sawo sokuthoma abathe nakuphela untaka wee2021 babe sebakghone ukuthola umsebenzi ekorweni yangeqadi.
",0.5967077
"talle van diegene in die eerste inname van skoolas sistente het op soortgelyke wyse werk gekry, gewapen met ondervinding, opleiding en verwysings.
","abanengi balabo ababe sesiqhemeni sokuthoma sabasizi besikolweni, nabo ngokunjalo bagcine bathole umsebenzi, sebahlome ngele muko, sebathwasiselwe nomsebenzi, sebaphethe godu neencwadi ezifakazela ilwazi lokusebenza abanalo.
",0.61101663
"die programme wat deur middel van die presi densiële werkskeppingsti mulus geïmplementeer is, het ook die gemeenskappe in die algemeen bevoordeel.
","amahlelo aphunyeleliswe ngehlelo likamengameli lokuvula imisebenzi selawu size ngokunabileko umphakathi.
",0.6164188
"die fokus is op werkskep ping in sektore wat n direkte maatskaplike impak het, waaronder opvoedkunde, voedselsekerheid, onderhoud van staatsinfrastruktuur en omgewingsbeskerming.
","laphake bekuqalwe ukuvulwa kom sebenzi emakorweni anegalelo eliya phezu ko mphakathi poro, njengefundo, ukutholakala kokudla, ukutjhejwa komthangalasisekelo wo mphakathi kunye nokuvi kelwa kwebhoduluko.
",0.6798296
"deur middel van hierdie presidensiële werkskepping stimulus is jongmense in diens geneem om onderwysers in ons skole te ondersteun en by te staan.
","ngalelihlelo likamenga meli lokuvula imisebenzi, abantu abatjha baqatjhelwe ukusekela nokusiza abotitjhere eenkolweni zelizwe lekhethu.
",0.5743903
"ander is in diens geneem om brûe in landelike gemeenskappe te bou.
","abanye baqatjhelwe ukwakha amabhlorho eendaweni zemakhaya.
",0.28708145
"baie vroeë kinderontwik kelingsentrums is gehelp om te oorleef en te heropen.
","amanengi amaziko wokukhulisa umntwana kwebuncanini (amaecd) asizwe ukuthi abambelele abe avulwe ngobutjha.
",0.6151151
"bestaansboere het ondersteu ning ontvang om produksie uit te brei, en omgewingsba tes soos riviere en vleilande is herstel en word in stand gehou.
","abalimi abalimela/abafuyela ukuziphilisa basekelwe ukuthi bandise umkhiqizwabo, namafa webhoduluko anjengemilambo neemphande zeentete kwavuselelwa kwabe kwatjhejwa.
",0.67419195
"as deel van fase twee bring ons n maatskaplike indiensnemingsfonds op die been wat werksgeleenthede sal steun wat die samelewing bevoordeel, onder leiding van gemeenskapsorganisasies, op diverse gebiede soos stedelike landbou, openbare kuns, die opgradering van informele nedersettings en gemeenskapsveiligheid.
","njengengcenye yesigaba sesibili, sivula isikhwama sezemisebenzi yomphakathi esizakusekela umsebenzi owenzela woke umuntu ubuhle, ozabe udoswa phambili ziinhlangano zomphakathi emakorweni amihlobohlobo anjengezokulima eendaweni zemadrobheni, ubugwali bomphakathi, ukuphakanyiswa kweendawo zokuhlala ezingakahleleki kunye nokuphepha komphakathi.
",0.6950857
"te midde van die erge ekonomiese terugslag weens die koronaviruspandemie, het staatsen maatskaplike indiensneming n belangrike stimulus vir werkskepping voorsien.
","ebujameni bobudisi bezomnotho obubangelwe sisifo sengogwana icorona esirhageleko, ukuqatjhwa kwabantu embusweni nemphakathini kube sikhu thazo esiqakathekileko sokuvulwa kwemisebenzi.
",0.6220743
"dit is die implemen tering van ons verbintenis dat die staat indiensneming aktief moet ondersteun terwyl die arbeidsmark herstel.
","lokhuke kuphunyeleliswa kukuzibophelela kwethu okuthi umbuso kufuze usekele ukuvulwa kwemisebenzi, imakethe yezemisebenzi nayisalwela ukuvuka.
",0.5814734
"deur middel van die presidensiële indiensneming stimulus het ons jongmense in die arbeidsmark ingebring in baie groter getalle in n onge kende kort tydperk.
","ngehlelo likamengameli lokuvula imisebenzi, nge sikhatjhana esifitjhani sifake abantu abatjha emsebe nzini ngobunengi ngendlela engakhange kheyenzeke.
",0.6164844
"ongeveer 84% van die deelnemers aan fase een was jongmense onder die ouderdom van 35, en tweederdes was vroue.
","abantu abangaba ma84% ababe sesigabeni sokuthoma sehlelweli kube babantu abatjha beminya ka yobudala engaphasi kwama35, kanti babili kabathathu babo bekubabantu abasikazi.
",0.7010779
"in fase twee verwag ons dat hierdie getal selfs hoër sal wees, aangesien die sti mulus byna r1 miljard sal voorsien aan befondsing vir die presidensiële jeugindiensnemingsingryping.
","esigabeni sesibili silindele ukuthi lelinani liphakame, njengoba phela ihlelo lokukhuthaza umsebenzi lizokukhupha pheze ibhiliyoni yamaranda yokusekela igadango likamengameli lokuqatjhwa kwelutjha.
",0.655577
"verskeie jongmense sal as deel van die ingryping gewerf word in n nasionale jeugdiens waarin nuwe lewe geblaas is.
","njengengcenye yega dangweli, abantu abatjha abambadlwana bazokubi zelwa ephikweni lelutjha lelizwe elivuselelweko.
",0.55883384
"jongmense sal opleiding in digitale vaardighede ont vang en ondernemings wat deur jongmense besit word, sal hulp kry om uit te brei en personeel aan te stel.
","abantu abatjha bazoku thwasiselwa amakgho nofundwa wobudijithali kantike amabhizinisi welutjha azakusekelelwa ukukhula nokuqatjha.
",0.50457406
"werkloosheid in ons land is n krisis.
","ukutlhogeka komsebenzi elizweni lekhethu kumraro orhageleko.
",0.43642676
"ons kan nie eindelose vertragings bekostig weens burokratiese rompslomp, verouderde indiensnemings prosesse, n gebrek aan kapasiteit en beplanning, of kortstondige of onvolhoubare programme om hierdie pro bleem op te los nie.
","angeze sikghone ukusolo sivinjwa kuriyada isiphelani koku lungiswa kwalomraro ngenca yehlelo eliziingaba gaba lokulawulela ukuvimba, ikambiso yokuqatjha esele yaphelelwa sikhathi, ukungabi namandla wekghono lokwenza nokuhlela, namkha amahlelo aphelela emmoyeni namkha angabambeleliko.
",0.52321625
"die sukses van die presidensiële indiensneming stimulus toon dat wanneer ons saamwerk, vinnig beweeg, kreatief dink en ons hulpbronne goed bestuur, ons n massiewe impak kan hê.
","ipumelelo yehlelo likame ngameli lokuvula imisebenzi itjengise ukuthi lokhuya nasisebenzisanako, sikhambisa, sicabanga ngendlela eyakhako sibe siphathe kuhle imithombo yethu yamandla, singenza litho likhulu.
",0.40695655
"die presidensiële indiensnemingstimulus het gedemonstreer dat ons werk kan skep as ons saamwerk as openbare sektor, arbeids mag, die gemeenskap en die regering.
","ihlelo likamengameli loku vula imisebenzi litjengisile ukuthi singayakha imisebenzi nasisebenzisanako ekorweni yembusweni, kezabasebenzi, emphakathini nakurhulu mende.
",0.6638726
die volgende fase van die presidensiële indiensnemingstimulus sal ons ongetwyfeld selfs nader sal bring aan ons gesament like doel van ordentlike werk en geleenthede vir almal.,"ihlelo likamengameli lokuvula imisebenzi lisunduzela ukuvulwa kwemisebenzi vukuzenzele unnamed ukusikinyiswa kwamhlapha kwesigaba sesi bili sehlelo likamenga meli lokuvula imise benzi kuliliqha elikhulu emzameni wethu wokuvulela amasewula afri ka angasebenziko imise benzi.
",0.6638726
"rapporteer korrupsie via die teenkorrupsieblitslyn silusapho nyanda om korrupsie in die staatsdiens te bekamp, bly n prioriteit vir die regering en die teenkorrupsieblitslyn maak dit maklik vir lede van die publiek om gevalle waar korrupsie vermoed word, te rapporteer.
","bika ubukhohlakali enomborweni yokulwa nobukhohlakali silusapho nyanda nayibe kunobukhohlakali, ukukhwabanisa, ubusela namkha okhunye nje okuphambene nokulunga ekorweni yabasebenzi bembusweni, ukhuthazwa bona ukubike lokho.
",0.7159835
"die blitslyn is in 2004 deur die staatsdienskommis sie (sdk) geloods en het sedertdien meer as 100 000 oproepe met aantygings van korrupsie en wanadministra sie ontvang.
","ukulwa nobulelesi ekorweni yabase benzi bembusweni kusese liqalontanzi likarhu lumende; njeke inomboro yokulwisa ubukohlakali eli zweni lokeli yenza kube lula emalungeni womphakathi ukubika izenzo ezisolisa kwanga ngezobukhohlakali.
",0.58140266
"dié oproepe deur onthullers het gelei tot die ondersoek van 24 035 sake van kor rupsie, bedrog en ander misdaad, sê die kommissaris van die sdk, michael selo ane, wat toesig hou oor al die werk wat deur die kommissie uitgevoer word.
","inomboro yokubika izenzo zobukhohlakali le yavulwa yikomitjhini yabasebenzi be mbusweni (ipsc) ngomnyaka wee2004, kantike ukusukela ngesikhatheso seyidlulile eekulungwaneni ezili100 imi biko yeensolo zobukhohlakali nezinto eziphambuke endleleni esekhe yathunyelwa babantu.
",0.73407304
"tussen 2020 en 2021 is 337 sake via die blitslyn gerap porteer.
","imibiko yokubika ubukho hlakali le, ebeyisenziwa bahlabimkhosi, yenze ukuthi kuphenywe imilandu ema24 035 yobukhohlakali, yoku khwabanisa neminye, kutjho ukomitjhinara wezekoro yabasebenzi bembusweni umichael seloane, oweluse woke umsebenzi owenziwa ngilekomitjhini.
",0.5502573
"vyfendertig van dié het ongerymdhede rakende aanstellings en verkrygings behels wat tans deur die sdk ondersoek word.
","ukusukela ngomnyaka wee2020 ukuya kewe2021, ima337 imilandu ebikwe ezikweni loku bika ubukhohlakali.
",0.64552045
"die oorblywende sake is na ander staatsdepartemente of wetstoepassingsagentskappe vir ondersoek verwys.
","ama35 wemilandu le iphathelene nokuqatjhwa kwabantu ngo kungamthetho, nokuthengwa kweensetjenziswa ngokunga mthetho ephenywa yipsc.
",0.5939034
"ongerymdhede betref fende behuising, tenders en maatskaplike toelae onder die heropbouen ontwikkelings program (hop) is onder die algemeenste aantygings wat gemaak word.
","imilandu esele idluliselwe keminye iminyango karhu lumende namkha kabanye abathobelisimthetho kobanyana iyokuphenywa.
",0.55842704
"""ons het tydens die inper kingstydperk baie wenke per epos ontvang.
","ukwenza izinto eziphambe ne nokulunga emahlelweni wokwakhiwa kwezindlu, ze hlelo lokwakha nokuvuse lela (amardp), nemathende ni kunye neembonelelweni zomrholo wombuso yizwa ngobatjho evame khulu ukubikwa bahlabimkhosi.
",0.63604385
"ons het ook n geoutomatiseerde bood skapopnamestelsel vir die gene wat ons blitslyn naure wil skakel,"" sê seloane.
","""ngesikhathi sokuqinteliswa kwamakhambo sihletjelwe kanenginengi ngamaimeyili.
",0.6251122
"hy voeg by dat daar n bestendige toename in die rapportering van bedrog met betrekking tot maatskaplike toelae was sedert die inper kingsvlakke begin lig is, veral rakende die maatskaplike noodverligtingstoelae.
","sinanehlelo elizirekhodela umlayezo kilabo abafisa uku fowunela inomboro yethu yokubika ubukhohlakali ngemva kwesikhathi somse benzi,"" kunaba useloane.
",0.5868925
"ter versterking van dié pogings om korrupsie te bekamp, het die staat wets toeppassingsagentskappe voorsien van vaardige personeel en n koalisiesentrum gevestig.
","ungezelela ngokuthi solo kugedliswe imilayelo yokuqi nteliswa kwamakhambo, kuya ngokwanda ukubikwa kwamacala wokukhwabanisa aphathelene neembonelelo zo mrholo wembusweni, khulu khulu iimbonelelo zokwethula umphakathi umthwalo wobu disi bokudosa emhlweni.
",0.65565246
"dié sentrum bring wetstoepassingsagent skappe byeen, waar hulle inligting en hulpbronne deel in die stryd teen bedrog en korrupsie in die verkryging van kovid19verwante goedere en dienste.
","ukuqinisa imizamo yokulwa nobukhohlakali, umbuso uni kele abathobelisimthetho abase benzi abanamakghonofundwa, wabe wasungula neziko elibi zwa ngokuthi yifusion centre .
",0.68730175
"wat gebeur nadat n wenk ontvang word?
","leliziko liyihlanganisela yaba thobelisimthetho ababelana ngelwazi nangemithombo yamandla ekulwiseni ukuk hwabanisa nobukhohlakali ekuthengweni kwepahla neen setjenziswa ezikhambisana necovid19 .
",0.44003993
"seloane sê dat wanneer n saak via die blitslyn gerapporteer word, vroeë beslegtingsbeamptes seker maak dat alle betrokke inligting verskaf is.
","kwenzekani emve ni kobana kuhla tjwe umkhosi woku yelelisa?
",0.25058526
"soda nige inligting behels die besonderhede van wie wat gedoen het, wanneer dit na bewering plaasgevind het en die rede daarvoor.
","o0oo00oo useloane uthi lokhuya icala nalibikwa ngefowuni yokubika amacala, iimpha thimandla eziqalene mandla eziqalene neensombululo zamsinyana ziyahlola uku thi yoke imininingwana efa neleko ikhona na.
",0.58418524
"hy sê dat indien enige oortreding bevind word — hetsy ongerymdhede met verkryging of aanstellings, omkopery, korrupsie ver want aan hopbehuising, bedrog met betrekking tot maatskaplike toelae, onwet tige migrasie, aanranding, diefstal of bedrog — die sdk óf remediërende aksie aan die betrokke departement sal voorstel óf die saak na die valke, die sanp of die teenkorrup sietaakmag sal verwys vir verdere ondersoek.
","laphake kubalwa nemininingwana yokuthi ngubani owenzeni, nokuthi isenzo esenzekile kweso senziwe nini, kunye nokuthi kubayini owenze isenzweso asenzile.
",0.7050123
"sake wat die sdk na departemente verwys vir ondersoek sluit die vol gende in: staatsamptenare wat ekstra werk doen vir geld sonder toestemming van die departemente; onverklaarde belangebot sings; onetiese gedrag.
","uthi nayibe kutholakala ukuthi kwenziwe okupha mbene nokulunga kungaba kuthengwa kweensetje nziswa nokuqatjhwa kwa bantu ngokungamthetho, ukufunjathiswa, ubukhohla kali obuphathelene nezindlu zerdp, ukukhwabaniswa kwesibonelelo somrholo wembusweni, ukufahlela kwabantu/ukungena ngo kungemthetho elizweni lekhethu, ukubetha, ukweba namkha ukukhwabanisa – ipsc ingaphakamisa ukuthi umnyango ofaneleko uthathe amagadango wokulungisa namkha udlulisele icalelo kumahawks, emapholiseni wakwasaps namkha esiqhe meni somsebenzi wokulwa nobukhohlakali kobanyana khekuphenywe ngomlandu loyo ukuya phambili.
",0.68254876
"seloane sê dat die sdk die staatsdepartemente 60 dae gee om ondersoek in te stel en n saak af te handel.
","imilandu edluliselwa yipsc eminyangweni kobanyana iyokuphenywa ngile elande lako, hlangana neminye: abasebenzi bembusweni abenza umsebenzi onge zelelweko kobanyana ba zokurhola ngaphandle kwemvumo evela eminya ngweni abasebenza kiyo; ukungavezi iinrhulu phelo zakho zengeniso mali ezitjhayisana nemi thetho yokuziphatha ye mbusweni kunye nokuziphatha okupha mbana nesiko elivunye lweko lokuziphatha kwa basebenzi.
",0.5658822
"hy sê dat die departement dan die sdk oor die bevin dinge inlig.
","useloane uthi ipsc i nikela iminyango karhulumende amalanga ama60 ukuphe nya beyiqede ngomlandu.
",0.5814331
"""as ons tevrede is met die stappe wat die departement geneem het, sal ons die saak sluit; maar as ons nie tevrede is nie, word die saak na hulle teruggestuur.
","uthi ngemva kwalokhoke umnyango wazisa ipsc ukuthi utholeni ephe nyweni lawo.
",0.56680095
"""naamloosheid gewaar borgwanneer n onthuller nie sy/haar identiteit wil openbaar nie, neem die sdkblitslyn slegs hul kontakbesonder hede.
","""nayibe siyaneliseka ngamaga dango athethwe mnyango, siyawuvala umlandu, ko dwana nayibe sisarhonona, sibuyela kiwo umnyango.""
",0.75087595
"dit is belangrik sodat die sdk met hulle in kontak kan tree, sou daar meer inligting benodig word.
","kune siqinisekiso so kungazigaguli ibizo umhlabimkhosi nakanga funiko ukwaziwa ukuthi ungubani, isiphathimandla seziko lomtato wokubika ubukhohlakali sithatha imi niningwana yokuthintana kwaphela.
",0.5681282
"onthullers wat sake via die sdkblitslyn rapporteer, word daarvan verseker dat hulle beskerm sal word as hulle verkies om naamloos te bly, sê seloane.
","lokhuke kuqa kathekile ngoba nayibe kusafuneka elinye ilwazi, ipsc kufuze ikghone uku mthinta umhlabimkhosi loyo.
",0.6903907
"hy verduidelik dat die vroeë beslegtingsbeamptes opgelei is om te verseker dat onthullers se identiteit beskerm word.
","abahlabimkhosi ababika amacala ezikweni lomta to wokubika imilandu kupsc banikelwa isiqini sekiso sokuthi amabizwabo angeze avezwe nayibe ba funa ukungaziwa nofana ukungazigaguli, kuhlathu lula useloane.
",0.63029563
"seloane sê dat suidafrikaners korrupsie moet rapporteer omdat dit van die armes steel en ontwikkeling belemmer, wat keer dat die land vooruitstrewend kan wees.","bika ubukhohlakali enomborweni yokulwa nobukhohlakali silusapho nyanda nayibe kunobukhohlakali, ukukhwabanisa, ubusela namkha okhunye nje okuphambene nokulunga ekorweni yabasebenzi bembusweni, ukhuthazwa bona ukubike lokho.
",0.63029563
"indiening van klagtes by die gepf vergemaklik vukuzenzele unnamed lede, pensioenaris se en begunstigdes van die pensioen fonds vir staatsampte nare (gepf) het nou af toegang tot hulp indien hul ongelukkig is oor die diens wat hul ontvang.
","ukufaka iinlilo zegepf okwenziwe lula vukuzenzele unnamed amalunga, abase benzi esele bathe the umhlalaphasi kunye nabazuzi besikhwa ma somhlalaphasi sabase benzi bakarhulumende (igepf) kwanje sebano bubhadekelo nayibe aba kaneliseki ngendlela be nzelwa ngayo izinto.
",0.40145516
"om te verseker dat die gepf hul lede en dié se families regverdig behan del, het die raad onlangs n beregtiger aangestel om klagtes te hanteer.
","ukuqinisekisa ukuthi amalunga wegepf nemi ndeni yawo baphatheka kuhle, mhlapha ibhodi ivule iofisi esebenza ngamacala wemibango.
",0.68009615
"die beregter vir pensioenfondse is n interne dog onafhank like kantoor van die gepf.
","umbekilihlo womhlalaphasi wabase benzi bakarhulumende (igepo) yiofisi yange khaya kodwana ezijame leko yegepf.
",0.6448276
"die gepf is een van die grootste pensioenfondse ter wêreld, met meer as 1,2 mil joen aktiewe lede en meer as 450 000 pensioenarisse en begunstigdes.
","igepf ingesinye see nkhwama zomhlalaphasi ezikulu khulu ephasini; inamalunga ayi1.2 yee ngidi kunye nabantu esele bathethe umhlalaphasi nabazuzi abangaphezulu kwee450 000. isikhwamesi sasungulwa ngomthetho wegepf begodu silawulwa ngomthetho lo.
",0.618171
"die fonds is ingevolge die wet op pensioene vir staatsamp tenare gestig en word daar volgens gereguleer.
","uadvocate makhado ramabulana uqatjhelwe isikhundla sokuba mbekili hlo.
",0.5697514
"advokaat makhado rama bulana is as die beregtiger aangestel.
","uthi iofisi le yavulelwa ukusiza abantu abaneenlilo ngomsebenzi wegepf.
",0.5800977
"hy sê dat die kantoor ten doel het om hulp en steun te verleen aan mense wat ongelukkig is met die dienste van die gepf.
","iofisi le izakuba lisizo khulu ebantwini abanga namali yokubhadela ama gcwetha.
",0.5371386
"mense wat nie regsaksie kan bekostig nie, sal veral voordeel trek uit die bereg tigerskantoor.
","ngaphambi koba na abantu base imila ndwabo yemibango eofi sini yomvikeli wompha kathi namkha emakhotho, bangakhombela uku lanyulelwa mbekilihlo.
",0.49169564
"voor mense hul klagtes na die kantoor van die openbare beskerm er of na die howe neem, kan hulle bemiddeling deur die beregter versoek.
","umbekilihlo uzakulamula eendabeni ezenza kuri yadeke ngokunganasizathu ukusetjenzwa kwembadalo ekufuze ibhadelwe aba yitlemileko.
",0.6081811
"die beregtiger sal intree in sake wat lei tot onre delike vertragings in die verwerking van betalings verskuldig aan eisers.
","kodwanake ingalamula imibango engasingaphezulu kwe minyaka emithathu yenze kile.
",0.6089467
"dit mag slegs as bemiddelaar optree in klagtes wat in die afgelope drie jaar ontstaan het.
","ezinye iindaba eziwela ngaphasi kwegepo ngilezi ezilandelako: ukubhalelwa kweempha thimandla kukwenza u msebenzazo ngokomthe tho nangokwemithetjhwa na yesikhwama; ukwephula isibopho nga phandle kwesizathu esi zwakalako; kunye nemininingwana/nelwa zi elidurhisako elivezwe basebenzi begepf.
",0.5528237
"ander sake wat binne die bestek van die gepo val, sluit die volgende in: amptenare wat versuim om hul pligte ingevolge die fonds se wet en reëls uit te voer; die verbreking van n verbintenis sonder n gegronde rede; en verkeerde of misleidende inligting wat deur gepfwerknemers verskaf is.
","ngaphambi kokufaka isililo kugepo, umuntu kufuze athumele isililo esitloli weko kugepf, ephikweni lelawulo lemihlalaphasi ka rhulumende (igpaa) namkha kumqatjhi walezi injamiso, abanikele ithuba lokulungisa indaba yesili lweso.
",0.6540557
