src_text,tgt_text,cosine_score
"ukwakha isitjhaba esitjheja abentwana vukuzenzele unnamed kunesaga esijayele kileko eentjhabeni ezinengi zeafrika esithi umntwana ukhuliswa sitjhaba.
","ho aha naha e kgathallang bana vukuzenzele unnamed hona le maele a tlwaelehileng sethong sa afrika a reng ngwana o hodiswa ke setjhaba.
",0.7074388
"ifundiso le – ethi umphakathi unomsebenzi omkhulu wokukhulisa, ukutjheja zehlalakuhle nokuphepha komntwana ngamunye – kuba liqaloqangi emkhumblulwenami nangicabanga ngesehlo sokuhlongakala okumasikizi kukaenock mpianzi obekaneminyaka eli13 ngesikhathi asekhambeni lesikolo lamhlapha.
","mohopolo ona wa hore setjhaba ka bophara se ikarabella ntshetsopeleng, paballe hong le tshireletsong ya ngwana e mong le e mong – o a mphihlela ha ke nahana ka tlokotsi e utlwisang bohloko ya lefu la enock mpianzi ya dilemo tse 13, ya sa tswa hlokahalla ka mpong ya leeto la sekolo.
",0.45155317
"ngetjhudwelimbi, akusin guenock kwaphela umntwa na olahlekelwe yipilwakhe ngabonobangela egade bangakhandelwa, kwaphela nagade abantu abakhulu bathatha igadango elifaneleko lokubatjheja begodu baba nokuziphendulela.
","ka maswabi, enock ha se yena feela ngwana ya ileng a hloka hala ka mabaka a ka thibelwang ka botlalo, ha feela batho ba baholo ba ka ba le tlhokomelo le boikarabelo ka tshwanelo.
",0.6446948
"ngikhumbula godu omunye oneminyaka eli13 ukeamohetswe shaun seboko okghan ywe mamanzi mhlapha edamini lesikolo samabanga aphasi semagaliesburg nabantwana ababili abahlongakele elekgolo primary school, eselimpopo lokha itrogo itjhayisa iboda elagirikela phezu kwabentwanaba.
","ke boele ke nahane ka keamohe tswe shaun seboko, ya dilemo tse 13, ya ileng a kgaqwa ke metsi haufinyane letamong la ho sesa la sekolo poraemare sa magaliesburg, le bana ba babedi ba hlokahaletseng sekolong sa poraemare sa lekgolo mane limpopo ha lori e ne e thula le bota le ileng la ba wela hodimo.
",0.45541844
"emkhumbulwenami kufika nabantwana abanengi, abanjengonathlia pienaar – oneminyaka esi6ababulawa nakudumuzana amagenge ecape flats.
","ha motho a nahana ka bana ba bangata, ba jwalo ka nathlia pienaar, ya dilemo tse tsheletseng, ya ileng a bola uwa dintweng tsa ho thunyana ha maqulwana a dinokwane cape flats.
",0.7369849
"sikhumbula godu ukuhlongakala okumasikizi kwakamichael komape nolumka mkethwa ababulawa kuwela ngeendlwaneni zoku zithuma zomgodi.
","re boela re hopola ho shwa ka sehloho ha michael komape le lumka mkethwa, ba ileng ba hlokahala ka bobedi ba bona kamora ho wela ka hara mekoti ya matlwana.
",0.7085619
"besingakafaneli ukula hlekelwa maphilo wabantu abasesebancani kangaka, namaphilo wabanye abanengi abangakabalwa.
","maphelo a bana bohle, le maphelo a ba bang ba bangata, a ne a sa tlameha ho feela ho hang.
",0.39917648
"zoke iingozezi gade zingakhandelwa nange bekuthethwe amagadango afane leko wokuvikela abantwanaba.
","ditlokotsi tsena tsohle di ka be di thibetswe haeba mekgwa ya thibello e ne e sebedi sitswe ho tshireletsa bana bana ba kotsing.
",0.5288739
"kubonakala ingasuthi thina simphakathi siliselela abentabethu.
","ke bona eka, jwalo ka se tjhaba, re hloleha ho hlokomela bana ba rona.
",0.5123297
"abentwana abanengi bazifumana basengozini, engaba sike jana sokuzenzela esikhanjiswa ngemlanjeni nofana batjhiywe babodwa ngemkhukhwini onekesi yepharafeni.
","ke bana ba bangata ba iphumanang ba le kotsing, hore na e ne e le ho etsa lewala nokeng kapa ba siilwe ba le bang ka mokhukhung le lebone la para fini.
",0.6180903
"lokha abosokontraka nabatjhiya imigodi ingakavaleki nofana imithangalasisekelo yeenkolo ingatjhejwa nofana iinthuthi zabafundi zilayitjhe ngokudluleleko, amaphilo wabentwana abasengozini.
","kapa ka mohlomong bo radikonteraka ba siya mekoti e epilweng e sa tshireletseha kapa meaho ya sekolo e sa hloko melwa, kapa dipalangwang tsa sekolo tseo ho tsona ho pete tswang bana, maphelo a bana a ba kotsing.
",0.63647974
"kodwanake kunezenzo ezinye ezingaphezu kokunga tjheji nokungenzi umseben zi ngefanelo.
","empa ho na le bohlaswa le ho se tsotelle mosebetsing.
",0.4610348
"abentwana abanengi basahlelwa ziinlelesi ezibagagadlhelako, amagenge nabathengisi beendakamizwa ngombana abanabuyo.
","bana ba bangata e ba mahlatsipa a dilalome tsa tlhekefetso ya motabo, ditlolo tsa molao tsa maqulwana a dinokwane le barekisi ba dithethefatsi hobane ba ka ba kotsing ha bonolo.
",0.6232065
"si mphakathi sitlhoga ukuzimisela nokulima indima ekuvikeleni abentabethu eengozinezi.
","jwalo ka setjhaba, re tshwanela ho ba sedi re be re ipabole ntlheng ya ho tshireletsa bana ba rona dikotsing tsena esita le tse ding.
",0.52191067
"simphakathi kudingeka bona sitjale isiko lokuziphendulela.
","jwalo ka setjhaba, re tshwanela ho thea tlwaelo ya ho ba le boikarabelo.
",0.4778
"kufuze siziphendulele kithi ngokwethu, senzele abentabethu nabanye.
","re tshwanela ho ba le bo ikarabelo, molemong wa bana ba rona le ba bang.
",0.4889204
"nje ngalokha sitlhoga ukuqinise kisa bonyana abentwana ba kghona ukukhulela endaweni ephephileko, ethokomeleko nekhuthazako, kufuze nathi sizizwele umsebenzi wokuvikela nokunakekela boke labo esibaziko nesinetjhebiswano nabo.
","jwaloka ha re tshwanela ho netefatsa hore bana ba kgona ho holela tikolohong e bolokehileng, ba baletswe mme re hahamalle boemong ba hore re tle re kgone ho ikutlwa re na le boikarabelo ba ho tshireletsa le ho kgathalla bohle bao re ba tsebang, esita le ho buisana le bona.
",0.6519281
"kufuze kube mthwalo wethu ukutjheja eendleleni.
","re tlameha ho ikutlwa re na le boikarabelo le tsotello mebileng.
",0.16946393
"nanyana sikwamukela ukwehla kwesibalo sabahlongakalele eengozini zendlela kilesisikhathi sokuphumula, iqiniso lendaba kukobana bangaphezulu kwe1,600 abahlongakalele eendleleni zethu esikhathini esingaba yinyanga nesiquntu.
","leha re amohela phokotseho ya dikotsi mebileng nakong ya sehla sa matsatsi a phomolo a phethelang selemo, se nyarosang ke hore ke batho ba fetang 1,600 ba ileng ba hlo kahalla mebileng ya rona na kong ya kgwedi le halofo feela.
",0.6472521
"kuzwisa ubuhlungu ukubikelwa bona abatjhayeli abangaphezu kwee9 000 babotjhelwe imilandu efaka hlangana ukutjhayela basele, ukutjhayela ngebelo eliphezulu nokutjhayela ngokungatjheji.
","se tshosang ke hore bakga nni ba fetang 9,000 ba ile ba kwalelwa ditlolo tsa molao tse kenyeletsang ho kganna tlasa ba tahilwe, lebelo le hodimo, ho kganna ha bohlaswa le ho se tsotelle.
",0.424779
"isikopilo lokuziphendulela libiza bonyana kufuze soke sitjhayele ngokuphepha nangokuhlonipha amalungelo wabakhamba ngeenyawo nabanye abasebenzisi beendlela.
","tlwaelo ya ho nka boikarabelo e bolela hore re tlameha ho dula re kganna hantle re bile re hlompha ditokelo tsa ditaaso le basebedisi ba bang ba mebila.
",0.54958236
"isikopilo lokuziphendulela litjho bonyana kufuze abobaba babe yingcenye ekulu epi lweni yabentababo.
","tlwaelo ya ho ba le boikarabelo e bolela hore bontate ba hloka ho ba teng maphelong a bana ba bona.
",0.48174164
"abomma abanengi baqalene nomsebenzi wokukhulisa abentwana babodwa, lokhu kuletha ukwehla kwethemba lokuphe pha nelokhunye kibo nebe ntwaneni babo.
","ke basadi ba bangata ba tlamehang ho hodisa bana ba le bang, e leng ntho e fokotsang makgabane a bona le a bana ba bona.
",0.59435356
"umukghwa wokuziphe ndulela utjho bonyana kufuze siye emsemeni ngendlela ephephileko singazibizeli ihiv .
","tlwaelo ya ho ba le boikarabelo e boela hore re tlameha ho ba le thobalano e bolokehileng hore re se ke ra iphumana re le kotsing ya ho tshwaetswa ke hiv kapa ho tshwaetsa ba bang ka yona.
",0.5836341
"singaseli utjwala khulu nofana sisebenzise iindakamizwa.
","ha re a tlameha ho sebedisa jwala le dithethefatsi hampe.
",0.44913414
"kufuze siphile ipilo ephephileko sikhandele amalwele anokuvikeleka sikwazi ukuphila isikhathi eside.
","re tlameha ho pheella ho phela maphelo a matle hore re tle re pheme mahloko ao e leng hore a ka thibelwa ka hohlehohle, re be re phele maphelo a malelele.
",0.5209794
"isikopilo le kufuze ikhuthazwe ngilabo abaseenkhundleni zokuphatha emphakathini, kungaba barholi bezekolo nofana abasopolotiki, abarholi bendabuko nabosaziwako.
","tlwaelo e jwalo ka ena e tlameha ho ananelwa, haholoholo ke bohle ba nang le tshusumetso esita le ba apesitsweng matla a bolaodi setjhabeng, hore na ke baetapele ba sedumedi kapa ba dipolotiki, ba setso kapa dikgalala tse tummeng.
",0.47717583
"ngeenkulumo nezenzo zabo, kufuze banqophe ukwakha umphakathi ongcono lapho woke umuntu athokoziswa khona ngokuhle akwenzileko begodu atjhejwa khona.
","ka mantswe le diketso tsa bona, ba tlameha ho batla ho aha setjhaba se betere, seo bohle ba ka se ananelang ba be ba se kgathalle.
",0.53794855
"iimphathimandla ezikhethiweko nabasebenzi bombuso bathweswe umsebenzi wokuqinisekisa ukuphepha nokuqa lelela zehlalakuhle yezakha muzi.
","baetapele ba kgethilweng hammoho le basebetsi ba mmuso, ba tshepetswe boikarabelo ba ho netefatsa hore ho ba le tshireletso le paballo ya baahi.
",0.5465353
"kufuze baqinisekise bonyana kunomthangalasisekelo owaneleko nophephileko eenkolweni.
","ba tlameha ho netefatsa hore ho na le meaho ya sekolo e lekaneng mme e bolokehileng.
",0.4803028
"kufuze beqe msi nyana nakuphazamiseka ukuni kelwa kwamanzi emphakathini nofana nakubikwa bona iimbani zestradeni azikhanyi.
","ba tlameha ho potlakela ho tlaleha haeba ho na le tshitiso phepelong ya metsi dibakeng tsa rona, kapa ha mabone a mebileng a sa sebetse hantle.
",0.6227731
"kufuze baqinisekise bonyana imithetho yezamaphilo nokuphepha iyalandelwa begodu nokuthi umthetho uyahlonitjhwa bewuthotjelwe.
","ba tlameha ho netefatsa hore melao ya bophelo bo botle le ya tshireletso, e a hlokomelwa.
",0.4252606
"phezu komsebenzi karhu lumende oragako, kiyo yoke imikhakha ngomnqopho wokuphumelelisa umsebenzi lo, sizifumene sikateleleka ukuthatha amagadango angakajayeleki.
","hodima mosebetsi o ntseng o tswelapele mmusong ka bophara, mekgahlelong yohle, ho phethahatsa boikarabelo bona, re ile ra tlameha hore ka dinako tse ding re nke dikgato tse sa tlwaelehang.
",0.48977602
"ukuziphe ndulela ngokuhlongakala kwabentwana neengozi ezi bangelwa kuwela kwabe ntwana eendlwaneni zoku zithumela zemigodi, sihlome ijima lokuphepha ukurhabisa ukunikela ngeendlwana ezifaneleko kizo zoke iinkolo ngelizweni.
","ho arabela mafung le dikotsing tsa bana tse bakilweng ke ho wela ha bana ka mekoting ya matlwana, re ile ra thakgola lenaneo la safe ho potlakisa phano ya matlwana a tshwanetseng dikolong tsohle naheng.
",0.6363835
"sithumele ibutho lamajoni wesewula afrika (isandf) eendaweni ezithile zekapa ngehloso yokusekela amapholisa emzamweni wawo wokwehlisa inturhu yamagenge.
","re ile ra romela sesole sa naha sa aforika borwa dibakeng tsa motse kapa e le ho tshehetsa sepolesa matsapeng a sona a ho fokotsa merusu ya maqulwana a dinokwane.
",0.6232829
"mhlapha nje, ngokubambisana no mphakathi, sihlome iqhinga eli rhabako lokuphelisa inturhu eqothele abomma nabentwana.
","haufinyane tjena, re ile, mmoho le ditho tsa setjhaba, ra kena leanong la karabelo ya tshohanyetso ya ho fedisa dikgoka kgahlano le basadi le bana.
",0.54613703
"kusese kunengi esitlhoga ukukwenza singurhulumende ngokubambisana no mphakathi.
","empa, ho ntse ho ena le tse ngata tse tshwanelang ho etswa, ke mmuso le setjhaba.
",0.38596264
"sibuka imisebenzi yezakhamuzi neenhlangano ezizinikele emsebenzini wokutjheja ihlalakuhle yabanye.
","re thoholetsa batho le mekgatlo eo e itlammeng ka ho nka boikarabelo molemong wa paballo ya ba bang.
",0.52928627
"sikhuluma ngabantu abafana noralph bouwers nomark nicholson, abahlela imidlalo yokuzithabisa elavender hill esekapa ngomnqopho wokukhandela ilutjha bona lingangeneleli ezenzweni zamagenge.
","ho na le batho ba kang ralph bouwers le mark nicholson, ba hlophisang diketsahalo tsa boithapollo molemong wa batjha mane lavender hill e motse kapa, ho etsetsa hore ba se ke ba kena boqulwaneng ba dinokwane.
",0.7649856
"kunabomma, abodade namadodakazi ababafundi nabazinikeleko ehlanga nweni yeoperation bobbi bear, ekuyihlangano yeamanzi mtoti kwazulunatala enikela abentwana abahlukunyeziweko indawo yokufihla ihloko.
","ho na le bomme, dikgaitsedi le baradi ba sebetsang e le baithuti ba baithaopi ba operation bobbi bear, mokgatlo o amanzimtoti mane kwazulunatal o fang batjha ba bao e leng mahlatsipa a tlhekefetso lehae.
",0.7319156
"kuneenqhema zezekolo ezinengi ezinjengesouthern african catholic bishops’ conference, engihlangene nazo mhlapha bangitjela ngomsebenzi abawenzako ukutjhejana neendingo zabatlhagako, ukusekela imindeni kobana itjheje nokusiza ilutjha ekuqalaneni neentjhijilo ezibembetheko.
","dihlopha tsa tumelo tse kang seboka sa babishopo ba katolike sa aforika borwa, seo ke ileng ka kopana le sona haufinyane,se ile sa mphetela ka mosebetsi oo se o etsang ho arabela ditlhokong tsa bafutsana, ho tshehetsa ma lapa hore a be le tlhokomelo, a hodise a be a thuse batjha hore ba tobane le diphepetso tseo ba kopanang le tsona.
",0.7255764
"amasewula afrika la asibonisa indlela.
","maaforika borwa ana a re bontsha tsela.
",0.57413316
"ngesibonelo sabo, basikhumbuza kobana kutjho ukuthini ukuziphendulela nokutjheja abanye.
","ka mehlala ya bona, ba re hopotsa hore na ho bolelang ho nka boikarabelo esita le ho ikarabella ho ba bang.
",0.4605151
"ilizweli livelelwe ziingozi ezinengi.
","naha ena e bile le ditlokotsi tse ngata haholo.
",0.42466515
"kulahleke amaphilo amanengi wabantu abatjha, kwalimala abentwana abane ngi bahlukunyezwa.
","batjha ba bangata ba ile ba lahlehelwa ke maphelo a bona, le bana ba bangata ba ile ba hlokofala ba ba ba tshoha haholo.
",0.45392042
"sisoke singakghona uku ziphelisa nya izenzo zobu nyamazanezi ezihlukumeza abantu abanganabuyo, kwa phela omunye nomunye naka ngazibophelela emsebenzini wokukhulisa ngefanelo abe ntwana beendaweni zemakha ya woke wesewula afrika.","ho aha naha e kgathallang bana vukuzenzele unnamed hona le maele a tlwaelehileng sethong sa afrika a reng ngwana o hodiswa ke setjhaba.
",0.45392042
"ummongo nomthelela weadhd neadd silusapho nyanda likhona isizo labentwana abatshwenywa bulwele bamadlharuma nokungabi nendlebe.
","dintlha tse tebileng ka adhd le add silusapho nyanda thuso e a fumaneha molemong wa bana ba nang le mahloko a kgaello ya tsotello le ya mafolofolo a feteletsengthe brains of preschool children grow at an incredible rate and help lay the foundations of language, thinking and social and emotional development.
",0.65108716
"lokha umntwana na kanobulwele bama dlharuma noku ngabi nendlebe (iadhd) nofana bokutlhayelelwa kulalela (iadd), bungelatjhwa ubujamobu njengombana bungaba nemithelela engasimihle kwasafuthi emaphilweni wabo.
","silusapho nyanda haeba ngwana ya tshwerweng ke bohloko ba kga ello ya ho tsotella le ya mafolofolo a fetele tseng (adhd) le bohloko ba kgaello ya ho tsote lla (add) ha a alafshwe, mahloko ana a ka nna a ba le ditlamorao tse mpe ka nako e telele bophelong ba hae bo botle.
",0.6878884
"lokhu kumbono kadorh.
","sena ke ho ya ka ngaka khatija jhazbhay, eo e leng hlooho ya yuniti ya twantsho ya mahloko a kelello ya bana le batjha mane sepetleleng sa townhill se pietermaritzburg.
",0.6843082
"ukhatija jhazbhay, oyihloko yeyunithi yabentwana nokululeka ngomkhumbulo etownhill hospital, esemgungundlovu, kwazulunatala.
","o hlalositse ka hore ha bana bana ba se ba hodile, ba ka iphumana ba le kotsing e tomanyana ya mahloko a mang a kelello, a jwalo ka pherekano le tshithabelo ya maikutlo, mme ba ka boela ba sebedisa dithethefatsi hampe.
",0.6568964
"wahlathulula bonyana njengabantu abadala, abentwanaba nasele bakhulile bangaba sengozini yasafuthi yamalwele womkhubulo, njengokwethukwa nokugandeleleka komkhumbulo, kanti bangasebenzisa imitjhoga butjhwileni.
","adhd le add di ama tswelopele ya ngwana di thutong mme le boitshwaro ba hae bo ka nna ba tshwenya batho ba bang.
",0.6021113
"iadhd neadd ziqintelisa abentwana ukuragela phambili kezefundo kanti nokuziphatha kwabo kungatlhoriya abanye abentwana.
","bana ba ka qetella ba hloilwe, ba iphumane ba kene dikgathatsong mme ba dule ba ameha dikotsing.
",0.5919478
"abentwanaba bangahloywa, bahlale basemrarweni godu kulula nokulimala kibo.
","""maemo a ngwana ka mong a qollehile mme a ntse a tswelapele, kahoo ho bohlokwa hore ho etswe dithlahlobo tsa bongaka ka botlalo ho hlwaya dintlha tse ding tse ka sitisang tswelopele ya bona, hammoho le makgabane a ka ntlafatswang ho ba thusa ho fihlella bokgoni ba bona bo feletseng,"" ho rialo ngaka jhazbhay.
",0.5920912
"""ubujamo bomntwana ngamunye buhlukile godu buyatjhuguluka, ngalokhoke kuqakathekile ukuhlolisisa kubonwe abanye abonobangela abangaba nomthelela ekukhuleni kwabo, kunye namandla wabo angakhelela ukubasiza ukusebenzisa amakghonwabo ngokuzeleko,"" kwatjho udorh.
","o hlalositse hore adhd le add ke phokolo ya tswelopele ya kelello e iponahatsang ka mathata a boitshwaro, a jwalo ka ho se tsotelle.
",0.63322586
"jhazbhay.
","hona ho bonahala ka mo kgwa wa: ho etsa diphoso tse bohla swa ho se phethele mesebetsi ho lahla dintho ho sitiseha ha bobebe le bolebadimehlala ya mafolofolo a feteletseng kapa diketso tse sa laoleheng e akga: ho tshwaratshwara ho opaka matsoho kapa ho qhomaqhoma ho hloka botsitso setulong sa bona ho phatloha ka dikarabo le ho raoha ha a tshwanetse hore a dule fatshe.
",0.35915872
"wahlathulula bonyana iadhd neadd malwele aphazamisa imizwa okudala ubudisi beminyakazo nokuziphatha, okufana nokungalaleli.
","""matshwao a iponahatsa ka mekgwa e mmedi kapa e me ngata – lapeng, sekolong, le ho metswalle kapa ba leloko kapa nakong ya diketsahalo tse ding tse itseng – a ka sitisa ditshebetso tsa phedisano, mosebetsing kapa sekolong.
",0.4978792
"lokhu kubonakala: ngokwenza iimphoso ezingamukelekiko ukungaqedi imisebenzi ukulahla izinto ukuphazamiseka lula nokulibalaiimbonelo zamadlharuma no kwenza izinto butjhwileni kufaka hlangana ukungahlaliseki ukudlalisa izandla namkha iinyawo ukungahlaliseki esitulweni ukuphahluka lokha umntwana nakanikela ipe ndulo nokusikima naku fanele ahlale phasi.
","dintlha tse tebileng ka adhd le add silusapho nyanda thuso e a fumaneha molemong wa bana ba nang le mahloko a kgaello ya tsotello le ya mafolofolo a feteletsengthe brains of preschool children grow at an incredible rate and help lay the foundations of language, thinking and social and emotional development.
",0.4978792
"abantu abatjha balingomuso lelizwe lekhethu vukuzenzele unnamed ukucocisana nabantu abatjha kuhlala ku ngitjhiya ngivuse lelekile.
","batjha ke bokamoso ba naha ya rona vukuzenzele unnamed ho phura lepshetla le batjha ho dula ho ntshiya ke le mafolofolo.
",0.71411765
"kuyathabisa uku zwisisa imizabalazo yabo nokunqoba kwabo kunye nenembombono yabo malu ngana nokuthi kungenziwani ukwenza ilizwe lekhethu libe ngcono.
","ho a thabisa ho fumana maikutlo a bona ka mathata a teng ditshotlehong tsa bona, esita le tjhe belopeleng ya bona ka se ka etsuwang ho ntlafatsa naha ena.
",0.6460733
"yinto engeze yaphikiswa ukuthi ukuba khona kwelutjha kuqakatheke khulu emmoyeni nangesakheko sobunjalo besi tjhaba sekhethu.
","ha ho potang hore boteng ba batjha ke ntho ya bohlokwa botebong le boitshwarong bo botle naheng ya rona.
",0.49426225
"nanyana kunekolelo ekhuthako ethi abantu abatjha bazibona balungile ngakho koke abangikho, abanandaba neendaba zepolitiki namkha into abayaziko kukuzibekelela nje kwaphela, irhubhululo lalapha ekhethu nelemazweni ngamazwe soke isikhathi lifakazela ukuthi abantu abatjha ephasini zombelele bahlala banommoya nethemba elihle ngamathubabo wepumelelo.
","ntle le mohopolo wa hore ba ipona ba kgotsofetse, e bile ba se na thahasello dipolotiking, boithuto ba kwano lapeng le ba matjhabeng bo ntse bo netefa tsa hore batjha lefatsheng lohle ba dula ba thahasella tseo ba di bonang di le molemo ho bona.
",0.33221272
"ngokutjho kwehlolombono yakwaipsos ebizwa ngokuthi yipulse of the people emenyezelwe ngenyanga kanobayeni, ama61% wamasewula afrika weminyaka yobudala ehlangana kwe15 ne17 ahlalele ethembeni ngo mnyaka wee2020.
","ho ya ka diphumano tsa boithuto tsa ipsos pulse of the people tse ntshitsweng ka pherekgong, 61% ya ma aforika borwa a dipakeng tsa dilemo tse 15 ho isa ho tse 17 a ikutlwa a na le tshepo mabapi le 2020. ha ke na qeaqeo ya hore ana ke maikutlo ao batjha ka kakaretso ba nang le ona, haholo holo sehlopha se tswetsweng mothinyeng wa selemokgolo, bao jwale ba qalang ho kena bophelong ba bona ba boholo, ke bona bana bao le ba bitsang ma2000.
",0.720734
"anginakuzaza ngokuthi lo mbono wabantu abatjha abanengi, khulu khulu isizukulwani esibelethwe ekupheleni komnyakakulungwana esikiwo lo abakhona bangena esigabeni sabantu abakhulu njenganje, laba ilutjha elibabiza ngokuthi ma2000.
","ke bara le baradi ba tswe tsweng kamora demokrasi.
",0.4616947
"godu bamadodana nabe ntazana ababelethwe ngemva kokufika kombuso wentando yenengi.
","leha ba se na malebela a mahlo noko a puso ya kgethollo ka kotloloho, ba ntse ba tswelapele ho phela le masalla a yona a ho se lekane ha merabe, tlhokeho ya toka esita le bofuma.
",0.60588837
"nanyana banga khange bacatjhazelwe bu nqopha lilunya lombuso we bandlululo (iapartheid) nje, kodwana solo baphila nomsalela webandlululo lokutjhiyana ngendima, lokuhlukaniselwa iindawo zokuhlala ngendlela engakalungi kunye newobuchaka.
","batjha bana ba a itshepa ebile ba na le dithahasello.
",0.51869285
"abantu abatjhaba bayazithemba, baneqiniso ngezinto abazenzako, baphuphuma itjisakalo yepumelelo.
","ba tseba ditokelo tsa bona ebile ha ba tshabe ho di tseka.
",0.42522207
"bayawazi amalungelwabo begodu abesabi ukugandelela isidingo sokobana kufanele banikelwe wona.
","batjha ba naha ya rona ba emetse mafolofolo, tshepo, monate, bokgoni, bokamoso le tokoloho.
",0.527354
"ilutjha lekhethu lijamele amajadu, ithemba, ithabo, amandla wokwenza, ingomuso nekululeko.
","ke matswallwa a disebedi swa tsa dijithale mme ba a the lla tshebedisong ya dithe knoloji tsa sejwalejwale, ebile ba habile ho kena mesebetsing e neng e le siyo ho hang dinakong tsa batswadi ba bona.
",0.6423603
"basizukulwani esinelwazi elingeneleleko lokusetjenziswa kwecwephetjhe nethekhnoloji yesimodeni begodu banelukuluku lokungena emabizelweni ayengekho nokuba khona ngeenkhathi zababelethi babo.
","letsatsing le etellang la puo ya boemo ba naha (sona) pele, ke bile le monyetla wa ho buisana le sehlopha sa batjha ba mahlahahlaha motshetshe thong wa meloko e kopantswe ng o neng o epilwe ke lekgo tla la naha la ntshetsopele ya batjha (nyda).
",0.34180808
"ngaphambi kwelanga lokwe thula ikulumo yobujamo beli zwe (isona), ngaba nethuba elikhethekileko lokucocisana nesiqhenyana sabantu abatjha abamajadu ekulumiswaneni evange iinzukulwani ngeenga ba ezitjhiyanako eyayibizwe yiejensi yezokuthuthukiswa kwelutjha yelizweloke – (inyda).
","re tshohlile ka dintho tse bohlokwa ka ho fetisisa batjheng ra ba ra hlahloba mekgwa eo ka yona re ka di amanyang le maikutlo a rona esita le diketso tsa rona.
",0.555247
"sicocisene ngeendaba eziqakatheke khulu ebantwini abatjha sabe sahlola neendlela esingathomanisa ngazo imibono nezenzo zethu.
","ka tlwaelo, ho fumana mesebetsi le menyetla ke tsona dintho tse neng di kgurume ditse motshetshetho oo.
",0.5000446
"veleke, imikhulumiswano yethu beyande khulu ngokutholakala kwemisebenzi namathuba wemisebenzi.
","ba thong ba batjha ba 1.2 milione ba kenang letsholong la ho ba tla mesebetsi selemo le se lemo, e ka ba karolo ya pedi borarong ya ba dulang ba sa sebetse kapa ba sa ithute.
",0.457739
"ebantwini abatjha abayi1.2 yeengidi abasathoma uku sebenza qobe mnyaka, pheze babili kabathathu babo bagcina bangasebenzi, bangafundi nokufunda.
","ba neng ba nka seabo mo tshetshethong oo ba amohetse nnete ya hore taba ya mese betsi ya batjha e nketswe hloo hong maemong a hodimodi mo mmusong.
",0.546549
"abebakhulumisana ekulumiswaneni le bathokozela ukuthi indaba yomsebenzi ebantwini abatjha itjhejwa ezingeni eliphezulu likarhulumende.
","empa mohoo oo o ne o tlwaelehile: ba ne ba le malalaalaotswe ba bile ba na le bokgoni ba ho kenya letsoho moruong ka mekgwa e fapaneng, ho akga le ho ba bahwebi, empa ditshita tsa bo tsamaisi le kgaello ya ditjhe lete di ba thibela ho etsa jwalo.
",0.548303
"kodwana seyindaba ejayelekileko nakilelihlandla: bakulungele bebanekghono lokufaka isandla emnothweni ngeendlela ezihlukahlukileko, ekubalwa hlangana nazo nokuba bosomabhizinisi, kodwana uburhiyarhiya bemibandela yekambiso kunye nokutlhogeka kweemali zokusekela kuya baliya ukwenza lokho esele balungele ukukwenza.
","jwaloka ha bright hlongwa ne wa batjha ba kgwebong aforika borwa a ile a mpole lla, ho hlokeha hore ho be teng dithuso tse ngatanyana tsa ditjhelete tse lebiswang ho batjha ba bahwebi.
",0.59238327
"njengoba ubright hlongwa ne weyouth in business south africa akhe atjho kimi, kufuze kwandiswe imali ekusekelwa ngayo abosomabhizinisi aba tjha.
","ba lakatsa ho kopana le ditheo tse fapafapaneng tsa ditjhelete, ditheo tsa ditjhelete tsa ntshetsopele, batsetedi ba adimanang ka tjhelete, batsetedi ba tsetelang dikhamphaneng tsa poraefete esita le dibanka tse kgolo tse fanang ka sekoloto di be di ikakgele lerapo molaleng ka batjha ba bahwebi.
",0.68097323
"bangathanda ukubona imihlobohlobo yeenjamiso zeemali, iinhlangano zeemali eziqalelela ituthuko, abasisi abanomusa, amafemu wangeqadi wokulinganiseka komsebenzi kunye nama bhanka akweledisako nasiza abosomabhizinisi abatjha.
","hore naha ya rona e atlehe e be e tswelepele, re tlameha ho etsa makgobonthithi ohle ao re ka a kgonang ho netefatsa hore batjha ba kgona ho kenya letsoho ka mokgwa o bona halang moruong wa rona, le haeba e le mesebetsing eo ba hirilweng semmuso ho yona kapa moo ba itshebetsang.
",0.573779
