src_text,tgt_text,cosine_score
ukusungulwa kweyunidi le ngenye yeendlela esizisebe nzisako ukuqeda ikohlakalo kurhulumende begodu sizo yiqeda mbala ikohlakalo kiyo yoke imikhakha yemisebenzi yesewula afrika.,"ho fedisa bobodu tshebeletsong ya setjhaba vukuzenzele unnamed tshenolo ya pala menteng ya hore basebetsi ba mmu so ba diketekete ba ntse ba fumana matlole a dithuso tsa setjhaba ka bokunyata kgwedi le kgwedi e bo ntsha hore re ntse re sa na le leeto le le telele leo re lokelang ho le nka ho ke nya tlwaelo ya maitshwa ro a matle tshebeletsong ya setjhaba.
",0.5311991
"ihlelo likamengameli lokuvula imisebenzi lisunduzela ukuvulwa kwemisebenzi vukuzenzele unnamed ukusikinyiswa kwamhlapha kwesigaba sesi bili sehlelo likamenga meli lokuvula imise benzi kuliliqha elikhulu emzameni wethu wokuvulela amasewula afri ka angasebenziko imise benzi.
","letsholo la ho bopa menyetla ya mesebetsi la boporesidente le kgothaletsa tlhahiso ya mesebetsi vukuzenzele unnamed ho thakgolwa ha moraorao ha mo kgahlelo wa bobe di waletsholo la ho bopa mesebetsi la boporeside nte ho bontsha kgatelopele e kgolo morerong wa rona wa ho bopa menyetla ya mesebetsi bakeng sa ma afrika borwa a hlokang mosebetsi.
",0.6811419
"sivule ihlelo lokukhuthaza ukwakhiwa nokuvulwa kwemisebenzi nyakenye ngomnqopho wokuvula amathuba wemisebenzi amanengi ngendlela ekunga kghonakala ngayo nge sikhatjhana esifitjhazana khulu.
","re thehile letsholo la ho bopa mesebetsi la boporesi dente gwahola bakeng sa ho hlahisa menyetla e mengata kamoo ho ka kgonehang ka nako e kgutshwane kamoo ho ka kgonehang.
",0.3007152
"lokhuke kwenza ukuthi kufuneke ukuthi kutholakale iindlela ezitja zokuphumelelisa amahlelo amalungana nalokhu ngebelo elikhulu ekungakhange khekusetjenzwe ngalo pham bilini nangomthamo omkhulu kinayo yoke eyakhe yaba khona.
","sena se qositse ditsela tse ntjha le tsa ntjhafatso tsa ho sebeletsa ho kenya tshebetsong mananeo ka lebelo le bongata bo so kang bo bonwa.
",0.23149942
"ihlelo lokutholela abantu abanengi ebebangasebenzi umsebenzi lisebenzise iinkundla zeendlela zokuthintana ezibudijithali ukufika ebantwini abalungele umsebenzi abanengi ngokukghonakalako.
","motjha wa ho thaotha batho ba bangata ba sa sebetseng o ne o sebedisa mapatlelo a dijithale bakeng sa ho fihlella bankakarolo ba tshwanele hang ba bangata kamoo ho ka kgonehang.
",0.62406874
"isibonelo, abosomaplasi abancani bakghone ukwenza iimbawo zokusekelwa ngeussd bathola amavawutjha woku basiza emaselifowunini wabo.
","ka mohlala, dihwai tse nyane di kgonne ho etsa dikopo tsa tshehetso ka ho romela sms le ho fumana divaotjhara tsa ho sebedisa diselfounu tsa tsona.
",0.4008345
"solo umnyango weze fundo esisekelo uvulele iimbawo zesiqhema esi landelako sabasizi beenkolo mhlapha, bangaphezulu kwee940 000 abantu abatjha abafake iimbawo zabo ngekundla engabhadalelwako ebizwa ngokuthi yisayouth.
","esale lefapha la thuto ya motheo le bulela dikopo tsa lebotho le latelang la bathusi ba matitjhere haufinyana tjena, batjha ba fetang 940 000 ba entse dikopo ka ho sebe disa lepatlelo la ho thaotha le sa lefellweng le bitswang sa youth.
",0.7071923
"mobi, eyingcenye yepathway management net work yelizwe loke.
","mobi, le bopang karolo ya naha ya marangrang a motjha wa bolaodi.
",0.57805556
"ukusetjenziswa kwa mahlelo wethekhnoloji amatjha ekuvuleni amathuba wemisebenzi kwenze umsebenzi wokuqatjha ube lula khulu, ube msinyana begodu wenzelwe emkhanyweni ngcono kunaphambilini.
","tshebediso ya dithekenoloji tse ntjha mabapi le ho fana ka menyetla ya khiro e entse hore ho thaotha ho be bonolo, ho potlake le ho ba le ponaletso.
",0.56452876
"ihlelo likamengameli lokuvula imisebenzi likghonakalise ukusebenzisana ekorweni yembusweni.
","letsholo la ho bopa mese betsi la boporesidente le thusitse le ho akofisa tshebedi sano ka hara lekala la mmuso.
",0.60100734
"amahlelo wesigaba sokuthoma aphunyeleliswa minyango yombuso eli11.
","mananeo a mokgahlelo wa pele a ile a kenngwa tshe betsong ke mafapha a naha a 11. mesebetsi ya ona e ne e momahantswe bakeng sa ho phema ho iphetapheta le tshenyo le ho matlafatsa ho ithuta ka boiphihlelo ba a mang.
",0.54113317
"okwakwenziwa ngamahlelo lawa kwakukhambisana ngoku vumelana kobanyana kuzokubalekelwa ukubuyeleleka kwento yinye nokusetjenziswa kwemi thombo yamandla ngokungakafaneli nokukhuthazwa kokufunda ngelimuko labanye.
","letsholo la ho bopa mese betsi la boporesidente le boetse e bontshitse bohlokwa ba ho sebedisana ha baahi se tjhabeng mmuso, dikgwebo, mekgatlo ya basebetsi le se tjhaba ka kakaretso di ipopile mmoho bakeng sa ho thusa ba hlokang mesebetsi ho ba le seabo moruong.
",0.5885171
"ukukhuthazwa kokuvulwa kwemisebenzi kubuye godu kwatjengisa ukuqakatheka kokusebenzisana nomp hakathi.
","se ka fetang halofo ya milione ya maafrika borwa e se e kgotse molemo mokgahlelong wa pele, moo ho ntseng ho na le mananeo a mang a mo tjheng.
",0.5648341
"urhulumende, amabhizinisi, zabasebenzi kunye neenhlangano zomphakathi, boke bahlanganele ukubabuthela emnothweni labo abangasebenziko.
","bankakarolo ba ile ba nehwa monyetla wa ho una boiphediso, ho ithuta maitse belo a matjha le ho ntlafatsa a ntseng a le teng, le ho sebedisa boiphihlelo ba bona jwaloka motheo wa ho thola mesebetsi e meng kapa ho itshebetsa.
",0.5934322
"angaphezulu kwesi quntu sesigidi amasewula afrika esele azuzile esiga beni sokuthoma, esisese namahlelo ambadlwana asaragako.
","ka mohlala, palo e ngata ya bankakarolo ba hirilweng ke lefapha la mesebetsi ya setjhaba le infrastraktjha mokgahlelong wa lona wa pele wa mananeo a lona ba ile ba hirwa lekaleng la poraefete mafelong a tlhakubele 2021. bongata ba lebotho la pele la bathusi ba matitjhere, le bona, ba kgona ho thola mesebetsi, ba hlometse ka boiphihlelo, thupello le ditshupiso.
",0.6526418
"abangene esigabenesi banikelwe ithuba lokuthola umthombo wokuziphilisa, bafunde amakghonofundwa amatjha bakhuphule nalawo esele banawo, basebenzise nelimuko labo njengesi sekelo sokuthola omunye umsebenzi namkha sokuzivulela umsebenzi abangazi sebenza ngawo.
","mananeo a kentsweng tshe betsong ka letsholo la ho bopa mesebetsi la boporesidente a boetse a tswetse badudi ka bophara molemo.
",0.49850398
"isibonelo, bambadlwana abantu abaqatjhwe mnya ngo wezemisebenzi ka rhulumende nezemithangalasisekelo esigabeni sawo sokuthoma abathe nakuphela untaka wee2021 babe sebakghone ukuthola umsebenzi ekorweni yangeqadi.
","tjantjello e ne e le hodima tlhahiso ya mesebetsi makaleng a nang le kgahlamelo e otlolohileng hodima setjhaba a kang thuto, kanetso ya dijo, tokiso ya infrastraktjha ya setjhaba le tshireletso ya tikoloho.
",0.6691313
"abanengi balabo ababe sesiqhemeni sokuthoma sabasizi besikolweni, nabo ngokunjalo bagcine bathole umsebenzi, sebahlome ngele muko, sebathwasiselwe nomsebenzi, sebaphethe godu neencwadi ezifakazela ilwazi lokusebenza abanalo.
","ka letsholo la ho bopa mese betsi la boporesidente batjha ba ile ba hirelwa ho tshehetsa le ho thusa matitjhere diko long tsa rona.
",0.5164964
"amahlelo aphunyeleliswe ngehlelo likamengameli lokuvula imisebenzi selawu size ngokunabileko umphakathi.
","ba bang ba ile ba hirelwa ho aha marokgo metseng ya mahae.
",0.493572
"laphake bekuqalwe ukuvulwa kom sebenzi emakorweni anegalelo eliya phezu ko mphakathi poro, njengefundo, ukutholakala kokudla, ukutjhejwa komthangalasisekelo wo mphakathi kunye nokuvi kelwa kwebhoduluko.
","ditsi tse ngata tsa dikolo tsa dikonyana di ile tsa thuswa ho phela le ho bula botjha.
",0.52852833
"ngalelihlelo likamenga meli lokuvula imisebenzi, abantu abatjha baqatjhelwe ukusekela nokusiza abotitjhere eenkolweni zelizwe lekhethu.
","dihwai tse sebeletsang ho iphedisa di ile tsa tshehetswa mabapi le ho ntlafatsa tlhahiso, mme dithepa tsa tikoloho tse kang dinoka le mekgwabo di ile tsa tsosoloswa le ho baballwa.
",0.56251806
"abanye baqatjhelwe ukwakha amabhlorho eendaweni zemakhaya.
","jwaloka karolo ya mo kgahlelo wa bobedi, re theha letsholo la ho bopa mesebetsi la boporesidente le tla tshe hetsa mosebetsi molemong wa bohle le eteletsweng pele ke mekgatlo ya badudi dibakeng tse fapafapaneng tse kang temo ya metse ya ditoropo, bonono ba setjhaba, ntlafatso ya dibaka tsa mekhukhu le boipaballo ba badudi.
",0.59747297
"amanengi amaziko wokukhulisa umntwana kwebuncanini (amaecd) asizwe ukuthi abambelele abe avulwe ngobutjha.
","hara bothata bo matla ba moruo bo bakilweng ke sewa sa lefu la kokwanahloko ya corona, khiro ya setjhaba le kahisano di fanne ka tlhasi mollo ya bohlokwa mabapi le tlhahiso ya mesebetsi.
",0.6177938
"abalimi abalimela/abafuyela ukuziphilisa basekelwe ukuthi bandise umkhiqizwabo, namafa webhoduluko anjengemilambo neemphande zeentete kwavuselelwa kwabe kwatjhejwa.
","sena ke ho kenngwa tshebetsong ha boitlamo ba rona ba hore puso e lokela ho tshehetsa khiro ka mafolofolo ha mmaraka wa basebetsi o ntse o hla phohelwa.
",0.62046504
"njengengcenye yesigaba sesibili, sivula isikhwama sezemisebenzi yomphakathi esizakusekela umsebenzi owenzela woke umuntu ubuhle, ozabe udoswa phambili ziinhlangano zomphakathi emakorweni amihlobohlobo anjengezokulima eendaweni zemadrobheni, ubugwali bomphakathi, ukuphakanyiswa kweendawo zokuhlala ezingakahleleki kunye nokuphepha komphakathi.
","ka letsholo la ho bopa mesebetsi la boporesidente re kentse palo e ngata ya batjha ka hara lebotho la basebetsi ka tsela e so kang e bonwa ka nakwana e nyane.
",0.53569984
"ebujameni bobudisi bezomnotho obubangelwe sisifo sengogwana icorona esirhageleko, ukuqatjhwa kwabantu embusweni nemphakathini kube sikhu thazo esiqakathekileko sokuvulwa kwemisebenzi.
","se ka etsang 84% ya bankakarolo mokgahlelong wa pele e bile batjha ba ka tlasa dilemo tse 35, mme nngwe tharong ebile basadi.
",0.4832684
"lokhuke kuphunyeleliswa kukuzibophelela kwethu okuthi umbuso kufuze usekele ukuvulwa kwemisebenzi, imakethe yezemisebenzi nayisalwela ukuvuka.
","mokgahlelong wa bobedi re lebeletse hore palo ena e batle e phahama, kaha letsholo le tla fana ka se ka etsang r1 bilione ya thuso ya matlole bakeng sa boitshunyako ba khiro ya batjha ke boporesidente.
",0.59893316
"ngehlelo likamengameli lokuvula imisebenzi, nge sikhatjhana esifitjhani sifake abantu abatjha emsebe nzini ngobunengi ngendlela engakhange kheyenzeke.
","jwaloka karolo ya boi tshunyako, batjha ba seng bakae ba tla thaothelwa ka hara tshebeletso ya naha ya batjha e hlabolotsweng botjha.
",0.6250912
"abantu abangaba ma84% ababe sesigabeni sokuthoma sehlelweli kube babantu abatjha beminya ka yobudala engaphasi kwama35, kanti babili kabathathu babo bekubabantu abasikazi.
","batjha ba tla fumana thu pello ya maitsebelo a dijithale mme dikgwebo tseo e leng tsa batjha di tla thola tshehetso ya ho hola le ho hira.
",0.62056303
"esigabeni sesibili silindele ukuthi lelinani liphakame, njengoba phela ihlelo lokukhuthaza umsebenzi lizokukhupha pheze ibhiliyoni yamaranda yokusekela igadango likamengameli lokuqatjhwa kwelutjha.
","tlhokeho ya mesebetsi ka hara naha ya bo rona ke tlokotsi.
",0.38053763
"njengengcenye yega dangweli, abantu abatjha abambadlwana bazokubi zelwa ephikweni lelutjha lelizwe elivuselelweko.
","re keke ra kgona ho mamella ditiehiso tse sa feleng mabapi le ho tobana le bothata bona ka lebaka la melao e mengata, metjha ya ho thaotha e siilweng ke nako, kgaello ya bokgoni le meralo, kapa mananeo a sa re iseng pele kapa ao e seng a moshwelella.
",0.5561676
"abantu abatjha bazoku thwasiselwa amakgho nofundwa wobudijithali kantike amabhizinisi welutjha azakusekelelwa ukukhula nokuqatjha.
","katleho ya letsholo la ho bopa mesebetsi la boporesi dente le bontshitse hore ha re sebetsa mmoho, re potlaka, re nahana hantle le ho laola mehlodi ya rona ka nepo, re ka ba le kgahlamelo e matla.
",0.4843452
"ukutlhogeka komsebenzi elizweni lekhethu kumraro orhageleko.
","letsholo la ho bopa mese betsi la boporesidente e bontshitse hore re ka hlahisa mesebetsi haeba re sebetsa mmoho jwaloka lekala la mmuso, mekgatlo ya basebetsi, badudi le mmuso.
",0.5299816
"angeze sikghone ukusolo sivinjwa kuriyada isiphelani koku lungiswa kwalomraro ngenca yehlelo eliziingaba gaba lokulawulela ukuvimba, ikambiso yokuqatjha esele yaphelelwa sikhathi, ukungabi namandla wekghono lokwenza nokuhlela, namkha amahlelo aphelela emmoyeni namkha angabambeleliko.
","letsholo la ho bopa menyetla ya mesebetsi la boporesidente le kgothaletsa tlhahiso ya mesebetsi vukuzenzele unnamed ho thakgolwa ha moraorao ha mo kgahlelo wa bobe di waletsholo la ho bopa mesebetsi la boporeside nte ho bontsha kgatelopele e kgolo morerong wa rona wa ho bopa menyetla ya mesebetsi bakeng sa ma afrika borwa a hlokang mosebetsi.
",0.5299816
"bika ubukhohlakali enomborweni yokulwa nobukhohlakali silusapho nyanda nayibe kunobukhohlakali, ukukhwabanisa, ubusela namkha okhunye nje okuphambene nokulunga ekorweni yabasebenzi bembusweni, ukhuthazwa bona ukubike lokho.
","tlaleha bobodu ka mohala o tobaneng le thibelo ya bobodu silusapho nyanda haeba o belaella diketso tsa bobodu, boqhekanyetsi, boshodu kapa diketso tse sa lokang tshebeletsong ya mmuso, o kopuwa ho di tlaleha.
",0.6876516
"ukulwa nobulelesi ekorweni yabase benzi bembusweni kusese liqalontanzi likarhu lumende; njeke inomboro yokulwisa ubukohlakali eli zweni lokeli yenza kube lula emalungeni womphakathi ukubika izenzo ezisolisa kwanga ngezobukhohlakali.
","tshitwe 2021o e tlisetswa ke dikgokahano tsa mmuso (gcis)o e tlisetswa ke dikgokahano tsa mmuso (gcis) ho fediswa ha bobo du tshebeletsong ya mmuso ho tla dula ho le lenaneng le ka pele la tshe betso ya mmuso, mme mohala wa naha o otlolohileng wa twantsho ya bobodu o nolo fatsa mokgwa wa hore baahi ba tsebe ho tlaleha diketso tse belaellwang tsa bobodu.
",0.67489195
"inomboro yokubika izenzo zobukhohlakali le yavulwa yikomitjhini yabasebenzi be mbusweni (ipsc) ngomnyaka wee2004, kantike ukusukela ngesikhatheso seyidlulile eekulungwaneni ezili100 imi biko yeensolo zobukhohlakali nezinto eziphambuke endleleni esekhe yathunyelwa babantu.
","mohala ona o ne o thakgolwe ke khomishene ya tshebeletso ya mmuso (psc) ka selemo sa 2014, mme ho tloha hona hoo, ho se ho amohetswe ditlaleho tse fetang 100 000 tsa bobodu le diqoso tsa tsamaiso e mpe.
",0.6224331
"imibiko yokubika ubukho hlakali le, ebeyisenziwa bahlabimkhosi, yenze ukuthi kuphenywe imilandu ema24 035 yobukhohlakali, yoku khwabanisa neminye, kutjho ukomitjhinara wezekoro yabasebenzi bembusweni umichael seloane, oweluse woke umsebenzi owenziwa ngilekomitjhini.
","ditlaleho tsena tse entsweng ke dihlabamokgosi di thusitse hore ho be le dinyewe tse 24 035 tsa bobodu, boqheka nyetsi le ditlolo tse ding tsa molao tse fuputswang, ho rialo mokomishenara wa tshebeletso ya mmuso michael seloane, ya okamelang mosebetsi wohle o etswang ke khomishene.
",0.67615664
"ukusukela ngomnyaka wee2020 ukuya kewe2021, ima337 imilandu ebikwe ezikweni loku bika ubukhohlakali.
","pakeng tsa selemo sa 2020 le 2021, diqoso tse 337 di tlale hilwe ka mohala ona.
",0.6886033
"ama35 wemilandu le iphathelene nokuqatjhwa kwabantu ngo kungamthetho, nokuthengwa kweensetjenziswa ngokunga mthetho ephenywa yipsc.
","tse 35 tsa tsona tse fuputswang ke psc di amana le ho hirwa le ho rekwa ha thepa ho sa etswang ka nepo tse setseng ho tsena di ile tsa fetisetswa mafapheng a mang a mmuso kapa sepoleseng bakeng la dipatlisiso.
",0.673891
"imilandu esele idluliselwe keminye iminyango karhu lumende namkha kabanye abathobelisimthetho kobanyana iyokuphenywa.
","ho abuwa ha matlo a rdp, dithendara le diphallelo tsa se tjhaba ke tse ding tsa diketso tse seng setlwaeding tse ngata ka ho fetisisa tse tlalewang.
",0.5456689
"ukwenza izinto eziphambe ne nokulunga emahlelweni wokwakhiwa kwezindlu, ze hlelo lokwakha nokuvuse lela (amardp), nemathende ni kunye neembonelelweni zomrholo wombuso yizwa ngobatjho evame khulu ukubikwa bahlabimkhosi.
","""nakong ya ho kginwa ha maeto re amohetse ditlhoko mediso tse ngata ka imeile.
",0.5080041
"""ngesikhathi sokuqinteliswa kwamakhambo sihletjelwe kanenginengi ngamaimeyili.
","re boetse re na le sistimi e itshe betsang ya ho hatisa melaetsa bakeng sa batho ba lakatsang ho letsetsa mohala ona wa rona ka morao ho dinako tsa mose betsi,"" o rialo seloane.
",0.6084455
"sinanehlelo elizirekhodela umlayezo kilabo abafisa uku fowunela inomboro yethu yokubika ubukhohlakali ngemva kwesikhathi somse benzi,"" kunaba useloane.
","o boela a re ho tloha ho nyehlisweng ha dikgato tsa ho kginwa ha maeto, ho bonahala ho bile le keketseho e tsitsitseng ya ho tlalewa ha boqhekanyetsi bo amanang le diphallelo tsa setjhaba, haholoholo diphallelo tsa kimollo ya setjhaba.
",0.5407219
"ungezelela ngokuthi solo kugedliswe imilayelo yokuqi nteliswa kwamakhambo, kuya ngokwanda ukubikwa kwamacala wokukhwabanisa aphathelene neembonelelo zo mrholo wembusweni, khulu khulu iimbonelelo zokwethula umphakathi umthwalo wobu disi bokudosa emhlweni.
","ho matlafatsa mekutu ya ho lwantsha bobodu, mmuso o ntlafaditse makala a phetha hatso ya molao ka basebetsi ba nang le tsebo, le ka ho theha fusion centre.
",0.60237795
"ukuqinisa imizamo yokulwa nobukhohlakali, umbuso uni kele abathobelisimthetho abase benzi abanamakghonofundwa, wabe wasungula neziko elibi zwa ngokuthi yifusion centre .
","setsi sena ke lemulwana la makala a phethahatso ya molao a abelanang tlhahisoleseding le disebediswa ntweng ya boqhekanyetsi le bobodu bo etsahalang thekong ya thepa le ditshebeletsong tse ama nang le covid19 .
",0.6607787
"leliziko liyihlanganisela yaba thobelisimthetho ababelana ngelwazi nangemithombo yamandla ekulwiseni ukuk hwabanisa nobukhohlakali ekuthengweni kwepahla neen setjenziswa ezikhambisana necovid19 .
","ho etsahala eng ka morao ho ho etswa ha tlhokomediso?
",0.25170863
"kwenzekani emve ni kobana kuhla tjwe umkhosi woku yelelisa?
","seloane o re ha tlhokomediso e tlalehilwe ka mohala ona, basebetsi ba tharollo ya se thato ba netefatsa hore dintlha tsa bohlokwa tsa tlhahisolese ding ena di a fanwa.
",0.21951623
"o0oo00oo useloane uthi lokhuya icala nalibikwa ngefowuni yokubika amacala, iimpha thimandla eziqalene mandla eziqalene neensombululo zamsinyana ziyahlola uku thi yoke imininingwana efa neleko ikhona na.
","tsena di kenyeletsa dintlha tsa hore mang o entse eng, tsa hore na ketso ena e tlalewang e etsahetse hokae, le hobaneng.
",0.41954532
"laphake kubalwa nemininingwana yokuthi ngubani owenzeni, nokuthi isenzo esenzekile kweso senziwe nini, kunye nokuthi kubayini owenze isenzweso asenzile.
","o re haeba tlolo ya molao e fumanwa – le ha e ka ba diketso tse fosahetseng tsa ho reka kapa ho hira, tjotjo, bobodu bo amanang le matlo a rdp, boqhekanyetsi bo di phallelong tsa setjhaba, phallo e seng molaong, ho otla, bo shodu kapa boqhekanyetsi bo bong feela – psc e kgothaletsa bohato ba tokiso bo tshwane lang ho nkuwa ke lefapha le amehang kapa e fetisetse qoso ena ho the hawks, sepolesa kapa sehlopha sa tshebetso sa twantsho ya bobodu.
",0.68872654
"uthi nayibe kutholakala ukuthi kwenziwe okupha mbene nokulunga kungaba kuthengwa kweensetje nziswa nokuqatjhwa kwa bantu ngokungamthetho, ukufunjathiswa, ubukhohla kali obuphathelene nezindlu zerdp, ukukhwabaniswa kwesibonelelo somrholo wembusweni, ukufahlela kwabantu/ukungena ngo kungemthetho elizweni lekhethu, ukubetha, ukweba namkha ukukhwabanisa – ipsc ingaphakamisa ukuthi umnyango ofaneleko uthathe amagadango wokulungisa namkha udlulisele icalelo kumahawks, emapholiseni wakwasaps namkha esiqhe meni somsebenzi wokulwa nobukhohlakali kobanyana khekuphenywe ngomlandu loyo ukuya phambili.
","diqoso tseo psc e di feti setsang mafapheng bakeng la dipatlisiso, di kenyeletsa: basebetsi ba mmuso ba etsang mesebetsi e meng e ka thoko e ba kenye tsang tjhelete kantle ho tumello ya mafapha a ba a sebe letsang; ditabatabelo tse etsang kgohlano tse sa kang tsa totobatswa le; boitshwaro bo sa lokang.
",0.66547287
"imilandu edluliselwa yipsc eminyangweni kobanyana iyokuphenywa ngile elande lako, hlangana neminye: abasebenzi bembusweni abenza umsebenzi onge zelelweko kobanyana ba zokurhola ngaphandle kwemvumo evela eminya ngweni abasebenza kiyo; ukungavezi iinrhulu phelo zakho zengeniso mali ezitjhayisana nemi thetho yokuziphatha ye mbusweni kunye nokuziphatha okupha mbana nesiko elivunye lweko lokuziphatha kwa basebenzi.
","seloane o re psc e neha mafapha a mmuso matsatsi a 60 a ho etsa dipatlisiso le ho kwala nyewe.
",0.48394278
"useloane uthi ipsc i nikela iminyango karhulumende amalanga ama60 ukuphe nya beyiqede ngomlandu.
","o re jwale lefapha le fa psc tlaleho ya tseo le di fumaneng.
",0.5848366
"uthi ngemva kwalokhoke umnyango wazisa ipsc ukuthi utholeni ephe nyweni lawo.
","""haeba re kgotsofatswa ke mehato eo lefapha le e nkileng, re tla e kwala nyewe ena, empa haeba re sa kgotsofala, re kgutlela ho bona.
",0.5624547
"""nayibe siyaneliseka ngamaga dango athethwe mnyango, siyawuvala umlandu, ko dwana nayibe sisarhonona, sibuyela kiwo umnyango.""
","""re o netefaletsa hore ha o tlo tsejwahaeba sehlabamokgosi se sa rate hore boitsebiso ba sona bo tsejwe, mosebeletsi wa psc ya mohaleng ona o tla nka feela nomoro ya hae ya mohala.
",0.6171562
"kune siqinisekiso so kungazigaguli ibizo umhlabimkhosi nakanga funiko ukwaziwa ukuthi ungubani, isiphathimandla seziko lomtato wokubika ubukhohlakali sithatha imi niningwana yokuthintana kwaphela.
","sena ke sa bohlokwa hobane haeba ho ka ha hlokeha tlha hisoleseding e eketsehileng, psc e tla tlameha ho ikopanya le yena.
",0.5337678
"lokhuke kuqa kathekile ngoba nayibe kusafuneka elinye ilwazi, ipsc kufuze ikghone uku mthinta umhlabimkhosi loyo.
","dihlabamokgosi tse tla lehang dinyewe ka mohala ona o otlolohileng wa psc di netefaletswa hore boitsebiso ba tsona bo tla pateha, haeba di lakatsa jwalo, ho rialo selo ane.
",0.61720693
"abahlabimkhosi ababika amacala ezikweni lomta to wokubika imilandu kupsc banikelwa isiqini sekiso sokuthi amabizwabo angeze avezwe nayibe ba funa ukungaziwa nofana ukungazigaguli, kuhlathu lula useloane.
","o hlalosa hore basebetsi ba tharollo ya sethatho ba rupeletswe ho netefatsa hore boitsebiso ba sehlabamokgosi bo dule bo tshireletsehile.
",0.5290415
"uhlathulula ukuthi iimphathimandla eziqale iinsombululo zam sinyana zithwasiselwe ukuqinisekisa ukuthi ibizo lomhlabimkhosi lihlala lifi hliwe.
","tlaleha bobodu ka mohala o tobaneng le thibelo ya bobodu silusapho nyanda haeba o belaella diketso tsa bobodu, boqhekanyetsi, boshodu kapa diketso tse sa lokang tshebeletsong ya mmuso, o kopuwa ho di tlaleha.
",0.5290415
"ukufaka iinlilo zegepf okwenziwe lula vukuzenzele unnamed amalunga, abase benzi esele bathe the umhlalaphasi kunye nabazuzi besikhwa ma somhlalaphasi sabase benzi bakarhulumende (igepf) kwanje sebano bubhadekelo nayibe aba kaneliseki ngendlela be nzelwa ngayo izinto.
","ho kenya ditletlebo ka gepf ho nolofaditswe vukuzenzele unnamed ditho, batho ba pentjheleng le ma jalefa a letlole la dipentjhele tsa basebetsi ba mmuso (gepf) jwale ba se ba fumana thuso ha ba ikutlwa ba sa sebeletswa hantle.
",0.3737737
"ukuqinisekisa ukuthi amalunga wegepf nemi ndeni yawo baphatheka kuhle, mhlapha ibhodi ivule iofisi esebenza ngamacala wemibango.
","ho netefatsa hore ditho tsa gepf le ba malapa a tsona ba sebeletswa kantle ho leeme, boto e sa tswa theha ofisi e sebetsanang le ditletlebo.
",0.6022249
"umbekilihlo womhlalaphasi wabase benzi bakarhulumende (igepo) yiofisi yange khaya kodwana ezijame leko yegepf.
","monamodi wa dipentjhele tsa basebetsi ba mmuso (gepo) ke ofisi e ka hare ho gepf, empa e e ikemetse.
",0.6328738
"igepf ingesinye see nkhwama zomhlalaphasi ezikulu khulu ephasini; inamalunga ayi1.2 yee ngidi kunye nabantu esele bathethe umhlalaphasi nabazuzi abangaphezulu kwee450 000. isikhwamesi sasungulwa ngomthetho wegepf begodu silawulwa ngomthetho lo.
","gepf ke le leng la ma tlole a dipentjhele a maholo ka ho fetisisa lefatsheng, le na le ditho tse ntseng di le mosebetsing tse fetang dimi lione tse 1.2, le tse seng di le pentjheleng mmoho le bajalefa ba 450 000. letlole lena le ne le thewe ho latela molao wa dipentjhele tsa basebetsi ba mmuso, hape le laolwa ka ona molao ona.
",0.6405237
"uadvocate makhado ramabulana uqatjhelwe isikhundla sokuba mbekili hlo.
","moadvokate makhado ramabulana o hlomamisitswe jwalo ka monamodi.
",0.653614
"uthi iofisi le yavulelwa ukusiza abantu abaneenlilo ngomsebenzi wegepf.
","o re ofisi ena e thehetswe ho thusa batho ba tletlebiswang ke ditshebeletso tsa gepf.
",0.45400503
"iofisi le izakuba lisizo khulu ebantwini abanga namali yokubhadela ama gcwetha.
","e tla tswela molemo haholo holo batho ba hlokang tjhelete ya ho hira maqwetha a ka ba thusang.
",0.46967998
"ngaphambi koba na abantu base imila ndwabo yemibango eofi sini yomvikeli wompha kathi namkha emakhotho, bangakhombela uku lanyulelwa mbekilihlo.
","pele batho ba ka isa ditletlebo tsa bona ofising ya mosireletsi wa setjhaba kapa makgotleng a dinyewe ba ka batla bonamodi ba mona modi.
",0.54071105
"umbekilihlo uzakulamula eendabeni ezenza kuri yadeke ngokunganasizathu ukusetjenzwa kwembadalo ekufuze ibhadelwe aba yitlemileko.
","ofisi ya monamodi e tla thusa haeba ho na le tiehiso e sa hlokahaleng tshebetsong ya ho ntsha ditjhelete tse yang ho baikopedi ba lokelang.
",0.5860629
"kodwanake ingalamula imibango engasingaphezulu kwe minyaka emithathu yenze kile.
","e ka thusa ho rarolla ditletlebong tse etsahetseng nakong e sa feteng dilemo tse tharo tse fetileng.
",0.48026457
"ezinye iindaba eziwela ngaphasi kwegepo ngilezi ezilandelako: ukubhalelwa kweempha thimandla kukwenza u msebenzazo ngokomthe tho nangokwemithetjhwa na yesikhwama; ukwephula isibopho nga phandle kwesizathu esi zwakalako; kunye nemininingwana/nelwa zi elidurhisako elivezwe basebenzi begepf.
","ditaba tse ding tse matleng a gepo di kenyeletsa: ho hloleha ha basebe letsi ho etsa mesebetsi ya bona ho latela molao le melawana ya letlole; ho hloleha ho lefa moikopedi kantle ho mabaka a utlwahalang le; tlhahisoleseding e fosahetseng kapa e lahlehisang e fanweng ke basebetsi ba gepf.
",0.72133386
