src_text,tgt_text,cosine_score
"kusekela lokwentiwe yiuif kusite emabhizinisini labebukene nebuma tima nebasebenti.
","nseketelo lowu nyikiweke hi uif a wu nyika vutomi eka mabindzu na vatirhi lava a va ri eku tikeriweni.
",0.9295194
"kwente umehluko phakatsi kwetinkapani letisele tivu liwe kanye naletiphoceleke kutsi tivalwe, naphakatsi kwemisebenti lehlengekile nalelahlekile.
","wu endle ku cinca exikarhi ka tikhamphani leti nga sala ti pfurile na leti ti nga boheka ku pfala, exikarhi ka mitirho leyi nga ponisiwa na mitirho leyi nga lahleka.
",0.9187678
"loku kuhlomulise ema bhizinisi lafana nesihle’s brew, indzawo yekudle la egauteng, lekhonile kugcina basebenti bayo labangu18 ngenca yeluhlelo leters.
","leswi swi vuyisele mabindzu yo fana na sihle’s brew, khefi ya swakudya swo dyela kwalaho egauteng, leyi yi nga kota ku vuyisela vatirhi va yona va 18 hikwalaho ka xikimi xa ters.
",0.9284022
"sibonga lusekelo lwahulumende, imamoshalagae trading and projects, libhizinisi letintfo tegezi lelisemokopane, likhonile kukho khela basebenti bayo kanye nerenti netinhlawulo tamasipala ngesikhatsi sekuvalwa kwelive.
","hikwalaho ka nseketelo wa mfumo, mamosha lagae trading and projects, bindzu ra gezi ra timovha emokopane, ri kotile ku hakela vatirhi va rona ku katsa na mali ya rhente na tihakelo ta vukorhokeri bya masipala hi nkarhi wa mpfalelo.
",0.92143464
"basebenti labebasebumatimeni bakhonile kutfola libintana emiholweni yabo.
","vatirhi lava a va ri eka swiyimo swo tika va kotile ku amukela xiphemu xa miholo ya vona.
",0.9383176
"lindiwe ntuli longu mmeli wemtsetfo wase centurion ebecoca ngekutsi kutfola kwakhe kusitakala kumente wakhona kusebentela ekhaya wakhona nekukhokhela irenti.
","lindiwe ntuli, munhu loyi a leteriweke switsongo eka swa nawu ecenturion, u rungurile hilaha ku kuma mivuyelo ya yena swi nga n’wi pfumelela hakona ku tirha a ri ekaya na ku kota ku fikelela rhente ya yena.
",0.91495436
"tinyenti tindzaba ngetinkapani letikhonile kubambelela kulomnyaka londlulile ngenca yelusito lolutfolakele kuuif.
","ku na switori swo tala swa tikhamphani leti ti nga kota ku tshama ta ha tirha ku ya emahlweni eka lembe leri nga hundza hikwalaho ka nseketelo lowu ti nga wu kuma kusuka eka uif.
",0.9406927
"lokufanako kungashiwo nangemabhizinisi lama ncane lasitwe tibonelelo letehlukene nekubolekwa timali lokwentiwa matiko lahlukene.
","swo fana swi nga vuriwa hi mabindzu lamatsongo lama nga pfuniwa hi malimpfuneto yo hambanahambana na mali yo lomba leyi a yi nyikiwa hi tindzawulo to hlayanyana.
",0.94838303
"letinhlelo tibasite ka khulu bantfu bakitsi nga lesikhatsi bebadzinga sito.
","magoza lawa ma pfunile swinene vanhu va ka hina hi nkarhi wa vona wa ku dinga.
",0.9104674
"njengoba sisuka ekusitweni sintjintjela ekusima meni, kufanele sintjintje kwenta.
","loko ha ha cinca kusuka eka mphalalo ku ya eka nhlakarhelo, hi fanele ku cinca maendlelo.
",0.88135785
"njengoba letinhlelo telusito betentelwe simo se sikhashana, umnotfo usa tochubeka kuva umtselela ngenca yalolubhubhane sikhatsi lesidze.
","loko magoza lama mphalalo ma endleriwile ku va ma xinkadyana, ikhonomi yi ta ya emahlweni yi twa switandzhaku swa ntungukulu ku ringana nkarhi wo leha.
",0.91893977
"nanoma mikhawulo yekuvalwa kwelive icegisiwe, tinkapani letinyenti tisashikashika nekubukana nalokulahlekelwa tinyanga tekungasebenti nalokulahlekelwa ngumalingena.
","hambi tanihileswi swipimelo swa mpfalelo swi nga olovisiwa, tikhamphani to tala ti le ku tikeriweni ku kondzelela switandzhaku swo landzela swa tin'hweti ta matirhelo lama hungutiweke na ku lahlekeriwa hi malinhlengeleto.
",0.9084111
"kungalesizatfu kutsi, kulandzela kucocisana kabanti nabalingani lesisebentisana nabo kuned lac, kuzuza kwecovid ters kwelulelwe kuye ku15 indlovulenkhulu 2021 kumikhakha lengakakhoni kusebenta ngalokugcwele.
","swi hikwalaho ka xiva ngelo lexi leswaku, hi ku landza mikanerisano yo leha na vanakulobye va vaaki eka nedlac, mbuyelo wa covid ters wu engeteleriweke kufika hi siku ra 15 nyenyankulu 2021 eka tisekitara leti a ti nga koti ku tirha hi ku hetiseka.
",0.9163002
"sibonelelo secovid19 lesikhetsekile selulwe ngaletinye tinyanga letintsatfu.
","malimpfuneto ya covid yo hlawuleka yi engeteleriwile kuya eka tin'hweti tinharhu.
",0.8702389
"letinyatselo leti tisala titesikhashane.
","lama ku tshama ku ri magoza ya nkarhinyana.
",0.79712665
"kunakisisa kwetfu nyalo kumele kube sekwakheni simondzawo lesivumako kutsi emabhizinisi avuseleleke, kanye nekukhula kwemnotfo lokudvundvu balisa kwakhiwa kwemi sebenti nalokuheha lutja lomali.
","nkongomo wa hina sweswi wu fanele wu va eka ku tumbuluxa mbangu lowu kotisaka mabindzu ku hlakarhela, na ku kula ka ikhonomi leyi yi nga xihlohloteri xa ku tumbuluxiwa ka mitirho na ku koka rinoko ra vuvekisi.
",0.90156466
"lokuvuseleleka kuta wuba lukhuni futsi kuta wutsatsa sikhatsi, loku ku bangwa kutsi sisasemkha tsini walolubhubhane.
","nhlakarhelo wu ta tika naswona wu ta teka nkarhi, kungari nkarhinyana hikuva ha ha ri exikarhi ka ntungukulu.
",0.92363906
"njengekubaluleka kwaletinyatselo tekulekelela nyalo, singeke sikwati kutigcina ngalokuchubekako.
","xa nkoka tanihileswi magoza lama mphalalo lama ma xiswona sweswi, a hi nga swi koti ku ma yisa emahlweni ku ya ku yile.
",0.8977871
"sidzinga kucinisekisa kutsi letinyatselo telusito tiniketa sisekelo lesicinile sekuvuseleleka kabanti ngaphandle kwekuchubekisela live ekujuleni kwesikweleti.
","hi fanele ku tiyisisa le swaku magoza lama mpha lalo ma nyika masungulo mo tiya ma nhlakarhelo wo anama handle ko ndzondzo meta tiko eswikweletini.
",0.932005
"ngaphandle kwekutsi sehlisele phansi emazingeni lalawulekako sikweleti setfu savelonkhe angeke sibe nekuvuseleleka kwemnotfo ngemphumelelo.
","handle ka loko hi nga hu nguta xikweleti xa hina xa rixaka kufika eka tilevhele leti yisekaka emahlweni ku hava nhlakarhelo wo twala wa ikhonomi wu nga fikelelekaka.
",0.89703363
"lwati lwetfu silive nyalo kumele lusuke kulombuso wekusitwa lwendlulele kulona wekuvuseleleka, futsi kumele sonkhe sibe yincenye yalomzamo.
","ku lemuka ka hina ka rixaka sweswi swi fanele ku suka eka xivandla xa mpha lalo ku ya eka xa nhlaka rhelo, naswona hinkwerhu hi fanele ku va xiphemu xa ku tikarhata loku.
",0.8947451
"njengahulumende, tincumo leticinile kunchitfomali yesive kumele tentiwe futsi ticaliswe kusentjetiswa kulomnyaka lona.
","tanihi mfumo, swiboho swo tika hi matirhiselo ya mali ya mfumo swi ta dinga ku tekiwa na ku simekiwa lembe leri.
",0.8892577
"tinkapani kutawudzi ngeka kutsi tibe netindlela letinsha tekuphatsa neti nchubo leticinisa kusimama nenzuzo, kanye nekugcina umsebenti kube ngulokuphambili letikunakako.
","tikhamphani ti ta dinga ku va na maendlelo mantshwa eka ku fambisa tindlela na tiphurosese leti ti sirhelelaka vuyisekamahlweni na mpindzulo, na ku vuyi sela mitirho ku va leswi swi rhangaka emahlweni.
",0.95167917
"kumele sibuyisele imali yetfu emuva emnotfweni wetfu ngekutsenga imikhi cito yasekhaya, sisekele emabhizinisi asekhaya netimboni nekutsenga kubakhiciti basekhaya.
","hi fanele ku tlherisela mali ya hina eka ikhonomi ya hina hi ku xava swimakiwa swa laha tikweni, hi seketela mabindzu ya laha tikweni na tiindasitiri na ku xava eka vaphakeri va laha tikweni.
",0.9528271
"sigulane lesilimele lesinematfuba lamakhulu ekululama nasiniketwa kwelashwa ngekunyakatisa mtimba kute sibe nemandla site sikhone kutimela singakasitwa.
","muvabyi loyi a nga vaviseka a nga na ntshembo wa nhlakarhelo u nyikiwa therapi ya le mirini ya nkarhi na nkarhi ku n'wi pfuna ku tiya kukondza a kota ku yima hi yexe.
",0.89094234
"kumele tibukwe njaloke letinyatselo tekusita njengetindlela tekubuyisa umnotfo wetfu esimeni sawo.
","xana magoza lama ma mphalalo ma nkarhinyana ma nga voniwa tanihi ti ndlela to vuyisela ikhonomi ya hina yi yima nakambe.
",0.8390511
"umgomo wetfu lesiwufunako kutsi sikwati kuchubeka futsi.
","xikongomelokulu xa hina i ku famba nakambe.
",0.9392067
"njengesive, asesonkhe sifakeni sandla.
","tanihi rixaka, a hi hoxeni xandla hinkwerhu.
",0.94337976
"asekutsi sonkhe sibe yincenye ye ntfutfuko nenchubekele mbili yetfu.
","a hi veni xiphemu xa nhluvuko na ndlandlamuko wa hina vini.
",0.91032666
asesisebentiseni lolusito lolweluliwe kuchubekisa kuvuseleleka lokunemandla.,"magoza yo pfuxeta ikhonomi vukuzenzele unnamed ku nga ri khale ku ta va lembe kusukela loko ku vile na mhangu leyi tivisiweke yo sungula ya khoronavhayirasi etikweni ra ka hina.
",0.91032666
"imisebenti yahulumende lececeshekile vukuzenzele unnamed lesikhatsi ngikhetse lwa kulesikhundla sekuba ngumenga meli waseningizimu afri ka, ngatsi kwakha hulu mende losebenta kahle, lonelikhono nalonesimilo lesingenayo inkhohlaka lo bekunguletinye tintfo letimcoka lengiticalisa e mbili.
","vukorhokeri bya mfumo bya xiphurofexinali vukuzenzele unnamed loko ndzi hlawuriwa eka xiyimo xa ku va phuresidente wa afrikadzonga, ndzi vule leswaku ku aka mfumo lowu nga tlangisiki swi pfuno, wa vuswikoti na ku va wa matikhomelo nene lowu nga hava vu kungundzwana a ku ri xo rhanga emahlweni eka swirhangana swa mina.
",0.92742884
"nguhulumende lone likhono, losebenta kahle, lonesimilo nalotsembele entutfukweni kuphela longa tibophelela ekutfutfukiseni timphilo tebantfu balelive.
","ko va ntsena mfumo wa vuswikoti, lowu nga tlangi siki swipfuno, wa matikho melonene na ku va wu lava nhluvukiso ntsena wu nga kotaka ku humelerisa eka ku tinyiketela ku antswi sa vutomi bya vanhu va tiko leri.
",0.92822933
"loku kusho kutsi hulume nde kufuneka abe netisebenti letibobabe nabomake labace ceshekile, labanemakhono, labatinikele nalabatsembe kile.
","leswi swi vula leswaku vukorhokeri bya mfumo byi boheka ku va na vatirhi va vavanuna na vavasati lava va nga tiphurofexinali, lava nga na swikili, lava nga tilaveriki swa vona vini na ku va lava nga tshembeka.
",0.8938862
"kufuneka batibophelele ku hambisa embili kubaluleka kwemtsetfosisekelo, futsi kufuneka kwenteke njengo ba ngishilo enkhulumeni yami yekucala, ""kusebentela ummango ngekwetsembeka hhayi lenye intfo.
","va boheka ku va va tinyike tela ku tiyisisa mikhuvanene ya vumbiwa, naswona va bo heka, tanihiloko ndzi vurile eka mbulavulo wa ku vekiwa exitulwini, ""va korhokela hi ku tshembeka xivangelo xa vaaki ntsena handle ka swin'wana"".
",0.90953207
"""kulamaviki lamabili lengci le, kube nekucocisana ne mmango mayelana nedo khumenti yenchubomgomo lemcoka letawufaka umfu tfo lomkhulu kumitamo yetfu yekucinisa, kukhulisa nekufundzisa tisebenti tahu lumende.
","eka mavhiki mambirhi lama nga hundza, mikanerisano ya vaaki a yi ri ku endlekeni eka dokhumente ya pholisi ya nkoka leyi yi nga ta nyika mafulufulu lamakulu eka matshalatshala ya hina ya ku seketela, ku tiyisa na ku nyika vuswikoti eka vuko rhokeri bya mfumo.
",0.9035219
"umtsetfosivivinyo lo luhlaka wenchubomgomo yavelonkhe lomayelana nekucecesheka kwebase benti bahulumende uhlose kwakha hulumende losebe ntela kancono bantfu bakitsi, lovikelekile ekungenelelweni kwetepolitiki lokungenasi dzingo nalocasha ngekubuka kufaneleka.
","rimba ra nsimeko ra rixaka ra mpfapfarhuto eka ku endla vukorhokeri bya mfumo byi va bya xiphurofexinali ri na xikongomelo xa ku aka mfumo lowu korhokelaka vanhu va ka hina ku antswa, lowu wu sirheleriweke eka ku nghenelela ka tipolitiki loku nga fanelangiki na laha ku thoriwa swi endliwaka hi ku ya hi mipimo yo ringanela.
",0.9342754
"loluhlaka lwavunywa yi khabhinethi ngalweti lo mnyaka lowengcile kantsi nyalo kucocisana lokuhlele kile nemikhakha lehluka hlukene yemmango kuya chubeka.
","rimba leri ri pasisiwile hi khabinete hi hukuri lembe leri nga hela naswona mika nerisano ya xivumbeko na ti sekitara to hambanahambana ta vaaki yi le ku endliweni sweswi.
",0.8750295
"eminyakeni lemashumi amabili nesikhombisa singe ne kuntsandvoyelinyenti, kungashiwo kutisebenti tahulumende kutsi nanoma kunetintfo letinengi letentiwe kahle kakhulu, sinetinseyeya letimcoka kumatiko lama nengi ahulumende letima yelana nemakhono, kwati umsebenti nekucecesheka.
","makumembirhinkombo wa malembe eka xidemo kirasi, swi nga vuriwa hi vukorhokeri bya mfumo leswaku loko swikhwama swo hlayanyana swa kahle swinene swi ri kona, hi na mitlhontlho yo tivikana eka tindzawulo ta mfumo to tala hi mayelana na swikili, vuswikoti, na moya wa xi phurofexinali.
",0.8991896
"esikhatsini lesinengi, bantfu bacashelwa noma bakhushulelwa etikhundleni letimcoka letingakabafaneli noma lebangakatifundzeli.
","hinkwaswo hi ntolovelo kutlula mpimo, vanhu va thoriwile na ku tlakusiwa ku ya eka swiyimo leswi swi nga fanelangiki kumbe va nga swi thwaselangiki.
",0.8884617
"loku kunemtselela ekuse benteni kwahulumende, futsi kuphindze kungente ekucasheni ngebuhlobo, ekungeneleleni kwetepoli tiki emsebentini wematiko, kungabi nekuphendvula, kungalawuli kahle nenkho hlakalo.
","leswi swi khumba matirhelo ya mfumo, kambe swi tlhela swi hoxa xandla eka ku tholana hi vuxaka, ku nghenelela ka tipolitiki eka ntirho wa tindzawulo, ku pfumaleka ka vutihlamuleri, vufambisi byo ka byi nga lulamangi na vukungundzwana.
",0.8986248
"kukhona futsi inkinga lemayelana nekungenelela kwetepolitiki nekwebapha tsi labakhulu ekwenteni imisebenti yahulumende.
","ku tlhela ku va na xiphiqo xo fambelana xa ku nghe nelela ka tipolitiki na vurha ngerinkulu eka mafambiselo ya vukorhokeri bya mfumo.
",0.88542306
"umuntfu kufuneka abuke kuphela kungasimami kwematiko ahulumende uma kuntjintjiselwana noma kuntjintjwa baphatsi laba khulu njalo uma kubekwa indvuna lensha.
","munhu u dinga ntsena ku languta eka ku pfumaleka ntshamiseko eka tindzawulo ta mfumo loko vafambisi nkulu va cincacinciwa kumbe ku siviwa nkarhi na nkarhi loko ku thoriwa holobye lontshwa.
",0.94444764
"bacondzisijikelele ne tinhloko tematiko etifundza bayatsintseka kakhulu.
","valawurinkulu vo angarhe la na tinhloko ta tindzawulo ta swifundzakulu hi vona va khumbekaka ngopfungopfu.
",0.84102654
"kulamanye ematiko, emadg nabohod nebaphatsi labasetulu babe nekunga hlaliseki emsebentini laba wentako, lokwente ematiko asebente ngekuphatamiseka lokuncane.
","eka tindzawulo tin'wana, tidg, tihod na vafambisi va vurhangerinkulu va vile na ntshamiseko eka nkarhi wa vona wa ku khoma hofisi, leswi pfumelelaka tindzawu lo ku tirha hi nkavanyeto wuntsongo.
",0.9042946
"linyenti lalawa matiko lanebaphatsi labasi meme, imiphumela yeluhlo lomabhuku ivamise kuba mihle futsi kuba nekuphe ndvula ngekusetjentiswa kwetimali tahulumende.
","eka vunyingi bya tindzawulo leti laha ku nga na ntshamiseko wa vu rhangeri, mivuyelo ya oditi yi tala ku va leyinene naswona timali ta mfumo ti humese riwa vutihlamuleri.
",0.9305681
"lapho kuba nekuntjintja kakhulu kwebaphatsi bema tiko, kuvamise kutsi kuhlale kunekudideka.
","laha ku nga na nhlayo ya le henhla ya ku fambetela na ku siviwa ka tinhloko ta tindzawulo, ku tala ku tshama ku ri na nkavanyeto wa mafambiselo.
",0.87046766
"lokunye lokumcoka kwale tincomo letentiwe kulomtse tfosivivinya loluhlaka kutsi kusebenta kwahulumende kufuneka kungangenwa tepolitiki nekutsi ematiko ahulumende kufuneka avi keleke kupolitiki.
","xin'we xa swibumabumelo swa nkoka leswi endliweke eka rimba ra mpfapfarhuto hi leswaku vukorhokeri bya mfumo, ngopfungopfu eka swiyimo swa le henhla byi boheka ku nga tirhiseriwi tipolitiki na leswaku tindza wulo ta mfumo ti boheka ku sirheleriwa eka tipolitiki.
",0.8677695
"kucecesheka kuyadzinge ka kute kube nekusimama kuhulumende, kakhulu etikhundleni letisetulu.
","ku endliwa ka xiphu rofexinali swi fanerile ku endlela ntshamiseko eka vukorhokeri bya mfumo, ngopfungopfu eka swiyimo swa le henhla.
",0.85538054
"tise benti tahulumende kufuneka tikhone kuchubeka tente umsebenti wato ""nanoma ngabe kube nekuntjintjwa kwetindvuna, kwemalunga emkhandlu lophetse noma kwemakhansela ngekhatsi kwelicembu leliphetse umbu so, noma kwetingucuko temacembu etepolitiki emva kwelukhetfo"".
","vatirhela mfumo va boheka ku ya emahlweni va tirha mitirho ya vona ""handle ka micinco yihi kumbe yihi ya vaholo bye, swirho swa khansele ya vurhangerinkulu kumbe vakhanselara endzeni ka vandla leri fumaka leri ri nga na matimba ya mafambiselo, kumbe ku cinca ka mavandla ya tipolitiki endzhaku ka mihlawulo"".
",0.9373071
"sihlongota kutsi kube ne tingucuko letinengi letibanti, letifana nekungeta sikhatsi sekusebenta kwetinhloko tematiko sihambisane neku faneleka nekusebenta kwato, kwentiwe luhlolo lolugcile ekwatini kwenta umsebenti futsi lolufaka ikhomishana yetisebenti tahulumende uma kwentiwa tingcoco tetinhlolokhono kwebaco ndzisijikelele nekwemase kela ebacondzisijikelele.
","hi le ku ringanyeteni ka mi antswiso yo hlayanyana, tani hi ku engetelela nkarhi wa ku khoma hofisi wa tinhloko ta ndzawulo hi ku ya hi mpimo wo ringanela na matirhelo, ku endla mihlahluvo ya vu swikoti bya ntirho na ku katsa khomixini ya vuko rhokeri bya mfumo eka tii nthavhiyu ta valawurinkulu vo angarhela na swandla swa valawurinkulu vo angarhela.
",0.9238478
"kucala kusebentisa luhlolo lwebucotfo kubo bonkhe bantfu labafakwe eluhlwini lwenhlololuvo kungasisita kute sikhone kucasha tise benti tahulumende letingase benta ngekwetsembeka.
","ku tivisa swikambelo swa vutengi eka vanhu lava hlawuriweke swi ta pfuna leswaku hi kota ku kuma vatirhelamfumo lava nga ta korhokela hi ku tshembe ka.
",0.91263914
"futsi kufuneka silule lokubhala kweluhlolo lwekungena loluphocelekile lesiletfule ngamabasa 2020 lwentiwe nakutikhundla letingetulu kwetebaphatsi betikhundla letisetulu.
","hi tlhela hi dinga ku ndlandlamuxa swikambelo swo nghena swo boha leswi hi nga swi tivisa hi dziva misoko 2020 ku hundza eka vufambisi bya le henhla.
",0.88746035
"bohulumende labasatfutfuka labanemphu melelo basebentisa letindlela letifana naleti kusita kwenta kube nekucecesheka kuhulu mende.
","mifumo leyi hluvukaka leyi nga humelela yi na ma goza lama fanaka lama nga ta pfuna ku antswisa moya wa xiphurofexinali endzeni ka vukorhokeri bya mfumo.
",0.8184086
"njengoba sibekile kulo mtsetfosivivinya loluhlaka, ""inchubokuphatsa kufuneka ichubeke kulandzela ligunya letepolitiki lelibekwe bavoti kanye nelicembu letepolitiki, kodvwa bayekele kutsi bona babe yincenye yetepoliti.
","loko ha ha tsala eka rimba ra mpfapfarhuto, ""xibyu rokirasi xi boheka ku ya emahlweni ku simeka hi ku tshembeka na hi vurhonwana xilerisoximfumo xa tipolitiki lexi nga vekiwa.
",0.82205904
"""sihlongota kutsi kube nendlela lenemandla yeku casha neyekukhetsa tisebenti tahulumende, yekungeniswa kwato neyekulawula umse benti wato.
","hi ringanyeta endlelo ra vurhon'wana swinene eka ku laviwa na ku hlawuriwa ka vatirhelamfumo, vutivisi bya matirhelo na malawulelo ya matirhelo.
",0.9066312
"loku kufaka kuchubeka nekufundza kanye nendlela lecacile yekuceceshwa kuso sonkhe sisebenti sahulumende.
","leswi swi katsa ku dyondza loku yaka ema hlweni na ndlela ya nhluvu kiso wa xiphurofexinali yo vonaka ya mutirhelamfumo un'wana na un'wana.
",0.87323487
"lomtsetfosivivinya lo luhlaka ugcizelela lesidzingo sekutfwesa tisebenti licala ngekwephula umtsetfo, ku cedza lomkhuba wekungaje ziswa uma kungakaphatfwa kahle noma kabi tinsita tahulumende.
","rimba ra mpfapfarhuto ri veka ntshikelelo eka xidingo xa ku endla vatirhelamfumo va va na vutihlamuleri eka matirhiselo ya mali lama hambanaka na milawu, ku tshika ntolovelo wa ku ka va nga katsiwi eka mixupulo eka malawulelo yo homboloka na ku yiveteriwa ka swipfuno swa mfumo.
",0.904464
"kucecesheka kwetisebenti tahulumende kufaka kucece shwa kwetisebenti letiphetse kuyo yonkhe imikhakha yahulumende mayelana ngaletibonelelo temtsetfo letisebentako.
","ku endla vukorhokeri bya mfumo byi va bya xiphu rofexinali swi katsa vuleteri bya vaofisiri lava nga na vu tihlamuleri eka swiyenge hinkwaswo swa mfumo eka milulamiselo ya milawu leyi nyikiweke leyi faneleke.
",0.90308005
"sikole savelonkhe sahu lumende sinemsebenti lo mcoka lesingawenta nga loku.
","xikolo xa mfumo xa rixaka xi na xiave xa nkoka ku xi tlanga eka mhaka leyi.
",0.8779204
"kucecesheka emsebentini akusiko kuphela kuba ne ticu letifanele nemakhono ekwenta msebenti, kodvwa kumayelana nekuba nema zinga lafanele enhlonipho, kunakekela nekubacotfo uma usebenta nemalunga emmango.
","moya wa xiphurofexinali a wu hi mayelana na ku va na mithwaso leyi faneleke na swikili swa xithekiniki ntsena, kambe wu tlhela wu va hi mayelana na ku va na mipimo leyi faneleke ya nhlonipho, ku titsongahata na vutengi eka ku tirhana na vaaki.
",0.91886175
"umsebenti wahulumende wehlukahlukene, unemakho no lamakhulu lahlukahluke ne, ticu nelwati lwemsebenti.
","vukorhokeri bya mfumo byi hambananile, byi ri na vunavi lebyikulu bya swikili, mi thwaso na vuswikoti.
",0.8835068
"tisebenti tahulumende leti nengi tinemakhono elukhe tselo ladzingekako ekwente ni kahle umsebenti.
","vatirhelamfumo vo tala va na swikili swo kongomisa leswi swi faneleke eka ku phakela loku tirhaka kahle ka vukorhokeri.
",0.8622658
"ngakoke akusilo liciniso kutsi sidzinga linani lelincane letisebenti ta hulumende: lesikudzingako tisebenti letikwati kwenta umsebenti letinemakhono lafanele, letinesimilo sekuce cesheka naletinekutibophe lela ekusebenteleni bantfu.
","hikokwalaho, a hi mhaka ngopfu ya leswaku hi dinga vukorhokeri bya mfumo lebyitsongo: lexi hi xi dingaka ngopfu i vukorho keri bya mfumo lebyi ringa neleke xikongomelo lebyi nga na swikili leswi ringaneleke, matikhomelonene ma xiphu rofexinali na ku tinyiketela ku korhokela vanhu.
",0.88020146
"bobabe nabomake labase benta kuhulumende kufu neka baniketwe emandla ekwenta umsebenti wabo we kuchubekisa intfutfuko ne wekuhlanganisa intsandvo yelinyenti.
","vavanuna na vavasati va vukorhokeri bya mfumo va dinga ku nyikiwa vuswikoti ku kota ku tlanga xiphemu xa vona eka ku fambisa nhluvukiso na ku tiyisa xi demokirasi.
",0.89110047
"loku kusici nisekiso setfu lesikhulu sahulumende lonelikhono lolandzela tifiso tetakhamuti.
","lexi i xitiyisiso xa hina xo tlula hinkwaswo xa mfumo wo swi kota lowu korhokelaka ku tsakela ka vaakatiko.
",0.90846866
"ngiyanicela nonkhe kutsi nibe yincenye yalenchubo yekucocisana nemmango mayelana nalomtsetfosivi vinya loluhlaka, lotfolakala kuwebhusayithi yesikolo savelonkhe sahulumende, nekutsi nente luvo lwenu luvakale.
","ndzi mi kombela ku va xiphemu xa phurosese ya mikanerisano ya vaaki hi mayelana na rimba ra mpfa pfarhuto, leri ri kumekaka eka webusayiti ya xikolo xa mfumo xa rixaka, na ku endla leswaku rito ra wena ri twiwa.
",0.9178438
"hulumende akasiyo ince nye yanoma nguliphi licembu letepolitiki, futsi akufuneki abe sizindza sanoma ngu liphi licembu alitsandzako.
","vukorhokeri bya mfumo a hi bya vandla rin'we ro karhi, kumbe a byi fanelangi ku va ndhawu ya ntlawa wo karhi lowu nga na ku navela.
",0.8772329
"akufuneki atishayele wakhe umtsetfo.
","a byi fanelangi byi va nawu eka byona n'wini.
",0.8738523
"hulumende wabo bonkhe bantfu baseningizimu afrika.
","vukorhokeri bya mfumo i bya vanhu va afrikadzonga.
",0.7195685
kufuneka usebentele bona futsi bona bodvwa.,"vukorhokeri bya mfumo bya xiphurofexinali vukuzenzele unnamed loko ndzi hlawuriwa eka xiyimo xa ku va phuresidente wa afrikadzonga, ndzi vule leswaku ku aka mfumo lowu nga tlangisiki swi pfuno, wa vuswikoti na ku va wa matikhomelo nene lowu nga hava vu kungundzwana a ku ri xo rhanga emahlweni eka swirhangana swa mina.
",0.7195685
"baholi bendzabuko bamcoka emitameni yetfu yekululama vukuzenzele unnamed kuletinyanga leti mbalwa letengcile, kudzingeke ku tsi sivalelise kabuhlungu emakhosi endzabuko lama bili lahlonipheke kakhu lu eveni letfu.
","varhangeri va swa ndhavuko i va nkoka eka matshalatshala yo pfuxeta hi vuntshwa vukuzenzele unnamed eka tin’hweti titso ngo leti hundzeke, hi vile ni ku lelana ka gome na tihosi timbirhi to hlonipheka swinene ta tiko ra hina.
",0.90942144
"sive semazulu sisandza kufihla lohloniphekile ka khulu inkhosi goodwill zwelithini ka bhekuzulu lobuse sigamu seminyaka lelikhulu.
","sweswinyana rixaka ra ma zulu ri lahlile muhlonipheki hosi goodwill zwelithini ka bhekuzulu loyi a fumeke ku ringana hafu ya dzana ra ma lembe.
",0.9595369
"ngabhimbidvwa ne, sive semapedi sifihle kgoshikgolo thulare thulare iii, lokhotseme anesikhatsi lesingaphansi kwemnyaka abekwe esihlalweni.
","hi sunguti, vapedi va lahlile kgoshikgolo thulare thulare iii, loyi a nga hundza emisaveni ehansi ka lembe a vekiwile exitulwini.
",0.9198312
"ngekushona kwabo, si lahlekelwe bantfu labahamba embili ekulondvoloteni tintfo letimagugu etfu, nebantfu la bahlonishwako labanakekela bavikele imilandvo yebantfu babo labahlukahlukene.
","eka ku hundza ka vona emisaveni, hi lahlekeriwile hi tinhenha leti ti hlayiseke ndhavuko, na vanhu vo hloniphiwa hikwalaho ka matimu yo hlonipheka ya rixaka ra vona.
",0.9263721
"ngalokufanako futsi, beba bantfu labamcoka labatfutfu kisa tindzawo tasemakhaya, futsi batibophelele ekuchu bekiseni embili tinhlelo teku tfutfukisa timo letibona kalako tebantfu babo.
","nakambe, a va ri vatlangi va xiphemu xa nkoka eka nhluvukiso wa miganga, naswona a va tinyiketerile ku fambisa minongonoko ku tlakusa swiyimo swa nkoka swa rixaka ra vona.
",0.9265672
"ngekungena kwentsandvo yelinyenti ngemnyaka we1994, kwaba yintfo lecaliswa embili nguhulumende lo musha kubuyisela sitfunti nekwenta buholi bendzabuko bube semtsetfweni buhambi sane nemitsetfo yendzabuko nemihambo yayo futsi bu landzela umtsetfosisekelo weriphabhulikhi.
","loko ku sungula xidemoki rasi hi 1994, a ku ri xirhanga na xa mfumo lowuntshwa ku vuyisela vutshembeki na ntiyiso wa vurhangeri bya swa ndhavuko hi ku fa mbelana na milawu ya ndha vuko na mahanyelo na hiku landzelela vumbiwa ra ri phabuliki.
",0.9151874
"sikhungo sebuholi bendza buko sisachubeka kudlala inzi ma lemcoka etimphilweni tetinkhulungwane tebantfu balo lonkhe live letfu, kakhu lu etindzaweni tasemapha ndleni.
","huvo ya vurhangeri bya swa ndhavuko yi ya ema hlweni yi va na ntirho wa nkoka evuton’wini bya ti miliyoni ya vanhu etikweni ra ka hina, ngopfungopfu ematikoxikaya.
",0.85308385
