src_text,tgt_text,cosine_score
"daar is baie verhale van ondernemings wat die afgelope jaar danksy die steun wat hulle van die wvf ontvang het hul deure kon oophou.
","zinengi iindaba ngamakampani akghone ukuraga nomsebenzi ngepumelelo enyakeni odlulileko njengombana bebasekelwa yiuif.
",0.6460297
"dit geld ook vir kleinhandelsake wat deur die verskeie toelae en lenings wat deur verskillende departemente toegestaan is, geholpe is.
","okufanako kungatjhiwo nangamarhwebo amancani asizwa ziimbonelelo ezihlukahlukeneko kunye nemalimboleko ebeyikhutjhwa minyango eminengi.
",0.61913586
"dié maatreëls het ons mense in tye van nood bygestaan.
","amagadango la asize khulu abantu belizwe lekhethu ngeenkathi zokutlhoga.
",0.54811144
"soos wat ons beweeg van verligting na herstel, moet ons van rat verander.
","njengobana siphuma ebujameni bokudinga isizo siya ekululameni, fanele sitjhugulule indlela yokwenza.
",0.5625342
"terwyl hierdie verligtingsmaatreëls van tydelike aard is, gaan die ekonomie steeds vir n hele ruk die nagevolge van die pandemie ervaar.
","ngesikhathi amagadango la bekahlonywe kwesikhatjhana, umnotho wona usazokuraga nokudosa emhlweni ngenca yemithelela yengogwana engumabhubhisa le.
",0.6250342
"selfs met die verslapping van baie van die inperking se beperkings, sukkel vele ondernemings steeds met die nagevolge van maande en maande se beperkte werksaamhede en verlore inkomste.
","nanyana imithetho yokuqinteliswa kwamakhambo seyinyefisiwe nje, amakhamphani amanengi asadosa emhlweni ngokuraga eenyangeni lapho bekunciphe khona umsebenzi nemali ingangeni.
",0.54607016
"daar is dus besluit, na aanleiding van omvattende gesprekvoering met maatskaplike vennote by nedlac, dat die kovid tersvoordele met drie maande verleng sal word tot 15 maart 2021 in sektore wat nog nie ten volle operasioneel is nie.
","nguye kanye unobangela lo owenze bona ngemva kwemikhulumiswano nabalingani bethu bakwanedlac isekelomali lecovid19 ters lelulelwe isikhathi bekube nakali15 kuntaka 2021 kwenzelwa imikhakha ebeyingakghoni ukusebenza ngokupheleleko.
",0.38725132
"die spesiale kovidtoelae is met drie maande verleng.
","isibonelelo sombuso esikhethekileko secovid19 selulelwe isikhathi ngeenyanga ezintathu.
",0.5709226
"dit bly egter korttermynmaatreëls.
","la magadango wesikhatjhana.
",0.5366527
"ons moet nou daarop begin fokus om n omgewing te skep waarin besighede kan herstel en wat werkskepping en belegging aanmoedig.
","okwanje itjhejo lethu kumele libe sekwakheni indawo ekghonakalisa bona amarhwebo akwazi ukubuyela endimeni begodu nokuthi umnotho ukghone ukusiza ngokwakhiwa kwemisebenzi begodu udose nesisomali.
",0.5670474
"die herstel gaan moeilik wees en tyd neem, veral synde ons steeds te midde van die pandemie is.
","ukubuyela endimeni komnotho kuzokuba yinto ebudisi tle begodu kuzokuthatha isikhathi, njengombana sisese phakathi kobujamo bengogwana le.
",0.57605314
"so belangrik soos die verligtingsmaatreëls is, kan ons dit nie onbepaald in plek hou nie.
","nanyana amagadango wokusekela ngeemali la aqakatheke kangaka, angeze sakghona ukuwaraga unomphela.
",0.5298141
"ons moet seker maak dat hierdie verligtingsmaatreels n stewige basis vorm vir die breër herstel van die ekonomie sonder om die land verder in die skuld te dompel.
","sidinga ukwenza isiqiniseko sokobana amagadango la akha isisekelo esiqinileko khona umnotho uzakuqina ngaphandle kokufaka ilizwe lekhethu eenkolodweni ezidlula esele likizo.
",0.6481217
"tensy ons ons nasionale skuld kan afbring na onderhoubare vlakke, sal geen betekenisvolle herstel moontlik wees nie.
","ngaphandle kwalokha nange singakghona ukwehlisa isikolodo selizweloke sibe sesigabeni esilawulekako angeze umnotho wadzimelela.
",0.6002952
"ons nasionale bewussyn moet nou verby verligting na herstel strek, en ons moet almal ons deel bring om dit te bewerkstellig.
","imikhumbulo yethu sisitjhaba kufanele isuke ekukhululekeni iye ekwelulameni, begodu soke kufanele sibe yingcenye yomzamo lo.
",0.6057104
"as die staat gaan ons vanjaar moeilike besluite oor openbare besteding moet neem en implementeer.
","njengorhulumende, iinqunto eziqinileko ekusetjenzisweni kwemali yombuso kumele zithathwe begodu zifezwe nonyaka.
",0.54657876
"maatskappye gaan innoverend moet wees met be stuursmetodes en prosesse om hul volhoubaarheid en winsgewendheid te verseker, met die voorkoming van werksverlies as hul grootste oorweging.
","amakhamphani azokudinga bona avele neendlela ezitjha zokuraga begodu neenkambiso zokudzimelelisa ibhizinisi nokwenza ingenisomali, nokugcina imisebenzi kufanele kube yinto eba liqalontangi.
",0.5992655
"ons moet geld in ons ekonomie terugplaas deur plaaslike produkte te koop, plaaslike besighede en bedrywe te ondersteun en by plaaslike verskaffers te aan te koop.
","kumele sibuyisele imali yethu emnothweni welizwe lekhethu ngokuthenga ipahla ekhiqizwe ekhethwapha sisekele amarhwebo wangekhaya begodu sithenge kubathengisi bekhethwapha.
",0.6200129
"n beseerde pasiënt met goeie kanse vir herstel ontvang gereelde fisioterapie om hom te help om sterker te word sodat hy gou weer op sy eie voete kan staan.
","isigulani esilimeleko esikhombisa amathuba amanengi wokuphola sinikelwa ukwelulwa komzimba kwangamalanga khona sizakuqina besikghone nokuzijamela ngaphandle kokusizwa.
",0.71195
"so ook moet dié tydelike verligtingsmaatreëls beskou word as n manier om ons ekonomie weer op die been te bring.
","ngakhoke amagadango wesikhatjhana la abonwe njengeendlela zokuvuselela umnotho welizwe lekhethu.
",0.5876516
"ons uiteindelike doel is om weer self te kan loop.
","umnqopho wethu ophambili kukobana siqhubekele phambili.
",0.3599031
"kom ons almal strek as n nasie n helpende hand uit.
","sisisizwe, soke kumele sifake isandla.
",0.5392675
"kom ons wees saam deel van ons eie ontwikkeling en vordering.
","sibe yingcenye yetuthuko neragelophambili yethu.
",0.5063864
laat ons gebruik maak van dié verlengde verligtingsmaatreëls om sterk ekonomiese herstel te bewerkstellig.,"amagadango wokuvuselela umnotho vukuzenzele unnamed sekuzokuphela unya ka solo kwabikwa ukwehla kwengo gwana icorona esewu la afrika.
",0.5063864
"'n professionele staatsdiens vukuzenzele unnamed met my verkiesing as staatspresi dent het ek des tyds gesê dat die skepping van ’n doeltreffende, be kwame en etiese regering, vry van enige korrupsie, een van my grootste prio riteite is.
","imisebenzi yembusweni enamakghonofundwa vukuzenzele unnamed mhlazana ngikhe thelwa isikhu ndla sokuba ngu mengameli wesewula afrika, ngathi ukwakha umbuso osebenza kuhle, onekgho no nonemikghwa emihle, onganabukhohlakali zizi nto ezihlangana namaqa lontanzi wami aqakathe kileko.
",0.7041126
"slegs ’n bekwame, doeltref fende, etiese en ontwikke lingsgeoriënteerde regering kan die verbintenis tot die verbetering van die lewens van die mense van hierdie land nakom.
","mbuso okghonako, ose benza kuhle, onemikghwa emihle nonqophe ukuthuthu kisa ilizwe ongakghona ukuphumelelisa iimbopho zokwenza ipilo yabantu be lizweli ibe ngcono.
",0.578096
"dit beteken dat die staats diens beman moet word deur mense wat professioneel, vaardig, onbaatsugtig en eerlik is.
","lokhu kutjho ukuthi abase benzi bekoro yembusweni kufuze kube madoda nabafa zi abalawulwa makghonofu ndwa, abanamakghonofu ndwa, abacabangela abanye abantu, nabathembekileko.
",0.58438164
"hulle moet daartoe verbind wees om die waardes van die grondwet te handhaaf en moet, soos ek in my in huldigingstoespraak gesê het, ""hulself getrou vir geen ander saak as dié van die publiek beywer nie"".
","kufuze bazibophelele uku phakamisa amagugu wo mthethosisekelo, begodu nje ngoba ngakhe ngatjho eku lumeni yokugcotjwa kwami, ""basebenzele iinrhuluphelo zomphakathi ngokuthembe ka kwaphela, hayi okhunye.
",0.61646795
"tydens die afgelope twee weke het openbare kon sultasies plaasgevind met betrekking tot ’n belangrike beleidsdokument wat groter dryfkrag gaan gee aan ons werk om die staatsdiens te steun, versterk en bevoeg te maak.
","""eemvekeni ezimbili ezidlu lileko, bekubanjwe imikhulu miswano yokuzwa imibono yomphakathi ngomtlolo oqa kathekileko womthethoka mbiso ozakukhuthaza ube uqinise ihlohlomezela yekoro yembusweni.
",0.6473394
"die konsep vir die nasionale implementeringsraamwerk vir die professionalisering van die staatsdiens is daarop gemik om ’n regering tot stand te bring wat ons volk beter dien, wat geïsoleer is van onbehoorlike politieke inmenging, en waar aanstel lings op meriete plaasvind.
","umtlamo wokuphumele lisa imithetho elizweniloke enqophe ukwembesa ikoro yembusweni amakghono fundwa unqophe ukwakha umbuso osebenzela abantu bekhethu, ongeze ucajelwe yipolitiki nalapho abantu bazakuqatjhwa khona ngoba bawulungele loyomsebenzi abaqatjhelwa wona.
",0.6928922
"die raamwerk is in novem ber laasjaar deur die kabinet goedgekeur en gestruktureer de konsultasie met verskeie sektore van die samelewing word tans onderneem.
","umtlamo lo uphasiswe yikhabinethi ngosinyikhaba nyakenye, kantike njenganje kusakhanjiswa amahlelo wokubonisana nomphakathi ngawo.
",0.62642455
"na seweentwintig jaar van demokrasie kan ons die vol gende van die staatsdiens sê: ondanks uitnemendheid op talle terreine, is daar in baie staatsdepartemente steeds ernstige uitdagings met betrekking tot vaardighede, bekwaamheid en professio naliteit.
","ngemva kwama27 wemi nyaka kwangena umbuso wentando yenengi, kunga tjhiwo ukuthi nanyana la phaya nalaphaya kunezinto ezenzeke kuhle okubabaze kako nje, sisese neentjhijilo ezimbi eminyangweni ka rhulumende eminengi malu ngana namakghonofundwa, ikghono lokwenza umsebenzi kunye nobukghonofundwa.
",0.65408593
"te dikwels is mense aange stel in en bevorder tot sleutel posisies waarvoor hulle nie geskik of bekwaam was nie.
","sekukanengi khulu abantu baqatjhelwa namkha bakhu tjhulelwa eenkhundleni eziphezulu ezingakabafaneli nabangakazifundeli.
",0.39267194
"dit het die werksprestasie van die regering beïnvloed en ook bygedra tot nepo tisme, politieke inmenging in die werksverrigting van departmente, ’n gebrek aan verantwoordbaarheid, wan bestuur en korrupsie.
","lokhuke kuliya ukusebenza kuhle kwakarhulumende, kubuye kukhwezelele ukuqatjhana ngobuhlobo, kufake noku cabhela kwepolitiki emsebe nzini weminyango, kwenze nokuthi kungabi nokuzi phendulela, imisebenzi ilawulwe ngendlela enga kafaneli, bekube nobukho hlakali.
",0.6226317
"daar is ook die verwante probleem van politieke en uitvoerende inmenging in die administrasie van die staatsdiens.
","kukhona godu nomunye umraro okhambisana noku cabhela kwepolitiki nabapha thi ekuragweni komsebenzi wembusweni.
",0.5780232
"'n mens hoef net te kyk na die onstabiliteit in staatsdepartemente wan neer seniorbestuur verskuif of vervang word elke keer as ’n nuwe minister aangestel word.
","isibonelo ku lokhuya nakurarana izinto eminyangweni karhulu mende lokhuya abaphathi beenkhundla eziphakemeko nabatjintjaniswako namkha nabajanyiselelwako qobe nakubekwa ungqongqotjhe omutjha esikhundleni.
",0.5957092
"direkteursgeneraal en pro vinsiale departementshoofde word veral hierdeur geraak.
","abanqophisi zombelele (abodg) neenkhulu zemi nyango (amahod) eemfu ndeni ngibo abavamise uku caphazeleka khudlwana.
",0.5880067
"in sommige departemente het dgs, departementshoofde en uitvoerende bestuur die voor deel van 'n stabiele amps termyn geniet, wat sulke departemente in staat gestel het om met min ontwrigting aan te hou funksioneer.
","ke minye iminyango, abodg, amahod kunye nabaphathi abaphezulu azange bathi nteke ngoba izinto khange zitjharagane eminyangweni yabo, ngaleyindlelake imi nyango yabo isebenza nga phandle kokuliyeka okunga ko.
",0.61841774
"in die meeste sulke departemente waar daar stabiele leierskap is, is ouditverslae geneig om positief en openbare be fondsing verantwoordbaar te wees.
","ebunengini beminyango lapho iindaba zoburholi zi nzinze khona, imiphumela yokuhlolwa kweencwadi ivamise ukuba mihle, begodu zoke iimali zombuso ezise tjenziswe lapho kuyaziwa ukuthi zisetjenziswe njani.
",0.64086187
"daarenteen is daar dikwels administratiewe onstuimigheid in departe mente met ’n hoë omset van leierskap.
","lapho iinkhulu zeminyango zitjintjwatjintjwa khona ka nengi, kuvamisile ukuthi kurarane izinto ngobunengi.
",0.53877664
"een van die belangrikste voorstelle in die konsepraamwerk is dat die staats diens gedepolitiseer moet word en dat staatsdeparte mente van politiek geïsoleer moet word.
","esinye seemphakamiso eziqakathekileko ezenziwe emtlamweni lo kukuthi ikoro yembusweni akukafaneli ukuthi ithintane neendaba zepolitiki, begodu neminya ngo karhulumende nayo kufuze bona ingeyamani nepolitiki.
",0.6673096
"professionalisering is nood saaklik vir stabiliteit in die staatsdiens, veral in die se nior range.
","ubukghonofundwa buya funeka, kobanyana kuzo kuba nobunzinzo ekorweni yembusweni, khulu khulu eenkhundleni eziphezulu.
",0.6110133
"staatsamptenare moet hul pligte kan uitvoer ""ondanks enige veranderinge onder die ministers, lede van die uitvoerende raad of raadslede in die regerende party met betrekking tot die administrasie, of verskui wings van politieke partye na afloop van verkiesings"".
","abasebenzi bembusweni kufuze bakghone ukuragela phambili nokwenza umse benzi wabo ""ngaphandle kokutjintja abongqongnqo tjhe, abosomkhandlu na mkha amakhansela nga phakathi kwesiqhema esibu sako namkha amatjhuguluko weenqhema zepolotiki ngemva kwekhetho"".
",0.48367256
"ons stel ’n aantal verrei kende hervormings voor, byvoorbeeld die verlen ging van die ampstermyn van departementshoofde op grond van meriete en prestasie, die instelling van beroepsgebaseerde bekwaamheidsassesserings asook die betrokkenheid van die staatsdienskomis sie wanneer onderhoude met kandidate vir die poste van direkteursgeneraal en adjunkdirekteursgeneraal gevoer word.
","siphakamisa amatjhu guluko anabileko, afana nokuthi kungezelelwe isikha thi seenkhulu zeminyango nazisebenza kuhle, kuhlolwe nokuthi abasebenzi bembu sweni basebenza kuhle kangangani, bekumenywe nekomitjhini yabasebenzi bembusweni (ipsc) ibe khona nakuhlungwa abodg kunye namasekela wabo.
",0.64889336
"die instelling van integri teitstoetsing vir alle kandi date wat op die kortlys is, sal daartoe bydra dat ons staatsamptenare kan werf wat met eerbaarheid kan dien.
","ukuhlolwa kokuthembe ka kwabafakiimbawo zo msebenzi abenyulelwe ukuhlungwa kungaba lisizo, ngoba kungenza ukuthi siqatjhe abasebenzi bembu sweni abangasebenza ngo kuthembeka.
",0.6665025
"ons moet voorts ook die verpligte intreeeksamens wat ons in april 2020 inge stel het, uitbrei na meer as slegs die senior bestuurders.
","godu sifuna nokulidlulisela nakeminye imikhakha ihlelo lokuhlolwa okukatelelekileko ekuhlolwa ngalo abaphathi beenkhu ndla eziphakemeko naba thoma umsebenzi esithome ukulisebenzisa ngosihla bantangana wee2020.
",0.29517984
"suksesvolle ontwikkelende regerings het soortgelyke maatreëls wat professiona lisme onder die staatsdiens bevorder.
","imibuso eqalelela ituthuko ephumelelako inamahlelo anjalo asiza ukuphakamisa ubukghonofundwa ekorweni yembusweni.
",0.6085273
"soos ons in die konsepraamwerk noem, ""moet die burokrasie voortdurend lo jaal en nougeset die politieke mandaat wat deur die kiesers en die party daargestel is, implementeer, maar hulle daarvan weerhou om self politieke rolspelers te wees.
","njengoba sitjheja emtla mweni, ""umbuso kufuze ura gele phambili ngokwenzela abantu umsebenzi othunywe wona bavowudi nanga si qhema sepolitiki, ngoku khuthala nangokuyelela, nangokuthembeka, kodwana ubalekele ukuba bosopolitiki ngokwabo.
",0.4365165
"""ons voorstel is ’n stren ger benadering jeens die werwing en keuring, in duksie en prestasiebestuur van staatsamptenare.
","siphakamisa indlela etjhube khudlwana yokufuna noku khetha abasebenzi bompha kathi, neyokujayezwa umse benzi kwabasebenzi abasa ndukuqatjhwa kunye neyoku lawulwa kwamasebenzo wa basebenzi.
",0.62880427
"dit sluit in volgehoue leer en ’n duidelike professionele ontwikkelingspad vir elke staatsamptenaar.
","hlangana nalo khuke kubalwa nokufunda isiphelani nendlela ebonakala kuhle yokukuthuthukiswa kobukghonofundwa ko munye nomunye umsebenzi wembusweni.
",0.5629226
"die konsepraamwerk benadruk die behoefte om staatsamptenare verant woordbaar te hou vir on reëlmatighede en sodoende ’n kultuur van straffeloos heid in die wanbestuur en misbruik van regeringshulp bronne te verhoed.
","umtlamo uthi kuqakatheke khulu ukuthi ikoro yembu sweni ifundise/ibandule zoke iimphathimandla kiyo yoke imikhakha karhulu mende ngemithetho yembu sweni efaneleko.
",0.62480104
"professionalisering van die staatsdiens behels die opleiding van rekening kundige beamptes oor al die regeringsfere heen met betrekking tot die toepaslike wetlike bepalings.
","isikolo selizweloke sika rhulumende (insg) sino msebenzi oqakatheke khulu ekufuze siwenze lapha.
",0.5848079
"die nasionale regerings kool speel ’n sleutelrol in hierdie verband.
","ubukghonofundwa abu kaphathelani neencwadi ze fundo namakghonofundwa wecwephetjhe kwaphela, kodwana buphathelene nanehlonipho efaneleko, ne mikghwa emihle yokusebe nzisana namalunga wompha kathi.
",0.5185573
"professionalisme behels nie net die regte kwalifikasies en tegniese kennis nie, maar ook die toepaslike standaarde van respek, hoflikheid en integriteit in skakeling met lede van die publiek.
","ikoro yembusweni ina bile, inamakghonofundwa, iincwadi zefundo kunye na makghono anabileko.
",0.63806015
"die staatsdiens is uiteen lopend, met ’n wye verskei denheid vaardighede, kwa lifikasies en bekwaamhede.
","abase benzi bembusweni abanengi banamakghonofundwa akhe thekileko afunekako ekwe nzeni umsebenzi.
",0.6086031
"baie staatsamptenare het gespesialiseerde vaardig hede wat noodsaaklik is vir doeltreffende dienslewering.
","ngalokhoke akutjho ukuthi kufuneka ikoro yembusweni encazana: okufunekako eqinisweni yiko ro yembusweni elungele umsebenzi enamakghono fundwa afunekako, imikghwa yokuziphatha eyembeswe ngamakghonofundwa kunye nesibopho sokusebenzela abantu.
",0.5943186
"dit is dus nie noodwendig die geval dat ons ’n kleiner staatsdiens benodig nie; wat ons wel nodig het is ’n ef fektiewe staatsdiens met die nodige vaardighede, profes sionele etiek en ’n verbintenis om die gemeenskap te dien.
","amadoda nabafazi bekoro yembusweni kufuze bahlo nyiswe ngamandla koba nyana bazokukghona uku lima indimabo ekurageni ituthuko nekuhlanganiseni ihlelo lentando yenengi.
",0.63888705
"die mense in die staatsdiens moet in staat gestel word om hul rol te vervul in die strewe na ontwikkeling en die kon solidering van demokrasie.
","lesike siqinisekiso sethu esiphambili sombuso okgho nako osebenzela iinrhulu phelo zezakhamuzi.
",0.60274804
"dit is ons beste waarborg vir ’n bekwame staat wat die belange van sy landsburgers dien.
","ngikhombela bona ube yingcenye yehlelo lokubo nisana nomphakathi ngalo mtlamo womthetho, otho lakala kubunzinzolwazi bensg, la uzakuzwakalisa khona lakho ilizwi nombono.
",0.5530937
"ek doen ’n beroep op julle almal om deel te neem aan die openbare konsultasie proses vir hierdie konsepraamwerk, wat op die nasionale regeringskool se webwerf beskikbaar is, en om jul stemme te laat hoor.
","ikoro yembusweni ayi singeyesiqhema sinye, be godu akukafaneli bona ibe yikundla yesiqhema nanyana kungaba ngisiphi.
",0.6323903
"die staatsdiens behoort nie aan een spesifieke party nie; en dit behoort ook nie die domein van enige bepaalde belangegroep te wees nie.
","akukafa neli bona ibe ngumazenzela umathanda ngomthetho.
",0.48243982
"dit behoort nie bo die wet te staan nie.
","ikoro yembusweni nge yabantu besewula afrika.
",0.4571146
"die staatsdiens behoort aan die mense van suidafrika.
","imisebenzi yembusweni enamakghonofundwa vukuzenzele unnamed mhlazana ngikhe thelwa isikhu ndla sokuba ngu mengameli wesewula afrika, ngathi ukwakha umbuso osebenza kuhle, onekgho no nonemikghwa emihle, onganabukhohlakali zizi nto ezihlangana namaqa lontanzi wami aqakathe kileko.
",0.4571146
"tradisionele leiers van sleutelbelang tot herstelpogings vukuzenzele unnamed ons moes, in die afgelope paar maande, van twee van ons land se mees gesiene konings afskeid neem.
","abarholi bendabuko basilodlhelo semizamo yokuvuselela vukunzele unnamed eenyangeni ezimba lwa ezidlulileko, ku lambalele amakhosi amabili ahlonipheke khulu elizweni lekhethu.
",0.6474769
"die zoeloenasie het on langs sy majesteit, koning goodwill zwelithini ka bhekuzulu, wat vir n halfeeu regeer het, ter ruste gelê.
","isitjhaba sakwazulu sisa ndukuphekelela kiboyise mkhulu isilo samabandla, ikosi ugoodwill zwelithini kabhekuzulu obuse amatjhu mi amahlanu weminyaka.
",0.6894233
"die bapedivolk het in januarie kgoshikgolo thulare thulare iii ter ruste gelê wat minder as n jaar na sy inhuldiging oorlede is.
","ngotjhirhweni, isitjhaba sabapedi siphekelele kibo yisemkhulu ikosi ukgoshi kgolo thulare thulare iii, okhothame kungakapheli umnyaka ahlezi esitulweni.
",0.7278159
"ons het, met hul afsterwe, kampioene van die bewaring van ons land se erfenis en die geskiedenis van hul onder skeie volke verloor.
","ngokukhothama kwabo ndabezitha laba, silahle kelwe ziinkutani ebezi netjisakalo yokubulunga nokutlhogomela umlando nemvelaphi yeentjhaba zabo bona kungatjhabalali.
",0.45272785
"hulle het terselfdertyd ook wesenlik tot landelike ont wikkeling bygedra en was toegewy aan die steun van programme ter verbetering van hul mense se lewensge halte.
","kusesenjalo, bebalima indima eqakathekileko eku thuthukiseni iindawo zema khaya, bazimisele ukwenza amahlelo azokwenza ngcono ubujamo besitjhaba.
",0.62174416
"een van die nuwe regering se prioriteite, met die koms van demokrasie in 1994, was om die integriteit en reg matigheid van tradisionele leierskap in ooreenstemming met tradisionele wette en gebruike, en onderworpe aan die grondwet van die republiek, te hervestig.
","ngemva kokungena ko mbuso wentando yenengi ngomnyaka we1994, be kuqakathekile bona umbuso omutjha ubuyise isithunzi bewuqinisekise ubudosipha mbili bobukhosi nokukha mbisana nomthetho nama siko womthethosisekelo welizwe lekhethu.
",0.36953205
"die tradisionele leierskaps instelling speel steeds n belangrike rol in die lewens van miljoene mense regoor ons land, veral in landelike gebiede.
","ihlangano yabarholi ben dabuko iragela phambili ngokulima indima eqakathe kileko emaphilweni wabantu abaziingidigidi elizweni le khethu, khulukhulu eenda weni zemakhaya.
",0.5708167
"tradisionele leiers ondersteun en dryf ontwik keling in hul gemeenskappe.
","abarholi bendabuko basekela beba tjhayela ihlelo lokuthuthu kisa umphakathi.
",0.6048964
"ek het onlangs die geleent heid gehad om oor die debat van die opening van die na sionale huis van tradisionele leiers deel te neem; dié debat het op die dringende kwes sies wat die land in die gesig staar, gefokus.
","mvanje, ngibe nethuba lokuhlanganyela ekulume nipikiswano yokuvulwa kwendlu yesizwe yamakho si wendabuko, enqophe ekuqalisiseni iintjhijilo ilizwe eliqalane nazo.
",0.63860035
"wat juis besonders verfris send van dié kragtige ge sprekvoering was, was dat die tradisionele leierskap n besondere begrip van die moeilike ekonomiese toe stande wat die land in die gesig staar het en graag deel wil wees van die poging om die uitdagings van onderont wikkeling en armoede in hul omgewings aan te spreek.
","obekubethisa ummoya ngekulumopendulwano le kukobana abarholi benda buko namasiko batjengise ikareko yokujamelana no budisi bezomnotho ilizwe eliqalane nabo, begodu ba netjisakalo yokuba yingcenye yokulwisana neentjhijilo zokungathuthuki nomtlhago eendaweni ababusa kizo.
",0.65998507
"ek het nog altyd gesê dat ons ekonomiese herstel na af loop van die koronaviruspan demie inklusief moet wees, en dat niemand agtergelaat moet word nie.
","ngokungatjhugulukiko ngitjhwile bona ukubuyekeza umnotho ngesikhathi se ngogwana yecorona kufuze kufake woke umuntu, be godu akekho ozokuvalelwa ngaphandle.
",0.38252348
"die sukses van die ekono miese herkonstruksieen her stelplan rus op die smee van sterk vennootskapsbande tussen nie net die staat, han del en arbeid nie, maar ook met tradisionele leierskap en ander gemeenkapsgroepe.
","ukuphumelela kwehlelo qhinga lokukwakha kabu tjha nokuvuselela umnotho (ierrp) akuqinisi ubudle lwano phakathi kukarhulu mende, amarhwebo nabase benzi kwaphela, kodwana bulima indima nebarho lini bendabuko nezinye iinhlangano zomphakathi.
",0.37368453
"n deurlopende tema tydens die debat was dat tradisio nele leiers nie van aalmoese nie vir hulle gemeenskappe afhanklik wil wees nie en ook nie wil hê hul gemeenskappe moet die heeltyd van die regering se finansiële steun afhanklik wees nie.
","abahlanganyeli bekulu mopikiswano bagandelele indaba yokobana abasafuni ukuthembela ezabelweni namkha umphakathi uqa lelele khulu esizweni laka rhulumende ngezeemali.
",0.69093823
"hulle wil die nodige steun, opleiding en bemagtiging hê om landelike gemeenskappe in staat te stel om selfversor gend te wees.
","bafuna ukunikelwa isekelo elifaneleko, ukubandulwa kunye nebhoduluko elivu mela bona imiphakathi yee ndaweni zemakhaya izi jamele.
",0.54625833
"hulle wil die stedelikelandelike skeiding, met be trekking tot staatsdienste en privaat sektorhulpbronne, oorbrug.
","bafuna ukususa ukunga fani kwezinga lokuphakelwa kwezenzelwa zomphakathi eendaweni zemakhaya ne zemadorobheni kufakwa hla ngana neensiza zekoro yan geqadi nofana ezijameleko.
",0.6189932
"hul wil graag sien dat lande like gebiede omskep word in spoelpunte van ekonomiese aktiwiteit, asook bedryfsen werksgeleenthede.
","ebangathanda ukuku bona ngeendawo zemakha ya kukobana zibe maziko wemisebenzi yezomnotho, amabubulo namathuba wo msebenzi.
",0.5308635
"dit weer spieël die doelwitte van die distriksontwikkelingsmodel (dom) wat in 2019 geloods is.
","lokhu kutjengisa ukuphumelela kweemfiso zehlelo lokuthuthukiswa kweeyingi (iddm), elasu ngulwa ngomnyaka wee2019.
",0.5337684
