src_text,tgt_text,cosine_score
"eka mavhiki mambirhi lama nga hundza, mikanerisano ya vaaki a yi ri ku endlekeni eka dokhumente ya pholisi ya nkoka leyi yi nga ta nyika mafulufulu lamakulu eka matshalatshala ya hina ya ku seketela, ku tiyisa na ku nyika vuswikoti eka vuko rhokeri bya mfumo.
","kha vhege mbili dzo fhi raho, nyambedzano dza tshitshavha dzo vha hone malugana na ḽiṅwalo ḽa vhuṱhogwa ḽa mbekanya maitele ḽine ḽa ḓo ṋetshedza ṱhuṱhuwedzo khulwane kha vhuḓiimiseli hashu u itela u khwaṱhisa, u maanḓafhadza na u kona u langa tshumelo ya tshitshavha.
",0.35521033
"rimba ra nsimeko ra rixaka ra mpfapfarhuto eka ku endla vukorhokeri bya mfumo byi va bya xiphurofexinali ri na xikongomelo xa ku aka mfumo lowu korhokelaka vanhu va ka hina ku antswa, lowu wu sirheleriweke eka ku nghenelela ka tipolitiki loku nga fanelangiki na laha ku thoriwa swi endliwaka hi ku ya hi mipimo yo ringanela.
","mvetomveto ya u shu miswa ha muhanga wa lushaka kha vhuḓivhi ha tshumelo dza muvhuso i pika kha u fhaṱa muvhuso une wa shumela vhathu vha shu, wo tsireledzeaho kha u dzhenelela ha poḽotiki hu sa ṱoḓei na kha hune u tholwa ha vha ho itwa zwo fanela.
",0.5985205
"rimba leri ri pasisiwile hi khabinete hi hukuri lembe leri nga hela naswona mika nerisano ya xivumbeko na ti sekitara to hambanahambana ta vaaki yi le ku endliweni sweswi.
","muhanga wo ṱanganedzwa nga khabinethe nga ḽara ṅwaha wo fhelaho nahone nyambedzano dzo dzudza nywaho na sekhithara dzo fhambanaho dza tshitshavha dzi nḓilani zwazwino.
",0.33313373
"makumembirhinkombo wa malembe eka xidemo kirasi, swi nga vuriwa hi vukorhokeri bya mfumo leswaku loko swikhwama swo hlayanyana swa kahle swinene swi ri kona, hi na mitlhontlho yo tivikana eka tindzawulo ta mfumo to tala hi mayelana na swikili, vuswikoti, na moya wa xi phurofexinali.
","miṅwaha ya fumbilisumbe ya demokirasi, zwi nga ambe lwa tshumelo ya muvhuso uri musi hu na vhukoni vhuṱukuṱuku vhu re hone, ri na khaedu khulwane kha mihasho minzhi ya mu vhuso malugana na zwikili, vhukoni na vhuḓivhi.
",0.63653094
"hinkwaswo hi ntolovelo kutlula mpimo, vanhu va thoriwile na ku tlakusiwa ku ya eka swiyimo leswi swi nga fanelangiki kumbe va nga swi thwaselangiki.
","zwo no ḓi itea lunzhi, vha thu vha tholwa vha dovha hafhu vha fhiriselwa kha vhuimo ha phanḓa vhune a vhu ngo vha fanela kana a vha swikeli u vha khaho.
",0.307196
"leswi swi khumba matirhelo ya mfumo, kambe swi tlhela swi hoxa xandla eka ku tholana hi vuxaka, ku nghenelela ka tipolitiki eka ntirho wa tindzawulo, ku pfumaleka ka vutihlamuleri, vufambisi byo ka byi nga lulamangi na vukungundzwana.
","hezwi zwi kwama mas humele a muvhuso, fhedzi zwi dovha hafhu zwa shela mulenzhe kha tshiḓivhano, u dzhenelela ha poḽotiki kha mishumo ya mihasho, u shea ha vhuḓifhinduleli, u sa langwa zwone na zwiito zwa vhuaḓa.
",0.649379
"ku tlhela ku va na xiphiqo xo fambelana xa ku nghe nelela ka tipolitiki na vurha ngerinkulu eka mafambiselo ya vukorhokeri bya mfumo.
","hu dovha hafhu ha vha na thaidzo i elanaho na u dzhe nelela ha poḽotiki na vhala nguli kha ndaulo ya tshu melo ya muvhuso.
",0.56847125
"munhu u dinga ntsena ku languta eka ku pfumaleka ntshamiseko eka tindzawulo ta mfumo loko vafambisi nkulu va cincacinciwa kumbe ku siviwa nkarhi na nkarhi loko ku thoriwa holobye lontshwa.
","muthu u khou fanela u sedza kha u shayea ha vhudziki ha mihasho ya muvhuso musi vhalanguli vhahulwane vha tshi vhavhingwa kana u tshintshiwa tshifhinga tshoṱhe musi minisṱa a tshi tholwa.
",0.55239695
"valawurinkulu vo angarhe la na tinhloko ta tindzawulo ta swifundzakulu hi vona va khumbekaka ngopfungopfu.
","vhalanguli vhahulwane na vhahulwane vha mihasho ya mavunḓu vha dzulela u kwamea.
",0.45409518
"eka tindzawulo tin'wana, tidg, tihod na vafambisi va vurhangerinkulu va vile na ntshamiseko eka nkarhi wa vona wa ku khoma hofisi, leswi pfumelelaka tindzawu lo ku tirha hi nkavanyeto wuntsongo.
","kha miṅwe miha sho, dzidg, dzihod na vhala nguli vhahulwane vho vha na vhudziki musi vha tshi tho lwa lwa tshoṱhe, zwa konisa mihasho u shuma hu tshi tou vha na u khakhisea huṱuku.
",0.3653171
"eka vunyingi bya tindzawulo leti laha ku nga na ntshamiseko wa vu rhangeri, mivuyelo ya oditi yi tala ku va leyinene naswona timali ta mfumo ti humese riwa vutihlamuleri.
","kha vhunzhi ha mihasho iyi hune ha vha na vhudziki kha vhurangaphanḓa, mawanwa a muṱolo a dzulela u vha avhuḓi nahone masheleni a tshitshavha a a vhonala uri khou shumiswa hani.
",0.5235044
"laha ku nga na nhlayo ya le henhla ya ku fambetela na ku siviwa ka tinhloko ta tindzawulo, ku tala ku tshama ku ri na nkavanyeto wa mafambiselo.
","hune ha vha na kuṱutshele kwa vhalanguli vha mihasho, hu dzulela u vha na khakhathi kha ndangulo.
",0.51771474
"xin'we xa swibumabumelo swa nkoka leswi endliweke eka rimba ra mpfapfarhuto hi leswaku vukorhokeri bya mfumo, ngopfungopfu eka swiyimo swa le henhla byi boheka ku nga tirhiseriwi tipolitiki na leswaku tindza wulo ta mfumo ti boheka ku sirheleriwa eka tipolitiki.
","nthihi ya themendelo khulwane dzo itwaho kha muhanga wa mvetomveto ndi ya uri tshumelo ya mu vhuso i fanela u bviswa kha zwa poḽotiki na uri mihasho ya muvhuso i fanela u tsire ledzwa kha poḽotiki.
",0.6454773
"ku endliwa ka xiphu rofexinali swi fanerile ku endlela ntshamiseko eka vukorhokeri bya mfumo, ngopfungopfu eka swiyimo swa le henhla.
","u vha makone ndi zwa vhuṱhogwa kha vhudziki ha kha tshumelo ya muvhuso, nga maanḓesa kha maimo a nṱha.
",0.5883416
"vatirhela mfumo va boheka ku ya emahlweni va tirha mitirho ya vona ""handle ka micinco yihi kumbe yihi ya vaholo bye, swirho swa khansele ya vurhangerinkulu kumbe vakhanselara endzeni ka vandla leri fumaka leri ri nga na matimba ya mafambiselo, kumbe ku cinca ka mavandla ya tipolitiki endzhaku ka mihlawulo"".
","vhashumeli vha mu vhuso vha fanela u kona u isa phanḓa na u ita mishumo yavho ""zwi si na ndavha na u tshintsha ha minisṱa, miraḓo ya khoro ndanguli kana vhoṋeḓorobo kha ḽihoro ḽivhusi ḽine ḽa khou langula, kana tshanduko kha mahoro a zwa poḽotiki nga murahu ha khetho"".
",0.631764
"hi le ku ringanyeteni ka mi antswiso yo hlayanyana, tani hi ku engetelela nkarhi wa ku khoma hofisi wa tinhloko ta ndzawulo hi ku ya hi mpimo wo ringanela na matirhelo, ku endla mihlahluvo ya vu swikoti bya ntirho na ku katsa khomixini ya vuko rhokeri bya mfumo eka tii nthavhiyu ta valawurinkulu vo angarhela na swandla swa valawurinkulu vo angarhela.
","ri khou dzinginya tshivha lo tsha tshanduko dzi re kule na u swikelwa, dzi fanaho na u engedza tshifhinga tsha mishumo ya tshoṱhe kha vhalanguli vha mihasho zwi tshi ya nga vhukoni na mashumele, u ita ngaganyo dza vhukoni dzo ḓitikaho nga mushumo na u dzhenisa khomishini ya tshumelo dza muvhuso kha inthaviwu dza vhalanguli vhahulwane na vhafarisavhalanguli vhahu lwane.
",0.61919034
"ku tivisa swikambelo swa vutengi eka vanhu lava hlawuriweke swi ta pfuna leswaku hi kota ku kuma vatirhelamfumo lava nga ta korhokela hi ku tshembe ka.
","u ḓivhadza ndingo dza tshirunzi kha vhathu vhoṱhe vho khethelwaho u ita inthaviwu zwi ḓo thusa nahone ri ḓo kona u thola vhashumeli vha muvhuso vhane vha nga kona u shuma nga vhufulufhedzei.
",0.56910074
"hi tlhela hi dinga ku ndlandlamuxa swikambelo swo nghena swo boha leswi hi nga swi tivisa hi dziva misoko 2020 ku hundza eka vufambisi bya le henhla.
","ri khou fanela u engedza milingo ya khombekhombe ya u dzhena ye ra i ḓivhadza nga lamba mai 2020 kha vhalanguli vhahulwane.
",0.60093695
"mifumo leyi hluvukaka leyi nga humelela yi na ma goza lama fanaka lama nga ta pfuna ku antswisa moya wa xiphurofexinali endzeni ka vukorhokeri bya mfumo.
","mivhuso yo bvelelaho i na maga a fanaho ane a thusa u vha muḓivhi ngomu kha tshumelo ya muvhuso.
",0.51595575
"loko ha ha tsala eka rimba ra mpfapfarhuto, ""xibyu rokirasi xi boheka ku ya emahlweni ku simeka hi ku tshembeka na hi vurhonwana xilerisoximfumo xa tipolitiki lexi nga vekiwa.
","musi ri tshi khou ṱhogomela mvetomveto ya muhanga, ""maitele a ndangulo a fa nela u bvela phanḓa na u shumisa bono ḽa zwa poḽotiki nga vhuronwane na nga u fulufhedzea ḽe ḽa vhewa nga vhakhethi na dzangano, fhedzi nga nyiledzo kha u vha vhorapoḽotiki vhone vhaṋe.
",0.6440721
"hi ringanyeta endlelo ra vurhon'wana swinene eka ku laviwa na ku hlawuriwa ka vatirhelamfumo, vutivisi bya matirhelo na malawulelo ya matirhelo.
","""ri khou eletshedza ma thomo a vhuronwane kha u tholwa na u khethwa ha vhashumeli vha muvhuso, maitele a u wana vhashumi vhaswa na ndangulo ya kushumele.
",0.5834949
"leswi swi katsa ku dyondza loku yaka ema hlweni na ndlela ya nhluvu kiso wa xiphurofexinali yo vonaka ya mutirhelamfumo un'wana na un'wana.
","hezwi zwi katela ngudo dzi bvelaho phanḓa na nḓila ya mvele dziso ya vhukoni i re khagala kha mushumeli muṅwe na muṅwe wa muvhuso.
",0.58285517
"rimba ra mpfapfarhuto ri veka ntshikelelo eka xidingo xa ku endla vatirhelamfumo va va na vutihlamuleri eka matirhiselo ya mali lama hambanaka na milawu, ku tshika ntolovelo wa ku ka va nga katsiwi eka mixupulo eka malawulelo yo homboloka na ku yiveteriwa ka swipfuno swa mfumo.
","mvetomveto ya muhanga i ombedzela kha ṱhoḓea dza u ṋea vhashumeli vha mu vhuso vhuḓifhinduleli kha vhuḓifari vhu si havhuḓi, u fhelisa mvelele ya u sa dzhiela muthu vhukando kha ndaulo i si yavhuḓi na i songo fanelaho ya zwishu miswa zwa muvhuso.
",0.6134541
"ku endla vukorhokeri bya mfumo byi va bya xiphu rofexinali swi katsa vuleteri bya vaofisiri lava nga na vu tihlamuleri eka swiyenge hinkwaswo swa mfumo eka milulamiselo ya milawu leyi nyikiweke leyi faneleke.
","u khwiṋisa tshiimiswa tsha muvhuso zwi katela u pfumbudza vhaofisiri vha muvhalelano u mona na madavhi oṱhe a muvhuso kha thendelo yo teaho ya zwa mulayo.
",0.63111424
"xikolo xa mfumo xa rixaka xi na xiave xa nkoka ku xi tlanga eka mhaka leyi.
","tshikolo tsha lushaka tsha muvhuso tshi na mushumo wa ndeme une tsha fanela u u ita kha heḽi fhungo.
",0.44146082
"moya wa xiphurofexinali a wu hi mayelana na ku va na mithwaso leyi faneleke na swikili swa xithekiniki ntsena, kambe wu tlhela wu va hi mayelana na ku va na mipimo leyi faneleke ya nhlonipho, ku titsongahata na vutengi eka ku tirhana na vaaki.
","u vha muḓivhi a si u vha na ndalukanyo dzo fanelaho na zwikili zwa thekhiniki fhe dzi, fhedzi na u dovha hafhu wa vha na u tevhela milayo yo fanelaho ya ṱhonifho.
",0.6481182
"vukorhokeri bya mfumo byi hambananile, byi ri na vunavi lebyikulu bya swikili, mi thwaso na vuswikoti.
","tshiimiswa tsha muvhuso tsho angalala, na u vha na vhunzhi ha zwikili, nda lukanyo na vhukoni.
",0.3020652
"vatirhelamfumo vo tala va na swikili swo kongomisa leswi swi faneleke eka ku phakela loku tirhaka kahle ka vukorhokeri.
","vha shumeli vhanzhi vha mu vhuso vha na zwikili zwo khetheaho zwine zwa vha zwa ndeme kha ndugiselo i shumaho ya tshumelo.
",0.5064008
"hikokwalaho, a hi mhaka ngopfu ya leswaku hi dinga vukorhokeri bya mfumo lebyitsongo: lexi hi xi dingaka ngopfu i vukorho keri bya mfumo lebyi ringa neleke xikongomelo lebyi nga na swikili leswi ringaneleke, matikhomelonene ma xiphu rofexinali na ku tinyiketela ku korhokela vanhu.
","zworalo, a si zwa ndeme uri ri ṱoḓa tshumelo ṱhukhu ya muvhuso: zwine ra ṱoḓa ndi tshumelo ya muvhuso yo linganaho tshipikwa ine ya vha na zwikili zwo fane laho, mikhwa ya vhuḓifari havhuḓi na vhuḓiimiseli ha u shumela vhathu.
",0.7209087
"vavanuna na vavasati va vukorhokeri bya mfumo va dinga ku nyikiwa vuswikoti ku kota ku tlanga xiphemu xa vona eka ku fambisa nhluvukiso na ku tiyisa xi demokirasi.
","vhanna na vhafumakadzi vha tshumelo ya muvhuso vha fanela u funḓedzwa vhukoni ha u ita mushumo wavho kha u tshimbidza mveledziso na u ṱanganya demokirasi.
",0.63218206
"lexi i xitiyisiso xa hina xo tlula hinkwaswo xa mfumo wo swi kota lowu korhokelaka ku tsakela ka vaakatiko.
","heyi ndi pfu lufhedziso ya khwiṋe ya muvhuso u konaho une wa shumela zwine vhadzulapo vha takalela zwone.
",0.55268306
"ndzi mi kombela ku va xiphemu xa phurosese ya mikanerisano ya vaaki hi mayelana na rimba ra mpfa pfarhuto, leri ri kumekaka eka webusayiti ya xikolo xa mfumo xa rixaka, na ku endla leswaku rito ra wena ri twiwa.
","ndi humbela vhoiwe uri ni vhe tshipiḓa tsha maitele a nyambedzano dza tshi tshavha kha mvetomveto ya muhanga uyu, ine ya vha hone kha webusaithi ya tshikolo tsha lushaka tsha muvhuso, na u ita uri maipfi a vhoiwe a pfiwe.
",0.60432595
"vukorhokeri bya mfumo a hi bya vandla rin'we ro karhi, kumbe a byi fanelangi ku va ndhawu ya ntlawa wo karhi lowu nga na ku navela.
","tshimiswa tsha muvhuso a si tsha ḽihoro na ḽithihi, kana u vha muvhuso wa tshigwa da tsha dzangalelo ḽeneḽo.
",0.59027976
"a byi fanelangi byi va nawu eka byona n'wini.
","a tshi faneli u vha mulayo nga tshone tshiṋe.
",0.30769452
"vukorhokeri bya mfumo i bya vanhu va afrikadzonga.
","tshiimiswa tsha muvhuso ndi tsha vhathu vhoṱhe vha afrika tshipembe.
",0.5871952
byi fanele ku korhokela vona naswona vona ntsena.,"tshumelo ya muvhuso ya maimo a nṱha vukuzenzele unnamed musi ndi tshi khethwa kha vhuimo ha u vha muphuresidennde wa afrika tshipembe, ndo amba zwa uri u fhaṱa mu vhuso u bvelelaho, u ko naho nahone wa mikhwa u si na zwiito zwa vhuaḓa zwo vha zwi tshiṅwe tsha zwa ndemesa kha nṋe.
",0.5871952
"varhangeri va swa ndhavuko i va nkoka eka matshalatshala yo pfuxeta hi vuntshwa vukuzenzele unnamed eka tin’hweti titso ngo leti hundzeke, hi vile ni ku lelana ka gome na tihosi timbirhi to hlonipheka swinene ta tiko ra hina.
","vharangaphanḓa vha zwa sialala ndi vha ndeme kha ndingedzo dza mvusuludzo vukuzenzele unnamed kha miṅwedzi i si gathi yo fhiraho ro onesana nga mbiluvhuṱungu na vha hali vhavhili vha zwa si alala vha ṱhonifheaho kha shango ḽashu.
",0.6271056
"sweswinyana rixaka ra ma zulu ri lahlile muhlonipheki hosi goodwill zwelithini ka bhekuzulu loyi a fumeke ku ringana hafu ya dzana ra ma lembe.
","a si kale lushaka lwa ma zulu lwu tshi kha ḓi tou bva u swiṱa khosikhulu yalwo muhali vho goodwill zwe lithini vha ha bhekuzulu, vhe vha vhusa lushaka ulwo lwa miṅwaha i linganaho hafu ya sentshari (miṅwaha ya 50).
",0.40102166
"hi sunguti, vapedi va lahlile kgoshikgolo thulare thulare iii, loyi a nga hundza emisaveni ehansi ka lembe a vekiwile exitulwini.
","nga ṅwedzi wa phando, lushaka lwa bapedi lwo swiṱa khosikhulu yalwo vho thu lare thulare wa vhuraru, vhe vha dzama hu songo fhela na ṅwaha vho rwelwa ṱari sa khosi.
",0.57243705
"eka ku hundza ka vona emisaveni, hi lahlekeriwile hi tinhenha leti ti hlayiseke ndhavuko, na vanhu vo hloniphiwa hikwalaho ka matimu yo hlonipheka ya rixaka ra vona.
","kha u fhira fhano shangoni ha avho, ro xelelwa nga vhaha li vha ndondolo ya vhufa ha shu, vhalisa vha ṱhonifheaho kha ḓivhazwakale ya vhathu vhavho.
",0.5523139
"nakambe, a va ri vatlangi va xiphemu xa nkoka eka nhluvukiso wa miganga, naswona a va tinyiketerile ku fambisa minongonoko ku tlakusa swiyimo swa nkoka swa rixaka ra vona.
","nga tshifhinga tshenetsho, vho vha vhatambi vha tshipiḓa tsha ndeme kha mveledziso ya vhupo ha mahayani, nahone vho vha vho ḓiimisela kha u bveledza mbekanyamushumo dzine dza ḓo khwiṋisa kutshilele kwa vhalanda vhavho.
",0.5198982
"loko ku sungula xidemoki rasi hi 1994, a ku ri xirhanga na xa mfumo lowuntshwa ku vuyisela vutshembeki na ntiyiso wa vurhangeri bya swa ndhavuko hi ku fa mbelana na milawu ya ndha vuko na mahanyelo na hiku landzelela vumbiwa ra ri phabuliki.
","zwi tshi tevhela u thoma ha demokirasi nga 1994, tsho vha tshipikwa tsha muvhuso muswa u vhue dzedza vhufulufhedzei na vhurangaphanḓa ha vhuku ma ha zwa sialala, nga fhasi ha milayo ya sialala na mai tele a ḽino shango nahone zwo ḓisendeka nga ndayotewa ya shango.
",0.6883038
"huvo ya vurhangeri bya swa ndhavuko yi ya ema hlweni yi va na ntirho wa nkoka evuton’wini bya ti miliyoni ya vanhu etikweni ra ka hina, ngopfungopfu ematikoxikaya.
","tshiimiswa tsha vharanga phanḓa vha zwa sialala tshi khou bvela phanḓa na u shuma mushumo wa ndeme kha matshilo a miḽioni dza vhathu u mona na shango ḽashu, zwihulu vhuponi ha mahayani.
",0.5229833
"varhangeri va swa ndhavuko va seke tela na ku fambisa nhluvuko emigangeni ya vona.
","vharangaphanḓa vha zwa sialala vha ṋea thi khedzo na u ḓisa mveledziso kha lushaka.
",0.49389723
"sweswinyana, ndzi vile na nkateko wo nghenelela eka njhekanjhekisano loko ku pfuriwa yindlu ya rixaka ya varhangeri va swa ndha vuko, leyi a yi khumbeke hi timhaka leti tshikelelaka swinene leti nga langutana na tiko ra hina eka nkarhi wa sweswi.
","zwenezwino, ndo vha na tshikhala tsha u dzhenela therisano kha mushumo wa u vula nnḓu ya lushaka ya vharangaphanḓa vha zwa sialala, he therisano idzo dza vha dzo sedzesa kha dziṅwe dza khaedu nnzhi dzine ḽino shango ḽa khou ṱangana na dzo zwazwino.
",0.4961776
"lexi phyuphyiseke moya mayelana na mbhurisano wa matimba a ku ri leswaku vurhangeri bya ndhavuko byi tlangela hi matimba swiyimo swo tika swa ikho nomi leswi nga langutana na tiko ra ka hina, naswona byi lava ku va xiphemu ku lula misa mitlhontlho yo tala ya nkalanhluvukiso na vusweti emigangeni ya vonandzi boxile ko hlaya leswa ku nhlakarhelo wa ikhonomi ya hina eka ku tumbuluka ka ntungukulu wa khoro navhayirasi swi fanele ku katsa hinkwavo, naswona ku nga vi na loyi a siyiwaka endzhaku.
","zwe zwa vha zwi tshi khou takadza zwihulu nga ha therisano idzo ndi u vhona vharangaphanḓa vha zwa sialala vha tshi sumbedza u pfesesa khaedu dza zwa ikonomi dzo ambarelaho ḽino shango, na u ṱoḓa u vha tshipiḓa tsha thandululo kha khaedu nnzhi dza u sa bvelela na vhushai kha vhupo havho.
",0.6347189
"ku humelela ka kungu ra ku akiwa hi vuntshwa na nhlakarhelo wa ikhonomi swi le ka ku kuma vutirhi sani bya matimba ku nga ri exikarhi ka mfumo ntsena, bindzu na ntirho, kambe na vurhangeri bya ndhavuko na ku vumbiwa ka rixaka.
","tshifhinga tshoṱhe ndi amba fhungo ḽa uri mvusuludzo ya ikonomi ya shango ḽashu zwino nga tshifhinga tsha dwadze ḽa tshitzhili tsha corona i ṱoḓa mutingati, zwo ralo a hu na muthu ane a fanela u siiwa murahu.
",0.5615034
"ku tikhoma ka nkarhi nka rhi ka vatekaxiave eka njheka njhekisano sweswi hileswaku a va tsakeli ku tiseketela hi swihanano kumbe miganga ya vona yi ya emahlweni yi langutela eka mfumo ku pfuniwa hi swa timali.
","u phuletshedza kha pulane ya mvusuludzo na mbue dzedzo ya ikonomi zwo ḓisendeka nga tshumisano yo khwaṱhaho hu si vhukati ha muvhuso, mabindu na vha shumi fhedzi, fhedzi na kha vharangaphanḓa vha zwa sialala khathihi na zwiṅwe zwiimiswa zwa vhadzulapo.
",0.5590205
"va lava ku nyikiwa nseke telo lowu faneleke, ndzetelo ni ku endla leswaku ndhawu yi pfumelela matikoxikaya ku kota ku tiyimela.
","nyiledzo ya u ḓidzhenisa ha vhadzheneli kha therisano dza zwenezwino zwo vha ngwa nga u sa ṱoḓa havho u ḓitika tshoṱhe nga zwifhiwa, na u sa ṱoḓa uri vhadzulapo vhavho vha dzulele u sedza kha muvhuso tshifhinga tshoṱhe vha tshi ṱoḓa thuso ya masheleni.
",0.17138192
"va lava ku hlanganisa avo wa dorobaxikaya eka ku fikelela vukorhokeri bya mfumo na switirhisiwa swa tisekitara to ka ti nga ri ta mfumo.
","vha khou ṱoḓa u ṋetshedzwa thikhedzo yo teaho, u pfumbu dzwa na u konisa vhupo ha vho u itela uri vhadzulapo vha vhupo ha mahayani vha kone u ḓiimisa nga vhoṱhe.
",0.5895525
"leswi va nga tsakelaka ku swi vona i ku va matikoxi kaya ya hundzuka senthara ya migingiriko ya ikhonomi, indasitiri na ku pfuleka ka mintirho.
","vharangaphanḓa vha zwa sialala vha khou ṱoḓa u fhungudza gake ḽine ḽa vha hone vhukati ha vhupo ha mahayani na ha dziḓoroboni malugana na u swikela tshumelo dza muvhuso na zwiko zwa nḓowetshumo ya phuraivethe.
",0.5602105
"leswi swi kombi sa leswi naveriwaka swa nhluvukiso wa mondlolo wa xifundzhatsongo (ddm), lowu simekiweke hi 2019. varhangeri va swa ndha vuko va vekiwile endhawini leyinene ku tiyisisa leswaku makungu ya xifundzha tsongo ya fikeleriwa ni ku hlamula swilaveko swa nti yiso swa miganga na leswaku va kombisa ntiyiso lowu ha nyiwaka ematikoxikaya.
","zwine vha tama ndi u vhona vhupo ha mahayani vhu tshi vha senthara ya mushumo wa ikonomi, mamaga na zwikhala zwa u sikwa ha mi shumo.
",0.62296903
"tanihiloko ddm yi seketela minongonoko ya miganga leyi kongomisaka eka swi dingo, matimba na mikarhi eka tindhawu to karhi, va rhangeri va swa ndhavuko va sungurile endlelo ra vona eka nhluvukiso wa ikhonomi ya miganga.
","hezwi zwi sumbedza zwipikwa zwa tshiedza tsha mveledziso ya tshiṱiriki (ddm), tshe tsha rwelwa ṱari nga ṅwaha wa 2019. vharangaphanḓa vha zwa sialala vha kha vhuimo havhuḓi ha u vhona uri pu lane dza tshiṱiriki dzo dzia, nahone dzi fhindula kha ṱhoḓea dza vhukuma dza vhadzulapo khathihi na u sumbedza ngoho yo tshili waho vhuponi ha mahayani.
",0.5786892
"va tumbuluxile investrural masterplan, leyi nga sime kiwa en’walunguvupela dyambu n’hweti leyi hundze ke.
","u fana na musi ddm i tshi tikedza mbekanyamushumo dzapo dzi lavhelesaho kha ṱhodea, nungo na zwi khala kha vhupo vhukene, vharangaphanḓa vha zwa sialala vho bveledza nḓila yavho ya mveledziso yapo ya ikonomi.
",0.467829
"swi hlohlotela swinene leswaku varhangeri va swa ndhavuko va khomanile ku seketela kungu leri naswona va lava ku tirha na varha ngeri va miganga ku tiyisisa leswaku swa humelela.
","vho bveledza pulane khu lwane ya u ita vhubindudzi vhuponi ha mahayani ye ya rwelwa ṱari vunḓuni ḽa north west ṅwedzi wo fhelaho.
",0.53710014
"hi nkarhi wa njhekanjheki sano eka yindlu ya rixaka ya vafambisi va swa ndhavuko ku nyikiwile mavonelo ya leswaku ku humelela loku kulu ka mhaka ya nongonoko wa investrural hileswaku mihlangano ya swa ndha vuko ya leteriwa, ku tiyisiwa ni ku dyondzisiwa.
","zwi a ṱuṱuwedza zwihulwane u vhona uri vharangaphanḓa vha zwa sialala vho vhu elelana hafhu nga murahu ha pulane iyi nahone vha khou ṱoḓa u shumisana na vharangaphanḓa vhapo u vhona uri pulane iyo i bvelele.
",0.58958477
"vatekaxiave vo hlaya va andlarile makungu ya ikho nomi lama nga eka switeji leswi tlakukeke swa nhluvu kiso.
","nga tshifhinga tsha theri sano kha nnḓu ya lushaka ya vharangaphanḓa vha zwa sialala ho dzinginywa uri tshiitisi tshihulwane tsha u phuletshedza tsha mbeka nyamushumo ya investrural ndi u vhona uri miraḓo ya zwa sialala vho pfumbu dzwa, u manḓafhadzwa na u koniswa kha mushumo wonoyo.
",0.628644
"leswi swi sungula eka tiphurojeke ta swa vurimi ku fika bayosiporopekiti ku ya eka eneji leyi pfuxelelekaka.
","vhunzhi ha vhe vha vha tshipiḓa vho ḓivhadza pulane dza ikonomi dzine dza vha kha zwipiḓa zwa u fhedzisela zwa mveledziso.
",0.4974779
"leswi a swi ri erivaleni hi leswaku huvo ya vurhangeri bya swa ndhavuko yi twisisa leswaku ku dyondzeka swi na nkoka swinene eka ma bindzu ya le makaya hi ndlela ya mabindzu lamatsongo, ma le xikarhi na swibindzwana na mabindzuntirhisano ku va xiphemu xa ikhonomi ya ntolovelo.
","hezwi ndi u bva kha thandela dza zwa vhulimi u ya kha u ṱoḓwa ha zwipuka na miri u itela u wana mishonga na u ya kha fulufulu ḽi vusuludzeaho.
",0.21737975
"varhangeri va swa ndha vuko lava vulavuleke va nyikile xivono xa vona xa ‘tihosi ta nhluvukiso’, lava va tivonaka va nga ri nstena va hlayisi va swa ndhavuko kambe tanihi vafambisi va ikhonomi leyi humelelaka ni ku ya emahlweni.
","zwe zwa vha zwi khagala ndi zwa uri tshiimiswa tsha vhurangaphanḓa ha zwa sialala tshi pfesesa uri kushu mele kwa maimo a nṱha ndi kwa ndeme kha vhubindudzi ha mabindu maṱuku, a vhu kati na mabindu mahulwane a vhupo ha mahayani, kha thihi na kha tshumisano ya uri a kone u vha tshipiḓa tsha lutsinga lwa ikonomi.
",0.6198181
"va kotile ku tiva tiphurojeke to hlaya na tindlela ta ikhonomi leti nga ta tumbuluxa mitirho ni ku antswisa vutihanyisi bya le matikoxikaya.
","vharangaphanḓa vha zwa sialala vhe vha amba vho ṱahisa bono ḽavho ḽa ‘vhavhusi vha mveledziso’vhane vha si ḓivhone sa vharangaphanḓa vha zwa vhufa fhedzi, fhedzi sa vhabveledzisi vha lupfu mo na mvelephanḓa ya iko nomi.
",0.46392423
"varhangeri va swa ndha vuko va tlhele va kombisa ku tiyimisela ka vona ku endla xiave xa nkoka xa endlelo ra nhluvukiso wa misava.
","vho topola thandela dza tshivhalo na zwikhala zwa ikonomi zwine zwa ḓo sikela vhathu mishumo na u khwiṋisa kutshilele kwa vha thu kha vhupo ha mahayani.
",0.4825623
"hi mpfhuka ka 2018, varha ngeri va swa ndhavuko va endlile kwalomu ka 1 500 000 wa tihekitara ta misava ya bindzu leyi nga pfulekela ku hluvukisiwa, na swona ku na ntshembo wa leswaku leswi swi nga tlakuka nkarhi lowutaka.
","vharangaphanḓa vha zwa sialala vho ita na u bvisela khagala lutamo lwavho lwa u shela mulenzhe kha maitele a tshanduko dza zwa mavu.
",0.54764885
"ku hluvukisa qhingha leri nga nhlanganisiwa leri nga tiyiselaka, hi pfumerile ku khoma samiti ya misava ya presidente eka lembe leritaka.
","u bva nga ṅwaha wa 2018 vharangaphanḓa vha sialala vho ṋetshedza hekithara dza mavu avho dza 1 500 000 uri a shumiswe kha mveledziso, nahone hu khou fulufhelwa uri zwa u ṋetshedzwa ha mavu hu tshi itelwa mve ledziso zwi ḓo engedzea tshifhingani tshi ḓaho.
",0.5077199
"laha ku ta vulavuriwa hi swilo leswi nga ni ntshikelelo mayelana na ku hluvukisa misava na switandzhaku leswi nga kona emisaveni ya bindzu, yo tala ya yona leyi kumekaka ematikoxikaya.
","u bveledza ḽiano ḽo dzudza nywaho nahone ḽa tshifhinga tshilapfu, ro tendelana kha u ḓo fara guvhangano ḽa mu phuresidennde ḽa u rera nga ha mavu ṅwaha u ḓaho.
",0.20001706
