src_text,tgt_text,cosine_score
"muhumbulo wa tshumisano i vhuedzaho roṱhe u ḓo vha wa ndeme nga maanḓesa kha mbuedzedzo ya ikonomi ya ḽifhasi, hune mveledziso i sa lingani ya amba uri maṅwe mashango a ḓo vhuelela ngo nani nga u ṱavhanya, ngeno maṅwe a tshi ḓo vha o salela murahu.
","ingqiqo yentsebenziswano ezuzisa amacala onke iza kubaluleka ngokukodwa ekuvuselelweni koqoqosho lwehlabathi, apho uphuhliso olungalinganiyo luthetha ukuba amanye amazwe aza kubuyela kwimo yesiqhelo msinyane, ngethuba amanye esilela ngasemva.
",0.45616326
"nga thikhedzo kha mbu edzedzo ya ikonomi, vha shumisani vha mashango a brics vho tendelana u khwaṱhisa tshumisano kha sekhithara dza zwa khemikhaḽa dzi fanaho na muḓagasi, saintsi, ḓivhakhomphyutha (it), thekhinoḽodzhi na vhutu mbuli, vhulimi na nyaluwo ya zwa ikonomi.
","ukuxhasa ukuvuselelwa koqoqosho, amaqabane ebrics aye avuma ukome leza intsebenziswano kumacandelo enza ukuba izinto zenzeke afana namandla ombane, ubugcisa bonxibelelwano, inzululwazi, ubugcisa nemveliso yezinto ezintsha, ulimo noqoqosho enjongo yalo ikukucutha umonzakalo nomgcipheko kokusingqongileyo.
",0.34159178
"hedzi ndi dzone sekhithara dza ndeme dzo bulwaho kha pulane ya mvusuludzo na mbuedzedzo ya ikonomi ye ya ḓivhadzwa ṅwaha wo fhelaho.
","onke la ngamacandelo abalulekileyo achongwe kwisicwangciso sokwakhiwa ngokutsha nokuvuselelwa koqoqosho esibhengezwe kulo nyaka uphelileyo.
",0.5973947
"tshumisano na maṅwe ma shango a brics, nga maa nḓesa kha zwi kwamaho ṱhoḓuluso dza vhutumbuli, i ḓo thusa u ṱavhanyisa mve ledziso ya nḓowetshumo ya shango ḽashu na u ri thusa u swikela zwipikwa zwa thekhinoḽodzhi ntswa kha matshilele ashu.
","intsebenziswano namanye amazwe ebrics, ingakumbi kwicandelo lophando olu velisa izinto ezintsha, iza kuncedisa ukukhawulezisa kokunikwa amandla kwama shishini kweli lizwe ze isi ncede sifezekise iminqweno yethu yefourth industrial revolution .
",0.5699235
"kha fhungo iḽi, nyambe dzano dzo itwa u mona na tsiko ya fhethu ho dzudza nywaho ha mashango a brics ha u kovhelana mashumele a khwiṋe, nḓivho na vhutsila, zwi tshi katela na tshumiso ya fhethu ha thekhinoḽodzhi hu swikeleleaho nga tshitshavha.
","ngoko ke, kwaye kwaba njwa iingxoxo malunga nokudalwa kwamaqonga asesikweni ebrics ukwa belana ngezona ndlela zizizo zokwenza izinto, ulwazi nobungcali, kuquka uku setyenziswa kwamaqonga obugcisa obufumaneka naku bani na.
",0.6479139
"vhashumisani vha masha ngo a brics vho tendelana uri mashango a khou bvelelaho a khou ṱoḓa thuso uri a kone u swikela zwipikwa zwa mve ledziso i bvelelaho ya un, na uri mashango a ṋetshedzo a fanela u ṱhonifha ndingedzo dzao kha iḽi fhungo.
","amaqabane ebrics aye avuma ukuba amazwe asakhulayo adinga uncedo ukuphumeza iinjongo ezizinzileyo zophuhliso zezizwe ezimanyeneyo, kwaye amazwe anikelayo kumelwe ukuba akwenze oko azibophelele kuko.
",0.602631
"hezwi ndi zwa ndeme nga maanḓa kha muhumbulo wa mushu mo wa kilima.
","oku kuba luleke nangakumbi kumxholo wentshukumo yemozulu.
",0.47377974
"u fana na mashango manzhi, afrika tshipembe ḽi khou ṱoḓa u bvela phanḓa kha gondo ḽa mveledziso ya khaboni i katelaho, i bvelelaho nahone ine ya dzhiela nṱha tshiimo tshashu sa shango ḽi khou bvelelaho.
","njengamazwe amaninzi, umzantsi afrika ufuna uku hamba kwindlela evelisa izinga eliphantsi lekha bhoni, ebandakanyayo, ezinzileyo nethabathela ingqalelo indawo yethu njengelizwe elisakhulayo.
",0.61228114
"kha miṅwaha hei ya 11 u bva tshe ra vha muraḓo wa mashango a brics, u vha muraḓo hashu ho ṱuṱuwedza zwihulwane dzangalelo ḽashu ḽa lushaka.
","iqonga lebrics lopha ndo ngamandla ombane oluyintsebenziswano liza kuxabiseka xa sizama ukufumana imithombo eyahlukeneyo yamandla ethu ombane.
",0.62203836
"u vha muraḓo wa mashango a brics zwo khwaṱhisa vhuimo hashu sa ha ikonomi ya ndeme i khou aluwaho.
","kule minyaka eli11 oko sazibandakanya nebrics, ubulungu bethu buziqhubele phambili kakhulu iinjongo zethu zesizwe.
",0.57953095
"zwo ri ṋea tswikelo kha mbekanyamaitele na vhukoni na nḓivho ya ikonomi khu lwane nahone dzine dza vha hone, khathihi na tswikelo kha thikhedzo ya bannga ya mveledziso ya lushaka.
","ukuba lilungu lebrics kuyiphucule indawo yethu njengoqoqosho olukhu layo olubalulekileyo.
",0.5614921
"zwo khwaṱhisa mishumo yashu u mona na shango ḽoṱhe, nga maanḓesa kha tshanduko ya zwiimiswa zwinzhi.
","kwenze ukuba sikwazi ukufumana ubungcali bemi gaqonkqubo neyobugcisa boqoqosho lwamazwe ama khulu nazinzileyo, kunye nokufumana inkxaso yenational development bank .
",0.25304377
"ro vhuelwa kha u vha tshipiḓa tsha ipfi ḽo ṱanganelaho ḽi lwelaho u khwaṱhisa nzu dzanyo ya ḽifhasi yo ḓitikaho nga ṱhonifho ya roṱhe na vhuvhusahoṱhe hu linganaho ha mashango.
","komeleze ubutshantliziyo bethu kwiqonga lehlabathi, ingakumbi xa kufikwa kwi nguqu yamaziko amazwe amaninzi.
",0.17955153
"mashango a brics ndi a ndeme zwihulwane kha shango ḽashu, nahone a ḓo bvela phanḓa na u vha a ndeme lwa tshifhinga tshilapfu tshi ḓaho.","ibrics yinto ebaluleke kakhulu ekukhuleni komzantsi afrika vukuzenzele unnamed kunyaka ongapha mbi konyulo loku qala lwentando ye sininzi, umongameli ne lson mandela wabhala inqa ku kwiphephancwadi leforeign policy malunga nomgaqonkqubo weza ngaphandle omtsha wo mzantsi afrika.
",0.17955153
"u fhelisa zwiito zwa vhuaḓa kha tshumelo dza muvhuso vukuzenzele unnamed nzumbululo ya phalamenndeni ya uri vhashu meli vha muvhuso vho vha vha khou ṱanganedza tshelede dza mundende ṅwedzi nga ṅwedzi dzi sumbedza uri ri kha ḓi vha na mushumo vhukuma wa u khwaṱhisedza mvelele ya mikhwa kha tshumelo ya muvhuso.
","ukuphelisa urhwaphilizo kumaziko karhulumente vukuzenzele unnamed ukuvezwa epala mente kokuba amawaka abase benzi bakarhulumente bafumana izibonelelo ngo kungekho semthethweni inyanga nenyanga, kubo nisa ukuba isende indlela ekusafuneka siyihambile yokumilisela inkcubeko yokuziphatha kakuhle kwabantu abakumaziko karhulumente.
",0.49484736
"mathomoni a ṅwaha, ho dovha ha wanala uri vha shumi vha swikaho 16 000 vha re kha mutevhe wa miholo ya muvhuso vho badelwa mu ndende wa ṱhaḓulo ya zwa matshilisano ya magavhelo a zwa vhushai wa covid19 .
","ekuqaleni kwalo nyaka, kwafunyaniswa ukuba malunga nama16 000 abasebenzi bakarhulumente bahlawulwa ngokunxamnye nomthetho isibonelelo senkxasomali yoncedo lwentlalontle yecovid19 .
",0.68201
"zwi a ḓivhea uri vhahumbeli vhane vha vha na zwiṅwe zwiko zwa mbuelo a vha tei u wana mundende uyu.
","kuyaziwa ngumntu wonke ukuba abafaki zicelo abane minye imithombo yengeniso abasifanelanga le sibonelelo.
",0.47206134
"zwi dovha zwa vha kha khagala uri avho vha wanaho mbuelo u bva kha muvhuso a vho ngo tea ita khumbelo ya mu ndende uyu.
","kukwaziwa ngokucacileyo ukuba abo bafumana umvuzo kurhulumente akufanele kanga bafake izicelo zale sibonelelo.
",0.4822289
"naho zwo ralo vho zwi ita.
","kodwa bazifaka.
",0.34770712
"vhaṅwe vhathu vha 17 000 vho tholwaho muvhusoni wa lushaka na wa vundu vho ḓisa khumbelo kha ndinge dzo dza u engedza miholo yavho nga tshelede yo ite lwaho vhashai.
","abantu abangama17 000 abaqeshwe kurhulumente wesizwe nowephondo bafake izicelo ngeenjongo zokunyusa imivuzo yabo ngemali eyenzelwe abo bangathathi ntweni.
",0.4223448
"musi hu na ṱhoḓea khulwane shangoni, ine vhashumeli vhashu vha muvhuso vha tou i ḓivha zwavhuḓi, zwiito zwivhi izwi nga khole zwa u tswa masheleni a muvhuso a zwi hangwelei.
","ngenxa yentlupheko isizwe ejongene nayo, eya ziwa kakhulu ngabasebenzi bakarhulumente, le njongo yangabom yokuba kwimali karhulumente ayixoleleki.
",0.54437286
"muvhuso zwino u khou khwaṱhisa nungo dza u thivhela u tambiswa uhu ha masheleni na u dzhiela vhukando muṅwe na muṅwe wa vhashumeli vha muvhuso ane a dzhe nelela kha vhukhakhi uhu.
","urhulumente ngoku uqinisa imizamo yakhe yokuthintela olu hlobo loku xhatshazwa kwemali yakhe kwaye athabathe amanya thelo ngakuye nabani na okumaziko karhulumente othe wabandakanyeka kwi senzo sobuqhetseba.
",0.55326295
"muvhuso wo rwela ṱari yuni thi ya vhuḓifari ha ndaulo ya tshitshavha, tshirunzi na thuso ya thekhinikhaḽa ya ndaṱiso.
","kutshanje, urhulumente usungule icandelo lokuzi phatha kakuhle, intembeko kunye noluleko kulawulo lukarhulumente.
",0.6660604
"yunithi i ḓo fhaṱa vhukoni nga ngomu ha zwiimiswa zwa tshitshavha u itela u tshimbidza maitele a ndaṱiso kha milandu ya u shaya vhuḓifari na u vha na tshumisano na zwiimiswa zwa muvhuso kha u ita uri avho vha zwiito izwo vha dzhie vhuḓifhinduleli ha zwiito izwo zwavho.
","eli candelo liza kwakha amandla nga phakathi kwimibutho yoluntu ukuze liqalise iinkqubo zoluleko kwimeko yokunga ziphathi kakuhle kwaye lisebenzisane namanye amaqumrhu karhulumente ekuziseni ngaphambili abo bathe babandakanyeka.
",0.46821928
"yunithi i ḓo pfukisela milandu ya zwiito zwa vhuaḓa kha tshigwada tshi shumanaho na u lwa na zwiito zwa vhuaḓa na u sala murahu mihasho u khwaṱhisedza uri milandu ya vhugevhenga ine ya kwama vhashumeli vha muvhuso i fhedzisela i milandu ine vha dzhielwa vhukando ha ndaṱiso.
","eli candelo liza kuthumela amatyala orhwaphilizo kwiqela likarhulumente lokulwa urhwaphilizo, lize lilandelele amasebe karhulu mente ukuqinisekisa ukuba amatyala olwaphulomthetho abandakanya abasebenzi bakarhulumente aguqulelwa kumatyala oluleko.
",0.58222324
"musi hu na tshumi sano na vha senthara ya ṱhanganelano ya mazhe ndedzi manzhi, yunithi i ḓo thusa u topola vhashumeli vha muvhuso kha milandu ya ndeme ine ya khou ṱoḓisiswa nga vha zwiimiswa zwa vhu kombetshedzi ha mulayo.
","ngentse benziswano neziko ifusion centre leearhente ezininzi, eli candelo liza kunceda ekuchongeni abasebenzi ababandakanyeka kumatyala ahamba phambili aphandwe ngabasemagunyeni bezo mthetho.
",0.5614804
"yunithi i ḓo lavhelesa kuitelwe kwa u ṱolwa ha matshilele a vhashumeli vha muvhuso.
","eli candelo liza kubeka eswe ni indlela yokuphila yabase benzi bakarhulumente.
",0.5163915
"hune mihasho ya topola zwiito zwa vhuaḓa na lupfumo lu sa ṱalutshedzei, milandu i ḓo pfukiselwa kha vha tshumelo ya tshipholisa ya afrika tshipembe.
","apho amasebe karhulumente aza kuchonga urhwaphilizo kunye nobutyebi obunga qondakaliyo, lamatyala aya kudluliselwa kwinkonzo yamapolisa omzantsi afrika.
",0.62648875
"yunithi ntswa yo no ḓi thoma u shuma yo ḓifunga, u thusa u topola vhashu meli vha muvhuso vho ḓidzhenisaho kha milandu ya thengo dza tshomedzo dza covid19 , mundende wo khetheaho wa covid19 na vhufhura kha tshikwama tsha ndindakhombo ya vhushayamushumomilandu ya vhashumi vha muvhuso ine ya iswa kha yunithi ya tsedzuluso yo khetheaho u itela nyito ya ndaṱiso i ḓo lavheleswa nga yunithi u ela mvelaphanḓa yayo.
","eli candelo litsha sele liwuqalisile umsebenzi walo ngokuzimisela, lincedisa ekuchongeni abasebenzi bakarhulumente ababandakanyeka kumatyala anxulumene nokuthengwa kweempahla zecovid19 , nesibonelelo esikhetheki leyo secovid19 kunye nobuqhetseba kwingxo wamali yeinshurensi yokungaphangeli.
",0.64516515
"tshiṅwe tshiteṅwa tsha ndeme ya mushumo wa yunithi hu ḓo vha u thoma vhuḓifari na tshirunzi kha maimo a tshumelo ya muvhuso.
","amatyala amagosa ase burhulumenteni athunye lwe licandelo lophando olukhethekileyo ukuze ku thathwe amanyathelo olu leko ngakuwo, aya kujongwa leli candelo ukuvavanya inkqubelaphambili yawo.
",0.21637183
"vhashumeli vha muvhuso vha si gathi lwa miṅwaha yo vhalaho vho vha na kuvhonele kwa uri u ita vhubindudzi kana u vhuelwa lu songo ḓaho u bva kha muvhuso zwi a tendelwa khavho, khonani dzavho na miṱa yavho, tenda ha vha hu si na u pfuka mulayo.
","elinye icala elibaluleki leyo lelicandelo iya kuba kukumisela imigaqo yoku ziphatha kakuhle kunye nokuthembeka kumaziko karhulumente.
",0.54661727
"ri tea u lwa nga nungo dzoṱhe u shandukisa kuvhonele ukwu.
","abasebenzi bakarhulumente abambalwa kule minyaka idlulileyo, banoluvo lokuba ukwenza ushishino okanye ukuxhamla kurhulumente kuvumele kile kubo, kubahlobo babo nakwiintsapho zabo, ukuba yonke into isemthethweni.
",0.55073404
"musi ri khou shumela u fhe lisa zwiito zwa vhuaḓa, hu tea u vha na u sedza ho linganaho kha mikhwa ya vhuḓifari havho, ngauri kha zwine zwa nga vha zwi sa tou vha zwi siho mulayoni, zwi nga vha zwi si vhuḓifari havhuḓi na u sa ṱanganedzea kha vha shumeli vha muvhuso.
","kufuneka senze konke esi nako ukutshintsha le ndlela yokucinga.
",0.38954538
"yunithi ntswa i ḓo ta maga na milayo kha zwa vhuḓifari na tshirunzi.
","njengokuba sisebenzela ukuphelisa urhwaphilizo, kufanele ukuba kugxilwe ngokulinganayo ekufundi seni ngesimilo esisesikweni, ngoba okusenokuba se mthethweni kusenokuba gwenxa ekuziphatheni ngokusesikweni kwaye aku fanelekanga oko kubasebenzi bakarhulumente.
",0.27146548
"i ḓo dovha ya fhaṱa vhukoni ha mihasho kha u dzhia vhukando ha ndaṱiso kha vhashumi vhane vha wanala vhe na mulandu wa u shaya vhuḓifari.
","eli candelo litsha liza kumi sela imigaqo nemilinganiselo yokuziphatha kakuhle, yokuthembeka kunye neyesi milo.
",0.58824575
"mahoḽa vhashumi vha fhiraho 200 vho pfumbudzwa sa vhaingameli na vhathomi.
","liza kwakha namandla amasebe okohlwaya ama gosa afunyaniswe enetyala lokungaziphathi kakuhle.
",0.57213634
"u fhaṱa muvhuso u re na vhuḓifari u konaho zwi dzula zwi zwa ndeme kha ndaulo iyi.
","bangaphezu kwama200 abasebenzi abaye baqeqeshwa kunyaka ophelileyo njenga magosa ongameleyo kunye nabasunguli.
",0.41337898
"saizwi ho sumbedziswa tshivhalo tsha milandu ine ya kwama vhashumeli vha muvhuso vha vhuelwaho zwi siho mulayoni, maitele a ḓo konḓa nahone a ḓo dzhia tshifhinga.
","ukwakha ilizwe eliziphatha kakuhle, nelinakho kuqhu beka kuzezona zinto olu lawulo igxila kuzo.
",0.45770708
"fhedzi ro ḓiimisela u dzula ro sedzana nazwo.
","njengoko kuvezwe inqwaba yeziganeko ezi bandakanya abasebenzi bakarhulumente abathe baxhamla ngokungekho mthethweni kurhulumente, le nkqubo iyakuba nzima kwaye izothatha ixesha.
",0.5183078
"muvhuso u konaho ndi mutheo wa u swikelela zwipikwa zwoṱhe zwa lushaka.
","nangona kunjalo sizimisele ukulufeza ugqatso.
",0.44220847
"ha sa khwiniswa vhuḓifhinduleli na u ṱuṱuwedza vhuḓifari kwaho, a hu na tshine tsha nga swi kelelwa.
","umbuso onesakhono usi siseko sokufezekisa zonke izinto eziphambili kwilizwe lethu.
",0.19956908
"vhunzhi ha vhashumeli vha muvhuso vho ḓikumedzela, vha ṱhonifha mulayo nahone vha na vhuḓifari.
","ngaphandle kokuphu cula uxanduva lokuphendula kunye nokukhuthaza ukuzi phatha kakuhle, akukho nanye into enokufezekiswa.
",0.52592355
"mushumo we ra livhana nawo ndi tshumisano ya u bvisa avho vha songo ḓiimisela, na u lulamisa ma fhungo a si one a uri vhoṱhe vha shumaho muvhusoni vha khou shumela thumbu dzavho kana vha ita zwa vhuaḓa.
","uninzi lwabasebenzi baka rhulumente bazinikele, bathobela umthetho kwaye banesimilo.
",0.51323783
"ndi ita khuwelelo kha vhanna na vhafumakadzi vhoṱhe vha shumelaho shango ḽashu ḓuvha na ḓuvha uri vha ḓikumedzela hafhu kha mikhwa ya u bve ledzisa vhaṅwe vhathu na tshumelo, na u humbula uri vhuḓifari havho vhu tea u dzula vhu mulayoni na u vha na vhuḓifari kwaho.
","umsebenzi ophambi kwethu kukusebenzisana sisonke ukukhupha abo benza ngwenxa, kwaye kulungiswe impazamo yokuba bonke abo baqeshwe kurhulumente bangohlohle sabo okanye bayarhwaphiliza.
",0.57095385
u thomiwa ha yunithi iyi ndi iṅwe ya nḓila ine nga khayo ra khou shuma u fhelisa zwiito zwa vhuaḓa muvhusoni nahone kha masia oṱhe a vhutshilo ha afrika tshipembe.,"ukuphelisa urhwaphilizo kumaziko karhulumente vukuzenzele unnamed ukuvezwa epala mente kokuba amawaka abase benzi bakarhulumente bafumana izibonelelo ngo kungekho semthethweni inyanga nenyanga, kubo nisa ukuba isende indlela ekusafuneka siyihambile yokumilisela inkcubeko yokuziphatha kakuhle kwabantu abakumaziko karhulumente.
",0.57095385
"maga a ṱhuṱhuwedzo ya vhusikamishumo na tsireledzo ya mishumo zwa muphuresidennde a bveledza tsiko ya mishumo vukuzenzele unnamed u rwelwa ṱari ha zwinozwino ha ḽiga ḽa vhuvhili ḽa maga a ṱhuṱhuwedzo ya vhusikamishumo na tsireledzo ya mishumo zwa muphuresidennde hu imela mvelaphanḓa khu lwane kha u lwela hashu u sika zwikhala zwa mishumo u itela vhadzulapo vha afrika tshipembe vha si na mishumo.
","isivuseleli sikamongameli sengqesho sidala amathuba emisebenzi vukuzenzele unnamed ukusungulwa kwakutsha nje kwesigaba sesibini kwesivuseleli sikamongameli sengqesho kubonisa inkqubela phambili enkulu kakhulu kwilinge lokudala amathuba emisebenzi kubemi bomzantsi afrika abangaphangeliyo.
",0.6001059
"ro thoma maga a thuṱhu wedzo ya vhusikamishumo na tsireledzo ya mishumo zwa ṅwaha wo fhelaho nga u sika zwikhala zwinzhi zwinzhi nga tshifhinga tshipfufhisa.
","kulo nyaka uphelileyo siye saqulunqa uvuselelo ngqesho ukuze sikwazi ukudala amathuba emisebenzi amaninzi, kangango ko sikwazi kwixesha elifutshane.
",0.4268946
"hezwi zwo ṱoḓa nḓila ntswa dzi bvele dzaho dza u shuma u itela u thoma u shumisa mbekanya mushumo nga luvhilo lu songo ḓoweleaho na tshikalo tshi mangadzaho.
","oku kufune iindlela ezintsha nezino buchule zokusebenza ukuze kuphunyezwe le nkqubo ngesantya kunye nangomlinganiselo ongazange wabonwa.
",0.50601137
"maitele a u thola vhathu vhanzhi vhe vha vha vha sa shumi o shumisa pulatifomo dza dzidzhithala u swikelela vhadzheneli vho lugelaho vhanzhi.
","kwinkqubo yokufuna nokufumana abantu abaninzi abangasebenziyo, siye sasebenzisa amaqonga edijithali ukuze sikwazi ukufikelela kubathathi nxaxheba abaninzi naba fanelekileyo.
",0.56883514
"sa tsumbo, vhora bulasi vhaṱuku vho kona u ita khumbelo ya thikhedzo nga kha ussd na u wana voutshara dza u wana tshu melo dza zwa vhulimi kha ṱhingothendeleki dzavho.
","umzekelo, amafama asakhasayo akwazile ukufaka izicelo zenkxaso ngeussd kwaye bakwazi ukufumana iivawutsha kwiiselfowuni zabo.
",0.6938281
"u bva tshe muhasho wa pfunzo dza u mutheo wa vulela khumbelo dza mute vhe u tevhelaho wa vhathusi zwikoloni zwenezwino, vhaswa vha fhiraho 940 000 vho ita khumbelo nga kha pulatifomo dza u thola dzi sa badelwi dzi no pfi sayouth.
","okoko isebe lemfundo esi siseko livule ithuba lezicelo zeqela elilandelayo labancedisi bezikolo kutshanje, bangaphezulu kwama940 000 abantu abatsha abafake izicelo besebenzisa iqonga lokukhangela imisebenzi elingahlawulisiyo elibizwa ngokuba yisayouth.
",0.60370463
"mobi, zwine zwa vha tshipiḓa tsha netiweke dza tikedza vhaswa u wana gondo ḽa u dzhena kha zwa ikonomi.
","mobi, eliyinxalenye yepathway management network yesizwe.
",0.56859255
"tshumiso ya thekhinoḽodzhi ntswa kha u ṋea zwikhala zwa mishumo yo ita uri u thola zwi leluwe, zwi ṱavhanye na u vha khagala.
","ukusetyenziswa kwetheknoloji yale mihla ekuvezeni amathuba engqesho kwenze ukufuna nokufumana kwabantu kwabalula kakhulu, kwakhawuleza kwaye kwa caca ngakumbi.
",0.57123786
"maga a ṱhuṱhuwedzo ya vhusikamishu mo na tsireledzo ya mi shumo zwa muphuresi dennde o konisa na u le ludza tshumisano kha sekhithara ya muvhuso.
","isivuseleli sikamonga meli sengqesho senze kwaye saququzelela intse benziswano kumacandelo karhulumente.
",0.62025607
"mbekanyamushumo dza kha ḽiga ḽa u thoma dzo shumiswa nga mihasho ya lushaka ya 11. mishumo yayo yo konanywa u thi vhela ndovhololo na tshi nyalelo na u khwaṱhisedza u guda kha tshenzhemo dza vhaṅwe.
","iinkqubo kwisigaba sokuqala ziphunyezwe ngamasebe esizwe ali11.
",0.54806936
"maga a ṱhuṱhuwedzo ya vhusikamishumo na tsireledzo ya mishumo o sumbedza ndeme ya tshumisano ya matshilisano.
","la masebe alungelelanisa imisebenzi yabo ukuthintela ukuyiphindaphinda kunye nemosharha kwaye aze aphucula ukufunda kumava abanye.
",0.627483
"muvhuso, mabindu, vhashumi na tshitshavha tsha vhadzulapo vho ṱangana u itela u dzhenisa avho vha sa shumi kha ikonomi.
","uvuselelo lwengqesho lukwabonise ukubaluleka kwentsebenziswano noluntu.
",0.5019402
"vhadzulapo vha afrika tshipembe vha fhiraho hafu ya miḽioni vho no vhuelwa kha ḽiga ḽa u thoma, hu tshi kha ḓi vha na mbekanyamushumo dzo vhalaho dzine dza kha ḓi ḓa.
","urhulumente, amashishini, abasebenzi kunye nemibutho yoluntu aye adibana ukuze bafake abo bangaphangeliyo kwezoqoqosho.
",0.56104887
"vhadzheneli vho ṋewa tshikhala tsha u ḓitshelela, u guda zwikili zwiswa na u khwiṋisa zwine vha vha nazwo, na u shumisa tshenzhemo yavho sa muratho wa u wana muṅwe mushumo kana u ḓisikela mushumo.
","bangaphezu kwesiqingatha sesigidi abemi bomza ntsi afrika abasele bexhamlile kwisigaba sokuqala sale nkqubo, kusekho neenkqubo ezininzi ezisa qhubayo.
",0.56361276
"sa tsumbo, vhunzhi ha vhadzheneli vho tholwa ho nga muhasho wa mishumo ya tshitshavha na themamveledziso kha mbe kanyamushumo dzawo dza ḽiga ḽa u thoma vho kona u wana mushumo kha sekhithara dza phuraivethe mafheloni a ṱhafamuhwe 2021. vhunzhi ha avho ndi vha mutevhe wa u thoma wa vhathusi tshikoloni, nga u ralo, vho wana nḓila ya u dzhena mishumoni, vha wana tshenzhemo, vhugu disi na ndaedzi.
","abathathinxaxheba banikwe amathuba amaninzi afana nawokufumana imali yokuziphilisa, awokufunda izakhono ezitsha nawokuphucula ezo zakhono sele zikho kwaye basebenzisa amava abo njengesiseko sokufu mana eminye imisebenzi okanye awokuzisebenzela.
",0.6146586
"mbekanyamushumo dzo thomiwaho nga kha maga a ṱhuṱhuwedzo ya vhusikamishumo na tsireledzo ya mishumo zwa muphureside nnde dzo dovha dza vhuendza vha nga u angaredza.
","umzekelo, abanye abatha thinxaxheba abaqeshwe kwiinkqubo zesigaba sokuqala zesebe lemisebenzi karhulumente neziseko zophuhliso bakwazile ukufumana ingqesho kumacandelo abucala ekupheleni kweyokwindla ka2021.
",0.59045833
"ho vha ho se dzeswa kha tsiko ya mishumo kha sekithara dzine dza kwama tshitshavha u fana na ya pfunzo, tsire ledzo ya zwiḽiwa, ndondolo na themamveledziso ya tshitshavha na tsireledzo ya mupo.
","uninzi lwabo babekwiqela lokuqala labancedisi ezikolweni, ngokufanayo, baye bafumana indlela yokufu mana imisebenzi, bexhobe ngamava, ngeqeqesho kunye nabantu abanochaza uhlobo abasebenza ngalo.
",0.6407515
"nga maga a ṱhuṱhuwedzo ya vhusikamishumo na tsireledzo ya muphuresi dennde aya vhaswa vho tholwa u tikedza na u thusa vhadededzi zwikoloni zwashu.
","iinkqubo eziphunyezwe sisivuseleli sikamongameli sengqesho ziye zanceda uluntu ngokubanzi.
",0.55779064
"vhaṅwe vho tholwa u fhaṱa maburoho kha zwitshavha zwa mahayani.
","ezi nkqubo zigxile ekudaleni amathuba emisebenzi kuma candelo anefuthe elithe ngqo kwezentlalo afana nezemfundo, nokufumaneka kokutya, nokugcinwa kweziseko ezingundoqo zoluntu kunye nokukhuselwa koku singqongileyo.
",0.5079313
"senthara nnzhi dza mveledziso ya nyaluwo ya vhana ya vhuhanani (ecd)dzo thuswa u bvela phanḓa na u shuma na u vula hafhu.
","ngale nkqubo yesivuseleli sikamongameli sengqesho kwaqeshwa ulutsha ukuwu xhasa nokuncedisa ootitshala ezikolweni zethu.
",0.551847
"vhorabulasi vhaṱuku vho tikedzwa u ṱanḓavhudza mveledzo na ndaka ya mupo u fana na milambo na maro roma zwo vusuludzwa na u londotwa.
","kwaze kwaqeshwa nabanye ukwakha iibhulorho kwiindawo ezisemaphandleni.
",0.5713099
"sa tshipiḓa tsha ḽiga ḽa vhuvhili, ri khou thoma tshikwama tsha thikhedzo ya mishumo ya tshitsha vha tshine tsha ḓo tikedza mishumo mivhuya ine ya rangelwa phanḓa nga madzangano a tshitshavha kha masia a fanaho na vhulimi ha dziḓoroboni, vhutsila ha tshitshavha, khwiṋiso ya vhudzulo ha mishashani na tsireledzo ya tshitshavha.
","amaziko amaninzi ophuhliso lwabantwana abaselula axhaswa ukuze akwazi ukuphinda avule kwakhona.
",0.5082455
"vhukatini ha vhuleme vhuhulu ha ikonomi ho vhangwaho nga dwadze ḽa tshitzhili tsha corona, mishumo ya tshitshavha yo ṋekedza thikhedzo ya vhuṱhogwa kha tsiko ya mishumo.
","ngelixa amafama asakhasayo wona axhaswa ukuze akwazi ukwandisa iimveliso kwakhona, izinto ezifana nemilambo nemigxo bhozo iye yabuyiselwa esimeni esisebenzayo yaze yagcinwa ikhuselekile.
",0.58356047
"hezwi ndi u thoma u shuma ha vhuḓikumedzeli hashu ha uri muvhuso u tea u tikedza wo khwaṱha u sikwa ha mishumo musi maraga wa zwa mishumo u khou vusuludzea.
","njengenxalenye yesigaba sesibini, siseka ingxowamali yengqesho yoluntu eza kuxhasa imisebenzi ekhokelwa yimibutho yase kuhlaleni kwimimandla eyohlukeneyo kwezolimo zasezidolophini, kwezobugcisa, kwezokuphu culwa kwamatyotyombe kunye nakwezokhuseleko loluntu.
",0.2512521
"nga kha maga a ṱhuṱhu wedzo ya vhusika mishumo ya tsireledzo ya mishumo zwa muphuresidennde ro dzhenisa vhaswa kha mutevhe wa vhashumi nga vhunzhi vhukuma nga nḓila i songo lavhelelwaho kha tshifhinga tshipfufhisa.
","kudodobalo okukhoyo okukhulu kwezoqoqosho okubangelwa ngubhubhane wentsholongwane icorona, ingqesho yoluntu nentla lontle ibonelele ngovuselelo olubalulekileyo ekudaleni amathuba emisebenzi.
",0.60826766
"vhaṅwe vha vhadzhe neli vha 84% kha ḽiga ḽa u thoma vho vha vhe vhaswa vha vhukale ha fhasi ha miṅwaha ya 35, nahone vha mbili tshararu vho vha vhe vhafumakadzi.
","oku ibe kukuphunyezwa kwe sibophelelo sethu sokuba urhulumente kufuneka axhase ezengqesho ngelixa icandelo lezemisebenzi lisazama ukubuyela kunda lashe.
",0.460495
"kha ḽiga ḽa vhuvhili ri lavhelela tshivhalo itshi uri tshi gonye, thikhedzo ya mishumo i ḓo ṋekedza r1 biḽioni ya ndambedzo u itela lambedza thusedzo ya u tholwa ha vhaswa u bva kha ofisi ya muphuresidennde.
","ngokusebenzisa isi vuseleli sikamongameli sengqesho sizise amawa kawaka abantu abatsha emsebenzini ngendlela engazange yabonwa ngaphambili kwixeshana nje elifutshane.
",0.5955242
"sa tshipiḓa tsha thusedzo, hu ḓo tholwa vhaswa vho vhalaho kha tshumelo ya vhaswa ya lushaka yo vusuludzwaho.
","malunga nama84% abathathi nxaxheba kwisigaba sokuqala sale nkqubo yayingabantu abatsha abangaphantsi kweminyaka engama35, kwaye isibini kwisithathu sabo yayinga bantu basetyhini.
",0.5015001
