src_text,tgt_text,cosine_score
"tsha vhuṱhogwa vhukuma, ri fanela u vha kule na muṅwe muthu – lwa vhukule ha mithara dzi swikaho mbili – u bva kha vhaṅwe vhathu.
","kufuneka siqhubeke nokucoca size sifake nesibulalizintsholongwane kuyo yonke imiphezulu/imiphandle kuzo zonke iindawo zikawonkewonke.
",0.5149089
"zwazwino hu na vhuṱanzi ho bvelelaho ha uri tshitzhili tshi nga hwalwa nga zwipiḓa zwiṱukuṱuku muyani fhethu ho ḓalesaho vhathu, ho valeaho kana hune hu sa tou vha na u mona ha muya zwavhuḓi.
","okona kubaluleke nangakumbi, kufuneka sigcine umgama wokuqelelana okhuselekileyo – ozimitha ezi2 ubuncinane – ukusuka kwabanye abantu.
",0.53104913
"nga nṱhani ha hezwi, ri fanela u khwinisa nga u ṱavhanya vhupo ha nga ngomu ha fhethu ha nnyi na nnyi hune khonadzeo ya khombo ya u kavhiwa ya vha khulwanesa.
","ngoku kukho ubungqina obuvelayo bokuba le ntsholongwane isenokuhamba njengamasuntswana amancinci emoyeni kwiindawo ezinabantu abaninzi, ezivaliweyo okanye ezingangeni kakuhle umoya.
",0.60567015
"tsheo yashu ya u ḓivhadza nyiledza u bva mahayani ya lushaka nga vhuphara yo thivhela u gonya huhulu ha vhulwadze nga u ṱavhanya musi tshumelo dza mutakalo dzashu dzo vha dzi sa athu lugiselwa zwavhuḓi, zwe zwa vha zwi tshi ḓo vhanga ndozwo khulwanesa ya matshilo a vhathu.
","ngenxa yeso sizathu kufuneka ngoko nangoko siphucule imo yangaphakathi kwiindawo zikawonkewonke apho umngcipheko wobungozi bosuleleko umkhulu kakhulu khona.
",0.49871284
"kha tshifhinga tshe ra vha ri natsho, ro dzhia maga a vhuṱhogwa u khwaṱhisa phindulo ya mutakalo washu.
","isigqibo sethu sokubhengeza ukuvaleleka phantsi kwemiqathango ethile kwizwelonke sathintela ukunyuka ngamandla kosuleleko ngobuninzi ngexesha apho iinkonzo zethu zezempilo zazingekasilungeli esi simo, nento eyayinokukhokelela kweyona lahleko inkulu yokuphulukana nobomi.
",0.5630059
"ro ita dzindingo dza tshitzhili tsha corona dzi fhiraho miḽioni mbili nahone vhashumeli vha mutakalo vha tshitshavha vho ṱola vhathu vha fhiraho 20 miḽioni.
","kwixesha ebesinalo, sithathe amanyathelo abalulekileyo okomeleza indlela yethu yezempilo yokusabela.
",0.22089009
"ro kona u ri hu vhe na mimbete ya sibadela i ṱoḓaho u swika 28,000 ya vhalwadze vha covid19 na u fhaṱa zwibadela zwa tshifhinga nyana zwi shumaho u mona na shango.
","senze uvavanyo lwentsholongwane icorona olungaphezulu kwezigidi ezimbini kanti ke oonompilo benze uhlolo olungaphezulu kwezigidi ezingama20.
",0.6015067
"zwazwino ri na mimbete ya khwarathini ya 37,000 kha zwiimiswa zwa muvhuso na zwa phuraivethe u mona na shango, zwo lugela u ṱanganedza avho vha sa koni u ḓikhethela thungo mahayani avho.
","sineebhedi ezingama28,000 esibhedlele ezilungele ukusetyenziswa zizigulane zecovid19 saze sakha izibhedlele zethutyana ezisebenzayo kwizwelonke.
",0.629497
"ro renga na u ḓisa tshomedzo dza u ḓitsireledza dza miḽioni zwibadela, dzikiḽiniki na zwikoloni u mona na shango u tsireledza vhashumi vha ṋetshedzaho tshumelo dza vhuṱhogwa.
","ngoku sineebhedi zokuvaleleka bucala ezingama37,000 kumaziko abucala namaziko karhulumente kwiizwelonke, ezilungele ukwenza amakheswa abo bangakwaziyo ukwenza njalo emakhayeni wabo.
",0.30634904
"ro thola nahone ri khou bvela phanḓa na u thola vhaongi vha u engedzedza, madokotela na vhashumi vha zwa mutakalo kha tshiimo tsha shishi.
","sithenge saza sathumela izigidi zezixhobo zokuzikhusela emsebenzini kwizibhedlele, kwiiklinikhi kunye nasezikolweni kwizwelonke ukukhusela abasebenzi bethu abangabona baphambili edabini.
",0.46728104
"ri ya phanḓa na u ita mvelaphanḓa kha ndingedzo dzashu dza u lwa na covid 19, fhedzi khaedu yashu khulwanesa i kha ḓi ḓa.
","siye saqasha kwaye siyaqhubeka nokufuna abongikazi, oogqirha nabasebenzi bakaxakeka bezempilo abongezelelweyo.
",0.53815943
"u mona na mavundu oṱhe, ri khou shuma u engedza tshivhalo tsha mimbete wadini dza vha lwalesaho na kha wadi zwadzo uri i vhe hone u itela vhalwadze vha covid19.
","siyaqhubeka nokwenza inkqubela kumalinge wethu okuqubisana necovid19, kodwa owona mcelimngeni mkhulu usengaphambili.
",0.57153594
"tshikhala wadini tshi khou vulea kha zwibadela zwo vhalaho nga u lengisa ndondolo ya dzilafho ine a si ya shishi, u shandukiswa ha huṅwe fhethu zwibadela ha itwa wadi dza u engedzedza na u fhaṱwa kana u engedzedzwa ha zwibadela zwa tshifhinga nyana.
","kuwo onke amaphondo, sime ngomumo ukwandisa ngakumbi inani leewadi zesiqhelo ezibhedlele kunye neebhedi zabagula kakhulu zezigulane zecovid19.
",0.59356904
"ri khou shuma u engedza nḓisedzo ya okisidzheni, dziventhiḽeitha na dziṅwe tshomedzo u itela avho vha ṱoḓaho ndondolo ya vhuṱhogwa, hu tshi katela na u nga pambusa ṋetshedzo ya okisidzheni dze dza vha dzi tshi khou ya u shumiselwa zwiṅwe.
","umthamo weewadi zesiqhelo ezibhedlele uphunguliwe kwizibhedlele ezininzi ngokuthi kulityaziswe kwabo badinga inkathalelo engangxamisekanga, ukuguqulwa kweendawo ezithile zesibhedlele ukuba zibe ngamacandelo ongezelelweyo wabagulayo nokwakhiwa okanye ukwandiswa kwezibhedlele zethutyana.
",0.6392373
"ri khou shumisa thekhinoḽodzhi dza didzhithaḽa u khwaṱhisa u topola, u sala murahu vho kwamanaho na muthu o kavhiwa na u vha vhea fhethu ha thungo, na u tikedza avho vho wanwaho uri vha na tshitzhili tsha corona.
","sisebenzela ukwandisa ubonelelo lomongomoya, izixhobo zokuphefumlisa kunye nezinye izixhobo zabo badinga inkathalelo yabagula kakhulu, kuquka nokutshintsha ubonelelo lomongomoya ebelusetyenziselwa ezinye iinjongo.
",0.6146198
"sa izwi zwino ri tshi khou sendela tsini na maṱhakheni a vhulwadze, ri tea u khwaṱhisedza uri ri tevhedza tsiradwadze na u khwaṱhisa maga ane a vha hone a u ongolosa reithi ya phiriselo.
","sifaka ubuchwepheshe bedijithali ukuqinisa indlela ekubonwa ngayo, ukulanda umkhondo nokwenziwa amakhweswa kwabo bebedibene nomntu osulelekileyo, kunye nokubonelela ngenkxaso kwabo uvavanyo lubafumanise bosulelekile.
",0.6484529
"milayo ya u ambarwa ha mimasiki i ḓo khwaṱhiswa.
","njengokuba sisondela kwinkcochoyi yosuleleko, sidinga ukulumka ngakumbi size siqinise la manyathelo sele ekho ukuthomalalisa izinga lokusasazeka.
",0.31138125
"vhatholi, vhaṋe vha mavhengele na vhalanguli, vhareili vha zwiendedzi zwa nnyi na nnyi, na vhalanguli na vhaṋe vha zwifhaṱo zwiṅwe zwa nnyi na nnyi zwazwino vha kombetshedzwa nga mulayo u khwaṱhisedza uri muthu muṅwe na muṅwe a dzhenaho kha zwifhaṱo zwavho kana moḓoro u fanela u vha vho ambara masiki.
","imigaqo engokunxitywa kwezigqubuthelobuso iza kuqiniswa.
",0.40296343
"thekhisi dzi tshimbilaho nyendo pfufhi dzapo zwazwino dzi ḓo tendelwa u engedza tshivhalo u ya kha phesenthe ya 100 ya vhanameli, ngeno thekhisi dza nyendo ndapfu dzi sa ḓo tendelwa u ṋamedza tshivhalo tshi fhiraho phesenthe dza 70 dza vhanameli, zwi tshi bva nga uri phurotokhoḽo ntswa dza u fhungudza khonadzeo dza khombo dzi elanaho na u ambarwa ha masiki, u sanithaiza moḓoro na u vula mafasiṱere dzi khou tevhedzwa.
","abaqashi, abanini zivenkile kunye nabalawuli, abaqhubi bezithuthi zikawonkewonke, kunye nabalawuli kunye nabanini baso nasiphi na isakhiwo sikawonkewonke bayanyanzelwa ngumthetho ukuba baqinisekise nabani na ongena kwizakhiwo zabo okanye izithuthi kufuneka esinxibile isigqubuthelobuso.
",0.5595238
"zwazwino hu na vhuṱanzi vhu re khagala ha uri u vulwa ha thengiso ya mahalwa zwo vhanga mutsiko u vhonalaho kha zwibadela, hu tshi katelwa yunithi dza zwi tatisaho na icu, nga vhanga ḽa khombo dza mimoḓoro , zwi tatisaho zwi elanaho na dzikhakhathi.
","iiteksi ezihamba imigama emifutshane ngoku ziza kuvunyelwa ukuba ziwandise umthamo wazo wokukhwelisa i100 leepesenti, ngelixa ezihamba imigama emide zingavumelekanga ukuba ziwandise umthamo wama70 eepesenti, phantsi komqathango wokulandelwa kwemimiselo yokuthomalalisa umngcipheko omalunga nokunxitywa kwezigqubuthelobuso, ukucocwa kwezithuthi ngesibulalizintsholongwane kunye nokuvulwa kweefestile.
",0.5470933
"nga u ralo, ro dzhia tsheo ya uri u itela u vhulunga tshivhalo tsha mimbete sibadela, thengiso, u hwala na u iswa ha mahalwa zwi khou imiswa u bva zwino.
","ngoku kukho ubungqina obucacileyo bokuba ukuqaliswa kokuthengiswa kotywala kukhokelele ekubekweni kwezibhedlele zethu phantsi koxinzelelo olumandla, kuquka namacandelo abonzakeleyo kunye namacandelo abagula kakhulu (iicu), ngenxa yeengozi zeemoto, ubundlobongela kunye nokwenzakala okunxulumene nabo.
",0.6169975
"sa maga a u engedzedza u itela u fhungudza mutsiko zwibadela, hu ḓo vhewa nyiledzo ya tshifhinga tsha u tshimbila vhukati ha awara ya 9 nga madekwana na awara ya 4 nga matsheloni.
","ngoko ke sithathe isigqibo sokuba khona ukuze sikwazi ukugcina umthamo wezibhedlele uphantsi, ukuthengiswa, ukusasazwa kunye nokuhanjiswa kotywala kuza kurhoxiswa ngoko nangoko.
",0.61036503
"ri khou dzhia maga aya ri tshi tou zwi ḓivha zwavhuḓi uri a kombetshedza nyiledzo dzi sa takalelwi kha matshilo a vhathu.
","njengenyathelo elongezelelweyo lokunciphisa uxinzelelo ezibhedlele, kuza kumiselwa ixesha lokuvaleleka ngendlu phakathi kwentsimbi ye9 ngokuhlwa nentsimbi yesi4 ekuseni.
",0.559865
"honeha, o tea u ri thusa uri ri kone u bva maṱhakheni a vhulwadze.
","siwathatha la manyathelo sikuqonda kakuhle ukuba abeka ubomi babantu phantsi kwezithintelo ezingamkelekiyo.
",0.5475464
"a hu na nḓila ine ri nga tinya ḓumbu ḽa tshitzhili tsha corona.
","noxa kunjalo, ayafuneka, ayimfuneko ukusinceda siphumele kweli xesha le nkcochoyi yesi sifo.
",0.3958938
"fhedzi ri nga fhungudza tshinyalelo ine tshi nga i bveledza kha matshilo ashu.
","ayikho indlela esinokuthi siluphephe olu qhwithelo lwentsholongwane icorona.
",0.5281067
"sa lushaka, ro ṱangana u tikedzana, u khuthadza avho vhane vha khou lwala khathihi na u ṱuṱuwedza u ṱanganedzwa ha vhathu vhane vha vha na tshitzhili.
","kodwa singawuthothisa umonakalo le ntsholongwane enokuwenza kubomi bethu.
",0.43888187
"zwazwino, u fhira na mathomoni, ri na vhuḓifhinduleli ha matshilo a vhathu vha re vhukati hashu.
","njengesizwe sihlangene sonke ukuba sixhasane, sinike intuthuzelo kwabo bagulayo kunye nokukhuthaza ukwamkeleka kwabo baphila nale ntsholongwane.
",0.24941482
"ri ḓo bva kha ḓumbu iḽi ro tsireledzea.
","ngoku, ngaphezulu kunangaphambili, sinoxanduva lobomi babo basingqongileyo.
",0.37037718
"ri ḓo vusuludza shango ḽashu ḽa vha na mutakalo na lupfumo.
","siza kumelana nolu qhwithela.
",0.482103
ri ḓo kunda.,"nceda unqande ukunwenwa kwecovid19 vukuzenzele unnamed isizwe sakuthi sijamelene neyona ntlekele inzima kakhulu kwimbali yedemokhrasi yethu.
",0.482103
"u pembelela vhafumakadzi nga u vha dzhenisa kha zwa ikonomivha dzhenisa kha zwa ikonomi vukuzenzele unnamed nga ṱhangule afrika tshipembe ḽi pembelela ṅwedzi wa vhafumakadzi.
","ukubhiyozela abantu basetyhini ukubhiyozela abantu basetyhini ngokubabandakanya kuqoqoshongokubabandakanya kuqoqosho vukuzenzele unnamed ngenyanga yethupha umzantsi afrika ubhiyozela inyanga yabantu basetyhini.
",0.6104931
"mushumo uyu u sumba tshiga tsha anivesari ya ḓuvha ḽe nga 1956 vhafumakadzi vha 20,000 vha gwalaba vha ya union buildings – gogo ḽa vha tshifumakadzini vha ambaho nyambo dzo fhambanaho, vha bvaho fhethu ho fhambanaho na vha mirafho yoṱhe.
","eli thuba liphawula isikhumbuzo samhla abasetyhini abangama20 000 ngowe1956 bathi benza umngcelele woqhankqalazo ukuya kwizakhiwo zomdibaniso – inyambalala yamakhosikazi athetha iilwimi ngeelwimi, ephuma kwiinkalo nakwiintlanga zonke.
",0.6590266
"vho vhumbana kha migwalabo yavho ya u lwela uri hu fheliswe milayo i thivhelaho mbofholowo ya u tshimbila kha vharema na pfanelo dzavho dza u tshila vho vhofholowa.
","emanyene kwisinyanzeliso sawo sokupheliswa kwemithetho emibi yamapasi kunye nelungelo lawo lokuhlala enkululekweni.
",0.29962033
"maimo na vhuimo ha vhafuma kadzi afrika tshipembe ṋamusi zwo fhambana vhukuma na zwe zwa ṱangana na vhomme na vhomakhulu washu nga 1956. ri bva kule u swikela afrika tshipembe ḽi si na khethano nga lukanda, mbeu, ḽa dimokirasi, ḽi bvelelaho nahone ḽo vhofholowaho.
","isimo nendawo abantu basetyhini ababekwa kuyo emzantsi afrika namhlanje yohluke kakhulu kunaleyo oomama noomakhulu bethu babejongene nayo ngowe1956.
",0.6420177
"ho vha na mvelaphanḓa yavhuḓi kha u khwinisa matshilo a vhafumakadzi vha afrika tshipembe kha sia ḽa ikonomi, poḽotiki na kha matshilo a vhathu.
","sihambe indlela ende ekuphumezeni umzantsi afrika ongenacalucalulo ngokobuhlanga, ngokwesini, olawulwa ngokwentando yesininzi, ohlumayo nokhululekileyo.
",0.66707414
"kha tshifhinga tshenetshi tshithihi, ri a zwi ḓivha zwauri hu na zwinzhi hafhu zwine ra khou tea u zwi ita.
","kubekho inkqubela yokwenene ekuphuculeni ubomi babantu basetyhini basemzantsi afrika kwezoqoqosho, kwizinga lezepolitiki nakubomi bukawonkewonke.
",0.552259
"vhafumakadzi vha kha ḓi ṱangana na zwa khethululo, u vhaiswa na dzikhakhathi, vha hwala mutsiko muhulu wa vhushai.
","kwangaxesha nye, siyaqonda ukuba isende indlela ekusafanele siyihambile.
",0.3648913
"arali ri tshi khou ṱoḓa u wedza nga ngoho pfulufhedziso dza ndayotewa yashu ri tea u lingedza nga maanḓa u sedzana na zwa u sa dzheniswa kha zwa masheleni na kha zwa ikonomi zwine zwa ita uri vhafumakadzi vha ḓiwane vha songo tsireledzea kha dzikhakhathi na u tambudzwa.
","abantu basetyhini basajongene nokucalulwa, impathombi nobundlobongela, kwaye basajongene nobunzima obukhulu bendlala.
",0.60859025
"ro dzhena kha fulo ḽihulwane ḽa vhutumbuli ḽine ḽa ri ṱumanya na ndingedzo dza ḽifhasi dza u swikela ndinganyiso ya mbeu nga 2030. ndinganyiso ya murafho ndi mafhungo a sumbaho tshanduko na ṱhuṱhuwedzo u itela u fhelisa khethululo na dzikhakhathi zwi itelwaho vhafumakadzi na u itela u shela mulenzhe nga nḓila i linganaho kha zwa poḽotiki, matshilisano na zwa ikonomi.
","ukuba ngaba sizimisele ekuphumezeni isithembiso somgaqosiseko, kufanele siloyisile uqoqosho nokukhetheka kwezezimali okwenza ukuba abantu basetyhini babe zizisulu zokuphathwa kakubi nobundlo bongela ngakumbi.
",0.5703602
"sa tshipiḓa tsha fulo iḽi, ro dzhenela kha ‘ṱhanganelano dza ndivho nthihi’ mbili, iṅwe ndi ya pfanelo na vhulamukanyi ha zwa ikonomi ngeno iṅwe i tshi lwisana na khakhathi dzo ḓisendekaho nga mbeu.
","sizibandakanye nephulo eliqalayo ukubakho elisiqhagamshelanisa namalinge ehlabathi jikelele okuphumeza umakulingwane ngowesini ngowama2030.
",0.59067416
"vhuvhili ha thero idzi ndi dza ndeme kha mafhungo a lushaka lwashu riṋe vhaṋe.
","umakulingwane kwisizukuluwana yiajenda yebhongo neyenguqu yokuphelisa ucalucalulo nobundlobongela obugxile kwabasetyhini nokuthatha kwabo inxaxheba ngokulinganayo kubomi bezepolitiki, ezentlalo nobezoqoqosho.
",0.5915203
"kha miṅwedzi ya fumithihi u bva tshe pulane ya nyito i sedzaho zwa shishi ya u fhelisa khakhathi dzo ḓisendekaho nga mbeu na u vhulawa ha vhathu vha tshifumakadzi ya thoma u shuma ro vha na mvelaphanḓa ya u engedza thikhedzo na ndondolo kha vhaponyi, nahone mvelaphanḓa i khou itwa kha mbuyedzedzo ya zwa mulayo u itela uri vha wane tsireledzo khulwane.
","njengenxalenye yeli phulo, sizibandakanye ‘neendibanisela zokusebenza’ ezimbini, enye yeyobulungisa kwezoqoqosho namalungelo kunye nenye yokulwa ubundlobongela obugxile kwezesini.
",0.56378293
"kha ṅwedzi wa ṱhangule, ri thoma u shumisa pulane ya tshiṱirathedzhi ya lushaka u fhelisa khakhathi dzo ḓisendekaho nga mbeu na zwa u vhulawa ha vhathu vha tshifumakadzini.
","yomibini le mixholo ibaluleke kakhulu kuqobo lweajenda yethu yesizwe.
",0.44003272
"tshipiḓa tshihulwane tsha pulane iyi ndi u vhona uri hu vhe na u dzheniswa nga vhunzhi ha vhafumakadzi kha zwa masheleni.
","sele izinyanga ezilishumi elinanye ukususela kwafezekiswa isicwangciso sokusebenza ukusabela kwimeko kaxakeka sokulwa ubundlobongela obugxile kwezesini nokubulawa kwabasetyhini ngamadoda senze inkqubela ekunabiseni inkxaso nenkathalelo kwabasindileyo, kwaye inkqubela iyenzeka kuhlaziyo lwezomthetho ukubanika ukhuseleko olukhulu.
",0.58737826
"izwi zwi khou itwa ngauri hu na vhuṱumani ha tshayandinganyiso kha zwa ikonomi na kha zwa matshilisano.
","ngenyanga yethupha, siyaqala ukufezekisa isicwangciso sobuchule sesizwe ukulwa ubundlobongela obugxile kwezesini nokubulawa kwabasetyhini ngamadoda.
",0.5717528
"tshiimo tsha ikonomi tsha vhafumakadzi afrika tshipembe tshi itisa uri vha vhe vha songo tsireledzea kha u tambudzwa.
","umba ongundoqo wesi sicwangciso usekuqinisekiseni ngokubandakanyeka kakhulu kwabantu basetyhini kwezezimali.
",0.51174164
"zwo ralo ri tea u khwaṱhisa thikhedzo kha vhafumakadzi u itela uri vha kone u ima nga vhone vhaṋe kha zwa masheleni.
","oku kungenxa yokuba ukungalingani kwezoqoqosho nokungalingani kwezentlalo kuyathungelana.
",0.52000964
"ro ita tshivhalo tsha vhuḓikumedzeli kha zwa ndinganyiso ya murafho zwine zwa ḓo sedzwa khazwo nga kha pulane ya tshiṱirathedzhi ya lushaka.
","isimo sezoqoqosho sabantu basetyhini emzantsi afrika sibenza babe zizisulu zokuphathwa kakubi ngakumbi.
",0.56017554
"tsha u thoma, ri khou ya u tshimbidza zwa u dzhenisa vhafumakadzi kha zwa ikonomi nga kha zwirengwa nga muvhuso.
","ngoko ke kufuneka siyinyusile inkxaso yabasetyhini ukubenza bakwazi ukuzimela ngokwezezimali.
",0.5727116
"ro vhea tshipikwa tsha u vhona uri phesenthe dza henefha kha 40 dza tshumelo na thundu dzi rengwaho nga zwiimiswa zwa muvhuso zwi waniwe kha mabindu a langwaho nga vhafumakadzi.
","senze iqela lezibophelelo phantsi kukamakulingwane kwisizukuluwana oko kuza kuqala ukucaca kwisicwangciso sobuchule sesizwe.
",0.60650307
"tsha vhuvhili, ri khou ya u engedza thikhedzo ya smme dzi langwaho nga vhafumakadzi na kha vhafumakadzi vhane vha shuma kha sekithara zwadzo kana vha sa shumi.
","okokuqala, siza kuqhuba ukubandakanyeka kwabantu basetyhini kuqoqosho ngenkqubo yentengo karhulumente.
",0.3955462
"izwi zwi ḓo katela u shumisana na sekithara dza zwa masheleni u itela tswikelo na khonadzeo ya tshumelo dza zwa masheleni kha vhafumakadzi.
","sesiwumisele umli nganiselo wokuqinisekisa ukuba ama40 eepesenti ubuncinane bempahla neenkonzo ezithengwa ngamaqumrhu karhulumente kufuneka zithengwe kumashishini wabantu basetyhini.
",0.60046065
"tsha vhuraru, ri ṱoḓa uri vhafumakadzi vhanzhi vha kone u swikela vhubveledzisi vhu ngaho sa ha mavu.
","okwesibini, sizakuyinyusa inkxaso yamashishini amancinci aphakathi naphuhlayo (ismmes) wabantu basetyhini neyabantu basetyhini abasebenza kwicandelo elingekho sesikweni okanye abangaphangeliyo.
",0.5793866
"ndi zwa ndeme zwauri vhafumakadzi ndi vhavhuelwa vha mbekanyamushumo dza mbuyedzedzo ya mavu dzi no khou bvelela.
","oku kuzakuquka nokudibana necandelo lezezimali ukwenza ukuba iinkonzo zezezimali zifikeleleke kwaye zingababizi kakhulu abantu basetyhini.
",0.57834315
"ndi zwa ndeme zwauri kha r75 miḽioni ya ndiliso ya covid19 yo vhetshelwaho zwa vhulimi phesenthe dza 53 dza vhavhuelwa hu ḓo vha vhafumakadzi vha mahayani.
","okwesithathu, sifuna ukuqinisekisa ukuba abantu basetyhini bayakwazi ukufikelela kwiimpahla ezivelisayo ezifana nomhlaba.
",0.54392004
"ri tea u vhona uri zwi tshidzaho vhafumakadzi na vhalimi zwavho zwi ise phanḓa na u wana thikhedzo na musi dwadze ḽo no fhira.
","kubalulekile ukuba abantu basetyhini babe ngabaxhamli kwinkqubo yohlengahle ngiso lomhlaba ekhawulezileyo.
",0.57666737
"tsha vhuṋa, ri tea u vhona uri vhafumakadzi vho tsireledzea kha khakhathi dzo ḓisendekaho nga mbeu mushumoni.
","kubalulekile ukuba kwimali ezizigidi ezingamashumi asixhenxe anesihla nu seerandi zoncedo lwecovid19 ebekelwe bucala igalelo lezolimo ngeevawutsha ama53 eepesenti zabo bangabaxhamli iza kuba ngabantu basetyhini basemaphandleni.
",0.6087179
"kha hezwi, ri ḓo vha ri tshi khou shuma kha lushaka na kha dzingu u itela khwaṱhisedzo ya buthano ḽa ilo ya khakhathi na u vhaiswa mushumoni.
","kufuneka siqinisekise ukuba abantu basetyhini abangamafama okuzi philisa nawemithamo emincinci bayaqhubeka ukufumana inkxaso nasemva kwalo bhubhane.
",0.62330174
"zwo ambiwa uri mbofholowo ai sokou ḓa fhedzi i tou shumelwa.
","okwesine, sifuna ukuqinisekisa ukuba abantu basetyhini bakhuselekile kubundlobongela obugxile kwezesini kwindawo yempangelo.
",0.52957964
"mbofholowo ya vhafumakadzi a i tou vha maipfi o tou ṅwalwaho fhedzi nga nnḓa ha musi i tshi tshimbidzana na vhuḓikumedzeli vhu bvaho kha sekithara dzoṱhe dza lushaka.
","kule meko, siza kusebenza kwinqanaba lesizwe nelommandla ekusondeleni ukuqinisekisa ingqungquthela yombutho wezabasebenzi wezi zwengezizwe engobundlobongela nempathombi kwindawo yempangelo.
",0.5128863
"musi ri tshi khou lugisela u fhaṱa nga huswa ikonomi yashu nga murahu ha dwadze ḽa tshitzhili tsha corona , ro amba uri a ri sokou hu mela he ra vha ri hone musi ṱhaho ya vairasi i sa athu vha hone.
","kuthiwa inkululeko ayinikezelwa, kodwa iyathathwa.
",0.4948078
"ri tea u fhaṱa ikonomi yo fhambanaho ya ndeme ine, kha zwoṱhe, ya khwinisa nga maanḓa tshiimo tshi vhonalaho tsha vhafumakadzi.
","ukukhululeka kwabantu basetyhini kusephepheni nje kuphela ngaphandle kokuba kukhatshwa sisibophelelo esivela kuwo onke amacandelo oluntu.
",0.4815213
"izwi zwi amba uri vhubindudzi hashu kha themamveledziso a vhu tei u tikedza fhedzi mveledziso ya nḓowetshumo dzapo, zwi tea u ya na kha mabindu a langwaho nga vhafumakadzi.
","njengokuba silungiselela ukwakha uqoqosho lwethu ekuqhambukeni kobhubhane wentsholongwane icorona , sathi asinokwazi ukuvela nje sibuyele apho besikho phambi kokuqhambuka kwale ntsholongwane.
",0.548275
"zwi tea u sikela zwikhala zwa mushu mo vhafumakadzi kha masia oṱhe a vhupulani, ṋetshedzo ya masheleni, vhufhaṱi na u londola themamveledziso.
","kufuneka sakhe uqoqosho olohluke ngokubalulekileyo neliza kuthi, phakathi kokunye, liphucule ngokubonakalayo indawo abakuyo abantu basetyhini.
",0.5223125
"nga kha maga a fanaho, musi ri tshi engedza mbekanyamushumo dzashu dza mishumo ya tshishavha, ri tea u vhona uri vhafumakadzana nga maanḓa ndi vhone vha topolwaho sa vhashelamulenzhe.
","oku kuthetha ukuthi kutyalomali lwethu kwiziseko ezingundoqo kufuneka singaxhasi nje uphuhliso kumashishini asekhaya kuphela, kodwa sixhase namashishini wabantu basetyhini.
",0.54531306
"nṱha ha mbuelo, mbekanyamushumo hedzi dzi ḓo vha ṋetshedza zwikha la zwa u swikela vhuṅwe vhukoni na tshenzhemo zwi ṱoḓeaho u itela u dzhena kha ikonomi khulwane.
","kufuneka ludalengabomi amathuba emisebenzi yabantu basetyhini kuwo onke amanqanaba okucwangcisa, elezezimali, elokwakha nokulungisa iziseko ezingundoqo.
",0.55712295
"sa izwi hu vhuḓifhinduleli ha muvhuso u ṋetshedza zwikhala zwa ikonomi vhafumakadzi na u sika mutheo kwao u itela u tshimbidza zwa ndinganyiso ya mbeu, muṅwe na muṅwe kha vhadzulapo u tea u ita mushumo wawe.
","ngokomlinganiselo ofanayo, njengokuba sisenyusa iinkqubo zemisebenzi yethu karhulumente, kufuneka siqinisekise ukuba ngokukodwa abantu basetyhini abalulutsha bachongwa njengabathathi nxaxheba.
",0.5422774
"mabindu a tea u tikedza vhubindudzi vhu langwaho nga vhafumakadzi musi hu tshi rengwa thundu.
","ukongeza kwimivuzo, ezi nkqubo ziza kubabonelela ngethuba lokufumana izakhono ezithile namava adingekayo ukungena kuqoqosho lwesiqhelo.
",0.49995708
"vha tea u thola vhafumakadzi vhanzhi na u vhea vhafumakadzi vhanzhi kha maimo a vhulanguli.
","nangona iluxanduva lukarhulumente ukubonelela abantu basetyhini ngamathuba ezoqoqosho nokudala inkqubosikhokelo yokuxhasa ukuqhubela phambili ukulingana kwezesini, wonke umntu eluntwini udinga ukudlala indima yakhe.
",0.540347
"hezwi zwoṱhe ndi zwa ndeme ho sedzwa zwauri rekhodo dza sekithara dza phuraivethe kha vhaimeli vha mbeu kha masia a vhulanguli dzi salela murahu kha dza sekithara ya nnyi na nnyi.
","abezoshishino kufuneka baxhase amashishini amancinci wabantu basetyhini ekuthengeni iimpahla neenkonzo.
",0.5245732
"hezwi ndi mafhungo ane a ambiwa a tshi dovhololwa kha nyambedzano dze nda vha nadzo na tshivhalo tsha madzangano a mabindu a vhafumakadzi.
","kufuneka baqeshe abantu basetyhini abongezelelweyo baze banyusele abantu basetyhini abongezelelweyo kwizikhundla zezolawulo.
",0.54233265
"hu tshi shumiswa maga a eḓanaho, ri tea u fhelisa zwa u sa lingana ha mbeu musi hu tshi holelwa vhanna na vhafumakadzi, hu dzhielwe nṱha maitele a miholo i eḓanaho kha mishumo i eḓanaho zwine zwa vha kha mulayo wa ndinganyiso ya mushumo.
","oku kubaluleka ngakumbi xa uqwalasela ukuba imbali yecandelo labucala ekumelweni kwesini kwinqanaba lezikhundla zezolawulo litsala emva kunecandelo likarhu lumente.
",0.6086749
"vhafumakadzi vha tea u tsireledzwa kha u vhaiswa na khethululo mishumoni.
","lo ngumba ophakanyiswa izihlandlo ngezihlandlo kuthethathethwano endilubamba nemibutho yezoshishino yabantu basetyhini.
",0.5843898
"zwi kha vhatshimbidzi vha vhuendedzi, vhalauli vha dziyunivesithi, khoro ndanguli ya zwikolo na madzangano a vhurereli u ita nyimele dza uri vhafumakadzi na vhasidzana vha ende, vha gude na u rerela vho tsireledzea.
","ngokufanayo, kufuneka sikuphelisile ukungalingani okugxile kwisini kwimivuzo yamadoda neyabantu basetyhini, size sisebenzise imigomo yokuhlawula umvuzo olinganayo ngomsebenzi ofanayo oqulathwe kumthetho womakulinganwe emsebenzini.
",0.54973453
"ri tea u fungelela ra ya phanḓa na ndingedzo dzashu dza u fhelisa vhukunzi vhu itelwaho wa inwe mbeu, khethululo i itelwaho vhafumakadzi ho sedzwa mbeu, na u vhusiwa nga vhanna.
","abantu basetyhini kukwafuneka bekhuselwe ekuphathweni kakubi nakucalucalulo emsebenzini.
",0.5433376
"ndi maitele haya ane a itisa uri hu vhe na mutsiko u itelwaho vhafumakadzi.
","kuxhomekeke kubanikazi bezothutho, abalawuli beedyunivesithi, iibhodi ezilawulayo ezikolweni kunye nemibutho yezenkolo ukudala iimeko ezilungiselela abantu basetyhini namantombazana ukuba ahambe, afunde aze akhonze ngokukhuselekileyo.
",0.5684967
