src_text,tgt_text,cosine_score
nginifisela okuhle kodwa emnyakeni omutjha.,"2021 e betere ho maafrika borwa ohledibeke tsa pele tsa selemo e bile tse boima ho maafrika borwa ohle.
",0.4910965
" sizizwa sihloniphekile ngokuba mrholi wehlangano yebumbano lamazwe weafrika (iau)siphelile isikhathi se sewula afrika soku ba ngusihlalo weau.
"," ke tlotla hore re ile ra fuwa monyetla wa ho etella pele mokgatlo wa dinaha tsa afrika (au) vukuzenzele unnamed sehla sa afrika bo rwa sa ho ba moe tapele wa au se fi hlile pheletsong.
",0.71763784
"vukuzenzele unnamed njengoba sibuyekeza sise tjisa umnyaka ebesiphe the ngawo isikhundla so kuba ngusihlalo wehlanga no le, ngikhumbula isitjho sabadala esithi, ‘umnyama omkhulu uvulela umkhanyo’ sabhabhadiswa ngomli lo thina kilelizwe l ekhethu, njengoba sithethe isikhundla sokuba ngusihlalo ngenyanga yinye ekubikwe ngayo umuntu wokuthoma ongenwe yingogwana icorona elizweni leafrika.
","ha re hetla morao moo selemo sa rona se qadileng teng re le maemong ana, ke hopola mantswe a kgale a reng ‘ka hara bobe bo bong le bo bong ho na le botle’.
",0.56432736
"amaqalontanzi wethu ebesizibekele wona ngethemu yethu, hlangana nawo ekubalwa nokukhuthaza ukuthula nokuvikeleka, ukuhlonyiswa ngamandla womnotho kwabantu abasikazi kunye nokunatjiswa kokulungelelwa kwezomno tho, kwakateleleka bona siwatjhugulule ngendima ekulu khonokho kobanyana sizokuqalana nesifo esidlange iphasi loke.
","rona re bile le kolobetso ya mollo, jwalo ka ha re bile badulasetulo ka kgwedi e ho bileng le tlaleho ya pele ya motho a nang le kokwanahloko ya corona ka hara kontinente.
",0.62413275
"umsebenzi osigandelele khulu ukudlula yoke kube kukuthi kufuneke sitjhaye le ihlelo leau ukulungisa ubujamo oburhabako obumbi kinabo boke obakhe benzeka ephasini loke eminyakeni engaphezulu kwelikhulu edlu lileko.
","maano ao re neng re a beile ka pele sehleng sa rona, a a kgang ntshetsopele ya kgotso le tshireletso, matlafatso ya basadi moruong le ho tebisa ho kopana ha moruo, a ile a tlameha ho phephethwa hanghang ho sa lebellwa, hore fela ho tsebe ho mekamekanwa le sewa sena.
",0.32170546
"icovid19 icaphazele woke amazwe weafrika.
","mosebetsi o neng o re peteditse haholo e bile wa ho tsepamisa maikutlo a au ho phumano ya tharollo ya koduwa ena e mpehadi ka ho fetisisa lefatshe ka bophara dilemong tse fetang tse le kgolo tse fetileng.
",0.55738175
"bekube kunamhlanje, banga phezulu kweengidi ezi3.5 abantu ekufakazeleke ukuthi bangenwe bulwelobu eafrika, kantike bunjalo nje sebubulele abangaphezulu kwee88 000. kube mraro wezepilo, wobuntu, wehlalakuhle yompha kathi newomnotho emazweni weafrika, ubunengi bawo atlhayela ngemithombo yamandla neensetjenziswa zokulawula umraro wezepilo ongaka.
","covid19 e amme dinaha tsohle kontinenteng.
",0.51961815
"izinto zinjalo, njengoba singakhange khesiwubone umraro wezepilo ongaka epi lwenethu, ngokunjaloke na mazwe weafrika athethe igadango angakhange akhe alithathe phambilini lokubu mbanela ukulwa nobu lwelobu.
","ho fihlela hajwale, ho na le batho ba dimiliyone tse tharo le halofo ba ho tsejwang hore ba na le covid19 ka hara afrika, mme ba fetang 88 000 ba hlokahetse.
",0.57111627
"ngokwenza njalo, sikghone ukusebenzisa ilwazi elikhe thekileko lekhonthinenthi yeafrika ngokwayo khulukhu lu, nekghono layo kunye ne leenjamiso zamaziko woku lawula zepilo nokukhandela amagulo, njengeafrica ce ntres for disease control and prevention (iafrica cdc).
","e bile bothata bo boholo ditheong tsa bophelo, botho, phedisano le moruo bakeng sa dinaha tsa afrika, tseo bongata ba tsona di hae llwang ke disebediswa tsa ho laola koduwa ya bophelo e kgolo ha kana.
",0.36814648
"iafrika akhange isonge izandla ibukele ubulwelobu busehla beburhatjha nengozi yabo.
","le ha e le mona sewa sena se bile seholo ha kana, ho bile jwalo fela le ka mokgwa oo dinaha tsa afrika di ileng tsa ipopa ngatana nngwe twantshong ya sona ka teng.
",0.6741657
"sisikime msinyana ngamalanga wokuthoma wobulwelobu oburhatjheke ephasini jikelele, sikhanjelwa phambili yiau, msinyana sakha ihlelo loku lwa nabo lilawulwa yiafrica cdc neenqhema zo msebenzi eengodini ngee ngodi.
","ka ho etsa seo, haholoholo re tshepetse tsebong, bokgo ning le ditheong tsa konti nente tse jwalo ka ditheo tsa afrika tsa taolo le thibelo ya mahloko (africa cdc).
",0.6340526
"silimukile ukuthi elinye nelinye ilizwe ekhonthinenthini yekhethu le lizokukhahlumezeka kumbi ngobulwele oburhatjhekilekobu.
","afrika ha e a ka ya iketla ya phutha matsoho ya shebella ha sewa sena se kotsi se ntse se nama.
",0.5162943
"ubunengi bamazwe lawa akanayo imithombo yamandla nee nsetjenziswa zokulwa nomra ro wezepilo yomphakathi namkha yokuvikela umnothwawo.
","ho tloha qalong ya sewa sena re ntse re etelletswe pele ke au, re ile ra etsa leano la ho se phallela ka potlako ka thuso ya africa cdc mmoho le dihlopha tsa tshebetso tsa mabatowa a kontinente.
",0.607079
"ngalokhoke thina njengamazwe weafrika sivumelene ukukhetha amaafrika ambadlwana aziwako ukuthi abe ziinthunywa ezikhethekileko, ezizakukhulumisana nabasekeli ngee mali bamazwe ngamazwe neenhlangano zeenqhemaqhema kobanyana akhombe lele iafrika isizo leemali nelokusizwa eenkolodweni zayo.
","re ile ra elellwa hore naha enngwe le enngwe kontinenteng e tlo angwa hampe ke sewa sena.
",0.52582645
"ngalendlela, ngokusebenzi sana njengekhonthinenthi yinye, siphumelele ukutho lela amazwe amanengi isizo lokusekelwa ngeemali zokuvala iinkolodo zazo neloku sizwa ngeemali emahlelweni wokulwa necovid19 newokuvuselelwa komnotho.
","bongata ba tsona di ne di ke ke tsa ba le disebediswa tse hlokahalang bakeng sa ho rarolla mathata a bophelo a setjhaba kapa ho tshireletsa meruo ya tsona.
",0.5418171
"kodwana nanyana amazwe weafrika aye emazweni ngamazwe ayokufuna isizo nje, sithome ngokuzivusa thina ngokwethu — ngokwakha nokuvula isikhwama sokulwa necovid19 ekho nthinenthini yeafrika.
","ka hoo, jwalo ka dinaha tsa afrika re dumellane ho kgetha maaforika a hlaheletseng ka mahetla jwalo ka baemedi ba kgethehileng, ba tla bua le batshehetsi ba tjhelete ba matjhabatjhaba le ditheo tsa dipuso tse fapaneng bakeng sa ho tshehetsa ka tjhelete le kimollo ya mekitlane ya afrika.
",0.664852
"kobunye nobunye ubudle lwano obakhiwe namazwe anothe ngcono ngemithombo yamandla neensetjenziswa nabanikeli ngesizo bamazwe ngamazwe, sizakhele ikundla yokusabalalisa iinhlahla eafrika kobanyana amazwe weafrika azokwazi ukutho la ipahla eziimvikelimzi mba nezinye iinsetjenziswa zeenhlahla ngendlela yobuhle obulinganako, nangeendleko ezingalilisiko.
","ka mokgwa ona wa ho sebetsa mmoho jwalo ka kontinente, re kgonne ho fihlella kimollo ya mekitlane bakeng sa dinaha tse ngata le ho fumana thuso ya tjhelete bakeng sa ho lwantsha covid19 le ho thusa ho tsosa moruo.
",0.6058306
"kwanjesike njengoba umjo vo wecovid19 sewutho lakala nje, sisebenze ngo kuhlanganyela ukuqinise kisa ukuthi ikhonthinenthi ye khethu ithola isabelo sayo esiyifaneleko, ngokusebenzi sana neziko lecov ax eli doswa phambili siqhema somjovo sangekhethu iafri can vaccine acquisition task team.
","empa le ha e le mona dinaha tsa afrika di kopile thuso ho matjhabatjhaba, re ithusitse ka borona pele – ra aha latlole la ho lwantsha covid19 a kontinente.
",0.57588506
"sewuthomile ukusa tjalaliswa ekhonthinenthini yeafrika umjovo, kantike sisebenzela ukuthi nakuphela umnyaka wee2021 ibe sesijove ubunengi besitjhaba seafrika, kobanyana sizokuhlanganisa inani elaneleko labantu abavikeleke esifeni.
","ka lebaka la tshebedisano mmoho enngwe le enngwe e etswang le dinaha tse nang le disebediswa tse betere mmoho le batshehetsi ba dinaha tsa matjhabatjhaba, re sibollotse motjha wa afrika wa phepelo ya disebediswa le meriana o tswetseng pele, bakeng sa ho thusa dinaha tsohle tsa afrika ho fumana disebediswa tsa tshireletso le phepelo ya meriana ka ho tshwana le ka ditjeho tse tlase.
",0.66373587
"sijame ndawonye ukuvikela ipilo, abantu nemithombo abantu abaphila ngayo ekho nthinenthini yeafrika.
","mme jwalo ka ha ente e thibelang covid19 e se e le teng, re sebeditse mmoho ho netefatsa hore kontinente e fumana karolo ya yona e e tshwanetseng, ka tshebedisano mmoho le setheo sa covax le ketello pele ya sehlopha sa afrika sa tshebetso ya phumano ya ente.
",0.68766904
"ngokwenza njalo, sitjengise ikghono lethu lokuzithemba nelokuba batjhayeli betuthuko yethu ngokwethu.
","ente e se e qadile ho fihla ka hara kontinente mme re labalabela ho bona boholo ba batho ba kontinente ba entile mafelong a 2021, hore re fihlelle setjhaba se sengata se entileng se seng se sa tshwaetsehe.
",0.50418866
"nanyana senganywe yicovid19 nje, kodwana nokho siphumelele ukuba nendima kumaqalontanzi wethu amba dlwana aqakathekileko.
","re sebeditse mmoho bake ng sa ho tshireletsa bophelo, batho le tshehetso ya bophe lo kontinenteng.
",0.5424827
"ngesikhathi sethemu yethu, ugcine usikinyisiwe umtlamo wokurhwebelana kweafrika iyodwa, iafrica continental free trade area (iafcfta), ebe sitjengiso sesikhathi esitjha sokurhwebelana kwamazwe weafrika awodwa nesokulungelelana komnotho weafrika.
","ka ho etsa jwalo, re bontshitse bokgoni ba ho ikemela le ho intshetsa pele.
",0.39212477
"ngitjho nangesikhathi sobudisi esilethwe bulwele oburhatjheke iphasi lokeli, ikhonthinenthi yeafrika itjhotjholoze ngamandla ‘ngehlelo lokuqeda izipi’ ngaphakathi kwayo.
","le ha e le mona covid19 e re hlwele setha, re ntse re kgonne ho ntshetsa pele maano a rona a mmalwa a ka sehlohong.
",0.550447
"iau ibe nelizwi emikhulumiswa neni yegrand ethopian renaissance dam, nekuphumeleliseni ukubekwa phasi kweenkhali elibya kunye nekukhuthazeni ukuthula elizweni lesouth sudan.
","sehleng sa rona ho ile ha sibollwa letsholo la kgwebisano ya dinaha tsa konti nente ya afrika ntle le dite fello (afcfta), e bontshang nako e ntjha kgwebisanong ya dinaha tsa afrika le kopanelong ya moruo.
",0.667451
"omunye umthamo wethu obonakalako kube kuhlonyi swa kwabantu abasikazi ngamandla abonakalako, umphumela wakhona ozakudlulela ngale kwethemu yethu nangale kwetjhumiminyaka lokuqalelelwa kwabantu abasikazi beafrika ukuyokufika emnya keni wee2030.
","le maemong a thata a tlisitsweng ke sewa sena, kontinente e ntse e kgonne ho tswela pele ka leano la ho ‘kgutsisa dithunya’ ka hara kontinente.
",0.5659213
"njengoba sidlulisela isi khundla sokuphathesi eli zweni ledemocratic republic of congo nje (idrc), sitjhiya ihlangano erhanyazelako yekhonthinenthi yeafrika le ezandleni zamandla ama khulu.
","au e ile ya nka karolo dipuisanong tsa grand ethiopian renai ssance dam mme ya fihlella ho kgutsisa dithunya libya le ho tlisa kgotso naheng ya south sudan.
",0.652815
"isewula afrika izakusolo ilima yayo indima ukukhu thaza ibumbano ekhonthi nenthini ibe isekele nosihlalo ongenako lo kunye nemiza mweni yayo yokuphumele lisa iinrhuluphelo zeau ngeajenda yomnyaka wee2063.
","nqa enngwe eo re neng re tsepamisitse maikutlo ho yona sehleng sa rona ke ho matlafatso ya basadi moruong, eo re tla tswela pele ho e kenya tshebetsong le ka mora sehla sa rona le nakong ya dilemo tse leshome tsa kenyeletso ya basadi ba afrika ditjheleteng le moruong ho leba ho 2030. jwalo ka ha re fetisetsa boetapele ho naha ya democratic republic of congo (drc), re tlohela ketapele ena e kgabane ya kontinente e le maemong a matle ho feta pele.
",0.7034395
"mhlazana kusungulwa ihlangano yobunye beafrika (ioau) ngomnyaka we1963, amazwe amalunga walehlangano atjala imbewu yo kusebenzisana neyokuzwela na ngomnqopho wokwenza ipilo yabantu boke beafrika ibe ngcono.
","afrika borwa e tla tswela pele ho nka karolo ho tlisa kopano ka hara kontinente, le ho tshehetsa ketapele e ntjha le matsapa a au a ho phethahatsa ditabatabelo tsa ona tsa agenda 2063. ha mokgatlo wa dinaha tsa afrika o ne o thewa ka 1963, dinaha tseo e leng ditho mokgatlong ona di ile tsa jala peo ya tshebedisano mmoho le bonngwe ntshetsopeleng ya bophelo bo botle bakeng sa batho bohle ba afrika.
",0.63894486
"amazwe amalunga la avuma ukuthi ukubumbana kweafrika yinto eqakathekileko ekuqinisekiseni ihlalakuhle nokuledlha kwabantu beafrika.
","di ile tsa bolela hore kopano ya afrika e bohlokwa haholo bakeng sa ho netefatsa the kolohelo le bophelo bo botle ba maafrika.
",0.60392785
"umlando ufakazela ukuthi imbewu leyo azange iwele yoke equlwanini enothileko, begodu umsebenzi wokubumbana kwamazwe weafrika uliyekile bewaba neenqabo ezinengi nobudisi bokusikimisa imisebenzi emihle.
","nalane e paka hore ha se ka mehla moo peo ena e ileng ya wela mobung o nonneng, mme dilemong tse ngata tse fetileng, porojeke ya kopano ya kontinente e bone ditshita tse ngata le qalo tse fosahe tseng.
",0.60517967
"kodwanake ingozi eza nobulwelobu obungumabhubhi sa ihlohlomezele amazwe weafrika ukuthi abumbane, asebenzisane.
","empa kotsi e tlisitsweng ke sewa sena e qobelletse dinaha tsa afrika ho sebetsa mmoho.
",0.6136018
"kilelilangabi lomlilo wecovid19, imbewu yebumba no nokusebenzisana eyatja lwa bahlahlindlela belizwe lekhethu imilile beyakhula.
","thuto eo re ithutileng yona bothateng ba covid19 e entse hore peo ya kopano le ya tshebedisano mmoho tse jetsweng ke baholoholo ba rona e mele mme e behe tholwana tse molemo.
",0.70652354
"lesisikhathi sokulingwa nobudisi obungaka sibe hlangana nesikhetheke khulu seau.
","nako ena ya teko ya tonanahadi le mathata e bile enngwe ya dinako tse babatsehang tsa au.
",0.5877006
"sizizwa sihloniphekile ngokunikelwa ithuba lokudosa phambili ihlangano le ngalesisikhathi, la kuvele khona tjhatjhalazi ihlathululo yamambala yamagama athi ‘african union,’ ngoku tjhugululiweko atjho ukuthi ‘ibumbano lamazwe weafrika’.
","ke tlotla hore re ile ra fuwa monyetla wa ho etella mokgatlo pele ka nako ena e bontshitseng hantle hore lentswe ‘kopano ya afrika’ le bolelang.
",0.5646025
le yipumelelo zoke izakha muzi zekhonthinenthi yeafrika ekumele zizikhakhazise ngayo zibe zikhuthazeke ngayo.," ke tlotla hore re ile ra fuwa monyetla wa ho etella pele mokgatlo wa dinaha tsa afrika (au) vukuzenzele unnamed sehla sa afrika bo rwa sa ho ba moe tapele wa au se fi hlile pheletsong.
",0.5646025
"amagadango wokuvuselela umnotho vukuzenzele unnamed sekuzokuphela unya ka solo kwabikwa ukwehla kwengo gwana icorona esewu la afrika.
","mehato ya ho tsosolosa moruo vukuzenzele unnamed e se e tla ba selemo jwale re bile le ke tsahalo ya pele ya kokwanahloko ya khorona e ileng ya tlalehwa naheng ya rona.
",0.6535135
"isifesi sifike satjhugulula okunengi kezamaphilo nepilweni yangamalanga yeengidigidi zabantu.
","sewa sena se bakile ditshenyehelo tse kgolo bophelong ba setjhaba esita le maphelong a dimilione tsa batho ba habo rona.
",0.45909944
"abasebenzi abanengi balahlekelwe yingcenye yemirholo yabo njengobana amairi wabo wokusebenza ehliswa ngapha abanye badilizwa emisebenzini.
","basebetsi ba bangata ba lahlehetswe ke karolo ya meputso ya bona ha dihora tsa bona tsa tshebetso di fokotswa, mme ba bangata ba fokotswa mesebetsing.
",0.52572703
"amarhwebo amanengi ahlangabezene nokulahlekelwa okukhulu kwengenisomali ngebanga lokuvalwa kwamarhwebo isikhathi eside nokuvula amairi ehlisiweko.
","dikgwebo tse ngata di bile le tahlehelo e boima ka lebaka la ditshebetso tse fokoditsweng.
",0.45568615
"amanye amarhwebo kwafanela bona avalwe.
","tse ding di ile tsa tlameha ho kwalwa.
",0.34348047
"abantu abathengisa endleleni nabazisebenzako nabo babetheke kumbi ngobujamobu.
","batho ba sebetsang karolong ya moruo e sa hlophiswang le bona ba amehile habohloko.
",0.4322772
"okubudisi ukudlula koke kukuthi, ingogwana le ithethe amaphilo wabantu ekungibo abondla imindeni eminengi, lokho kwatjhiya abaseleko bakhulelwe ziinhloko bona bayokuthathani bahlanganisa nani ukuze baziphilise.
","ntlheng e boima ka ho fetisisa, sewa sena se nkile maphelo a bafepi malapeng a mangata, mme ba malapa ba sala ba itlhophere, hape ba tsielehille bakeng sa bokamoso.
",0.6251471
"kungebangelo amagadango amakhulu esawathathako wokukhulula abantu womabili bekufanele athathwe begodu bekarhabekile.
","ke ka lebaka lena mehato e pharaletseng ya diphallelo eo re e nkileng e neng e hlokeha e bile e le e potlakileng.
",0.3198614
"begodu, njengobana sekutjhidele ukuphela komnyaka solo sangenelwa yicorona, singathi amagadango la atjengise ukuza nomphumela omuhle wokuvuselela umnotho.
","hape, jwalo ka ha ho batla ho fetile selemo, re ka re mehato ena e atlehile.
",0.3563612
"emagadangweni esiwathetheko wokusiza, kungahle kube ngamabili la asize khulu ekusibonelelo sombuso esikhethekileko secovid19 nomrholo wesikhatjhana womqatjhi/wabasebenzi okhutjhwa sikhwama setjhorensi yabaphelelwe msebenzi (iuif), obizwa ngokuthi yicovid ters.
","kakaretsong ya yona mehato ena ya diphallelo tseo re di entseng mohlomong e mmedi e bileng le tshusumetso e matla haholo ke phallelo ya setjhaba e ikgethileng ya covid19 le ya uif, ya leano la diphallelo tsa basebetsi la nakwana, le tsejwang feela e le covid ters.
",0.41028437
"bengeze sikwazi ukuwathatha amagadango ngokurhabako ingathana besinganahlelo lokuhlenga ihlalakuhle nokuziphilisa kwesitjhaba ebesele sinalo.
","re ne re ke ke ra atleha ho qala mehato ena ka nako e kgutshwane hakana haeba re ne re se na dibopeho tsa motheo tsa tshireletseho ya setjhaba tse pharaletseng tse neng di se di sebetsa.
",0.6123705
"sikghonile ukuqalana nesidingo esikhulu begodu ebesirhabeke kangaka esitjhabeni sekhethu sithokoze ihlelo lelizweloke nekambiso yeejensi yeembonelelo zesondlo nomhlalaphasi karhulumende yesewula afrika (isassa) kunye neuif.
","re ile ra kgona ho arabela tlhoko ena e kgolo e bileng e le e potlakileng setjhabeng sa rona, re leboha dibopeho tsa motheo tse kgolo naheng ka bophara le ditsamaiso tsa setsi sa afrika borwa sa tshireletso ya botjhaba (sassa) le letlole la inshorense ya batho ba feletsweng ke mosebetsi (uif).
",0.57446694
"kubekhona ukuphazamiseka kwemitjhini endleleni, kodwana okunengi kwalungiswa msinyazana.
","kantle ho qeaqeo, a bile teng mathatanyana a setekgeniki le a mang boleleng ba nako, empa tsena tsohle di ile tsa rarolleha kapele.
",0.5598542
"amakoro ahlukahlukeneko karhulumende enze umsebenzi omuhle khulu wokunikela iingidigidi zabazuzi amathuba nokuqinisekisa bona bayabhadelwa.
","diagente tsena tsa mmuso di entse mosebetsi o babatsehang wa ho ngodisa dimilione tsa baamohedi ba batjha le ho netefatsa ho lefuwa ha bona.
",0.6177413
"isekelo elinikelwe yiuif lasiza khulu amarhwebo asakhasako nadosa emhlweni kunye nabasebenzi.
","tshehetso e fanweng ke uif e inotse dikgwebo tse thekeselang esita le basebetsi.
",0.59566927
"laletha umehluko phakathi kokuthi amakhamphani aragele phambili nokurhweba nofana akateleleke bona avale, hlangana nemisebenzi eyahlengwako naleyo egcine iphelile.
","e entse phapang pakeng tsa dikhampani tse setseng di sebetsa le tse ileng tsa tlameha ho kwalwa, pakeng tsa mesebetsi e ileng ya bolokeha le e ileng ya lahleha.
",0.50635594
"lokhu kwasiza amarhwebo afana nesihle’s brew, ekuyindawo yokudlela esegauteng, eyakghona ukungadilizi abasebenzi bayo abali18 ngesizo lehlelo lecovid19ters.
","sena se ile sa tswela molemo dikgwebo tse jwalo ka sihle’s brew, kgwebo ya dijo gauteng, e ileng ya kgona ho boloka basebetsi ba yona ba 18 ka lebaka la morero wa ters.
",0.6814457
"sithokoza isekelo likarhulumende, ikampani imamoshalagae trading and projects, ethengisa iintambo neensetjenziswa zegezi esemokopane, ikghone ukubhadela abasebenzi begodu nemali yokuqatjha umakho nemali yentela kamasipala ngesikhathi sokuqinteliswa kwamakhambo.
","re leboha tshehetso ya mmuso, mamoshalagae trading and pojects, kgwebo ya motlakase wa dipalangwang mokopane, e ile ya kgona ho lefa basebetsi ba yona esita le ho lefella rente, le ditefiso tsa thepa nakong ya ho kginwa ha tshebetso le maeto.
",0.65703803
"abasebenzi ebebasebudisini bakghona ukuthola ubuncanyana bemirholo yabo.
","basebetsi ba maqakabetsing ba ile ba kgona ho amohela karolo ya meputso ya bona.
",0.36380893
"ulindiwe ntuli, oligcwetha lecenturion, usitjele ngokobana ukuhlomula kwakhe kumsize kangangani ngokuthi akghone ukusebenzela ekhaya begodu akghone nokubhadela indawo yokuhlala ayiqatjhileko.
","lindiwe ntuli, molaodi wa molao, centurion, o boletse kamoo ho fumana ha hae meropotso ho ileng ha mo thusa hore a tsebe ho sebeletsa hae mme a kgonane le rente ya hae.
",0.42483073
"zinengi iindaba ngamakampani akghone ukuraga nomsebenzi ngepumelelo enyakeni odlulileko njengombana bebasekelwa yiuif.
","di ngata dipale tsa dikhampani tse ileng tsa qoba ho teba nakong ya selemo sena se fetileng ka lebaka la tshehetso eo di e fumaneng ho uif.
",0.5884011
"okufanako kungatjhiwo nangamarhwebo amancani asizwa ziimbonelelo ezihlukahlukeneko kunye nemalimboleko ebeyikhutjhwa minyango eminengi.
","ho ka phetwa tse tshwanang le dikgwebong tse nyenyane tse thusitsweng ke diphallelo tse fapafapaneng esita le dikadimo tse fanweng ke mafapha a mangata.
",0.57936436
"amagadango la asize khulu abantu belizwe lekhethu ngeenkathi zokutlhoga.
","mehato ena e thusitse batho ba habo rona haholo nakong ya bona ya tlhoko.
",0.46010697
"njengobana siphuma ebujameni bokudinga isizo siya ekululameni, fanele sitjhugulule indlela yokwenza.
","jwalo ka ha re fetoha ho tloha ho diphallelo ho ya ho tsosoloso, re tlameha ho fetola mokgwa wa rona wa tshebetso.
",0.54069
"ngesikhathi amagadango la bekahlonywe kwesikhatjhana, umnotho wona usazokuraga nokudosa emhlweni ngenca yemithelela yengogwana engumabhubhisa le.
","le hoja mehato ena ya kokobetso e ne e raletswe ho ba ya nakwana, moruo o tla tswela pele ho utlwa maoma a sewa sena nako e itseng.
",0.61949766
"nanyana imithetho yokuqinteliswa kwamakhambo seyinyefisiwe nje, amakhamphani amanengi asadosa emhlweni ngokuraga eenyangeni lapho bekunciphe khona umsebenzi nemali ingangeni.
","le ha e le mona dipehelo tsa ho kginwa ha tshebetso le maeto di nyenyisitswe, dikhampani tse ngata di fumana ho le thata ho emelana le ditlamorao tsa dikgwedi tse ngata tsa ditshebetso tse fokotsehileng esita le kuno e lahlehileng.
",0.54732424
"nguye kanye unobangela lo owenze bona ngemva kwemikhulumiswano nabalingani bethu bakwanedlac isekelomali lecovid19 ters lelulelwe isikhathi bekube nakali15 kuntaka 2021 kwenzelwa imikhakha ebeyingakghoni ukusebenza ngokupheleleko.
","ke ka lebaka lena, kamorao ho dipuisano tse pharaletseng le balekane ba rona ba tswang setjhabeng ho lekgotla la naha la ntshetsopele ya moruo le basebetsi (nedlac), meropotso ya covid ters e atolotswe ho ya ho 15 tlhakubele 2021 bakeng sa dikarolo tse sa kang tsa kgona tshebetso ka botlalo.
",0.4035635
"isibonelelo sombuso esikhethekileko secovid19 selulelwe isikhathi ngeenyanga ezintathu.
","tshehetso e ikgethileng ya covid e atolotswe ka dikgwedi tse ding tse tharo.
",0.5303828
"la magadango wesikhatjhana.
","ena e ntse e le mehato ya nako e kgutshwane.
",0.30764812
"okwanje itjhejo lethu kumele libe sekwakheni indawo ekghonakalisa bona amarhwebo akwazi ukubuyela endimeni begodu nokuthi umnotho ukghone ukusiza ngokwakhiwa kwemisebenzi begodu udose nesisomali.
","re tlameha ho tsepamisa maikutlo a rona ho bopeng tikoloho e fang dikgwebo bokgoni ba tsosoloso, hape le kgolo ya moruo e tla kenya ho thewa ha mesebetsi merebele, hape e hohele matsete.
",0.57610124
"ukubuyela endimeni komnotho kuzokuba yinto ebudisi tle begodu kuzokuthatha isikhathi, njengombana sisese phakathi kobujamo bengogwana le.
","tsosoloso e tla ba boima mme e tla nka nako, hakaakang re sa ntse re le ka hara sewa.
",0.50091136
"nanyana amagadango wokusekela ngeemali la aqakatheke kangaka, angeze sakghona ukuwaraga unomphela.
","le ha e le ya bohlokwa jwalo, mehato ena ya diphallelo, re ke ke ra kgona ho di ntshetsa pele molebe.
",0.47947693
"sidinga ukwenza isiqiniseko sokobana amagadango la akha isisekelo esiqinileko khona umnotho uzakuqina ngaphandle kokufaka ilizwe lekhethu eenkolodweni ezidlula esele likizo.
","re tshwanela ho etsa bonnete ba hore mehato ena ya diphallelo e fana ka motheo o tiileng bakeng sa tsosoloso e batsi kantle ho ho kgannela naha tebetebeng ya dikoloto.
",0.6181197
"ngaphandle kwalokha nange singakghona ukwehlisa isikolodo selizweloke sibe sesigabeni esilawulekako angeze umnotho wadzimelela.
","kantle ho ha re ka theolela mokitlane wa naha ya rona methathing e laolehang, ha ho tsoloso e bonahalang e ka kgonehang.
",0.6205344
"imikhumbulo yethu sisitjhaba kufanele isuke ekukhululekeni iye ekwelulameni, begodu soke kufanele sibe yingcenye yomzamo lo.
","phadimehelo ya rona re le setjhaba e tlameha ho sutha mothathing wa diphallelo e habele ho wa tsosoloso, mme bohle re tshwanela ho ba karolo ya boiteko bona.
",0.5695262
"njengorhulumende, iinqunto eziqinileko ekusetjenzisweni kwemali yombuso kumele zithathwe begodu zifezwe nonyaka.
","re le mmuso, diqeto tse boima malebana le tshebediso ya ditjhelete tsa setjhaba di tla tshwanela ho nkuwa le ho sebediswa selemong sena.
",0.5774495
"amakhamphani azokudinga bona avele neendlela ezitjha zokuraga begodu neenkambiso zokudzimelelisa ibhizinisi nokwenza ingenisomali, nokugcina imisebenzi kufanele kube yinto eba liqalontangi.
","dikhampani di tla tshwanela ho hlahisa dintjhafatso ho ntshetseng pele mekgwa le ditshebetso tse netefatsang mokoka le bokgoni ba ho etsa phaello, poloko ya mesebetsi e le monahanong o ka sehloohong.
",0.5838804
"kumele sibuyisele imali yethu emnothweni welizwe lekhethu ngokuthenga ipahla ekhiqizwe ekhethwapha sisekele amarhwebo wangekhaya begodu sithenge kubathengisi bekhethwapha.
","re tlameha ho busetsa tjhelete ya rona moruong wa rona ka ho reka dihlahiswa tsa ka hara naha, re tshehetse dikgwebo tsa ka hara naha le bahlahisi ba ka hara naha, re reke ho bafepi ba ka hara naha.
",0.59090924
"isigulani esilimeleko esikhombisa amathuba amanengi wokuphola sinikelwa ukwelulwa komzimba kwangamalanga khona sizakuqina besikghone nokuzijamela ngaphandle kokusizwa.
","mokudi ya lemetseng mme a bonahala a na le menyetla e meholo ya ho kgutlela boemong ba hae ba pele o fumantshwa phekolo ya mmele e sa thiseng e le ho mo thusa ho matlafala ho fihlela a ka ikemela a sa thuswe.
",0.69761217
