src_text,tgt_text,cosine_score
"ntirho lowu hi nga langu tana na wona i ku tirhisana kususa lava nga fanelangiki, ni ku lulamisa matwisiselo lama nga riki wona ya leswaku hinkwavo lava thoriweke hi mfumo va tirhela ku tivuye risa kumbe i timbabva.
","ndi ita khuwelelo kha vhanna na vhafumakadzi vhoṱhe vha shumelaho shango ḽashu ḓuvha na ḓuvha uri vha ḓikumedzela hafhu kha mikhwa ya u bve ledzisa vhaṅwe vhathu na tshumelo, na u humbula uri vhuḓifari havho vhu tea u dzula vhu mulayoni na u vha na vhuḓifari kwaho.
",0.6176107
"ndzi rhamba vanuna ni vavasati hinkwavo lava tirhe laka tiko ra hina siku na siku ku tlhela va tiboha eka mikoka ya ku va va nga tilaveli swa vona ntsena kambe va tirhela, naswona va tlhela va tsu ndzuka leswaku matikhomelo ya vona ma fanele ku va ena wini ni ku va ni mahanyelo lamanene ya vumunhu mi karhi hinkwayo.
","u fhelisa zwiito zwa vhuaḓa kha tshumelo dza muvhuso vukuzenzele unnamed nzumbululo ya phalamenndeni ya uri vhashu meli vha muvhuso vho vha vha khou ṱanganedza tshelede dza mundende ṅwedzi nga ṅwedzi dzi sumbedza uri ri kha ḓi vha na mushumo vhukuma wa u khwaṱhisedza mvelele ya mikhwa kha tshumelo ya muvhuso.
",0.6176107
"swihanano swa mitirho hi presidente swi susumeta ku tumbuluxiwa ka mitirho vukuzenzele unnamed ku simekiwa ka xiyenge xa vumbirhi xa ku simekiwa ka swihanano swa mitirho hi pre sidente sweswinyana swi kombisa ku humelela lokukulu eka swiko ngomelo swa hina swo tumbuluxa swivandla swa mitirho eka ma afrikadzonga lava nga tirhiki.
","maga a ṱhuṱhuwedzo ya vhusikamishumo na tsireledzo ya mishumo zwa muphuresidennde a bveledza tsiko ya mishumo vukuzenzele unnamed u rwelwa ṱari ha zwinozwino ha ḽiga ḽa vhuvhili ḽa maga a ṱhuṱhuwedzo ya vhusikamishumo na tsireledzo ya mishumo zwa muphuresidennde hu imela mvelaphanḓa khu lwane kha u lwela hashu u sika zwikhala zwa mishumo u itela vhadzulapo vha afrika tshipembe vha si na mishumo.
",0.6293483
"hi tumbuluxile swiha nano swa mitirho lembe leri hundzeke ku vanga mikateko yo tala hilaha hi nga kotaka hakona hi xinkadyana lexitsongo hilaha swi kotekaka hakona.
","ro thoma maga a thuṱhu wedzo ya vhusikamishumo na tsireledzo ya mishumo zwa ṅwaha wo fhelaho nga u sika zwikhala zwinzhi zwinzhi nga tshifhinga tshipfufhisa.
",0.39395022
"leswi swi ta lava tindlela letintshwa ta maehleke telo to tirha ku simeka tiphurogireme leti nga tolovelekangiki hi xihatla ni mpimo.
","hezwi zwo ṱoḓa nḓila ntswa dzi bvele dzaho dza u shuma u itela u thoma u shumisa mbekanya mushumo nga luvhilo lu songo ḓoweleaho na tshikalo tshi mangadzaho.
",0.5334877
"ndlela yo gangisa vanhu votala lava nga tirhiki va tirhisile tindlela ta xidijitali ku fikelela vathoriwa vo hlaya lava ringaneleke hilaha swi nga kotekaka hakona.
","maitele a u thola vhathu vhanzhi vhe vha vha vha sa shumi o shumisa pulatifomo dza dzidzhithala u swikelela vhadzheneli vho lugelaho vhanzhi.
",0.5126597
"xikombiso, van’wamapurasi lavatsongo va swi kotile ku endla swikombelo ku seketeriwa hi ussd ni ku amukela tivhochara eka tiqingho ta vona.
","sa tsumbo, vhora bulasi vhaṱuku vho kona u ita khumbelo ya thikhedzo nga kha ussd na u wana voutshara dza u wana tshu melo dza zwa vhulimi kha ṱhingothendeleki dzavho.
",0.67135084
"ku sukela loko ndzawulo ya dyondzo ya le hansi yi pfulele swikombelo swa ntlawa wa vumbirhi wa vapfuneti va le swikolweni ku nga ri khale, ku tlula 940 000 wa vantshwa va endlile swikombelo hi ku tirhisa ndlela ya magangiselo ya mahala lama vuriwaka sayouth.
","u bva tshe muhasho wa pfunzo dza u mutheo wa vulela khumbelo dza mute vhe u tevhelaho wa vhathusi zwikoloni zwenezwino, vhaswa vha fhiraho 940 000 vho ita khumbelo nga kha pulatifomo dza u thola dzi sa badelwi dzi no pfi sayouth.
",0.61418486
"mobi, lama endla ka xiphemu xosungula xa rixaka xa pathway management network.
","mobi, zwine zwa vha tshipiḓa tsha netiweke dza tikedza vhaswa u wana gondo ḽa u dzhena kha zwa ikonomi.
",0.56707335
"ku tirhisiwa ka thekinoloji yintshwa eku nyikeni ka swivandla swa mitirho swi endle leswaku vugangisi byi olova, byi hatlisa ni ku va erivaleni.
","tshumiso ya thekhinoḽodzhi ntswa kha u ṋea zwikhala zwa mishumo yo ita uri u thola zwi leluwe, zwi ṱavhanye na u vha khagala.
",0.56968105
"swihanano swa mitirho hi presidente swi endle ni ku hatlisisa ntirhisano eka mabindzu ya mfumo.
","maga a ṱhuṱhuwedzo ya vhusikamishu mo na tsireledzo ya mi shumo zwa muphuresi dennde o konisa na u le ludza tshumisano kha sekhithara ya muvhuso.
",0.48655844
"tiphurogireme eka xiyenge xo sungula ti simekiwile hi tindzawulo ta mfumo ta 11. migingiriko ya tona a yi fambelana ni ku papalata mbuyelelo no tlangisa ni ku antswisa ku dyondza ku suka eka lava nga ni ntokoto.
","mbekanyamushumo dza kha ḽiga ḽa u thoma dzo shumiswa nga mihasho ya lushaka ya 11. mishumo yayo yo konanywa u thi vhela ndovhololo na tshi nyalelo na u khwaṱhisedza u guda kha tshenzhemo dza vhaṅwe.
",0.60970306
"engetelo wa mitirho wu tlhele wu kombisa nkoka wa ntirhisano kun’we.
","maga a ṱhuṱhuwedzo ya vhusikamishumo na tsireledzo ya mishumo o sumbedza ndeme ya tshumisano ya matshilisano.
",0.4318572
"mfumo, mabindzu, vathori na vaakatiko va tirhisanile swin’we ku tisa lava va nga tirhiki eka ikhonomi.
","muvhuso, mabindu, vhashumi na tshitshavha tsha vhadzulapo vho ṱangana u itela u dzhenisa avho vha sa shumi kha ikonomi.
",0.58047533
"ku tlula hafu ya gidi ya miliyoni ya maafrikadzonga va se va vuyeriwile ku suka eka xiyenge xo sungula, laha tiphurogireme tin’wana ta ha yaka emahlweni.
","vhadzulapo vha afrika tshipembe vha fhiraho hafu ya miḽioni vho no vhuelwa kha ḽiga ḽa u thoma, hu tshi kha ḓi vha na mbekanyamushumo dzo vhalaho dzine dza kha ḓi ḓa.
",0.5178285
"vathoriwa va se va nyikiwile nkateko wo vuyeriwa hi swa rihanyu, ku dyondza vutshila byintshwa no hluvukisa lebyi va nga na byona, ni ku tirhisa ntokoto tanihi masungulo ku kuma ntirho lowu landzelaka kumbe vutitirhi.
","vhadzheneli vho ṋewa tshikhala tsha u ḓitshelela, u guda zwikili zwiswa na u khwiṋisa zwine vha vha nazwo, na u shumisa tshenzhemo yavho sa muratho wa u wana muṅwe mushumo kana u ḓisikela mushumo.
",0.59942394
"xikombiso, nhlayo ya vathoriwa lava thoriweke hi ndzawulo ya mitirho ya mfumo na miako eka tiphurogireme ta yona ta xiyenge xo sungula yi swi kotile ku kuma mitirho eka mabindzu lama nga riki ma mfumo hi ku hela ka nyenyankulu 2021. vunyingi byo tala bya ntlawa wo sungula wa vapfuneti eswikolweni, hi ndlela leyi fanaka, va kumile ndlela yo thoriwa, lava haverisiweke hi ntokoto, vuleteri na vuti toloveti.
","sa tsumbo, vhunzhi ha vhadzheneli vho tholwa ho nga muhasho wa mishumo ya tshitshavha na themamveledziso kha mbe kanyamushumo dzawo dza ḽiga ḽa u thoma vho kona u wana mushumo kha sekhithara dza phuraivethe mafheloni a ṱhafamuhwe 2021. vhunzhi ha avho ndi vha mutevhe wa u thoma wa vhathusi tshikoloni, nga u ralo, vho wana nḓila ya u dzhena mishumoni, vha wana tshenzhemo, vhugu disi na ndaedzi.
",0.6749787
"tiphurogireme leti endliweke hi swihanano swa mitirho hi presidente ti tlhele ti vuyerisa miganga hi ku anama.
","mbekanyamushumo dzo thomiwaho nga kha maga a ṱhuṱhuwedzo ya vhusikamishumo na tsireledzo ya mishumo zwa muphureside nnde dzo dovha dza vhuendza vha nga u angaredza.
",0.5052575
"xikongomelo ku vile ku tumbuluxa mitirho eka tisekitara hi xikongomelo xa ximunhu xo khumba eka swo fana ni dyondzo, nhlayiseko wa swakudya, ku lunghisiwa ka switirhisiwa swa mani na mani na nsirhelelo wa mbangu.
","ho vha ho se dzeswa kha tsiko ya mishumo kha sekithara dzine dza kwama tshitshavha u fana na ya pfunzo, tsire ledzo ya zwiḽiwa, ndondolo na themamveledziso ya tshitshavha na tsireledzo ya mupo.
",0.6263225
"hi ku tirhisa swihanano swa mitirho hi presidente vantshwa va thoriwile ku seketela no pfuna vadyondzisi eswikolweni swa hina.
","nga maga a ṱhuṱhuwedzo ya vhusikamishumo na tsireledzo ya muphuresi dennde aya vhaswa vho tholwa u tikedza na u thusa vhadededzi zwikoloni zwashu.
",0.5609108
"van’wana va thori wile ku aka mabuloho eka miganga ya le makaya.
","vhaṅwe vho tholwa u fhaṱa maburoho kha zwitshavha zwa mahayani.
",0.45378655
"tisenthara to tala ta nhluvukiso wa tindzumulo ti pfuniwile ku sisimuka ni ku pfula.
","senthara nnzhi dza mveledziso ya nyaluwo ya vhana ya vhuhanani (ecd)dzo thuswa u bvela phanḓa na u shuma na u vula hafhu.
",0.5546371
"van’wamapurasi lavatsongo va pfuniwile ku engetela vuhumelerisi, na switirhisiwa swa mbangu swo fana na milambo na swimbyarumbyaru swi pfuxetiwile ni ku hlayisiwa.
","vhorabulasi vhaṱuku vho tikedzwa u ṱanḓavhudza mveledzo na ndaka ya mupo u fana na milambo na maro roma zwo vusuludzwa na u londotwa.
",0.63531446
"tanihi xiphemu xa xiyenge xa vumbirhi, hi le ku tumbuluxeni ka nkwama wa rixaka wa vuthori lowu nga ta seketela ntirho wa mbuyelo lowunene lowu rhangeriweke hi mihlangano ya miganga eka tindhawu to hamba nahambana tanihi hi le ka vurimi bya le madorobeni, vutshila bya mani na mani, nhluvukiso wa tindhawu to ka ti nga ri enawini ni nhlayiseko wa vaaki.
","sa tshipiḓa tsha ḽiga ḽa vhuvhili, ri khou thoma tshikwama tsha thikhedzo ya mishumo ya tshitsha vha tshine tsha ḓo tikedza mishumo mivhuya ine ya rangelwa phanḓa nga madzangano a tshitshavha kha masia a fanaho na vhulimi ha dziḓoroboni, vhutsila ha tshitshavha, khwiṋiso ya vhudzulo ha mishashani na tsireledzo ya tshitshavha.
",0.63224494
"exikarhi ka ikhonomi leyi tikeriwaka leswi vangiweke hi ntungu wa vuvabyi bya khoronavhayirasi, mitirho ya mani na mani yi nyikile vuhanano bya nkoka eka ntumbuluxo wa mitirho.
","vhukatini ha vhuleme vhuhulu ha ikonomi ho vhangwaho nga dwadze ḽa tshitzhili tsha corona, mishumo ya tshitshavha yo ṋekedza thikhedzo ya vhuṱhogwa kha tsiko ya mishumo.
",0.56038123
"leswi i nsimeko wa ku tinyiketela ka hina leswaku tiko ri va ni xiave xo seketela mitirho loko timakete ti ri karhi ti pfuxeleleka.
","hezwi ndi u thoma u shuma ha vhuḓikumedzeli hashu ha uri muvhuso u tea u tikedza wo khwaṱha u sikwa ha mishumo musi maraga wa zwa mishumo u khou vusuludzea.
",0.21175069
"hi swihanano swa mitirho hi presidente hi tisile va ntshwa eka xiyimo xa mitirho hi ndlela ya le henhla yo ka yi nga tolovelekanga hi nkarhi wutsongo.
","nga kha maga a ṱhuṱhu wedzo ya vhusika mishumo ya tsireledzo ya mishumo zwa muphuresidennde ro dzhenisa vhaswa kha mutevhe wa vhashumi nga vhunzhi vhukuma nga nḓila i songo lavhelelwaho kha tshifhinga tshipfufhisa.
",0.47827068
"kwalomu ka 84% wa vathoriwa eka xiyenge xo sungula a ku ri vantshwa lava nga ehansi ka 35 wa malembe, naswona mbirhi xa nharhu a va ri vaxisati.
","vhaṅwe vha vhadzhe neli vha 84% kha ḽiga ḽa u thoma vho vha vhe vhaswa vha vhukale ha fhasi ha miṅwaha ya 35, nahone vha mbili tshararu vho vha vhe vhafumakadzi.
",0.5394396
"eka xiyenge xa vumbirhi hi langutela nhlayo leyi ku va ehenhla swinene, tanihiloko swihanano swi ta nyika kwalomu ka r1 biliyoni ku hakelela eka ku tinghenelerisa ka presidente eka mitirho ya vantshwa.
","kha ḽiga ḽa vhuvhili ri lavhelela tshivhalo itshi uri tshi gonye, thikhedzo ya mishumo i ḓo ṋekedza r1 biḽioni ya ndambedzo u itela lambedza thusedzo ya u tholwa ha vhaswa u bva kha ofisi ya muphuresidennde.
",0.5562117
"tanihi xiphemu xo nghenelela, vantshwa votala va ta gangisiwa eka mpfuxeto wa vukorhokeri bya vantshwa bya rixaka.
","sa tshipiḓa tsha thusedzo, hu ḓo tholwa vhaswa vho vhalaho kha tshumelo ya vhaswa ya lushaka yo vusuludzwaho.
",0.5116127
"vantshwava ta kuma ndze telo wa vutshila bya dijitali naswona mabindzu lama fambisiwaka hi vantshwa ma ta kuma nseketelo wa ndlandlamuxo ni vuthori.
","vhaswa vha ḓo wana vhugudisi ha zwikili zwa didzhithala na mabindu o farwaho nga vhaswa a ḓo wana thikhedzo ya u aluwa a thola vhathu.
",0.6279794
"mpfumaleko wa mitirho etikweni ra hina i xiphiqo lexikulu.
","vhushayamushumo kha shango ḽashu ndi thaidzo khulwane vhukuma.
",0.304385
"hi nge swikoti kutiyisela hilaha ku nga heriki ku lulamisa xiphiqo lexi hikwalaho ko landzelela milawu ya byurokiresi, ndlela ya magangiselo lama hundze riweke, mpfumaleko wa vuswikoti ni nkunguhato, kumbe tiphurogireme ta nkarhi wo koma kumbe leti pfumalekaka ntiyisiso.
","ri nga si tsha vha na zwilengisi zwi sa gumi kha u tandulula thaidzo dza mai tele a ndangulo a konḓaho, maitele a u thola a si tsha shumaho, u shaya vhukoni , kana mbekanyamushumo dzi fhelelaho muyani kana dzi sa koni u bvela phanḓa lwa tshifhinga tshilapfu.
",0.62150574
"ku humelela ka swi hanano swa mitirho hi presidente ku kombisile leswaku loko ho tirha kun’we, hi famba hi xihatla, hi ehleketa hi ndlela yo vuyerisa ni ku lawulaswitirhisiwa swa hina hi ndlela leyinene, hi nga tisa ku cinca lokukulu.
","u bvelela ha maga a ṱhuṱhuwedzo ya vhusika mishumo na tsireledzo ya mishumo zwa muphuresi dennde zwo sumbedza uri musi ri tshi shumisana, nga u ṱavhanya, u vha na mihumbulo i bveledzaho vhukoni na u langa zwiko zwashu zwavhuḓi, ri nga swikelela mvelelo dzavhuḓi khulwane vhukuma.
",0.5254182
"swihanano swa mitirho hi presidente swi kombise leswaku hi nga tumbu luxa mitirho loko ho tirha kun’we tanihi mabindzu ya mfumo, ku tirha, miganga na mfumo.
","maga a ṱhuṱhuwedzo ya vhusikamishumo na tsireledzo ya mishumo zwa muphuresidennde o sumbedza uri ri a kona u sika mishumo arali hu na tshumisano sa seki thara ya lushakai, vhashumi, tshitshavha na muvhuso.
",0.63386524
a ndzi ni ku kanakana leswaku xiyenge lexi la ndzelaka xa swihanano swa mitirho hi presidente swi ta hi tshuneta ekusuhi no fikelela swikongomelo swa hina kun’we swa swivandla swa mitirho leyinene ya hinkwavo.,"maga a ṱhuṱhuwedzo ya vhusikamishumo na tsireledzo ya mishumo zwa muphuresidennde a bveledza tsiko ya mishumo vukuzenzele unnamed u rwelwa ṱari ha zwinozwino ha ḽiga ḽa vhuvhili ḽa maga a ṱhuṱhuwedzo ya vhusikamishumo na tsireledzo ya mishumo zwa muphuresidennde hu imela mvelaphanḓa khu lwane kha u lwela hashu u sika zwikhala zwa mishumo u itela vhadzulapo vha afrika tshipembe vha si na mishumo.
",0.63386524
"mangala vukungundzwana hi ku tirhisa nomboro ya riqingho ra xilamulelamhangu ro lwisana na vukungundzwana silusapho nyanda loko u ehleketelela vukungundzwana, vumbabva, vukhamba kumbe ku endliwa ka swo biha eka vukorhokeri bya mfumo, u hlohloteriwa ku swi mangala.
","kha vha vhige zwiito zwa vhuaḓa nga u shumisa nomboro ya luṱingo ya u lwa na zwiito vhuaḓa silusapho nyanda arali vha tshi khou humbulela uri hu nga vha hu na zwiito zwa vhuaḓa, vhufhura, vhuvhava kana zwiḓwe zwiito zwi songo ḓaho zwine zwa khou bvelela kha tshumelo dza muvhuso, vha khou ḓuḓuwedzwa uri vha ye vha vhige zwiito zwenezwo.
",0.6331494
"ku sivela vukungu ndzwana eka vuko rhokeri bya mfumo swa ha ri xirhangana xa mfu mo naswona nomboro ya ri qingho ra xilamulelamhangu ro lwisana na vukungu ndzwana yi olovisela vaaki ku mangala swiendlo swa vuku ngundzwana leswi ehlekete leriwaka.
","""u fhelisa zwiito zwa vhuaḓa muvhusoni zwi kha ḓi vha tshipikwa tshihulwane tsha muvhuso na hone nomboro ya luṱingo ya lushaka ya u lwa na zwiito zwa vhuaḓa i thusa miraḓo ya tshitshavha uri vha kone u vhiga zwiito zwiṅwe na zwiṅwe zwa vhuaḓa zwine zwa khou humbulelwa nga nḓila yo lelu waho.
",0.6681858
"nomboro ya riqingho lera xila mulelamhangu yi simekiwile hi khomixini ya vukorhokeri bya mfumo (psc) hi 2004 naswona kusukela nkarhi wolowo, ku amukeriwile tiqingho to tlula 100 000 to mangala vukungu ndzwana na mafambiselo yo biha.
","nomboro iyi ya luṱingo yo rwelwa ṱari nga vha khomishini ya tshumelo dza muvhuso (psc) nga ṅwaha wa 2004 nahone u tou bva zwenezwo, ho no ṱanganedzwa ṱhingo dzi fhiraho 100 000 dza u vhiga nga ha mavharivhari a zwiito zwa vhuaḓa na tshayandaulo.
",0.6949146
"tiqingho leta valumandleve ti vangile leswaku ku lavi sisiwa 24 035 wa milandzu ya vukungundzwana, vumbabva na vugevenga byin’wana, ku vula khomixinara wa vuko rhokeri bya mfumo michael seloane, loyi a angamelaka ntirho hinkwawo lowu endli waka hi khomixini leyi.
","ṱhingo hedzi dzi bvaho kha tsevhi dzashu, ndi dzone dze dza ita uri hu vhe na milandu i linganaho 24 035 ya zwiito zwa vhuaḓa, vhufhura khathihi na miṅwe yo fhambanaho ine ya khou ṱoḓisiswa zwazwino"", hu ṱalutshedza mukhomishinari wa khomishini ya tshumelo dza muvhuso vho michael seloane vhane vha vha vhone vha lavhe lesaho mushumo woṱhe une wa itwa nga khomishini iyi.
",0.6467359
"exikarhi ka 2020 na 2021 ku mangariwile milandzu ya 337 hi ku tirhisa nomboro ya riqingho lera xilamulela mhangu.
","vhukati ha ṅwaha wa 2020 na 2021, ho vhigwa milandu i linganaho 337 hu tshi shumiswa yeneyo nomboro ya luṱingo.
",0.7275927
"makumenharhun’we ya yona yi khumba mihombo loko eka matholelo na maxavelo ya tinhundzu na vukorhokeri leyi yi nga eku lavisisiweni hi psc.
","milandu ya furaruṱhanu kha yeneyo, ndi ine ya elana na mafhungo a vhuaḓa kha zwa kutholele kwa vhathu na kuren gelwe kwa thundu na tshumelo dza muvhuso ine zwazwino ya khou ṱoḓisiswa nga vha psc.
",0.66815317
"milandzu leyi nga sala yi hundziseriwile eka tindzawulo ta mfumo tin’wana kumbe tie jensi ta nsindziso wa nawu ku ya lavisisiwa.
","miṅwe milandu yo salaho kha yeneyo, yo fhiriselwa kha miṅwe mihasho ya muvhuso kana ma zhendedzi a khombethedzo ya mulayo uri hu itwe ṱhoḓisiso.
",0.5308647
"mihomboloko ya tindlu ta nongonoko wo aka hi vunts hwa na nhluvukiso (rdp), ya tithendara na ya mali ya nhla yiso wa vaaki yi le xikarhi ka swihehlo leswi nga toloveleka swinene leswi endliweke.
","zwiito zwa vhuaḓa kha zwi kwamaho dzinnḓu dza mbeka nyamushumo ya phaṱhululo na mveledziso (rdp), thendara na magavhelo a zwa matshilisano ndi maṅwe a mavharivhari o andesaho e a vhigwa.
",0.6879108
"""hi nkarhi wa ku pfariwa ka tiko, hi amukerile vuluma ndleve byo tala hi imeyili.
","""nga tshifhinga tsha nyiledzo dza u tshimbila, ro sevhiwa lunzhi hu tshi shumiswa imeiḽi.
",0.5450829
"hi tlhela hi va na sisiteme yo rhekhoda swihungwana ya otometiki eka lava tsakelaka ku fonela nomboro ya hina ya riqingho ra xilamulelamhangu endzhaku ka tiawara to tirha,"" ku vula seloane.
","ri dovha hafhu ra vha na sisṱeme ya u rekhoda milaedza nga yone iṋe hu tshi itelwa avho vhane vha tama u founela kha nomboro yashu ya luṱingo nga murahu ha awara dza u shuma"", hu amba vho seloane.
",0.34674957
"u engetela leswaku kusukela loko ku hungutiwile tilevhele ta ku pfariwa ka tiko, ku vile na ku tlakuka lokukulu ka ku mangariwa ka vumbabva lebyi fambelanaka na mali ya nhla yiso wa vaaki, ngopfungopfu mali ya nhlayiso ya mphalalo wa vanhu wa ntshikelelo.
","vho dovha hafhu vha ḓadzisa nga ḽa uri u bva tshe tshiimo tsha nyiledzo tsha tsitselwa fhasi, hu khou vha na u enge dzea nga zwiṱuku ha u vhigwa ha milandu i elanaho na vhufhura ha masheleni a magavhelo a zwa matshilisano, nga maanḓa magavhelo a ṱhaḓulo ya matshi lisano kha thambulo.
",0.62164795
"ku tiyisisa matshalatshala yo sivela vukungundzwana, mfumo wu nyikile vuswikoti eka tiejensi ta nsindziso wa nawu hi vatirhi lava nga na swi kili, na ku tumbuluxa senthara leyi hlanganeriweke.
","u itela u khwaṱhisa ndingedzo dza u fhelisa zwiito zwa vhuaḓa, muvhuso wo khwaṱhisa ma zhendedzi a khombetshedzo ya zwa mulayo nga u thola vhashumi vha re na vhukoni khathihi na u vhumba senthara ya ṱhanganelano.
",0.6485026
"senthara i ntlawahato wa tiejensi ta nsi ndziso wa nawu leti avelanaka vuxokoxoko na swipfuno eka ku lwisana na vumbabva na vukungundzwana eka maxavelo ya tinhundzu na vukorhokeri lebyi fambelanaka na covid.
","ndi zwifhio zwine zwa itea nga murahu ha u sevhiwa?
",0.6049365
"xana ku humelela yini endzhakukaloko vulu mandleve byi endliwile?
",".
",0.19488624
"seloane u vula leswaku loko nandzu wu mangariwa hi ku tirhisa nomboro ya riqingho lera xilamulelamhangu, vatirhi vo sungula vo tisa switshunxo va kamba loko vuxokoxoko hinkwabyo lebyi faneleke byi nyikiwile.
","vho seloane vha ri musi mulandu wo vhigwa hu tshi shumiswa nomboro ya luṱingo ya u vhiga mafhungo, vhaofisiri vha zwa thandululo ya milandu nga tshihaḓu vha a lavhelesa u vhona arali ho ṋetshedzwa zwidodombedzwa zwoṱhe zwo teaho.
",0.5654428
"leswi swi katsa vuxokoxoko bya leswaku i mani a nga endla yini, xiendlo lexi hehliwaka xi endliwile rini, naswona hikwalahoka yini.
","hezwi zwi katela zwido dombedzwa zwi fanaho na uri ndi nnyi o itaho mini, zwiito izwo zwo itea lini nahone ndi ngani zwo itea.
",0.4703544
"u vula leswaku loko ku kumeka leswaku ku na swo biha leswi nga endliwa – ku nga va ku ri mihomboloko ya maxavelo ya tinhundzu na vukorhokeri na matholelo, ku ba mati, vukungundzwa na lebyi fambelanaka na tindlu ta rdp, vumbabva bya mali ya nhlayiso wa vaaki, ku rhurha swi nga ri enawini, ku ba, vukhamba kumbe vumbabva – psc yi nga bumabumela xiendlo xo lulamisa eka ndzawulo leyi faneleke kumbe ku hundzi sela nandzu lowu eka hawks, saps kumbe xipano xa xintirhwana xo lwisana na vukungundzwana ku lavisisa ku ya emahlweni.
","vho amba uri arali hu tshi nga wanala ho vha na vhu khakhi – hu nga vha vhuaḓa ha zwa u renga tshumelo na thundu na u tholiwa ha vhathu, tshanḓanguvhoni, vhuaḓa vhu elanaho na zwa dzinnḓu dza rdp, vhufhura ha masheleni a magavhelo a zwa matshilisano, mupfuluwo u siho mulayoni, u rwa, vhuvhava kana vhufhura – vha psc vha nga theme ndela vhukando ha vhululamisi kha muhasho wo teaho kana vha fhirisela mulandu uyo kha vha dzihawks, saps kana vha tshigwada tshi lwaho na zwiito zwa vhuaḓa uri vha ite dziṅwe ṱhoḓisiso.
",0.7197577
"milandzu leyi psc yi yi hundziselaka eka tindzawulo ku ya lavisisiwa, yi katsa: vatirhelamfumo lava endlaka ntirho wo engetela handle ka mpfumelelo wa ti ndzawulo mitlimbo ya mitsakelo leyi nga paluxiwangiki, na matikhomelo yo biha.
","milandu ine vha psc vha i fhirisela phanḓa kha mihasho uri hu itwe dziṅwe ṱhoḓisiso ndi ine ya katela: vhashumi vha muvhuso vhane vha ita miṅwe mi shumo ya nga thungo vha tshi itela u wana malamba ngeno vha songo ranga u wana thendelo u bva kha mihasho.
",0.6114542
"seloane u vula leswaku psc yi nyika tindzawulo ta mfumo masiku ya 60 ku lavisisa na ku pfala nandzu.
","u sa bvisela khagala khuḓano ine ya nga vha hone vhukati ha mus humo na madzangalelo avho.
",0.52841043
"u vula leswaku endzhakukaswona ndzawulo yi tivisa psc leswi yi nga swi kuma.
","vhuḓifari vhu songo ḓaho.
",0.33303976
"""loko hi tsakisiwa hi magoza lama tekiweke hi ndzawulo, hi ta pfala nandzu lowu, kambe loko ma nga hi tsakisi hi tlhelela eka ndzawulo.""
","vho seloane vha ri psc i ṋea mihasho ya muvhuso maḓuvha a 60 u ita ṱhoḓisiso na u vala milandu iyo.
",0.49212813
"vuxikalavito bya tiyi sisiwaloko mulumandleve a nga lavi leswaku vito ra yena ri boxiwa, muofisiri wa nomboro ya riqingho lera xilamulelamhangu wa psc u tsala vuxokoxoko bya yena byo tihlanganisa.
","vho dovha hafhu vha amba uri u bva afho muhasho u tea u ḓivhadza vha psc nga ha mawanwa awo.
",0.6489024
"leswi swi na nkoka hikuva loko ku laveka vuxokoxoko byo enge tela, psc yi boheka ku kota ku tihlanganisa na yena.
","""arali ri tshi pfa ro fushea nga ha vhukando ho dzhiiwaho nga muhasho, ri ḓo vala mulandu uyo, fhedzi arali ri songo fushea, ri ḓo dovha hafhu ra u humisela murahu khavho.
",0.5222685
"valumandleve lava va mangalaka milandzu eka nomboro ya riqingho lera xilamulelamhangu ya psc va tshembisiwa ku sirheleriwa loko va lava ku tshama va ri xikalavito, ku vula seloane.
","""u sa bulwa ha zwidodombedzwa zwavho ho khwathisedzwaarali muthu wa tsevhi a sa ṱoḓi dzina ḽawe ḽi tshi bulwa, muofi siri wa nomboro ya luṱingo lwa u vhiga mafhungo wa psc u ḓo ṅwala fhedzi zwidodombe dzwa zwavho zwa vhukwa mani.
",0.683115
"u hlamusela leswaku vatirhi vo sungula vo tisa switshunxo va leteriwile ku tiyisisa leswaku vutitivisi bya valumandleve byi tshama byi sirheleriwile.
","hezwi ndi zwa ndeme u itela uri arali hu tshi nga vha na vhuṅwe vhuṱanzi vhune ha nga ṱoḓea, vha psc vha kone u vha kwama.
",0.54329646
"seloane u vula leswaku vanhu va afrikadzonga va boheka ku mangala vuku ngundzwana hikuva byi yivela swisiwana naswona byi yimisa nhluvukiso, leswi swi sivelaka tiko ku humelela ku ya emahlweni.","kha vha vhige zwiito zwa vhuaḓa nga u shumisa nomboro ya luṱingo ya u lwa na zwiito vhuaḓa silusapho nyanda arali vha tshi khou humbulela uri hu nga vha hu na zwiito zwa vhuaḓa, vhufhura, vhuvhava kana zwiḓwe zwiito zwi songo ḓaho zwine zwa khou bvelela kha tshumelo dza muvhuso, vha khou ḓuḓuwedzwa uri vha ye vha vhige zwiito zwenezwo.
",0.54329646
"ku nghenisa swivilelo swa gepf swi olovisiwa vukuzenzele unnamed swirho, vanhu lava nga ephenxenini na vavuyeriwa va nkwama wa phenxeni ya vatirhelamfumo (gepf) sweswi va na endlelo ro kuma ku pfuneka loko va nga tsakisiwi hi vukorho keri lebyi va byi kumeke.
","u swikisa mbilahelo kha gepf zwazwino zwo no leluwa vukuzenzele unnamed miraḓo, vhano thi khathihi na vhathu vhane vha wana mbuelo u bva kha tshikwama tsha phe ntsheni tsha vhashumeli vha muvhuso (gepf) zwa zwino hu na hune vha nga wana hone thuso arali vha sa khou fushea nga tshu melo ine vha khou i wana.
",0.67853844
"ku tiyisisa leswaku swirho swa gepf na mindyangu ya swona swi khomiwa kahle, bodo ya ha ku tumbuluxa hofisi leyi nga ta tirhana na mikwetlembetano.
","u itela u vhona uri miraḓo ya gepf na vha miṱa yavho vha khou farwa zwavhuḓi, bodo yo ḓo vula ofisi ine ya ḓo sedzana na mbilahelo.
",0.6430559
"mulavi sisi wa swivilelo wa phenxeni ya vatirhelamfumo (depo) i hofisi ya gepf ya le ndzeni kambe leyi tiyimeleke.
","mulamukanyi wa phentsheni dza vhashu meli vha muvhuso (gepo) ndi ofisi ya nga ngomu fhedzi yo ḓiimisaho nga yoṱhe ya gepf.
",0.64867157
